911,t**1,口味: 【14粽7味4蛋1600克】福享B粽子礼盒,好评,价格实惠，味道不错,-,-,2021-06-18
912,1**铃,口味: 【14粽7味4蛋1600克】福享B粽子礼盒,好评,买来送人的 包装不错 好评 ,-,-,2021-06-18
913,淘**女,口味: 【10粽4蛋1280g】祥礼五芳粽子礼盒,好评,过完节以后更便宜了,-,-,2021-06-17
914,不**透,口味: 【14粽7味1400g】福享五芳粽子礼盒,好评,送人的好看 ,-,-,2021-06-16
915,z**d,口味: 【14粽7味4蛋1600克】福享B粽子礼盒,好评,宝贝非常好，一次满意的购物体验。,-,-,2021-06-20
916,g**d,口味: 【14粽7味1400g】福享五芳粽子礼盒,好评,味道非常好，质量没话说的，包装很好，快递非常快。,-,-,2021-06-15
917,a**2,口味: 【14粽7味1400g】福享A粽子礼盒,好评,非常好，每年端午节都买五芳斋粽子，这段时间忙的忘记收货好评了，补上,-,-,2021-06-17
918,鸿**来,口味: 【16粽8荤8素1600克】浓情T83粽子礼盒,好评,不愧是淘宝百年老字号旗舰店独家首发,-,-,2021-06-17
919,秋**5,口味: 【14粽7味1400g】福享A粽子礼盒,好评,很大一个礼盒，7种口味，每种2个，价格不贵，送人大牌子也能拿出手去。礼盒封着口，没有办法看有没有胀气，但是相信五芳斋的品质 ,-,-,2021-06-10
920,吴**7,口味: 【11粽6味1100克】花样五芳礼盒,好评,送人的 很多人都说这个牌子好吃 也有说不好吃的 但是它总体是比较划算的 性价比高！送人也不错，还是满意的！去年也买过，但是寄来礼盒有点破损，建议快递方面在上心一点，毕竟好多人都是买礼盒送人，其他还是挺满意的！ ,-,-,2021-06-12
921,陌**i,口味: 【3盒领券更优惠】10粽4蛋4绿豆糕1380克福雅礼盒,好评,给家里人买的，也没图片，也不知道好不好吃，到时候追评！ ,-,-,2021-06-15
922,名**玥,口味: 【16粽8荤8素1600克】浓情T83粽子礼盒,好评,还不错，实惠,-,-,2021-06-15
923,m**a,口味: 【3盒领券更优惠】11粽6味1100克花样礼盒,好评,还是老味道，喜爱一如既往,-,-,2021-06-15
924,a**6,口味: 【10粽4蛋1280g】祥礼五芳粽子礼盒,好评,物美价廉，很OK，比实体店优惠太多了 ,-,-,2021-06-20
925,w**3,口味: 【10粽4蛋4绿豆糕1380克】祥礼T4粽子礼盒,好评,绿豆糕好吃还不错，包装挺好的 ,-,-,2021-06-17
926,k**r,口味: 【14粽7味1400g】福享五芳粽子礼盒,好评,质量好，发货快，下次继续,-,-,2021-06-26
927,小**8,口味: 【16粽8荤8素1600克】浓情T83粽子礼盒,好评,买少了，一个都没吃到，都送礼了,-,-,2021-06-23
928,陈**朴,口味: 【14粽7味1400g】福享五芳粽子礼盒,好评,物流速度挺快的，喜欢 口感味道：喜欢吃五芳斋的粽子，一直喜欢 ,-,-,2021-06-18
929,j**1,口味: 【11粽6味1100克】花样五芳礼盒,好评,速度很快，东西很好,-,-,2021-06-21
930,g**g,口味: 【14粽7味1400g】福享A粽子礼盒,好评,送人的，真是没办法，不得不买 ,-,-,2021-06-23
931,橘**果,口味: 【10粽4蛋1200克】锦绣粽子礼盒,好评,送妈妈 妈妈很高兴,-,-,2021-06-20
932,我**o,口味: 【3盒领券更优惠】12粽4蛋1440克祥礼T780送礼盒,好评,卖家态度很热情，物流和给力，宝贝到了以后包装完好无损。完美的购物体验。,-,-,2021-06-15
933,q**5,口味: 【10粽4蛋4绿豆糕1380克】祥礼T4粽子礼盒,好评,味道不错的，买两年了，但快递如果不改进应该是不会来了,-,-,2021-06-25
934,t**5,口味: 【3盒领券更优惠】祥礼T865送礼盒10粽4蛋1240克,好评,包装高大上 ,-,-,2021-06-25
935,g**1,口味: 【3盒领券更优惠】10粽6味1120克浓情T32礼盒,好评,不错 口感味道：不错 ,-,-,2021-06-16
936,如**儿,口味: 【3盒领券更优惠】10粽4蛋4绿豆糕1380克祥礼T4礼盒,好评,发货快速 及时  整体评价：好 新鲜度：好 ,-,-,2021-06-14
937,h**g,口味: 【14粽7味1400g】福享五芳粽子礼盒,好评,送人自己吃都可以，性价比挺高的，包装也不错，日期都很新，口味比较多，可以尝新，真空包装也不用担心很快会坏掉  ,-,-,2021-06-09
938,瑞**颖,口味: 【6荤6素1200克】浓情T82粽子礼盒,好评,买给我**，最不满意的就是买完就降价，之前买一盒能买两盒了，要不是送礼果断退货了 ,-,-,2021-06-22
939,j**i,口味: 【14粽7味1400g】福享A粽子礼盒,好评,包装精美大气，公司人都说好吃,-,-,2021-06-10
940,t**6,口味: 【6荤6素1200克】浓情T82粽子礼盒,好评,室友说很好吃，我很想她们嘤嘤嘤,-,-,2021-06-20
941,蛋**单,口味: 【11粽6味1100克】花样五芳礼盒,好评,很好吃，颜值高，送人妙,-,-,2021-06-15
942,六**2,口味: 【14粽7味1400g】福享五芳粽子礼盒,好评,送人的挺不错，礼盒装，好评,-,-,2021-06-16
943,t**3,口味: 【10粽4蛋4绿豆糕1380克】祥礼T4粽子礼盒,好评,我也不知道怎么样～直接寄到老家吧～人也没回去 ,-,-,2021-06-23
944,兔**5,口味: 【10粽4蛋1200克】锦绣粽子礼盒,好评,送礼合适。,-,-,2021-06-15
945,阴**眼,口味: 【11粽6味1100克】花样五芳礼盒,好评,口感味道：好吃 ,-,-,2021-06-17
946,卫**晗,口味: 【14粽7味1400g】福享五芳粽子礼盒,好评,很好吃，比较划算,-,-,2021-06-16
947,小**3,口味: 【14粽7味4蛋1600克】福享B粽子礼盒,好评,这是买的第二份很好哦，跟换算,-,-,2021-06-15
948,t**2,口味: 【10粽4蛋4绿豆糕1380克】祥礼T4粽子礼盒,好评,给女朋友家买的粽子 还不错,-,-,2021-06-21
949,d**8,口味: 【3盒领券更优惠】16粽8荤8素1600克浓情T83礼盒,好评,正品，买的放心，价钱也不贵,-,-,2021-06-18
950,t**7,口味: 【14粽7味1400g】福享五芳粽子礼盒,好评,很好，我们家一直吃五芳斋肉粽。物流很快。因为在异地没有图片。,-,-,2021-06-18
951,t**0,口味: 【14粽7味1400g】福享A粽子礼盒,好评,粽子收到了，味道可以，第一次吃肉粽，挺好吃的。 ,-,-,2021-06-13
952,紧**念,口味: 【14粽7味4蛋1600克】福享B粽子礼盒,好评,很好吃，送人也有面子,-,-,2021-06-16
953,l**3,口味: 【14粽7味1400g】福享五芳粽子礼盒,好评,送人还行 ,-,-,2021-06-15
954,o**8,口味: 【16粽8荤8素1600克】浓情T83粽子礼盒,好评,不按时发货，味道也一般般。,-,-,2021-06-24
955,赌**浅,口味: 【14粽7味1400g】福享A粽子礼盒,好评,花花很新鲜 真的很棒哟,-,-,2021-06-10
956,x**y,口味: 【3盒领券更优惠】10粽4蛋4绿豆糕1380克祥礼T4礼盒,好评,妈妈说味道很好 ,-,-,2021-06-17
957,y**6,口味: 【拍1盒发2盒】甄享礼盒9粽4蛋1300克*2盒,好评,棒，分装到小盒子里面了 ,-,-,2021-06-13
958,f**r,口味: 【11粽6味1100克】花样五芳礼盒,好评,送家人的，整体还不错 ,-,-,2021-06-23
959,t**1,口味: 【14粽7味4蛋1600克】福享B粽子礼盒,好评,总体还不错，下次还来。 ,-,-,2021-06-16
960,我**士,口味: 【10粽4蛋4绿豆糕1380克】祥礼T4粽子礼盒,好评,没有照片，买了五盒给亲戚 亲戚一张照片都没发😂不过物流速度杠杠的，头天下单，第二天就到了，nice！,-,-,2021-06-19
961,优**量,口味: 【10粽4蛋1200克】锦绣粽子礼盒,好评,感觉还不错，买来送人的 ,-,-,2021-06-18
962,阳**年,口味: 【3盒领券更优惠】10粽6味1160克心悦礼盒,好评,买来送人的 应该还不错,-,-,2021-06-19
963,优**量,口味: 【10粽4蛋1200克】锦绣粽子礼盒,好评,感觉还不错，买来送人的  ,-,-,2021-06-18
964,l**w,口味: 【3盒领券更优惠】10粽4蛋4绿豆糕1380克祥礼T4礼盒,好评,送人的，对方还挺满意。 ,-,-,2021-06-19
965,v**e,口味: 【14粽7味1400g】福享A粽子礼盒,好评,很好吃，家里人很喜欢，以后也会经常光顾的哈哈哈哈哈 ,-,-,2021-06-17
966,v**e,口味: 【10粽4蛋1280g】祥礼T3粽子礼盒,好评,很好吃，家里人很喜欢，以后也会经常光顾的哈哈哈哈哈  ,-,-,2021-06-17
967,t**9,口味: 【3盒领券更优惠】14粽4蛋1640克浓情T831送礼盒,好评,说的是蛋黄的，只是肉粽没有蛋黄,-,-,2021-06-25
968,z**3,口味: 【3盒领券更优惠】14粽7味4蛋1600克福享B礼盒,好评,老妈说挺好吃的 她喜欢就好,-,-,2021-06-16
969,t**3,口味: 【11粽6味1100克】花样五芳礼盒,好评,好吃不贵，美味值得购买 ,-,-,2021-06-23
970,张**8,口味: 【10粽4蛋4绿豆糕1380克】祥礼T4粽子礼盒,好评,不错，挺好吃，值得购买 ,-,-,2021-06-22
971,豆**5,口味: 【11粽6味1100克】花样五芳礼盒,好评,挺好的，据说很好吃 ,-,-,2021-06-23
972,m**堂,口味: 【14粽7味1400g】福享A粽子礼盒,好评,包装不错，挺好的,-,-,2021-06-22
973,t**2,口味: 【3盒领券更优惠】10粽4蛋4绿豆糕1380克祥礼T4礼盒,好评,宝贝已经收到了，很不错，物流也是超快的。味道也好 ,-,-,2021-06-21
974,等**你,口味: 【3盒领券更优惠】16粽8荤8素1600克浓情T83礼盒,好评,整体评价：不咋滴 胀包问题：不咋滴 包装品质：不咋滴 口感味道：不咋滴 新鲜度：不咋滴 总结一下，不好吃，还贵 ,-,-,2021-06-20
975,t**2,口味: 【14粽7味1400g】福享五芳粽子礼盒,好评,李嘉琪推荐的。味道不错👍,-,-,2021-06-21
976,t**6,口味: 【14粽7味1400g】福享A粽子礼盒,好评,味道不错，肉素都挺好吃,-,-,2021-06-15
977,茶**e,口味: 【6荤6素1200克】浓情T82粽子礼盒,好评,每年端午都要买五芳斋粽子，寄给妈**。以前就爱吃五芳斋肉粽，粽子首选。 ,-,-,2021-06-22
978,w**7,口味: 【11粽6味1100克】花样五芳礼盒,好评,跟早二年比，相差太远了！还没有本地粽好吃,-,-,2021-06-24
979,l**荣,口味: 【14粽7味1400g】福享A粽子礼盒,好评,寄给父母的。老字号信得过。,-,-,2021-06-15
980,t**7,口味: 【14粽7味1400g】福享A粽子礼盒,好评,给老妈买的，老妈说很好吃很满意,-,-,2021-06-18
981,哔**嘀,口味: 14粽4蛋1640克浓情T831送礼盒,好评,看起来还行,-,-,2021-06-20
982,畅**音,口味: 【3盒领券更优惠】10粽4蛋4绿豆糕1380克祥礼T4礼盒,好评,粽子收到啦，买给父母的，物流很快，刚好端午节那天到，满意,-,-,2021-06-16
983,y**0,口味: 【16粽8荤8素1600克】浓情T83粽子礼盒,好评,就两个口味，不是很满意 ,-,-,2021-06-23
984,芹**店,口味: 【11粽6味1100克】花样五芳礼盒,好评,为了多吃个五芳斋的粽子，特意又买了礼品装~大品牌值得信赖~ ,-,-,2021-06-12
985,雅**嫣,口味: 【10粽4蛋4绿豆糕1380克】祥礼T4粽子礼盒,好评,买给家里公公婆婆的。老人很满意。 ,-,-,2021-06-18
986,l**6,口味: 【14粽7味4蛋1600克】福享B粽子礼盒,好评,味道还不错，性价比高，家人挺喜欢吃的,-,-,2021-06-21
987,l**5,口味: 14粽6味1520克祥礼T738礼盒,好评,一直吃五芳斋的，味道不错,-,-,2021-06-19
988,l**9,口味: 【11粽6味1100克】花样五芳礼盒,好评,到货速度很快，送人了 ,-,-,2021-06-17
989,小**3,口味: 【16粽8荤8素1600克】浓情T83粽子礼盒,好评,卖家太不负责人了，买了粽子根本就不管你了。端午节之前买的粽子到6月20号还没有收到。联系客服退款说好给退的结果也没退。只要你买了粽子根本就不管你了,-,-,2021-06-22
990,h**6,口味: 【11粽6味1100克】花样五芳礼盒,好评,非常好，送给长辈的，好看也好吃,-,-,2021-06-11
991,w**j,口味: 【6荤6素1200克】浓情T82粽子礼盒,好评,口感味道：赞 ,-,-,2021-06-16
992,t**0,口味: 【3盒领券更优惠】10粽6味1160克心悦礼盒,好评,买给男朋友的 他说很好吃,-,-,2021-06-16
993,d**7,口味: 【14粽7味1400g】福享A粽子礼盒,好评,我拿回家直接拆开吃了一口，味道可以 ,-,-,2021-06-12
994,芳**6,口味: 14粽4蛋1640克浓情T831送礼盒,好评,多次购买，孩子喜欢吃,-,-,2021-06-18
995,t**9,口味: 【11粽6味1100克】花样五芳礼盒,好评,刚买两箱粽子就降价好几十，卖家态度挺好，把钱补给我了 ,-,-,2021-06-15
996,h**1,口味: 【3盒领券更优惠】14粽7味4蛋1600克福享B礼盒,好评,送客户的，不知道味道怎么样 ,-,-,2021-06-25
997,蝶**1,口味: 【14粽7味1400g】福享五芳粽子礼盒,好评,全送人了，一个没吃上,-,-,2021-06-23
998,t**8,口味: 【14粽7味1400g】福享A粽子礼盒,好评,寄给老师的，听说不错，我们老板也是买的这个给我们吃，超级好吃 ,-,-,2021-06-16
999,x**1,口味: 【14粽7味1400g】福享五芳粽子礼盒,好评,平时也爱吃粽子，买了好多，五芳斋的粽子没话说 ,-,-,2021-06-20
1000,a**0,口味: 【14粽7味4蛋1600克】福享B粽子礼盒,好评,五芳斋大品牌值得信赖，粽子很好吃,-,-,2021-06-24
1001,文**妍,口味: 14粽7味1400克福享A礼盒,好评,一直很喜欢吃，这次活动必须来一箱呀！,-,-,2021-06-19
1002,p**飞,口味: 【10粽4蛋1280g】祥礼T3粽子礼盒,好评,送人感觉不太大气,-,-,2021-06-23
1003,张**兵,口味: 【14粽7味4蛋1600克】福享B粽子礼盒,好评,质量很好！各种口味的粽子很好吃！！！,-,-,2021-06-17
1004,t**8,口味: 【3盒领券更优惠】10粽6味1160克心悦礼盒,好评,不知道好不好吃，没有问偷走的那个人，虽然没吃到，但是快递员态度也不错，还是给个好评吧！ ,-,-,2021-06-25
1005,g**d,口味: 【14粽7味1400g】福享五芳粽子礼盒,好评,味道非常好！质量很好！家里人很喜欢，快递非常快。,-,-,2021-06-15
1006,t**9,口味: 【10粽4蛋1280g】祥礼T3粽子礼盒,好评,宝贝非常满意，日期很新鲜，老板还送了礼物 ,-,-,2021-06-10
1007,程**简,口味: 【3盒领券更优惠】11粽6味1100克花样礼盒,好评,还不错，我不喜欢吃甜粽所以觉得肉粽还是好吃,-,-,2021-06-17
1008,开**花,口味: 【14粽7味4蛋1600克】福享B粽子礼盒,好评,每年都买五芳斋，有五芳斋才叫过节呢！好吃没的说 ,-,-,2021-06-15
1009,令**夫,口味: 【6荤6素1200克】浓情T82粽子礼盒,好评,老品牌口味一如既往的好,-,-,2021-06-17
1010,x**1,口味: 【10粽4蛋1280g】祥礼五芳粽子礼盒,好评,第一次上网买，也是最后一次，不怎么好吃,-,-,2021-06-23
1011,t**2,口味: 【3盒领券更优惠】10粽6味1160克心悦礼盒,好评,端午给家里买的礼盒,-,-,2021-06-21
1012,白**4,口味: 【14粽7味1400g】福享A粽子礼盒,好评,礼袋缺一个红丝带,-,-,2021-06-16
1013,宇**淘,口味: 【14粽7味1400g】福享A粽子礼盒,好评,五芳斋不愧是大品牌，礼盒很高端 ,-,-,2021-06-11
1014,d**j,口味: 【11粽6味1100克】花样五芳礼盒,好评,过节送长辈的，没拍照 ,-,-,2021-06-18
1015,r**0,口味: 【14粽7味4蛋1600克】福享B粽子礼盒,好评,过节前几天买的，还挺贵，节后过几天一看掉价厉害 ,-,-,2021-06-17
1016,t**2,口味: 【3盒领券更优惠】11粽6味1100克花样礼盒,好评,粽子不错，礼盒包装也不错,-,-,2021-06-21
1017,i**g,口味: 【14粽7味1400g】福享五芳粽子礼盒,好评,味道还行,-,-,2021-06-15
1018,美**6,口味: 【3盒领券更优惠】10粽4蛋4绿豆糕1380克祥礼T4礼盒,好评,快递比我预期的要快了，粽子也很好吃，包装都很好 ,-,-,2021-06-19
1019,b**惰,口味: 14粽4蛋1640克浓情T831送礼盒,好评,好吃，现在买价格也挺划算的， ,-,-,2021-06-20
1020,既**匆,口味: 【14粽7味1400g】福享A粽子礼盒,好评,还不错，女朋友说好吃,-,-,2021-06-19
1021,t**8,口味: 【14粽7味4蛋1600克】福享B粽子礼盒,好评,女朋友挺喜欢肉馅的，哈哈哈 ,-,-,2021-06-21
1022,2**d,口味: 【14粽7味1400g】福享A粽子礼盒,好评,粽子好吃，父母很喜欢,-,-,2021-06-18
1023,0**0,口味: 【14粽7味4蛋1600克】福享B粽子礼盒,好评,买了两盒的粽子，味道不错。 ,-,-,2021-06-18
1024,开**2,口味: 【10粽4蛋1280克】祥礼T3粽子礼盒,好评,整体评价：可以 ,-,-,2021-06-16
1025,小**8,口味: 【6荤6素1200克】浓情T82粽子礼盒,好评,挺好的，价格适中，质量看着不错,-,-,2021-06-15
1026,麽**鱼,口味: 【16粽8荤8素1600克】浓情T83粽子礼盒,好评,买了送家人的，味道不错的。 ,-,-,2021-06-16
1027,0**光,口味: 【3盒领券更优惠】14粽7味4蛋1600克福享B礼盒,好评,送给老师的，应该还不错吧。 ,-,-,2021-06-15
1028,l**u,口味: 【14粽7味1400g】福享A粽子礼盒,好评,买给爸妈吃的，应该还好吧,-,-,2021-06-16
1029,c**5,口味: 【10粽4蛋4绿豆糕1380克】祥礼T4粽子礼盒,好评,整体评价：还可以吧 ,-,-,2021-06-17
1030,嘬**x,口味: 【14粽7味1400g】福享A粽子礼盒,好评,很好，量也足,-,-,2021-06-22
1031,马**3,口味: 【10粽4蛋1280g】祥礼T3粽子礼盒,好评,好好吃，而且便宜，快递也给力，好评好评 ,-,-,2021-06-15
1032,水**5,口味: 【11粽6味1100克】花样五芳礼盒,好评,很好呀很实惠好吃下次还买你家的粽子,-,-,2021-06-15
1033,t**6,口味: 14粽6味1520克祥礼T738礼盒,好评,味道不错，下次还买！ ,-,-,2021-06-19
1034,j**8,口味: 14粽4蛋1640克浓情T831送礼盒,好评,包装不错，粽子不是很大，味道还没有吃 ,-,-,2021-06-23
1035,美**r,口味: 【3盒领券更优惠】14粽6味1520克祥礼T738礼盒,好评,给家人买的 味道不错 ,-,-,2021-06-18
1036,小**点,口味: 【6荤6素1200克】浓情T82粽子礼盒,好评,家人说味道还不错,-,-,2021-06-18
1037,橙**y,口味: 【3盒领券更优惠】10粽6味1160克心悦礼盒,好评,给朋友买的，他说很好吃 ,-,-,2021-06-20
1038,曹**2,口味: 【3盒领券更优惠】16粽8荤8素1600克浓情T83礼盒,好评,父母很喜欢。明年还来。,-,-,2021-06-18
1039,o**y,口味: 【16粽8荤8素1600克】浓情T83粽子礼盒,好评,给老爸买的，他说很好吃。 ,-,-,2021-06-16
1040,有**0,口味: 【3盒领券更优惠】11粽6味1100克花样礼盒,好评,整体评价：还可以 ,-,-,2021-06-19
1041,漆**琪,口味: 【14粽7味1400g】福享A粽子礼盒,好评,还不错，送礼蛮好的 ,-,-,2021-06-17
1042,y**7,口味: 【14粽7味1400g】福享A粽子礼盒,好评,还可以，送人的不错！ ,-,-,2021-06-24
1043,一**y,口味: 【11粽6味1100克】花样五芳礼盒,好评,整体评价：很好吃 ,-,-,2021-06-15
1044,目**g,口味: 【3盒领券更优惠】14粽4蛋1640克浓情T831送礼盒,好评,挺好第二次买送婆婆。 ,-,-,2021-06-15
1045,似**梦,口味: 【11粽6味1100克】花样五芳礼盒,好评,买来送人的，还可以吧。 ,-,-,2021-06-23
1046,t**1,口味: 【16粽8荤8素1600克】浓情T83粽子礼盒,好评,正宗品质，味道不错的事,-,-,2021-06-15
1047,c**1,口味: 【14粽7味1400g】福享A粽子礼盒,好评,东西收到了，没有破损，物流很快，包装完好，还没有吃呢  ,-,-,2021-06-20
1048,雪**7,口味: 【10粽4蛋1280g】祥礼五芳粽子礼盒,好评,送人的 说是很好吃哦,-,-,2021-06-16
1049,t**9,口味: 【11粽6味1100克】花样五芳礼盒,好评,买来送礼的，很大气,-,-,2021-06-18
1050,顶**人,口味: 【6荤6素1200克】浓情T82粽子礼盒,好评,味道不错，可以呦,-,-,2021-06-16
1051,袁**7,口味: 【11粽6味1100克】花样五芳礼盒,好评,可以，发货速度快，包装完好 最重要的是粽子好吃 ,-,-,2021-06-19
1052,豫**瑾,口味: 【3盒领券更优惠】11粽6味1100克花样礼盒,好评,送人的，对方满意。 ,-,-,2021-06-15
1053,d**5,口味: 【11粽6味1100克】花样五芳礼盒,好评,送人了，不知道如何了 ,-,-,2021-06-24
1054,娟**儿,口味: 【14粽7味1400g】福享A粽子礼盒,好评,味道还不错～好吃😋,-,-,2021-06-19
1055,t**3,口味: 【14粽7味1400g】福享五芳粽子礼盒,好评,这个颜色很喜欢，摸起来质感不错，百搭～包装也很大气，用来送人的话也是不错的选择,-,-,2021-06-23
1056,h**6,口味: 【3盒领券更优惠】14粽7味4蛋1600克福享B礼盒,好评,味道很好，不愧是老字号，值得推荐,-,-,2021-06-18
1057,透**雨,口味: 【3盒领券更优惠】10粽4蛋1280克祥礼T3礼盒,好评,味道挺好的，还会回购的。,-,-,2021-06-18
1058,杨**琪,口味: 【14粽7味1400g】福享五芳粽子礼盒,好评,不好吃，小孩都不愿意吃,-,-,2021-06-23
1059,紫**影,口味: 【14粽7味1400g】福享A粽子礼盒,好评,俺是山东的，还是老实吃甜粽子吧，肉的根本吃不了 ,-,-,2021-06-23
1060,t**i,口味: 【3盒领券更优惠】11粽6味1100克花样礼盒,好评,品牌做起来，都是代加工,-,-,2021-06-16
1061,d**l,口味: 【11粽6味1100克】花样五芳礼盒,好评,好吃，喜欢 ,-,-,2021-06-24
1062,s**6,口味: 【3盒领券更优惠】12粽4蛋1440克祥礼T780送礼盒,好评,速度非常快，前一天买到老家奶奶吃的，第二天居然到了，好评,-,-,2021-06-15
1063,静**7,口味: 【14粽7味1400g】福享A粽子礼盒,好评,很好吃。丈母娘很喜欢,-,-,2021-06-16
1064,走**1,口味: 【3盒领券更优惠】14粽7味4蛋1600克福享B礼盒,好评,买给亲戚的，应该还行吧,-,-,2021-06-16
1065,温**0,口味: 【11粽6味1100克】花样五芳礼盒,好评,买来过端午，妈妈说挺好吃的，物流也很给力,-,-,2021-06-15
1066,大**e,口味: 【14粽7味1400g】福享A粽子礼盒,好评,老字号品牌，发货快，物流给力，粽子，腌蛋和绿豆糕都很好吃。,-,-,2021-06-15
1067,情**愿,口味: 12粽4蛋1440克祥礼T780送礼盒,好评,真好，满满一箱子,-,-,2021-06-19
1068,t**9,口味: 【14粽7味1400g】福享五芳粽子礼盒,好评,不错礼盒很好！ ,-,-,2021-06-17
1069,i**5,口味: 【10粽4蛋1280g】祥礼五芳粽子礼盒,好评,挺好的，礼盒装，用来送礼 ,-,-,2021-06-18
1070,y**2,口味: 【3盒领券更优惠】14粽7味1400克福享A礼盒,好评,五芳斋的产品非常好。明年还会再来买。 ,-,-,2021-06-15
1071,m**h,口味: 【3盒领券更优惠】16粽8荤8素1600克浓情T83礼盒,好评,好吃味美,-,-,2021-06-17
1072,c**6,口味: 【3盒领券更优惠】14粽7味1400克福享A礼盒,好评,买给父母的，希望好吃,-,-,2021-06-17
1073,h**0,口味: 【3盒领券更优惠】10粽4蛋1200克锦绣礼盒,好评,可以 挺好的 味道挺好,-,-,2021-06-17
1074,t**3,口味: 14粽6味1520克祥礼T738礼盒,好评,我只喜欢吃肉粽，要是有全肉粽的就好了 ,-,-,2021-06-23
1075,爱**5,口味: 【拍1盒发2盒】【拍3份领券更优惠】甄享礼盒9粽4蛋1300克*2盒,好评,还不错，发货速度快,-,-,2021-06-23
1076,e**j,口味: 【3盒领券更优惠】10只大粽10味1400克情系礼盒,好评,送人的，应该还好吧,-,-,2021-06-16
1077,逸**6,口味: 【10粽4蛋1200克】锦绣粽子礼盒,好评,端午节送礼佳品！,-,-,2021-06-20
1078,t**6,口味: 【14粽7味4蛋1600克】福享B粽子礼盒,好评,送人了不错还是 ,-,-,2021-06-24
1079,t**3,口味: 【14粽7味4蛋1600克】福享B粽子礼盒,好评,买来送人的，据说可以，很满意,-,-,2021-06-23
1080,l**7,口味: 【11粽6味1100克】花样五芳礼盒,好评,好吃，软，糯，料足。,-,-,2021-06-17
1081,b**5,口味: 【14粽7味1400g】福享五芳粽子礼盒,好评,钱包和购物车，总有一个在清‬空🛒,-,-,2021-06-20
1082,张**1,口味: 【11粽6味1100克】花样五芳礼盒,好评,送人的 都说难吃,-,-,2021-06-24
1083,茉**6,口味: 【10粽4蛋1280g】祥礼五芳粽子礼盒,好评,每年都买给父母吃,-,-,2021-06-25
1084,m**妍,口味: 【3盒领券更优惠】10粽6味1120克浓情T32礼盒,好评,还不错，送人呢,-,-,2021-06-17
1085,木**a,口味: 【3盒领券更优惠】10粽4蛋4绿豆糕1380克祥礼T4礼盒,好评,送父母的 很喜欢 ,-,-,2021-06-15
1086,t**9,口味: 【14粽7味1400g】福享A粽子礼盒,好评,包装品质：非常喜欢 ,-,-,2021-06-15
1087,g**陈,口味: 【14粽7味1400g】福享A粽子礼盒,好评,东西很好，质量也很好，很喜欢，下次还来。 ,-,-,2021-06-17
1088,淘**号,口味: 【10粽4蛋1200克】锦绣粽子礼盒,好评,收到货真的是一般 ,-,-,2021-06-23
1089,刘**6,口味: 【14粽7味1400g】福享五芳粽子礼盒,好评,味道好，重量租。很糯很好吃,-,-,2021-06-15
1090,q**y,口味: 12粽4蛋1440克祥礼T780送礼盒,好评,差劲的一次购物，不是因为东西不好，买的礼盒买之前问几个口罩，客服给我说有好几种口味，收到货了，就两种口味，还说是什么礼盒随机发，不按自己口味搭配，我给截图发过去，又说是我自己不找人工客服的原因,-,-,2021-06-20
1091,和**方,口味: 【16粽8荤8素1600克】浓情T83粽子礼盒,好评,还不错，送给家人的，下次多买几盒,-,-,2021-06-16
1092,此**年,口味: 【10粽4蛋1280克】祥礼T3粽子礼盒,好评,买来公司送礼  ,-,-,2021-06-20
1093,t**3,口味: 【14粽7味4蛋1600克】福享B粽子礼盒,好评,味道不错，很好吃,-,-,2021-06-23
1094,微**7,口味: 【3盒领券更优惠】14粽7味4蛋1600克福享B礼盒,好评,味道不错很满意,-,-,2021-06-20
1095,s**1,口味: 【10粽4蛋1200克】锦绣粽子礼盒,好评,很好很好吃 性价比很高,-,-,2021-06-17
1096,l**1,口味: 【11粽6味1100克】花样五芳礼盒,好评,味道香甜很好吃,-,-,2021-06-16
1097,如**锅,口味: 【3盒领券更优惠】10粽4蛋4绿豆糕1380克福雅礼盒,好评,味道还不错，挺好的,-,-,2021-06-16
1098,玫**语,口味: 【11粽6味1100克】花样五芳礼盒,好评,很快就到了👑，包装很仔细，没有问题 ,-,-,2021-06-20
1099,t**5,口味: 【3盒领券更优惠】10粽6味1160克心悦礼盒,好评,很好吃 爸爸妈妈很喜欢,-,-,2021-06-25
