1460,凤**8,口味: 【16粽8荤8素1600克】浓情T83粽子礼盒,好评,非常非常的满意，包装精美！口感丰富！发货神速！服务一流！，，，，，，，此处略去八百字！一切尽在不言中！！！此处再加一片掌声雷动！！！ ,-,-,2021-06-13
1461,今**娶,口味: 【16粽8荤8素1600克】浓情T83粽子礼盒,好评,好吃。不错。值得入手 ,-,-,2021-06-19
1462,昂**岸,口味: 【14粽7味1400g】福享A粽子礼盒,好评,不错，好吃的。端午安康 ,-,-,2021-06-15
1463,大**起,口味: 【3盒领券更优惠】14粽7味1400克福享A礼盒,好评,速度有点慢慢 ,-,-,2021-06-23
1464,l**2,口味: 【6荤6素1200克】浓情T82粽子礼盒,好评,整体评价：味道很不错， 包装品质：包装很到位， 口感味道：很棒。 ,-,-,2021-06-13
1465,相**惜,口味: 【10粽4蛋1280g】祥礼T3粽子礼盒,好评,发货很快。还送了个赠品。谢了。份量很足。包装完整没有损坏。礼盒送人挺合适的。大方美观,-,-,2021-06-11
1466,兜**5,口味: 【11粽6味1100克】花样五芳礼盒,好评,特别垃圾的粽子，客服效率极低还喜欢忽悠人，买回家发现有一袋粽子都黑了整个包装完全变质，跟客服说补发，客服不愿意，说只肯赔偿10块钱，结果都快一个星期了也没人赔偿，其它包装没有坏的粽子当天吃了一袋，第二天就上吐下泻，去医院查了一下是急性肠胃炎，这么大的店难道卖的都是毒粽子？极差的一次购物体验！,-,-,2021-06-19
1467,云**年,口味: 【3盒领券更优惠】14粽6味1520克祥礼T738礼盒,好评,不错  速度  挺快的,-,-,2021-06-15
1468,太**贝,口味: 【3盒领券更优惠】14粽6味1520克祥礼T738礼盒,好评,一星都不想给 这家店永不购买 ,-,-,2021-06-21
1469,y**6,口味: 【16粽8荤8素1600克】浓情T83粽子礼盒,好评,基本每年端午节都会买五芳斋粽子，没失望过。口感好，包装完美,-,-,2021-06-14
1470,博**梦,口味: 11粽6味1100克花样礼盒,好评,肉粽子数量太少，素粽子里面吃起来有点干，没有想象好吃，先给个四星吧,-,-,2021-06-21
1471,绿**光,口味: 【3盒领券更优惠】16粽8荤8素1600克浓情T83礼盒,好评,箱子上写的是16个粽子，里面却只有8个，花了159元买了两箱16个粽子，10元一个粽子也是可以了，给反馈，拖了好几天，一直要照片，包装的不行还要里面的的粽子照片，我寄回老家，端午节都过去多少天了，我上哪去找粽子去，真无语，你们发货以后请数好，区区几个粽子无所谓，但是你们处理的很欠妥，少我16个粽子，还补偿我10元钱，那就我买你们的粽子10元一个，你给我补偿就成了10元16个粽子，你留着自己花吧，算我吃亏好了,非常抱歉，是我自己搞错了，发的是正确的，老家那边的亲人看错了，见谅,-,2021-06-16
1472,蓝**0,口味: 【10粽4蛋4绿豆糕1380克】祥礼T4粽子礼盒,好评,东西不错，还有优惠，可以放心省钱购买，不要犹豫了 ,-,-,2021-06-13
1473,小**2,口味: 【14粽7味4蛋1600克】福享B粽子礼盒,好评,端午节，买来送人，包装大气，口味也是喜欢的￼ ,-,-,2021-06-12
1474,a**6,口味: 【10粽4蛋1280g】祥礼五芳粽子礼盒,好评,不错，喜欢，性价比高，以后会经常光顾 ,-,-,2021-06-20
1475,王**3,口味: 【14粽7味1400g】福享五芳粽子礼盒,好评,直播间买的，有优惠，口味还可以，就是生厂日期长了点,-,-,2021-06-20
1476,l**3,口味: 【10粽4蛋1280g】祥礼五芳粽子礼盒,好评,一盒59.5，拍3盒算下来一盒65.9。问客服永远让你重复问题，重复了近10遍，就等到电脑回复那几句。很多人碰到同样的问题，找不到客服就问主播。主播就把问题推给客服。怀疑他家可能没有人工客服。,-,-,2021-06-22
1477,玛**打,口味: 【14粽7味1400g】福享A粽子礼盒,好评,包装还不错，大小正好可以用来送礼，但是粽子真的不好吃，特别是咸粽子，可能是身为一个北方人真的吃不来咸的粽子吧🤣。但是甜粽子的口味也很一般，如果想从这里面获取美味两个字的感受，就放弃吧，也就是用来果腹而已，真的不好吃🥲期望有点高，失望有点大。 PS：每个人的口味都不一样 ,-,-,2021-06-15
1478,宽**5,口味: 【10粽4蛋1200克】锦绣粽子礼盒,好评,应季购物，硬核美食，送给朋友，让他开心，他想要更贵的，我觉得差不多就行了，等一后有钱了再说吧，毕竟这个也不错了。 ,没有拍实物，不好意思，但是毕竟也是美食了，美食不就是为了心情愉悦嘛，各位老铁不要太计较。,-,2021-06-17
1479,g**2,口味: 【3盒领券更优惠】10粽4蛋4绿豆糕1380克福雅礼盒,好评,好吃，送货快,-,-,2021-06-18
1480,落**6,口味: 【3盒领券更优惠】14粽6味1520克祥礼T738礼盒,好评,每年端午必买 ,-,-,2021-06-15
1481,顺**8,口味: 【11粽6味1100克】花样五芳礼盒,好评,淘金币淘金币桃林海 ,-,-,2021-06-24
1482,t**3,口味: 【11粽6味1100克】花样五芳礼盒,好评,挺洋气的礼盒🎁，送礼合适,-,-,2021-06-23
1483,t**1,口味: 【14粽7味4蛋1600克】福享B粽子礼盒,好评,"今天下午收到的，老婆收到粽子后今晚就煮来吃了,她和孩子都夸这味道不错！",-,-,2021-06-11
1484,t**9,口味: 【6荤6素1200克】浓情T82粽子礼盒,好评,物流很快，礼盒既好看又有料，客服特别耐心、细心。下次还会回购的，不愧是老品牌了。 他们家的礼盒包装方式：一个袋子里有两个真空小袋子，一个真空小袋子里又有两个粽子。,追评图片,-,2021-06-12
1485,l**2,口味: 【14粽7味1400g】福享五芳粽子礼盒,好评,整体评价：粽子很好吃包装也不错，下次还会继续购买。 ,-,-,2021-06-10
1486,w**o,口味: 【14粽7味1400g】福享A粽子礼盒,好评,日期很新鲜，五芳斋老牌子了也放心、每一款都好吃！满足 ,-,-,2021-06-10
1487,金**7,口味: 【14粽7味1400g】福享A粽子礼盒,好评,不错，年年都买正厂五芳斋,-,-,2021-06-16
1488,和**2,口味: 【10粽4蛋1280克】祥礼T3粽子礼盒,好评,我选的规格是2箱  五芳祥礼礼盒T3，那么小的礼盒单独送不出手就不说了，明明规格详情里写的五香猪肉粽是4只，收到的礼盒却只有2只。联系客服，让我拍收到的箱子照片和礼盒照片，可是当时收到货的时候快递箱已扔，其中一箱已送人，另外一箱才发现数量不对劲。冲着品牌买的，结果这么不靠谱！！！ ,-,-,2021-06-15
1489,t**9,口味: 【14粽7味4蛋1600克】福享B粽子礼盒,好评,发货速度快，东西又好吃,-,-,2021-06-20
1490,z**1,口味: 【14粽7味1400g】福享A粽子礼盒,好评,五芳斋，大品牌，值得购买,-,-,2021-06-14
1491,明**美,口味: 【10粽4蛋4绿豆糕1380克】祥礼T4粽子礼盒,好评,10粽子，甜粽比较好吃，个人更喜欢甜粽，甜而不腻，味道超级棒 ,-,-,2021-06-13
1492,s**1,口味: 【10粽4蛋1200克】锦绣粽子礼盒,好评,好吃物流很快很好,-,-,2021-06-17
1493,月**舒,口味: 【10粽4蛋1280g】祥礼T3粽子礼盒,好评,很不错，公司端午节礼品,-,-,2021-06-17
1494,卡**卡,口味: 【3盒领券更优惠】14粽7味4蛋1600克福享B礼盒,好评,不太满意，鸭蛋个头小，和鸡蛋差不多，粽子味道也是一般般，主要是买了一个牌子，同是618期间，买了没两天降价差不多一半，虽然说是端午节日礼品，但割韭菜的感觉也太明显了吧。  ,-,-,2021-06-18
1495,哈**y,口味: 【14粽7味1400g】福享A粽子礼盒,好评,端午节，不能回家，给爸，妈，买的，妈妈今早打电话说好咸，不能下口。哎，想到买牌子的，好吃些，没想到太失望了😡😡 ,-,-,2021-06-12
1496,博**4,口味: 【14粽7味1400g】福享A粽子礼盒,好评,口味齐不错，包装很好可以送礼大气 ,-,-,2021-06-11
1497,王**岛,口味: 【11粽6味1100克】花样五芳礼盒,好评,端午给家人买的，不错 ,-,-,2021-06-15
1498,王**5,口味: 【11粽6味1100克】花样五芳礼盒,好评,好评，过节给家人买的 ,-,-,2021-06-19
1499,g**夏,口味: 【10粽4蛋4绿豆糕1380克】祥礼T4粽子礼盒,好评,很好吃哦，老牌子了，里面混搭，很划算 ,-,-,2021-06-13
1500,长**6,口味: 【14粽7味1400g】福享A粽子礼盒,好评,整体评价：发货速度，买了几次了，买过八宝饭也挺好吃的，粽子也不错，料多实惠，很满意 ,-,-,2021-06-12
1501,l**祺,口味: 【14粽7味1400g】福享A粽子礼盒,好评,质量挺好，物流也很快，赞！,-,-,2021-06-20
1502,s**z,口味: 【14粽7味1400g】福享五芳粽子礼盒,好评,👌🙌🤲👏👏👋,-,-,2021-06-24
1503,1**h,口味: 【10粽4蛋1280克】祥礼T3粽子礼盒,好评,给家里人买的，他们说很好吃…嘿嘿，每年都给我他们买粽子，每年都是五芳斋，算是表达一点自己的关心吧。 ,-,-,2021-06-11
1504,王**5,口味: 【3盒领券更优惠】10粽4蛋1200克锦绣礼盒,好评,不错，老顾客了，而且物流很快,-,-,2021-06-21
1505,f**1,口味: 【14粽7味1400g】福享A粽子礼盒,好评,好评，每年来买。,-,-,2021-06-18
1506,小**4,口味: 【3盒领券更优惠】10粽4蛋4绿豆糕1380克祥礼T4礼盒,好评,东西不错，发货速度快,-,-,2021-06-17
1507,王**6,口味: 【10粽4蛋4绿豆糕1380克】祥礼T4粽子礼盒,好评,粽子还可以肉粽不如以前的好吃口感不如以前好，肉比较硬口感不好，豆沙粽不好吃。 口感味道：肉硬口感不好，豆沙粽不好吃 ,-,-,2021-06-22
1508,t**9,口味: 【14粽7味1400g】福享五芳粽子礼盒,好评,可以说是非常好吃了！！😃😃 肉粽绝棒👍🏻肉汁味特别浓肉也很大块！ 主要是真的好便宜啊，虽然个人不太喜欢素粽，但是家里有人爱吃，就可以分着吃～ ,-,-,2021-05-13
1509,数**7,口味: 【3盒领券更优惠】10粽4蛋4绿豆糕1380克福雅礼盒,好评,货已收到。感觉还不错 ,-,-,2021-06-17
1510,出**山,口味: 【3盒领券更优惠】11粽6味1100克花样礼盒,好评,物流是真的差，同城几十公里的路程用了两天多时间，还出错，用啥都别用百世快递了，有问题连快递的联系方式都没有，打电话都是机器人，真心差,真心差，看了大家的评论才知道是通病，选择的物流就是个大问题，百世快递就不行嘛，跟扔垃圾一样胡乱扔，不破才怪。。无语。。差差差评。。,-,2021-06-16
1511,默**生,口味: 【16粽8荤8素1600克】浓情T83粽子礼盒,好评,质量好，第二次购买了。喜欢,-,-,2021-06-18
1512,一**h,口味: 【11粽6味1100克】花样五芳礼盒,好评,不错非常。 ,-,-,2021-06-12
1513,t**9,口味: 【14粽7味1400g】福享五芳粽子礼盒,好评,好吃的粽子，各种口味，满足了一家人的需求，很不错，买东西就要认准老牌子！,-,-,2021-06-09
1514,m**g,口味: 【14粽7味1400g】福享五芳粽子礼盒,好评,好评！日期还不错，5月份的 ,-,-,2021-06-11
1515,蓝**5,口味: 【6荤6素1200克】浓情T82粽子礼盒,好评,今天蒸了几个肉粽，很粘糯，好吃，出门在外，过端午直接买现成的就可以 ,-,-,2021-06-14
1516,y**6,口味: 【11粽6味1100克】花样五芳礼盒,好评,不错，很好吃！ ,-,-,2021-06-18
1517,2**1,口味: 【14粽7味1400g】福享五芳粽子礼盒,好评,还会再买,-,-,2021-06-19
1518,桐**缘,口味: 【11粽6味1100克】花样五芳礼盒,好评,给家里买的,-,-,2021-06-16
1519,熊**n,口味: 【10粽4蛋1200克】锦绣粽子礼盒,好评,给家里买的。,-,-,2021-06-17
1520,z**9,口味: 【10粽4蛋4绿豆糕1380克】祥礼T4粽子礼盒,好评,咸鸭蛋很咸,-,-,2021-06-25
1521,a**1,口味: 【14粽7味1400g】福享A粽子礼盒,好评,粽子很小个，留到端午节吃，相信品牌质量，价格小贵，整体还行吧！ ,-,-,2021-06-09
1522,照**寒,口味: 【14粽7味1400g】福享A粽子礼盒,好评,买给爸爸的，爸爸说包装精致，粽子味道好，很满意,-,-,2021-06-11
1523,t**7,口味: 【3盒领券更优惠】16粽8荤8素1600克浓情T83礼盒,好评,发货物流快，送给客户的，好评,-,-,2021-06-16
1524,j**6,口味: 【14粽7味1400g】福享A粽子礼盒,好评,值得购买，品牌值得信任,-,-,2021-06-19
1525,小**g,口味: 【14粽7味1400g】福享A粽子礼盒,好评,非常好吃，值得购买,-,-,2021-06-19
1526,李**y,口味: 【16粽8荤8素1600克】浓情T83粽子礼盒,好评,肉的太好吃啦，大大的一块纯瘦肉，咸淡适中，价格合理!好吃，推荐给朋友啦,-,-,2021-06-13
1527,x**你,口味: 【14粽7味1400g】福享五芳粽子礼盒,好评,自己买来吃的，包装的很好，没有涨袋少装的情况，而且常温下也可以保存真心不错～～里面七种口味，肉的四种甜的三种可以随心选择着吃～～好评！ ,-,-,2021-06-04
1528,t**6,口味: 【11粽6味1100克】花样五芳礼盒,好评,价格还可以 就是忽略了口味 不晓得我宝不喜欢吃甜粽 谁知道里面好多甜粽 最后还算可以吧 包装很体面,-,-,2021-06-17
1529,t**9,口味: 【11粽6味1100克】花样五芳礼盒,好评,包装很漂亮，送人一点也不失档次，希望也好吃吧，嘿嘿,-,-,2021-06-13
1530,叼**0,口味: 【14粽7味1400g】福享A粽子礼盒,好评,整体评价：非常的差买了14个礼盒包装粽子，就只发了4个而且还是小盒子装的。我买来是送人的，到货了老人就直接吃了，今天才问他们说是就只有四个粽子，而且还是一个普通小盒子装的，幸好不是买了送个其他人的，不然就麻烦了。问客服也一直不理。完全就是商家的错误，这么大的商家犯这种低级错误 ,真的垃圾，不要买这家店的东西，低级错误都能犯,-,2021-06-14
1531,仁**8,口味: 【16粽8荤8素1600克】浓情T83粽子礼盒,好评,看网上卖的挺火爆，就买了一盒，物流挺快，就是盒子都压扁了，本来想送人，结果自己吃啦，这个东西，味道和以前买的普通粽子一样，很普通，普通。普普通通。重要的事情说三遍。,-,-,2021-06-15
1532,简**9,口味: 【14粽7味1400g】福享五芳粽子礼盒,好评,不错，多次回购 ,-,-,2021-06-16
1533,李**2,口味: 【拍1盒发2盒】【拍3份领券更优惠】甄享礼盒9粽4蛋1300克*2盒,好评,挺好的，家人挺喜欢 ,-,-,2021-06-16
1534,双**想,口味: 【10粽4蛋1280克】祥礼T3粽子礼盒,好评,送给家里人的，很喜欢,-,-,2021-06-18
1535,上**好,口味: 【14粽7味1400g】福享A粽子礼盒,好评,挺好的，吃完了已经,-,-,2021-06-19
1536,飞**想,口味: 【11粽6味1100克】花样五芳礼盒,好评,不错，价廉物美，味道好极了,-,-,2021-06-18
1537,t**1,口味: 【10粽4蛋1200克】锦绣粽子礼盒,好评,老牌子，不错👍 ,-,-,2021-06-16
1538,高**蓝,口味: 【11粽6味1100克】花样五芳礼盒,好评,自己品吧 ,-,-,2021-06-15
1539,幸**0,口味: 【16粽8荤8素1600克】浓情T83粽子礼盒,好评,物流很快哦 ,-,-,2021-06-18
1540,t**0,口味: 【3盒领券更优惠】10粽4蛋4绿豆糕1380克福雅礼盒,好评,整体评价：买完就降价了，12号买的，另外一个都还没到，就降了一半，让客服催催，一直在机器人回复，催了个寂寞，买完就不理人是什么鬼，那现在去降价是卖不出去还是伤之前买过的人呀，买了两盒，现在都可以买四盒了，东西还没到货就知道邀请评价，还不理人，催催也不见快递动了 ,-,-,2021-06-15
1541,t**1,口味: 【3盒领券更优惠】16粽8荤8素1600克浓情T83礼盒,好评,味道还阔以，就是太油腻了,-,-,2021-06-22
1542,月**邪,口味: 【11粽6味1100克】花样五芳礼盒,好评,****买了几天就降价不给退差价恶心🤢 口感味道：还特别难吃越做越假越烂 ,-,-,2021-06-21
1543,z**8,口味: 【14粽7味1400g】福享A粽子礼盒,好评,老品牌，值得信赖 ,-,-,2021-06-15
1544,c**o,口味: 【10粽4蛋1280g】祥礼五芳粽子礼盒,好评,买来送长辈的，不知道口感如何，买粽子都是买这个牌子的。 ,-,-,2021-06-11
1545,t**1,口味: 【14粽7味1400g】福享A粽子礼盒,好评,还可以，值得购买 ,-,-,2021-06-18
1546,a**1,口味: 【14粽7味1400g】福享五芳粽子礼盒,好评,不错，肉粽很好吃 ,-,-,2021-06-19
1547,兔**1,口味: 【11粽6味1100克】花样五芳礼盒,好评,很好，中华老字号,-,-,2021-06-15
1548,8**n,口味: 【14粽7味1400g】福享五芳粽子礼盒,好评,"整体评价：质量非常好，与卖家描述的完全一致，非常满意,真的很喜欢，完全超出期望值，发货速度非常快，包装非常仔细、严实，物流公司服务态度很好，运送速度很快，很满意的一次购物店家很讲信誉，而且很不错哦，在这家店买东东，我很满意~ ",-,-,2021-06-09
1549,金**8,口味: 【3盒领券更优惠】11粽6味1100克花样礼盒,好评,挺好的，组员很喜欢,-,-,2021-06-16
1550,m**i,口味: 【14粽7味1400g】福享A粽子礼盒,好评,好评！o(∩_∩)o ,-,-,2021-06-15
1551,孤**0,口味: 【11粽6味1100克】花样五芳礼盒,好评,东西呀还是可以的，买给爸**，他们说挺好吃的，挺不错 ,-,-,2021-06-13
1552,翩**哦,口味: 【14粽7味1400g】福享A粽子礼盒,好评,挣扎着从618那么多订单中找到这个单子，必须给差评，不然晚上睡不着！ 不针对产品，针对你们家！我见过差的但没见过喜欢么不上心的，买东西漏发就算了，还不承认给个假单号，继续给我补发又漏了！连续两次补发完全浪费了我的耐心，更关键售后贼慢，投诉给天猫都说劝不动。怎么？店大真的可以欺客？是谁给你们的权利？不是消费者吗？ 五芳斋一生黑，再也不回来了！  ,-,-,2021-06-22
1553,刘**儿,口味: 【3盒领券更优惠】10粽4蛋1200克锦绣礼盒,好评,🌈质量很好，买的很合我心意💕，棒棒哒！✨需要的亲们可以放心购买 ,-,-,2021-06-15
1554,h**b,口味: 【14粽7味1400g】福享五芳粽子礼盒,好评,網購了這麼多年，這是我第一次這麼認真的對待。我懷著忐忑的心情拿著手機盯著屏幕，遲遲不敢下手。我怕我一旦說出來，老闆會覺得我在拍馬*，是不是想為了那幾塊錢的紅包，又怕我的評價會誤導後來的網友。為了寫這次評價，我鼓起勇氣喝了3瓶啤酒才有信心。記得第一次喝酒還是對初戀表白的那天，今天又是同樣的心情，拼了，為了不辜負老闆對我的期望，我一定會客觀，公正，如實的寫下自己的評價：這是我這開心的一次网购，谢谢！！！  ,-,-,2021-06-14
1555,啦**店,口味: 【3盒领券更优惠】10粽6味1120克浓情T32礼盒,好评,送客户的，非常满意,-,-,2021-06-19
1556,我**4,口味: 【10粽4蛋1280克】祥礼T3粽子礼盒,好评,买了两三次了，不错，好评,-,-,2021-06-16
1557,颓**9,口味: 【14粽7味4蛋1600克】福享B粽子礼盒,好评,一年一次都喜欢光顾五芳斋肉粽，好吃！公司发的不够吃，再买一盒！ ,-,-,2021-06-14
1558,明**美,口味: 【11粽6味1100克】花样五芳礼盒,好评,很好吃，个人偏甜粽，每年都买他家的粽子还有月饼，好品牌产品不会差 ,-,-,2021-06-13
1559,l**1,口味: 【11粽6味1100克】花样五芳礼盒,好评,送家人的，不错,-,-,2021-06-15
1560,t**7,口味: 【拍1盒发2盒】甄享礼盒9粽4蛋1300克*2盒,好评,还不错就是有点贵，头一天买完第二天就降价三十块，下次不能在直播间买了 ,-,-,2021-06-23
1561,t**3,口味: 【14粽7味1400g】福享五芳粽子礼盒,好评,整体评价：包装蛮好，口味也不错哦 ,-,-,2021-06-23
1562,t**9,口味: 【11粽6味1100克】花样五芳礼盒,好评,包装盒很漂亮，物流也快，有好几种口味，还没吃不知道味道咋样，得你吃过了再来,-,-,2021-06-10
1563,l**4,口味: 【14粽7味1400g】福享A粽子礼盒,好评,五芳斋粽子很快就收到了，和图片一样没有差别，五芳斋粽子质量很好，各种口味都很好吃，吃完会继续购买的。卖家服务很好，发货速度很快，全五分好评。 ,-,-,2021-06-11
1564,s**里,口味: 【10粽4蛋1280g】祥礼五芳粽子礼盒,好评,很好吃，已经不知道多少次回购了，鸭蛋有点咸，不过就粥也很好吃！,-,-,2021-06-13
1565,姚**y,口味: 【11粽6味1100克】花样五芳礼盒,好评,包装完整。公司发福利搭配刚刚好。 ,-,-,2021-06-09
1566,w**2,口味: 【3盒领券更优惠】10粽4蛋1200克锦绣礼盒,好评,好不好吃不知道，好评吧,-,-,2021-06-26
1567,t**1,口味: 【11粽6味1100克】花样五芳礼盒,好评,兄弟们是真的难吃 太硬了 改变了我对于粽子的看法 煮完还是很硬  咸的不咸 甜的不甜,-,-,2021-06-21
1568,贾**影,口味: 【14粽7味4蛋1600克】福享B粽子礼盒,好评,提前多次催促，提醒。依然还是端午节之后才到。老人过节都没吃上。差评。 ,-,-,2021-06-22
1569,t**3,口味: 【6荤6素1200克】浓情T82粽子礼盒,好评,礼盒很高端大气上档次 冲着这老牌子买的，家人很开心,-,-,2021-06-23
1570,晓**尧,口味: 【11粽6味1100克】花样五芳礼盒,好评,老品牌，送人很体面，到货也很快，五星好评！,-,-,2021-06-14
1571,s**3,口味: 【3盒领券更优惠】10粽6味1160克心悦礼盒,好评,整体评价：好 胀包问题：无 包装品质：完整 口感味道：赞 新鲜度：近 ……… ,-,-,2021-06-14
1572,最**帅,口味: 【10粽4蛋4绿豆糕1380克】祥礼T4粽子礼盒,好评,服务很差，连续几天留言解决问题没任何回答，这个店永远没真人人工，靠季节吃一波红利而已，服务售后真的太差太差,-,-,2021-06-20
1573,马**i,口味: 【11粽6味1100克】花样五芳礼盒,好评,物流还有客服无话可说😶nbnbnbnbnbnbnb ,-,-,2021-06-20
1574,萤**鹿,口味: 【14粽7味1400g】福享A粽子礼盒,好评,整体评价：店大，但是客服的效率实在是太差劲，最开始问团购回复速度特别慢，然后又说这款不团购，后面回复基本都要半天，人多我能理解，但是已读不回我就不理解了，货发出去不知道发到哪里，联系客服又联系不到，去直播间问主播也解决不了问题，也有很多人说客服不理人，订单不发货，特别是公司大规模的量，我是第一次买五芳斋，都说是粽子第一品牌，但是冲着这个服务也不会再买第二次，就算他的粽子做的有多好，招牌也是他自己砸掉的 ,-,-,2021-06-15
1575,预**福,口味: 【10粽4蛋1200克】锦绣粽子礼盒,好评,好快，昨天晚上拍的9盒今天中午就收到了包装也很好，没有破损 ,-,-,2021-06-11
1576,秋**2,口味: 【10粽4蛋4绿豆糕1380克】祥礼T4粽子礼盒,好评,外包装很好，还没打开看里面，看后再评价,-,-,2021-06-13
1577,t**9,口味: 【11粽6味1100克】花样五芳礼盒,好评,送人的，还挺好的，不知道里面什么样的，有没有什么坏的，老品牌，所以选择的这个，价格实惠，物流要是再快点就好了，毕竟是吃的东西。 ,-,-,2021-06-14
1578,n**i,口味: 【14粽7味4蛋1600克】福享B粽子礼盒,好评,据说肉有点硬，没有店里卖的好吃，不过塑封的，难免会这样 ,-,-,2021-06-21
1579,不**8,口味: 【16粽8荤8素1600克】浓情T83粽子礼盒,好评,好吃，也很划算，收到货后就看不到以前选的产品类型了,-,-,2021-06-14
1580,y**0,口味: 【10粽4蛋1200克】锦绣粽子礼盒,好评,还不错，好评 ,-,-,2021-06-16
1581,一**6,口味: 【14粽7味1400g】福享A粽子礼盒,好评,挺不错的，喜欢 ,-,-,2021-06-19
1582,t**8,口味: 【11粽6味1100克】花样五芳礼盒,好评,满意，很好吃,-,-,2021-06-16
1583,谁**4,口味: 【3盒领券更优惠】10粽4蛋4绿豆糕1380克祥礼T4礼盒,好评,很好吃，很喜欢 ,-,-,2021-06-18
1584,艳**0,口味: 【14粽7味4蛋1600克】福享B粽子礼盒,好评,很好吃，很不错的,-,-,2021-06-17
1585,枫**情,口味: 【16粽8荤8素1600克】浓情T83粽子礼盒,好评,一般，荤粽里也没看到什么荤馅，就是一股咸味。 ,-,-,2021-06-20
1586,w**2,口味: 【14粽7味4蛋1600克】福享B粽子礼盒,好评,送亲戚的，刚收到尚未吃过。相信质量应该不错吧！,-,-,2021-06-26
1587,w**6,口味: 【3盒领券更优惠】10粽4蛋1200克锦绣礼盒,好评,垃圾，先涨价后降价。朋友们不要买他家的，客服完全听不懂话。 整体评价：差差差 ,-,-,2021-06-22
1588,y**4,口味: 【14粽7味1400g】福享五芳粽子礼盒,好评,粽子还不错，也挺适合送人，价格实惠 ,-,-,2021-06-12
1589,l**子,口味: 【6荤6素1200克】浓情T82粽子礼盒,好评,收到。很不错,-,-,2021-06-15
1590,蓝**。,口味: 【3盒领券更优惠】10粽4蛋4绿豆糕1380克祥礼T4礼盒,好评,个咯来嘛来嘛图米诺后米诺扣女欧诺肉欧尼欧尼拒绝欧诺口头木木门口做工你努力,-,-,2021-06-20
