940,九**陵,口味: 芝麻味（250g/盒 无桂花）,好评,买了三盒，吃了口味不错 ,-,-,2021-04-30
941,t**2,口味: 原味（250g/盒）,好评,好吃，味道不错，买的原味的 ，很喜欢 ！,-,-,2021-06-22
942,t**1,口味: 原味（250g/盒）,好评,吃着一般，跟馒头差不多，像是口感粗糙的馒头，桂花味也吃不出来，只有甜味 ,-,-,2021-05-21
943,t**7,口味: 芝麻味（250g/盒 无桂花）,好评,可能是因为运过来时间太长了，保质期是六号生产的，收到是10号已经过了四天了，桂花糕的口感没有以前买的那么q弹反而有些发干。 ,-,-,2021-06-17
944,原**1,口味: 原味（250g/盒）,好评,很好吃，宝贝很喜欢吃，本来打算再买，正好同事旅游回来，带了好多，就不买了,-,-,2021-05-01
945,n**h,口味: 原味（250g/盒）,好评,味道不错，调成糊状九十多岁老爷子很快就吃掉一块，有老人孩子的可以囤着点。语音好评+推荐！ ,-,-,2021-04-19
946,薇**钻,口味: 红豆味（250g/盒）,好评,口感一般吧，不是很糯有点硬，是不是桂花少了些，只有甜味没有桂花香也没有红豆味😅😅,-,-,2021-05-24
947,w**9,口味: 红豆味（250g/盒）,好评,包装品质：很low 保质期：很短 口感味道：一般 ,-,-,2021-06-26
948,黑**节,口味: 红豆味（250g/盒）,好评,这个算得上是他家还算入口的，想吃可以买这个尝尝鲜，但不推荐买三种口味，真心一般。 ,-,-,2021-04-29
949,t**2,口味: 红豆味（250g/盒）,好评,包装品质：王金美 商品分量：分量足 保质期：时间好 新鲜度：蜂蜜幸好 ,-,-,2021-06-22
950,h**1,口味: 特惠3盒装【原味+红豆味+芝麻味】,好评,真好吃😄和馒头差不多，买的草率了。 ,-,-,2021-06-24
951,s**8,口味: 抹茶味（250g/盒）,好评,不是很好吃，大家还是不要买了， ,-,-,2021-04-23
952,暗**4,口味: 抹茶味（250g/盒）,好评,新鲜度：很新鲜 口感味道：热热超级好吃的 ,-,-,2021-04-26
953,焦**方,口味: 原味（250g/盒）,好评,不错，很有嚼劲 ，会回购的 ,-,-,2021-04-23
954,薇**钻,口味: 原味（250g/盒）,好评,口感一般吧，不是很糯有点硬，是不是桂花少了些，只有甜味没有桂花香😅😅,-,-,2021-05-24
955,q**7,口味: 原味（250g/盒）,好评,味道好极了，打算再入手一些 ,-,-,2021-04-21
956,t**5,口味: 原味（250g/盒）,好评,味道很好。吃到嘴里甜甜糯糯的。而且还是独立小包装。,-,-,2021-06-21
957,栋**芽,口味: 抹茶味（250g/盒）,好评,都很干，感觉没有什么差别，普通的糕点味道，常温保质期只有15天，买多了  ,-,-,2021-05-20
958,怪**8,口味: 抹茶味（250g/盒）,好评,保质期：不新鲜 保质期才10天 发过来都快过期了 不敢吃  ,-,-,2021-05-23
959,t**2,口味: 原味（250g/盒）,好评,收到了价格实惠包装完好无损物流很给力值得推荐，口感不错 ,-,-,2021-06-22
960,t**0,口味: 抹茶味（250g/盒）,好评,分量很足 ,-,-,2021-06-24
961,t**4,口味: 抹茶味（250g/盒）,好评,我记得，好好吃呀，训练前的加餐 ,-,-,2021-06-26
962,t**1,口味: 原味（250g/盒）,好评,包装品质：普通 商品分量：没称重 保质期：15天 生吃的，明天蒸熟尝尝看 ,-,-,2021-04-23
963,t**1,口味: 原味（250g/盒）,好评,不错，挺好吃的，孩子也爱吃 ,-,-,2021-05-01
964,t**4,口味: 原味（250g/盒）,好评,此用户没有填写评价。,这是我买过最难吃的桂花糕了，平常买别家的都很好，就他家的桂花糕简直难以下咽,-,2021-06-26
965,t**7,口味: 芝麻味（250g/盒 无桂花）,好评,好吃，是有点儿硬的干的那种 ,-,-,2021-06-17
966,a**3,口味: 芝麻味（250g/盒 无桂花）,好评,公公喜欢吃芝麻味儿的，所以我也没吃过这个口味的，还是等吃过之后再评价吧！,-,-,2021-04-28
967,z**n,口味: 原味（250g/盒）,好评,包装品质：J精致雅致 商品分量：H还好 保质期：S尚可 新鲜度：X新鲜 口感味道：N浓香沁入心扉，甜蜜蕴绕唇齿 ,-,-,2021-05-05
968,w**家,口味: 原味（250g/盒）,好评,很热情的卖家，下次还来希望下次还有机会合作祝你生意兴隆质量非常好真出乎我的意料包装非常仔细非常感谢。祝生意兴隆。 ,-,-,2021-04-25
969,病**5,口味: 红豆味（250g/盒）,好评,吃住一般，孩子们都不喜欢吃，吃住有点干，味道还可以，习惯给个好评！,-,-,2021-05-17
970,凡**宇,口味: 原味（250g/盒）,好评,挺好吃的，刚到的时候吃着软软糯糯的，放了几天就有一丢丢硬。建议尽快吃完,-,-,2021-05-05
971,w**e,口味: 原味（250g/盒）,好评,包装品质：完好 商品分量：我觉得很足 保质期：没找到 新鲜度：很新鲜 口感味道：甜糯 不硬 不热也可以吃 ,-,-,2021-04-25
972,喵**蓼,口味: 原味（250g/盒）,好评,好吃，是软的，我以为是干干有点硬的那种呢，这种真好吃，软糯的，会回购 ,-,-,2021-04-24
973,摁**几,口味: 原味（250g/盒）,好评,有淡淡的桂花香味，软软的还有一点点嚼劲。很好吃一收到我就连吃了3个 ,-,-,2021-04-25
974,t**8,口味: 芝麻味（250g/盒 无桂花）,好评,口感味道：真的之前买了很多次，这次买到的特别干，刚吃就在嘴里变成了渣，再也不买了 ,-,-,2021-05-23
975,二**7,口味: 抹茶味（250g/盒）,好评,有点硬，硬到很有嚼劲，没有抹茶的味道，也没吃出来桂花的味道，只能说还行吧😭 ,-,-,2021-05-21
976,t**4,口味: 原味（250g/盒）,好评,桂花糕有点干，还有点粗口感不太好，有的没到保质期就长毛了。,-,-,2021-06-26
977,爱**0,口味: 原味（250g/盒）,好评,口感味道：跟桂花糕一点不搭边 这是米糕吧，一点点桂花的味道都没有！真是服气！ ,-,-,2021-05-26
978,t**8,口味: 原味（250g/盒）,好评,款式很新颖，做工精细，价格实惠。不出意外，我会再来哟。 ,-,-,2021-05-05
979,卉**0,口味: 抹茶味（250g/盒）,好评,挺好吃的，不很甜，松软适口，日期也很新鲜,-,-,2021-04-19
980,明**2,口味: 原味（250g/盒）,好评,*难吃，像发面蒸馍一样，还有点硬，谁说的入口即化，站出来，我保证不打*你 ,-,-,2021-05-21
981,w**9,口味: 原味（250g/盒）,好评,此用户没有填写评价。,这是我吃过最难吃的桂花糕，又硬又不甜，就像吃纸巾一样，谁买谁后悔，不会在回购,-,2021-06-26
982,b**g,口味: 抹茶味（250g/盒）,好评,很硬很干，也不香，整个就是干干的带点甜味的糕。。。没吃完全过期了 ,-,-,2021-05-20
983,t**9,口味: 红豆味（250g/盒）,好评,一块多钱，好便宜,-,-,2021-04-24
984,秋**i,口味: 原味（250g/盒）,好评,不好吃，是我吃过的最不好吃的桂花糕，又硬，一点都没有桂花味，买了就是浪费，全部倒掉。,-,-,2021-05-17
985,t**1,口味: 原味（250g/盒）,好评,不错孩子很喜欢吃，也没有那么甜，味道刚刚好,-,-,2021-05-09
986,t**5,口味: 红豆味（250g/盒）,好评,东西不错，还有优惠，可以放心省钱购买，不要犹豫了。,-,-,2021-06-21
987,l**4,口味: 原味（250g/盒）,好评,味道一般，很干，吃一块差点被噎*，赶紧喝口水……必须吃一口喝一口水，不然真的会被噎到……,-,-,2021-05-26
988,紫**弦,口味: 原味（250g/盒）,好评,味道很好，红豆味的也好吃已经是第二次购买啦！下次在买个抹茶味的因该也不会不好吃！,-,-,2021-04-29
989,梅**子,口味: 抹茶味（250g/盒）,好评,一盒有6个，好吃不腻。软软的家里小孩拿着吃也不会脏手黏手，也很喜欢吃呢 ,-,-,2021-04-25
990,兔**3,口味: 红糖味（250g/盒）,好评,口感味道：红糖的中间没有花生碎  红糖味也不够  没有原味的好吃 ,-,-,2021-05-25
991,t**6,口味: 原味（250g/盒）,好评,口味一般般，比较干涩,-,-,2021-06-22
992,晨**织,口味: 红豆味（250g/盒）,好评,给老人买的，口味也不是特别甜，很适合老年人的一款零食。,-,-,2021-05-08
993,爱**h,口味: 原味（250g/盒）,好评,还行，不错。 ,-,-,2021-05-24
994,欧**欣,口味: 红糖味（250g/盒）,好评,宝贝收到了，昨天买的今天就到了，物流好快产品也很好，好评，好评,-,-,2021-05-08
995,小**了,口味: 原味（250g/盒）,好评,买了两盒，桂花和红糖的，蒸一下，软糯点会更好吃,-,-,2021-05-04
996,t**6,口味: 原味（250g/盒）,好评,包装完好，口感很好我很喜欢桂花的味道 ,-,-,2021-06-22
997,t**8,口味: 特惠3盒装【原味+红豆味+芝麻味】,好评,除了快递差点其它没毛病。,-,-,2021-05-27
998,韩**1,口味: 红糖味（250g/盒）,好评,超好吃，是我喜欢的口感，糯糯的，又加购了两盒，希望口感一直这样，一块33克，110卡，还可以接受 ,-,-,2021-04-25
999,z**n,口味: 红豆味（250g/盒）,好评,太好吃啦，很有嚼劲而且Q不粘牙，满口米香，推荐好友啦也买了 ,-,-,2021-04-17
1000,风**7,口味: 原味（250g/盒）,好评,味道挺好的，孩子喜欢吃，价格也合适！,-,-,2021-04-24
1001,t**2,口味: 芝麻味（250g/盒 无桂花）,好评,包装品质：包装质量 商品分量：分量科数 保质期：17新鲜 ,-,-,2021-06-22
1002,凹**5,口味: 红豆味（250g/盒）,好评,除了原味和黑芝麻其他不要买！   包装好，物流快，价格实惠，比超市便宜多了 ,-,-,2021-05-04
1003,z**a,口味: 芝麻味（250g/盒 无桂花）,好评,日期新鲜，糕很香甜，比较酥软，但是蛮干的，不习惯的可以蒸一下再吃 ,-,-,2021-05-09
1004,王**奇,口味: 芝麻味（250g/盒 无桂花）,好评,已经第二次购买了，这次稍稍有点儿硬，不过味道还行，习惯性好评吧,-,-,2021-05-17
1005,t**8,口味: 抹茶味（250g/盒）,好评,第五次购买，闺女喜欢吃，一如既往的好味道，下次闺女想吃了，还来你家 ,-,-,2021-04-21
1006,紫**4,口味: 抹茶味（250g/盒）,好评,跟我们的沙糕有点像但味道却不一样，个人感觉还可以。,-,-,2021-05-19
1007,5**q,口味: 原味（250g/盒）,好评,还不错，就是特别有韧劲，嚼的有点费力：好了……不会是这样想过要放弃你真正属于别人担心别人说自己做 ,-,-,2021-04-16
1008,y**7,口味: 芝麻味（250g/盒 无桂花）,好评,收到就品尝了一块，不是很甜，但是我想要的。吃起来软糯可口，非常喜欢。,-,-,2021-04-23
1009,t**8,口味: 原味（250g/盒）,好评,干巴 口感味道：干巴巴 ,-,-,2021-05-24
1010,谦**命,口味: 抹茶味（250g/盒）,好评,这个好吃的，就是有点干，但是不黏牙的！！桂花味香香的，抹茶yyds！ ,-,-,2021-05-25
1011,嘿**耶,口味: 原味（250g/盒）,好评,特别好！,-,-,2021-04-24
1012,毛**娜,口味: 原味（250g/盒）,好评,不好吃，硬邦邦的。糕就应该是软软的滑滑的。可没有啊！ ,-,-,2021-05-22
1013,r**6,口味: 原味（250g/盒）,好评,好好吃！从不爱糕点的瞬间爱上，不甜，有嚼劲儿，夹心很香 ,-,-,2021-04-27
1014,孙**6,口味: 红糖味（250g/盒）,好评,包装品质：包装的很牢固 商品分量：差不多 保质期：在时间内 新鲜度：很新鲜 口感味道：味道柔软有嚼劲 ,-,-,2021-03-01
1015,t**3,口味: 红豆味（250g/盒）,好评,独立包装，方便携带，不是很甜，早上配牛奶、麦片或稀饭挺好，好评。,-,-,2021-05-09
1016,此**代,口味: 原味（250g/盒）,好评,桂花糕特别好吃，有淡淡的甜味，甜而不腻,-,-,2021-04-25
1017,t**5,口味: 芝麻味（250g/盒 无桂花）,好评,买来给上学的侄女吃的，虽然本人没有见到实物，但是听侄女说很好吃，还会继续复购的 ,-,-,2021-06-21
1018,x**x,口味: 原味（250g/盒）,好评,包装好，日期新鲜，物流快 ,-,-,2021-04-28
1019,w**4,口味: 原味（250g/盒）,好评,淡淡的桂花味。买了好几次了，闺女很爱吃。,-,-,2021-04-20
1020,t**0,口味: 原味（250g/盒）,好评,口味一般，可能是期待值有点高，反正不会回购了,-,-,2021-06-24
1021,楠**伟,口味: 原味（250g/盒）,好评,吃过很多家，价位都差不多，这家的口感没之前吃的口感好，感觉跟粗 ,-,-,2021-05-07
1022,聪**2,口味: 原味（250g/盒）,好评,小贵，味道不错，吃着有点干,-,-,2021-05-23
1023,升**滴,口味: 红豆味（250g/盒）,好评,同时下的第二单。店家的优惠券一次只能买一盒，想多买又想要优惠就只能采用这种蠢办法了。,-,-,2021-05-26
1024,高**里,口味: 抹茶味（250g/盒）,好评,好吃，多次购买了！还推荐了好几个同事买给家里老人小孩吃，很松软，不甜腻！ ,-,-,2021-04-18
1025,t**d,口味: 原味（250g/盒）,好评,不像预期中的软糯，很干。 有点嚼劲，韧韧的。,-,-,2021-05-12
1026,s**y,口味: 原味（250g/盒）,好评,不知道好评怎么来的。。真的是巨干，真的不好吃。踩雷了，看见领券推荐来的，说很好吃无限回购，事实证明，又干又硬。 ,-,-,2021-04-29
1027,高**4,口味: 原味（250g/盒）,好评,吃着特别干，不好嚼，很难咽下去,-,-,2021-05-19
1028,t**5,口味: 红豆味（250g/盒）,好评,口感味道：放了两三天就会变得很干，只能配水喝 ,-,-,2021-06-21
1029,大**i,口味: 原味（250g/盒）,好评,难吃，像加了胶质在里面，不松软也不自然,-,-,2021-05-15
1030,a**l,口味: 芝麻味（250g/盒 无桂花）,好评,上次也是在这家买的，软软糯糯的，这次硬邦邦的，不吃了😩 ,吃到了差不多完了才发现找不到生产日期。,-,2021-05-13
1031,w**9,口味: 原味（250g/盒）,好评,此用户没有填写评价。,这是我吃过最难吃的桂花糕，又硬又不甜，真**难吃的东西,-,2021-06-26
1032,张**0,口味: 原味（250g/盒）,好评,口感不错，桂花少点，没吃出桂花味道😂,-,-,2021-05-03
1033,y**女,口味: 红糖味（250g/盒）,好评,此用户没有填写评价。,太干了，没有没有米糕的软糯,-,2021-05-20
1034,景**g,口味: 红豆味（250g/盒）,好评,说实话真心不好吃，能噎**，喇嗓子，小孩吃一口就吐了，浪费钱,-,-,2021-05-15
1035,婷**7,口味: 红豆味（250g/盒）,好评,有点硬硬的，和想象中酥软香甜不一样 ,发霉的……,-,2021-05-22
1036,紫**弦,口味: 原味（250g/盒）,好评,味道不错很纯正，也不是很甜好吃！,-,-,2021-04-21
1037,上**8,口味: 原味（250g/盒）,好评,口感不错，很软，吃着还行，继续努力持续关注！ ,-,-,2021-05-05
1038,流**0,口味: 抹茶味（250g/盒）,好评,不好吃，应该是我不喜欢这种味道，倒是有桂花香味 ,-,-,2021-05-22
1039,陈**9,口味: 芝麻味（250g/盒 无桂花）,好评,非常好吃，很像我方面在福建路边人家推着自行车卖的米糕。,-,-,2021-04-25
1040,星**6,口味: 红豆味（250g/盒）,好评,桂花糕太好吃了，我非常满意，特别爱吃，下次还会继续光顾。,-,-,2021-05-03
1041,l**4,口味: 抹茶味（250g/盒）,好评,好吃，好吃，好吃，重要的是说三遍，口感不错，喜欢桂花的,-,-,2021-05-06
1042,津**哥,口味: 抹茶味（250g/盒）,好评,还行吧包装精美上档次值得购买！吃完再来买！ ,-,-,2021-05-06
1043,t**6,口味: 原味（250g/盒）,好评,好吃，棉软香糯，桂花香甜，喜欢了！,-,-,2021-06-22
1044,三**l,口味: 芝麻味（250g/盒 无桂花）,好评,不是我喜欢吃的味道，但是给同事吃，他能说挺好吃的，,-,-,2021-04-23
1045,t**9,口味: 原味（250g/盒）,好评,已收到，好评！,-,-,2021-05-01
1046,木**儿,口味: 原味（250g/盒）,好评,好吃，我就喜欢这种保质期短的，没有防腐剂的，吃着放心 ,-,-,2021-04-29
1047,x**4,口味: 抹茶味（250g/盒）,好评,比较干  没有想象的那么好吃 ,-,-,2021-05-26
1048,呼**1,口味: 芝麻味（250g/盒 无桂花）,好评,到了之后，不派送，4天啊，直接影响口感！差评 ,-,-,2021-05-19
1049,t**9,口味: 红糖味（250g/盒）,好评,干干的感觉，特别的有嚼劲，红糖味的有些甜，不过个人不太喜欢,-,-,2021-05-20
1050,t**1,口味: 原味（250g/盒）,好评,第一口不怎么样，越吃越好吃，真心不错，建议大家买一单，好吃,-,-,2021-05-07
1051,董**露,口味: 抹茶味（250g/盒）,好评,好吃，不噎，软糯有嚼劲,-,-,2021-04-23
1052,t**0,口味: 原味（250g/盒）,好评,闺女爱吃，甜度可以接受，不会齁 ,-,-,2021-06-24
1053,w**5,口味: 抹茶味（250g/盒）,好评,看了评价才买的，非常非常期待的桂花糕，打开就非常非常失望，什么桂花糕，光看外表就没有食欲，就跟地摊上买的棉花糖差不多，，吃到嘴里想吐，非常难缴，就是大家千万别上当,-,-,2021-04-12
1054,宝**0,口味: 红豆味（250g/盒）,好评,味道鲜美，很喜欢 ,-,-,2021-04-30
1055,a**9,口味: 红豆味（250g/盒）,好评,大品牌！值得信赖的！效果超级好！贵有贵的道理！很棒的商品！,-,-,2021-04-19
1056,叶**敏,口味: 芝麻味（250g/盒 无桂花）,好评,噎喉咙,-,-,2021-05-20
1057,右**z,口味: 原味（250g/盒）,好评,口感味道：好像吃棉花 ,-,-,2021-05-20
1058,n**h,口味: 原味（250g/盒）,好评,收到货了，不错满意 ,-,-,2021-05-06
1059,l**6,口味: 原味（250g/盒）,好评,还行，太干巴了,-,-,2021-05-21
1060,梁**i,口味: 芝麻味（250g/盒 无桂花）,好评,第二次购买了，喜欢芝麻口味的。特别好吃！ ,-,-,2021-05-04
1061,t**5,口味: 抹茶味（250g/盒）,好评,桂花糕收到了，很新鲜，很好吃，非常满意。 ,-,-,2021-06-21
1062,g**i,口味: 原味（250g/盒）,好评,挺好吃的，很管饱，下午吃一块抗饿到晚上   ,-,-,2021-05-06
1063,t**2,口味: 芝麻味（250g/盒 无桂花）,好评,很好，日期新鲜，物流也很快 ,-,-,2021-06-22
1064,摇**终,口味: 原味（250g/盒）,好评,收到不够快，日期是18号生产的，收到的时候吃已经不怎么柔软了，有点干干的，不太好吃 ,-,-,2021-05-24
1065,阿**1,口味: 原味（250g/盒）,好评,可以，很好吃 ，关键还便宜，推荐购买 ,-,-,2021-05-07
1066,t**9,口味: 原味（250g/盒）,好评,不爽口 口感味道：不好吃，没有之前买的那家好吃。 ,-,-,2021-05-27
1067,鲁**8,口味: 抹茶味（250g/盒）,好评,桂花糕已收到，和描述一样，比较好吃，今后还购。物流也较快，比较满意！,-,-,2021-04-20
1068,丿**丶,口味: 芝麻味（250g/盒 无桂花）,好评,桂花糕口感很好！一吃就上瘾吃完回购,-,-,2021-04-17
1069,t**5,口味: 抹茶味（250g/盒）,好评,新鲜，味美，还要再次购买,-,-,2021-06-21
1070,0**x,口味: 芝麻味（250g/盒 无桂花）,好评,此用户没有填写评价。,特别难吃  别买  干巴还涩,-,2021-05-05
1071,木**7,口味: 原味（250g/盒）,好评,当时不知道能不能吃惯，就买了一盒，没想到还挺好吃的,-,-,2021-05-23
1072,t**9,口味: 原味（250g/盒）,好评,口感味道：  QQ软软的。一下子能吃好几个。 ,-,-,2021-04-17
1073,蜜**佛,口味: 原味（250g/盒）,好评,日期很新鲜，口感也好,-,-,2021-04-19
1074,云**9,口味: 抹茶味（250g/盒）,好评,软糯，口感不错，有嚼劲 ,-,-,2021-04-17
1075,心**9,口味: 原味（250g/盒）,好评,口感味道：感觉稍微有点硬，其他还好 ,-,-,2021-05-12
1076,l**1,口味: 原味（250g/盒）,好评,一般一点桂花味都没有，那怕只有一点点呢，都没有，,-,-,2021-05-23
1077,h**1,口味: 原味（250g/盒）,好评,口感一般，没什么香味，建议改进吧,-,-,2021-06-24
1078,宝**0,口味: 抹茶味（250g/盒）,好评,很喜欢，好吃 ,-,-,2021-04-30
1079,t**4,口味: 原味（250g/盒）,好评,上次买过的一家很好吃，这次买这家简直就是吃土一样,-,-,2021-06-26
1080,九**制,口味: 原味（250g/盒）,好评,好吃😋不知道可不可以蒸着吃 几个味道都可以试一下 ,-,-,2021-04-17
1081,k**a,口味: 芝麻味（250g/盒 无桂花）,好评,还行，就是要稍微蒸一下才好吃，否则比较硬 ,-,-,2021-05-15
1082,t**6,口味: 原味（250g/盒）,好评,一般般吧，没什么桂花香味儿，吃着噎人,-,-,2021-06-22
1083,s**4,口味: 红糖味（250g/盒）,好评,口感很干味道一般,-,-,2021-05-14
1084,l**6,口味: 原味（250g/盒）,好评,味道还可以，就是口感不太好，太硬了 ,-,-,2021-05-24
1085,f**6,口味: 红豆味（250g/盒）,好评,新鲜软糯香甜 ,-,-,2021-04-18
1086,t**5,口味: 红糖味（250g/盒）,好评,一般般吧。感觉不是现做的，干干的，不新鲜,-,-,2021-06-21
1087,t**9,口味: 红豆味（250g/盒）,好评,软糯清香、可口味美！,-,-,2021-05-07
1088,f**4,口味: 红豆味（250g/盒）,好评,超级无敌好吃，原味的比黑芝麻的好吃 ,-,-,2021-04-30
1089,t**5,口味: 抹茶味（250g/盒）,好评,抹茶味的太喜欢啦，味道也没有很腻,-,-,2021-06-21
1090,许**2,口味: 原味（250g/盒）,好评,买回来放桌上就被孩子拆掉吃完了，还会再买呢。 ,-,-,2021-04-29
1091,w**g,口味: 原味（250g/盒）,好评,口感一般这个价格值了 ,-,-,2021-05-05
1092,g**x,口味: 红糖味（250g/盒）,好评,很有嚼劲。一下子都吃完了，没来得及拍照。,-,-,2021-05-06
1093,t**5,口味: 芝麻味（250g/盒 无桂花）,好评,味道不错，下次就买他家的东西,-,-,2021-06-21
1094,流**客,口味: 原味（250g/盒）,好评,好吃，一盒我当饭前零食都吃了,-,-,2021-05-01
1095,t**3,口味: 原味（250g/盒）,好评,有些干，不是想象中那么软糯。,-,-,2021-05-15
1096,浮**郭,口味: 芝麻味（250g/盒 无桂花）,好评,味道不错，喜欢。开水冲成糊，更好吃。,-,-,2021-04-26
1097,t**3,口味: 原味（250g/盒）,好评,买了三种口味，口感都不错，吃完再买。,-,-,2021-05-09
1098,z**y,口味: 红糖味（250g/盒）,好评,价格便宜 味道差不多 物有所值 ,-,-,2021-04-30
1099,j**h,口味: 红豆味（250g/盒）,好评,比较干，微微甜比较好,-,-,2021-04-25
1100,t**5,口味: 原味（250g/盒）,好评,不好吃，棉棉的硬硬的，口感一点都不好 ,-,-,2021-06-21
1101,嗅**0,口味: 原味（250g/盒）,好评,原来这是桂花糕的味道！还可以,-,-,2021-04-27
1102,a**7,口味: 原味（250g/盒）,好评,没几天就发霉了 ,-,-,2021-05-25
1103,刘**5,口味: 抹茶味（250g/盒）,好评,口感味道：中间有点硬，口感不好 ,-,-,2021-05-14
1104,高**下,口味: 芝麻味（250g/盒 无桂花）,好评,这次的口感很差，太粗，难下咽，习惯好评 ,-,-,2021-05-27
1105,t**1,口味: 红豆味（250g/盒）,好评,新鲜度：不怎么样，发来的时候有点硬 ,-,-,2021-05-25
1106,g**8,口味: 原味（250g/盒）,好评,一般，跟以前买的桂花糕不一样,-,-,2021-05-23
1107,林**窝,口味: 原味（250g/盒）,好评,我之前买的软软的 这次买的有点干干的 没有之前的芝麻的好吃。  ,-,-,2021-05-23
1108,卡**0,口味: 原味（250g/盒）,好评,味道很好，适合老人和孩子吃。,-,-,2021-05-01
1109,只**人,口味: 原味（250g/盒）,好评,味道还行，可以推荐下,-,-,2021-04-24
1110,d**3,口味: 红豆味（250g/盒）,好评,价格便宜，但味道不是我们喜欢的 ,-,-,2021-05-25
1111,s**0,口味: 抹茶味（250g/盒）,好评,不好吃，太干了，有点咽不下去 ,-,-,2021-05-24
1112,t**8,口味: 红豆味（250g/盒）,好评,好难吃 干巴巴的 没味道 吃了容易渴 一点也不好吃 扔掉了 谁买谁吃亏啊！！,-,-,2021-05-22
1113,h**a,口味: 原味（250g/盒）,好评,立马吃了，不上火挺好的。桂花香浓点就更好哦！,-,-,2021-04-25
1114,l**6,口味: 原味（250g/盒）,好评,难吃*了！还很难咬，很甜的！没一点桂花味道的😬,-,-,2021-05-16
1115,t**9,口味: 原味（250g/盒）,好评,有点干，要是柔软一点就好了。口感还好吧😊,-,-,2021-04-24
1116,t**2,口味: 原味（250g/盒）,好评,很好吃😋，物流也很快 ,-,-,2021-06-22
1117,g**浩,口味: 原味（250g/盒）,好评,糕点新鲜，包装较好，好评。,-,-,2021-05-03
1118,t**4,口味: 抹茶味（250g/盒）,好评,口感味道：太干，蒸了好久 ,-,-,2021-06-26
1119,夏**头,口味: 原味（250g/盒）,好评,味道香甜，口感劲道，挺好吃的 ,-,-,2021-04-27
1120,w**1,口味: 原味（250g/盒）,好评,不是软的，是咬起来有嚼劲的那种！还行吧 ,-,-,2021-04-22
1121,l**涵,口味: 原味（250g/盒）,好评,多次购买了，家里老人和小孩都喜欢吃！,-,-,2021-05-04
1122,t**8,口味: 抹茶味（250g/盒）,好评,口感味道：没有以前好吃  ,-,-,2021-05-23
1123,t**4,口味: 原味（250g/盒）,好评,优惠券买来试试 感觉还不错,-,-,2021-06-26
1124,h**q,口味: 原味（250g/盒）,好评,已经买过一次了 喜欢原味和芝麻味的  ,-,-,2021-04-21
1125,h**q,口味: 芝麻味（250g/盒 无桂花）,好评,已经买过一次了 喜欢原味和芝麻味的 ,-,-,2021-04-21
1126,玩**物,口味: 原味（250g/盒）,好评,实惠好物值得购买,-,-,2021-04-17
1127,t**3,口味: 原味（250g/盒）,好评,味道不怎么……包装好评,-,-,2021-05-24
1128,捣**9,口味: 原味（250g/盒）,好评,好吃，下午小饿的时候来一块，早上起来晚了，热一下也是不错的早餐,-,-,2021-04-26
1129,玫**9,口味: 原味（250g/盒）,好评,这个香味还好，口感不好，吃到嘴里绵绵的 ,-,-,2021-05-21
