数据下载时间：2021-06-30 09:55:15 功能：看店宝【https://kandianbao.com/】 宝贝评价信息分析 相关查询网址：https://kandianbao.com/item/pingjia/643976644608/,,,,,,,
序号,评价用户,sku,评价类型,评价内容,追评,掌柜回评,评价时间
1,幻**6,口味: 【0脂荞麦方便面20袋+0脂荞麦面皮10袋】送2瓶【0脂油醋汁】,好评,包装挺精致的，小份独立包装，这个自己做了拌荞麦面，面条小包装方便食用一次一包，作为减脂餐再适🌞合不过了口感很好又好吃，我是泡了三分钟过下凉水就好啦，作为非常爱吃面食的我，能遇上这款荞麦面这么多算是非 常棒了，继续支持！！因为它热量非常😍低，而且有饱腹感，同时纤维含量又很高，很利于肠道的 健康  ,已近安利给小姐妹们了，趁着这次活动还好多买了好多，需要减肥的集美们可以尝试一下,-,2021-06-24
2,t**3,口味: 0脂免煮荞麦面【买30送30#3C实发60包】[不送酱汁],好评,真的好爽口，好吃、顶饿，还能减肥，等这两箱吃完，在接着买不错😊 吃完再来买买买，赞👍 值得购买👍 👍荞麦面的方便面，都是独立小包装营养又健康，还不怕长肉肉。特抗饿！自己动手做个盖浇面，经济实惠又美味！ ,兔煮荞麦面口感相当好 中午终于可以吃主食了好开心 这次购物特别满意！口感好。道挺好，口感很滑。我觉得还行，用热水泡5 6分钟就可以了，一包够我吃两顿，nice,-,2021-06-21
3,t**r,口味: 0脂免煮荞麦面【买10送5#3C实发15包】[不送酱汁],好评,朋友给推荐的这个面她自己吃过一段时间，说0脂的，有饱腹感，可以满足食欲吃的时候很简单，跟泡方便面差不多，热水一泡就可以吃了。味道也非常不错口味正和我意免煮特别适合我这种在学校的，非常不错，好吃，还方便。 ,荞麦也是属于碳水，虽然0脂肪，但是也推荐是中午早上食用，晚上还是减少碳水哦0脂肪的，减脂期也可以吃，只要开水泡一下就可以了，口感很好，饱腹感也强。好吃、顶饿，还能减肥，等这两箱吃完，在接着买,-,2021-06-25
4,小**1,口味: 0脂免煮荞麦面【买10送5#3C实发15包】[不送酱汁],好评,吃的时候口感很有弹性...量特别足.特别出数.非常不错.建议购买！包装严实，物流很快，超满意。兔煮荞麦面口感相当好 中午终于可以吃主食了好开心 这次购物特别满意！口感好。道挺好，口感很滑。 新鲜度：日期新鲜口感味道：是喜欢的的味道很健康 ,已经是老客户了，n次来买了，实惠又划算，家人挺喜欢吃的，口感还不错，健康又好吃。最近都在减肥，吃的时候口感很有弹性！很香很香！还有嚼劲儿,-,2021-06-21
5,艾**2,口味: 0脂免煮荞麦面【买30送30#3C实发60包】送2瓶【0脂油醋汁】,好评,"还不错，跟方便面差不多，泡了三分钟拿来做焖面，也不会软烂，很筋道，不错真心不错(´-ω-`)，不错😊 吃完再来买买买，赞👍 值得购买👍 👍荞麦面的方便面，甩肉就靠它啦,还是免煮的,简直太美味啊♍。好吃又能减肥太棒了, ",味道还不错，用小锅煮的，喜欢吃软一点的，不会长胖又可以吃面条，开心真 香! 我想说，刚我把油醋汁直接淋面上，真的好爽 口，跟我一样想控制体重的可以试试!日期挺新鲜的，期待味道，减肥吃，换口味,-,2021-06-26
6,w**0,口味: 0脂免煮荞麦面【买15送15#3C实发30包】送【0脂油醋汁】,好评,这个面口感非常好，下次试试自己做调料，里面拌一点自己喜欢的蔬菜，味道非常完美。非常不错的荞麦面，吃的时候很简单，跟泡方便面差不多，热水一泡就可以吃了。 而且荞麦的比普通的白面还有营养，味道也非常不错 ,没想到泡了满满一大碗，都够两三个人吃了，也好吃，味道不错，夏天来了，吃这个比较舒服，主要还是杂粮非油炸的，比较健康口味正和我意 ，减脂瘦身也可以吃了 ，赶紧回购。,-,2021-06-22
7,8**虹,口味: 0脂免煮荞麦面【买5送5#3C实发10包】送【0脂油醋汁】,好评,太合适啦，也不用担心长肉肉，还会回购的！减肥冲！一口咬下去，太好吃了，好吃又减脂非常不错的荞麦面，吃的时候很简单，跟泡方便面差不多，热水一泡就可以吃了。味道也非常不错口味正和我意 ，减脂瘦身也可以吃面皮了 ，赶紧回购。 ,荞麦方便面味道真不错，用开水泡了三分钟，再用凉水冲冲，面条筋道爽滑早上吃荞麦面皮，晚上吃荞麦面条，我这一天天的也是醉了，哈哈哈，不过很开心，能减肥嘛，希望有好的效果！,-,2021-06-18
8,幻**1,口味: 0脂免煮荞麦面【买30送30#3C实发60包】[不送酱汁],好评,买这个面主要是因为它是粗粮，不会产生那么多的糖给身体负担，而且没有脂肪和盐，是健身减肥人士最好的选择，之所以买他们家是因为减肥期间的面包面条之类的都在他家买的，印象非常好。一下买了很多，在健身减肥期间太馋泡面了，这个热水泡一泡也能熟，煮熟放凉拌着吃也好吃，卖家还送了油醋汁，面的口感很好一包就能吃饱，跟方便面一样好吃而且0脂的，代餐太方便了  ,分量正好，一次吃一包 ，煮了调成凉面，没有发现胀包，也没有碎的，点个赞,-,2021-06-23
9,看**o,口味: 0脂免煮荞麦面【买30送30#3C实发60包】[不送酱汁],好评,一定要泡着吃啊啊啊 ，味道还可以，不苦，不喜欢油醋汁味道可以买点调料或者酱汁配着吃?总体来说很划算口感很不错~平常赶时间用开水泡个3-5min⚡就可以吃啦~就是选酱很重要~ ！易泡软，随便加一点酱拌一下?就很好吃了™，性价比蛮高的⚠发货速度很快  ,真的很好，质量保证， 有需要还来你家。  谢谢老板服务态度很好物流也快，有需要的亲们赶紧下手吧！价格也实惠值得购买亲们,-,2021-06-23
10,卫**忆,口味: 【0脂荞麦方便面20袋+0脂荞麦面皮10袋】送2瓶【0脂油醋汁】,好评,第一次买荞麦方便面🌵很惊艳💓✨没想到这么劲道，由于最近健身💪🏼，什么主食都不敢吃🤐，朋友推荐这个免煮的方便面🍜果然不错，非油炸的，很饱腹👏又不怕长肉，特别适合减肥，吃完再来买点囤着👅 ,减肥非常非常适合吃，口感特好。卖家态度很好价格也很实惠，解答很专业热情，包装的很严实很好，口感跟方便面差不多，但是热量低很多，面饼也很完整！,-,2021-06-22
11,t**7,口味: 0脂免煮荞麦面【买30送30#3C实发60包】送2瓶【0脂油醋汁】,好评,很好吃的荞麦面，很筋道，吃着很方便，没有时间做饭的最佳选择，荞麦的还很健康不长肉！热量不高，确实适合减肥，又不用煮，泡一泡就好了，适合我这种懒人符合我的口味，真的好吃，一份分量也足，真心喜欢吃！ ,不添加面粉，关键还0脂肪，吃着毫无负罪感，而且饱腹感很强，我还加了点配菜，一袋量好多，吃的好饱非常方便，伴着吃，炒着吃都可以，还没有脂肪，不用担心会胖，爱了爱了,-,2021-06-22
12,t**3,口味: 0脂免煮荞麦面【买10送5#3C实发15包】[不送酱汁],好评,味道还不错，用小锅煮的，喜欢吃软一点的，不会长胖又可以吃面条，开心大意了，看着包装小，煮了两包，吃不完了。饱腹感也太强了吧配料很单纯，面吃起来也方便小小一包，吃起来很方便，泡一下就行了！吃完会再买一点。 ,包装完好，很好吃再加一袋鸡胸肉刚刚好看着非常不错，减肥饱腹必备品，一次一袋，再搭配着蔬菜和肉肉，完美！这次买了荞麦方便面试试好吃不，没想到还挺好吃，两款不一样的口感，很棒，同样都是非油炸0脂肪的，不怕长肉,-,2021-06-21
13,x**屋,口味: 0脂免煮荞麦面【买30送30#3C实发60包】送2瓶【0脂油醋汁】,好评,刚收到午餐就泡了一包🉑🉑💗💗 ，非常好吃又很方便，低脂又饱腹，配上清爽的黄瓜完美，一包一餐刚刚好，泡完再过下凉水出来口感比较Q弹，再也不用担心长胖了，推荐购买👏👏👏优秀,一小包一小包的单独包装，干净卫生，减肥吃的，更健康 ，看着没多少，吃起来还挺多的，面条有劲道，口感不错，就适合减肥期间想吃面食的人！,-,2021-06-23
14,平**娟,口味: 0脂免煮荞麦面【买30送30#3C实发60包】[不送酱汁],好评,宿舍姐妹一定要入！！！！ 吃起来很方便  搭配拌饭酱啊拌面酱啊都可以  热水泡一泡就可以吃了  口感是有点劲道的那种⚡ 0脂啊主要是  而且可以自己控制油的摄入量  个人感觉比吃米饭啥的容易瘦，减肥必备，味道不错 ，减肥又健康，拌上油醋汁，真的是超级美味 ，很好吃， 想吃方便面又怕胖的 可以选择荞麦方便面 无油0脂还健康 ，饱腹感很强，比那些泡面还好吃   ,一袋就够吃了，看着面很小，泡出来一大碗，舍友整了两袋，就有点多了，我的做法是拌的，挺好吃的,-,2021-06-23
15,t**4,口味: 0脂免煮荞麦面【买30送30#3C实发60包】送2瓶【0脂油醋汁】,好评,0脂低热量☁用心生活！吃了两包了太好吃了☔告别超市高钠高升糖挂面☔再自己配上青菜浇上赠送的油醋汁，营养又美味 商品包装得很贴心⚡够吃个把月的早餐面了客服的服务也很好☔泡一泡就能吃很方便，很适合我这种不怎么会煮饭的人☔  ,这次做的汤面，下次试试过下凉水做凉拌的，应该会更劲道~,-,2021-06-24
16,宝**丢,口味: 0脂免煮荞麦面【买30送30#3C实发60包】[不送酱汁],好评,非油炸荞麦面真的好吃。 0脂肪低热量非常的顶饱，还是免煮的，泡个3分钟就好了，卖家还送了油醋汁，这家荞麦面非常的香，不需要别的配料就可以吃了，这个面既减肥又好吃。  包装也很好，没有碎就很开森~ ,"很好吃好吃⛵,减肥必备,全五星好 评。这样的好掌柜可不 多。",-,2021-06-25
17,a**7,口味: 0脂免煮荞麦面【买15送15#3C实发30包】[不送酱汁],好评,今天煮了一个潮汕式的面汤，真香！我想说，刚我把油醋汁直接淋面上，真的好爽口，跟我一样想控制体重的可以试试！饱腹感很强，口感也不错，真不错，营养又健康，还不怕长肉肉。搭配着送的油醋汁我觉得也挺好吃的，干净又卫生，还方便携带，这款方便面是0脂肪的，只要开水泡一下就可以吃了，方便快捷，饱腹感很强，口感也不错，满意物流好快，荞麦方便面味道真不错，用开水泡了三分钟，再用凉水冲冲，面条筋道爽滑，再搭配油醋汁。 ,口感确实不错，非常好,-,2021-06-20
18,麦**叔,口味: 0脂免煮荞麦面【买30送30#3C实发60包】[不送酱汁],好评,"简简单单一顿减脂餐。几分钟就搞定,♒有营养,但是泡了五分钟🚻感觉够吃了。不经意看🐲到生产地,卡拌面,还💔不怕长肉肉。脂肪的免😞煮荞麦面太适合我了泡是肯定泡不开的，煮了好一会儿。口感不错，没有味道 ",很方便 今天的午餐，面撒上油醋汁，加个蛋，再加**胸肉，配上核桃和圣女果，真的绝了喜欢吃面，然后好怕吃成胖子，朋友给推荐的这个面她自己吃过一段时间，说0脂的，有饱腹感，可以满足食欲,-,2021-06-20
19,又**5,口味: 0脂免煮荞麦面【买30送30#3C实发60包】送2瓶【0脂油醋汁】,好评,不怕胖，饱腹感强，特抗饿！自己动手做个盖浇面，经济实惠又美味！配合运动，减肥效果超赞呢！饱腹感特别足，中午吃一包，一下午都不会感觉到饿！热水泡泡，拌上赠送的油醋汁就能吃，口感筋道，顶饱又减脂，吃完回购。  ,真香！ 😃我想说，刚我把油醋汁直接淋面上，真的好爽口，跟我一样想控制体重的可以试试！不用害怕长肉，非常的健康。做法超简单，开水一泡加点配菜就是一餐，这一袋吃完都撑了。,-,2021-06-26
20,s**0,口味: 0脂免煮荞麦面【买30送30#3C实发60包】[不送酱汁],好评,第一次买荞麦泡面，👟方便口感Q弹，👽这么健康的泡面吃的很快乐！小小一包，吃起来很方便，泡一下就行了！吃完会再买一点。真的值得买，吃完我再来买，客服也很有礼貌， ,"有营养,但是泡了五分钟🚻感觉够吃了。不经意看🐲到生产地,卡拌面,还💔不怕长肉肉。脂肪的免😞煮荞麦面太适合我口感不错，没有味道，配店家送的酱料，依然很好吃。值得购买！",-,2021-06-18
21,蛋**好,口味: 0脂免煮荞麦面【买15送15#3C实发30包】送【0脂油醋汁】,好评,",超级好🌵吃,建议购买也很划算📻,因为现在不敢吃白面面条。这个吃着合适。面好劲道～ 啊～ 真的是太好吃了🚑很方便！日期是‮鲜新‬的，🍒是‮幸件‬福的‮情事‬，🚄推荐挺好吃的荞麦方便面口感相当好，农夫慢家的荞麦面是我一直回购的  ",-,-,2021-06-20
22,t**1,口味: 0脂免煮荞麦面【买10送10#3C实发20包】送【0脂油醋汁】,好评,整体评价：整体还行 胀包问题：没有 包装品质：包装还可以，面饼有点碎，不过不多 口感味道：泡好闻起来有点点生面粉发霉的涩味，但是吃起来没有异味，比较顺滑，没有什么味道。那个送的油醋汁我个人不是特别喜欢，一般我会放一点点那个油醋汁然后再加一点自己喜欢的酱料或者配菜，这样感觉好吃一点☺️ ,-,-,2021-06-22
23,讨**气,口味: 0脂免煮荞麦面【买10送5#3C实发15包】[不送酱汁],好评,好吃、顶饿，还能减肥，等这两箱吃完，在接着买面条筋道爽滑，再搭配油醋汁，简直太美味啊。夏天到了，甩肉就靠它啦，饱腹感杠杠的吃起来很q、关键很方便，几分钟就搞定，好吃又能减肥太棒了 ,"脂肪的免煮荞麦面太适合我了,口味好,吃起来还不错。甩肉就靠它啦,还是免煮的,简直太美味啊♍。好吃又能减肥太棒了,",-,2021-06-12
24,t**3,口味: 0脂免煮荞麦面【买30送30#3C实发60包】[不送酱汁],好评,包装一级棒 ，对减肥有帮助，煮泡都可以。 没怪味爱吃好吃实惠，强烈推荐啊姐妹们。，特别适合我这种懒癌患者。0脂肪的适合想减肥的懒人，哈哈。不是苦的，荞麦味道很浓郁。店家的服务态度也非常的好 ，日期也是非常新鲜的，️包装图案非常好看，很高级很精致的感觉，感谢店家呀哈哈,口感很好吃着过瘾但是比泡面更实惠，q弹q弹的好吃又劲道，主要是低卡吃着很满足了！,-,2021-06-21
25,t**3,口味: 0脂免煮荞麦面【买5送5#3C实发10包】送【0脂油醋汁】,好评,不错不错，我看着一包有点少，一口气泡了两袋，都吃了哈哈哈哈哈哈赠送的油醋汁也不错，很好吃！然后我又放了火鸡面调料，酸酸辣辣！ ,-,-,2021-06-21
26,m**6,口味: 0脂免煮荞麦面【买30送30#3C实发60包】送2瓶【0脂油醋汁】,好评,味道非常好，是我喜欢的口感，比较劲道，有咀嚼感，不是软趴趴的那种面条。618买60包才43元，每天早上来一包，算下来才投7角一包，简直营养健康又经济实惠。一直回购农夫慢家的健康饮食，爆赞。 ,-,-,2021-06-19
27,j**0,口味: 0脂免煮荞麦面【买5送5#3C实发10包】送【0脂油醋汁】,好评,不过很开心，能减肥嘛，希望有好的效果！n次来买了，实惠又划算，家人挺喜欢吃的，口感还不错，健康又好吃。最近都在减肥很精致，荞麦的！健身补给用的，日期很新鲜，配料很齐全也很安全 ,5分钟就可以搞定一碗美味0卡拌面，真的是简单中透露出不平凡！强烈推荐给想要减脂的小伙伴们！真是方便！面条筋道弹牙，口感相当不错，还会回购的！,-,2021-06-13
28,顾**悦,口味: 0脂免煮荞麦面【买5送5#3C实发10包】送【0脂油醋汁】,好评,发自肺腑的真实好评，面挺好吃的，比想象中好吃，哈哈，荞麦面不发胖，又可以减肥，真不错，马上回购一箱。就是收到有点碎，希望卖家发货稍微包得好一点。,-,-,2021-06-23
29,李**0,口味: 0脂免煮荞麦面【买5送5#3C实发10包】送【0脂油醋汁】,好评,非常好吃😋一口气吃完，连着吃了好几天，搭配香菜和老干妈味道绝绝子！ ,-,-,2021-06-21
30,l**2,口味: 0脂免煮荞麦面【买10送10#3C实发20包】送【0脂油醋汁】,好评,终于收到我需要的宝贝了，东西很好，价美物廉，谢谢掌柜的！说实在，这是我淘宝购物来让我最满意的一次购物。无论是掌柜的态度还是对物品，我都非常满意的。掌柜态度很专业热情，有问必答，回复也很快，我问了不少问题，他都不觉得烦，都会认真回答我，这点我向掌柜表示由衷的敬意，这样的好掌柜可不多。再说宝贝，正是我需要的，收到的时候包装完整，打开后让我惊喜的是，宝贝比我想象中的还要好！不得不得竖起大拇指。下次需要的时候我还会再来的，到时候麻烦掌柜给个优惠哦！别看小小一包真的很饱腹啊,-,-,2021-06-18
31,金**9,口味: 0脂免煮荞麦面【买5送5#3C实发10包】送【0脂油醋汁】,好评,太差了，❌❌❌收到碎的不说，主要面的味道太刺鼻，商家居然说是袋子的问题，暴晒的，康师傅方便面也暴晒怎么没有味道❌❌❌❌❌吃了肚子疼，✈️商家非常不负责任的说我搭配了别的食材，今天又煮了一包，居然还有洗洁精似的泡沫在里面，忘了拍照了，✈️真的怀疑是小作坊制作的❌❌🤮🤮🤮🤮🤮🤮🤮🤮太差了，这是食品安全问题，大家千万不要拍，太差劲了👎🏻👎🏻👎🏻👎🏻服务态度超级差❌客服太不负责了👎🏻👎🏻👎🏻👎🏻物流慢的一批，✈️不想说了，以后再也不买了，我只是说了自己的感受，只是为了提醒大家慎拍❌❌❌❌❌❌❌❌❌🤮🤮🤮🤮🤮🤮🤮🤮🤮🤮🤮🤮🤮🤮🤮🤮🤮🤮🤮🤮🤮🤮🤮🤮🤮🤮🤮千万不要拍,-,-,2021-06-17
32,l**n,口味: 0脂免煮荞麦面【买5送5#3C实发10包】送【0脂油醋汁】,好评,挺好吃的，而且也很划算，方便，用水泡一下就可以吃啦,-,-,2021-06-25
33,翊**a,口味: 0脂免煮荞麦面【买5送5#3C实发10包】送【0脂油醋汁】,好评,此用户没有填写评价。,还可以吃起来就是泡面  方便快捷 不用煮就能吃饭荞麦面 夜里加班不用吃碳水炸弹了。最简单的一个评论就是，每次收货都是非常愉快的，首先价格不错，质量不错，快递不错，物流挺快，老板不错，客服服务到位。,-,2021-06-24
34,t**9,口味: 0脂免煮荞麦面【买30送30#3C实发60包】送2瓶【0脂油醋汁】,好评,我是我们村第一一个在网上上买东西的人。这里大部分人是不网购的。他们买东西价格一般不超过五块，听说我在网上买东西后，整个村都震惊了，村长跑到我家里对我爸说我是不是疯了?说这日子没法过了，让我出去租房子住，面对重重压力， 我坚持要买。我不能扭扭捏捏那你呢举着它，骄傲的站在村口，他们就跳井， 吓得我赶紧收起宝贝，挤出人群落荒而逃。为测试我立刻去我们村高达100米山上村长家客厅里测试宝贝效果，用完后，在全村人羡慕的目光中，仰首挺胸扬长而去。  ,-,-,2021-06-19
35,猪**宝,口味: 0脂免煮荞麦面【买5送5#3C实发10包】送【0脂油醋汁】,好评,方便而且好吃！像方便面的口感，饱腹感很强！奈斯！ ,-,-,2021-06-22
36,m**2,口味: 0脂免煮荞麦面【买10送5#3C实发15包】[不送酱汁],好评,都快吃完了才想起评论，煮泡都行像方便面挺方便的，口感也不错，减肥期间下午就靠它了，面饼看起来不大吃起来挺顶饱,-,-,2021-06-22
37,乖**悦,口味: 0脂免煮荞麦面【买10送10#3C实发20包】送【0脂油醋汁】,好评,好吃，还比我从其他家买的热量低，吃完再回购。 ,-,-,2021-06-26
38,s**g,口味: 0脂免煮荞麦面【买5送5#3C实发10包】送【0脂油醋汁】,好评,非常惊艳 平时都是吃荞麦面条 第一次买荞麦泡面，方便口感Q弹，这么健康的泡面吃的很快乐！我更喜欢吃拌面，每次煮泡几分钟捞出拌上赠送的油醋汁 外加一些酱油 味道就非常好了。同事看我吃这个都求推荐～一包面加青菜再加一些肉和虾 健康美味还能减脂 发货超快。10包两周已经吃完 准备补货啦 口感味道：Q弹 新鲜度：很新鲜 胀包问题：没有这个问题 包装品质：包装整齐 ,好吃不贵 健康万岁 已补货强烈推荐,-,2021-06-11
39,t**2,口味: 0脂免煮荞麦面【买30送30#3C实发60包】[不送酱汁],好评,很爱吃，好煮，劲道，味道也可以 ,-,-,2021-06-25
40,y**6,口味: 0脂免煮荞麦面【买15送15#3C实发30包】送【0脂油醋汁】,好评,说好的好评返现。。。 整体评价：好 胀包问题：好 包装品质：好 口感味道：好 新鲜度：好 ,-,-,2021-06-25
41,始**3,口味: 0脂免煮荞麦面【买30送30#3C实发60包】[不送酱汁],好评,开水可以泡熟 喜欢吃硬一点的面 所以很符合胃口❤️ 面饼看着小 泡开后还是挺多的❤️ 自己加点佐料就可以吃了 很方便❤️ 饱腹感很强❤️ 最后必须要提一下 快递包装真的需要改进！！！ 外包装就简简单单一个纸箱子 收到货后外包装稀碎！！！💔 面的包装袋也是很多孔洞！！！💔 一！！！定！！！要！！！改！！！进！！！啊啊啊啊啊啊！！！💔 面确实不错 应该会回购 之后希望包装可以更好❤️,-,-,2021-06-13
42,t**4,口味: 0脂免煮荞麦面【买10送10#3C实发20包】送【0脂油醋汁】,好评,整体评价：好 胀包问题：好 包装品质：好 口感味道：好 新鲜度：好 ,-,-,2021-06-24
43,t**8,口味: 0脂免煮荞麦面【买10送5#3C实发15包】[不送酱汁],好评,还不错，跟方便面差不多，泡了三分钟拿来做焖面，也不会软烂，很筋道，不错 ,-,-,2021-06-15
44,多**a,口味: 0脂免煮荞麦面【买5送5#3C实发10包】送【0脂油醋汁】,好评,确实不是很好吃，但在我接受范围内，本来就是想要找个健康一点做起来快一点的速食产品，搭配烤鸡蛋圣女果三分钟做完就能吃了，下次想试试荞麦面皮 ,-,-,2021-06-23
45,h**1,口味: 0脂免煮荞麦面【买10送10#3C实发20包】送【0脂油醋汁】,好评,口感不错，味道也挺好，开水泡一泡就行，很方便 ,-,-,2021-06-16
46,我**妍,口味: 0脂免煮荞麦面【买10送5#3C实发15包】[不送酱汁],好评,好吃又好煮，不会很软很烂。有弹性，很好吃的，一包的量刚好合适 ,-,-,2021-06-15
47,o**4,口味: 0脂免煮荞麦面【买30送30#3C实发60包】送2瓶【0脂油醋汁】,好评,荞麦方便面，口感不错，很好吃，价格也实惠，物流很快。 ,-,-,2021-06-15
48,s**e,口味: 0脂免煮荞麦面【买15送15#3C实发30包】[不送酱汁],好评,荞麦面不错 泡一会儿就可以吃了 而且泡开后不是软糟糟的那种 这点我很喜欢 比我上次买的荞麦面要劲道一点,-,-,2021-06-24
49,x**7,口味: 0脂免煮荞麦面【买10送10#3C实发20包】送【0脂油醋汁】,好评,东西还没吃，但是这个包装特糟心，都烂散架了。,-,-,2021-06-23
50,t**1,口味: 0脂免煮荞麦面【买10送10#3C实发20包】送【0脂油醋汁】,好评,味道说不上好吃，但是这个价格还算实惠 ,-,-,2021-06-22
51,美**我,口味: 0脂免煮荞麦面【买15送15#3C实发30包】[不送酱汁],好评,水煮开后，趁着锅的余热倒橄榄油，拌一拌，放点0脂牛肉酱和油醋汁，绝了！好好吃！不比泡面差！  ,-,-,2021-06-17
52,刘**1,口味: 0脂免煮荞麦面【买5送5#3C实发10包】送【0脂油醋汁】,好评,荞麦面收到，还没有吃，好像很不错，夏天来涼拌黄瓜🥒很好哦，希望能回购。,-,-,2021-05-31
53,t**2,口味: 0脂免煮荞麦面【买5送5#3C实发10包】送【0脂油醋汁】,好评,超級公仔面 真的沒分別 刷脂沒問題 一定會回購     下次給我便宜一點好嗎🙏🙏🙏🙏🙏,-,-,2021-06-25
54,v**8,口味: 0脂免煮荞麦面【买30送30#3C实发60包】送2瓶【0脂油醋汁】,好评,面好好吃，饱腹感也很强！ 油醋汁味道也十分好，赞！ 就是以后店家的纸箱包装好点，来到箱都爆开了！好在面没有丢了 ,-,-,2021-06-24
55,属**娆,口味: 0脂免煮荞麦面【买5送5#3C实发10包】送【0脂油醋汁】,好评,刚拿到的时候觉得好小一包肯定不够吃，所以一次煮了两包，放了一点黄瓜丝家手撕鸡，结果我和老公两个人都没吃完2包，看起来小小的，其实煮出来特别多。真是神奇的面包，特别棒。 ,-,-,2021-06-23
56,t**1,口味: 0脂免煮荞麦面【买5送5#3C实发10包】送【0脂油醋汁】,好评,看着很小，煮出来还是挺多的，够一个人吃了，挺划算的。,-,-,2021-06-22
