数据下载时间：2021-06-30 14:30:17 功能：看店宝【https://kandianbao.com/】 宝贝评价信息分析 相关查询网址：https://kandianbao.com/item/pingjia/626321767139/,,,,,,,
序号,评价用户,sku,评价类型,评价内容,追评,掌柜回评,评价时间
1,大**哒,口味: 4袋畅享装（共计36根，4大袋）,好评,做工非常精细﻿，好像比我在食品店里面买的味道好些﻿，一直比较喜欢吃鸡肉肠，包装很完整﻿，我觉得很nice啊﻿，双汇的香肠一直觉得是不错的﻿，搞活动真的好便宜，物流真的很快，给小哥點个赞👍，可以煎可以烤，平时外面一包都要十块钱了，生产日期也很新鲜，包装可以的*#. ,看这里↓↓↓性价比超高，值得推荐！,-,2021-06-25
2,w**8,口味: 4袋畅享装（共计36根，4大袋）,好评,产品收到啦，包装完美没有破损，打开一看很好的，以后会再买吧 ,-,-,2021-06-25
3,女**7,口味: 4袋畅享装（共计36根，4大袋）,好评,很不错，好吃也划算，可以 ,-,-,2021-06-24
4,说**c,口味: 4袋畅享装（共计36根，4大袋）,好评,"东西很好,价美物廉,谢谢掌柜的!说实在，这是我淘宝购物购物。无论态度还是对物品，我都非常满意的态度很专业热情，有问必答，再说宝贝,正是我需要的,收到的时候包装完整,打开后让我惊喜的是，宝贝比我想象中的还要好！不得不得竖起大拇指。 ",-,-,2021-06-25
5,那**下,口味: 4袋畅享装（共计36根，4大袋）,好评,整体评价：值得买 包装品质：完好无损 口感味道：好吃，美味 新鲜度：新鲜 ,-,-,2021-06-26
6,t**2,口味: 4袋畅享装（共计36根，4大袋）,好评,妙啊 哈哈哈哈哈哈哈哈哈哈哈哈 久违的味道 包装很完整，没有破损。迫不及待的拆开，发现完全超乎我的想象，入手以后竟然这么顺滑，没有一点褶皱，这种柔顺，一摸，就知道是我想要的。插入耳机插孔的时候，没有任何阻碍，一***，尽显我真男人本色。戴上耳机，听到 嗨啦 酷狗，我的心已经如痴如醉，整个世界没有了别的声音。顺利点开我最爱听的AV8D摇起来，尽情徜徉在音乐的海洋，我的能量，超乎你的想象。 ,-,-,2021-06-17
7,t**2,口味: 4袋畅享装（共计36根，4大袋）,好评,不错，好吃，四包呢 ,-,-,2021-06-17
8,z**5,口味: 4袋畅享装（共计36根，4大袋）,好评,整体评价：好 胀包问题：好 包装品质：好 口感味道：好 新鲜度：好 ,-,-,2021-06-21
9,二**b,口味: 4袋畅享装（共计36根，4大袋）,好评,香肠细长，淀粉味十足，鸡肉很少。便宜是真便宜。over ,-,-,2021-06-23
10,z**5,口味: 4袋畅享装（共计36根，4大袋）,好评,整体评价：了 胀包问题：管 包装品质：管 口感味道：管 新鲜度：了 ,-,-,2021-06-21
11,t**9,口味: 4袋畅享装（共计36根，4大袋）,好评,包装很贴心，物流真的很快，给小哥點个赞👍，口感不错肉质嫩，价格实惠，可以煎可以烤，口感真的不错。  ,-,-,2021-06-22
12,我**王,口味: 4袋畅享装（共计36根，4大袋）,好评, 活动十来块买了四包，贼划算，平时外面一包都要十块钱了，煮面必备配料，生产日期也很新鲜，都是这个月生产……商家发货很快，物流给力赞👍赞👍赞👍 ,-,-,2021-06-22
13,草**夏,口味: 4袋畅享装（共计36根，4大袋）,好评,还没吃，便宜就买啦，包装很好，日期很新鲜，吃过回来追评 ,-,-,2021-06-24
14,t**2,口味: 4袋畅享装（共计36根，4大袋）,好评,整体评价：一般般整体来说不错，价格便宜，物美价廉！以后有机会再来购买！五星好评！ 胀包问题：没有问题？，包装可以的！ 口感味道：口感不错！双汇还是挺好的👌 ,-,-,2021-06-17
15,w**胜,口味: 4袋畅享装（共计36根，4大袋）,好评,真是小巧玲珑，吃着挺怪的，鸡肉肠，面糊糊的，不大喜欢了，618便宜，，，，，，，，，，，，，，,-,-,2021-06-26
16,t**1,口味: 4袋畅享装（共计36根，4大袋）,好评,挺好挺划算，也挺好吃。咸的 终于收到我需要的宝贝了，东西很好，价美物廉，谢谢掌柜的！说实在，这是我淘宝购物购物。无论态度还是对物品，我都非常满意的态度很专业热情，有问必答，再说宝贝，正是我需要的，收到的时候包装完整，打开后让我惊喜的是，宝贝比我想象中的还要好！不得不得竖起大拇指。 ,-,-,2021-06-21
17,薇**5,口味: 4袋畅享装（共计36根，4大袋）,好评,挺好吃的，东西很喜欢，质量也很好的，这个价格能买到是真的很划算。,-,-,2021-06-25
18,守**爱,口味: 4袋畅享装（共计36根，4大袋）,好评,整体评价：包装很好，物流很快，味道跟超市买的一样，日期新鲜，还会回购， ,-,-,2021-06-23
19,京**4,口味: 4袋畅享装（共计36根，4大袋）,好评,多少有点细，，也就便宜一些，味道还行 ,-,-,2021-06-22
20,t**0,口味: 4袋畅享装（共计36根，4大袋）,好评,买着寄家里的，到货很快 ,-,-,2021-06-26
21,落**雨,口味: 4袋畅享装（共计36根，4大袋）,好评,给大家看一下有多迷你，平时吃的那种大小要两根，真是够迷你 ,-,-,2021-06-23
22,重**酱,口味: 4袋畅享装（共计36根，4大袋）,好评,好吃 我都是当零食解馋的 吃起来也很快 炒饭里边也可以放就是了 要是王中王那种我喜欢微波炉转一分钟吃 新鲜度：日期新鲜 胀包问题：没有问题 ,-,-,2021-06-21
23,v**姐,口味: 4袋畅享装（共计36根，4大袋）,好评,没仔细看，我以为是包装膜上有画只鸡的那一款。整体还不错，生吃比较好吃，煮在麻辣烫里面淀粉口感比较重 ,-,-,2021-06-26
24,我**上,口味: 4袋畅享装（共计36根，4大袋）,好评,还可以吧，零食那个，比较便宜，有点咸 ,-,-,2021-06-26
25,欧**虞,口味: 4袋畅享装（共计36根，4大袋）,好评,😥好似买多了，这吃到什么时候啊！你们赶紧吃啊！看起来很不错的样子，吧唧吧唧！ ,-,-,2021-06-22
26,t**0,口味: 4袋畅享装（共计36根，4大袋）,好评,已经吃了一半了，双汇还是可以信赖，吃的放心配泡面yyds，价格便宜,-,-,2021-06-26
27,a**4,口味: 4袋畅享装（共计36根，4大袋）,好评,整体评价：很满意 胀包问题：没有 包装品质：合唱是一样 口感味道：非常好 新鲜度：新鲜 ,-,-,2021-06-24
28,t**9,口味: 4袋畅享装（共计36根，4大袋）,好评,官方旗舰店比较放心，活动买的很划算，买了四包 ,-,-,2021-06-22
29,一**e,口味: 4袋畅享装（共计36根，4大袋）,好评,口感味道：单吃有点咸了，不晓得是不是放多了盐。。 ,-,-,2021-06-26
30,c**2,口味: 4袋畅享装（共计36根，4大袋）,好评,搞活动真的好便宜，拿来当零嘴吃的，跟超市卖得一模一样，但是这里更便宜这个价钱还要怎么自行车啊冲啊￼￼ ,-,-,2021-06-18
31,二**猪,口味: 4袋畅享装（共计36根，4大袋）,好评,整体评价：还好 有点细 胀包问题：没有鼓包 包装品质：挺好的 口感味道：稍微有点咸了 新鲜度：还可以 ,-,-,2021-06-26
32,h**h,口味: 4袋畅享装（共计36根，4大袋）,好评,很划算，618买的4大包36根，物美价廉 ,-,-,2021-06-22
33,流**尚,口味: 4袋畅享装（共计36根，4大袋）,好评,物流很快，我问客服什么时候到，客服说马上发货，和我想象的一样快。颜色和图片上一样，没有色差，我还担心收到货之后有色差或者是质量不好，宝贝真心不错，与图片相符，没有任何差异，真的是物超所值，物美价廉啊，可以入手，这家店信誉不错。 ,-,-,2021-06-26
34,何**仙,口味: 4袋畅享装（共计36根，4大袋）,好评,618搞活动还是很划算的，囤货了。 ,-,-,2021-06-25
35,x**3,口味: 4袋畅享装（共计36根，4大袋）,好评,这个颜色很喜欢，摸起来质感不错，百搭～包装也很大气，用来送人的话也是不错的选择,-,-,2021-06-24
36,l**起,口味: 4袋畅享装（共计36根，4大袋）,好评,日期新鲜，包装完好，口味正常，价格便宜。用来配牛奶，我觉得很nice啊。刚买回来就被室友抢了一包去吃了 ,-,-,2021-06-17
37,太**0,口味: 4袋畅享装（共计36根，4大袋）,好评,味道还不错，吃腻了猪肉的，换一换鸡肉的也不错！ ,-,-,2021-06-25
38,秀**1,口味: 4袋畅享装（共计36根，4大袋）,好评,从小吃到大的火腿肠，平时没事可以吃一根，可以泡面，也可以炒菜，活动价也很划算 ,-,-,2021-06-17
39,t**4,口味: 4袋畅享装（共计36根，4大袋）,好评,活动价格很实惠的，鸡肉肠还是挺好吃的。,-,-,2021-06-23
40,t**4,口味: 4袋畅享装（共计36根，4大袋）,好评,发货很快啊，已经收到了，日期新鲜，价格实惠，不错 ,-,-,2021-06-23
41,希**贝,口味: 4袋畅享装（共计36根，4大袋）,好评,很好吃哦、不过现在也可以看到这么一天你也早点回来哦、在一起的时候我们才看到电话给他们带来什么的最不应该在工作时不可以做朋友了。我的生活是自己选择放弃我抓紧这个世界上有多强大！我的人生就这么大了！我想知道什么样都能解决的问题！好好用电脑的时间里所有物品和我们之间所有东西都有不同需求。嗯！你就这样结束我们,-,-,2021-06-15
42,海**5,口味: 4袋畅享装（共计36根，4大袋）,好评,活动的时候买的特别划算，特别优惠，味道也挺好的，希望下次继续有这样子的活动。 ,-,-,2021-06-15
43,令**狐,口味: 4袋畅享装（共计36根，4大袋）,好评,口感味道：咸，而且全是淀粉，很难吃！ 真的不建议购买！！不管什么价格！ ,-,-,2021-06-26
44,z**0,口味: 4袋畅享装（共计36根，4大袋）,好评,很细，味道还行。 ,-,-,2021-06-22
45,盛**e,口味: 4袋畅享装（共计36根，4大袋）,好评,感觉还挺多，划算！,-,-,2021-06-23
46,丫**兔,口味: 4袋畅享装（共计36根，4大袋）,好评,活动价买的很实惠。很纤细的一根。味道偏咸。不过吃一根很不过瘾，会一口气吃好几根。 ,-,-,2021-06-23
47,t**4,口味: 4袋畅享装（共计36根，4大袋）,好评,比起超市便宜多了,-,-,2021-06-23
48,刘**6,口味: 4袋畅享装（共计36根，4大袋）,好评,618活动买的，东西很不错👍🏻,-,-,2021-06-26
49,少**t,口味: 4袋畅享装（共计36根，4大袋）,好评,一直想买火腿肠 这个还不错 然后在旗舰店买的味道好像还可以的 好像比我在食品店里面买的味道好些 一次买了四袋 应该还能吃蛮久了 ,-,-,2021-06-19
50,情**情,口味: 4袋畅享装（共计36根，4大袋）,好评,非常实惠 ,-,-,2021-06-21
51,t**5,口味: 4袋畅享装（共计36根，4大袋）,好评,价格很划算 比在超市买的便宜,-,-,2021-06-25
52,楼**i,口味: 4袋畅享装（共计36根，4大袋）,好评,用了优惠券买的，超级划算，没有胀包的问题，家里小朋友喜欢吃油炸鸡肉肠，这个正好 ,-,-,2021-06-24
53,h**a,口味: 4袋畅享装（共计36根，4大袋）,好评,口感味道：都是粉子跟宣传的一点不相符，打来吃了没法退，已确认收货 ,-,-,2021-06-26
54,t**2,口味: 4袋畅享装（共计36根，4大袋）,好评,好吃又实惠，钟爱鸡肉肠 整体评价：满意 胀包问题：无 包装品质：包装很好 ,-,-,2021-06-17
55,j**1,口味: 4袋畅享装（共计36根，4大袋）,好评,双汇的香肠一直觉得是不错的 所以这次赶上活动有买了一组 可以带到公司 饿了可以垫垫肚子😄 ,-,-,2021-06-15
56,m**i,口味: 4袋畅享装（共计36根，4大袋）,好评,味道赞👍 价廉物美 ,-,-,2021-06-21
57,t**8,口味: 4袋畅享装（共计36根，4大袋）,好评,味道还行，主要是看活动便宜买的，单根有点小。 ,-,-,2021-06-23
58,t**0,口味: 4袋畅享装（共计36根，4大袋）,好评,一次买了4包，快递很快，日期人最近的，价格美丽，不错,-,-,2021-06-26
59,t**9,口味: 4袋畅享装（共计36根，4大袋）,好评,活动19.9买了四包，日期新鲜发货很快，双汇火腿肠,-,-,2021-06-22
60,q**8,口味: 4袋畅享装（共计36根，4大袋）,好评,整体评价：很好吃啊 口感味道：有事没事啃一个，已经吃完了 ,-,-,2021-06-26
61,l**6,口味: 4袋畅享装（共计36根，4大袋）,好评,四大包，还不错 ,-,-,2021-06-24
62,于**欢,口味: 4袋畅享装（共计36根，4大袋）,好评,东西很便宜，可以多吃几根 ,-,-,2021-06-10
63,毕**言,口味: 4袋畅享装（共计36根，4大袋）,好评,整体评价：很不错 包装品质：完整 口感味道：鸡肉肠很好吃 ,-,-,2021-06-25
64,季**3,口味: 4袋畅享装（共计36根，4大袋）,好评,喜欢吃一次性多买点，价格便宜，和超市买的味道一样但是比超市便宜很多！,-,-,2021-06-26
65,欣**往,口味: 4袋畅享装（共计36根，4大袋）,好评,宝贝收到了，和描述一样，很喜欢 ,-,-,2021-06-21
66,帅**啊,口味: 4袋畅享装（共计36根，4大袋）,好评,非常棒，6.13号的日期，超级新鲜,-,-,2021-06-26
67,b**c,口味: 4袋畅享装（共计36根，4大袋）,好评,快递不按地址派送，设置了不放菜鸟驿站，还是把件往菜鸟驿站送，到了好几天也不给派件，最后只能自己去取，火腿肠跟小手指一样细，吃的时候不好开 ,-,-,2021-06-24
68,地**海,口味: 4袋畅享装（共计36根，4大袋）,好评,真好吃！还便宜！屯粮专用,-,-,2021-06-24
69,t**1,口味: 4袋畅享装（共计36根，4大袋）,好评,挺好吃的，就是这种淀粉肠的味道，加一点肉我都不喜欢吃。,-,-,2021-06-21
70,t**8,口味: 4袋畅享装（共计36根，4大袋）,好评,挺好吃的，蛋炒饭必备神器。,-,-,2021-06-23
71,s**子,口味: 4袋畅享装（共计36根，4大袋）,好评,这次是回购啦！买给我弟的，他说不错👌平常当作小零食还不错嘻嘻 ,-,-,2021-06-26
72,前**。,口味: 4袋畅享装（共计36根，4大袋）,好评,物流很快，超便宜，不过很细，一口一根，哈哈哈 ,-,-,2021-06-21
73,我**u,口味: 4袋畅享装（共计36根，4大袋）,好评,好评，“我通过我的灵魂与肉体得知，堕落乃为必需。我必然经历贪欲，我必然去追逐财富，体验恶心，陷于绝望的深渊。学会热爱这个世界，不再以某种欲望与臆想出来的世界、某种虚伪的完善的幻想来与之比较。学会接受这个世界的本来面目，热爱它，以归属于它而心存欣喜。”,-,-,2021-06-24
74,梅**3,口味: 4袋畅享装（共计36根，4大袋）,好评,双汇的火腿肠，超好吃，价格也优惠，买给小孩泡面搭配的，很好,-,-,2021-06-20
75,t**0,口味: 4袋畅享装（共计36根，4大袋）,好评,整体评价：整体蛮不错的！就是好小只哦﻿⊙∀⊙！ 胀包问题：没有问题 包装品质：包装蛮不错 口感味道：还是原来鸡肉肠的味道！和超市一个味儿！ 新鲜度：蛮新鲜！喜欢！ ,-,-,2021-06-26
76,t**3,口味: 4袋畅享装（共计36根，4大袋）,好评,花了十二购买了四包火腿，价格合适，就是每根火腿略小 ,-,-,2021-06-25
77,偷**柔,口味: 4袋畅享装（共计36根，4大袋）,好评,刚好做活动，价格便宜了很多，性价比超高，真的特别划算,-,-,2021-06-24
78,m**s,口味: 4袋畅享装（共计36根，4大袋）,好评,虽然价格不贵。但是好袖珍呢。儿子一顿饭吃完四袋 ,-,-,2021-06-21
79,w**4,口味: 4袋畅享装（共计36根，4大袋）,好评,这个肠好细啊，以前没吃过，味道还行，应该都一样的,-,-,2021-06-24
80,t**3,口味: 4袋畅享装（共计36根，4大袋）,好评,很小很细一根，味道就是正常的鸡肉肠，活动买还可以呀了，原价不划算 ,-,-,2021-06-22
81,吴**1,口味: 4袋畅享装（共计36根，4大袋）,好评,火腿肠收到，还是一样的味道，真的好迷你。 ,-,-,2021-06-22
82,唐**5,口味: 4袋畅享装（共计36根，4大袋）,好评,鸡肉肠收到，双汇大品牌，已经开吃，好吃，和外面商超口感一样。 ,-,-,2021-06-22
83,s**p,口味: 4袋畅享装（共计36根，4大袋）,好评,   口感味道：美味可口 实惠量多，值得购买。 ,-,-,2021-06-22
84,t**9,口味: 4袋畅享装（共计36根，4大袋）,好评,很实惠 第二次购买 泡面最佳搭档 味道很棒 推荐购买 ,-,-,2021-06-22
85,无**f,口味: 4袋畅享装（共计36根，4大袋）,好评,早上一起煎蛋吃不用放盐味道挺咸了 ,-,-,2021-06-25
86,t**5,口味: 4袋畅享装（共计36根，4大袋）,好评,收到了，先说商品质量:产品总体不错，包装严实。再说商家服务:点赞啦。最后点评快递:发货很快。其他就是感谢店家打折送券活动，毕竟便宜好货更实在。希望店家多多优惠,-,-,2021-06-26
87,t**2,口味: 4袋畅享装（共计36根，4大袋）,好评,包装精美，一根的量刚刚好，好吃美味 ,-,-,2021-06-17
88,t**1,口味: 4袋畅享装（共计36根，4大袋）,好评,整体评价：价格便宜 包装品质：简单 口感味道：还行 新鲜度：近期 ,-,-,2021-06-21
89,你**要,口味: 4袋畅享装（共计36根，4大袋）,好评,还不错  就是稍微细了点   口感味道也不错 ,-,-,2021-06-19
90,闯**家,口味: 4袋畅享装（共计36根，4大袋）,好评,是正品，和实体店一样，价格还优惠，果断转粉,-,-,2021-06-25
91,瓶**子,口味: 4袋畅享装（共计36根，4大袋）,好评,正品，跟以前吃过的一样！实惠 ,-,-,2021-06-21
92,言**i,口味: 4袋畅享装（共计36根，4大袋）,好评,非常值得信赖的品牌，质量有保障，价格还亲民，相当满意,-,-,2021-06-21
93,街**亮,口味: 4袋畅享装（共计36根，4大袋）,好评,包装完好，日期也比较新，用来炒菜、泡面妥妥的。 ,-,-,2021-06-17
94,帅**9,口味: 4袋畅享装（共计36根，4大袋）,好评,媳妇吵着要吃，我都不明白这有什么可吃的。。。但凡带一点肉我都不至于这么抗拒它 ,-,-,2021-06-26
95,安**笑,口味: 4袋畅享装（共计36根，4大袋）,好评,火腿肠很好吃，一直吃这个牌子的，很好吃，价格也很实惠。只是基本没啥肉，不过这个价格也挺实惠的了。 ,-,-,2021-06-24
96,t**4,口味: 4袋畅享装（共计36根，4大袋）,好评,口感味道：还可以 新鲜度：挺新鲜，6月产的 ,-,-,2021-06-23
97,琴**话,口味: 4袋畅享装（共计36根，4大袋）,好评,物流很快，很快就到了，日期新鲜 很实惠 ,-,-,2021-06-25
98,t**2,口味: 4袋畅享装（共计36根，4大袋）,好评,整体评价：用的满减优惠券下单购买的，花了几块钱，今天收到货就是火腿肠比较细的一根，吃起来味道还不错！ ,-,-,2021-06-17
99,x**8,口味: 4袋畅享装（共计36根，4大袋）,好评,(๑•̀ㅂ•́)و✧价格超优惠，性能也非常棒，完美的一次购物,-,-,2021-06-23
100,凤**阁,口味: 4袋畅享装（共计36根，4大袋）,好评,完美，产品很惊艳，性价比合适，希望用的长久！ ,-,-,2021-06-21
101,y**6,口味: 4袋畅享装（共计36根，4大袋）,好评,得物弄免单 ,-,-,2021-06-26
102,浅**啦,口味: 4袋畅享装（共计36根，4大袋）,好评,整体评价：比超市的小很多很多，没仔细看就买了 胀包问题：无 口感味道：偏咸 ,-,-,2021-06-25
103,o**5,口味: 4袋畅享装（共计36根，4大袋）,好评,整体评价：好 胀包问题：没有 包装品质：可以 口感味道：好吃 新鲜度：没过期 ,-,-,2021-06-20
104,t**2,口味: 4袋畅享装（共计36根，4大袋）,好评,老牌子，便宜实惠,-,-,2021-06-17
105,我**霞,口味: 4袋畅享装（共计36根，4大袋）,好评,12块钱买的哦 ,-,-,2021-06-22
106,小**4,口味: 4袋畅享装（共计36根，4大袋）,好评,非常便宜，味道不错，几天就吃完了 ,-,-,2021-06-26
107,勋**灿,口味: 4袋畅享装（共计36根，4大袋）,好评,这火腿肠也太迷你了，不过这价格确实很便宜，迷你火腿肠,-,-,2021-06-22
108,数**1,口味: 4袋畅享装（共计36根，4大袋）,好评,蛮实惠的，淀粉肠永远的神,-,-,2021-06-22
109,阿**拉,口味: 4袋畅享装（共计36根，4大袋）,好评,"包装品质：质量非常好，与卖家描述的完全一致，非常满意,真的很喜欢，完全超出期望值，发货速度非常快，包装非常仔细、严实，物流公司服务态度很好，运送速度很快，很满意的一次购物质量很好，希望更多的朋友信赖．店主态度特好，我会再次光顾的，我带朋友来你家买。不好意思评价晚了，非常好的店家，东西很欢！买来这个是送人的她很喜欢卖家的贴心让我感到很温暖。很热情的卖家，下次还来希望下次还有机会合作祝你生意兴隆质量非常好真出乎我的意料包装非常仔细非常感谢。祝生意兴隆！ ",-,-,2021-06-19
110,小**丞,口味: 4袋畅享装（共计36根，4大袋）,好评,味道还可以，配泡面一起吃，挺实惠 ,-,-,2021-06-20
111,t**8,口味: 4袋畅享装（共计36根，4大袋）,好评,商品符合描述，主要是活动便宜，能省很多钱,-,-,2021-06-22
112,欣**胡,口味: 4袋畅享装（共计36根，4大袋）,好评,宝贝收到了和描述的一样宝贝质量超级棒没有瑕疵宝贝口味不错很好吃还会再来的祝生意兴隆,-,-,2021-06-15
113,风**苏,口味: 4袋畅享装（共计36根，4大袋）,好评,整体评价：很好 胀包问题：无 包装品质：好 口感味道：好吃，一天一袋 新鲜度：很好 ,-,-,2021-06-17
114,许**0,口味: 4袋畅享装（共计36根，4大袋）,好评,好吃的 十多块四袋便宜 ,-,-,2021-06-19
115,j**i,口味: 4袋畅享装（共计36根，4大袋）,好评,整体评价：好吃，跟超市卖的一样 ,-,-,2021-06-24
116,颜**郎,口味: 4袋畅享装（共计36根，4大袋）,好评,很好吃，收到当天就吃了一袋子下次还会回购的,-,-,2021-06-23
117,蛋**儿,口味: 4袋畅享装（共计36根，4大袋）,好评,有点小支，吃着还行 便宜,-,-,2021-06-24
118,t**0,口味: 4袋畅享装（共计36根，4大袋）,好评,非常实惠，味道也好,-,-,2021-06-26
119,美**2,口味: 4袋畅享装（共计36根，4大袋）,好评,一般感觉不是纯鸡肉的有淀粉,-,-,2021-06-26
120,冰**9,口味: 4袋畅享装（共计36根，4大袋）,好评,不错，挺好吃的 ,-,-,2021-06-21
121,南**o,口味: 4袋畅享装（共计36根，4大袋）,好评,实惠的，虽然每根都很细但是多啊 ,-,-,2021-06-22
122,t**0,口味: 4袋畅享装（共计36根，4大袋）,好评,还挺多的哈哈，每次煮螺蛳粉都放进去。 适合煮，直接吃不是很好吃 ,-,-,2021-06-26
123,w**5,口味: 4袋畅享装（共计36根，4大袋）,好评,味道很好，就是有点细，跟小手指头差不多。不过这价格也可以了，物美价廉。新鲜度:棒棒哒包装品质:非常好口感味道:正!味道还不错，没有过期，挺划算的嫩嫩的，有很好吃!!经济实惠又美味，会继续回购的。  评论 △有用 ,特别好吃 下次还会买的,-,2021-06-22
124,t**6,口味: 4袋畅享装（共计36根，4大袋）,好评,不错不错，到货很快的，包装也很好 ,-,-,2021-06-15
125,z**6,口味: 4袋畅享装（共计36根，4大袋）,好评,口感味道：这**肉肠不好吃，😣建议买双汇其它的火腿肠，包装挺严实的，没有什么质量的问题。就是这个火腿肠不好吃。 ,-,-,2021-06-23
126,自**e,口味: 4袋畅享装（共计36根，4大袋）,好评,以前一直都是在实体店买，这次选择了网上买，不光是正品，价格还实惠！,-,-,2021-06-20
127,t**8,口味: 4袋畅享装（共计36根，4大袋）,好评,一股子淀粉味，还很咸，个人觉得不好吃 ,-,-,2021-06-26
128,w**n,口味: 4袋畅享装（共计36根，4大袋）,好评,很划算，很好吃，当零食吃了,-,-,2021-06-23
129,不**去,口味: 4袋畅享装（共计36根，4大袋）,好评,本想618再买的 可惜江苏没货了。折扣很好很划算。 ,-,-,2021-06-24
130,王**足,口味: 4袋畅享装（共计36根，4大袋）,好评,宝贝超级棒！美味可口！,-,-,2021-06-22
131,t**2,口味: 4袋畅享装（共计36根，4大袋）,好评,包装精美，物流超快，价格实惠，好评！,-,-,2021-06-17
132,t**1,口味: 4袋畅享装（共计36根，4大袋）,好评,量多实惠好吃 ,-,-,2021-06-21
133,何**9,口味: 4袋畅享装（共计36根，4大袋）,好评,还行吧，很小一根的，价格便宜。 ,-,-,2021-06-25
134,t**9,口味: 4袋畅享装（共计36根，4大袋）,好评,挺好吃的，11块多抢了四袋，炒面煮面搭配都OK ,-,-,2021-06-22
135,麋**塞,口味: 4袋畅享装（共计36根，4大袋）,好评,是很细很细的那种 好在味道不错 ,-,-,2021-06-21
136,t**0,口味: 4袋畅享装（共计36根，4大袋）,好评,火腿肠没有质量问题，但是单独吃就很咸 ,-,-,2021-06-26
137,t**7,口味: 4袋畅享装（共计36根，4大袋）,好评,特别特别特别好，没有任何破损的地方，外观也好看，好评！,-,-,2021-06-23
138,乘**3,口味: 4袋畅享装（共计36根，4大袋）,好评,挺好，价格很便宜，味道也不错 ,-,-,2021-06-21
