1561,z**9,口味: 经典原味（碱性24瓶）,好评,此用户没有填写评价。,喝了20天，每天两瓶，一点都没用,-,2021-04-07
1562,s**亚,口味: 经典原味（碱性24瓶）,好评,快递不打电话 直接送到快递柜 真想投诉他,-,-,2021-04-03
1563,星**淘,口味: 加葡萄糖酸锌（碱性24瓶）,好评,经常喝，很不错。趁着搞活动，又囤了一些 ,-,-,2021-01-05
1564,x**9,口味: 经典原味（碱性24瓶）,好评,很好喝，不错，送了12瓶，送的也很好喝。还会回购。 ,-,-,2021-01-15
1565,n**鬼,口味: 经典原味（碱性24瓶）,好评,很好喝，就是感觉有点贵,-,-,2021-04-07
1566,湘**紫,口味: 清新薄荷味（碱性24瓶）,好评, 挺好的，小包装，方便鞋带 ,-,-,2021-01-14
1567,s**i,口味: 经典原味（碱性24瓶）,好评,说实话 觉得不好喝。。。。。。。,-,-,2021-04-19
1568,h**o,口味: 经典原味（碱性24瓶）,好评,没有气泡，还是甜的，难喝,-,-,2021-04-14
1569,静**园,口味: 经典原味（碱性24瓶）,好评,垃圾快递，我指定不要圆通，中通，卖家说指定不了，不送上门，让我自己去扛回来！,-,-,2021-04-05
1570,老**松,口味: 清新薄荷味（碱性24瓶）3月新货,好评,此用户没有填写评价。,产品一小错还回在回购的！！！,-,2021-04-17
1571,b**3,口味: 经典原味（碱性24瓶）,好评,味道不太习惯，真心话,-,-,2021-04-20
1572,罗**院,口味: 经典原味（碱性24瓶）,好评,微微的甜，不喜欢这个口味 ,-,-,2021-04-07
1573,h**r,口味: 经典原味（碱性24瓶）,好评,味道不错，就是有点甜。,-,-,2021-04-06
1574,沙**叔,口味: 经典原味（碱性24瓶）,好评,很喜欢喝的一款苏打水 ,-,-,2021-01-15
1575,c**6,口味: 经典原味（碱性24瓶）,好评,口感味道：略微有点甜， ,-,-,2021-04-16
1576,雪**刘,口味: 经典原味（碱性24瓶）,好评,产品不错，差评是给物流的，不送货上门,-,-,2021-04-06
1577,s**n,口味: 经典原味（碱性24瓶）,好评,此用户没有填写评价。,甜得一批！根本不能喝,-,2021-06-21
1578,一**4,口味: 经典原味（碱性24瓶）,好评,还是挺甜的，不知道是什么 ,-,-,2021-04-13
1579,风**9,口味: 经典原味（碱性24瓶）,好评,很好，是正品，已多次购买了,-,-,2021-01-16
1580,s**r,口味: 经典原味（碱性24瓶）,好评,价格高了,-,-,2021-04-13
1581,别**真,口味: 经典原味（碱性24瓶）,好评,挺好的就是有点小贵,-,-,2021-04-08
1582,夏**9,口味: 经典原味（碱性24瓶）,好评,太甜了太甜了，孕妇还是少喝,-,-,2021-04-05
1583,楠**8,口味: 经典原味（碱性24瓶）,好评,比超市进货贵哈哈哈哈😂 ,-,-,2021-04-09
1584,泪**泪,口味: 经典原味（碱性24瓶）,好评,此用户没有填写评价。,难喝！！！还是巴黎水好喝,-,2021-04-06
1585,b**n,口味: 经典原味（碱性24瓶）,好评,口味不好，居然是甜的,-,-,2021-04-12
1586,a**沫,口味: 经典原味（碱性24瓶）,好评,还没喝，不过应该不错 ,-,-,2021-04-08
1587,t**2,口味: 加葡萄糖酸锌（碱性24瓶）,好评,相信品牌，还会关注。 ,-,-,2021-01-13
1588,t**0,口味: 经典原味（碱性24瓶）,好评,快递都不联系人直接扔丰巢柜,-,-,2021-06-16
1589,妆**1,口味: 经典原味（碱性24瓶）,好评,这么重居然还不送货上门,-,-,2021-04-06
1590,永**2,口味: 经典原味（碱性24瓶）,好评,口感味道：有点甜 ,-,-,2021-04-11
1591,玮**6,口味: 经典原味（碱性24瓶）,好评,不喜欢这个口味 ,-,-,2021-04-11
1592,渺**森,口味: 经典原味（碱性24瓶）,好评,东西是好东西，快递不是好快递,-,-,2021-04-15
1593,舞**媚,口味: 经典原味（碱性24瓶）,好评,不喜欢它的甜味。,-,-,2021-04-15
1594,l**t,口味: 经典原味（碱性24瓶）,好评,喝起来还不错。 ,-,-,2021-04-08
1595,陈**8,口味: 经典原味（碱性24瓶）,好评,口感味道：好入口 ,-,-,2021-01-15
1596,l**7,口味: 经典原味（碱性24瓶）,好评,口感非常不好  ,-,-,2021-04-10
1597,j**9,口味: 经典原味（碱性24瓶）仅此款送礼袋,好评,很好喝的苏打水,-,-,2021-01-28
1598,我**n,口味: 经典原味（碱性24瓶）,好评,有点甜 没有气儿  ,-,-,2021-04-07
1599,t**6,口味: 经典原味（碱性24瓶）仅此款送礼袋,好评,一如即往的满意,-,-,2021-06-22
1600,张**9,口味: 经典原味（碱性24瓶）,好评,快递说放门口丢了，没收到货,-,-,2021-04-08
1601,t**2,口味: 经典原味（碱性24瓶）仅此款送礼袋,好评,几次回购了,-,-,2021-01-31
1602,小**3,口味: 经典原味（碱性24瓶）,好评,N次回购,-,-,2021-01-25
1603,霓**西,口味: 经典原味（碱性24瓶）,好评,好喝，有点甜甜的,-,-,2021-04-12
1604,芝**洁,口味: 经典原味（碱性24瓶）,好评,不好喝，太甜了 ,-,-,2021-04-08
1605,外**梨,口味: 经典原味（碱性24瓶）,好评,恶心的商家 发票要靠投诉才开 ,-,-,2021-04-08
1606,t**5,口味: 经典原味（碱性24瓶）,好评,超级难喝 真的超难喝！,-,-,2021-04-05
1607,栗**袋,口味: 经典原味（碱性24瓶）,好评,喝不太习惯 ,-,-,2021-04-09
1608,粉**节,口味: 经典原味（碱性24瓶）,好评,一直夏天喝名仁的苏打水,-,-,2021-04-08
1609,n**y,口味: 经典原味（碱性24瓶）,好评,一直在喝原味的，每天两瓶 ,-,-,2021-01-15
1610,a**0,口味: 经典原味（碱性24瓶）,好评,没有送上门，快递太差劲,-,-,2021-06-22
1611,齐**川,口味: 加葡萄糖酸锌（碱性24瓶）,好评,难喝又贵 ,-,-,2021-04-17
1612,梓**q,口味: 经典原味（碱性24瓶）,好评,不太好喝 ,-,-,2021-04-15
1613,彭**颜,口味: 经典原味（碱性24瓶）,好评,不喜欢喝,-,-,2021-04-13
1614,t**7,口味: 经典原味（碱性24瓶）,好评,口味偏甜,-,-,2021-06-26
1615,周**巨,口味: 经典原味（碱性24瓶）,好评,味道不错，,-,-,2021-04-09
1616,雨**1,口味: 经典原味（碱性24瓶）,好评,回购商品,-,-,2021-01-16
1617,t**9,口味: 清新薄荷味（碱性24瓶）,好评,口味道好,-,-,2021-01-22
1618,z**0,口味: 经典原味（碱性24瓶）,好评,真是相当便宜了，物流也快。,-,-,2021-04-08
1619,a**7,口味: 经典原味（碱性24瓶）,好评,大家都知道的水,-,-,2021-04-08
1620,2**星,口味: 加葡萄糖酸锌（碱性24瓶）,好评,喝完回购的，物美价廉，好 ,-,-,2021-01-18
1621,幸**热,口味: 经典原味（碱性24瓶）,好评,奔着无糖苏打水买的,-,-,2021-04-04
1622,y**i,口味: 加葡萄糖酸锌（碱性24瓶） 无礼袋,好评,挺好的！已多次回购！,-,-,2021-01-28
1623,果**4,口味: 经典原味（碱性24瓶）,好评,宝贝收到，还未喝 ,-,-,2021-04-12
1624,w**6,口味: 经典原味（碱性24瓶）,好评,胃酸喝点苏打水吧。 ,-,-,2021-04-10
1625,h**1,口味: 经典原味（碱性24瓶）,好评,买很多次了,-,-,2021-04-04
1626,e**7,口味: 经典原味（碱性24瓶）,好评,买了很多次了 ,-,-,2021-04-17
1627,s**9,口味: 经典原味（碱性24瓶）,好评,买了很多次 ,-,-,2021-04-11
1628,笨**4,口味: 经典原味（碱性24瓶）,好评,看老顾客,-,-,2021-04-07
1629,h**8,口味: 经典原味（碱性24瓶）,好评,习惯好评,-,-,2021-04-17
1630,h**4,口味: 经典原味（碱性24瓶）仅此款送礼袋,好评,宝贝收到，囤货,-,-,2021-01-26
1631,6**9,口味: 经典原味（碱性24瓶）,好评,一直购买这个,-,-,2021-01-14
1632,运**鸣,口味: 经典原味（碱性24瓶）,好评,经常买，货真价实！,-,-,2021-01-11
1633,s**7,口味: 经典原味（碱性24瓶）,好评,夏天就靠它了！！！ ,-,-,2021-04-13
1634,t**7,口味: 经典原味（碱性24瓶）,好评,非常不错，好评！ ,-,-,2021-06-26
1635,上**身,口味: 清新薄荷味（碱性24瓶）无礼袋,好评,巨好喝。很不错！,-,-,2021-01-27
1636,见**3,口味: 经典原味（碱性24瓶）,好评,水➕调味剂,-,-,2021-04-14
1637,c**1,口味: 经典原味（碱性24瓶）,好评,一直这家买,-,-,2021-01-21
1638,t**4,口味: 经典原味（碱性24瓶）,好评,收到了，常卖，好喝,-,-,2021-01-20
1639,b**c,口味: 经典原味（碱性24瓶）,好评,一直喝的名仁苏打，满意 ,-,-,2021-01-10
1640,坏**6,口味: 经典原味（碱性24瓶）,好评,少了两瓶水,-,-,2021-04-04
1641,絮**水,口味: 经典原味（碱性24瓶）,好评,无气糖水。。。。。。。,-,-,2021-04-07
1642,天**7,口味: 经典原味（碱性24瓶）,好评,不错，挺好的，会一直喝。,-,-,2021-01-18
1643,黑**瞳,口味: 经典原味（碱性24瓶）仅此款送礼袋,好评,很好，快递小哥也不错。  ,-,-,2021-01-28
1644,h**0,口味: 经典原味（碱性24瓶）,好评,还可以，不错 ,-,-,2021-04-04
1645,陌**2,口味: 经典原味（碱性24瓶）仅此款送礼袋,好评,挺好的，经常买的,-,-,2021-01-31
1646,t**2,口味: 经典原味（碱性24瓶）仅此款送礼袋,好评,老板服务态度好，非常感谢。,-,-,2021-01-24
1647,马**强,口味: 经典原味（碱性24瓶）仅此款送礼袋,好评,不错，期待,-,-,2021-01-29
1648,飘**9,口味: 经典原味（碱性24瓶）,好评,不错，发货挺快,-,-,2021-04-06
1649,t**7,口味: 加葡萄糖酸锌（碱性24瓶）,好评,收到了，不错,-,-,2021-06-26
1650,w**4,口味: 清新薄荷味（碱性24瓶）2月新货,好评,水还行，包装期待再加固一些。还有就是快递太牛*了，拿了一瓶水喝了也就算了，还**给我插回去，啥意思呢？我请不起你这瓶水？还是***看不起我？,除了丢掉的一瓶喝过的，一共10瓶，还缺2瓶。仔细看了一下赠品写着送12瓶装的，**，快递是真的不客气了，不过那瓶插回去的我是真的服了。,-,2021-03-22
1651,w**h,口味: 经典原味（碱性24瓶）,好评,卖家在发货包装时，可否多加一层塑料薄膜包装，法国时候没有纸质包装不说吧，还就那样一层塑料薄膜，运输过程中薄膜破了不说，里面一层薄薄的纸箱都快烂了，这可是喝的水啊，让人感觉不干净了，非常不好的发货和运输！差评！ ,-,-,2021-03-17
1652,l**8,口味: 经典原味（碱性24瓶）,好评,东西很好，但是物流很垃圾，没有电话短信通知，直接把货放到丰巢柜就结束了，还是自己看淘宝，才发现放在快递柜了，导致货物迟了好几天才拿到、还付了超时费，差评，没有什么好说的 ,-,-,2021-03-18
1653,k**7,口味: 经典原味（碱性24瓶）,好评,发货速度很快，看起来像正品。 ,-,-,2021-03-23
1654,l**3,口味: 经典原味（碱性24瓶）,好评,服务超级棒，物流存驿站7天，没人送货，卖家给退运费！ ,-,-,2021-03-30
1655,z**2,口味: 清新薄荷味（碱性24瓶）2月新货,好评,太甜了，全网找不带甜味的苏打水 都找不到，太失望  为什么苏打水 要带甜味？喝着太难受，本来血糖就高,太甜了，失望,-,2021-04-02
1656,t**1,口味: 经典原味（碱性24瓶）,好评,溶解难易：多次购买了 ,-,-,2021-03-19
1657,小**e,口味: 经典原味（碱性24瓶）,好评,到货时，箱子是破的，还没喝，不知味道怎样,-,-,2021-03-24
1658,w**4,口味: 经典原味（碱性24瓶）,好评,第一次在这买，标的颜色比其他地方买的浅。,-,-,2021-03-19
1659,n**犊,口味: 经典原味（碱性24瓶）,好评,以后都不会再这家买东西了，发货慢，发票不给开，催了快一个月了还没给开出来。,-,-,2021-04-02
1660,陪**9,口味: 经典原味（碱性24瓶）,好评,虽然无糖但是安赛蜜之类的成分真的是甜到牙缝的那种，放弃 ,-,-,2021-03-19
1661,浅**爱,口味: 清新薄荷味（碱性24瓶）2月新货,好评,一般般，不值这个价钱。,-,-,2021-03-24
1662,t**5,口味: 加葡萄糖酸锌（碱性24瓶）,好评,老人家尿酸高，试试看能不能降低,-,-,2021-03-29
1663,t**3,口味: 经典原味（碱性24瓶）,好评,口味一般 ,没啥感觉，质量一般,-,2021-06-21
1664,卫**8,口味: 加葡萄糖酸锌（碱性24瓶）,好评,瓶子是旧的都不敢喝,-,-,2021-03-27
1665,木**9,口味: 经典原味（碱性24瓶）,好评,有点小贵，份量还有点少,-,-,2021-03-26
1666,三**三,口味: 经典原味（碱性24瓶）,好评,无糖原味还是甜的，要是不甜就好了,-,-,2021-03-26
1667,t**q,口味: 经典原味（碱性24瓶）,好评,感觉太甜了，可以适当少放糖。 ,-,-,2021-03-28
1668,9**b,口味: 经典原味（碱性24瓶）,好评,不是拍原味的吗，怎么还是有点甜,-,-,2021-03-30
1669,因**受,口味: 经典原味（碱性24瓶）,好评,已经无数次买了，你说好不好,-,-,2021-03-17
1670,z**q,口味: 经典原味（碱性24瓶）,好评,快递过来箱子都压变形了,-,-,2021-03-31
1671,q**8,口味: 经典原味（碱性24瓶）,好评,买了很多次了，好喝 ,-,-,2021-03-18
1672,t**6,口味: 经典原味（碱性24瓶）,好评,一如既往地满意,-,-,2021-06-22
1673,l**7,口味: 清新薄荷味（碱性24瓶）,好评,喝不惯这个味道,-,-,2021-03-17
1674,深**5,口味: 经典原味（碱性24瓶）,好评,差    太差了     太难喝了,-,-,2021-03-18
1675,仅**哦,口味: 经典原味（碱性24瓶）,好评,一直喝的都是这个    ,-,-,2021-03-20
1676,d**g,口味: 经典原味（碱性24瓶）,好评,就是这个味,-,-,2021-03-29
1677,媛**哒,口味: 经典原味（碱性24瓶）,好评,⚠️**商家 这个水能给孕妇喝❓说是无糖 里面添加了那么多添加剂。喝了一小口 嗓子都疼了。这一箱水只能扔掉了。还有那么多人给宣传。无语😓 这水还往出卖。商家的良心不会痛吗？？ ,-,-,2021-03-15
1678,h**1,口味: 经典原味（碱性24瓶）,好评,38的活动是送还有几天过期的苏打水,-,-,2021-03-11
1679,l**g,口味: 经典原味（碱性24瓶）,好评,写着无糖，结果加安赛蜜，三氯蔗糖，甜的一*，欺骗消费者,-,-,2021-03-10
1680,透**忆,口味: 经典原味（碱性24瓶）,好评,还是喜欢原味的，就是快递不好，那么重放在菜鸟驿站，也不送到家，我自己去拿就算了，叫菜鸟驿站的人帮忙搬一下到车上，也不搬，还说爱拿不拿，这个态度真的是非常生气。这个东西本来就是送货到家的好吧。快递态度不好，所以我是不会给好评的。卖家找个好一点的快递吧！ ,-,-,2021-03-12
1681,抖**e,口味: 经典原味（碱性24瓶）,好评,此用户没有填写评价。,昨天喝完一想，今天打开另一箱的时候发现包装有破损，里面还少了三瓶水，老顾客了，还是第一次碰到这种情况,-,2021-03-03
1682,j**7,口味: 经典原味（碱性24瓶）,好评,怎么说呢 在网上买这个 然后去菜鸟驿站自己搬回来 这一点真的是让人吐血 以后不会在网上买这种重的了 因为实在一个人弄回来很麻烦,-,-,2021-03-05
1683,徐**w,口味: 经典原味（碱性24瓶）,好评,第二次买了，减肥期间又不想喝白开水。 ,-,-,2021-03-02
1684,霉**6,口味: 经典原味（碱性24瓶）,好评,就是快递太猛了，收到货的时候盒子都破了,-,-,2021-03-05
1685,陶**6,口味: 清新薄荷味（碱性24瓶）2月新货,好评,快递实在太差了，直接放丰巢。家里有老人不会取，也不送家。倒是可以送物业，也是服气了！下次请不要发圆通 ,-,-,2021-03-15
1686,l**0,口味: 喵室友联名款（原味24瓶）,好评,21年3月买的，日期有点远，半年前的了，20年9月产的，物流速度也一般,-,-,2021-03-14
1687,一**4,口味: 清新薄荷味（碱性24瓶）,好评,都不知道怎么评价了，反正已经不知道是第几次回购了 ,-,-,2021-03-13
1688,许**良,口味: 经典原味（碱性24瓶）,好评,百世汇通是真奇葩，到了附近网店就是不派送，联系多次，就会回复尽快安排，十几天不派送，最后网点自己签收了？ ,-,-,2021-03-10
1689,t**0,口味: 加葡萄糖酸锌（碱性24瓶）,好评,箱子有点破损了,-,-,2021-06-16
1690,l**7,口味: 经典原味（碱性24瓶）,好评,挺大件的，味道还可以，比较满意,-,-,2021-03-07
1691,l**3,口味: 经典原味（碱性24瓶）,好评,就是有点小贵，不送货上门，其它还行吧,-,-,2021-03-11
1692,黎**4,口味: 经典原味（碱性24瓶）,好评,好评吧，我也没喝不知道啥味,-,-,2021-03-08
1693,t**5,口味: 清新薄荷味（碱性24瓶）,好评,最难喝的苏打水……没有之一,-,-,2021-03-13
1694,杭**爸,口味: 经典原味（碱性24瓶）,好评,还不错，和实体店买的没区别！ ,-,-,2021-03-07
1695,小**熙,口味: 经典原味（碱性24瓶）,好评,太甜了，没有想象中的那么好，,-,-,2021-03-05
1696,嘿**咩,口味: 经典原味（碱性24瓶）,好评,还没拆，应该没什么问题吧,-,-,2021-03-11
1697,贾**元,口味: 加葡萄糖酸锌（碱性24瓶）,好评,多次购买了，还不错！,-,-,2021-03-07
1698,s**0,口味: 经典原味（碱性24瓶）,好评,不好喝，口感很怪 ,-,-,2021-03-12
1699,t**2,口味: 经典原味（碱性24瓶）,好评,质量还有物流都挺好的,-,-,2021-03-15
1700,z**1,口味: 经典原味（碱性24瓶）,好评,还没喝，希望好喝！,-,-,2021-06-22
1701,胜**宝,口味: 经典原味（碱性24瓶）,好评,还没喝， 习惯好评,-,-,2021-03-04
1702,x**6,口味: 经典原味（碱性24瓶）,好评,味道不错。 ,-,-,2021-03-07
1703,蓝**2,口味: 清新薄荷味（碱性24瓶）,好评,此用户没有填写评价。,有一种牙膏的味道,-,2021-03-09
1704,流**谷,口味: 经典原味（碱性24瓶）,好评,不错，还可以，好喝,-,-,2021-03-01
1705,x**8,口味: 经典原味（碱性24瓶）,好评,快递差评,-,-,2021-06-20
1706,6**i,口味: 经典原味（碱性24瓶）,好评,挺好的，还是原来的味道,-,-,2021-03-09
1707,似**8,口味: 经典原味（碱性24瓶）,好评,包装好，发货速度快！,-,-,2021-03-03
1708,t**1,口味: 经典原味（碱性24瓶）仅此款送礼袋,好评,买后发现世面降价很厉害    ,-,-,2021-02-23
1709,琳**星,口味: 经典原味（碱性24瓶）仅此款送礼袋,好评,溶解难易：解渴 口感味道：还是以前的味道 ,-,-,2021-02-09
1710,赵**5,口味: 经典原味（碱性24瓶）,好评,我个人认为这个苏打水饮料是不能喝的，每喝一次就想吐，不知是为什么哈？,-,-,2021-02-25
1711,x**9,口味: 经典原味（碱性24瓶）,好评,东西不错，挺沉的。求求你们别用圆通了，超级慢还不送上楼😂 ,-,-,2021-02-24
1712,臧**人,口味: 加葡萄糖酸锌（碱性24瓶）,好评,物流太差，也不给送到家，自己去站点取，箱子也破了 ,-,-,2021-02-25
1713,我**8,口味: 经典原味（碱性24瓶）,好评,东西可以，快递没给送上楼，那么沉一人搬两箱上楼，我也是服了  ,-,-,2021-02-24
1714,t**7,口味: 经典原味（碱性24瓶）,好评,包装盒都坏了……唉！ ,-,-,2021-06-26
1715,小**天,口味: 经典原味（碱性24瓶）,好评,跟其它品牌不太一样，有点甜。,-,-,2021-02-24
1716,y**狸,口味: 经典原味（碱性24瓶）,好评,买贵了，不开心 ,-,-,2021-02-22
1717,臭**儿,口味: 经典原味（碱性24瓶）仅此款送礼袋,好评,不是第一次买了 ,-,-,2021-02-22
1718,臧**人,口味: 经典原味（碱性24瓶）,好评,物流太差劲，不送货 ,-,-,2021-02-25
1719,i**r,口味: 经典原味（碱性24瓶）,好评,收到，还没打开。,-,-,2021-02-19
1720,t**2,口味: 加葡萄糖酸锌（碱性24瓶） 无礼袋,好评,包装品质：快递暴力把箱子弄得裂开个大口子，好在水没有漏，所以只能差评。客服态度好。给好评。 ,-,-,2021-02-01
1721,f**8,口味: 经典原味（碱性24瓶）仅此款送礼袋,好评,老哥的尿酸真的下降了，看来要一直喝下去了 ,-,-,2021-02-01
1722,购**2,口味: 经典原味（碱性24瓶）,好评,有一箱漏了纸箱都湿了，希望下次有个外包装盒比较好，就不会有坏的,-,-,2021-01-28
1723,幕**b,口味: 加葡萄糖酸锌（碱性24瓶） 无礼袋,好评,还可以，能多点优惠就更好了嘿嘿，买的第二次了,-,-,2021-02-02
1724,吃**贝,口味: 经典原味（碱性24瓶）仅此款送礼袋,好评,上当了，水里有添加安赛蜜，一种不能代谢的添加剂，本来添加剂喝了就不好，本来想降尿酸，结果白买了，也退不了，运费就要100，**！坑**！ ,-,-,2021-01-30
1725,达**行,口味: 喵室友联名款（原味24瓶）  无礼袋,好评,味道还行，比较中正，好的话再三买😊 ,-,-,2021-02-01
1726,l**8,口味: 清新薄荷味（碱性24瓶）,好评,味道怪怪的，喝完感觉肚子不舒服,-,-,2021-01-30
1727,幽**说,口味: 清新薄荷味（碱性24瓶）无礼袋,好评,东西没有问题，快递不给送上门，放菜鸟驿站，我永远不会再买了。,-,-,2021-01-27
1728,鲁**根,口味: 经典原味（碱性24瓶）仅此款送礼袋,好评,好几次买了，水不错。只是快递员***差劲。早八点派件，晚八点没来。打电话不接，发短信说不干了，愿意找谁去找谁。圆通快递，去***,-,-,2021-01-24
1729,t**8,口味: 经典原味（碱性24瓶）仅此款送礼袋,好评,旗舰店竟然发快递不给送货到家 只放到驿站 还是京东买好 ,-,-,2021-06-21
1730,t**2,口味: 经典原味（碱性24瓶）,好评,买来送给我朋友 ,-,-,2021-01-29
1731,c**5,口味: 经典原味（碱性24瓶）仅此款送礼袋,好评,物流坑呀，同一时间的单，分两次拿的，就不能一次到吗？？？  ,-,-,2021-01-31
1732,t**3,口味: 经典原味（碱性24瓶）仅此款送礼袋,好评,还行！甜了点！,-,-,2021-06-21
1733,上**身,口味: 经典原味（碱性24瓶）仅此款送礼袋,好评,拿来做老冰球了。到时候试试看。,-,-,2021-01-27
1734,h**p,口味: 加葡萄糖酸锌（碱性24瓶） 无礼袋,好评,大多是冲降尿酸来的,-,-,2021-01-26
1735,一**悔,口味: 经典原味（碱性24瓶）仅此款送礼袋,好评,买来给孕妇喝的,-,-,2021-02-01
1736,胡**的,口味: 经典原味（碱性24瓶）仅此款送礼袋,好评,快递服务是真的垃圾。,-,-,2021-02-02
1737,t**2,口味: 经典原味（碱性24瓶）,好评,差，到货都是破的瓶子上都是灰尘 ,-,-,2021-01-13
1738,l**1,口味: 经典原味（碱性24瓶）,好评,这个喝着有股薄荷味，以前在实体店里买的喝着就没有，味道一般，送的带气的饮料没多少气，味道也一般，还是柠檬味的口感好点 ,-,-,2021-01-07
1739,均**下,口味: 经典原味（碱性24瓶）,好评,还没有喝，不知道味道怎么样，喝了再来评价 ,-,-,2021-01-09
1740,j**2,口味: 经典原味（碱性24瓶）,好评,很清甜。而且不会太口浮。味道很适合 ,-,-,2021-06-16
1741,t**1,口味: 经典原味（碱性24瓶）,好评,刚搬上楼就拆了，还是那个味道~喝了再买✌🏻 ,-,-,2021-01-14
1742,大**呐,口味: 经典原味（碱性24瓶）,好评,包装贼差，快递也挺慢的 日期蛮新鲜哦，我一般买天猫的，包装日期都好，第一次在旗舰店买，不是很理想  ,-,-,2021-01-16
1743,杰**呢,口味: 经典原味（碱性24瓶）,好评,已经记不清是多少次的回购了，买给爸爸喝的，居然对脚指头痛风有奇效 ,-,-,2021-01-04
1744,胡**的,口味: 经典原味（碱性24瓶）,好评,这么重的东西直接丢菜鸟驿站，然后还*不悔改！,-,-,2021-01-05
1745,t**7,口味: 经典原味（碱性24瓶）,好评,这么重的居然不给送到家  哪怕打个电话问一下  直接放到社区服务站  还要自己到社区搬回来  物流差评,-,-,2021-06-26
1746,骆**华,口味: 经典原味（碱性24瓶）,好评,货收到了，回到来测一下，PH值才7.0，我觉得不怎么样？,-,-,2021-01-05
1747,b**n,口味: 经典原味（碱性24瓶）,好评,太甜了。我以为是没味道的。,好甜，不会再买了。加了甜味剂,-,2021-01-17
1748,l**4,口味: 加葡萄糖酸锌（碱性24瓶）,好评,味道有点难接受,-,-,2021-01-20
1749,君**2,口味: 经典原味（碱性24瓶）,好评,供养寺院师父的，不知道如何,-,-,2021-01-06
1750,没**涯,口味: 经典原味（碱性24瓶）,好评,快递运输不满意,-,-,2021-01-16
1751,z**6,口味: 经典原味（碱性24瓶）,好评,此用户没有填写评价。,有糖的，告知各位，有糖。,-,2021-01-04
1752,史**国,口味: 经典原味（碱性24瓶）,好评,发货太慢了,-,-,2021-01-20
1753,桑**筝,口味: 经典原味（碱性24瓶）,好评,不错，味道好。,-,-,2021-01-05
1754,君**0,口味: 经典原味（碱性24瓶）,好评,来多次了，质量很好，价格比超市便宜。包装很好，物流很快，完好无损。下次再来。好,-,-,2021-06-30
1755,t**9,口味: 经典原味（碱性24瓶）,好评,比超市便宜，质量好，味道有些许甜甜的，家人很喜欢喝哦,-,-,2021-06-30
1756,活**阿,口味: 经典原味（碱性24瓶）,好评,之前买过还不错、这次的还没开始喝。 ,-,-,2021-06-30
1757,吉**0,口味: 经典原味（碱性24瓶）,好评,有点痛风，现在一直喝苏打水，味道不错。 ,-,-,2021-06-30
1758,吉**0,口味: 经典原味（碱性24瓶）,好评,有点痛风，现在一直喝苏打水，味道不错。 ,-,-,2021-06-30
1759,g**u,口味: 经典原味（碱性24瓶）,好评,好喝,-,-,2021-06-30
1760,t**3,口味: 经典原味（碱性24瓶）,好评,不差,-,-,2021-06-21
1761,t**8,口味: 清新薄荷味（碱性24瓶）5月新货,好评,搞活动买的，还算划算，2块出头一瓶。 ,-,-,2021-06-21
1762,d**5,口味: 经典原味（碱性24瓶）,好评,活动价格美丽合下来1.8毛多一瓶，超市要2.5到3元一瓶哦 ,-,-,2021-06-09
