365,t**8,口味: 经典原味（碱性24瓶）,好评,连续买了两箱了，口感不错，很是喜欢 ,-,-,2021-06-21
366,l**1,口味: 经典原味（碱性24瓶）,好评,好喝不解渴呀！越喝越想喝哈！再购一单 ,-,-,2021-05-16
367,温**哥,口味: 经典原味（碱性24瓶）,好评,女朋友喜欢喝,-,-,2021-05-21
368,路**敏,口味: 经典原味（碱性24瓶）,好评,小朋友很爱喝 ,-,-,2021-05-22
369,t**6,口味: 清新薄荷味（碱性24瓶）,好评,味道不错，薄荷味 ,-,-,2021-06-22
370,t**0,口味: 经典原味（碱性24瓶）,好评,挺好喝的，微甜，下次还会购买的！ ,-,-,2021-06-16
371,x**1,口味: 经典原味（碱性24瓶）,好评,口感味道：家人们都喜欢喝  ,-,-,2021-05-20
372,9**泽,口味: 经典原味（碱性24瓶）,好评,山好水好呱呱叫  痛风伴侣少不了 ,-,-,2021-05-20
373,t**0,口味: 经典原味（碱性24瓶）,好评,好喝。比哇哈哈的味道淡点，喝得喜欢 ,-,-,2021-06-16
374,玖**叶,口味: 经典原味（碱性24瓶）,好评,挺好喝的，微甜，而且不含糖喜欢,-,-,2021-05-13
375,t**5,口味: 加葡萄糖酸锌（碱性24瓶）,好评,多次回购，很不错的苏打水！,-,-,2021-05-10
376,伊**茉,口味: 经典原味（碱性24瓶）,好评,口感不错，满意的一次购物 ,-,-,2021-05-19
377,晴**6,口味: 经典原味（碱性24瓶）,好评,这个牌子的苏打水还好，值得信赖！五星好评！,-,-,2021-05-10
378,这**哈,口味: 经典原味（碱性24瓶）,好评,第二次购买了，味道还可以,-,-,2021-05-16
379,t**8,口味: 经典原味（碱性24瓶）,好评,物流很快包装完好到位。喝完继续安排,-,-,2021-06-21
380,入**i,口味: 经典原味（碱性24瓶）,好评,超级解渴～夏天必备！冲！推荐,-,-,2021-05-20
381,n**y,口味: 经典原味（碱性24瓶）,好评,商品包装完好 ,-,-,2021-05-21
382,啊**娅,口味: 经典原味（碱性24瓶）,好评,非常满意，快递也快，希望对爸爸的尿酸有所控制! ,-,-,2021-05-17
383,t**8,口味: 经典原味（碱性24瓶）,好评,太甜了，还是喜欢原味苏打水,-,-,2021-06-21
384,刘**猫,口味: 经典原味（碱性24瓶）,好评,水有啥可评价的，喝了……挺解渴的……,-,-,2021-05-14
385,t**5,口味: 经典原味（碱性24瓶）,好评,口感好，每年夏天必买几箱,-,-,2021-05-17
386,t**2,口味: 经典原味（碱性24瓶）,好评,到了嘴是微甜，味道还不错，发货很快，值得回购！ ,-,-,2021-05-17
387,l**t,口味: 经典原味（碱性24瓶）,好评,价钱合理,-,-,2021-05-27
388,t**8,口味: 经典原味（碱性24瓶）,好评,苏打水还是活力恩的好喝,-,-,2021-06-21
389,漫**莜,口味: 经典原味（碱性24瓶）,好评,回购的，很喜欢，说实话就是有点小贵,-,-,2021-05-20
390,美**a,口味: 经典原味（碱性24瓶）,好评,好喝好喝好喝 重要的事情说三遍,-,-,2021-05-13
391,n**1,口味: 经典原味（碱性24瓶）,好评,多次购买非常满意 ,-,-,2021-05-13
392,我**8,口味: 经典原味（碱性24瓶）,好评,很好的哦下次一定再买,-,-,2021-05-24
393,加**饭,口味: 经典原味（碱性24瓶）,好评,还可以，就是有点小贵 ,-,-,2021-06-09
394,a**5,口味: 经典原味（碱性24瓶）,好评,点赞👍一天都活力满满。,-,-,2021-05-11
395,想**我,口味: 经典原味（碱性24瓶）,好评,首次购买感觉口感不错。,-,-,2021-05-11
396,静**1,口味: 经典原味（碱性24瓶）,好评,味道很好！还会来购买,-,-,2021-05-18
397,l**u,口味: 经典原味（碱性24瓶）,好评,多次购买，多搞活动 ,-,-,2021-05-19
398,y**6,口味: 经典原味（碱性24瓶）,好评,第二次购买，好喝 ,-,-,2021-05-17
399,阳**家,口味: 经典原味（碱性24瓶）,好评,特别好喝，无限回购。,-,-,2021-05-26
400,彭**2,口味: 经典原味（碱性24瓶）,好评,喜欢这口感，会回购。,-,-,2021-05-20
401,t**6,口味: 经典原味（碱性24瓶）,好评,口感味道：还是原味的好 ,-,-,2021-06-22
402,t**2,口味: 经典原味（碱性24瓶）,好评,挺好的，物流也挺快的嗯，价格也划算，以后还会再买的 ,-,-,2021-05-17
403,天**7,口味: 经典原味（碱性24瓶）,好评,不错回购多次,-,-,2021-05-17
404,社**8,口味: 清新薄荷味（碱性24瓶）,好评,还可以，去年买到今年 ,-,-,2021-05-18
405,t**0,口味: 经典原味（碱性24瓶）,好评,宝贝不错，值得购买，下次再来。 ,-,-,2021-06-16
406,z**l,口味: 经典原味（碱性24瓶）,好评,家人非常喜欢,-,-,2021-05-13
407,买**2,口味: 清新薄荷味（碱性24瓶）3月新货,好评,口感很好，喝了还想喝 ,-,-,2021-05-10
408,吕**g,口味: 经典原味（碱性24瓶）,好评,还没喝  买了两大箱,-,-,2021-06-11
409,岚**一,口味: 经典原味（碱性24瓶）,好评,买来尝鲜试试水！好,-,-,2021-05-17
410,老**i,口味: 加葡萄糖酸锌（碱性24瓶）,好评,酒前酒后来一瓶，哈哈哈,-,-,2021-05-23
411,哥**城,口味: 经典原味（碱性24瓶）,好评,好像买贵了 61 ,-,-,2021-06-10
412,哇**0,口味: 经典原味（碱性24瓶）,好评,水有点甜甜的，好喝,-,-,2021-05-26
413,枫**舞,口味: 加葡萄糖酸锌（碱性24瓶）,好评,东西非常好，快递也很快，五星好评 ,-,-,2021-05-24
414,t**9,口味: 经典原味（碱性24瓶）,好评,口感味道：太甜了 ,-,-,2021-05-12
415,j**f,口味: 加葡萄糖酸锌（碱性24瓶）,好评,日期新，口感好,-,-,2021-05-17
416,t**5,口味: 经典原味（碱性24瓶）,好评,无限回购产品,-,-,2021-05-20
417,t**4,口味: 加葡萄糖酸锌（碱性24瓶）,好评,一如既往的 好👌,-,-,2021-05-15
418,t**2,口味: 经典原味（碱性24瓶）,好评,口感味道：很好 ,-,-,2021-05-11
419,x**8,口味: 经典原味（碱性24瓶）,好评,味道还不错，价格很实惠,-,-,2021-06-20
420,c**5,口味: 经典原味（碱性24瓶）,好评,给爱人买的，不错。,-,-,2021-05-13
421,j**0,口味: 经典原味（碱性24瓶）,好评,售前2服务很好，解决问题速度很快，苏打水味道很不错，给店家点赞～～,-,-,2021-05-23
422,z**5,口味: 经典原味（碱性24瓶）,好评,物流放离家太远的菜鸟驿站,-,-,2021-06-09
423,1**q,口味: 加葡萄糖酸锌（碱性24瓶）,好评,真的推荐啊，快递速度特别的快，爱了爱了,-,-,2021-05-18
424,t**4,口味: 经典原味（碱性24瓶）,好评,无限次购买,-,-,2021-05-22
425,庄**思,口味: 清新薄荷味（碱性24瓶）,好评,味道可以 ,-,-,2021-05-20
426,任**1,口味: 经典原味（碱性24瓶）,好评,挺好喝的 不错 ,-,-,2021-05-17
427,彬**张,口味: 喵室友联名款（原味24瓶）9月日期,好评,已是回头客了,-,-,2021-05-27
428,1**c,口味: 经典原味（碱性24瓶）,好评,不错很好喝,-,-,2021-05-22
429,程**楠,口味: 经典原味（碱性24瓶）,好评,一直买，挺好的 ,-,-,2021-05-25
430,c**6,口味: 经典原味（碱性24瓶）,好评,好喝，一直买 ,-,-,2021-05-17
431,y**9,口味: 经典原味（碱性24瓶）,好评,稍微便宜点,-,-,2021-05-21
432,t**a,口味: 经典原味（碱性24瓶）,好评,很好的，味道很好,-,-,2021-06-26
433,九**王,口味: 经典原味（碱性24瓶）,好评,很好很满意,-,-,2021-05-27
434,t**2,口味: 经典原味（碱性24瓶）,好评,好喝不贵。,-,-,2021-05-16
435,豆**蕾,口味: 经典原味（碱性24瓶）,好评,感觉太甜了,-,-,2021-05-23
436,欧**淘,口味: 经典原味（碱性24瓶）,好评,回购无数 ,-,-,2021-05-20
437,蓝**1,口味: 经典原味（碱性24瓶）,好评,此用户没有填写评价。,棒棒哒✌️✌️✌️,-,2021-05-11
438,z**3,口味: 经典原味（碱性24瓶）,好评,口感微甜,-,-,2021-05-19
439,t**5,口味: 清新薄荷味（碱性24瓶）,好评,还没喝，先给好评。赞！,-,-,2021-05-15
440,冷**3,口味: 经典原味（碱性24瓶）,好评,一直喝的这个牌子的苏打水，不错的👍 ,-,-,2021-05-15
441,l**9,口味: 经典原味（碱性24瓶）,好评,没送到家，自己搬的,-,-,2021-06-10
442,t**9,口味: 经典原味（碱性24瓶）,好评,好几次购买了,-,-,2021-05-22
443,青**配,口味: 经典原味（碱性24瓶）,好评,太甜了吧,-,-,2021-06-07
444,常**1,口味: 经典原味（碱性24瓶）,好评,发货很快，生产日期是5月13号的。 ,-,-,2021-05-27
445,黑**空,口味: 经典原味（碱性24瓶）,好评,买了好几次了 ,-,-,2021-05-10
446,s**香,口味: 经典原味（碱性24瓶）,好评,买第三次了,-,-,2021-05-15
447,z**m,口味: 加葡萄糖酸锌（碱性24瓶）,好评,第四次买了 ,-,-,2021-05-20
448,随**5,口味: 经典原味（碱性24瓶）,好评,二次购买的,-,-,2021-06-07
449,空**格,口味: 加葡萄糖酸锌（碱性24瓶）,好评,每年夏天必buy ,-,-,2021-05-10
450,让**i,口味: 经典原味（碱性24瓶）,好评,不错，口感很好值得购买,-,-,2021-05-12
451,画**卜,口味: 经典原味（碱性24瓶）,好评,夏日止渴常备 ,-,-,2021-05-21
452,岚**一,口味: 清新薄荷味（碱性24瓶）,好评,买来尝鲜试试水！,-,-,2021-05-17
453,c**i,口味: 经典原味（碱性24瓶）,好评,老顾客了 ,-,-,2021-06-24
454,盛**浩,口味: 经典原味（碱性24瓶）,好评,一直选用明仁，值得信赖,-,-,2021-05-19
455,张**哥,口味: 经典原味（碱性24瓶）,好评,溶解难易：孩子高三吃夜宵，喝了名仁苏打水胃酸现象没有了 包装品质：包装严实，没有损坏现象 外观品相：外观设计一流，一看就是正品 口感味道：口感不错，有一点甜甜哒味道 ,-,-,2021-04-19
456,老**i,口味: 经典原味（碱性24瓶）,好评,多次购买，值得信赖,-,-,2021-05-23
457,y**爱,口味: 经典原味（碱性24瓶）,好评,物流速度很快 ,-,-,2021-05-25
458,t**6,口味: 经典原味（碱性24瓶）,好评,不错，夏天冰上更好喝,-,-,2021-06-22
459,佳**3,口味: 经典原味（碱性24瓶）,好评,很好，一直在买。,-,-,2021-05-15
460,凯**杨,口味: 经典原味（碱性24瓶）,好评,很好，一直在喝这个水,-,-,2021-05-12
461,暴**心,口味: 经典原味（碱性24瓶）,好评,好评，全五星。,-,-,2021-05-27
462,爱**5,口味: 经典原味（碱性24瓶）,好评,非常好喝，喜欢的口味 ,-,-,2021-06-22
463,小**6,口味: 经典原味（碱性24瓶）,好评,常购买，不错！ ,-,-,2021-05-24
464,t**6,口味: 经典原味（碱性24瓶）,好评,不错。。谢谢，，五分,-,-,2021-06-22
465,t**1,口味: 经典原味（碱性24瓶）,好评,挺好喝的苏打水，发货速度很快 ,-,-,2021-05-18
466,小**7,口味: 经典原味（碱性24瓶）,好评,非常好的商家,-,-,2021-05-18
467,w**n,口味: 经典原味（碱性24瓶）,好评,不错，一如既往的好 ,-,-,2021-05-16
468,七**十,口味: 经典原味（碱性24瓶）,好评,不错，是苏打的味道,-,-,2021-05-17
469,h**9,口味: 经典原味（碱性24瓶）,好评,物流很快，第二天就送到家门口 ,-,-,2021-06-09
470,宦**3,口味: 经典原味（碱性24瓶）,好评,挺好的，喜欢！还会再来的,-,-,2021-05-27
471,t**9,口味: 清新薄荷味（碱性24瓶）3月新货,好评,口感不错，发货速度快,-,-,2021-05-14
472,琉**心,口味: 经典原味（碱性24瓶）,好评,水很好喝，快递小哥也很敬业，赞一个,-,-,2021-05-23
473,x**9,口味: 经典原味（碱性24瓶）,好评,不错，配送也快 ,-,-,2021-05-20
474,y**3,口味: 经典原味（碱性24瓶）,好评,发货很快，挺好的,-,-,2021-05-13
475,t**4,口味: 经典原味（碱性24瓶）,好评,收到了，定期购买,-,-,2021-05-16
476,f**n,口味: 清新薄荷味（碱性24瓶）,好评,口感不错，到嘴里有一点点薄荷的清凉味道。 ,-,-,2021-06-04
477,y**1,口味: 经典原味（碱性24瓶）,好评,宝贝很快就收到了，每次都是赶在活动的时候，都会享受到一个不错的优惠价格，与活动力度也是很可观的！宝贝也是经过层层筛选，然后相互比较，才会得到心意的产品！物流也是相当的给力呢，也是事先沟通好所要选择的物流公司，所以才会彼此都省事，更妥当，更方便！ ,-,-,2021-04-22
478,捉**九,口味: 经典原味（碱性24瓶）,好评,口感味道：有点太甜了。 包装品质：还好 外观品相：还可以 ,-,-,2021-05-01
479,w**8,口味: 经典原味（碱性24瓶）,好评,包装完好，宝贝无破损，日期新鲜，味道不错 ,-,-,2021-05-03
480,l**3,口味: 喵室友联名款（原味24瓶）9月日期,好评,好喝，媳妇孩子都喜欢喝，比一些小品牌味道好的多 ,-,-,2021-05-01
481,兜**子,口味: 经典原味（碱性24瓶）,好评,其它都还不错。就是自从买了这个水之后，已经接到七八个焦作的莫名电话，说是打错了。 我也是问号脸。因为我从没有去过焦作或者怎样。只能是这次买水的发货地在焦作了。,-,-,2021-05-24
482,j**5,口味: 经典原味（碱性24瓶）,好评,在薇娅直播间抢购的，这个水有淡淡的甜味，很好喝，儿子也很喜欢喝。如果下次还有优惠的话，会继续购买的，希望优惠活动多多，哈哈哈哈哈哈😄 ,-,-,2021-04-17
483,唐**j,口味: 经典原味（碱性24瓶）,好评,苏打水收到了哦希望能慢慢减下来，喝完继续回购 ,-,-,2021-04-28
484,t**5,口味: 经典原味（碱性24瓶）,好评,这玩意儿是真好喝，泰国象牌的那个真喝不来🤓,-,-,2021-04-20
485,y**6,口味: 经典原味（碱性24瓶）,好评,正品，味道好，出门喜欢带上一瓶,-,-,2021-04-21
486,红**2,口味: 经典原味（碱性24瓶）,好评,对我这种又想减肥，肠胃又不太好，还经常运动的人非常理想/满意的饮品。大量囤货，一定会回购的。希望店家生意兴隆，以后多给点优惠哦！😁😁😜😜,-,-,2021-04-17
487,s**屁,口味: 经典原味（碱性24瓶）,好评,还是喜欢柠檬味的 ,-,-,2021-04-17
488,a**果,口味: 经典原味（碱性24瓶）,好评,一直在实体买，第一次在网上买，比实体便宜点 ,-,-,2021-04-18
489,颗**啦,口味: 经典原味（碱性24瓶）,好评,好喝，味道有淡淡的甜，比白开好喝太多了,-,-,2021-04-16
490,枫**刃,口味: 经典原味（碱性24瓶）,好评,此用户没有填写评价。,喝这一箱水我搬着走了2公里，估计到家我也喝完了！,-,2021-05-27
491,k**3,口味: 经典原味（碱性24瓶）,好评,生产日期比较近，买来备着吃火锅，烧烤时喝 ,-,-,2021-04-20
492,s**h,口味: 经典原味（碱性24瓶）,好评,不知道好不好 反正出门带一瓶哦 ,-,-,2021-05-27
493,x**8,口味: 经典原味（碱性24瓶）,好评,发货速度很快 性价比很高 ,-,-,2021-06-20
494,y**七,口味: 经典原味（碱性24瓶）,好评,淡淡的味道，口感相当不错。 ,-,-,2021-05-07
495,x**g,口味: 经典原味（碱性24瓶）,好评,名仁的苏打水不是第一次购买了，口感挺不错的，平时就有喝苏打水的习惯，确实不错，总体挺好的。 ,-,-,2021-04-20
496,t**2,口味: 经典原味（碱性24瓶）,好评,全家都喜欢的饮用水！,-,-,2021-05-08
497,向**剑,口味: 经典原味（碱性24瓶）,好评,物品收到，服务五星，物流给力！ ,-,-,2021-04-21
498,冬**z,口味: 经典原味（碱性24瓶）,好评,好喝，带一丝回甘 ,-,-,2021-04-23
499,5**4,口味: 经典原味（碱性24瓶）,好评,收到货，第一时间拆包装，感觉质量还是比较好的，与卖家描述的还是一致的，非常满意，发货速度比较快，物流公司服务态度很好，运送速度很快，总的来说这次是很满意的一次购物，感谢卖家。,-,-,2021-04-18
500,t**n,口味: 经典原味（碱性24瓶）,好评,刚好做活动，价格便宜了很多，性价比超高，真的特别划算,-,-,2021-04-20
501,王**9,口味: 经典原味（碱性24瓶）,好评,口感清淡，好喝，直播间比超市便宜。 ,-,-,2021-04-17
502,石**8,口味: 经典原味（碱性24瓶）,好评,此用户没有填写评价。,淡淡的甜，天气热刚好带着，喝着清爽。一打开就被孩子一瓶全喝光了,-,2021-04-19
503,w**1,口味: 经典原味（碱性24瓶）,好评,这种水真的很好吃😋，比起以前买的苏打水要好很多，继续保持自然状态的水，我回回购的。,-,-,2021-04-17
504,w**8,口味: 经典原味（碱性24瓶）,好评,此用户没有填写评价。,就是好喝,-,2021-05-30
505,y**o,口味: 经典原味（碱性24瓶）,好评,价格实惠，质量杠杠的，非常好的一次购物，下次还来,-,-,2021-04-16
506,n**1,口味: 经典原味（碱性24瓶）,好评,不错很划算比超市便宜，家里人都喜欢喝 ,-,-,2021-05-05
507,k**5,口味: 经典原味（碱性24瓶）,好评,直播间购买的，价格很实惠，一直喜欢和喝苏打水，直播间看到，就买来试试，还是很好的，这个才艺牌子也还可以。 ,-,-,2021-04-17
508,看**啊,口味: 经典原味（碱性24瓶）,好评,冰镇更可口 ,-,-,2021-04-18
509,豚**儿,口味: 经典原味（碱性24瓶）,好评,全家人都爱喝，尤其是孩子，苏打水也比较健康，总比喝饮料强。 ,-,-,2021-04-18
510,戴**8,口味: 经典原味（碱性24瓶）,好评,希望优惠力度大一点儿，爸爸喝了酒很喜欢喝这个，一个夏天买五件 ,-,-,2021-04-21
511,芦**0,口味: 经典原味（碱性24瓶）,好评,比超市优惠点，新日期，常备，囤货。 ,-,-,2021-04-18
512,g**8,口味: 经典原味（碱性24瓶）,好评,宝贝心仪很久了，趁活动时候买真的太划算了，喜欢的不要犹豫啊 ,-,-,2021-04-16
513,安**棠,口味: 经典原味（碱性24瓶）,好评,宝贝还不错，性价比比较高，推荐购买哦，可以的。 ,-,-,2021-04-20
514,t**8,口味: 清新薄荷味（碱性24瓶）3月新货,好评,日期新，口感不错，包装牢固，发货快。 ,-,-,2021-06-21
515,t**2,口味: 经典原味（碱性24瓶）,好评,少了一箱,-,-,2021-05-27
516,s**n,口味: 经典原味（碱性24瓶）,好评,非常好，口感刚好，实惠 ,-,-,2021-06-21
517,g**8,口味: 经典原味（碱性24瓶）,好评,大品牌！值得信赖的！效果超级好！贵有贵的道理！很棒的商品！ ,-,-,2021-04-16
518,早**晨,口味: 经典原味（碱性24瓶）,好评,本来想买纯水的，买错了，先喝着吧,-,-,2021-04-27
519,w**1,口味: 喵室友联名款（原味24瓶）9月日期,好评,东西收到了，质量很好，价格实惠，值得购买。,-,-,2021-04-20
520,朴**勋,口味: 经典原味（碱性24瓶）,好评,一般般 感觉还普通矿泉水好喝 太甜了这个苏打水 ,-,-,2021-04-18
521,a**儿,口味: 经典原味（碱性24瓶）,好评,常年备货，囤货必买款，n次回购，有活动大家就赶紧买 ,-,-,2021-03-07
522,x**1,口味: 经典原味（碱性24瓶）,好评,直播买的，优惠不少，家里人都喜欢喝,-,-,2021-04-20
523,z**b,口味: 经典原味（碱性24瓶）,好评,比薇娅直播间都便宜，再也不在直播间买了 ,-,-,2021-04-26
524,x**1,口味: 经典原味（碱性24瓶）,好评,东西不错，物流太差太差了，周折了许多天才送到收货地点，希望更换物流,-,-,2021-05-25
525,c**o,口味: 经典原味（碱性24瓶）,好评,尿酸患者不要买，这商家真的为了利益在这虚假宣传，,-,-,2021-05-26
526,t**2,口味: 经典原味（碱性24瓶）,好评,老公的最爱，挺合适的价格,-,-,2021-04-16
527,有**叫,口味: 喵室友联名款（原味24瓶）9月日期,好评,日期确实不太好，但是价格划算，每天喝还是挺快就能喝完的，好评呀 ,-,-,2021-04-30
528,夏**年,口味: 经典原味（碱性24瓶）,好评,薇娅直播间买的，划算，水也可以。,-,-,2021-04-26
529,w**7,口味: 经典原味（碱性24瓶）,好评,習慣喝蘇打水了，淡淡的味道。不再喝可樂了，需要再來 ,-,-,2021-04-18
530,t**1,口味: 清新薄荷味（碱性24瓶）3月新货,好评,味道不错，清淡的薄荷味，清爽不腻,-,-,2021-04-30
531,t**8,口味: 经典原味（碱性24瓶）,好评,收到了很满意，家里的常备之水，感谢快递小哥给我带到楼下，免得去驿站搬运太麻烦了，谢谢！,-,-,2021-06-21
532,手**6,口味: 经典原味（碱性24瓶）,好评,包装很好。跟实体店买的一样！喝完再来买！,-,-,2021-04-16
533,小**i,口味: 经典原味（碱性24瓶）,好评,还可以真的很好，性价比也很高，质量也很好，物流也快啊！一天就到货了！ ,-,-,2021-04-27
534,寒**雪,口味: 经典原味（碱性24瓶）,好评,水口感挺好的，小瓶子喝起来也方便 ,-,-,2021-04-21
535,苏**0,口味: 经典原味（碱性24瓶）,好评,超好喝，最爱喝柠檬味的,-,-,2021-04-28
536,t**7,口味: 经典原味（碱性24瓶）,好评,产品真的超级棒，下次还会买的，愿越做越好，非常好的购物体验 ,-,-,2021-06-26
537,云**8,口味: 经典原味（碱性24瓶）,好评,给老公买的，没看到实物，不过他说挺好喝的 ,-,-,2021-04-19
538,喵**6,口味: 经典原味（碱性24瓶）,好评,第二次买 买来孕期喝 挺不错的 偶尔恶心 或者出去带着 ,-,-,2021-04-21
539,h**8,口味: 经典原味（碱性24瓶）,好评,买给老公喝的，他尿酸高，口感他也喜欢……,-,-,2021-04-19
540,张**哥,口味: 清新薄荷味（碱性24瓶）2月新货,好评,包装严实，味道不错，有活动再来买。 ,-,-,2021-04-18
541,l**l,口味: 经典原味（碱性24瓶）,好评,比超市便宜 ,-,-,2021-04-20
542,t**0,口味: 经典原味（碱性24瓶）,好评,帮一个阿姨买的 用来减肥用的 她说挺好的 ,-,-,2021-06-16
543,方**4,口味: 清新薄荷味（碱性24瓶）,好评,味道一般，像薄荷味牙膏 ,-,-,2021-06-01
544,1**洁,口味: 经典原味（碱性24瓶）,好评,味道不错，夏天喝很清新，解渴 ,-,-,2021-05-02
545,齐**9,口味: 经典原味（碱性24瓶）,好评,感觉味道比超市里，稍微甜了些,-,-,2021-06-04
546,x**9,口味: 经典原味（碱性24瓶）,好评,多次购买这款水了，口喝、口干必选；功能还有很多……这家客服态度非常好，全部五星好评！,-,-,2021-05-07
547,豆**6,口味: 经典原味（碱性24瓶）,好评,包装很好，快递给力，卖家很有信誉，发货速度也很快。价格更是比别家的实惠多了 ,-,-,2021-04-28
548,x**e,口味: 经典原味（碱性24瓶）,好评,好喝，价格实惠，没多久就喝完了,-,-,2021-04-22
549,l**0,口味: 经典原味（碱性24瓶）,好评,味道真的很好，买了两次了，味道也很给力！！！今后还会多次回购！ ,-,-,2021-05-03
550,t**0,口味: 经典原味（碱性24瓶）,好评,最爱的一款苏打水，好喝 推荐 ,-,-,2021-06-16
551,y**1,口味: 经典原味（碱性24瓶）,好评,给爸爸买的，每天喝几瓶，等喝完了会回购的。 ,-,-,2021-05-08
552,t**4,口味: 经典原味（碱性24瓶）,好评,因为胃经常反酸，喝点这水舒服😊，趁活动屯点儿货。呵呵,-,-,2021-05-03
553,d**y,口味: 经典原味（碱性24瓶）,好评,好喝好喝，买下来太划算了 ,-,-,2021-04-27
554,t**2,口味: 经典原味（碱性24瓶）,好评,苏打水的味道怪怪的，菲常不适应这味道，尝了一瓶就不敢再喝了。,-,-,2021-06-02
555,w**里,口味: 经典原味（碱性24瓶）,好评,(๑•̀ㅂ•́)و✧价格超优惠,-,-,2021-04-20
556,阳**5,口味: 经典原味（碱性24瓶）,好评,其中一箱纸盒都破了，砸脚了,-,-,2021-06-03
557,玉**鱼,口味: 清新薄荷味（碱性24瓶）3月新货,好评,口感很好，有淡淡甜美薄荷味。发货快，服务好，值得信赖。 ,-,-,2021-04-19
558,梦**见,口味: 经典原味（碱性24瓶）,好评,赠品超难喝 跟漱口水一样,-,-,2021-04-30
559,t**5,口味: 经典原味（碱性24瓶）,好评,买来送人的  备注让多加一层包装  客服也非常热情 ,-,-,2021-04-19
560,x**1,口味: 经典原味（碱性24瓶）,好评,价格合适，喝的不错。,-,-,2021-05-05
561,小**丶,口味: 经典原味（碱性24瓶）,好评,直播价格很优惠～希望活动常有 ,-,-,2021-04-23
562,珑**儿,口味: 经典原味（碱性24瓶）,好评,多次购买了，说对尿酸高的吃了好，希望有帮助吧,-,-,2021-05-08
563,快**6,口味: 经典原味（碱性24瓶）,好评,很划算啊啊啊啊，买了兑换卡。 ,-,-,2021-06-21
564,萝**3,口味: 经典原味（碱性24瓶）,好评,🎈商品收到了，包装得很好，物流非常快，客服态度很积极，有问题及时解答！总体来说非常满意！,-,-,2021-04-18
565,c**2,口味: 清新薄荷味（碱性24瓶）,好评,快递没打电话，没发信息，翻看物流信息才知道已经签收，都不知道放哪里！,-,-,2021-06-04
566,k**u,口味: 经典原味（碱性24瓶）,好评,老客户了，经常回购！物流很快，有时还优惠让利！ ,-,-,2021-05-02
567,芮**娘,口味: 经典原味（碱性24瓶）,好评,挺好的，趁着活动买的，比线下便宜，满意。 ,-,-,2021-04-27
568,w**生,口味: 加葡萄糖酸锌（碱性24瓶）,好评,包装有点损坏，其他还好 ,-,-,2021-06-01
569,漫**莜,口味: 经典原味（碱性24瓶）,好评,和超市卖的苏打水一样,-,-,2021-04-22
570,t**1,口味: 清新薄荷味（碱性24瓶）3月新货,好评,口感味道：清新甜美 ,-,-,2021-05-04
571,草**夏,口味: 经典原味（碱性24瓶）,好评,比实体店划算 ,-,-,2021-05-09
572,郑**k,口味: 经典原味（碱性24瓶）,好评,东东完美收到了生产日期又是四月份的满意谢谢了,-,-,2021-04-25
573,h**2,口味: 经典原味（碱性24瓶）,好评,和之前店里买的一样,-,-,2021-04-20
