1307,大**9,颜色分类: 【中号双倍加厚】双面抗菌专利/砍剁不伤刀,好评,菜板很好，双面的用着比较放心，重量也很好，切菜不会跑，下次有需要的话会再来的，好评好评哦！ ,好评，用了几天了，朋友看了也说很好，推荐大家购买！,家图腾双面抗菌菜板，生熟食区分，一冲即净。我们一直秉承“99天剁坏包换”为原则，坚信质量与服务是口碑的前提，为您提供实打实的产品与质量和服务，vip客服竭力尽心提供优质服务！期待咱们下次合作 【家图腾旗舰店】,2021-05-24
1308,z**8,颜色分类: 【中号双倍加厚】双面抗菌专利/砍剁不伤刀,好评,产品设计人性化，颜值高，再也不用为砧板发霉而愁了 ,-,-,2021-05-12
1309,兵**2,颜色分类: 中号 加厚款【304不锈钢+抗菌pp剁骨面】,好评,东西收到了。很实在也好用。比以前买的木的质量好多了。用的也是很放心。 ,已经用了几天了在来评价的。用起来很放心和安全。不用担心发霉了。清洗起来也是很方便的。,-,2021-05-19
1310,v**炜,颜色分类: 大号 加厚款【304不锈钢+抗菌pp剁骨面】,好评,外观材质：不锈钢 商品品质：看起来高档，还赠送了刨子挺好的，推荐 ,-,-,2021-05-25
1311,如**8,颜色分类: 【大号双倍加厚】双面抗菌专利/砍剁不伤刀,好评,菜板外形大气，颜色漂亮，实用，放心。,这个菜板满足了我对健康卫生的所有要求，很满意的一次购物,-,2021-05-22
1312,王**1,颜色分类: 大号 加厚款【304不锈钢+抗菌pp剁骨面】,好评,菜板两面使用  超级好  之前的菜板老发霉  买了这个再也不用担心这个问题了,面板真心好  朋友推荐给我的  喜欢的可以下单了,健康，安全，卫生，不发霉，不滋生细菌，全新升级中科院专利不锈钢材质双面菜板，生食熟食分开.菜板首选   【家图腾旗舰店】,2021-05-21
1313,l**w,颜色分类: 【大号双倍加厚】双面抗菌专利/砍剁不伤刀,好评,宝贝已收到，质量非常棒，双面都可以使用，又好打理。 ,宝贝用了一段时间，很好用，质量很好。  很干净，不长霉。,-,2021-05-12
1314,小**3,颜色分类: 中号加厚款【304不锈钢+抗菌pp剁骨面】,好评,给老妈买的，她还满意，做工不错，格家里现有的替换着用，好清洗 ,-,-,2021-06-26
1315,h**y,颜色分类: 【大号双倍加厚】双面抗菌专利/砍剁不伤刀,好评,菜板收到，沉甸甸的，是双面，切菜切水果还是挺不错的，清洗也方便，爱了 ,我看了好多家，最后还是选了这里，没选错，很满意,-,2021-05-22
1316,迷**0,颜色分类: 【大号双倍加厚】双面抗菌专利/砍剁不伤刀,好评,外观材质：外观漂亮，是我想要的，非常喜欢。 ,这个菜板非常好，干净卫生，再也不用担心有霉菌了。,-,2021-05-19
1317,w**3,颜色分类: 【大号双倍加厚】双面抗菌专利/砍剁不伤刀,好评,宝贝收到了，很喜欢，把木菜板换掉用不锈钢菜板感觉心情好，因为它干净卫生且防霉，值得购买。,-,-,2021-05-23
1318,无**6,颜色分类: 【中号双倍加厚】双面抗菌专利/砍剁不伤刀,好评,非常喜欢这个宝贝，再也不担心阴天下雨会发霉了,已经开始使用了，真的很实用，洗刷也方便，再也不用担心菜板长毛毛了,-,2021-05-18
1319,f**婷,颜色分类: 大号 加厚款【304不锈钢+抗菌pp剁骨面】,好评,可以 主要是家里的木菜板 容易发霉  换个这样的 比较省事 好洗,-,-,2021-05-13
1320,梓**店,颜色分类: 【大号双倍加厚】双面抗菌专利/砍剁不伤刀,好评,菜板收到了，质量很好的，棱角做工很精细，继续回购,-,-,2021-05-18
1321,m**u,颜色分类: 【中号双倍加厚】双面抗菌专利/砍剁不伤刀,好评,牛油果色很漂亮，两面切了都会有一点纹，不过没有影响，PP面切生的，不锈钢切水果。 ,-,-,2021-05-15
1322,鱼**儿,颜色分类: 【中号 双倍加厚】 双面抗菌专利/砍剁不伤刀,好评,PP面砍鸡还是会有很深的刀痕 ,客服编号201已回访，我再用用看,-,2021-06-16
1323,a**3,颜色分类: 中号 加厚款【304不锈钢+抗菌pp剁骨面】,好评,菜板很厚，墩实，一面是不锈钢一面是塑料的，颜值很高,用着不错，好清洗,-,2021-05-24
1324,花**2,颜色分类: 中号 加厚款【304不锈钢+抗菌pp剁骨面】,好评,不错，挺厚实的，也方便,-,-,2021-05-30
1325,施**4,颜色分类: 中号 加厚款【304不锈钢+抗菌pp剁骨面】,好评,厚实！实用，店家还送了礼物，是我一直想要的砧板！ ,我用一段时间了，真好！好清洗还防霉！干干净净看着就舒服😊！,-,2021-05-14
1326,a**3,颜色分类: 大号 加厚款【304不锈钢+抗菌pp剁骨面】,好评,菜板很厚实，一面是不锈钢可以切菜，一面是塑料可以剁肉,-,-,2021-05-24
1327,c**8,颜色分类: 【大号双倍加厚】双面抗菌专利/砍剁不伤刀,好评,大小合适，双面抑菌，效果很满意。高兴的一次购物 ,不错不错，效果体验很好,-,2021-05-26
1328,古**风,颜色分类: 【大号双倍加厚】双面抗菌专利/砍剁不伤刀,好评,对比了好多家，选了这款抗菌不钢材菜板，不会生锈也不会腐烂，特别厚实，没有毛边，很安全。也比较好清理，不会有残留物，切完水果一擦就可以了。尺寸刚刚好特厚实，硬度好，还不会发霉，清洗特别方便，好用健康卫生 还不贵 推荐购买 ,之前用的木菜板会串味，这款菜板切鱼切肉后水冲洗下也不会有难闻的味道，这点非常喜欢，可以放心购买,家图腾双面抗菌菜板，一面采用的拥有专利抗菌不锈钢材质，抗菌率高达99.99%.另一面采用的是德国技术高韧性食品级PP材质，耐砍耐剁.拥有强大的99天无理由退换货的售后质保，让您多一份安心.【家图腾旗舰店】,2021-05-03
1329,女**1,颜色分类: 【大号双倍加厚】双面抗菌专利/砍剁不伤刀,好评,好用，拿到家马上拆了试用，在也不用但心有水亦出来了，朋友也要了连接要买,-,-,2021-05-10
1330,柠**8,颜色分类: 中号 加厚款【304不锈钢+抗菌pp剁骨面】,好评,挺重的，外环也好看，感觉质量不错，很划算 ,推荐购买！晚上用了一下，挺好用的，好评！,-,2021-05-15
1331,赐**坊,颜色分类: 【大号 双倍加厚】 双面抗菌专利/砍剁不伤刀,好评,重量够，质感不错！挺好用的，期待后面效果,用的还不错哈！值得买,-,2021-05-23
1332,t**6,颜色分类: 【中号双倍加厚】 双面抗菌专利/砍剁不伤刀,好评,质量很好的菜板 厚度也达到了要求 PP材质也不错 没什么异味 总体不错。而且使用的是中科院专利抗菌不锈钢材质，不会影响身体，更不会有发霉的情况，切了菜试了一下，落刀很稳而且不伤刀，上手你就可以知道有多顺手了。,-,-,2021-06-18
1333,姚**8,颜色分类: 【中号双倍加厚】双面抗菌专利/砍剁不伤刀,好评,宝贝收到了，老公也很喜欢，再也不用担心存黄曲霉素了，好喜欢 ,宝贝用了几天，一面可以切熟菜，一面可以却生菜，再也不用担心交叉感染了，而且不像以前用的木质的老是担心有黄曲霉素，这个砧板解决了所有的担心,-,2021-05-13
1334,s**心,颜色分类: 中号加厚款【304不锈钢+抗菌pp剁骨面】,好评,很棒。喜欢。非常好 ,-,-,2021-05-29
1335,t**3,颜色分类: 【大号双倍加厚】双面抗菌专利/砍剁不伤刀,好评,菜板收到了，颜值的确很高，非常的高大上，两面都可以用，特别喜欢，给个大大的赞👍,-,-,2021-06-16
1336,努**阳,颜色分类: 【大号双倍加厚】双面抗菌专利/砍剁不伤刀,好评,很有重量，抗菌，比木菜板好用很多，也卫生。特别好。 ,切菜好用，还能跺骨头。特别棒。,-,2021-05-20
1337,y**3,颜色分类: 中号 加厚款【304不锈钢+抗菌pp剁骨面】,好评,菜板收到了，看起来很上档次，亲们可以放心购买,今天回家用了，特别好用，不伤刀，而且好清洗,-,2021-05-14
1338,t**4,颜色分类: 【中号双倍加厚】双面抗菌专利/砍剁不伤刀,好评,质量真的不错，也好切菜，主要是不会发霉，也不是很重，准备给妈妈家也换上 ,-,-,2021-06-09
1339,s**2,颜色分类: 【大号双倍加厚】双面抗菌专利/砍剁不伤刀,好评,用了几天来评论，质量非常好，颜值也好看，收纳也方便 ,安全实用不滋生细菌，冲洗也很方便,-,2021-05-26
1340,t**6,颜色分类: 中号加厚款【304不锈钢+抗菌pp剁骨面】,好评,菜板很厚实，质量很好，商家很细心配有详细的使用方法 ,-,-,2021-06-18
1341,z**2,颜色分类: 【大号双倍加厚】双面抗菌专利/砍剁不伤刀,好评,跟商家描述一样，真是太好了，包装很好 挺高大上的，朋友们放心购买，我也推荐朋友购买了 ,-,-,2021-05-23
1342,李**倩,颜色分类: 【大号双倍加厚】双面抗菌专利/砍剁不伤刀,好评,切菜板做的美观大方，两面可以做到生熟分开，更加卫生。到货后立即就使用上了，淘汰了原来的木菜板。这个菜板稳固结实，而且大小适中，不锈钢的一面切菜声响也不大，完全可以接受。但是不会积累食材残渣，用水冲洗就好了。很方便，且菜板可悬挂，收纳方便。 ,非常不错的菜板，两面都可以使用，不过这款菜板清洗起来很方便。刀板收到了，太给力了，这刀板就不会霉了，比木头刀板好。大小刚好够用。钢面切菜很有感觉，挺好用的。尺寸大小也比较合适。,家图腾双面抗菌菜板，一面采用的拥有专利抗菌不锈钢材质，抗菌率高达99.99%.另一面采用的是德国技术高韧性食品级PP材质，耐砍耐剁.拥有强大的99天无理由退换货的售后质保，让您多一份安心.【家图腾旗舰店】,2021-06-20
1343,若**夕,颜色分类: 【大号 双倍加厚】 双面抗菌专利/砍剁不伤刀,好评,菜板很厚实，双面抗菌的，一面是中科院专利不锈钢材质，可以切生食和熟食，很好清洗，不会残留污渍，一面是德国高韧性食品级PP材质的.可以砍骨头，还有防滑颗粒的哦，切菜也是不会打滑，好用，非常超值的菜板。,用了好些日子了 一直没及时评价。菜板确实好 比以前任何一个都好。准备在给老妈买一个,健康，安全，卫生，不发霉，不滋生细菌，全新升级中科院专利不锈钢材质双面菜板，生食熟食分开.菜板首选   【家图腾旗舰店】,2021-05-05
1344,s**4,颜色分类: 【中号双倍加厚】双面抗菌专利/砍剁不伤刀,好评,很不错的菜板，超出我的预期，妈妈说切菜时手感很好，值得推荐！ ,真是不错，也很好清洁,健康，安全，卫生，不发霉，不滋生细菌，全新升级中科院专利不锈钢材质双面菜板，生食熟食分开.菜板首选   【家图腾旗舰店】,2021-05-11
1345,巴**m,颜色分类: 【大号 双倍加厚】 双面抗菌专利/砍剁不伤刀,好评,此用户没有填写评价。,客服服务态度很好,-,2021-06-05
1346,紫**柜,颜色分类: 中号 加厚款【304不锈钢+抗菌pp剁骨面】,好评,很不错，切上去感觉挺好，希望能用住。,-,-,2021-04-30
1347,a**u,颜色分类: 【大号双倍加厚】双面抗菌专利/砍剁不伤刀,好评,菜板很好用，最主要是不生霉好清理，正反都能用，好评。 ,-,-,2021-05-19
1348,t**9,颜色分类: 【中号 双倍加厚】 双面抗菌专利/砍剁不伤刀,好评,菜板还不错，用起来顺手，用完用水冲一下就行，用完立在一边美观不占地方。四周边角圆滑，没有毛刺，摸起来非常光滑。和木板不一样，简单清洗一下就干净了，我是奔着抗菌买的，双面不一样的材质，生熟可以分开切，有效避免了细菌的交叉感染，总体和描述的一致，非常喜欢,这个抗菌不锈钢菜板真的不错，挺喜欢的，感觉用起来就很喜欢，以后会再次来购买的[胜利],健康，安全，卫生，不发霉，不滋生细菌，全新升级中科院专利不锈钢材质双面菜板，生食熟食分开.菜板首选   【家图腾旗舰店】,2021-06-18
1349,l**7,颜色分类: 中号 加厚款【304不锈钢+抗菌pp剁骨面】,好评,中号的也不小，够用了，看着挺好的，也挺厚实的，期待使用效果！ ,物美价廉，推荐购买！,家图腾双面抗菌菜板，生熟食区分，一冲即净。我们一直秉承“99天剁坏包换”为原则，坚信质量与服务是口碑的前提，为您提供实打实的产品与质量和服务，vip客服竭力尽心提供优质服务！期待咱们下次合作 【家图腾旗舰店】,2021-06-20
1350,l**5,颜色分类: 中号 加厚款【304不锈钢+抗菌pp剁骨面】,好评,菜板收到了看起来不错沉甸甸的特别喜欢，大小正合适，好评 ,-,-,2021-05-23
1351,和**7,颜色分类: 中号 加厚款【304不锈钢+抗菌pp剁骨面】,好评,颜色很清新，实物有份量，不错的菜板。,-,-,2021-05-23
1352,t**9,颜色分类: 【大号双倍加厚】双面抗菌专利/砍剁不伤刀,好评,绝对好用到爆👍外形好看美观，无异味无色差，卖家服务态度很好，物流超快！还会继续光顾小店的👍 ,-,-,2021-06-18
1353,蒋**7,颜色分类: 【大号双倍加厚】双面抗菌专利/砍剁不伤刀,好评,刚收到还没使用，菜板厚度大小感觉还不错,两面用的就是好干净又卫生,-,2021-05-22
1354,张**n,颜色分类: 中号 加厚款【304不锈钢+抗菌pp剁骨面】,好评,菜板已经收到了，老婆用了挺满意的，一下买了2个，每天用它称赞好，这个东西老婆最有权威评价,-,-,2021-05-24
1355,l**c,颜色分类: 【中号 双倍加厚】 双面抗菌专利/砍剁不伤刀,好评,包装也很结实，砧板收到时完好无损，这个砧板够大，可以两面用，一面是不锈钢，另一面是pp面，水果和熟食分开用，生食另外用一张砧板，看中不锈钢是因为好清洗，也不易长霉菌，卫生健康，目前用着还不错。喜欢的亲们赶紧下手吧，放心购买吧！！,用过之后非常好 一点都不滑 包装完好，使用起来稳固结实，厚度重量，尺寸大小非常合适，而且不锈钢材质真是好清洁，和刀具放在一起很协调美观 推荐给朋友也买了。,健康，安全，卫生，不发霉，不滋生细菌，全新升级中科院专利不锈钢材质双面菜板，生食熟食分开.菜板首选   【家图腾旗舰店】,2021-04-27
1356,玖**明,颜色分类: 中号 加厚款【304不锈钢+抗菌pp剁骨面】,好评,挺好的上档次，终于有一块不会发霉不会变黑的菜板了，干饭人放心了。,用了感觉确实不错，值得👍,健康，安全，卫生，不发霉，不滋生细菌，全新升级中科院专利不锈钢材质双面菜板，生食熟食分开.菜板首选   【家图腾旗舰店】,2021-05-11
1357,h**6,颜色分类: 中号加厚款【304不锈钢+抗菌pp剁骨面】,好评,用後再評 ,-,-,2021-06-01
1358,大**月,颜色分类: 【大号双倍加厚】双面抗菌专利/砍剁不伤刀,好评,实物很好设计的很好，切了水果汁不会在留的到处都是了。厨房用的必须要选好一点的，安全第一,用过几天产品真的很不错，在入手一个准备,家图腾双面抗菌菜板，一面采用的拥有专利抗菌不锈钢材质，抗菌率高达99.99%.另一面采用的是德国技术高韧性食品级PP材质，耐砍耐剁.拥有强大的99天无理由退换货的售后质保，让您多一份安心.【家图腾旗舰店】,2021-05-20
1359,y**2,颜色分类: 【大号双倍加厚】双面抗菌专利/砍剁不伤刀,好评,宝贝收到了，物流很快，收货满意。菜板双面两用，试了一下效果不错，很干净物美价廉，第一次使用，期待后期的使用效果，好评！,用了几天，效果不错，很实用，也挺干净。,-,2021-05-23
1360,j**志,颜色分类: 大号 加厚款【304不锈钢+抗菌pp剁骨面】,好评,菜板收到了，颜值很高，感觉真的很不错。先用着看看。用着好的话，会推荐给亲戚朋友的。,-,-,2021-05-18
1361,梅**晴,颜色分类: 中号 加厚款【304不锈钢+抗菌pp剁骨面】,好评,菜板太好用了！不锈钢材质用着放心！背面也能用！ ,-,-,2021-05-11
1362,z**u,颜色分类: 【大号 双倍加厚】 双面抗菌专利/砍剁不伤刀,好评,很喜欢这款菜板，高大上，，很愉快的一次购物 ,回来特意两边都用了，，很好用，，也很好清理卫生,-,2021-05-22
1363,a**4,颜色分类: 【大号双倍加厚】双面抗菌专利/砍剁不伤刀,好评,很有份量。包装很好，顺丰发货，棒棒哒。刚收到，抗菌方面还不清楚，希望如描述的这样好。 ,-,-,2021-05-22
1364,s**n,颜色分类: 【中号双倍加厚】双面抗菌专利/砍剁不伤刀,好评,外观材质：美观大方，不像木制的笨重  商品品质：容易清洁，不容易藏污纳垢，目前试了一下切菜，剁菜效果怎么样还不知道 ,-,-,2021-05-13
1365,佳**5,颜色分类: 中号 加厚款【304不锈钢+抗菌pp剁骨面】,好评,菜板非常厚重质感非常好，而且非常容易清洗干净，很好用的产品，两面设计风格很好，一面是不锈钢，一面是塑料材质，非常方便实用，棒棒哒 ,-,-,2021-05-18
1366,小**磊,颜色分类: 【大号 双倍加厚】 双面抗菌专利/砍剁不伤刀,好评,很值得入手的一款菜板，很有分量，放在水池边切菜也刚好合适，这次刚好看到这个抗菌不锈钢材质的菜板果断入手，性价比很高，也不贵，一分钱一分货！尺寸大小也是很合适菜板分正反两个面，全不锈钢的很安全，好用推荐购买，边角也很圆滑。很方便打理清洗。一款值得回购的产品 ,外观很好看，刚拿回来就开始使用了，用完了还可以立起来，一点都不占位置的，使用也是很方便的。性价比很高，为了家人健康，值得拥有,家图腾全新升级采用双面抗菌设计，抗菌防霉家用菜板，仿大理石抗菌级PP面添加抗菌银离子可以达到抑制99%的细菌效果，魔方款不锈钢面采用医用级抗菌316L不锈钢最大程度上抑制细菌滋生，一冲即净，切菜不打滑、剁骨不伤刀、降噪低分贝，健康安全。双面抗菌菜板支持99天无理由退换货，售后无忧，您的满意才是我们的最高追求，期待您的再次光临哦,2021-04-20
1367,黄**3,颜色分类: 中号 加厚款【304不锈钢+抗菌pp剁骨面】,好评,包装很好，物流也很快，菜板材料厚实，品牌的东西就是不一样，还送了个刨刀,-,-,2021-05-18
1368,魏**叶,颜色分类: 【中号 双倍加厚】 双面抗菌专利/砍剁不伤刀,好评,挺好的，还送了刮皮刀,-,-,2021-06-04
1369,饶**9,颜色分类: 【大号双倍加厚】双面抗菌专利/砍剁不伤刀,好评,用了一段时间，好评,-,-,2021-05-28
1370,m**苏,颜色分类: 【大号双倍加厚】双面抗菌专利/砍剁不伤刀,好评,收到货马上试了一下，真的很好用，值得购买哦，我要推荐给身边的朋友 ,-,-,2021-05-10
1371,五**丶,颜色分类: 大号 加厚款【304不锈钢+抗菌pp剁骨面】,好评,回购的，非常好，一如既往，干净的刀板不生病比什么都重要，想换刀板的可以放心买啦,-,-,2021-05-20
1372,社**3,颜色分类: 【大号 双倍加厚】 双面抗菌专利/砍剁不伤刀,好评,客服服务好 ,-,-,2021-06-05
1373,t**0,颜色分类: 【大号 双倍加厚】 双面抗菌专利/砍剁不伤刀,好评,产品和商家描述相符，外观看起来还不错。用一段时间就知道好不好用。 ,刚才用着试一下，好用。,-,2021-05-24
1374,l**n,颜色分类: 【中号 双倍加厚】 双面抗菌专利/砍剁不伤刀,好评,颜值很高，看着挺厚实的。质量很好，两面都可以用的，方便,-,-,2021-05-25
1375,天**8,颜色分类: 【中号双倍加厚】双面抗菌专利/砍剁不伤刀,好评,菜板收到了，看着质量不错 也美观的 ,-,-,2021-05-19
1376,z**5,颜色分类: 【大号双倍加厚】双面抗菌专利/砍剁不伤刀,好评,宝贝收到了，非常不错呦，喜欢的小伙伴们可以入手了，双面使用更健康！,-,-,2021-05-13
1377,倾**8,颜色分类: 【大号双倍加厚】双面抗菌专利/砍剁不伤刀,好评,切菜切肉都不错，很好清洗，很卫生。比起要发霉的菜板，不锈钢菜板就好多了。还可以擀面用,实用大方美观，值得购买的好产品,-,2021-05-26
1378,t**2,颜色分类: 【大号双倍加厚】双面抗菌专利/砍剁不伤刀,好评,第一次买这钟抗菌防霉的白板，感觉还是蛮卫生的，9也许是心理作用，现在生活条件好了，什么都比较讲究啦，切菜切肉都好用，推荐购买 ,-,-,2021-06-19
1379,我**后,颜色分类: 中号 加厚款【304不锈钢+抗菌pp剁骨面】,好评,质量很好，包装严实，颜色也是喜欢的，棒棒哒 ,晚上就迫不及待用啦，不错不错，值得购买,-,2021-05-12
1380,欧**2,颜色分类: 中号 加厚款【304不锈钢+抗菌pp剁骨面】,好评,很满意 刚刚用了一下 很好 切菜也不滑 很不错 下次会再来的 ,质量很不错 刚刚推荐我朋友了,-,2021-05-13
1381,鱼**3,颜色分类: 中号 加厚款【304不锈钢+抗菌pp剁骨面】,好评,东西很不错，两面都能用，还送了一个小板可以切水果用。,-,-,2021-05-16
1382,苹**h,颜色分类: 【大号 双倍加厚】 双面抗菌专利/砍剁不伤刀,好评,这个价格，确实有些贵，加厚加大，大到哪去了，为了能健康卫生，买这个，切个土豆 .两面都滑，没有预想的好用，朋友还问了，确实不推荐买,客服回访了，给20的红包，如果觉得不合适，在规定时间内还可以退货，就当运费了，服务挺周到的，不错,-,2021-06-09
1383,x**7,颜色分类: 【中号双倍加厚】双面抗菌专利/砍剁不伤刀,好评,产品功能：实用 外观材质：简洁 商品品质：好 ,-,-,2021-05-10
1384,t**8,颜色分类: 【大号双倍加厚】双面抗菌专利/砍剁不伤刀,好评,卫生，健康，不发霉，新时代用新产品，点赞 ,使用一段时间了，特别好用！,-,2021-05-14
1385,g**3,颜色分类: 中号加厚款【304不锈钢+抗菌pp剁骨面】,好评,耐思，用起来感觉很不错，应该挺耐用，完美，真的真的很不错 ,用起来真的可以，不怕掉渣了，完美,家图腾双面抗菌菜板，生熟食区分，一冲即净。我们一直秉承“99天剁坏包换”为原则，坚信质量与服务是口碑的前提，为您提供实打实的产品与质量和服务，vip客服竭力尽心提供优质服务！期待咱们下次合作 【家图腾旗舰店】,2021-06-12
1386,比**8,颜色分类: 【中号双倍加厚】双面抗菌专利/砍剁不伤刀,好评,很厚实，好评,-,-,2021-06-04
1387,梅**2,颜色分类: 大号 加厚款【304不锈钢+抗菌pp剁骨面】,好评,打开一看，好大一个。感觉就很好用的样子，等明天用过了再来追评 ,-,-,2021-05-21
1388,唯**意,颜色分类: 【大号双倍加厚】双面抗菌专利/砍剁不伤刀,好评,之前家里的菜板家里人普遍认为材质太软，用着太轻没有质感。看看去下单了这一款。大品牌值得信赖。菜板结实好用，也不占地方，配合挂钩可以挂在墙上，方便收纳。大小合适正好是我需要。喜欢用来切水果。切蔬菜。切肉的菜板正好和他分开。也介绍闺蜜买了。准备再买一个。,用起来感觉还不错的，之前的那个生霉了，就不想再用了，还是很不错的，质量也很好，一面不锈钢一面pp面，这种好用而且不会生霉。拿水一冲，干干净净，用的感觉不错，最起码家用足够了！,健康，安全，卫生，不发霉，不滋生细菌，全新升级中科院专利不锈钢材质双面菜板，生食熟食分开.菜板首选   【家图腾旗舰店】,2021-05-07
1389,吟**心,颜色分类: 【中号双倍加厚】双面抗菌专利/砍剁不伤刀,好评,很重，感觉就很耐用，看着很不错，做工精细 ,-,-,2021-05-11
1390,q**o,颜色分类: 中号 加厚款【304不锈钢+抗菌pp剁骨面】,好评,木菜板用久了容易发霉和凹陷，对身体不好。看中这个菜板有中科院专利，可以抗菌防霉，买个过来试用一下。目前看还行。 ,-,-,2021-05-19
1391,s**罢,颜色分类: 【中号双倍加厚】双面抗菌专利/砍剁不伤刀,好评,还是很有分量的，也没有气味。颜值不错！有需要会再来的！,-,-,2021-05-10
1392,t**9,颜色分类: 【大号 双倍加厚】 双面抗菌专利/砍剁不伤刀,好评,菜板收到货了 非常喜欢 用着放心再也不用怕菜板发霉了 ,客服态度很好 产品质量很好,-,2021-06-18
1393,刘**好,颜色分类: 【大号双倍加厚】双面抗菌专利/砍剁不伤刀,好评,宝贝收到了！感觉还可以！第一次用！一直想买个抗菌的，安全卫生，希望不会失望 ,-,-,2021-05-21
1394,x**5,颜色分类: 中号 加厚款【304不锈钢+抗菌pp剁骨面】,好评,菜板质感很好，顺丰物流也快，非常满意，谢谢客服。这次继续 ,马上清洗菜板，非常好切，一点不滑，以后可以分开生熟菜，介绍给亲戚同事。,-,2021-05-21
