286,t**8,颜色分类: 大号加厚款【304不锈钢+抗菌pp剁骨面】,好评,菜板收到了，终于可以生熟分开了，防止细菌滋生，非常好用！ ,非常好用，👍,家图腾双面抗菌菜板，生熟食区分，一冲即净。我们一直秉承“99天剁坏包换”为原则，坚信质量与服务是口碑的前提，为您提供实打实的产品与质量和服务，vip客服竭力尽心提供优质服务！期待咱们下次合作 【家图腾旗舰店】,2021-06-22
287,丁**选,颜色分类: 【大号 双倍加厚】 双面抗菌专利/砍剁不伤刀,好评,刚收到货，买的最大的那种，看起来质量不错，有点重，直播间买的说送19.9元的那种削皮刀，结果来的是这样一种削皮刀，其实消费者也不会因为送哪款削皮刀而买菜板，但是至少要说到做到吧。 ,-,-,2021-06-23
288,似**0,颜色分类: 【中号 双倍加厚】 双面抗菌专利/砍剁不伤刀,好评,这个菜板确实好用，之前是用的木菜板不好清洗，而且容易发霉容易裂开，这个确实好，还有一个水槽，而且好清洗，非常满意的一次网购。,从食品安全的角度来讲这个菜板还是不错的，食品级的不锈钢，切肉类的那面使用起来也比较好，清洗容易不会留残渣。很多超市的占板也是使用了这种材质。做工非常值得信赖！使用的很完美！,-,2021-06-07
289,t**4,颜色分类: 【中号 双倍加厚】 双面抗菌专利/砍剁不伤刀,好评,卫生，不发霉，两面都可以用，生熟菜可以分开，不锈钢很厚，很好切菜 ,-,-,2021-06-09
290,杨**1,颜色分类: 【大号 双倍加厚】 双面抗菌专利/砍剁不伤刀,好评,菜板颜色好干净的，做工精致，尺寸大小也够，摸着很结实，感觉不错，现给好评。 ,-,-,2021-06-23
291,思**闫,颜色分类: 【大号 双倍加厚】 双面抗菌专利/砍剁不伤刀,好评,产品功能：收到货就用了，老妈怕滑，不过确实一点都不滑，也很好清洗 ,特别的好用，而且特容易清洗,-,2021-06-23
292,t**8,颜色分类: 【大号双倍加厚】双面抗菌专利/砍剁不伤刀,好评,菜板挺好用的，主要方便清洁。而且它两面都可以用，切菜，切肉可以分开，比较木板来说干净卫生一些 ,看重抗菌买的，家里一直用的木菜板，使用时间久了，板面就开始发黄，四边角就开始发黑了，一点也不卫生。对比了好多家选了这款，一面采用抗菌不锈钢，一面是食品级pp材质的菜板，现在生熟食品可以分开了，避免了串味和细菌交叉感染，总体效果很满意。,-,2021-06-08
293,我**秋,颜色分类: 大号加厚款【304不锈钢+抗菌pp剁骨面】,好评,这款菜板看好了很久了，等到这次活动果断拍下来了，实物很漂亮双面使用生熟分开 还有滤水槽很赞,"切菜板质量还不错，以后不用担心发霉问题了，菜板特别厚实,有分量,,双面不同的材质，生熟食可以分开来切，有效避免了细菌的交叉感染，,板子切东西不容易滑动,，更安全。真心推荐这款颜值高的切板。物美价廉。喜欢的朋友可以下手了",-,2021-06-06
294,天**6,颜色分类: 中号加厚款【304不锈钢+抗菌pp剁骨面】,好评,原来的菜板用的有点发霉，看了几家才选的这家，看上去质量不错，值得信任，用了几天还不习惯，这个菜板不怕发霉啦 ,已经用了几天，还不错的，应该不会发霉，不错。,-,2021-06-23
295,流**止,颜色分类: 【中号 双倍加厚】 双面抗菌专利/砍剁不伤刀,好评,宝贝很好看也好用。之前买的木菜板的，很容易发霉，这样对健康很不利。就想买款不锈钢的菜板，到货后我试过了，菜板确实好用，PP材质的那面用来切肉最棒了，不锈钢那面切水果，切起来刷刷的顺手多了，清洗很方便，只需要用水冲一冲就很干净了。抗菌不锈钢材质的安全卫生！非常实用，价格便宜性价比高！特别好用，很满意的一个产品，卫生冲洗简单方便，妥妥好评好评。再也不用担心菜板霉变了。 ,我个人对于厨具的选择也特别讲究，⛳尤其是菜板的选择，不仅仅要实用，更要健康卫生🍣。不锈钢菜板避免了木菜板发霉的问题，做工精致，抗菌不锈钢的使用起来质量非常好，我是非常喜欢的啦,家图腾双面抗菌菜板，生熟食区分，一冲即净。我们一直秉承“99天剁坏包换”为原则，坚信质量与服务是口碑的前提，为您提供实打实的产品与质量和服务，vip客服竭力尽心提供优质服务！期待咱们下次合作 【家图腾旗舰店】,2021-06-06
296,t**2,颜色分类: 【中号 双倍加厚】 双面抗菌专利/砍剁不伤刀,好评,质量很好，防滑，干净，推荐购买,买回来就迫不及待的清洗试用，设计简约大方，冲洗方便，两面都可以用，质感不错，抗菌防霉还干净卫生。,-,2021-06-19
297,t**7,颜色分类: 大号加厚款【304不锈钢+抗菌pp剁骨面】,好评,菜板昨天收到了，看着质量很好，非常厚实，今天特意用了一下感觉不错，切菜时的声音不是很大，使用PP面切肉类，不锈钢面切蔬菜水果，杜绝生熟食细菌交叉感染，抗菌菜板使用健康卫生，不用担心发霉了，清洗也方便很多，立在墙边一会就干了  ,不锈钢表面光滑厚实，不粘，拿来揉面，做面食也不错，并且易清洗干净，使用比较卫生。值得拥有。,家图腾双面抗菌菜板，一面采用的拥有专利抗菌不锈钢材质，抗菌率高达99.99%.另一面采用的是德国技术高韧性食品级PP材质，耐砍耐剁.拥有强大的99天无理由退换货的售后质保，让您多一份安心.【家图腾旗舰店】,2021-06-18
298,z**5,颜色分类: 【大号 双倍加厚】 双面抗菌专利/砍剁不伤刀,好评,很有质感，白钢面会有轻微刀痕，不影响使用，也不伤刀！,用了一段时间了，很好用，好清洗还健康！,-,2021-06-21
299,刘**6,颜色分类: 大号加厚款【304不锈钢+抗菌pp剁骨面】,好评,不锈钢菜板收到可，质量挺不错的，有分量，大小刚刚好，非常实用，防滑又易清洗，抗菌健康，没有异味，切菜或者切水果不会滑动，使用完水冲洗下就干净了，切肉类可以用白色的那一面，特别好用，比之前家里用的木菜板好多了，抗菌防霉就选这款,双面的，使用非常方便，以后生熟食可以分开切了，不用担心细菌交叉感染！也不会发霉了，干净卫生，质量也有保障,家图腾双面抗菌菜板，生熟食区分，一冲即净。我们一直秉承“99天剁坏包换”为原则，坚信质量与服务是口碑的前提，为您提供实打实的产品与质量和服务，vip客服竭力尽心提供优质服务！期待咱们下次合作 【家图腾旗舰店】,2021-06-13
300,1**婧,颜色分类: 中号加厚款【304不锈钢+抗菌pp剁骨面】,好评,比普通菜板好多了，抗菌又好清洗，给宝宝用着特别的放心，大家可以闭眼入，棒棒哒 ,已经用了一段时间了，超市都没有这种的菜板，大家放心冲了,健康，安全，卫生，不发霉，不滋生细菌，全新升级中科院专利不锈钢材质双面菜板，生食熟食分开.菜板首选   【家图腾旗舰店】,2021-06-23
301,d**8,颜色分类: 【大号 双倍加厚】 双面抗菌专利/砍剁不伤刀,好评,菜板非常喜欢，抗菌不锈钢材质，看着非常精致，一面抗菌不锈钢的材质，一面食品级pp材质，没有异味，开水烫洗了一下就使用了，起初还担心会不好用，也是抱着试试的心态下单的，使用了效果还可以，抗菌去腥，水一冲布一擦就干了，四边软胶包边完全不用担心边角发黑的情况，质量不错，非常喜欢,菜板很厚实，拿着有分量，做了提手的设计，平时不用的时候，挂在墙上或者立在墙边都非常不错，好收纳，不占地。先用段时间，好用给爸妈也换一个,家图腾双面抗菌菜板，一面采用的拥有专利抗菌不锈钢材质，抗菌率高达99.99%.另一面采用的是德国技术高韧性食品级PP材质，耐砍耐剁.拥有强大的99天无理由退换货的售后质保，让您多一份安心.【家图腾旗舰店】,2021-06-14
302,星**话,颜色分类: 中号 加厚款【304不锈钢+抗菌pp剁骨面】,好评,菜板收到了，拿着很厚重，简单清洗后，使用了一下。一面荤菜，一面水果。切菜不打滑，清洗方便。之前的木质菜板，板面已经发黑了，看着一点也不卫生，就购买的这款，感觉真的不错  ,刚刚切了个西瓜，边上有防水槽的设计，果渍不会流到桌面上，使用完水冲洗下就干净了，非常喜欢,健康，安全，卫生，不发霉，不滋生细菌，全新升级中科院专利不锈钢材质双面菜板，生食熟食分开.菜板首选   【家图腾旗舰店】健康，安全，卫生，不发霉，不滋生细菌，全新升级中科院专利不锈钢材质双面菜板，生食熟食分开.菜板首选   【家图腾旗舰店】,2021-06-02
303,t**6,颜色分类: 【大号 双倍加厚】 双面抗菌专利/砍剁不伤刀,好评,这个宝贝收到了看看真的很好要买的朋友下单吧！客服也好物流也快要买的下单吧！,-,-,2021-06-18
304,云**丶,颜色分类: 大号加厚款【304不锈钢+抗菌pp剁骨面】,好评,切菜板超有质感，此之前买的强多了，一边是不锈钢的，一边是类似塑料的，之前网上看过这种，切菜切肉都能满足，还不串味，确实会干净一些，还比较容易清洗，点赞，挺喜欢,很不错，用的也挺舒服的,-,2021-05-29
305,9**後,颜色分类: 【中号 双倍加厚】 双面抗菌专利/砍剁不伤刀,好评,颜值高，看着就喜欢，期待用着也很好，卖家服务很棒，，发货也快挺好的，值得推荐，赞赞攒攒👍👍👍👍👍👍👍👍👍👍,用了下很不错，特地看了下没有刀痕，颜值还是很好，满意,-,2021-06-10
306,j**3,颜色分类: 中号加厚款【304不锈钢+抗菌pp剁骨面】,好评,还不错，以前是用竹木的菜板，发霉变黑的问题一直解决不了，第一次用不锈钢菜板，干净好收拾，也挺好看 ,菜板不会和之前用的木板一样划痕深。不锈钢面可以拿来切水果蔬菜的，PP面用来切肉或者鱼类，有韧性不伤刀，菜板提起来有份量，清洗也很方便，不会有残留污渍，用的比较放心，不需要特别打理！比木质好用，挺满意的，现在这个很不错值得推荐,-,2021-06-06
307,寒**慧,颜色分类: 【大号 双倍加厚】 双面抗菌专利/砍剁不伤刀,好评,我也是听朋友推荐的，刚好碰到618活动，收到货以后真的觉得物有所值，以后碰到活动还要买一块,-,-,2021-06-21
308,忆**o,颜色分类: 【大号 双倍加厚】 双面抗菌专利/砍剁不伤刀,好评,一直不太中意木质的砧板，葱姜蒜后总会有味道，久久散不去，还容易发霉。试着买了这款抗菌防霉的双面砧板，今天用来切饺子馅，切葱姜蒜后真的没有留下味道，还好清洗，材质也厚实 ,真的一点都不串味，清洗非常方便,-,2021-06-18
309,史**8,颜色分类: 【中号 双倍加厚】 双面抗菌专利/砍剁不伤刀,好评,用了感觉还不错，特意买了这款抗菌材质的不锈钢案板，比之前买的塑料的好的多，到手拿着很厚实很好用，做工很好比较细致，边角不是那种很毛糙的，而且很安全不会伤到，两面都可以使用，我都是一面用来切青菜水果，另一面呢切肉类，主要是很好清洗切肉以后水冲一下就好了，再也不担心发霉不健康了,抗菌材质永远不担心发霉生锈影响身体健康。有质感，切菜好用清洗起来也很方便，推荐,健康，安全，卫生，不发霉，不滋生细菌，全新升级中科院专利不锈钢材质双面菜板，生食熟食分开.菜板首选   【家图腾旗舰店】,2021-06-10
310,w**2,颜色分类: 中号加厚款【304不锈钢+抗菌pp剁骨面】,好评,很好，很喜欢，质量也好，也很大，很实用,满意，很满意，也很好用,-,2021-06-19
311,f**1,颜色分类: 【中号 双倍加厚】 双面抗菌专利/砍剁不伤刀,好评,菜板是已经用过，=整体是很不错的，那手上很有分量，菜板是抗菌的，=用着相对来说也是比较放心的，还有一个水槽的设计=，防止切菜的时候水流到衣服上的，也是挺干净的🍎，用完了还可以挂起来，让水分流失的更快，也不会担心有异味的，真的挺满意的。 ,用着非常好！拿手上也是挺有分量的，很有手感的，用完了还方便清洗，水冲一下就干净了，满意,家图腾双面抗菌菜板，一面采用的拥有专利抗菌不锈钢材质，抗菌率高达99.99%.另一面采用的是德国技术高韧性食品级PP材质，耐砍耐剁.拥有强大的99天无理由退换货的售后质保，让您多一份安心.【家图腾旗舰店】,2021-06-08
312,勇**号,颜色分类: 【大号 双倍加厚】 双面抗菌专利/砍剁不伤刀,好评,菜板非常好，是给妈家买的，老人家很喜欢，主要是生熟可以分开两面用 ,-,-,2021-06-22
313,晓**啊,颜色分类: 中号加厚款【304不锈钢+抗菌pp剁骨面】,好评,先说下物流，发的顺丰，隔天就到了，包装也没问题，两面都可以使用，一面切肉，一面切水果，细心的地方是还有凹槽，即便有水溢出也不会流出菜板，还没使用，用后再来评价，总体好评,很好用，建议购买,健康，安全，卫生，不发霉，不滋生细菌，全新升级中科院专利不锈钢材质双面菜板，生食熟食分开.菜板首选   【家图腾旗舰店】,2021-05-28
314,t**0,颜色分类: 中号加厚款【304不锈钢+抗菌pp剁骨面】,好评,砧板收到了，质量很好这款菜板四周做了包边的处理，很细心没有瑕疵。周围都有凹槽，不用担心会有水流到台面上难清洗产品功能：质量非常好，两面都可以使用，以后生熟食可以分开切了，更加卫生，清洗也比较方便，质量非常好，不像木质菜板那样边上有凸起，会发霉的情况，主要是抗菌材质比较安全好评,已经在使用了，没有异味，即使切火龙果什么的也不担心掉颜色洗不掉，非常喜欢,家图腾双面抗菌菜板，生熟食区分，一冲即净。我们一直秉承“99天剁坏包换”为原则，坚信质量与服务是口碑的前提，为您提供实打实的产品与质量和服务，vip客服竭力尽心提供优质服务！期待咱们下次合作 【家图腾旗舰店】,2021-06-11
315,马**号,颜色分类: 中号加厚款【304不锈钢+抗菌pp剁骨面】,好评,"有了抗菌菜板就再不怕生熟串味了，也不怕会变霉了，这个菜板设计合理，能防'漏易清洁，而且菜板切菜时不打滑，使用很安全。",-,-,2021-06-20
316,恋**海,颜色分类: 【大号 双倍加厚】 双面抗菌专利/砍剁不伤刀,好评,收到了，立刻拿了个胡萝卜切片试了一下，切菜手感很好，一直在找一款方便清洗又好用的菜板，终于找到了，家里大部分时间都是我烧饭，所以我对厨具要求挺高的，这款不锈钢菜板很和我意，最重要的是它不会发霉滋生细菌，烧饭不光要好吃更要健康！ ,确实很好用，而且两面可以很好区分开来用，一面切荤菜，一面切素，光滑平整很好清洗，不会残留，不像木制菜板有缝隙会清洗不彻底，挺满意的！,-,2021-06-03
317,t**5,颜色分类: 【大号 双倍加厚】 双面抗菌专利/砍剁不伤刀,好评,菜板买来家人用的很好，夸我买的好，还推荐给朋友，超级喜欢。物美价廉，有需要继续回购。 ,老妈用的菜板很喜欢，一面切菜一面切肉。很好用，喜欢的亲不要犹豫快下手吧！值得购买！,-,2021-06-18
318,d**e,颜色分类: 【中号 双倍加厚】 双面抗菌专利/砍剁不伤刀,好评,不锈钢面超实在，周边的硅胶手感不错，沉甸甸的菜板，颜色也很棒，选的黄绿色搭配的，粉绿粉黄的质感，塑料面磨砂质感。,很好用，易冲洗,-,2021-06-03
319,t**0,颜色分类: 【大号 双倍加厚】 双面抗菌专利/砍剁不伤刀,好评,物有所值，太喜欢了，终于不用为切菜板会发霉而发愁了，准备入手第二个了,这个可以双面菜板质量还不错，不会发霉，不会藏菌，清洁也方便，干得快！到现在用过几个菜板，这是外观最漂亮、设计最合理而且材质最健康的一款。挺好的，非常不错，有大有厚真不错。还是个抗菌不锈钢材质的，安全性很高！双面都可以用，非常实用，价格也比较优惠，实在让人很满意！,家图腾双面抗菌菜板，生熟食区分，一冲即净。我们一直秉承“99天剁坏包换”为原则，坚信质量与服务是口碑的前提，为您提供实打实的产品与质量和服务，vip客服竭力尽心提供优质服务！期待咱们下次合作 【家图腾旗舰店】,2021-06-08
320,梦**叙,颜色分类: 【大号 双倍加厚】 双面抗菌专利/砍剁不伤刀,好评,菜板收到了，挺厚实的，拿着很有分量。不锈钢材质的不用担心发霉变质，性价比也很高，两面用的，不会担心窜味这些了，一面切肉一面切水果蔬菜这些，非常不错呢，干净卫生。菜板还有一个手提的设计，用完了可以挂起来也可以立起来，让水分流失的更快，总体效果还是可以的。客服人员态度很好，愉快的购物体验。  ,高大上的菜板，食品级Pp面和不锈钢面，双面使用。比起木板竹板防霉抗菌强多了。独特的设计方便晾干，满意的购物,健康，安全，卫生，不发霉，不滋生细菌，全新升级中科院专利不锈钢材质双面菜板，生食熟食分开.菜板首选   【家图腾旗舰店】,2021-06-14
321,w**7,颜色分类: 大号加厚款【304不锈钢+抗菌pp剁骨面】,好评,这款不锈钢的菜板很结实，以后在也不用担心菜板会变形和发霉了，这一款双面菜板就挺好的，一边切肉一边切果蔬。我就是奔着抗菌买的，抗菌防霉很好，尺寸选择的也正合适。值得推荐。非常实用，防滑又易清洗，抗菌健康，服务好。打开看了一下质量不错没有异味，切菜或者切水果不会滑动。,这个清洗方便，切菜切肉不滑，还很卫生，这样的切菜板性比价真不错，健康好用售后有保障。客服服务很好，很有耐心，菜板做工不错，边角圆滑没有毛刺。,家图腾双面抗菌菜板，生熟食区分，一冲即净。我们一直秉承“99天剁坏包换”为原则，坚信质量与服务是口碑的前提，为您提供实打实的产品与质量和服务，vip客服竭力尽心提供优质服务！期待咱们下次合作 【家图腾旗舰店】,2021-06-10
322,福**1,颜色分类: 【大号 双倍加厚】 双面抗菌专利/砍剁不伤刀,好评,宝贝产品功能齐全！外观材质环保实用，客服耐心服务周到，快递送货便捷！好评 ,宝贝环保，双面可用，实用经济！质量很好！,健康，安全，卫生，不发霉，不滋生细菌，全新升级中科院专利不锈钢材质双面菜板，生食熟食分开.菜板首选 【家图腾旗舰店】,2021-06-22
323,n**m,颜色分类: 【大号 双倍加厚】 双面抗菌专利/砍剁不伤刀,好评,菜板寄回老家了，妈妈说很好，两面都可以用，比木头菜板好多了，不会掉渣不会发霉，这块板买对了，可以用很长时间 ,抗菌菜板值得购买，价格也合适,家图腾双面抗菌菜板，一面采用的拥有专利抗菌不锈钢材质，抗菌率高达99.99%.另一面采用的是德国技术高韧性食品级PP材质，耐砍耐剁.拥有强大的99天无理由退换货的售后质保，让您多一份安心.【家图腾旗舰店】,2021-06-26
324,谁**2,颜色分类: 大号加厚款【304不锈钢+抗菌pp剁骨面】,好评,这个是真的好，材料和做工都特别精致，做工真的非常棒，我觉着我可以推荐给我朋友买 ,物美价廉，很好的一块抗菌不锈钢砧板，第一次用这种材质的砧板，砧板本身具有抗菌防霉作用，有利于人体健康，很精致，边边角角处理的非常到位，不锈钢抗菌去腥效果很棒。终于把家里发黑的木案板给换掉了,-,2021-06-07
325,三**优,颜色分类: 【大号 双倍加厚】 双面抗菌专利/砍剁不伤刀,好评,此用户没有填写评价。,已经使用了一段时间才来评价，做工精良，切菜后清洗方便非常干净，有一定重量，还会回购的！,-,2021-06-11
326,不**欲,颜色分类: 【大号 双倍加厚】 双面抗菌专利/砍剁不伤刀,好评,这个宝贝还挺不错的，我挑选了好多家做了好多对比结果买回来的话，真的没有让我失望，还是可以的抗真菌材质。没有色差这个牛油果的颜色是真的好看，而且质感十足喜欢的赶紧下单吧。,蛮喜欢的，比起之前的老菜板，这款还能抗菌防霉，而且菜板两面都能使用，一面剁骨，一面切菜切水果。到手看着不错，买来专门给小孩切水果什么的吃。Pp面感觉很舒服，非常好，谢谢客服的推荐，很满意,家图腾双面抗菌菜板，生熟食区分，一冲即净。我们一直秉承“99天剁坏包换”为原则，坚信质量与服务是口碑的前提，为您提供实打实的产品与质量和服务，vip客服竭力尽心提供优质服务！期待咱们下次合作 【家图腾旗舰店】,2021-06-07
327,湘**y,颜色分类: 【大号 双倍加厚】 双面抗菌专利/砍剁不伤刀,好评,外观材质：非常好 不管切什么容易清洗  牛油果绿 挺好看的 产品功能：背面钢的还没用 应该揉面不错  天天用 随时清洗 挂起来 也挺养眼的。哈哈哈😄 ,已经用了一个星期了。这个比木的菜板好多了 以前也买过木的 但是容易发霉 也买过塑料的 一股塑料味还不敢用力  这个性价比高 感觉能用20年  没味道 容易清洗不留痕迹切辣椒🌶️后洗能洗掉 不错,健康，安全，卫生，不发霉，不滋生细菌，全新升级中科院专利不锈钢材质双面菜板，生食熟食分开.菜板首选   【家图腾旗舰店】,2021-06-21
328,刘**7,颜色分类: 【中号 双倍加厚】 双面抗菌专利/砍剁不伤刀,好评,高质量秒赞没有异味,刚刚用了太棒啦！干净卫生方便勤洗！,健康，安全，卫生，不发霉，不滋生细菌，全新升级中科院专利不锈钢材质双面菜板，生食熟食分开.菜板首选   【家图腾旗舰店】,2021-06-14
329,t**8,颜色分类: 【大号 双倍加厚】 双面抗菌专利/砍剁不伤刀,好评,预想效果不错，质量设计材质nice.健康菜板(无味)放心，精致美观，与卖家描述一样，材质加厚希望能用的久点。 ,用过后的确不错与描述介绍的一样，无论质量款式价钱还是这家靠谱，买就对了。,-,2021-05-31
330,t**9,颜色分类: 大号加厚款【304不锈钢+抗菌pp剁骨面】,好评,买了这个中科院研制的抑菌菜板，已经试用过了，很不错！一面是不锈钢拉丝的，我准备用来切蔬菜水果，另一面准备切肉用，生熟分开更健康，他家买菜板还有赠品，送了不锈钢刮皮刀。,这个菜板真的好用，切菜声首不大，清洗也方便，满意。,-,2021-06-18
331,l**5,颜色分类: 【大号 双倍加厚】 双面抗菌专利/砍剁不伤刀,好评,菜板感觉很结实，挺厚的，把手和菜板是一体的6，可以放在水槽的沥水架上，不会有影响，很好清洗。,挺好的，双面抗菌，切完东西没有残留，容易清洗，肉眼可见的干净。,家图腾双面抗菌菜板，生熟食区分，一冲即净。我们一直秉承“99天剁坏包换”为原则，坚信质量与服务是口碑的前提，为您提供实打实的产品与质量和服务，vip客服竭力尽心提供优质服务！期待咱们下次合作 【家图腾旗舰店】,2021-05-29
332,棒**n,颜色分类: 【中号 双倍加厚】 双面抗菌专利/砍剁不伤刀,好评,外观材质：不锈钢 非常好 很结实 用起来很方便 生熟分开 不串味 双面防霉   易清洗 防滑 非常喜欢 好评 好评好评 ,-,-,2021-06-05
333,不**0,颜色分类: 【大号 双倍加厚】 双面抗菌专利/砍剁不伤刀,好评,很不错的粘板，大小合适，本来以为会很重的，结果也不是很重提起来刚刚好。一共有两面，背面可以切骨头，不锈钢面可以切肉切菜，都很好用的。￼￼已经推荐给同事啦，买买买！ ,很不错的～推荐。细节满分💯,家图腾双面抗菌菜板，生熟食区分，一冲即净。我们一直秉承“99天剁坏包换”为原则，坚信质量与服务是口碑的前提，为您提供实打实的产品与质量和服务，vip客服竭力尽心提供优质服务！期待咱们下次合作 【家图腾旗舰店】,2021-06-06
334,z**g,颜色分类: 【中号 双倍加厚】 双面抗菌专利/砍剁不伤刀,好评,小巧实用，占地面积不大，两面都可用，生熟可以隔离使用，无细菌行 ,已经用了一段时间了，卫生干净无细菌，是一款值得购买的产品,-,2021-06-19
