数据下载时间：2021-06-30 17:25:13 功能：看店宝【https://kandianbao.com/】 宝贝评价信息分析 相关查询网址：https://kandianbao.com/item/pingjia/641771375493/,,,,,,,
序号,评价用户,sku,评价类型,评价内容,追评,掌柜回评,评价时间
1,一**部,颜色分类: 【中号 双倍加厚】 双面抗菌专利/砍剁不伤刀,好评,材质厚实，双面都可用，拿放也方便，一面用来切肉类，一面用来切水果，肉果分离，更卫生健康，而且清洗方便，不会有肉屑粘住菜板上，真心觉得不错。很棒的菜板子，我们家以前的菜板都发霉了，早就想换了没看到想买的，挑了好久决定买的这个，果然没让我失望，两面都可以用。很好清洗，水一冲就好了，买值了，比超市里便宜多了， ,抗菌菜板很好双面可用，外观漂亮，干净卫生，不锈钢易清洗，不积水，不伤刀，大小合适不占空间，真心喜欢。还不怕发霉，不怕有细菌，真正的高大上。,家图腾双面抗菌菜板，生熟食区分，一冲即净。我们一直秉承“99天剁坏包换”为原则，坚信质量与服务是口碑的前提，为您提供实打实的产品与质量和服务，vip客服竭力尽心提供优质服务！期待咱们下次合作 【家图腾旗舰店】,2021-06-25
2,海**5,颜色分类: 【中号 双倍加厚】 双面抗菌专利/砍剁不伤刀,好评,菜板包装完好无损，收到后很期待的打开了，外观设计简单大方，不那么沉重，两面都可以用的，用起来也很方便，清洗的时候随意冲洗就行了。用了这么几天，确实非常方便，质量好不发霉，轻巧便捷。易清洗。早都想买这样的菜板了，家里的木头菜板爱长霉菌，看着就不想用了。这种菜板结实还耐用，切完菜用水冲冲就行，也不担心晾不干发霉了。 ,案板清洗方便，刚切起南瓜来杠杠的。案板质感很好很敦实，剁排骨也杠杠的。肉类蔬菜水果可以分开用，不用担心串味了，以前用的木头的容易发黑滋生细菌，无锈钢双面菜板的干净卫生，很有质感❤️,家图腾双面抗菌菜板，生熟食区分，一冲即净。我们一直秉承“99天剁坏包换”为原则，坚信质量与服务是口碑的前提，为您提供实打实的产品与质量和服务，vip客服竭力尽心提供优质服务！期待咱们下次合作 【家图腾旗舰店】,2021-06-21
3,晓**1,颜色分类: 大号加厚款【304不锈钢+抗菌pp剁骨面】,好评,用了几天了，清洗方便，在上面砍骨头都妥妥的了，有挂手可以悬挂起来，干净卫生❤️❤️手感不错，有一定的分量，切菜不会跑，很好清洗。第一次买这种双面菜板，家里的是木板的那种材质，特别容易发霉，还不好清理，这款菜板特别好清理，切完菜用水冲一次就干净了，一面抗菌一面不锈钢的。和面也没问题。 ,设计简约大方，冲洗也方便，双面抗菌的，这个价位太可了。两面用的菜板，很方便实用，而且抗菌防霉。家里的木板很容易发霉有味，这个很不错，容易清洗，而且两面的方便又干净，切菜不打滑。,家图腾双面抗菌菜板，一面采用的拥有专利抗菌不锈钢材质，抗菌率高达99.99%.另一面采用的是德国技术高韧性食品级PP材质，耐砍耐剁.拥有强大的99天无理由退换货的售后质保，让您多一份安心.【家图腾旗舰店】,2021-06-21
4,1**0,颜色分类: 【大号 双倍加厚】 双面抗菌专利/砍剁不伤刀,好评,一直用的都是竹木菜板，看了测评之后觉得发霉之后的砧板好脏啊，毕竟是每天跟食物打交道的东西，这下引起了重视，对比了好几家的抗菌砧板，最终选择了这家，不管是从功能设计、价格上面都很满意，双面材质的，生熟也可以分开切，更加的卫生，总体和描述的一致，可以放心购买  ,产品质量好，很厚实，外观颜值也比较高，终于把家里会霉变的木板给换掉了，很满意的一次购物体验,家图腾双面抗菌菜板，一面采用的拥有专利抗菌不锈钢材质，抗菌率高达99.99%.另一面采用的是德国技术高韧性食品级PP材质，耐砍耐剁.拥有强大的99天无理由退换货的售后质保，让您多一份安心.【家图腾旗舰店】,2021-06-21
5,j**6,颜色分类: 【中号 双倍加厚】 双面抗菌专利/砍剁不伤刀,好评,性价比高还健康卫生哦。外观设计大气颜值高，还是双面设计的，两面可以用防串味，材质厚实坚固耐用很平稳好用，价格实惠，物超所值，推荐给朋友了。昨天收到晚上就用了，挺好用的，我切肉的话就用那个高韧pp面的，像切水果蔬菜之类的就用不锈钢面的，不锈钢的材质不怕发霉，好洗耐用。提起来手感很好。  ,抗菌不锈钢材质非常厚实💝。一面可以切水果 一面可以切菜 真的挺好使用 ，感觉就是每个家庭都必备的 ，🌴我换了又换，买了这款不锈钢的我感觉可以使用老长时间🌴,家图腾双面抗菌菜板，一面采用的拥有专利抗菌不锈钢材质，抗菌率高达99.99%.另一面采用的是德国技术高韧性食品级PP材质，耐砍耐剁.拥有强大的99天无理由退换货的售后质保，让您多一份安心.【家图腾旗舰店】,2021-06-18
6,j**霞,颜色分类: 中号加厚款【304不锈钢+抗菌pp剁骨面】,好评,使用了几次了，效果还不错，不锈钢的用着比较干净，不会有发黑发霉的情况，菜板的质量确实没得说，很厚实提在手上分量十足，卖家还送了削皮刀，真的太实用了，双面材质相当于买了2块菜板，荤腥味道重的可以和蔬菜水分开切切，避免串味，把手也很上档次，挂起来非常方便，建议大家买,用来切肉和深蔬菜完全不在话下，使用用水一冲就干干净净，比老式木板靠谱,健康，安全，卫生，不发霉，不滋生细菌，全新升级中科院专利不锈钢材质双面菜板，生食熟食分开.菜板首选   【家图腾旗舰店】,2021-06-25
7,l**7,颜色分类: 中号加厚款【304不锈钢+抗菌pp剁骨面】,好评,菜板收到就清洗使用了，一般都是我妈在家打理厨房，不得不说木质的刀板的砧板是真的很难搞，所以我这次专门买了个抗菌不锈钢的切菜板，做工很细致，拿在手上摸着没有毛刺感，我觉得性价比还是是挺高的。特别是抗菌不锈钢材质，PP面防滑设计感觉超赞。外观好看，材质厚实。  ,菜板不错。比想象中的要好。已经使用过很好清理。非常不错。好评，很不错的一款菜板，质量也好，价格便宜。菜板不错，价格实惠 质量也好。商品品质：质量好，包装严实大小合适,家图腾双面抗菌菜板，生熟食区分，一冲即净。我们一直秉承“99天剁坏包换”为原则，坚信质量与服务是口碑的前提，为您提供实打实的产品与质量和服务，vip客服竭力尽心提供优质服务！期待咱们下次合作 【家图腾旗舰店】,2021-06-20
8,王**9,颜色分类: 中号加厚款【304不锈钢+抗菌pp剁骨面】,好评,菜板性价比挺高的，很喜欢。再也不用担心用的时间长 霉的的现象了。刚好在做午饭之前收到了直接用上，大小颜色都很满意，拎着还挺重有质感，以后再也不怕它菜板发霉了，开心。这款双面不锈钢菜板质量真的不错，材质好外观漂亮，做工精细无瑕疵，值得拥有。之前用的是木质的很容易潮湿，这个很卫生，304食品级的很安全,收到很满意，颜值好看，很简约，看着就有一种干净的感觉，抗菌不锈钢的材质，双面可用，加厚承重力更强大，切菜也好切的，还有就是不会发霉好清洗，推荐大家入手,家图腾双面抗菌菜板，一面采用的拥有专利抗菌不锈钢材质，抗菌率高达99.99%.另一面采用的是德国技术高韧性食品级PP材质，耐砍耐剁.拥有强大的99天无理由退换货的售后质保，让您多一份安心.【家图腾旗舰店】,2021-06-15
9,李**倩,颜色分类: 【大号 双倍加厚】 双面抗菌专利/砍剁不伤刀,好评,抗菌不锈钢菜板，双面都可以用，一面切菜，切菜防滑不打滑，另一面可以切肉，我用来做了面食，和面也不粘，好用，清洗也方便，不滋生细菌，把手可以随意悬挂，沥水。妈妈也说这款菜板不错。菜板质量好，款式设计新颖人性化，双面水果蔬菜分开干净卫生，菜板边缘导流不积水，抗菌防霉毒，好清洁易打理，颜色干净，性价比高，值得入手👍👍 ,，方便不占地方！价格实惠，材质很安全没有异味，用着也放心！,家图腾双面抗菌菜板，生熟食区分，一冲即净。我们一直秉承“99天剁坏包换”为原则，坚信质量与服务是口碑的前提，为您提供实打实的产品与质量和服务，vip客服竭力尽心提供优质服务！期待咱们下次合作 【家图腾旗舰店】,2021-06-20
10,z**0,颜色分类: 中号加厚款【304不锈钢+抗菌pp剁骨面】,好评,不锈钢菜板避免了木菜板发霉的问题，做工不错，边角圆润，之前买的菜板是塑料的，重一点切就掉塑料屑，这款双面的菜板质量非常好。对得起这个价格。菜板质量好，款式设计新颖人性化，双面水果蔬菜分开干净卫生，抗菌防霉，好清洁易打理，颜色干净，性价比高，值得入手👍👍 ,双面材质，生熟可以分开切，确实比木菜板用着卫生一些，使用完水冲洗一下就干净了，还不留味，推荐,家图腾双面抗菌菜板，生熟食区分，一冲即净。我们一直秉承“99天剁坏包换”为原则，坚信质量与服务是口碑的前提，为您提供实打实的产品与质量和服务，vip客服竭力尽心提供优质服务！期待咱们下次合作 【家图腾旗舰店】,2021-06-26
11,路**5,颜色分类: 中号加厚款【304不锈钢+抗菌pp剁骨面】,好评,顺丰物流特快，物美价廉，质量不错很棒，不像竹子或者木制菜板容易发霉，梅雨季节也不用担心菜板长毛了，大爱，下次推荐给朋友们。看过很多家，就喜欢这家的，喜欢的亲们可以下手了。,很棒的菜板子，家里以前的木菜板都发霉了，早就想换了，没看到合适的，挑了好久决定买的这个，果然没让我失望，两面都可以用。很好清洗，水一冲就好了，买值了，比超市里便宜多了，一面切生食，一面切蔬菜水果，很好的区分开来，干净卫生，赞,健康，安全，卫生，不发霉，不滋生细菌，全新升级中科院专利不锈钢材质双面菜板，生食熟食分开.菜板首选   【家图腾旗舰店】,2021-06-21
12,t**4,颜色分类: 【大号双倍加厚】双面抗菌专利/砍剁不伤刀,好评,此用户没有填写评价。,菜板使用了一段时间了，效果确实不错，不会发黑，霉变。长期处在水槽边也不用担心。之前使用的木菜板，不易干容易滋生细菌，这下不用担心了。一分钱一分货！尺寸大小也是很合适，菜板分正反两个面，平常切蔬菜瓜果可以用不锈钢面，切肉类可以用PP的那一面，抗菌防霉效果很好，赞一个,家图腾双面抗菌菜板，一面采用的拥有专利抗菌不锈钢材质，抗菌率高达99.99%.另一面采用的是德国技术高韧性食品级PP材质，耐砍耐剁.拥有强大的99天无理由退换货的售后质保，让您多一份安心.【家图腾旗舰店】,2021-06-09
13,小**3,颜色分类: 【大号 双倍加厚】 双面抗菌专利/砍剁不伤刀,好评,菜板颜值高，质量好，放在厨房里感觉挺舒服的，给人一种干净的感觉，做工很精致，没有瑕疵，双面材质，二面都可以切，一面切蔬菜水果，一面切肉，可以分开使用，还避免了串味，使用之后好清洗，还不会留味，更加健康卫生。一分钱一分货推荐,冲着抗菌防霉买的，细节处理到位很不错，做工不错。光亮，也不用担心长霉和细菌滋生，很好的一个产品,健康，安全，卫生，不发霉，不滋生细菌，全新升级中科院专利不锈钢材质双面菜板，生食熟食分开.菜板首选   【家图腾旗舰店】,2021-06-26
14,t**5,颜色分类: 【大号 双倍加厚】 双面抗菌专利/砍剁不伤刀,好评,菜板用着很顺手，切菜切肉分开用，干净卫生，颜值很高的一款菜板！做饭心情也好了很多！菜板收到了马上试用一下，是两面的一面用来切水果一面用来切菜，再也不用担心西瓜上有大蒜味儿了🤣🤣抗菌防霉，南方天气潮湿必备的。棒棒哒！赶上618活动买的，价格很实惠。 ,"菜板厚实，可以剁排骨，两面都可以用，分开使用,更加卫生了.再也不担心长霉了。还有防水设计很贴心，买的大号够用。菜板很好用不打滑，有防溢水槽不怕弄得哪里都是水，主要是抗菌防霉",家图腾双面抗菌菜板，生熟食区分，一冲即净。我们一直秉承“99天剁坏包换”为原则，坚信质量与服务是口碑的前提，为您提供实打实的产品与质量和服务，vip客服竭力尽心提供优质服务！期待咱们下次合作 【家图腾旗舰店】,2021-06-18
15,浩**妈,颜色分类: 中号加厚款【304不锈钢+抗菌pp剁骨面】,好评,菜板收到了，包装严实完好无损，大小也刚刚好，材质厚实，上档次，外观设计精致美观，一面是不锈钢材质的，一面是PP材质的，不像木质的春季里容易发霉，而不锈钢材质和PP材质有防霉和抑菌的作用。使用的更加放心，也更加卫生 ,材质厚实，双面都可用，拿放也方便，一面用来切肉类，一面用来切水果，肉果分离，更卫生健康，而且清洗方便，不会有肉屑粘住菜板上，真心觉得不错。,家图腾双面抗菌菜板，一面采用的拥有专利抗菌不锈钢材质，抗菌率高达99.99%.另一面采用的是德国技术高韧性食品级PP材质，耐砍耐剁.拥有强大的99天无理由退换货的售后质保，让您多一份安心.【家图腾旗舰店】,2021-06-21
16,t**5,颜色分类: 【中号 双倍加厚】 双面抗菌专利/砍剁不伤刀,好评,看了很多家的菜板，还是下单购买了这款抗菌的不锈钢菜板。收到的不锈钢菜板颜值很高，平常使用也很干净耐用，关键用起来也很好用，很满意。菜板的边缘比较光滑，没有瑕疵，用完了还可以挂起来哦，家里人都很喜欢。很有分量，有把手可以挂起来，不锈钢面可以切水果，这样生熟分开很卫生，爸妈说还不错，不锈钢的不会发霉，用着也干净。 ,不锈钢的比较容易清洗，水冲洗下就干净了，木质竹子菜板总感觉清洗不干净，板面还是滑的，切痕深容易起碎屑，不锈钢菜板完全不用担心了，质量不错，不锈钢材质很好。很满意！,家图腾双面抗菌菜板，生熟食区分，一冲即净。我们一直秉承“99天剁坏包换”为原则，坚信质量与服务是口碑的前提，为您提供实打实的产品与质量和服务，vip客服竭力尽心提供优质服务！期待咱们下次合作 【家图腾旗舰店】,2021-06-18
17,丁**当,颜色分类: 中号加厚款【304不锈钢+抗菌pp剁骨面】,好评,抗菌菜板质量还是挺不错的，拿着很厚实，双面不同的材质，相当于2个切菜板，以后生熟食可以分开切了，像之前的木菜板切完鱼或者肉，清洗后会有味道，这款完全不用担心，切完荤腥用洗洁精清洗下就没味了，还挺方便的。一面切生熟一面切蔬菜水果，防止细菌交叉感染，使用的更加卫生。 ,终于把家里会发霉的木菜板换掉了，这款四周软胶包边，不发黑，板面也不会发黄，使用效果挺不错的,健康，安全，卫生，不发霉，不滋生细菌，全新升级中科院专利不锈钢材质双面菜板，生食熟食分开.菜板首选   【家图腾旗舰店】,2021-06-22
18,l**3,颜色分类: 【大号 双倍加厚】 双面抗菌专利/砍剁不伤刀,好评,抗菌菜板收到了，一到就迫不及待的打开了，质量很好、双面材质的，抗菌去腥，效果不错，之前的切菜板板面开始发黄了，清洗后还是滑滑的清洗不干净，用着也不卫生，就换了这款新型的菜板试试，一分价钱一分货 比之前买的木质的好用多了， 抗菌去腥，不容易滋生细菌， 效果非常棒  ,"一面切菜一面切水果真是太棒了,非常防滑,抗菌不锈钢安全。",健康，安全，卫生，不发霉，不滋生细菌，全新升级中科院专利不锈钢材质双面菜板，生食熟食分开.菜板首选   【家图腾旗舰店】,2021-06-21
19,z**7,颜色分类: 【大号 双倍加厚】 双面抗菌专利/砍剁不伤刀,好评,这几天的使用了，感觉还不错，双面材质的抗菌菜板，质量确实没得说，很厚实提在手上分量十足，卖家还送了削皮刀，真的太实用了，百度了一下还具有防霉抗菌的作用，双面材质生熟也可以分开使用了，比较了交叉感染，使用完水冲洗下干干净净。把手也很上档次，挂起来非常方便，推荐大家购买。 ,清洗后没有什么味道，不用担心串味的味道，之前木菜板切完鱼和肉之后，很久才能散掉，这款菜板不错,家图腾双面抗菌菜板，生熟食区分，一冲即净。我们一直秉承“99天剁坏包换”为原则，坚信质量与服务是口碑的前提，为您提供实打实的产品与质量和服务，vip客服竭力尽心提供优质服务！期待咱们下次合作 【家图腾旗舰店】,2021-06-24
20,小**3,颜色分类: 【大号 双倍加厚】 双面抗菌专利/砍剁不伤刀,好评,抗菌菜板收到了，质量很好，四边角都圆滑处理了没毛刺，厚薄适中，不会发霉变质，性价比也很高，两面用的，不会担心窜味这些了，一面切肉一面切水果蔬菜这些，非常不错呢，干净卫生。菜板还有一个手提的设计，用完了可以挂起来，让水分流失的更快，不会出现水流不干净的情况的，总体效果还是可以的 ,使用不会发霉这些，这款的话会很新很干净，特别漂亮还是很喜欢的。有需要还来购买的,健康，安全，卫生，不发霉，不滋生细菌，全新升级中科院专利不锈钢材质双面菜板，生食熟食分开.菜板首选   【家图腾旗舰店】,2021-06-26
21,小**丝,颜色分类: 【大号 双倍加厚】 双面抗菌专利/砍剁不伤刀,好评,货收到了，一面钢一面pp材质，厚实有分量，而且价格实惠，边上的胶皮链接也很紧实，我妈也看好了，说有活动再给她买一个，用好会推荐周边的人的。 ,不错不错，结实耐用,-,2021-06-23
22,我**7,颜色分类: 【大号 双倍加厚】 双面抗菌专利/砍剁不伤刀,好评,菜板收到了还没舍得用，不过拎起来挺有重量的，家里用的是竹菜板，用了很多年了，感觉竹木菜板经常要换，不然会发黑发霉，这次换了这款看着效果不错，双面材质的，生熟可以分开切了，一面用来切荤腥，一面切蔬菜水果，感觉很卫生  ,不锈钢菜板避免了竹木菜板发霉的问题，做工不错，边角圆润，这款双面的菜板质量非常好。对得起这个价格,健康，安全，卫生，不发霉，不滋生细菌，全新升级中科院专利不锈钢材质双面菜板，生食熟食分开.菜板首选   【家图腾旗舰店】,2021-06-22
23,t**7,颜色分类: 【中号 双倍加厚】 双面抗菌专利/砍剁不伤刀,好评,案板质量挺好的～一边是不锈钢的～一边是抗菌的～挺好的～生熟可以分开用～很方便～而且很容易清洗！比普通的实木案板好用太多了！喜欢！而且不锈钢材质不会滋生细菌比以前的木菜板安全多了。菜板特别厚实，包装里拿出来的时候手感就很棒，是两面可用的，一面切菜一面切肉，相当ok，大小也合适，非常喜欢，在家里做饭，换个新的菜板，干净卫生还开心～～～～ ,用了几次，真是越来越喜欢了，好用，好洗，感觉自己做饭都更好吃了呢，哈哈哈。菜板用竹的会发霉，就想着买这种抗菌材质的。双面设计很人性化，厚度适中。质量稳固结实，抗菌材质很环保。,家图腾双面抗菌菜板，生熟食区分，一冲即净。我们一直秉承“99天剁坏包换”为原则，坚信质量与服务是口碑的前提，为您提供实打实的产品与质量和服务，vip客服竭力尽心提供优质服务！期待咱们下次合作 【家图腾旗舰店】,2021-06-18
24,r**1,颜色分类: 【中号 双倍加厚】 双面抗菌专利/砍剁不伤刀,好评,抗菌菜板收到了，外观，质量都挺满意的，简单清洗后就使用了，切菜这些不会滑，剁肉这些也没有碎屑的，不锈钢的那面可以用来切菜水果之类的，颜色也好看，切菜水果都可以，质量很好，这款不锈钢的就不用担心抗菌材质的使用健康卫生，点个赞！终于不用担心菜板霉变了，这款抗菌防霉效果很好值得推荐 ,大小合适，价格实惠，整体性价比很高，双面材质，生熟食可以区分开切，有效预想细菌的交叉感染，非常喜欢,健康，安全，卫生，不发霉，不滋生细菌，全新升级中科院专利不锈钢材质双面菜板，生食熟食分开.菜板首选   【家图腾旗舰店】,2021-06-16
25,一**8,颜色分类: 【中号 双倍加厚】 双面抗菌专利/砍剁不伤刀,好评,双面抗菌不发霉，生熟不串味。环形导水槽设计，防漏易清洁。不锈钢和食品级pp材质可以冷熟分开使用，性价比高，颜值高。 ,刚买了就开始使用了，面板防滑，切菜不打滑，清洗方便，非常实用,健康，安全，卫生，不发霉，不滋生细菌，全新升级中科院专利不锈钢材质双面菜板，生食熟食分开.菜板首选   【家图腾旗舰店】,2021-06-22
26,清**8,颜色分类: 【大号 双倍加厚】 双面抗菌专利/砍剁不伤刀,好评,产品是正品，质量不错，价格实惠。加厚的很沉实，比之前买的强的太多了，没法与这款比。还送了小物件。 ,菜板跟厚实 也很有重量 挺不错的 关键还好看。重量还可以，双面的，可以生熟分开。外观材质：质量很好，很实用，价格便宜下次再回购，菜板收到了挺喜欢的，两面可用，还挺厚实的。用来切水果美观又卫生，好用。很好清洗，不管切什么，水冲下都很干净，超级满意，关键是干净不发霉，菜板不发霉就很耐用,家图腾双面抗菌菜板，生熟食区分，一冲即净。我们一直秉承“99天剁坏包换”为原则，坚信质量与服务是口碑的前提，为您提供实打实的产品与质量和服务，vip客服竭力尽心提供优质服务！期待咱们下次合作 【家图腾旗舰店】,2021-06-16
27,l**响,颜色分类: 【大号 双倍加厚】 双面抗菌专利/砍剁不伤刀,好评,抗菌菜板收到了，外观颜值挺喜欢的，双面材质的比较好清洗，生熟可以分开试用，不会担心会串味，之前家里一直用竹木菜板，使用久可容易发霉，就想着买这种抗菌材质的。双面设计很人性化，厚度适中。质量稳固结实，抗菌材质很环保。没有任何异味，关键很卫生。清洗也方便  ,肉类蔬菜水果可以分开用，不用担心串味了，以前用的木头的容易发黑滋生细菌，无锈钢双面菜板的干净卫生，很有质感❤,家图腾双面抗菌菜板，一面采用的拥有专利抗菌不锈钢材质，抗菌率高达99.99%.另一面采用的是德国技术高韧性食品级PP材质，耐砍耐剁.拥有强大的99天无理由退换货的售后质保，让您多一份安心.【家图腾旗舰店】,2021-06-19
28,t**6,颜色分类: 【中号 双倍加厚】 双面抗菌专利/砍剁不伤刀,好评,买这种双面不同材料的案板，确实非常的好用，还有一面是pp面。抗压力不错。双面的可以实现蔬果和肉类分开处理不会出现串味的现象，这样子比较安全和卫生，完全就不用担心感染到细菌了，相信产品质量，整体没有瑕疵，非常美观好用，家里人也都很喜欢，告别老式木质的菜板使用之后会发霉生菌的现象，质量一般会掉渣的问题。这款不锈钢菜板性价比很高，很满意的购物。,用完了可以自己直立起来，起到了防霉的作用，希望用久了也不会发霉，价格算下来也不贵，还可以,家图腾双面抗菌菜板，一面采用的拥有专利抗菌不锈钢材质，抗菌率高达99.99%.另一面采用的是德国技术高韧性食品级PP材质，耐砍耐剁.拥有强大的99天无理由退换货的售后质保，让您多一份安心.【家图腾旗舰店】,2021-06-18
