752,t**8,颜色分类: 大号加厚款【304不锈钢+抗菌pp剁骨面】,好评,宝贝已收到与店家描述的一模一样，重量刚刚好，在上面切菜，菜板不会移动，值得大家购买,-,-,2021-05-25
753,燕**妮,颜色分类: 大号加厚款【304不锈钢+抗菌pp剁骨面】,好评,很好的菜板还送了削皮刀👍,-,-,2021-06-24
754,k**3,颜色分类: 【中号 双倍加厚】 双面抗菌专利/砍剁不伤刀,好评,送货快 宝贝收到 看着不错！ ,-,-,2021-06-18
755,r**1,颜色分类: 【大号 双倍加厚】 双面抗菌专利/砍剁不伤刀,好评,第一次买这种，以前都用传统木头，挺好的，轻薄型，不太笨重，方便。 ,用了一段时间，收藏方便。,家图腾双面抗菌菜板，生熟食区分，一冲即净。我们一直秉承“99天剁坏包换”为原则，坚信质量与服务是口碑的前提，为您提供实打实的产品与质量和服务，vip客服竭力尽心提供优质服务！期待咱们下次合作 【家图腾旗舰店】,2021-06-16
756,袁**圆,颜色分类: 【大号 双倍加厚】 双面抗菌专利/砍剁不伤刀,好评,产品挺好用，样子很高级，没有味道 ,客服态度不错～,健康，安全，卫生，不发霉，不滋生细菌，全新升级中科院专利不锈钢材质双面菜板，生食熟食分开.菜板首选   【家图腾旗舰店】,2021-06-16
757,柴**头,颜色分类: 【大号 双倍加厚】 双面抗菌专利/砍剁不伤刀,好评,很好评！希望能用得住！,今天晚上用了一下这个菜板，两面都试过了，非常好用，四圈有胶圈所以很防滑，底部还有个翘起来的小边边，感觉让台面和菜板之间不会贴太近。不锈钢一面非常好切菜，剁骨头那边刀感也很好！不锈钢那边太好洗了，青菜类的一冲就干净了，不用担心汁水残留导致发霉，而且用纸巾一擦就干了！打算给爸妈、公婆都换这个了，至少比木头的要干净卫生！,-,2021-06-13
758,无**9,颜色分类: 【大号 双倍加厚】 双面抗菌专利/砍剁不伤刀,好评,案板收到了，看着挺好的，立马把旧的木质案板扔了，再也不会担心细菌滋生了。 ,切水果试了试案板，还行，切好水一冲就干净了,-,2021-06-12
759,吕**0,颜色分类: 【大号双倍加厚】双面抗菌专利/砍剁不伤刀,好评,菜板用竹的会发霉就买这种的，菜板设计很人性化，这是我在很多相同产品中选出来的一款颜值很高。绿色看着很清新，用的时候很稳固，不会乱跑乱动。厚度适中，尺寸大小适宜三口之家，质量稳固结实，无漆无蜡不伤身，很环保。  ,这款案板也挺厚实的，比以前买的案板厚实很多，而且质感特好尺寸大小刚刚好不占位置，切菜位置刚刚够，设计很合理。很科学。没有任何异味。,健康，安全，卫生，不发霉，不滋生细菌，全新升级中科院专利不锈钢材质双面菜板，生食熟食分开.菜板首选   【家图腾旗舰店】,2021-05-03
760,x**8,颜色分类: 中号 加厚款【304不锈钢+抗菌pp剁骨面】,好评,这个菜板干净卫生，非常方便，不伤刀，好用，强烈推荐,干净卫生，非常满意！非常非常好，值得拥有,"非常感谢您对家图腾旗舰店支持，新升级无色素揉面垫不仅收纳方便,还是0添加无异味，高品质的揉面垫选家图腾旗舰店。",2021-05-16
761,刘**磊,颜色分类: 中号加厚款【304不锈钢+抗菌pp剁骨面】,好评,今天收到货很满意东西不错👍👍👍而且没有味道和实体店的货物一样很满意😍😍😍,这面切水果西红柿流出的汁都可以保留在板里面不会就到台面上非常好👍👍👍不锈钢面切肉拿冷水洗洁精一冲就干净了太方便了。比以前的木制板干净利落。,家图腾双面抗菌菜板，生熟食区分，一冲即净。我们一直秉承“99天剁坏包换”为原则，坚信质量与服务是口碑的前提，为您提供实打实的产品与质量和服务，vip客服竭力尽心提供优质服务！期待咱们下次合作 【家图腾旗舰店】,2021-06-07
762,红**3,颜色分类: 【大号 双倍加厚】 双面抗菌专利/砍剁不伤刀,好评,质量很好，很满意 ,拿到家就用了，家人都很满意，两面用很方便。强烈推荐。,-,2021-06-16
763,e**6,颜色分类: 【中号 双倍加厚】 双面抗菌专利/砍剁不伤刀,好评,看着挺好的，,挺好的，拿在手上有点份量,-,2021-06-23
764,～**～,颜色分类: 中号加厚款【304不锈钢+抗菌pp剁骨面】,好评,性价比吧,-,-,2021-06-16
765,啵**5,颜色分类: 【大号 双倍加厚】 双面抗菌专利/砍剁不伤刀,好评,还没有用，看着挺好的 ,-,-,2021-06-24
766,w**8,颜色分类: 【中号 双倍加厚】 双面抗菌专利/砍剁不伤刀,好评,不错的，妈妈说切来不软不硬,-,-,2021-06-13
767,周**3,颜色分类: 中号加厚款【304不锈钢+抗菌pp剁骨面】,好评,大小差不多，1-3人量可以用，最重要是清洗起来好方便！！！之前家里用的木头的，发霉了，这个不用担心，推荐给身边的人 ,用了几天，先生在切菜偷拍几张推荐给大家。,-,2021-06-07
768,我**5,颜色分类: 【大号 双倍加厚】 双面抗菌专利/砍剁不伤刀,好评,看起来砧板板是不错的。感觉就像一层薄薄的不锈钢皮包起来的。商家也还挺不错的，叫我用了放心，90天包换，7天无理由退货。希望如此吧，看起来是不错的，亲也很不错。,我准备用几天再来追加评论。我感觉这个不锈钢铁皮嘛，刀切的肯定有痕，后面是塑料板。老板还是不错的，包我90天质量。明天就去买个大骨头砍一下。,-,2021-06-10
769,j**3,颜色分类: 【大号双倍加厚】双面抗菌专利/砍剁不伤刀,好评,质量非常好，很厚实，不像木质的容易发霉，卫生健康，赠送的削皮刀质量也很好，值得购买。,-,-,2021-05-18
770,茶**1,颜色分类: 中号加厚款【304不锈钢+抗菌pp剁骨面】,好评,此用户没有填写评价。,实物和图片一样，质量很好，客服服务也好，很满意的一次购物！,-,2021-06-12
771,j**2,颜色分类: 【中号双倍加厚】双面抗菌专利/砍剁不伤刀,好评,做工不错，很扎实，也很美观，推荐购买和使用 ,-,-,2021-05-18
772,r**丶,颜色分类: 【中号 双倍加厚】 双面抗菌专利/砍剁不伤刀,好评,用了几天确实不错，再也不用担心砧板发霉会影响健康了。外观漂亮，光滑，比想象中的厚实。收捡方便，一点不占空间，准备给妈妈也买一个，妈妈看到这个很喜欢，我也觉得质量很好，服务也很好。最重要的是不滋生霉菌，对身体有好处，比木头的卫生耐用。 ,正常切菜切水果没有留下痕迹，最满意的应该是不会生霉。挺好的，比别的原料的菜板干净卫生，好清洗，本次购物很满意，全五星好评。,-,2021-04-26
773,q**1,颜色分类: 大号 加厚款【304不锈钢+抗菌pp剁骨面】,好评,菜板收到非常好，双面生熟分开，干净卫生，清洗方便。,-,-,2021-05-17
774,小**呀,颜色分类: 中号 加厚款【304不锈钢+抗菌pp剁骨面】,好评,已经收到了 没有异味 很厚实 不错的选择 适合三四个人使用买的中号   ,-,-,2021-05-11
775,曹**9,颜色分类: 【大号 双倍加厚】 双面抗菌专利/砍剁不伤刀,好评,没有说的那么好用，我看不出来那里可以杀菌，不锈钢的，一切全是划痕。滑来滑去，清洗也不好清洗，怎么洗都油乎乎的,客服编号淘宝淘气值201联系退货处理，承诺99天承担运费退货。,-,2021-06-22
776,翠**8,颜色分类: 【中号 双倍加厚】 双面抗菌专利/砍剁不伤刀,好评,很好哦，雙面的超級方便 ,-,-,2021-06-18
777,y**0,颜色分类: 大号加厚款【304不锈钢+抗菌pp剁骨面】,好评,还没拆，搬新家再用 ,-,-,2021-06-25
778,t**4,颜色分类: 【中号 双倍加厚】 双面抗菌专利/砍剁不伤刀,好评,好，很好，非常好哦。不锈钢的就不容易上锈了，目前用起来非常好，期待用了一段时间依旧这么好。哇咔咔咔咔,-,-,2021-06-09
779,t**2,颜色分类: 【中号双倍加厚】双面抗菌专利/砍剁不伤刀,好评,今天收到了！菜板厚实，卖家还送了礼物，非常满意的一次购物！我喜欢的颜色,早上用了，真心不错,家图腾双面抗菌菜板，一面采用的拥有专利抗菌不锈钢材质，抗菌率高达99.99%.另一面采用的是德国技术高韧性食品级PP材质，耐砍耐剁.拥有强大的99天无理由退换货的售后质保，让您多一份安心.【家图腾旗舰店】,2021-06-19
780,侯**g,颜色分类: 大号加厚款【304不锈钢+抗菌pp剁骨面】,好评,非常不错 赞一个,-,-,2021-06-18
781,莫**1,颜色分类: 【大号 双倍加厚】 双面抗菌专利/砍剁不伤刀,好评,我喜欢的，真心不错,-,-,2021-06-19
782,t**4,颜色分类: 【大号 双倍加厚】 双面抗菌专利/砍剁不伤刀,好评,质量好值得购买 ,-,-,2021-06-09
783,红**z,颜色分类: 【中号双倍加厚】双面抗菌专利/砍剁不伤刀,好评,发货快，拍下的第二天早上就收到了。源自德国，不锈钢和食品级PP材质，用起来放心。 ,-,-,2021-05-15
784,c**h,颜色分类: 【中号 双倍加厚】 双面抗菌专利/砍剁不伤刀,好评,试了一下，感觉还行,-,-,2021-06-18
785,w**8,颜色分类: 中号 加厚款【304不锈钢+抗菌pp剁骨面】,好评,质量不错，试了几下没有刀印，不知道时间长了会不会有，还有赠品，不错啊 ,硅胶没有味道，很好，菜板切了肉也没有划痕,家图腾双面抗菌菜板，生熟食区分，一冲即净。我们一直秉承“99天剁坏包换”为原则，坚信质量与服务是口碑的前提，为您提供实打实的产品与质量和服务，vip客服竭力尽心提供优质服务！期待咱们下次合作 【家图腾旗舰店】,2021-05-20
786,没**7,颜色分类: 中号加厚款【304不锈钢+抗菌pp剁骨面】,好评,商品好，售后服务很好 ,-,-,2021-06-15
787,z**6,颜色分类: 大号加厚款【304不锈钢+抗菌pp剁骨面】,好评,此用户没有填写评价。,售后服务态度很好,-,2021-06-17
788,小**洲,颜色分类: 【大号 双倍加厚】 双面抗菌专利/砍剁不伤刀,好评,很好，很坚实，好用。,？价钱比之前买的是稍微贵点，不过这个砧板真的很厚实，剁鸡剁排骨都完全没有问题。婆婆也说挺好用。最重要的好清洗。,-,2021-06-14
789,周**1,颜色分类: 中号 加厚款【304不锈钢+抗菌pp剁骨面】,好评,非常好，大小也合适，正反都好用，还送了刨刀！ ,太好用了，大小合适，非常喜欢！,-,2021-05-18
790,l**l,颜色分类: 【中号 双倍加厚】 双面抗菌专利/砍剁不伤刀,好评,发货速度很快；颜色超灵的，牛油果颜色很赞👍质量不错哦；卖家服务很好：值得推荐购买；集美们赶紧入手吧！,真的好用 颜值超高的 值得购买 质量与美貌并存的一款产品,-,2021-05-26
791,你**0,颜色分类: 【大号 双倍加厚】 双面抗菌专利/砍剁不伤刀,好评,菜板是给妈妈买的，质量挺好的，稳固又结实厚实度，我妈也很喜欢，尺寸大小是妈妈添的，妈妈觉得这个尺寸正好适合她用，表面无漆无蜡，没有任何异味儿，还是双面的，更加卫生健康了。我妈说这个菜板挺好的，她挺喜欢，下回还可以再买这个牌子的。,生肉、熟食分开切，菜板很轻便，便于冲洗，买了个支架沥水很方便吧、不发霉，而且很节省空间，好评,家图腾双面抗菌菜板，生熟食区分，一冲即净。我们一直秉承“99天剁坏包换”为原则，坚信质量与服务是口碑的前提，为您提供实打实的产品与质量和服务，vip客服竭力尽心提供优质服务！期待咱们下次合作 【家图腾旗舰店】,2021-04-22
792,胖**r,颜色分类: 中号加厚款【304不锈钢+抗菌pp剁骨面】,好评,比木菜板卫生多了，质量杠杠的，刚好碰上优惠，很划算,-,-,2021-06-14
793,t**8,颜色分类: 【中号 双倍加厚】 双面抗菌专利/砍剁不伤刀,好评,美观适用，质量好，赞👍 ,-,-,2021-06-17
794,塔**i,颜色分类: 中号 加厚款【304不锈钢+抗菌pp剁骨面】,好评,东西很好，实用方便。好用，下次还可以回购。,好用，质量不错👍,-,2021-05-15
795,牵**子,颜色分类: 中号加厚款【304不锈钢+抗菌pp剁骨面】,好评,用了再来评价 ,-,-,2021-06-20
796,f**a,颜色分类: 【中号 双倍加厚】 双面抗菌专利/砍剁不伤刀,好评,感觉不错 还没用 客服很不错,-,-,2021-06-20
797,刘**2,颜色分类: 【中号双倍加厚】双面抗菌专利/砍剁不伤刀,好评,宝贝真好用，原来用的都是木头的，容易发霉，这个超赞👍,"宝贝收到了，卖家发货很快，物流也非常给力,客服服务态度极好，很有耐心，好喜欢。还有包装精美，高端大气上档次;看得出来商家很用心。宝贝真心不错。刚刚切了个西瓜，效果不错，PP面做了防水槽设计，汁水不会流到地上，效果挺不错的，水一冲就干净了。有了这个不锈钢的就再不怕发霉了。更加的卫生健康。放在台面上很稳定，不会滑，有一定分量，质量很好。切菜非常方便，以后再也不用担心发霉了。",家图腾双面抗菌菜板，生熟食区分，一冲即净。我们一直秉承“99天剁坏包换”为原则，坚信质量与服务是口碑的前提，为您提供实打实的产品与质量和服务，vip客服竭力尽心提供优质服务！期待咱们下次合作 【家图腾旗舰店】,2021-06-05
798,豹**帅,颜色分类: 【大号 双倍加厚】 双面抗菌专利/砍剁不伤刀,好评,挺重的 不知道好不好用 先给好评 ,-,-,2021-06-21
799,烟**畔,颜色分类: 大号加厚款【304不锈钢+抗菌pp剁骨面】,好评,看着颜色就清爽，清洗方便，再也不用担心生锈发霉，谢谢店家送的小礼物。 ,-,-,2021-05-26
800,t**6,颜色分类: 大号加厚款【304不锈钢+抗菌pp剁骨面】,好评,挺好的 大家放心购买 ,冲啊,健康，安全，卫生，不发霉，不滋生细菌，全新升级中科院专利不锈钢材质双面菜板，生食熟食分开.菜板首选   【家图腾旗舰店】,2021-06-18
801,t**5,颜色分类: 【中号 双倍加厚】 双面抗菌专利/砍剁不伤刀,好评,质量好发货快再也不用担心长霉菌了，买小了个人建议买大号,-,-,2021-06-18
802,叶**1,颜色分类: 【大号 双倍加厚】 双面抗菌专利/砍剁不伤刀,好评,家里的木菜板用久了板面会发黄，四边角容易发黑，经常要换。朋友推荐的这款不锈钢材质的菜板，特意买来试试，双面不同材质，不锈钢面可以用来切蔬菜水果，PP面可以用来切肉，生熟可以分开使用，有效避免了细菌的交叉感染，使用后清洗比较方便，水冲洗下就干净了，使用效果很棒 ,菜板拿着挺有分量的，很厚实，切着很稳，起初还担心会用不惯，试了一下跟木菜板区别不大，可以放心购买。,健康，安全，卫生，不发霉，不滋生细菌，全新升级中科院专利不锈钢材质双面菜板，生食熟食分开.菜板首选   【家图腾旗舰店】,2021-04-22
803,子**8,颜色分类: 【中号 双倍加厚】 双面抗菌专利/砍剁不伤刀,好评,很满意@,-,-,2021-06-23
804,z**8,颜色分类: 中号加厚款【304不锈钢+抗菌pp剁骨面】,好评,不锈钢材质的比较干净，给宝宝用放心,-,-,2021-06-14
805,静**年,颜色分类: 中号加厚款【304不锈钢+抗菌pp剁骨面】,好评,挺好的，给描述相符,很不错的呢,健康，安全，卫生，不发霉，不滋生细菌，全新升级中科院专利不锈钢材质双面菜板，生食熟食分开.菜板首选   【家图腾旗舰店】,2021-06-13
806,商**儿,颜色分类: 【中号 双倍加厚】 双面抗菌专利/砍剁不伤刀,好评,这款菜板当时主要看它防发霉，觉得挺好的，以前用的菜板很容易发霉，菜板发霉听说很容易致癌，所以果断换了一个新菜板，收到货物更是开心，双面好用，看上去很舒服，我喜欢咯，主要是考虑不生霉，这才是最关键，家里人不多用这个足够了。东西很好，值得。,两面有区别，正好一面用来处理熟食，另一面处理果蔬。可挂立收纳，易清洗。性价比还不错，分量十足，质量很好。还在挑选的亲们可以下手买一个试试,健康，安全，卫生，不发霉，不滋生细菌，全新升级中科院专利不锈钢材质双面菜板，生食熟食分开.菜板首选   【家图腾旗舰店】,2021-04-21
807,兆**哒,颜色分类: 【中号双倍加厚】双面抗菌专利/砍剁不伤刀,好评,看了这款菜板很长时间了，一直都很中意，终于下决定买下，真的物超所值，很喜欢 ,这个菜板真是满满的幸福感，用过之后，一冲即净，颜值还很高,-,2021-05-24
808,t**2,颜色分类: 【大号 双倍加厚】 双面抗菌专利/砍剁不伤刀,好评,很大，够用了,-,-,2021-06-19
809,t**0,颜色分类: 【大号 双倍加厚】 双面抗菌专利/砍剁不伤刀,好评,好  买了两块,-,-,2021-06-16
810,t**1,颜色分类: 中号 加厚款【304不锈钢+抗菌pp剁骨面】,好评,此用户没有填写评价。,用着不错,-,2021-06-13
811,帅**哥,颜色分类: 中号加厚款【304不锈钢+抗菌pp剁骨面】,好评,此用户没有填写评价。,真的很好用,-,2021-06-19
812,t**6,颜色分类: 大号加厚款【304不锈钢+抗菌pp剁骨面】,好评,家里的老菜板要我说早该换了，之前的木菜板用一用就长霉，开裂，看起来非常不美观，换了这款不锈钢的完全没有这种担扰，外表光滑没有毛刺看起来非常精致，平常切菜切水果都很好用，水一冲就干干净净和新的一样了，还不会串味，这点非常满意  ,双面可用的，非常好的设计，这样肉菜分开使用，而且也不会残留细菌，非常好，赞！,健康，安全，卫生，不发霉，不滋生细菌，全新升级中科院专利不锈钢材质双面菜板，生食熟食分开.菜板首选   【家图腾旗舰店】,2021-06-18
813,c**a,颜色分类: 【大号 双倍加厚】 双面抗菌专利/砍剁不伤刀,好评,打开包装，放到厨房里，把之前木质的扔掉，这个牛油果🥑绿色呀，另我感到厨房都蓬壁生辉啦！好看呀！两面都好用，之前还担心不锈钢面会太硬呢，结果用起来超级舒服😌PP面用着就更完美啦，还有一圈的防水栏，不用担心睡淌的到处都是了。如果再在设计上磨刀器就更完美👌,-,-,2021-06-06
814,小**儿,颜色分类: 【大号双倍加厚】双面抗菌专利/砍剁不伤刀,好评,这款不锈钢砧板本人很喜欢，无论是质地还是尺寸，都符合本人的预期。手感虽然蛮有份量的，使用起来还是比较轻便，边角光滑没有毛刺，物流蛮快的，打开后没有异味，很环保，外观简洁大方，用起来比较顺手，买来专门切水果蔬菜用的，不会串味，好清洗不发霉。双面两用，更加卫生。 ,菜板子，不锈钢，防霉，清洗方便，真的很棒呢。不锈钢食品接触，安全放心，比家用刀具硬度低，不会伤刀。精致生活，需要精致的家居用品，非常建议购买，大中小各取所需。,健康，安全，卫生，不发霉，不滋生细菌，全新升级中科院专利不锈钢材质双面菜板，生食熟食分开.菜板首选   【家图腾旗舰店】,2021-05-03
815,红**a,颜色分类: 中号加厚款【304不锈钢+抗菌pp剁骨面】,好评,家图腾的这款切菜板，价格实惠，质量还有保障，厚度适中，尺寸够大。非常适合家庭厨房使用，肉类和蔬菜分开切，防止交叉感染，竹制品又环保，值得拥有。很结实，切食物不用担心划痕.买得也不贵，挺重挺实用的，也不用担心像木制砧板容易发霉，还是挺满意的。洗干净之后放一会就干了.  ,"这款菜板厚实不错比我原有的要厚实。产品做工没的说，双面使用的设计，可以很好的分开生熟和果蔬与肉食.把健康和卫生两大块考虑进去,这一点很不错",家图腾双面抗菌菜板，生熟食区分，一冲即净。我们一直秉承“99天剁坏包换”为原则，坚信质量与服务是口碑的前提，为您提供实打实的产品与质量和服务，vip客服竭力尽心提供优质服务！期待咱们下次合作 【家图腾旗舰店】,2021-04-29
816,微**8,颜色分类: 【大号 双倍加厚】 双面抗菌专利/砍剁不伤刀,好评,好重，质量很好,-,-,2021-06-16
817,9**舞,颜色分类: 【中号 双倍加厚】 双面抗菌专利/砍剁不伤刀,好评,还没用，感觉还行 ,-,-,2021-06-22
818,w**9,颜色分类: 【大号 双倍加厚】 双面抗菌专利/砍剁不伤刀,好评,菜板很厚实，清洗方便，切菜切肉不打滑，物流也很快，很愉快的一次购物… ,已经使用了两天，很不错，好清洗。,-,2021-05-25
819,小**子,颜色分类: 中号 加厚款【304不锈钢+抗菌pp剁骨面】,好评,发货速度也很快，质量看着不错，还没用，用了追评，送了个削皮器，还不错，嘿嘿,用了，感觉还不错,-,2021-05-17
820,h**n,颜色分类: 【大号 双倍加厚】 双面抗菌专利/砍剁不伤刀,好评,店家的售后服务态度非常好！五星好评！,菜板很好用，值得购买，推荐！,-,2021-06-15
821,花**子,颜色分类: 【大号双倍加厚】双面抗菌专利/砍剁不伤刀,好评,底部需要洒水才不跑，案板颜值很不错，还没搬新家没用，这两样东西都是第一次用，实际体验待使用了以后再追评价 ,-,-,2021-06-01
822,d**a,颜色分类: 【大号 双倍加厚】 双面抗菌专利/砍剁不伤刀,好评,618一元购菜板美滋滋儿哈哈哈,非常棒的1元购体验。 谢谢老板。老板大气,家图腾双面抗菌菜板，一面采用的拥有专利抗菌不锈钢材质，抗菌率高达99.99%.另一面采用的是德国技术高韧性食品级PP材质，耐砍耐剁.拥有强大的99天无理由退换货的售后质保，让您多一份安心.【家图腾旗舰店】,2021-06-20
823,王**t,颜色分类: 【大号 双倍加厚】 双面抗菌专利/砍剁不伤刀,好评,待使用后再追评 ,-,-,2021-06-19
824,t**0,颜色分类: 【大号双倍加厚】双面抗菌专利/砍剁不伤刀,好评,收到货了颜值一百质量一百太喜欢了值得购买,菜板已收到质量太好了大爱值得购买,-,2021-05-19
825,运**豆,颜色分类: 【中号 双倍加厚】 双面抗菌专利/砍剁不伤刀,好评,质量很好！ ,-,-,2021-06-18
826,芒**2,颜色分类: 中号加厚款【304不锈钢+抗菌pp剁骨面】,好评,案板厚度是我想要的款式，货物厚实大气，有品味，还可以挂非常实用，方便沥水。很喜欢！拍照也好看，切了下水果，挺顺手的。顺丰快递又非常放心，包装很好，没有任何破损！拿到手上也很有份量！非常好一次购物。 ,商品质量非常好，菜板整体分量很足，做工很精细。是我想要的，大小非常合适，拿着也很方便，终于可以生熟分的明确了。菜板双面设计实用性很强。,家图腾双面抗菌菜板，一面采用的拥有专利抗菌不锈钢材质，抗菌率高达99.99%.另一面采用的是德国技术高韧性食品级PP材质，耐砍耐剁.拥有强大的99天无理由退换货的售后质保，让您多一份安心.【家图腾旗舰店】,2021-04-27
827,小**9,颜色分类: 【大号 双倍加厚】 双面抗菌专利/砍剁不伤刀,好评,此用户没有填写评价。,客服小波，服务很好，618零点还给补了差价,-,2021-06-14
828,t**2,颜色分类: 【大号双倍加厚】双面抗菌专利/砍剁不伤刀,好评,一直想买这款砧板，终于买到手了，以前的砧板用了一段时间就会发黑发霉，这款砧板太好了，颜值爆了！宝贝跟预想的一样好，物流也很快，一面切菜，一面切水果，无细菌感染，非常棒！质量挺好的，有一定重量！考虑几天入手的，没有失望哦！一分价钱一分货，可以两面用！好清洗，推荐大家入手！中科院的抗菌材料，双面菜板，太喜欢了  ,婆婆用了，她很喜欢哦，非常好的菜板，之前一直用的木质的和竹质的菜板，每次用不了多久就会发霉。赞叹“现在的东西真先进”，双面设计，一面切蔬菜水果，一面切肉类，防止串味儿，还干净卫生。,"非常感谢您对家图腾旗舰店支持，新升级无色素揉面垫不仅收纳方便,还是0添加无异味，高品质的揉面垫选家图腾旗舰店。",2021-06-19
829,黑**1,颜色分类: 【中号 双倍加厚】 双面抗菌专利/砍剁不伤刀,好评,这个菜板还是蛮不错的嘛，收到货之后就感觉非常棒，做工很精细，没有毛刺，双面可用，食品级PP材质，安全没有异味，还有一定的抗菌作用。昨天买的小西瓜今天刚刚好可以拿出来切一下，好切不伤刀，吃完以后放在水槽一冲，不会像之前买的木制菜板那样， 还有残留，是一个实实在在的健康好产品！ ,-,-,2021-04-18
