982,t**1,口味: [300g经典原味]5袋箱装,好评,第二次购买了，味道不错，挺喜欢吃的,-,-,2021-06-21
983,t**5,口味: [300g经典原味]5袋箱装,好评,个人口味不一样吧，一般般,-,-,2021-06-25
984,慧**2,口味: [300g经典原味]5袋箱装,好评,味道很正宗，非常好吃，我感觉有瘾，,-,-,2021-06-24
985,b**2,口味: [300g经典原味]5袋箱装,好评,第一次买他家的，如果好吃会再买的 ,-,-,2021-06-20
986,b**6,口味: [300g经典原味]5袋箱装,好评,好吃，味道很正宗，价格便宜,-,-,2021-06-24
987,看**1,口味: [300g经典原味]5袋箱装,好评,好吃  味道正宗  吃完了还会回购的 推荐推荐,-,-,2021-06-26
988,哦**s,口味: [300g经典原味]5袋箱装,好评,收到啦！迫不及待的打开吃了一袋，味道非常不错，辣度刚刚好，准备复购几份了,-,-,2021-06-18
989,t**0,口味: [300g经典原味]5袋箱装,好评,螺蛳粉味道很好，很好吃，份量足，包装精致密封性好。 ,-,-,2021-06-22
990,t**7,口味: [300g经典原味]5袋箱装,好评,第一次吃，味道还真的挺好的，吃完再来,-,-,2021-06-26
991,t**0,口味: [300g经典原味]5袋箱装,好评,很喜欢这个味道，下次还会再来的 。,-,-,2021-06-22
992,t**8,口味: [300g经典原味]5袋箱装,好评,口感很好，非常好吃，下次还会来买的 ,-,-,2021-06-25
993,t**2,口味: [300g经典原味]5袋箱装,好评,味道不错，很赞，分量也很多,-,-,2021-06-22
994,来**a,口味: [300g经典原味]5袋箱装,好评,螺狮粉收到了，已经开吃了一包，味道很正宗，又酸又辣，材料十足，包装日期很新鲜 ,-,-,2021-06-09
995,枫**1,口味: [300g经典原味]5袋箱装,好评,真的很好吃，和店里的到味道一样的，，价格还实惠 ,-,-,2021-06-15
996,t**6,口味: [300g经典原味]5袋箱装,好评,螺蛳粉口感很好，调料齐全，吃着劲道爽滑，鲜香味正，正宗的很，闻起臭，吃着可香了，值得回购,-,-,2021-06-24
997,赵**奕,口味: [300g经典原味]5袋箱装,好评,味道很不错，口感正宗， ,-,-,2021-06-24
998,t**4,口味: [300g经典原味]5袋箱装,好评,口感好，味道正，真心好吃,-,-,2021-06-17
999,t**0,口味: [300g经典原味]5袋箱装,好评,螺蛳粉己下肚，口味正中，吃完回购,-,-,2021-06-22
1000,t**4,口味: [300g经典原味]5袋箱装,好评,味道好极了，大人小孩都爱吃，又回购了,-,-,2021-06-17
1001,s**6,口味: [300g经典原味]5袋箱装,好评,包装安全结实  口感非常精典   适合我的口味 ,-,-,2021-06-17
1002,t**4,口味: [300g经典原味]5袋箱装,好评,卖家发货速度快，螺蛳粉分量足，味道也正，吃完还会再来买,-,-,2021-06-17
1003,t**2,口味: [300g经典原味]5袋箱装,好评,螺蛳粉包装很漂亮，味道很正宗，非常喜欢，满意,-,-,2021-06-23
1004,t**9,口味: [300g经典原味]5袋箱装,好评,配菜很非常丰富，闻着味道就特别有食欲！会回购！酸辣都恰到好处，性价比不要太高，笋脆嫩不老，这个最好吃，挺不错的哟，没怪味非常新鲜，没什么不一样的，酸料包太给力了，笋脆老汤包味道挺浓郁,-,-,2021-06-14
1005,b**淑,口味: [300g经典原味]5袋箱装,好评,买来当夜宵吃，很划算，很好吃。,-,-,2021-06-22
1006,t**9,口味: [300g经典原味]5袋箱装,好评,粉粉已经收到了。非常好吃。感谢商家做这么好吃的东西让我过嘴瘾。赞👍,-,-,2021-06-14
1007,z**4,口味: [300g经典原味]5袋箱装,好评,货已收到味道不错，下次还要买。,-,-,2021-06-23
1008,不**字,口味: [300g经典原味]5袋箱装,好评,收道，味道特别香，下次还要多买点。,-,-,2021-06-25
1009,t**9,口味: [300g经典原味]5袋箱装,好评,好吃，实惠又正宗,-,-,2021-06-14
1010,我**我,口味: [300g经典原味]5袋箱装,好评,伙食分收到了，口感不错，味道挺正宗的，这次比较实惠,-,-,2021-06-19
1011,t**4,口味: [300g经典原味]5袋箱装,好评,好吃，粉很爽滑，汤底浓厚，回味无穷啊！,-,-,2021-06-17
1012,t**2,口味: [300g经典原味]5袋箱装,好评,非常好吃，味道好极了，会推荐给朋友,-,-,2021-06-25
1013,t**0,口味: [300g经典原味]5袋箱装,好评,整体评价：好 包装品质：好 口感味道：超级好吃 下次回购 ,-,-,2021-06-22
1014,简**2,口味: [300g经典原味]5袋箱装,好评,孩子很喜欢吃,-,-,2021-06-19
1015,欧**6,口味: [300g经典原味]5袋箱装,好评,非常好吃，里面有好多小料包,-,-,2021-06-26
1016,t**5,口味: [300g经典原味]5袋箱装,好评,真的推荐啊，快递速度特别的快，爱了爱了  好吃好吃，喜欢的宝宝可以入手了,-,-,2021-06-25
1017,林**b,口味: [300g经典原味]5袋箱装,好评,螺蛳粉很美味，比在实体店的好吃，下次还来选购，,-,-,2021-06-26
1018,t**3,口味: [300g经典原味]5袋箱装,好评,收到了好吃，耐煮量大,-,-,2021-06-20
1019,t**8,口味: [300g经典原味]5袋箱装,好评,快递很给力，刚好可以当晚饭，味道棒棒哒好吃。,-,-,2021-06-23
1020,l**9,口味: [300g经典原味]5袋箱装,好评,问道金典纯正，口感好，价格实惠,-,-,2021-06-20
1021,陈**1,口味: [300g经典原味]5袋箱装,好评,我姐吃的，听说还可以，就是有点辣 ,-,-,2021-06-21
1022,庭**8,口味: [300g经典原味]5袋箱装,好评,很好吃，喜欢这个味道，吃没再回购,-,-,2021-06-21
1023,t**0,口味: [300g经典原味]5袋箱装,好评,味道正宗，料包齐全，会继续回购,-,-,2021-06-22
1024,t**2,口味: [300g经典原味]5袋箱装,好评,特别喜欢吃，味道很好，还会再来,-,-,2021-06-25
1025,t**3,口味: [300g经典原味]5袋箱装,好评,螺蛳粉很好吃，味道很正，好吃停不下来,-,-,2021-06-20
1026,t**0,口味: [300g经典原味]5袋箱装,好评,味道不错喜欢吃，以后还会回购的,-,-,2021-06-22
1027,t**0,口味: [300g经典原味]5袋箱装,好评,螺蛳粉很好吃，而且味道很好，很好吃，吃完再买。,-,-,2021-06-22
1028,t**6,口味: [300g经典原味]5袋箱装,好评,螺狮粉收到了，味道棒极了呢，很满意的一次购物。发货速度，会回购。,-,-,2021-06-24
1029,m**7,口味: [300g经典原味]5袋箱装,好评,QQ弹弹味道很正宗,-,-,2021-06-24
1030,t**9,口味: [300g经典原味]5袋箱装,好评,螺蛳粉收到了，料包足，煮了很香，味道不错，赞！,-,-,2021-06-14
1031,t**8,口味: [300g经典原味]5袋箱装,好评,大爱，和老公都喜欢，回购几次了,-,-,2021-06-25
1032,邱**君,口味: [300g经典原味]5袋箱装,好评,螺蛳粉收到了，味道很正宗，喜欢吃,-,-,2021-06-23
1033,t**4,口味: [300g经典原味]5袋箱装,好评,迫不及待得尝了一下，味道还可以哦,-,-,2021-06-17
1034,t**5,口味: [300g经典原味]5袋箱装,好评,螺蛳粉儿收到了。味道挺好的，非常好吃。,-,-,2021-06-25
1035,唉**呵,口味: [300g经典原味]5袋箱装,好评,不正宗  个人觉得不太适合我的口味,-,-,2021-06-25
1036,y**1,口味: [300g经典原味]5袋箱装,好评,收到了，真够味儿，爽！还会回购的！,-,-,2021-06-22
1037,t**9,口味: [300g经典原味]5袋箱装,好评,螺丝粉味道很正，量很足。还会回购的。,-,-,2021-06-14
1038,t**8,口味: [300g经典原味]5袋箱装,好评,宝贝收到，料很足，酸辣可口，很好吃。,-,-,2021-06-25
1039,梅**j,口味: [300g经典原味]5袋箱装,好评,此用户没有填写评价。,吃了才来评论，这款螺蛳粉味道非常不错，方便快捷，价格也实惠，值得购买,-,2021-06-14
1040,t**4,口味: [300g经典原味]5袋箱装,好评,味道不错，吃着好吃，下次还会下购的。,-,-,2021-06-17
1041,t**7,口味: [300g经典原味]5袋箱装,好评,螺蛳粉收到了，煮了一包，味道还可以，,-,-,2021-06-26
1042,t**4,口味: [300g经典原味]5袋箱装,好评,太香了，跟店里买的一样，主要这个方便实惠，想吃可以自己在家煮,-,-,2021-06-17
1043,t**7,口味: [300g经典原味]5袋箱装,好评,味道不错，分量足，好吃。,-,-,2021-06-26
1044,依**9,口味: [300g经典原味]5袋箱装,好评,拿到手后立马就拆开一包来试试，太好吃了值得推荐。,-,-,2021-06-21
1045,t**1,口味: [300g经典原味]5袋箱装,好评,真的很划算呢，实物和图片一样，口感很好，可以放心入手。,-,-,2021-06-21
1046,t**6,口味: [300g经典原味]5袋箱装,好评,螺蛳粉很好吃，吃起来也很香，很好吃，味道很好。,-,-,2021-06-24
1047,可**可,口味: [300g经典原味]5袋箱装,好评,螺蛳粉正宗，酸辣适中，包装完好，量足味正料齐全，新日期，棒棒哒 ,-,-,2021-06-19
1048,子**1,口味: [300g经典原味]5袋箱装,好评,满满的一大碗，粉很细腻，很好吃，配料也很足,-,-,2021-06-25
1049,小**呢,口味: [300g经典原味]5袋箱装,好评,收到了，和描述一样，味道很好，很喜欢！,-,-,2021-06-24
1050,t**2,口味: [300g经典原味]5袋箱装,好评,物流很快就收到了，味道不错，量很多，值得购买和推荐！,-,-,2021-06-21
1051,野**5,口味: [300g经典原味]5袋箱装,好评,味道好极了，正宗的柳州螺蛳粉味道杠杠的。,-,-,2021-06-22
1052,t**9,口味: [300g经典原味]5袋箱装,好评,螺蛳粉味道很正宗，粉条很好煮，味道很鲜，汤很好喝，不错,-,-,2021-06-14
1053,t**7,口味: [300g经典原味]5袋箱装,好评,螺蛳粉很好吃，味道不错，很喜欢，吃完再来买。 ,-,-,2021-06-26
1054,t**8,口味: [300g经典原味]5袋箱装,好评,很满意，发货快，本人很喜欢吃螺蛳粉，这家的还蛮好吃，会来回购的，推荐 ,-,-,2021-06-26
1055,j**8,口味: [300g经典原味]5袋箱装,好评,物流很快！看这包装就是物超所值？已经收藏并推荐给朋友了！还会再来的！关键是客服的服务态度也挺好！ ,-,-,2021-06-23
1056,游**里,口味: [300g经典原味]5袋箱装,好评,味道还可以，分量很足哦,-,-,2021-06-25
1057,k**j,口味: [300g经典原味]5袋箱装,好评,味道还可以，份量很足,-,-,2021-06-26
1058,q**y,口味: [300g经典原味]5袋箱装,好评,到货很快哦，晚上饿了就泡来吃掉。,-,-,2021-06-17
1059,r**0,口味: [300g经典原味]5袋箱装,好评,味道很正宗，米粉Q弹软糯，配料也很足，吃完还要买,-,-,2021-06-18
1060,t**6,口味: [300g经典原味]5袋箱装,好评,发货挺快的物流给力，口味也很正价格也不贵。。。,-,-,2021-06-24
1061,t**6,口味: [300g经典原味]5袋箱装,好评,螺蛳粉收到了 包装很好很满意 口感和味道很喜欢 分量很足  ,-,-,2021-06-24
1062,张**4,口味: [300g经典原味]5袋箱装,好评,爱了爱了，非常美味的螺蛳粉，还会复购噢。  ,-,-,2021-06-24
1063,辣**i,口味: [300g经典原味]5袋箱装,好评,螺蛳粉收到了，包装很好，味道不错，很满意！ ,-,-,2021-06-21
1064,宝**2,口味: [300g经典原味]5袋箱装,好评,买回来吃了，很好吃，味道新鲜，喜欢吃！,-,-,2021-06-23
1065,郭**9,口味: [300g经典原味]5袋箱装,好评,味道很正宗，量很充足,-,-,2021-06-25
1066,t**3,口味: [300g经典原味]5袋箱装,好评,很好吃，跟卖家描述的一样，以后还来买。,-,-,2021-06-20
1067,大**菜,口味: [300g经典原味]5袋箱装,好评,包装很好，特意吃了味道好极了，服务态度好，孩子很喜欢吃，不错的一次购物。 ,-,-,2021-06-26
1068,t**8,口味: [300g经典原味]5袋箱装,好评,味道好正宗，心心念念的味道，吃完再买👍👍👍👍,-,-,2021-06-21
1069,李**2,口味: [300g经典原味]5袋箱装,好评,好吃，味道棒棒哒，很大一包，料很足,-,-,2021-06-24
1070,喜**拓,口味: [300g经典原味]5袋箱装,好评,很正宗的味道，吃这也很爽特满意 ,-,-,2021-06-24
1071,t**u,口味: [300g经典原味]5袋箱装,好评,螺蛳粉味道很正很好吃，会回购的,-,-,2021-06-21
1072,t**3,口味: [300g经典原味]5袋箱装,好评,特别好吃，味道很正，推荐购买！ ,-,-,2021-06-20
1073,t**5,口味: [300g经典原味]5袋箱装,好评,味道很正，吃着够爽 还会光顾的 ,-,-,2021-06-25
1074,t**2,口味: [300g经典原味]5袋箱装,好评,螺蛳粉很好吃，家里人也受感染都爱吃，嘻嘻，会回购的,-,-,2021-06-25
1075,我**5,口味: [300g经典原味]5袋箱装,好评,这是我在网上买的比较好的螺蛳粉。挺好吃，值得回味。 ,-,-,2021-06-23
1076,p**s,口味: [300g经典原味]5袋箱装,好评,味道不错，很正宗，包装很严密，发货速度也很快。 ,-,-,2021-06-24
1077,c**3,口味: [300g经典原味]5袋箱装,好评,挺好吃的，配料也多，价格不贵。,-,-,2021-06-26
1078,抱**熊,口味: [300g经典原味]5袋箱装,好评,挺好吃的粉，味道浓郁，最爱里面的腐竹，给了好多，比之前买的牌子好吃,-,-,2021-06-18
1079,王**7,口味: [300g经典原味]5袋箱装,好评,很好吃。忘记拍图片了，味道正宗,-,-,2021-06-21
1080,1**y,口味: [300g经典原味]5袋箱装,好评,收到货回家就迫不及待煮了一包吃，味道很好，跟我以前吃的正宗柳州螺蛳粉一模一样，超满足 🤩 ,-,-,2021-06-18
1081,缘**7,口味: [300g经典原味]5袋箱装,好评,螺蛳粉收到了，味道不错，很正宗。,-,-,2021-06-22
1082,j**n,口味: [300g经典原味]5袋箱装,好评,喜欢包装精美，很不错 ，下次还来,-,-,2021-06-24
1083,你**哈,口味: [300g经典原味]5袋箱装,好评,整体评价：好好吃 无限回购 ,-,-,2021-06-22
1084,z**0,口味: [300g经典原味]5袋箱装,好评,好吃，美味，量足,-,-,2021-06-22
1085,t**8,口味: [300g经典原味]5袋箱装,好评,螺蛳粉太好吃了，果断收藏，下次还会再来哟。,-,-,2021-06-25
1086,t**0,口味: [300g经典原味]5袋箱装,好评,很地道的螺狮粉，一直偏爱这口，这次选对了，正宗 ,-,-,2021-06-22
1087,t**8,口味: [300g经典原味]5袋箱装,好评,味道很好，比其他的螺狮粉要正宗，好吃，价格实惠，值得推荐大家购买！,-,-,2021-06-15
1088,t**5,口味: [300g经典原味]5袋箱装,好评,买勒一包试一下，结果真的很香，一直很喜欢吃螺丝粉，棒棒的这家人的味道很不错👏 老公都叫我多买几包了哈哈,-,-,2021-06-25
1089,t**0,口味: [300g经典原味]5袋箱装,好评,非常好吃，份量也很足，会再回购,-,-,2021-06-22
1090,t**7,口味: [300g经典原味]5袋箱装,好评,宝贝收到啦，实物真的好吃，价格非常实惠，强烈推荐这款，超级喜欢 ,-,-,2021-06-26
1091,t**3,口味: [300g经典原味]5袋箱装,好评,好喜欢吃螺蛳粉，很正宗的口味,-,-,2021-06-20
1092,t**3,口味: [300g经典原味]5袋箱装,好评,螺狮粉味道很正宗！是我喜欢的味道！,-,-,2021-06-20
1093,t**1,口味: [300g经典原味]5袋箱装,好评,螺丝粉价格不贵，味道很纯正，有喜欢吃的就赶紧下单吧！,-,-,2021-06-21
1094,t**5,口味: [300g经典原味]5袋箱装,好评,粉味道可以，下次还会来。,-,-,2021-06-25
1095,t**7,口味: [300g经典原味]5袋箱装,好评,好好吃，我家小孩很喜欢吃，都没买了好多次了，比超市便宜些🌹🌹🌹,-,-,2021-06-26
1096,t**3,口味: [300g经典原味]5袋箱装,好评,螺蛳粉收到就开吃了，味道正宗。,-,-,2021-06-20
1097,张**0,口味: [300g经典原味]5袋箱装,好评,老婆喜欢吃，给她买的，她说还不错的 ,-,-,2021-06-23
1098,t**7,口味: [300g经典原味]5袋箱装,好评,螺蛳粉到货了，质量很好，味道好极了，吃完再来 ,-,-,2021-06-26
1099,2**华,口味: [300g经典原味]5袋箱装,好评,螺狮粉收到了，没有任何不良包装，吃着美，味美汤好喝，配料不错。 ,-,-,2021-06-19
1100,l**5,口味: [300g经典原味]5袋箱装,好评,味道很鲜，孩子要买的，很好吃，喜欢 ,-,-,2021-06-24
1101,t**8,口味: [300g经典原味]5袋箱装,好评,整体评价：非常好，会回购 ,-,-,2021-06-25
1102,t**1,口味: [300g经典原味]5袋箱装,好评,螺蛳粉广西特产，口味齐全，任你选择，包装很好干净卫生，食用方便，值得购买,-,-,2021-06-21
1103,h**5,口味: [300g经典原味]5袋箱装,好评,好吃，新鲜日期 口感味道：正版 包装品质：好 ,-,-,2021-06-19
1104,t**7,口味: [300g经典原味]5袋箱装,好评,味道很臭，我不喜欢，但大女儿特别爱吃，东西分量很足，很棒,-,-,2021-06-26
1105,f**4,口味: [300g经典原味]5袋箱装,好评,味道很好，量也多，配料多 ,-,-,2021-06-22
1106,m**5,口味: [300g经典原味]5袋箱装,好评,快递物流很给力，宝贝质量超级好，满意的一次购物，赞👍,-,-,2021-06-22
1107,d**i,口味: [300g经典原味]5袋箱装,好评,味道很正宗，很浓，吃了回味无穷，哈哈,-,-,2021-06-25
1108,w**7,口味: [300g经典原味]5袋箱装,好评,挺好吃的，就是放辣放多啦！是我自己放的，有需要还会在来 ,-,-,2021-06-25
1109,l**6,口味: [300g经典原味]5袋箱装,好评,味道还不错，不过价格实惠。小孩很喜欢吃。,-,-,2021-06-21
1110,t**4,口味: [300g经典原味]5袋箱装,好评,味道非常好吃，下次再想吃再买,-,-,2021-06-17
1111,王**1,口味: [300g经典原味]5袋箱装,好评,味道正宗，价格实惠 ,-,-,2021-06-24
1112,不**o,口味: [300g经典原味]5袋箱装,好评,螺丝粉收到，包装严实，物流快，味道好，一家人都非常喜欢,-,-,2021-06-21
1113,孙**6,口味: [300g经典原味]5袋箱装,好评,螺蛳粉收到，味道很好，很正宗，值得购买品尝 ,-,-,2021-06-23
1114,t**1,口味: [300g经典原味]5袋箱装,好评,口味非常正宗，好吃，好香，非常满意，吃完再来！,-,-,2021-06-21
1115,星**1,口味: [300g经典原味]5袋箱装,好评,很好吃，味道很正，满意，愉快的一次购物。,-,-,2021-06-22
1116,t**4,口味: [300g经典原味]5袋箱装,好评,收到了  不错味道好极了  超赞  超值的 ,-,-,2021-06-17
1117,t**6,口味: [300g经典原味]5袋箱装,好评,螺师粉非常喜欢。螺狮粉品质保证，超爱螺狮粉，粉爽滑，汤酸辣适口，料包丰富,-,-,2021-06-24
1118,l**e,口味: [300g经典原味]5袋箱装,好评,吃完了来囤货，这个没有那么辣，适合我这种不太能吃辣的,-,-,2021-06-21
1119,t**0,口味: [300g经典原味]5袋箱装,好评,很正宗，口感好，好吃，日期新鲜 ,-,-,2021-06-22
1120,t**7,口味: [300g经典原味]5袋箱装,好评,口味好，喜欢吃，推荐购买，回购,-,-,2021-06-26
1121,t**7,口味: [300g经典原味]5袋箱装,好评,螺丝粉一如既往的好吃 这好像是第五次回购了把 真香味道不错,-,-,2021-06-26
1122,1**s,口味: [300g经典原味]5袋箱装,好评,非常满意的一次，挺好吃的！,-,-,2021-06-17
1123,t**6,口味: [300g经典原味]5袋箱装,好评,货收到了，我家吃这个螺丝粉吃得上瘾，老少皆宜第四次复购,-,-,2021-06-24
1124,向**8,口味: [300g经典原味]5袋箱装,好评,嘎嘎好吃，非常正宗，就喜欢吃这个味，一袋两人吃整好,-,-,2021-06-22
1125,t**5,口味: [300g经典原味]5袋箱装,好评,太好吃了，味道很赞，会回购的 😍😍😍😍,-,-,2021-06-25
1126,t**3,口味: [300g经典原味]5袋箱装,好评,性价比高哦(๑❛ᴗ❛๑) 看个人口味吧，这个味道我是不大能接受的  _・)  ,-,-,2021-06-20
1127,张**3,口味: [300g经典原味]5袋箱装,好评,螺蛳粉收到了，太满意了，包装的很细心，孩子迫不及待的就打开了，味道很正宗 ,-,-,2021-06-19
1128,t**6,口味: [300g经典原味]5袋箱装,好评,味道正宗酸爽,-,-,2021-06-24
1129,t**6,口味: [300g经典原味]5袋箱装,好评,(⊙o⊙)哇 太好吃了，一点都不夸张，非常地道 ,-,-,2021-06-24
1130,萄**儿,口味: [300g经典原味]5袋箱装,好评,"好吃好吃,味正,价格实惠,值得推荐",-,-,2021-06-24
1131,淅**2,口味: [300g经典原味]5袋箱装,好评,味道挺好的，挺香挺浓，感觉很正宗的,-,-,2021-06-24
1132,t**1,口味: [300g经典原味]5袋箱装,好评,味道很香很正宗，比较喜欢吃。,-,-,2021-06-21
1133,t**4,口味: [300g经典原味]5袋箱装,好评,日期新鲜，包装完好，味道好吃 ,-,-,2021-06-17
1134,t**3,口味: [300g经典原味]5袋箱装,好评,好吃，口感是我喜欢的，吃完再来,-,-,2021-06-20
1135,t**5,口味: [300g经典原味]5袋箱装,好评,很好吃的螺蛳粉，味道很好，吃货必备。,-,-,2021-06-25
1136,s**6,口味: [300g经典原味]5袋箱装,好评,味道正宗，粉丝劲道，吃完再来,-,-,2021-06-24
1137,w**8,口味: [300g经典原味]5袋箱装,好评,不用说太多，四个字，非常好吃，还会继续回购,-,-,2021-06-25
1138,霞**0,口味: [300g经典原味]5袋箱装,好评,好吃，包装精致里面配菜也非常丰富料包都很新鲜，口感味道与描述相符，味道很正宗，买的很合我心意 ,-,-,2021-06-10
1139,p**远,口味: [300g经典原味]5袋箱装,好评,螺蛳粉很好吃，没有一点腥味，很香，很好吃，吃完还会再买的。,-,-,2021-06-21
1140,t**4,口味: [300g经典原味]5袋箱装,好评,收到了，味道很好，买多次了，值得推荐购买！,-,-,2021-06-17
1141,t**1,口味: [300g经典原味]5袋箱装,好评,螺丝粉味道正宗，份量很足，日期很新鲜，吃完回购 ,-,-,2021-06-21
1142,t**1,口味: [300g经典原味]5袋箱装,好评,螺蛳粉包装好分量足，特别好吃，价格实惠，非常满意，还会回购。,-,-,2021-06-21
1143,t**6,口味: [300g经典原味]5袋箱装,好评,螺蛳粉收到，包装好，吃着口感不错，比超市便宜,-,-,2021-06-24
1144,x**1,口味: [300g经典原味]5袋箱装,好评,料包很正，性价比高，吃起来味道真心不错,-,-,2021-06-25
1145,t**1,口味: [300g经典原味]5袋箱装,好评,初闻说怪，捂鼻入口立觉惊艳，再尝叫爽，笑把奇香当怪臭，鲜香酸辣爽，欲罢不能  ,-,-,2021-06-21
1146,t**6,口味: [300g经典原味]5袋箱装,好评,不好吃，粉的质量是最差的那种,-,-,2021-06-24
1147,陆**娘,口味: [300g经典原味]5袋箱装,好评,螺蛳粉很好吃，价格实惠，很满意。,-,-,2021-06-22
1148,谢**8,口味: [300g经典原味]5袋箱装,好评,味道好极了 胀包问题：没有 ,-,-,2021-06-22
1149,t**4,口味: [300g经典原味]5袋箱装,好评,口味很棒，份量足。价格实惠，喜欢吃螺蛳粉的赶紧入手啦,-,-,2021-06-17
1150,t**3,口味: [300g经典原味]5袋箱装,好评,额非常好吃，平时也喜欢在网上买螺蛳粉，这次价格不贵还比之前的更好吃，味道也很浓，吃完还来,-,-,2021-06-20
1151,a**y,口味: [300g经典原味]5袋箱装,好评,螺蛳粉很好哈，味道也不错,-,-,2021-06-25
1152,t**2,口味: [300g经典原味]5袋箱装,好评,发货速度很快  以前去广西 很喜欢吃螺蛳粉 回到东北就吃不到 这次在🍑包买的很成功呢 味道纯正 很喜欢,-,-,2021-06-15
1153,w**1,口味: [300g经典原味]5袋箱装,好评,味道鲜美，老公和孩子特别喜欢吃，很满意,-,-,2021-06-23
1154,不**5,口味: [300g经典原味]5袋箱装,好评,包装很好，味道不错好吃。味道香喷喷。值得推荐,-,-,2021-06-22
1155,t**5,口味: [300g经典原味]5袋箱装,好评,好大一包，螺狮粉分量调料都十足的，味道非常棒，很正宗，以后都不用去外面花大价钱买吃的，值得回购,-,-,2021-06-25
1156,t**2,口味: [300g经典原味]5袋箱装,好评,份量足，佐料也搭配齐全，不错。,-,-,2021-06-22
1157,杨**风,口味: [300g经典原味]5袋箱装,好评,小粉丝(螺蛳粉)大产业在外地也能吃到柳州的味道很好，坚决支持传统产品发展。,-,-,2021-06-19
1158,t**8,口味: [300g经典原味]5袋箱装,好评,好好吃，买回来以后小孩抢着吃,-,-,2021-06-24
1159,l**1,口味: [300g经典原味]5袋箱装,好评,螺蛳粉好吃，已经回购几次了，怎么吃都不够， ,-,-,2021-06-22
1160,t**5,口味: [300g经典原味]5袋箱装,好评,宝贝收到了，孩子很喜欢吃，还会再来的 ,-,-,2021-06-25
1161,t**2,口味: [300g经典原味]5袋箱装,好评,整体评价：很棒，挺好吃的 ,-,-,2021-06-22
1162,t**3,口味: [300g经典原味]5袋箱装,好评,非常的正宗，很喜欢，味道特别好哦，爱上了！,-,-,2021-06-20
1163,t**3,口味: [300g经典原味]5袋箱装,好评,味道很正，分量也够，物流也快真的耶，真的很划得算，真的。,-,-,2021-06-20
1164,小**1,口味: [300g经典原味]5袋箱装,好评,物流很快，味道也不错，跟店里差不多，性价比很高,-,-,2021-06-21
1165,t**3,口味: [300g经典原味]5袋箱装,好评,味道相当奈斯，闻着臭吃着香 ,-,-,2021-06-20
1166,l**6,口味: [300g经典原味]5袋箱装,好评,第二次买了，味道真是太好了,-,-,2021-06-23
1167,t**1,口味: [300g经典原味]5袋箱装,好评,感觉不值这个价，还不如隔壁李子柒，酸笋口感比较差，是嫩的，不太建议购买,-,-,2021-06-21
1168,t**5,口味: [300g经典原味]5袋箱装,好评,很好吃 辣度有待提高,-,-,2021-06-25
1169,t**0,口味: [300g经典原味]5袋箱装,好评,质量不错，和超市买的一样，非常满意，,-,-,2021-06-22
1170,t**5,口味: [300g经典原味]5袋箱装,好评,味道非常正宗，一袋的量也非常多。,-,-,2021-06-25
1171,t**1,口味: [300g经典原味]5袋箱装,好评,价格便宜，味道不错,-,-,2021-06-21
1172,t**9,口味: [300g经典原味]5袋箱装,好评,螺丝粉非常好吃，料足，好吃,-,-,2021-06-14
1173,y**航,口味: [300g经典原味]5袋箱装,好评,很喜欢吃，口感不错，到货也快，很满意。,-,-,2021-06-21
