1374,t**3,口味: [300g经典原味]5袋箱装,好评,复购，好吃，量足,-,-,2021-06-20
1375,z**1,口味: [300g经典原味]5袋箱装,好评,非常好吃，量足，味道正宗，十分酸爽，吃完在来,-,-,2021-06-15
1376,t**7,口味: [300g经典原味]5袋箱装,好评,刚好做活动，价格便宜了很多，性价比超高，真的特别划算 ,-,-,2021-06-26
1377,丫**5,口味: [300g经典原味]5袋箱装,好评,女儿非常喜欢，很满意的一次购物！,-,-,2021-06-21
1378,t**0,口味: [300g经典原味]5袋箱装,好评,螺蛳粉味道很正宗，分量真的很足，我一个人都吃不完，好吃又不贵。下次回购,-,-,2021-06-22
1379,t**8,口味: [300g经典原味]5袋箱装,好评,料很足，味道不错很好吃，经济实惠，包装好看 ,-,-,2021-06-09
1380,t**3,口味: [300g经典原味]5袋箱装,好评,螺丝粉到货了，粉看上去很好，料包很足 ,-,-,2021-06-20
1381,乔**园,口味: [300g经典原味]5袋箱装,好评,宝贝收到了，物流很快。客服态度好，味道好。整体和描述的一样，值得购买。,-,-,2021-06-25
1382,t**3,口味: [300g经典原味]5袋箱装,好评,哈哈味道不错喜欢,-,-,2021-06-20
1383,t**0,口味: [300g经典原味]5袋箱装,好评,同事说这家口感很好，很好吃，买来送给女朋友的，她很喜欢吃螺丝粉,-,-,2021-06-22
1384,y**5,口味: [300g经典原味]5袋箱装,好评,味道很好，量足，我和老公两个人吃一包，吃到撑，爱了,-,-,2021-06-19
1385,t**7,口味: [300g经典原味]5袋箱装,好评,收到了就煮了一袋，挺好吃的，价格实惠，物流很快,-,-,2021-06-26
1386,t**6,口味: [300g经典原味]5袋箱装,好评,味道很好，量大实惠，还会再来光顾的,-,-,2021-06-24
1387,w**心,口味: [300g经典原味]5袋箱装,好评,味道不错，份量很足，粉很劲道，爱吃辣的小伙伴有口福啦😊,-,-,2021-06-15
1388,华**7,口味: [300g经典原味]5袋箱装,好评,螺蛳粉，孩子的最爱，平时总是去外面吃，今天吃了这个牌子的说要多买点回来,-,-,2021-06-20
1389,滨**s,口味: [300g经典原味]5袋箱装,好评,螺蛳粉很正宗，好吃不贵还会回购的！,-,-,2021-06-22
1390,j**3,口味: [300g经典原味]5袋箱装,好评,我最爱的螺蛳粉,-,-,2021-06-24
1391,t**4,口味: [300g经典原味]5袋箱装,好评,非常满意，很好吃，和现煮一样 ,-,-,2021-06-17
1392,t**7,口味: [300g经典原味]5袋箱装,好评,又回购一次了，还是那个味道，超级爱，一家大小斗爱吃，挺正宗的，推荐,-,-,2021-06-26
1393,t**2,口味: [300g经典原味]5袋箱装,好评,口味正宗，太好吃了,-,-,2021-06-23
1394,t**1,口味: [300g经典原味]5袋箱装,好评,好吃😊味道美极了！,-,-,2021-06-21
1395,t**5,口味: [300g经典原味]5袋箱装,好评,好吃，物流很快，包装完整，已经推荐给小姐妹,-,-,2021-06-25
1396,邱**祺,口味: [300g经典原味]5袋箱装,好评,螺丝粉收到了，昨天煮了吃，简单方便好吃。,-,-,2021-06-23
1397,韩**4,口味: [300g经典原味]5袋箱装,好评,一打开，一看料包这么多就知道很正宗，很地道，酸酸的，臭臭的，够味，太好吃了，一收到就立马煮了一碗，太喜欢这个味了 ,-,-,2021-06-12
1398,t**0,口味: [300g经典原味]5袋箱装,好评,好吃，取回来就煮了一袋，香喷喷的😂，量给的足，吃一次你忘不了的味道，香，我自己一分吃完撑得不行😂值得购买,-,-,2021-06-22
1399,y**0,口味: [300g经典原味]5袋箱装,好评,螺蛳粉非常的好吃，比我上次买的三只松鼠的好吃多了，以后买螺蛳粉就你家了，而且价格陕西！ ,-,-,2021-06-17
1400,2**i,口味: [300g经典原味]5袋箱装,好评,一打开纸箱，一股螺蛳粉的特殊味道就飘出来了，好香啊！吃完再来追评。,-,-,2021-06-16
1401,t**9,口味: [300g经典原味]5袋箱装,好评,味道不错，很好吃啊,-,-,2021-06-14
1402,t**1,口味: [300g经典原味]5袋箱装,好评,味道不错，挺正宗的,-,-,2021-06-21
1403,t**3,口味: [300g经典原味]5袋箱装,好评,味道很好的，是正宗的,-,-,2021-06-20
1404,窗**猫,口味: [300g经典原味]5袋箱装,好评,味道很正宗，好吃,-,-,2021-06-24
1405,t**0,口味: [300g经典原味]5袋箱装,好评,味道不错，辣的过瘾,-,-,2021-06-22
1406,春**1,口味: [300g经典原味]5袋箱装,好评,好吃，是喜欢的味道,-,-,2021-06-26
1407,尹**肖,口味: [300g经典原味]5袋箱装,好评,好喜欢吃，味道很好,-,-,2021-06-24
1408,默**财,口味: [300g经典原味]5袋箱装,好评,味道正宗，很好吃 ,-,-,2021-06-25
1409,我**3,口味: [300g经典原味]5袋箱装,好评,好吃好吃，真的不错，味道正宗，满意 ,-,-,2021-06-24
1410,t**1,口味: [300g经典原味]5袋箱装,好评,挺喜欢吃螺蛳粉的，买过几次，但是觉得这家的螺蛳粉还好吃，味道正宗，真的可以，喜欢吃的放心购买 ,-,-,2021-06-21
1411,t**2,口味: [300g经典原味]5袋箱装,好评,我只想说以后再也不去大街吃麻辣烫了，就在家里吃螺丝粉了，真好吃，,-,-,2021-06-23
1412,p**6,口味: [300g经典原味]5袋箱装,好评,好吃的很，老公很喜欢吃,-,-,2021-06-21
1413,t**4,口味: [300g经典原味]5袋箱装,好评,好好吃，爱了这个味道！,-,-,2021-06-17
1414,t**9,口味: [300g经典原味]5袋箱装,好评,味道真香，好好吃！不出门，就可以吃到这么正宗的味道！,-,-,2021-06-14
1415,t**妈,口味: [300g经典原味]5袋箱装,好评,柳州螺狮粉，用料足，口感劲道，味道特别正宗，在家也能吃到好吃的螺狮粉啦。 ,-,-,2021-06-19
1416,0**n,口味: [300g经典原味]5袋箱装,好评,味道挺不错的 辣椒挺辣的 ,-,-,2021-06-25
1417,t**8,口味: [300g经典原味]5袋箱装,好评,口感不错，量也足,-,-,2021-06-21
1418,阿**e,口味: [300g经典原味]5袋箱装,好评,螺丝粉口感很棒,-,-,2021-06-26
1419,自**3,口味: [300g经典原味]5袋箱装,好评,收到，味道正，好吃,-,-,2021-06-26
1420,t**9,口味: [300g经典原味]5袋箱装,好评,螺丝粉收到了，味道很好，值得购买,-,-,2021-06-14
1421,明**志,口味: [300g经典原味]5袋箱装,好评,螺蛳粉收到了，份量很足，口味也好吃酸酸辣辣的真过瘾，吃完再来，满意 ,-,-,2021-06-17
1422,t**5,口味: [300g经典原味]5袋箱装,好评,粉很筋道，很好吃，物流也很快，下次还会光顾的。,-,-,2021-06-25
1423,t**1,口味: [300g经典原味]5袋箱装,好评,物流很快，螺狮粉口味独特，很好吃，份量也很，喜欢,-,-,2021-06-21
1424,t**6,口味: [300g经典原味]5袋箱装,好评,个人觉得还不错，比较喜欢，还会再买的。,-,-,2021-06-24
1425,t**2,口味: [300g经典原味]5袋箱装,好评,很好吃的螺蛳粉，超好吃爱上了值得回购,-,-,2021-06-22
1426,l**3,口味: [300g经典原味]5袋箱装,好评,物流超给力，包装非常精细，孩子们很喜欢!推荐大家尝试,-,-,2021-06-19
1427,t**4,口味: [300g经典原味]5袋箱装,好评,料足味正，挺好的,-,-,2021-06-17
1428,常**3,口味: [300g经典原味]5袋箱装,好评,螺狮粉收到了，超好吃，吃完还来你家买，,-,-,2021-06-26
1429,t**4,口味: [300g经典原味]5袋箱装,好评,螺丝粉拿回来了，明天再煮，期待好吃!,-,-,2021-06-17
1430,t**7,口味: [300g经典原味]5袋箱装,好评,好吃又实惠的螺蛳粉，我们一家人的最爱,-,-,2021-06-26
1431,欣**0,口味: [300g经典原味]5袋箱装,好评,螺蛳粉好吃，不知道几次回购了 ,-,-,2021-06-23
1432,t**8,口味: [300g经典原味]5袋箱装,好评,此用户没有填写评价。,宝贝收到了物流很快质量很好客服回复及时物美价廉,-,2021-06-17
1433,芒**面,口味: [300g经典原味]5袋箱装,好评,好吃好吃    又辣又臭    太过瘾了     准备再入手,-,-,2021-06-22
1434,h**i,口味: [300g经典原味]5袋箱装,好评,很好吃，味道正宗，值得购买！,-,-,2021-06-24
1435,t**1,口味: [300g经典原味]5袋箱装,好评,味道很不错，好吃，下次再来！,-,-,2021-06-21
1436,t**0,口味: [300g经典原味]5袋箱装,好评,一颗星都不想给！酸笋用榨菜代替！,-,-,2021-06-22
1437,t**5,口味: [300g经典原味]5袋箱装,好评,口感很好，分量很足，满意,-,-,2021-06-25
1438,t**0,口味: [300g经典原味]5袋箱装,好评,螺蛳粉以后收到，很好吃会回公勺,-,-,2021-06-22
1439,我**策,口味: [300g经典原味]5袋箱装,好评,上次在朋友那吃过一回感觉味道不错，前几天嘴馋就自己买回来了，没让我失望，满意 ,-,-,2021-06-20
1440,1**咪,口味: [300g经典原味]5袋箱装,好评,忙的到现在才吃，粉很劲道，味道很正宗，自己还在里面加了料，分量很足，味道不错，下次还会来够 ,-,-,2021-06-13
1441,w**7,口味: [300g经典原味]5袋箱装,好评,物流快，味道好，辣度合适，好吃,-,-,2021-06-22
1442,月**心,口味: [300g经典原味]5袋箱装,好评,到货了就煮上了，色香味俱全，太好吃了，比外面店的好吃多了，吃完还继续购买,-,-,2021-06-17
1443,g**y,口味: [300g经典原味]5袋箱装,好评,发货快，口感香辣酸爽，味道很好，很好吃，这是一次满意的购物，好评。 ,-,-,2021-06-19
1444,t**1,口味: [300g经典原味]5袋箱装,好评,宝贝收到了，东西好吃快递给力，没有破损,-,-,2021-06-21
1445,江**5,口味: [300g经典原味]5袋箱装,好评,很好吃值得购买，很推荐这家，很正宗哦 ,-,-,2021-06-24
1446,t**8,口味: [300g经典原味]5袋箱装,好评,真的很好吃，属于无限回购款，推荐！,-,-,2021-06-26
1447,至**上,口味: [300g经典原味]5袋箱装,好评,我家宝宝非常喜欢吃。物流很快。味道也很好,-,-,2021-06-23
1448,t**3,口味: [300g经典原味]5袋箱装,好评,哈哈，螺蛳粉都吃下肚好几天了，光顾着美味却忘了来评价😂他家的螺蛳粉，确实好吃哟，估计戒不掉了。,-,-,2021-06-20
1449,w**6,口味: [300g经典原味]5袋箱装,好评,螺蛳粉很好吃，收到货就迫不及待的打开尝了一下，味道很好，口感很好。,-,-,2021-06-15
1450,k**o,口味: [300g经典原味]5袋箱装,好评,味道太爱了，好吃好吃,-,-,2021-06-22
1451,沫**心,口味: [300g经典原味]5袋箱装,好评,味道鲜美可口，份量也很足。包装很严实，路上也没挤压怪。会回购的,-,-,2021-06-16
1452,t**7,口味: [300g经典原味]5袋箱装,好评,量超级足，满满一大包，一个人吃得饱饱的，味道也很正宗，特别香,-,-,2021-06-26
1453,风**快,口味: [300g经典原味]5袋箱装,好评,满意味道非常正，非常喜欢很好吃，满意,-,-,2021-06-21
1454,t**5,口味: [300g经典原味]5袋箱装,好评,很好吃  推荐 ,-,-,2021-06-25
1455,粉**儿,口味: [300g经典原味]5袋箱装,好评,螺蛳粉口感劲道，爽嫩滑Q，超级好吃。分量很足，很正宗，准备回购 ,-,-,2021-06-16
1456,t**9,口味: [300g经典原味]5袋箱装,好评,是这个味没错，很实惠，价格也美丽,-,-,2021-06-14
1457,自**针,口味: [300g经典原味]5袋箱装,好评,好吃，份量足，正宗！ ,-,-,2021-06-22
1458,小**2,口味: [300g经典原味]5袋箱装,好评,好吃，味道不错。 ,-,-,2021-06-24
1459,c**e,口味: [300g经典原味]5袋箱装,好评,回购的，味道赞👍,-,-,2021-06-23
1460,t**9,口味: [300g经典原味]5袋箱装,好评,好吃，正宗味道。,-,-,2021-06-14
1461,t**2,口味: [300g经典原味]5袋箱装,好评,口感很好，很正宗,-,-,2021-06-22
1462,某**吗,口味: [300g经典原味]5袋箱装,好评,不错口感很好。,-,-,2021-06-25
1463,t**4,口味: [300g经典原味]5袋箱装,好评,味道很好，真的很好吃,-,-,2021-06-17
1464,t**0,口味: [300g经典原味]5袋箱装,好评,喜欢的味道，正宗 ,-,-,2021-06-22
1465,t**2,口味: [300g经典原味]5袋箱装,好评,味道正宗好吃,-,-,2021-06-26
1466,取**0,口味: [300g经典原味]5袋箱装,好评,味道还不错，全店同事都买了，都说挺好，性价比还是不错的。 ,-,-,2021-06-18
1467,c**x,口味: [300g经典原味]5袋箱装,好评,包装完好无损，味道口感很不错，正宗，会回购,-,-,2021-06-15
1468,t**1,口味: [300g经典原味]5袋箱装,好评,味道好好吃，很正宗，很好吃，下次还来。,-,-,2021-06-21
1469,待**5,口味: [300g经典原味]5袋箱装,好评,好吃好吃好吃   绝了 好吃的停不下来  吃的我都上火了😂,-,-,2021-06-26
1470,t**7,口味: [300g经典原味]5袋箱装,好评,味道不错，收到就打开吃了，分量很足，吃好了闻着这味道还想吃，吃完继续回购 ,-,-,2021-06-26
1471,梅**5,口味: [300g经典原味]5袋箱装,好评,很好吃，婆婆很喜欢,-,-,2021-06-21
1472,迷**8,口味: [300g经典原味]5袋箱装,好评,好像螺狮粉就只买过这家的 然后就一直买这家店的了 家里人都挺喜欢 优惠的接着买买 ,-,-,2021-06-15
1473,t**6,口味: [300g经典原味]5袋箱装,好评,挺好吃的，发货快，价格实惠,-,-,2021-06-24
1474,t**2,口味: [300g经典原味]5袋箱装,好评,广西螺蛳粉确实好吃，粉劲道，辣椒油味道好，酸笋够味。,-,-,2021-06-19
1475,t**8,口味: [300g经典原味]5袋箱装,好评,宝贝收到了，经典原味，是我喜欢的味道，推荐购买,-,-,2021-06-16
1476,t**1,口味: [300g经典原味]5袋箱装,好评,炒鸡好吃，这味道简直绝了，大人孩子都喜欢这味道，我会继续关注的…,-,-,2021-06-21
1477,u**y,口味: [300g经典原味]5袋箱装,好评,好吃，料很足,-,-,2021-06-16
1478,等**8,口味: [300g经典原味]5袋箱装,好评,好吃好吃，真的很好吃，已经是再次购买了,-,-,2021-06-25
1479,t**9,口味: [300g经典原味]5袋箱装,好评,价格实惠，挺好吃的,-,-,2021-06-14
1480,t**4,口味: [300g经典原味]5袋箱装,好评,螺蛳粉收到了。味道好。很好吃。吃完再买。,-,-,2021-06-17
1481,t**3,口味: [300g经典原味]5袋箱装,好评,螺丝粉好吃，正宗广西柳州螺丝粉，太爱了,-,-,2021-06-20
1482,t**0,口味: [300g经典原味]5袋箱装,好评,螺丝粉收到了 ，很好吃 ，以后会回购的 。,-,-,2021-06-22
1483,清**器,口味: [300g经典原味]5袋箱装,好评,货收到后就拆开吃了，挺好吃，会回购的,-,-,2021-06-26
1484,花**成,口味: [300g经典原味]5袋箱装,好评,螺狮粉超级好吃，让人吃了回味无穷,-,-,2021-06-25
1485,维**子,口味: [300g经典原味]5袋箱装,好评,螺蛳粉很好吃，跟外面卖的一样，味道香配料足👍 ,-,-,2021-06-16
1486,倩**1,口味: [300g经典原味]5袋箱装,好评,份量很足，超好吃,-,-,2021-06-24
1487,w**萍,口味: [300g经典原味]5袋箱装,好评,物流快，好好吃。喜欢这个酸爽的味道。,-,-,2021-06-25
1488,t**9,口味: [300g经典原味]5袋箱装,好评,拿回来，我就烧水，给螺蛳粉做了，味道好极了，有咬头，微辣，正适合我的口味，我还打算再买些,-,-,2021-06-14
1489,c**4,口味: [300g经典原味]5袋箱装,好评,我是第一次在网上买来吃，味道很正宗，很喜欢穿，每袋分量都很足,-,-,2021-06-18
1490,t**5,口味: [300g经典原味]5袋箱装,好评,孩子们都说好吃，味道特别香，还会再来的 口感味道：香 ,-,-,2021-06-25
1491,t**3,口味: [300g经典原味]5袋箱装,好评,味道很好，很正，下次还会光顾的,-,-,2021-06-20
1492,a**n,口味: [300g经典原味]5袋箱装,好评,口感特别正宗,-,-,2021-06-24
1493,心**2,口味: [300g经典原味]5袋箱装,好评,味道很不错👍,-,-,2021-06-21
1494,t**0,口味: [300g经典原味]5袋箱装,好评,很好吃，味道刚刚的 ,-,-,2021-06-22
1495,y**魔,口味: [300g经典原味]5袋箱装,好评,很好吃，味道很好，很香，非常满意,-,-,2021-06-22
1496,t**4,口味: [300g经典原味]5袋箱装,好评,宝贝收到不错好评！,-,-,2021-06-17
1497,t**5,口味: [300g经典原味]5袋箱装,好评,非常喜欢的口味，质量很好，非常好吃全家都爱吃，非常满意的一次购物。,-,-,2021-06-25
1498,浅**7,口味: [300g经典原味]5袋箱装,好评,拿到快递了，还没尝味道，包装很大气，一看就是挺高档的，这物流也太快了，两天到家,-,-,2021-06-20
1499,t**4,口味: [300g经典原味]5袋箱装,好评,宝贝已收到，味道不错，,-,-,2021-06-17
1500,t**0,口味: [300g经典原味]5袋箱装,好评,东西不错，卖家也很风趣。下次还来～,-,-,2021-06-22
1501,d**5,口味: [300g经典原味]5袋箱装,好评,收到就煮来吃了，很好吃，吃完打算再买,-,-,2021-06-25
1502,t**3,口味: [300g经典原味]5袋箱装,好评,好大一包，螺狮粉分量调料都十足的，味道也很好，很正宗，以后都不用去外面吃了，吃完还来你家买 ,-,-,2021-06-20
1503,t**0,口味: [经典原味]5袋箱装,好评,此用户没有填写评价。,今天又开煮了 ，超级满意，量多一大包包装的细心。特别有嚼劲爽口，味道是真不错。,-,2021-06-22
1504,t**4,口味: [300g经典原味]5袋箱装,好评,味道很鲜美，配料很齐全，满满一大碗，味儿地道，回购。,-,-,2021-06-17
1505,t**5,口味: [300g经典原味]5袋箱装,好评,味道很好吃，跟店里差不多，价格也实惠，很满意,-,-,2021-06-25
1506,t**1,口味: [300g经典原味]5袋箱装,好评,味道很好，不错哦，值得购买。 ,-,-,2021-06-21
1507,t**7,口味: [300g经典原味]5袋箱装,好评,好久没有吃螺狮粉了，很正宗，很好吃,-,-,2021-06-26
1508,t**8,口味: [300g经典原味]5袋箱装,好评,太好吃了，简单方便，食材丰盛，量足，一个人吃很饱的，哈哈。。下次再来你家买。。,-,-,2021-06-16
1509,蔡**文,口味: [300g经典原味]5袋箱装,好评,香辣可口，一包下去都还想吃第二包，吃完了又来,-,-,2021-06-15
1510,快**1,口味: [300g经典原味]5袋箱装,好评,太好吃😋好吃了，下次继续光顾。👍🏻👍🏻👍🏻👍🏻,-,-,2021-06-22
1511,t**2,口味: [300g经典原味]5袋箱装,好评,量足味道正宗 好吃不贵 以后螺蛳粉就认准这里了,-,-,2021-06-17
1512,t**1,口味: [300g经典原味]5袋箱装,好评,味道好吃，都已经购买多次了,-,-,2021-06-21
1513,恰**梦,口味: [300g经典原味]5袋箱装,好评,咋说呢，味道上感觉不太是我想要的味道，不过总体来说还可以,-,-,2021-06-24
1514,t**9,口味: [300g经典原味]5袋箱装,好评,粉精到，味道好吃，很不错,-,-,2021-06-14
1515,t**6,口味: [300g经典原味]5袋箱装,好评,收到货了，料非常足，很好吃，粉很有劲道，喜欢吃 ,-,-,2021-06-24
1516,t**6,口味: [300g经典原味]5袋箱装,好评,今天收到就煮了一包吃了，味道真的很棒，以后自己在家准备多囤点，既省事又好吃！ ,-,-,2021-06-24
1517,t**7,口味: [300g经典原味]5袋箱装,好评,螺蛳粉的味道很好，味道很正，米粉也很筋道，很喜欢，值得安利。,-,-,2021-06-26
1518,t**7,口味: [300g经典原味]5袋箱装,好评,味道正宗，好吃，发货快，物美价廉，好评！,-,-,2021-06-26
1519,t**1,口味: [300g经典原味]5袋箱装,好评,螺蛳粉收到了，味道和实体店买的一样，价格便宜,-,-,2021-06-21
1520,t**4,口味: [300g经典原味]5袋箱装,好评,挺棒的，发的快递到货速度挺快的。 ,-,-,2021-06-17
1521,t**7,口味: [300g经典原味]5袋箱装,好评,发货速度超级快，螺蛳粉正宗，下次还来！,-,-,2021-06-26
1522,t**2,口味: [300g经典原味]5袋箱装,好评,这家的螺蛳粉老正宗了，非常的好吃 ,-,-,2021-06-26
1523,t**皮,口味: [300g经典原味]5袋箱装,好评,好吃，口感纯正，孩子们很喜欢。,-,-,2021-06-15
1524,t**0,口味: [300g经典原味]5袋箱装,好评,螺蛳粉是正品，味道很好，很好吃，非常满意，下次还会光顾的。 ,-,-,2021-06-22
1525,t**5,口味: [300g经典原味]5袋箱装,好评,刚拿回家就吃了，口感好吃，里面的配料也很多，吃完下次还来这家买，物流也超快昨天下的单今天就到了。满意 ,-,-,2021-06-25
1526,t**3,口味: [300g经典原味]5袋箱装,好评,味道很正啊哈哈,-,-,2021-06-20
1527,若**m,口味: [300g经典原味]5袋箱装,好评,正宗，我嫂子是广西的，她都说好吃，那肯定是好吃了，她在网上没买过，现在被我带偏了，问我要了链接，值得推荐！,-,-,2021-06-18
1528,t**1,口味: [300g经典原味]5袋箱装,好评,非常好吃 喜欢的味道 物流也很快,-,-,2021-06-21
1529,t**5,口味: [300g经典原味]5袋箱装,好评,朋友推荐的，确实很不错，现在都不用去店里了想吃自己煮就可以了，满意喜欢,-,-,2021-06-25
1530,t**2,口味: [300g经典原味]5袋箱装,好评,好吃，美味嘿嘿,-,-,2021-06-24
1531,琦**1,口味: [300g经典原味]5袋箱装,好评,螺狮粉味道也很，我老公特别爱吃他家的螺狮粉，真的很好吃，会继续回购的,-,-,2021-06-19
1532,t**0,口味: [300g经典原味]5袋箱装,好评,日期新鲜，味道不错，份量很足，喜欢螺丝粉的可以购买。,-,-,2021-06-22
1533,t**8,口味: [300g经典原味]5袋箱装,好评,味道不错，很正宗，价格实惠，下次还会再来 ,-,-,2021-06-19
1534,t**5,口味: [300g经典原味]5袋箱装,好评,分量多很好吃哦,-,-,2021-06-25
1535,t**6,口味: [300g经典原味]5袋箱装,好评,分量足.很好吃 ,-,-,2021-06-24
1536,阿**3,口味: [300g经典原味]5袋箱装,好评,分量多，味道好！,-,-,2021-06-26
1537,梦**缘,口味: [300g经典原味]5袋箱装,好评,口味很正宗,-,-,2021-06-25
1538,开**8,口味: [300g经典原味]5袋箱装,好评,味道正，好吃,-,-,2021-06-25
1539,你**8,口味: [300g经典原味]5袋箱装,好评,味道真的很正,-,-,2021-06-25
1540,妖**e,口味: [300g经典原味]5袋箱装,好评,味道很不错哦,-,-,2021-06-24
1541,t**8,口味: [300g经典原味]5袋箱装,好评,价格便宜，东西很实惠有好多包的料，很好喝，一会再追一些图让大家看看。,-,-,2021-06-20
1542,t**7,口味: [300g经典原味]5袋箱装,好评,辣度可以，料包可以，分量很足，个人觉得还不够臭 ,-,-,2021-06-26
1543,t**6,口味: [300g经典原味]5袋箱装,好评,这是我吃过最好吃的粉，特别正尊,-,-,2021-06-24
1544,t**8,口味: [300g经典原味]5袋箱装,好评,螺蛳粉收到了，早上特意早起，煮了一包当早餐，哈哈，味道极好，一包都够我跟小妞吃了，完美,-,-,2021-06-18
1545,t**0,口味: [300g经典原味]5袋箱装,好评,一如既往的满意，吃过好几次了，很喜欢这个味道，价格也优惠,-,-,2021-06-22
1546,t**9,口味: [300g经典原味]5袋箱装,好评,感味道好!好闻酸臭味酸辣味贼喜欢，米粉很耐煮不易断，包装很精美，比店里实惠吃起来很好都是独立包装，笋脆嫩不老汤包味道挺浓郁辣油很香配菜也非常丰富没怪味非常新鲜生产日期新鲜，感觉煮好了比外面店里的更好吃不膨胀量很足加几根青菜和咸须口味更好,-,-,2021-06-14
1547,t**1,口味: [300g经典原味]5袋箱装,好评,粉很筋道，很细腻，很好吃，味道不错，儿子也说很好吃,-,-,2021-06-21
1548,t**6,口味: [300g经典原味]5袋箱装,好评,小孩很喜欢。,-,-,2021-06-24
1549,t**8,口味: [300g经典原味]5袋箱装,好评,螺蛳粉收到后就迫不及待的煮了，味道很正宗，家人们都很喜欢,-,-,2021-06-20
1550,t**9,口味: [300g经典原味]5袋箱装,好评,味道特别好，价格实惠和商家描述的一样，特别好吃,-,-,2021-06-14
1551,t**6,口味: [300g经典原味]5袋箱装,好评,味道太好了，准备回购了，。好评。,-,-,2021-06-24
1552,t**2,口味: [300g经典原味]5袋箱装,好评,收到货啦，包装完好，价格经济实惠，很满意。,-,-,2021-06-18
1553,t**4,口味: [300g经典原味]5袋箱装,好评,好大一大包,-,-,2021-06-17
1554,t**0,口味: [300g经典原味]5袋箱装,好评,味道不错，量也比较足，满意,-,-,2021-06-22
1555,t**9,口味: [300g经典原味]5袋箱装,好评,收到就煮了吃啦，味道不错，酸辣爽口，特别过瘾的呢！喜欢😘会复购的👍,-,-,2021-06-14
1556,t**0,口味: [300g经典原味]5袋箱装,好评,好满意啊，商家发货真快，客服回复真及时，宝贝非常满意，真心不错，会推荐给朋友的，祝店家生意越来越好。,-,-,2021-06-22
1557,6**啦,口味: [300g经典原味]5袋箱装,好评,好吃的螺蛳粉，吃完了又来！停不下来了😂,-,-,2021-06-21
1558,s**y,口味: [300g经典原味]5袋箱装,好评,挺不错的，吃起来好好吃，非常喜欢，吃完了还要再买 ,-,-,2021-06-26
1559,t**7,口味: [300g经典原味]5袋箱装,好评,真的很好吃，量大，价格实惠值得入手,-,-,2021-06-26
1560,t**5,口味: [300g经典原味]5袋箱装,好评,味道可以，量也很足，价格也实惠！,-,-,2021-06-25
1561,t**4,口味: [300g经典原味]5袋箱装,好评,口味正宗，很好吃，满意。,-,-,2021-06-17
1562,t**1,口味: [300g经典原味]5袋箱装,好评,味道很正宗，很好吃，很不错。,-,-,2021-06-21
1563,w**m,口味: [300g经典原味]5袋箱装,好评,酸辣粉非常好吃，很满意，料也很足，真心不错，有喜欢的可以在购买,螺蛳粉很好吃，真的很好吃，真的很不错。吃的都念念不忘，很满意。,-,2021-06-15
1564,t**9,口味: [300g经典原味]5袋箱装,好评,货已收到，很好吃，推荐给朋友了，感谢商家热情周到的服务！还会回购的！,-,-,2021-06-14
