333,s**0,食品口味: 【约20袋小包】原香味250g*1袋（酥脆醇香）,好评,还没吃呢，瞅着不错，习惯好评 ,-,-,2021-06-18
334,姚**宾,食品口味: 【约40袋小包】奶油味250g+椒盐味250g,好评,发货及时到货迅速  味美可口值得信赖  全五分,-,-,2021-06-02
335,贞**1,食品口味: 【约40袋小包】原香味250g*2袋（酥脆醇香）,好评,以前一直买的良品铺子和三只松鼠的，看到这个这么便宜抱着试一试的的想法买的，刚刚才收到货，立马拆了一包试试，好吃，就是山核桃那个味，没有怪味，准备立马回购几包，因为孩子吃这个太厉害了。 ,-,-,2021-05-11
336,恰**田,食品口味: 【约20袋小包】原香味250g*1袋（酥脆醇香）,好评,此用户没有填写评价。,买了几次了，味道不错，偶尔有几粒有味道。,-,2021-06-16
337,恰**田,食品口味: 【约20袋小包】原香味250g*1袋（酥脆醇香）,好评,此用户没有填写评价。,买了几次，味道不错，偶尔有几粒有味道。,-,2021-06-16
338,l**傅,食品口味: 【约40袋小包】原香味250g+奶油味250g,好评,第二次买了，儿子说这个好吃,-,-,2021-06-08
339,k**7,食品口味: 【约20袋小包】奶油味250g*1袋（酥香脆）,好评,宝贝收到了日期挺新鲜的 新鲜度： 觉得挺不错的，已经开始吃了，没有那种放很长时间的味道，还是脆脆的味道 口感味道好山核桃很脆口，看起来非常有食欲。 口感味道：山核桃肉颗粒很大，吃起来味道很香希望一直可以保持好的品質。味道很香  ,家人都比较喜欢吃。很脆很香反正是比超市划算太多了,-,2021-05-28
340,z**6,食品口味: 【约40袋小包】原香味250g*2袋（酥脆醇香）,好评,此用户没有填写评价。,第一次购买的挺好的，这一次购买的两袋都是回生的，没法吃！,-,2021-06-06
341,白**1,食品口味: 【约20袋小包】椒盐味250g*1袋（好吃停不了）,好评,包装完好无损，快递迅捷，非常满意的一次购物。 ,-,-,2021-05-29
342,蓝**9,食品口味: 【约20袋小包】椒盐味250g*1袋（好吃停不了）,好评,此用户没有填写评价。,新鲜好吃，吃不停，会回购的,-,2021-05-24
343,g**9,食品口味: 【约40袋小包】原香味250g*2袋（酥脆醇香）,好评,包装品质：包装好￼高端大气上档次。￼ 商品分量：分量味口非常好。￼ 保质期：新鲜质量好。￼ 新鲜度：好已多次回购了。￼ 口感味道：好 ,-,-,2021-05-17
344,a**j,食品口味: 【约20袋小包】原香味250g*1袋（酥脆醇香）,好评,比较小袋，但是味道很好。,-,-,2021-06-17
345,h**3,食品口味: 【约20袋小包】椒盐味250g*1袋（好吃停不了）,好评,口感特别好，回购几次了,-,-,2021-05-14
346,w**7,食品口味: 【约20袋小包】奶油味250g*1袋（酥香脆）,好评,味道不错，基本满壳，较满意。,-,-,2021-05-30
347,糊**5,食品口味: 【约40袋小包】原香味250g*2袋（酥脆醇香）,好评,好吃，上瘾啊！！！钱包受不了，今天又补货了一斤半,-,-,2021-06-18
348,t**3,食品口味: 【约40袋小包】原香味250g+奶油味250g,好评,味道口感不错，好吃，赞一个 ,-,-,2021-06-04
349,凡**调,食品口味: 【约40袋小包】椒盐味250g*2袋（好吃齐分享）,好评,小核桃很不错吃完再买 ,-,-,2021-05-30
350,c**6,食品口味: 【约20袋小包】原香味250g*1袋（酥脆醇香）,好评,物流十分的快啊，收到后第一时间就打开了，两大包哦，鼓鼓的量好足，里面的颗粒都好大，味道十分不错，分给同事一包自己留一包，可以倒在盒子里用勺子挖着吃哈哈哈过瘾 ,-,-,2021-05-10
351,f**8,食品口味: 【约40袋小包】原香味250g+奶油味250g,好评,很香。味道跟好。价格也不贵。值得购买 ,-,-,2021-05-29
352,c**8,食品口味: 【约40袋小包】原香味250g+椒盐味250g,好评,独立包装，方便取食！,-,-,2021-05-28
353,淘**丁,食品口味: 【约40袋小包】原香味250g+奶油味250g,好评,可以的，又脆又香。,-,-,2021-06-01
354,绵**邈,食品口味: 【约20袋小包】椒盐味250g*1袋（好吃停不了）,好评,核桃肉很香很脆很新鲜，口感很好没有坏的，正好出去旅游带去给大家一起吃了，物流也很快，想吃还会光顾的。 ,-,-,2021-05-17
355,z**8,食品口味: 【约40袋小包】奶油味250g+椒盐味250g,好评,真的特别棒啊，老板特别好，零食很好吃，经常来买 ,-,-,2021-06-05
356,一**湖,食品口味: 【约40袋小包】原香味250g*2袋（酥脆醇香）,好评,山核桃很香很脆，越嚼越香，越吃越得劲，省去了剥壳的烦恼，东西也是满满的，还特别的香脆，家人都说好吃味道非常好，物超所值，话不多说，这四个字已经说明了一切，希望卖家可以一直保持这个品质,-,-,2021-05-14
357,师**你,食品口味: 【约20袋小包】原香味250g*1袋（酥脆醇香）,好评,此用户没有填写评价。,好吃。一次一袋就可以。吃多会腻,-,2021-04-27
358,x**3,食品口味: 【约20袋小包】原香味250g*1袋（酥脆醇香）,好评,很香很好吃美味,-,-,2021-06-07
359,t**3,食品口味: 【约40袋小包】原香味250g+椒盐味250g,好评,家里老人很喜欢吃,-,-,2021-05-30
360,t**7,食品口味: 【约40袋小包】原香味250g*2袋（酥脆醇香）,好评,好吃，已经不知道多少次回购了。,-,-,2021-06-01
361,玩**话,食品口味: 【约20袋小包】原香味250g*1袋（酥脆醇香）,好评,很好吃，新鲜,-,-,2021-06-05
362,子**伽,食品口味: 【约20袋小包】奶油味250g*1袋（酥香脆）,好评,又香又脆，好吃！,-,-,2021-06-04
363,b**o,食品口味: 【约40袋小包】奶油味250g+椒盐味250g,好评,很赞，新鲜的核桃仁，省了自己剥的功夫，口味调的也很不错，想要的可以冲！已经安利给了姐妹 ,-,-,2021-05-13
364,欣**9,食品口味: 【约40袋小包】奶油味250g*2袋（2份更划算）,好评,孩子说很好吃， ,-,-,2021-06-25
365,w**1,食品口味: 【约20袋小包】奶油味250g*1袋（酥香脆）,好评,奶香味很好吃哦 ,-,-,2021-06-06
366,食**鸟,食品口味: 【约40袋小包】原香味250g*2袋（酥脆醇香）,好评,东西不错，复购 ,-,-,2021-06-02
367,不**3,食品口味: 【约40袋小包】奶油味250g+椒盐味250g,好评,老顾客了，核桃一直很不错，没有杂七杂八的东西，小袋装也方便携带，孩子基本一天一包，家里老人也爱吃。 ,-,-,2021-05-12
368,只**3,食品口味: 【约20袋小包】奶油味250g*1袋（酥香脆）,好评,真的好喜欢，客服态度也挺好的，值！以后有需要还会来买,-,-,2021-06-03
369,无**奈,食品口味: 【约20袋小包】原香味250g*1袋（酥脆醇香）,好评,挺好的，要是再便宜一点就好了,-,-,2021-06-07
370,w**9,食品口味: 【约40袋小包】原香味250g*2袋（酥脆醇香）,好评,宝贝还好五分好评！,-,-,2021-05-29
371,本**基,食品口味: 【约40袋小包】原香味250g+椒盐味250g,好评,味道还不错,-,-,2021-06-02
372,朱**8,食品口味: 【约20袋小包】椒盐味250g*1袋（好吃停不了）,好评,口味非常好,-,-,2021-05-31
373,永**菜,食品口味: 【约40袋小包】原香味250g+椒盐味250g,好评,味道好极了，孩子也喜欢吃，小包装吃也方便,-,-,2021-05-09
374,t**9,食品口味: 【约40袋小包】原香味250g*2袋（酥脆醇香）,好评,悠趣熊临安山核桃仁21年新货味道香脆，价钱较便宜，小包装便于保存，不会受潮，挺好。,-,-,2021-06-20
375,吴**蕾,食品口味: 【约20袋小包】原香味250g*1袋（酥脆醇香）,好评,非常好吃！又脆又香！讚👍👍,-,-,2021-06-07
376,j**2,食品口味: 【约20袋小包】原香味250g*1袋（酥脆醇香）,好评,收到就立马拆了一包，特别新鲜，酥脆香，独立小包装，还不会浪费，吃完还会回购 ,-,-,2021-05-10
377,c**6,食品口味: 【约20袋小包】原香味250g*1袋（酥脆醇香）,好评,好吃，小包携带方便，赞 ,-,-,2021-05-28
378,姗**舞,食品口味: 【约20袋小包】椒盐味250g*1袋（好吃停不了）,好评,爸妈喜欢 ,-,-,2021-06-01
379,t**9,食品口味: 【约20袋小包】原香味250g*1袋（酥脆醇香）,好评,非常好吃，下次还会买,-,-,2021-06-20
380,z**h,食品口味: 【约40袋小包】原香味250g+椒盐味250g,好评,很好，很新鲜！,-,-,2021-05-29
381,月**f,食品口味: 【约40袋小包】原香味250g+奶油味250g,好评,非常满意的一次购物,最满意的一次购物♥👍👍👍,-,2021-06-03
382,糊**5,食品口味: 【约20袋小包】原香味250g*1袋（酥脆醇香）,好评,好吃上瘾第二次买了,-,-,2021-06-04
383,糊**5,食品口味: 【约20袋小包】原香味250g*1袋（酥脆醇香）,好评,好吃上瘾第三次买了,-,-,2021-06-04
384,1**h,食品口味: 【约40袋小包】奶油味250g+椒盐味250g,好评,没上次的好吃，壳多，碎,-,-,2021-06-16
385,善**合,食品口味: 【约20袋小包】奶油味250g*1袋（酥香脆）,好评,多次回购了，味道不错，大颗粒的，小包装给儿子带学校去吃的，补补脑！😊 ,-,-,2021-05-16
386,快**2,食品口味: 【约40袋小包】原香味250g*2袋（酥脆醇香）,好评,个人觉得非常好吃😊,-,-,2021-06-08
387,秋**l,食品口味: 【约20袋小包】原香味250g*1袋（酥脆醇香）,好评,山核桃原味很好吃哟，香脆美味，多吃坚果好，也适合孩子多吃，价格也很实惠，会回购啦 ,-,-,2021-05-21
388,b**r,食品口味: 【约20袋小包】原香味250g*1袋（酥脆醇香）,好评,很好吃，家里人很喜欢,-,-,2021-05-28
389,泉**子,食品口味: 【约40袋小包】原香味250g*2袋（酥脆醇香）,好评,好吃，新货。还会再买。,-,-,2021-05-28
390,t**3,食品口味: 【约20袋小包】奶油味250g*1袋（酥香脆）,好评,很棒哦，二次回购。,-,-,2021-06-08
391,s**9,食品口味: 【约40袋小包】原香味250g+椒盐味250g,好评,山核桃仁很新鲜，口感香脆非常好吃！ ,-,-,2021-05-17
392,小**狗,食品口味: 【约40袋小包】原香味250g+奶油味250g,好评,"个人感觉还是这种仁好吃  小小的一包非常方便，不担心会受潮。很好吃,很脆,包装精致  山核桃肉饱满有光泽而且都是整个的口感脆脆的也没有什么渣，味道也很棒甜甜咸咸是我喜欢的口味而且颗粒很饱满，也很均匀。",好吃的，很香，比店里便宜的。,-,2021-04-08
393,c**6,食品口味: 【约20袋小包】原香味250g*1袋（酥脆醇香）,好评,小小包装，吃一次正好，控制量，携带方便，家里人都喜欢吃，我这袋里二十五包呢，赞 ,-,-,2021-05-13
394,5**8,食品口味: 【约20袋小包】椒盐味250g*1袋（好吃停不了）,好评,好吃😋很快就吃没了 ,-,-,2021-06-04
395,方**荣,食品口味: 【约40袋小包】原香味250g+椒盐味250g,好评,包装品质：很好 商品分量：很足量 口感味道：很香 赞 ,-,-,2021-05-17
396,l**9,食品口味: 【约40袋小包】原香味250g*2袋（酥脆醇香）,好评,一如既往的好，5分！,-,-,2021-06-03
397,w**i,食品口味: 【约20袋小包】奶油味250g*1袋（酥香脆）,好评,不是很脆，有点潮。 ,-,-,2021-06-15
398,r**g,食品口味: 【约40袋小包】原香味250g+椒盐味250g,好评,好评，小包装便于携带 ,-,-,2021-06-05
399,t**2,食品口味: 【约40袋小包】原香味250g+奶油味250g,好评,好吃，买了两次了,-,-,2021-05-31
400,y**2,食品口味: 【约20袋小包】原香味250g*1袋（酥脆醇香）,好评,买了好几次，好吃,-,-,2021-06-07
401,j**2,食品口味: 【约40袋小包】原香味250g*2袋（酥脆醇香）,好评,包装品质：好 商品分量：还可以 保质期：新鲜 新鲜度：新鲜 口感味道：不错，很好吃，喜欢 ,-,-,2021-05-30
402,洁**0,食品口味: 【约20袋小包】奶油味250g*1袋（酥香脆）,好评,好吃好吃，强烈推荐哦,-,-,2021-06-04
403,1**娟,食品口味: 【约20袋小包】原香味250g*1袋（酥脆醇香）,好评,非常好吃，很棒 ,-,-,2021-05-30
404,y**0,食品口味: 【约20袋小包】原香味250g*1袋（酥脆醇香）,好评,挺好吃的，会回购 ,-,-,2021-06-03
405,小**的,食品口味: 【约20袋小包】原香味250g*1袋（酥脆醇香）,好评,挺好吃的，很香脆 ,-,-,2021-05-28
406,虞**4,食品口味: 【约20袋小包】奶油味250g*1袋（酥香脆）,好评,此用户没有填写评价。,好吃，准备再买,-,2021-05-26
407,t**7,食品口味: 【约40袋小包】原香味250g+椒盐味250g,好评,再次回购！ ,-,-,2021-06-08
408,广**s,食品口味: 【约20袋小包】原香味250g*1袋（酥脆醇香）,好评,挺好吃的，小朋友很喜欢吃，这样小包装真的很好，带出去也方便，一次正好吃一袋 ,-,-,2021-05-14
409,a**j,食品口味: 【约20袋小包】奶油味250g*1袋（酥香脆）,好评,颗粒特别大，日期也很新鲜，买的原味的，孩子喜欢吃核桃，，方便不用拨壳，吃了好吃再来。好吃，宝宝也喜欢吃，价位优惠，，关键懒人只能吃现成的，剥壳太硬了很好，小盒包装！ 口感味道：口感不错份量很足，大人孩子都喜欢吃，满意，有需要会再来味道不错，太爱吃了很满意的一次购物。非常满意， ,口感不错份量很足，大人孩子都喜欢吃，满意,-,2021-03-31
410,如**如,食品口味: 【约40袋小包】原香味250g+椒盐味250g,好评,搜了很多家，选了这家，独立包装，干净卫生，香脆好吃，也买了一些给老人吃！ ,-,-,2021-05-11
411,c**4,食品口味: 【约40袋小包】原香味250g+椒盐味250g,好评,很香很脆，好吃 ,-,-,2021-06-05
412,树**8,食品口味: 【约40袋小包】原香味250g*2袋（酥脆醇香）,好评,很好吃，非常好！,-,-,2021-06-04
413,s**a,食品口味: 【约20袋小包】原香味250g*1袋（酥脆醇香）,好评,挺好吃的，方便 ,-,-,2021-05-28
414,灿**0,食品口味: 【约40袋小包】原香味250g+椒盐味250g,好评,非常好。香！脆！,-,-,2021-06-08
415,张**5,食品口味: 【约20袋小包】原香味250g*1袋（酥脆醇香）,好评,味道很不错，满意 ,-,-,2021-05-31
416,t**1,食品口味: 【约20袋小包】奶油味250g*1袋（酥香脆）,好评,挺好的，没什么大问题，很喜欢，下次需要再购买  ,-,-,2021-06-23
417,x**w,食品口味: 【约40袋小包】原香味250g*2袋（酥脆醇香）,好评,挺好的，又香又脆,-,-,2021-06-05
418,l**t,食品口味: 【约20袋小包】原香味250g*1袋（酥脆醇香）,好评,有点小贵,-,-,2021-06-15
419,糊**5,食品口味: 【约20袋小包】椒盐味250g*1袋（好吃停不了）,好评,好吃上瘾,-,-,2021-06-04
420,s**q,食品口味: 【约20袋小包】奶油味250g*1袋（酥香脆）,好评,好吃，不贵！,-,-,2021-05-29
421,回**来,食品口味: 【约40袋小包】原香味250g+奶油味250g,好评,小核桃仁收到了，独立小包装方便干净，味道非常香脆好吃，物流也很给力，速度非常快，会继续回购。 ,-,-,2021-05-10
422,云**梦,食品口味: 【约40袋小包】原香味250g+椒盐味250g,好评,挺好的，有点碎，但香味还是挺香的 ,-,-,2021-06-17
423,金**腿,食品口味: 【约40袋小包】奶油味250g+椒盐味250g,好评,生产日期是近期的，分量也挺足，口感也可以，和以前吃的小核桃仁没有区别，不错。 ,-,-,2021-05-11
424,t**9,食品口味: 【约40袋小包】原香味250g+奶油味250g,好评,此用户没有填写评价。,真的很垃圾,-,2021-06-20
425,于**y,食品口味: 【约40袋小包】原香味250g*2袋（酥脆醇香）,好评,好吃多买 ,-,-,2021-05-29
426,清**奇,食品口味: 【约20袋小包】原香味250g*1袋（酥脆醇香）,好评,  独立小包装，味道不错，很香！这下不用愁着一袋吃不完怎么办了，继续回购 ,-,-,2021-05-10
427,方**荣,食品口味: 【约40袋小包】原香味250g+奶油味250g,好评,这个小核桃很好吃，所以买了好几份，给我妈妈吃，妈妈说味道不错👍 ,-,-,2021-05-17
428,1**苑,食品口味: 【约40袋小包】原香味250g+奶油味250g,好评,之前买过好几次小核桃了，第一次买到迷你版的，小包装里面装的核桃很少很少的量，没有之前那家的实惠，味道都差不多，不分好坏。,-,-,2021-06-09
429,f**9,食品口味: 【约40袋小包】原香味250g+椒盐味250g,好评,买了好几次了,-,-,2021-06-07
430,七**地,食品口味: 【约40袋小包】奶油味250g+椒盐味250g,好评,小小包挺好的，便于携带，味道不错。干饭人走起。,-,-,2021-05-17
431,如**如,食品口味: 【约20袋小包】原香味250g*1袋（酥脆醇香）,好评,看到评价很好才来的，独立包装卫生干净，果粒大而脆，停不下来 ,-,-,2021-05-11
432,不**8,食品口味: 【约20袋小包】原香味250g*1袋（酥脆醇香）,好评,太难吃了,什么鬼东西啊，想想就来气，里面都是柴的，害人的商家，卖出这东西，不怕吃**啊，要*也是你们这些商家先*吧,-,2021-06-15
433,战**姚,食品口味: 【约20袋小包】原香味250g*1袋（酥脆醇香）,好评,山核桃仁很好吃，小包装方便携带，以后有需要还会光顾。,-,-,2021-05-18
434,l**1,食品口味: 【约40袋小包】原香味250g+椒盐味250g,好评,"吃起来脆脆的很🌲好吃,份量很足,日期新🀄鲜。量的话,很新鲜,😆没有碎的。虽然很小一💏袋,山核桃肉饱满有光📀泽,保质期长,口感味👍道好。山核桃肉已经收❄到了,星好评。下次还📲会再来的,次买了,包🔶装精致 ",核桃没有很多碎的 味道很不错，里面的壳也弄的很干净,-,2021-06-23
435,丫**8,食品口味: 【约40袋小包】原香味250g*2袋（酥脆醇香）,好评,一如既往的好啊，孩子也很爱吃，很酥脆，口感略甜，爱吃 ,-,-,2021-06-13
436,t**3,食品口味: 【约40袋小包】原香味250g*2袋（酥脆醇香）,好评,收到非常满意，包装完好日期新鲜，脆脆香香的很好吃 ,-,-,2021-05-12
437,i**6,食品口味: 【约20袋小包】奶油味250g*1袋（酥香脆）,好评,包装品质：每个独立包装很好，封口完美 新鲜度：日期很新鲜 口感味道：很香脆，完全没有焦味，很健康的核桃味道，会回购 ,-,-,2021-05-14
438,嘉**花,食品口味: 【约40袋小包】奶油味250g+椒盐味250g,好评,很好吃  香酥脆   味道很好  日期新鲜赞👍 ,-,-,2021-05-25
439,c**0,食品口味: 【约40袋小包】奶油味250g*2袋（2份更划算）,好评,宝贝收到啦，奶油味的太好吃了根本停不下来，日期也是最新的5月5号的，赞👍 ,-,-,2021-05-14
440,春**6,食品口味: 【约20袋小包】原香味250g*1袋（酥脆醇香）,好评,发货速度快，服务态度好。暂时没尝过，晚点再评价。,-,-,2021-06-06
441,团**3,食品口味: 【约40袋小包】原香味250g+椒盐味250g,好评,好吃，孩子喜欢价位也能接受。下次还会回购。,-,-,2021-05-23
442,t**6,食品口味: 【约40袋小包】原香味250g*2袋（酥脆醇香）,好评,小核桃很好吃，酥脆香甜，推荐推荐推荐！,-,-,2021-05-11
443,t**6,食品口味: 【约40袋小包】奶油味250g+椒盐味250g,好评,核桃很新鲜，很脆，很香，是第二次买了,-,-,2021-05-14
444,卡**6,食品口味: 【2020年新货】原香味250g*1袋（酥脆醇香）,好评,封口做的真不错 商品分量：分量很足 保质期：很新 新鲜度：吃着很新鲜 口感味道：家人都说好吃包装很完好无损，很好吃的核桃仁，原味的很香，生产日期也新鲜，会回购哦 ,口感很好。我是第N回买了。家人都爱吃味道很好！没有坏果！不错,-,2021-04-01
445,鱼**瑚,食品口味: 【约20袋小包】奶油味250g*1袋（酥香脆）,好评,核桃仁收到，很好吃，松弛，小包装方便携带，值得购买,-,-,2021-05-20
446,j**4,食品口味: 【约40袋小包】原香味250g*2袋（酥脆醇香）,好评,核桃仁很好吃，很香，第二次购买了，妈妈说这个好吃,-,-,2021-05-17
447,鳕**m,食品口味: 【约40袋小包】原香味250g*2袋（酥脆醇香）,好评,挺好吃的 还会继续回购 品质还行 虽然不是很大 挺好吃的 品质过得去的 ,-,-,2021-05-25
448,吴**0,食品口味: 【约20袋小包】奶油味250g*1袋（酥香脆）,好评,挺好的，吃着还好,-,-,2021-06-06
449,黄**y,食品口味: 【约40袋小包】奶油味250g*2袋（2份更划算）,好评,哇塞，一到手立马拆快递吃上！！就是这个味道，很脆颗粒又饱满，奶油味超级好吃！,-,-,2021-05-15
450,名**7,食品口味: 【约40袋小包】椒盐味250g*2袋（好吃齐分享）,好评,宝贝到了日期挺新鲜的 新鲜度： 我觉得挺不错的，已经开始吃了，没有那种放很长时间的味道，还是脆脆的味道  果仁都是整颗的。颗粒特别大，日期也很新鲜，孩子喜欢吃核桃 ,收到货了，非常适合自己的口味，物美价廉,-,2021-04-07
451,z**6,食品口味: 【约40袋小包】原香味250g+奶油味250g,好评,此用户没有填写评价。,小核桃仁的味道香脆，颗粒很饱满，口感极佳，和浙江的同学带来的味道一样，家里老小都喜欢每天吃一小把，以前都是买的带壳的，每次剥的手都疼了，这次买的不带壳的，简直太方便了，吃的停不下真的挺好吃的太好吃了，还没两天，就吃了剩这么点了核桃肉颗粒很大吃起来很香，下次还要买,-,2021-04-01
452,回**沉,食品口味: 【约20袋小包】原香味250g*1袋（酥脆醇香）,好评,核桃包装nice，小袋便捷食用，大家多多购买,-,-,2021-05-16
453,l**8,食品口味: 【约40袋小包】奶油味250g*2袋（2份更划算）,好评,独立包装，很方便，味道新鲜，没有放久的怪味。 ,-,-,2021-05-12
454,t**7,食品口味: 【约20袋小包】奶油味250g*1袋（酥香脆）,好评,核桃仁收到了 香香脆脆的 一颗接着一颗的吃，哈哈，太好吃了。颗颗饱满也吃过了，跟以前买的味道一样，香脆的，吃着很新鲜 口感味道：家人都说好吃包装很完好无损，很好吃的核桃仁，原味的很香，生产日期也新鲜，会回购哦,吃着很新鲜 口感味道：家人都说好吃,-,2021-03-31
455,t**7,食品口味: 【约40袋小包】原香味250g*2袋（酥脆醇香）,好评,山核桃仁和碧根果仁都很香，挺新鲜 ,-,-,2021-05-18
456,蝉**雪,食品口味: 【约20袋小包】奶油味250g*1袋（酥香脆）,好评,山核桃肉超级好吃，盐淡适中，颗粒饱满，新货，己第二次购买，包装精美，份量足，吃了停不下来吃完还会回购，单独小包方携带.之前同学每次回来都会给一些，一起品尝！  ,宝贝到了日期挺新鲜的而且颗粒很饱满，也很均匀，很少碎的，很满意了,-,2021-04-06
457,t**3,食品口味: 【约20袋小包】原香味250g*1袋（酥脆醇香）,好评,物流十分的快啊，收到后第一时间就打开了，两大包哦，鼓鼓的量好足，里面的颗粒都好大，味道十分不错，可以倒在盒子里用勺子挖着吃哈哈哈过瘾.小核桃是今年的新货，味道超级赞，非常好吃，家人们都爱吃 ,我又回购了，真的太好吃了，价格也相对实惠。,-,2021-04-02
458,l**我,食品口味: 【约40袋小包】椒盐味250g*2袋（好吃齐分享）,好评,已是第三次回购了，办公室小伙伴个个抢着吃,-,-,2021-05-12
459,李**5,食品口味: 【约20袋小包】原香味250g*1袋（酥脆醇香）,好评,"个人感觉还是这种仁好吃 小小的一包非常方便，不担心会受潮。很好吃,很脆,包装精致 山核桃肉饱满有光泽而且都是整个的口感脆脆的也没有什么渣，味道也很棒甜甜咸咸是我喜欢的口味而且颗粒很饱满，也很均匀。",跟以前买的味道一样，香脆的，吃着很新鲜 ,-,2021-05-30
460,t**3,食品口味: 【约20袋小包】原香味250g*1袋（酥脆醇香）,好评,非常好吃，小包装方便小孩拆了吃哦。 ,-,-,2021-05-27
461,t**5,食品口味: 【约20袋小包】奶油味250g*1袋（酥香脆）,好评,回来到了一尝，太好吃啦，味道不错，量也够，物流很快，值得二次购买！ ,好吃，够量！,-,2021-06-22
462,看**8,食品口味: 【约20袋小包】原香味250g*1袋（酥脆醇香）,好评,核桃仁收到了挺好吃 每天早餐都吃几颗 给孩子补脑真心特别好是我一直喜欢的香脆 新鲜度：非常新鲜，满意的一次购物。还新鲜，非常好囤货就要新鲜好吃 放心购买吧 超好吃，停不下来，又脆又香，老少赞不绝口  ,给孩子补脑真心特别好是我一直喜欢的香脆,-,2021-03-31
463,大**女,食品口味: 【约40袋小包】原香味250g+奶油味250g,好评,此用户没有填写评价。,全家人都很爱吃 每次一吃四五袋 买了两次 打算再次回购！,-,2021-05-19
464,孙**s,食品口味: 【约40袋小包】原香味250g+椒盐味250g,好评,口感味道：个头大，很新鲜，独立小包装，方便又新鲜！吃上瘾了，回购好几次了！ ,-,-,2021-05-10
465,t**9,食品口味: 【约40袋小包】原香味250g*2袋（酥脆醇香）,好评,包装品质：很好吃，味道很棒 ,-,-,2021-06-20
466,t**3,食品口味: 【约40袋小包】奶油味250g*2袋（2份更划算）,好评,价格很优惠，服务也很好，东西不错，客服服务热情。 ,-,-,2021-05-13
