740,北**枝,口味: 格力高6口味7盒,好评,包装品质：差 暴力快递（？）碎了，三盒百醇棒 两盒奇蒂饼干，两袋饼干，也都碎了 ,-,-,2021-05-16
741,t**1,口味: 格力高6口味7盒,好评,两包15克小饼干吗也算两盒，真是搞笑*了。 说是赠品我倒是不嫌多。,-,-,2021-06-17
742,美**9,口味: 格力高5口味8盒,好评,没看清，原来有三个是小包装，算下来也没便宜多少。不实惠。,-,-,2021-05-18
743,t**4,口味: 格力高6口味7盒,好评,太坑了吧    所谓的7盒   居然还有两袋15克没有巴掌大的小饼干,-,-,2021-06-21
744,t**6,口味: 格力高5口味8盒,好评,6盒百奇中有三盒都是小盒，还都已经化掉了 ,-,-,2021-05-22
745,萌**雪,口味: 格力高6口味7盒,好评,保质期不好，百醇都断了，盒子也都破损了，两代海盐也是真的很mini了。还没巴掌大。不值当。等于三十块钱买了五盒临期破损产品。 ,-,-,2021-05-22
746,t**6,口味: 格力高6口味7盒,好评,真就格力高七包？？这俩小东西也算俩？真牛！！ ,-,-,2021-05-16
747,小**1,口味: 格力高咸甜5口味7盒,好评,保质期：发了全是临期产品，良心不会痛吗？这日期就是因为快过期了才做活动的吧。差评！完全差评！实在是你们自己吃吧！ ,-,-,2021-05-20
748,t**0,口味: 格力高6口味7盒,好评,商品分量：感觉店家可能觉得消费者有点傻？这分量简直太糊弄了吧，这也算一件吗？ 对格力高的好感全无了，不会再购买  ,-,-,2021-06-23
749,k**达,口味: 百力滋10口味10盒,好评,第一次看到，快递员看到收件人在门口了还直接问也没问有没有人来拿，一声不吭把快递一推 扔到门口地上的……表情冷静中带着份高傲，庆幸买的是零食而不是啥贵重物品 ,-,-,2021-05-18
750,岳**c,口味: 格力高5口味8盒,好评,保质期有点久，都粘到一起了,-,-,2021-05-23
751,神**手,口味: 格力高6口味7盒,好评,宝物は受け取って、スーパー好きで、品質はとても良くて、売り手の説明と完全に一致して、とても満足して、本当にとても好きで、完全に期待値を超えます。出荷速度はとても速くて、包装はとてもきめ細かくて、厳実で、物流会社のサービス態度はとても良くて、運送速度はとても速くて、満足できる一回の体験です。また来ます。 ,-,-,2021-05-19
752,t**4,口味: 格力高5口味8盒,好评,海苔很咸，不好吃，还有两盒，组合不划算，不建议购买 ,-,-,2021-06-21
753,南**5,口味: 百力滋10口味10盒,好评,就这样，拆开一袋，都碎掉了。。。。和预想的不太一样，就这样吧... ,-,-,2021-05-18
754,t**4,口味: 百力滋10口味10盒,好评,有些日期不新鮮有一盒也過期的！開了兩包來吃也是斷的那種.......不好的體現...,-,-,2021-06-21
755,t**3,口味: 百力滋10口味10盒,好评,没回来没一根是完整的，都碎成渣渣了，还有的口味特别难吃,-,-,2021-05-23
756,香**菲,口味: 格力高咸甜5口味7盒,好评,就一种是经常买的其余几盒线下超市都没有见过，应该是线上专供的吧！价格是很合适，味道也还好 ,-,-,2021-05-22
757,椒**此,口味: 格力高5口味8盒,好评,包装品质：挺好 商品分量：还可以 保质期：还有4个月过期，12个月保质期。 新鲜度：不太新鲜，口感还可以。 口感味道：一如既往的好吃 ,-,-,2021-05-19
758,马**8,口味: 格力高5口味8盒,好评,可以，就是量不多 ,-,-,2021-05-23
759,常**0,口味: 百力滋10口味10盒,好评,虽然活动买的比较便宜，但几乎全是碎的，断的很厉害，一根可能就断两三次，没有一根是全乎的整整的。 ,-,-,2021-05-23
760,阿**8,口味: 百力滋10口味10盒,好评,开了两盒，里面都断了， ,-,-,2021-05-20
761,陶**0,口味: 格力高5口味8盒,好评,没看清 都是小包装 超市也这个价 。。。。有种被欺骗的感觉。。。,-,-,2021-05-20
762,可**范,口味: 格力高人气6盒装,好评,虽然便宜日期是去年九月份的，而且都碎了，估计是清库存的吧。 ,-,-,2021-05-16
763,八**开,口味: 格力高咸甜5口味7盒,好评,新鲜度：日期不新鲜都快过期了 ,-,-,2021-05-17
764,t**9,口味: 格力高5口味8盒,好评,日期真不新鲜  还有3个多月过期,-,-,2021-06-23
765,s**r,口味: 格力高6口味7盒,好评,七个里面两个是这么小的😂 ,-,-,2021-05-17
766,l**7,口味: 格力高5口味8盒,好评,包装很差，全是破损的，日期也不新鲜，都是去年9月份的商品了,-,-,2021-05-16
767,t**2,口味: 格力高6口味7盒,好评,什么意思 收到货与买的东西不一样 点进页面看连图都换了 怪我买之前没截图喽😒 ,-,-,2021-06-21
768,起**4,口味: 百力滋10口味10盒,好评,这也太nice了 ,-,-,2021-05-21
769,咖**麻,口味: 格力高5口味8盒,好评,盒子有点压变形了，里面饼干还行 ,-,-,2021-05-19
770,w**b,口味: 百力滋10口味10盒,好评,打开三盒 里面全碎的，完整长的不到3根，可以当方便面吃！无语 ,-,-,2021-05-21
771,乖**6,口味: 百力滋10口味10盒,好评,保质期：日期不太好，是20年9月，10月的。所以才做活动吧。尽快吃完吧。 ,-,-,2021-05-18
772,t**6,口味: 格力高咸甜5口味7盒,好评,包装品质：包装有点变形了 口感味道：有点甜 ,-,-,2021-05-18
773,落**油,口味: 格力高5口味8盒,好评,韩式海苔味好难吃……居然还有两盒 ,-,-,2021-05-23
774,多**子,口味: 百力滋10口味10盒,好评,各种口味都有，就是断根比较多，买盒装的意义不就是为了吃整根的。看得出商家又做减震处理，但吃了3盒，每盒里整根的不超过5根... ,-,-,2021-05-21
775,t**8,口味: 百力滋10口味10盒,好评,除了碎的七七八八，以及有几个口味过于奇怪外其他都挺好的,-,-,2021-05-23
776,t**0,口味: 格力高5口味8盒,好评,怎么说呢，跟描述的不一样，8盒有些贵有些便宜的 ,-,-,2021-06-23
777,刘**9,口味: 格力高5口味8盒,好评,虽然很便宜，但是我还是想说那个海苔味的很难吃，又咸又苦... ,-,-,2021-05-17
778,t**7,口味: 格力高6口味7盒,好评,什么鬼东西，拍的是七盒，结果只有五盒，并且有两个还不是百醇,-,-,2021-06-20
779,乖**6,口味: 百力滋10口味10盒,好评,新鲜度：日期不太好，去年9，10月的，买了两份，尽快吃完吧。 ,-,-,2021-05-18
780,无**0,口味: 格力高6口味7盒,好评,就这些,-,-,2021-05-16
781,j**7,口味: 格力高5口味8盒,好评,发货挺快，吃了两包，有三分之一到二分之一折断了，饼干还没吃 ,-,-,2021-05-22
782,清**5,口味: 格力高5口味8盒,好评,很划算，就是盒子压瘪了,-,-,2021-05-21
783,小**1,口味: 百力滋10口味10盒,好评,日期都是临近的，最重要的是我以为我买的百醇，结果是百力滋，挺难吃的,-,-,2021-05-20
784,晨**晨,口味: 格力高元气少女年货礼盒（送红包）,好评,给女朋友买的，买了三个礼盒，挺不错 ,-,-,2021-03-17
785,紫**转,口味: 百力滋10口味10盒,好评,每个口味都没吃过，，就当试试吧 ,-,-,2021-05-18
786,t**3,口味: 格力高咸甜5口味7盒,好评,千万不要买奇奇怪怪的口味，难吃到怀疑人生。,-,-,2021-05-22
787,t**0,口味: 百力滋10口味10盒,好评,快过期才搞的活动，哎 ,-,-,2021-06-23
788,傲**猫,口味: 格力高5口味8盒,好评,我说怎么这么便宜呢，原来有一半只有三十五克的，没看仔细 ,打开一袋吃，稀碎的,-,2021-05-17
789,t**5,口味: 格力高6口味7盒,好评,包装有点简陋 一个包装盒都没有 而且每包好小,-,-,2021-05-21
790,太**晒,口味: 格力高6口味7盒,好评,饼干比较坑人 15g太小袋了 不太值  商品分量：少 ,-,-,2021-05-21
791,娜**3,口味: 格力高人气6盒装,好评,保质期：生产日期都是去年9月份的了 ,-,-,2021-05-18
792,萱**6,口味: 格力高5口味8盒,好评,有几盒特别小，不过这个价格也很便宜了 ,-,-,2021-05-17
793,心**1,口味: 百力滋10口味10盒,好评,嗯，可能不适合我的口感，就是用来解馋的 ,-,-,2021-05-20
794,r**h,口味: 格力高咸甜5口味7盒,好评,居然是去年8月和9月生产的，如果提前知道是这种临期食品是万万不会买的。,-,-,2021-05-16
795,爱**s,口味: 格力高5口味8盒,好评,好吃，不过海苔味的百力滋不好吃，别的都挺好吃的 ,-,-,2021-05-19
796,小**1,口味: 百力滋10口味10盒,好评,还可以，包装的很好，没有压扁之类的,-,-,2021-05-21
797,t**8,口味: 格力高人气6盒装,好评,还好，不过没发到我喜欢的口味 ,-,-,2021-05-23
798,t**7,口味: 格力高咸甜5口味7盒,好评,性价比一点都不高，不好吃👎,-,-,2021-06-20
799,l**7,口味: 格力高咸甜5口味7盒,好评,保质期一般,-,-,2021-05-19
800,t**2,口味: 格力高咸甜5口味7盒,好评,谨慎下单，沙拉味好难吃,-,-,2021-06-21
801,玖**上,口味: 格力高6口味7盒,好评,差评！文字恶意引导顾客！买六发七，其实格力的才就3盒，太过分了！ ,-,-,2021-05-16
802,t**7,口味: 格力高5口味8盒,好评,好吃的，分量不是很服哦 ,-,-,2021-06-20
803,t**0,口味: 格力高5口味8盒,好评,日期不太新鲜,-,-,2021-06-23
804,t**4,口味: 格力高6口味7盒,好评,日期不太新鲜 ,-,-,2021-06-21
805,哼**p,口味: 格力高6口味7盒,好评,我咋感觉～有两包好小啊，赠品的感觉 ,-,-,2021-05-22
806,灵**橙,口味: 格力高5口味8盒,好评,时间太久了，去年9月份的，也不说清楚 ,-,-,2021-05-20
807,小**0,口味: 格力高6口味7盒,好评,拍的百醇里面只有三盒是，其他的不是,-,-,2021-05-20
808,米**果,口味: 格力高6口味7盒,好评,海盐的真的好小一袋，其他的都蛮好吃的,-,-,2021-05-17
809,t**4,口味: 格力高5口味8盒,好评,客服不错，东西还行,-,-,2021-06-21
810,y**2,口味: 格力高咸甜5口味7盒,好评,没看到是临期的就买了 失策 ,-,-,2021-06-21
811,我**梦,口味: 格力高5口味8盒,好评,搞半天才一块红包，不要扫码加会员,-,-,2021-05-20
812,t**7,口味: 格力高5口味8盒,好评,去年6月份的，买的时候没有说明，有说明是不会买的 ,-,-,2021-06-20
813,孤**叹,口味: 百力滋10口味10盒,好评,饼干有点碎，其他还好,-,-,2021-05-20
814,t**8,口味: 格力高5口味8盒,好评,很好吃  就是日期不太好 ,-,-,2021-05-22
815,t**0,口味: 格力高6口味7盒,好评,真不错啊，味道好极了，爱了爱了。 ,-,-,2021-06-23
816,t**8,口味: 格力高5口味8盒,好评,送人的，里面好多盒 ,-,-,2021-05-19
817,t**z,口味: 格力高6口味7盒,好评,只有5盒，两包瓶干，拉圾，别买,-,-,2021-05-15
818,t**6,口味: 格力高5口味8盒,好评,就是临期清仓,-,-,2021-05-17
819,t**3,口味: 格力高5口味8盒,好评,巨好吃！！！强推！！！！ ,-,-,2021-05-18
820,c**r,口味: 格力高6口味7盒,好评,有两包小到无法形容,-,-,2021-05-22
821,f**8,口味: 格力高5口味8盒,好评,习惯性好评,-,-,2021-05-22
822,c**0,口味: 格力高6口味7盒,好评,不错，好吃，就是量少,-,-,2021-05-17
823,积**7,口味: 格力高元气少女年货礼盒（送红包）,好评,送给朋友的 ,-,-,2021-02-19
824,1**n,口味: 格力高元气少女年货礼盒（送御守）,好评,礼盒各种各样的 ,-,-,2021-02-16
825,天**4,口味: 格力高元气少女年货礼盒（送御守）,好评,口味很不错 ,-,-,2021-02-14
826,罗**4,口味: 格力高元气少女年货礼盒（送御守）,好评,去闺蜜家拜年必备!!包装真的太可了!!里面每一样小零食都非常可爱，格力高的味道不用怀疑。小御守加持今年一定会好运连连! ,-,-,2021-02-05
827,巫**i,口味: 格力高元气少女年货礼盒（送御守）,好评,非常棒的礼盒，种类有很多，而且小纸人的御守也太可爱了吧～ ,-,-,2021-01-18
828,m**落,口味: 格力高元气少女年货礼盒（送御守）,好评,买来送人的，看着还行 ,-,-,2021-02-06
829,m**落,口味: 格力高元气少女年货礼盒（送御守）,好评,买了送人的，看着还行 ,-,-,2021-02-06
830,o**1,口味: 格力高元气少女年货礼盒（送御守）,好评,包装很精美，东西很多很实惠，准备春节在家养肉了,-,-,2021-01-22
831,x**0,口味: 格力高元气少女年货礼盒（送红包）,好评,很可爱的礼盒 小饼干也很好吃,-,-,2021-02-05
832,迷**n,口味: 格力高元气少女年货礼盒（送御守）,好评,小礼盒包装不错，还送了红包，送人在合适不过了,-,-,2021-02-01
833,t**糖,口味: 格力高元气少女年货礼盒（送红包）,好评,囤货囤货，还送了加湿器，很可爱,-,-,2021-01-27
834,t**5,口味: 格力高元气少女年货礼盒（送御守）,好评,量大 就是不知道为啥中间有一个被抠了洞... ,-,-,2021-02-01
835,鼠**岸,口味: 格力高9口味12件,好评,包装旧旧的，收到货的时候有的压的扁扁的，包装不好东西好吃还能原谅，可是味道太难吃了，就是一根光光的饼干棒子，没一种味道好吃，多大一股味精味道，总之千万不要买，真的很难吃 ,-,-,2021-07-01
836,我**7,口味: 格力高9口味12件,好评,大家慎重够买，已经变质有异味了，让提供评证，味道这东西怎么提供，便宜没好货，还说是临期商品，保质期内正常食用，都变质了怎么吃，维权难 ,-,-,2021-07-01
837,幽**影,口味: 格力高7口味9件,好评,好评！物流很快，宝贝很满意，质量很好，下次再来一波 ,-,-,2021-07-01
838,弥**流,口味: 格力高9口味12件,好评,很合算～东西也不错，没有断,-,-,2021-07-01
839,t**1,口味: 格力高9口味12件,好评,好吃，便宜,-,-,2021-06-17
840,t**1,口味: 格力高9口味12件,好评,好吃，便宜,-,-,2021-06-17
841,王**5,口味: 格力高7口味9件,好评,买了几次了 ,-,-,2021-07-01
842,d**7,口味: 格力高9口味12件,好评,包装品质：包装的很好，里面还有冰袋。 商品分量：挺好的 保质期：生产日期是2020年10月，保质期12月，临近日期了，还有四个月过期，那肯定是能吃完的。毕竟价格优惠。 ,-,-,2021-06-20
843,嘎**鞋,口味: 格力高9口味12件,好评,挺好的，活动价格实惠，部分商品还用了冰袋，饼干都没有压碎。日期在2020年下半年的，还是满意的。 ,-,-,2021-06-20
844,奈**柳,口味: 格力高7口味12件,好评,一开始感觉很划算，然后到手一大箱，一看日期离保质期还剩两三个月，也就是靠近保质期那种，要是介意的姐妹们不要拍，我也不大吃，给家里小孩吃不知道咋样，一共有12盒，有一说一真的是划算，盒子有一点点瘪了，但是没破损啥的也是还行（没打开里面来看看） ,-,-,2021-06-10
845,苏**玲,口味: 格力高7口味9件,好评,写的是近期货，拿到手生产时间也的确是2020年9月的，不过吃着和店里的没啥区别，关键是价格便宜阿，哈哈哈哈哈哈，自己吃吃挺好的 ,-,-,2021-06-22
846,c**0,口味: 格力高9口味12件,好评,和超市买的一样，用了优惠券，又赶上双十一，最后到手12件18块,-,-,2021-06-22
847,t**3,口味: 格力高9口味12件,好评,够便宜，12盒只要20块 ,-,-,2021-06-22
848,c**i,口味: 格力高9口味12件,好评,新鲜度：生产日期分别是2020年9月23日、25日，10日2-5号的货，这都是些临近过期食品 ,-,-,2021-06-20
849,小**o,口味: 格力高9口味12件,好评,2020年10月份的，除了日期不太好之外，其他都还行,-,-,2021-06-24
850,t**0,口味: 格力高9口味12件,好评,保质期：今年都1202六月了给我发一去年9月的，10月的东西？你促销发这些？学学达利，我买个豆奶促销人家发今年5月的，实在是想给你差评，快算求了，二三十要什么自行车 ,-,-,2021-06-23
851,零**n,口味: 格力高9口味12件,好评,618活动买的，16块钱12盒，相当不错！嘿嘿 ,-,-,2021-06-20
852,芳**2,口味: 格力高7口味12件,好评,6月4号买的，现在又玩套路，换个9口味12件，降价10块，不会再来了 ,-,-,2021-06-17
853,y**i,口味: 格力高9口味12件,好评,保质期：2020年12月的 买的时候都没有告诉我的！！ 包装品质：有一盒还被压扁了 ！ ,-,-,2021-06-19
854,s**7,口味: 格力高9口味12件,好评,生产日期是2020年九月到10月间的，不适合囤货 ,-,-,2021-06-19
855,l**唐,口味: 格力高咸甜5口味7盒,好评,产品都是临期的哦 2020年8月的 一年保质期 买之前也没说 也没提醒  然后我看了下 他们店大部分都是202008的 买的时候多多注意哈 我也没办法退了  一直说临期是45天  ,-,-,2021-06-05
856,l**唐,口味: 格力高6口味7盒,好评,产品都是临期的哦 2020年8月的 一年保质期 买之前也没说 也没提醒  然后我看了下 他们店大部分都是202008的 买的时候多多注意哈 我也没办法退了  一直说临期是45天   ,-,-,2021-06-05
857,l**i,口味: 格力高9口味12件,好评,不错，好吃，就是日期2020的,-,-,2021-06-19
858,t**2,口味: 格力高5口味8盒,好评,韩式海苔味是我吃过最难吃的，还给了四包，室友都不吃，好吃的百醇只有2包，日期主要是2020年9月到十月的，希望能给你们帮助,-,-,2021-06-21
859,t**2,口味: 格力高5口味8盒,好评,6盒就一盒百醇，还有两袋5毛的来凑数，剩下的几盒都是很便宜的也不是很好吃。就不值13块！,-,-,2021-06-21
860,小**澜,口味: 格力高人气6盒装,好评,2020年10月生产，口感还好 ,-,-,2021-05-18
861,小**m,口味: 百力滋10口味10盒,好评,一盒百醇都没有，都只有超市最便宜的味道，永旺10块钱4包的那种！那我还不如去永旺买反而更便宜 ,-,-,2021-05-29
862,露**m,口味: 百力滋10口味10盒,好评,甜的闻到还行，就是咸的不好吃，日期有2020年的也有21年的，保质期是12个月，味道说实话有点失望可能期待值太高了，基本都是那这种竖条饼干，里面没夹心，不好吃，下次我不会再买了，还是注心的好吃，平常想吃还是去超市买点比较好 ,-,-,2021-05-22
863,h**蛋,口味: 格力高5口味8盒,好评,还行不错，就是日期有点久了，2020年七月的，但不影响食用！ ,-,-,2021-05-17
864,p**y,口味: 格力高5口味8盒,好评,日期比较一般，2020年9月的，去年的时间了,-,-,2021-05-16
865,又**9,口味: 格力高5口味8盒,好评,很一般，都是一些不贵的东西，百醇就一盒 ,-,-,2021-05-27
866,你**了,口味: 格力高5口味8盒,好评,觉得不值 ,-,-,2021-06-19
867,1**5,口味: 格力高7口味9件,好评,大部分是2020年9月的，挺好吃。 ,-,-,2021-06-24
868,y**3,口味: 格力高5口味8盒,好评,就挺无语，有一盒吃了之后拉肚子，有两盒巧克力棒全黏在一起了...,-,-,2021-06-21
869,宝**逃,口味: 格力高9口味12件,好评,很满意的一次购物 ,-,-,2021-06-21
870,z**n,口味: 格力高咸甜5口味7盒,好评,味道很不错,-,-,2021-05-25
871,回**首,口味: 百力滋10口味10盒,好评,味道还不错，一大堆，都吃不完😂😂,-,-,2021-06-05
872,l**2,口味: 格力高9口味12件,好评,😃超级好用！还很美观！墙裂推荐！有需要再回购！ ,-,-,2021-06-21
873,钱**3,口味: 格力高5口味8盒,好评,商品分量：一般 ,-,-,2021-05-26
874,小**，,口味: 格力高7口味12件,好评,还可以吧,-,-,2021-06-14
875,一**z,口味: 格力高6口味7盒,好评,吃挺好吃，物流再完美一点就好了 ,-,-,2021-05-23
876,l**2,口味: 格力高9口味12件,好评,以前一直都是在实体店买，这次选择了网上买，不光是正品，价格还实惠！ ,-,-,2021-06-21
877,7**晗,口味: 格力高9口味12件,好评,好吃 而且日期也不算太近 包装很好还加了冰袋 ,-,-,2021-06-24
878,都**0,口味: 格力高7口味12件,好评,包装品质：非常不错 保质期：临期 新鲜度：有几个不咋好吃 口感味道：好吃 非常不错 ,-,-,2021-06-16
879,高**淼,口味: 格力高9口味12件,好评,保质期：2020年10月份的 ,-,-,2021-06-22
880,s**0,口味: 格力高9口味12件,好评,发的都是快过期的东西了，如下图 ,-,-,2021-06-19
881,诗**米,口味: 格力高9口味12件,好评,活动买的，很划算，只是不能挑口味,-,-,2021-06-20
882,相**阳,口味: 格力高5口味8盒,好评,海苔味好难吃 是因为难吃不好卖所以便宜么 而且日期是去年的  ,-,-,2021-06-09
883,陌**4,口味: 格力高6口味7盒,好评,商品分量：不多 新鲜度：挺好 ,-,-,2021-05-18
884,酷**k,口味: 格力高9口味12件,好评,真难吃，都不知道是啥东西，口感也不好，味道一点都不好。 ,-,-,2021-06-24
885,马**0,口味: 格力高5口味8盒,好评,实用性和颜值都非常的赞，我很喜欢，还会再来买的 ,-,-,2021-06-15
886,9**6,口味: 百力滋10口味10盒,好评,很划算，东西很好，很喜欢。 ,-,-,2021-05-18
887,黎**照,口味: 格力高5口味8盒,好评,可以。孩子爱吃。 ,-,-,2021-06-02
888,8**子,口味: 格力高6口味7盒,好评,商品分量：分量少 卖家太坑了，都是临期商品，价钱也不便宜，就收到五盒，六元一盒也不便宜 保质期：马上就要过期了  ,-,-,2021-05-21
889,寻**兔,口味: 格力高9口味12件,好评,比平时要便宜，囤了不少，特别特别满意👍，包装也很用心  口感味道：还不错，满意 ,-,-,2021-06-20
890,z**衿,口味: 格力高7口味9件,好评,里面的那个奇地饼干，真的是味道绝绝子。第一次尝试那个饼干就种**。 ,-,-,2021-06-26
891,初**j,口味: 格力高9口味12件,好评,搞活动买的，还挺划算的。 ,-,-,2021-06-22
892,格**t,口味: 格力高6口味7盒,好评,小规格饼干 ,-,-,2021-06-06
893,海**光,口味: 格力高7口味12件,好评,好评好评好评，好吃 ,-,-,2021-06-16
894,丶**格,口味: 格力高9口味12件,好评,20多块还要啥自行车啊啊啊啊啊啊啊啊啊啊啊啊啊啊啊啊啊啊啊啊啊啊啊啊 ,-,-,2021-06-23
895,b**n,口味: 格力高9口味12件,好评,非常好。非常好。非常好。非常好。,-,-,2021-06-21
896,t**2,口味: 格力高6口味7盒,好评,不错不错不错不错不错不错不错不错不错不错 ,-,-,2021-06-21
897,花**天,口味: 格力高9口味12件,好评,好吃好吃好吃好吃好吃好吃好吃好吃好吃,-,-,2021-06-23
898,有**牧,口味: 格力高9口味12件,好评,挺划算的，希望小朋友喜欢！挺划算的，希望小朋友喜欢！挺划算的，希望小朋友喜欢！挺划算的，希望小朋友喜欢！挺划算的，希望小朋友喜欢！挺划算的，希望小朋友喜欢！挺划算的，希望小朋友喜欢！挺划算的，希望小朋友喜欢！,-,-,2021-06-22
899,蕾**u,口味: 格力高5口味8盒,好评,还不错！！！！！！！！！！！！！！！！！！！！！！！！！,-,-,2021-05-18
900,t**6,口味: 格力高9口味12件,好评,好好好好好好好好好好好好好好好好好好好好好好好好好好好好好好好好好好好好好好好好好好好好好好好好好好好好好好好好好好好好好好好好好好好好好好好好好好好好好好好好好好好好好好好好好好好好好好好好好好好好好好好好好好好好好好好好好好好好好好好好好好好好好好好好好好好好好好好好好好好好好好好好好好好好好好好好好好好好好好好好好好好好好好好好好好好好好好好好好像,-,-,2021-06-23
901,t**2,口味: 格力高人气6盒装,好评,不错不错不错不错不错不错不错不错不错 ,-,-,2021-06-21
902,s**n,口味: 格力高9口味12件,好评,保质期基本到9月底10月初，不过这个价格是真划算，寄过来还放了冰袋，诚意满满。。保质期基本到9月底10月初，不过这个价格是真划算，寄过来还放了冰袋，诚意满满。。 ,-,-,2021-06-21
903,唯**饭,口味: 格力高9口味12件,好评,就那样,-,-,2021-06-21
904,花**殇,口味: 格力高5口味8盒,好评,2020年9月份的,-,-,2021-05-19
905,h**x,口味: 格力高7口味9件,好评,很划算！,-,-,2021-06-23
906,邵**雨,口味: 百力滋10口味10盒,好评,蛮好吃的。,-,-,2021-05-20
907,t**2,口味: 格力高人气6盒装,好评,好吃噢 ,-,-,2021-06-21
908,小**哼,口味: 格力高6口味7盒,好评,一般,-,-,2021-05-21
909,当**1,口味: 格力高9口味12件,好评,收到货 ,-,-,2021-06-20
910,j**c,口味: 格力高9口味12件,好评,👍,-,-,2021-06-25
911,s**3,口味: 格力高9口味12件,好评,很满意,-,-,2021-06-19
912,我**寐,口味: 格力高6口味7盒,好评,蛮可爱,-,-,2021-05-20
913,冷**龙,口味: 格力高7口味9件,好评,挺实惠的,-,-,2021-06-23
914,c**8,口味: 格力高人气6盒装,好评,不错！,-,-,2021-06-06
915,城**天,口味: 格力高9口味12件,好评,宝宝爱吃 ,-,-,2021-06-23
916,大**9,口味: 格力高5口味8盒,好评,小龙人 ,-,-,2021-06-17
917,婷**7,口味: 格力高9口味12件,好评,🉑 ,-,-,2021-06-23
918,s**暖,口味: 格力高9口味12件,好评,不错。 ,-,-,2021-06-26
919,t**1,口味: 格力高6口味7盒,好评,神价 ,-,-,2021-06-17
920,挂**z,口味: 格力高6口味7盒,好评,不划算,-,-,2021-05-18
921,橘**7,口味: 格力高9口味12件,好评,回购了,-,-,2021-06-20
922,轮**喃,口味: 格力高人气6盒装,好评,最爱,-,-,2021-05-18
923,笨**行,口味: 格力高9口味12件,好评,好吃耶,-,-,2021-06-23
924,闫**焦,口味: 格力高9口味12件,好评,不错不错,-,-,2021-06-21
