354,狮**士,口味: 格力高9口味12件,好评,包装倒蛮严实的，就是最便宜的百力滋最多，不太喜欢百力滋，齁咸。整体算不上多实惠。 保质期：极差，居然今年12月就过期，太不新鲜了，吃起来都膈应。堂堂旗舰店卖清仓的货，这不合适吧…… 新鲜度：差 ,-,-,2021-06-19
355,寒**0,口味: 格力高9口味12件,好评,保质期：全是去年生产的  8月  9月就到期  格力高这么**不怕生孩子没Py吗？ ,-,-,2021-06-20
356,t**5,口味: 格力高9口味12件,好评,很好！正品！,-,-,2021-06-20
357,h**1,口味: 格力高9口味12件,好评,便宜有便宜的道理，还剩2个月过期 ,-,-,2021-06-21
358,t**6,口味: 格力高9口味12件,好评,除了日期不是很新鲜，其他都很好，价格很棒,-,-,2021-06-21
359,r**0,口味: 格力高5口味8盒,好评,挺多个的，活动买两块钱一盒还算性价比高，整体满意 ,-,-,2021-06-09
360,连**乙,口味: 格力高9口味12件,好评,怪不得那么便宜，日期还三个月就过期了。。。。。。。 ,-,-,2021-06-20
361,梦**6,口味: 格力高9口味12件,好评,里面的味道奇奇怪怪的，只有四盒百醇，还有两盒味道一样，打开几包里面都碎掉了 ,-,-,2021-06-20
362,t**1,口味: 格力高5口味8盒,好评,终于收到我需要的宝贝了，东西很好，价美物廉，谢谢掌柜的！说实在，这是我淘宝购物来让我最满意的一次购物。无论是掌柜的态度还是对物品，我都非常满意的。掌柜态度很专业热情，有问必答，回复也很快，我问了不少问题，他都不觉得烦，都会认真回答我，这点我向掌柜表示由衷的敬意，这样的好掌柜可不多。再说宝贝，正是我需要的，收到的时候包装完整，打开后让我惊喜的是，宝贝比我想象中的还要好！不得不得竖起大拇指。下次需要的时候我还会再来的，到时候麻烦掌柜给个优惠哦！  ,-,-,2021-06-17
363,t**8,口味: 格力高人气6盒装,好评,买给女朋友吃的，比超市买划算多啦。 ,-,-,2021-06-10
364,t**6,口味: 格力高7口味9件,好评,可以，保质期还剩三个月，这个价钱买实在是太便宜了,-,-,2021-06-21
365,z**p,口味: 格力高9口味12件,好评,到手的是个很大很重的箱子，然后发现里面最重的是3个冰袋，可能是怕饼干融化了,-,-,2021-06-21
366,d**r,口味: 格力高9口味12件,好评,咸的都太咸了,-,-,2021-06-24
367,r**沫,口味: 格力高9口味12件,好评,不错😊就能看到的切勿忘我买了一箱威化饼饼饼子卖了吧大娘水饺子皮肤病医院长撤了没法接受不了解我买了一箱紫米蛋糕都可以啊兄弟姐妹姐妹姐妹俩小时候的工资结清楚吗你哪里的？,-,-,2021-06-19
368,慧**1,口味: 格力高9口味12件,好评,儿子说只有几盒百醇！也没有他喜欢的口味！其他的不好吃！,-,-,2021-06-20
369,f**8,口味: 格力高9口味12件,好评,亲们千万别购买太难吃了，搭配的里面没几个好吃的，都是一个味道，简直是坑人的商家，联系商家就说口味不同，都是扔的货,-,-,2021-06-22
370,我**留,口味: 格力高5口味8盒,好评,东西收到了呦  口感不错  是我喜欢的味道 ,-,-,2021-06-11
371,高**5,口味: 格力高9口味12件,好评,日期不新鲜，快递挺快，还有冰袋不过都化了，不是很满意,非常不好吃，同事也是吃几口就扔了,-,2021-06-20
372,v**卜,口味: 格力高5口味8盒,好评,我发现竟然有4盒海苔味的，这个最难吃，大人小孩都不愿意吃……虽然活动入的不贵，但是有这几盒就亏了…反正不划算 ,-,-,2021-06-18
373,t**5,口味: 格力高9口味12件,好评,是正品，但快递没什么防护，我56包都撞凹进去了,-,-,2021-06-22
374,耐**n,口味: 格力高9口味12件,好评,保质期：去年的货，快过期了！快过期了！快过期了！ ,-,-,2021-06-21
375,邓**茜,口味: 格力高9口味12件,好评,果然发的是临期产品，保质期一年的还有三个月就到期了！介意的慎拍,-,-,2021-06-20
376,p**a,口味: 格力高5口味8盒,好评,好吃。买的几个都挺好吃的。虽然我不太喜欢咸的。但是口感确实不错,-,-,2021-06-12
377,g**5,口味: 格力高9口味12件,好评,口味有的接受不了，但是量多，合适 ,-,-,2021-06-20
378,凉**贝,口味: 格力高9口味12件,好评,蔬菜色拉味不好吃，太咸了，其他味道还可以吧 ,-,-,2021-06-21
379,我**8,口味: 格力高9口味12件,好评,还可以，虽然便宜了，可是百力滋太多了，百醇太少,-,-,2021-06-22
380,e**糖,口味: 格力高9口味12件,好评,买了十二盒只收到十盒，客服说有两盒在冰袋里也没有过提示，冰袋早就被默认为包装扔了。不会再来光顾了,-,-,2021-06-22
381,透**2,口味: 格力高9口味12件,好评,不错，很满意！ ,-,-,2021-06-20
382,杨**仑,口味: 格力高9口味12件,好评,挺满意的，喜欢。,-,-,2021-06-20
383,t**3,口味: 格力高9口味12件,好评,商品好，快递服务差，两天未送货也没有打电话通知，导致冰袋都化了！！！ 不建议走中通！！！,-,-,2021-06-22
384,h**2,口味: 格力高9口味12件,好评,日期不好，而且到了之后都巧克力都化了，快递箱子还很暴力，烂了 ,-,-,2021-06-20
385,t**4,口味: 格力高9口味12件,好评,挺好的，就是那个绿色盒子的不好吃，别的都不错， ,-,-,2021-06-21
386,卢**1,口味: 格力高5口味8盒,好评,还不错吧，里面还有小饼干，不同的包装 ,-,-,2021-06-09
387,t**9,口味: 格力高9口味12件,好评,绿盒的最难吃，有三盒，好像是冰袋都化了,-,-,2021-06-23
388,v**静,口味: 格力高9口味12件,好评,临期的，还有2个月过期,-,-,2021-06-21
389,z**仙,口味: 格力高9口味12件,好评,宝贝很好,-,-,2021-06-20
390,只**4,口味: 格力高9口味12件,好评,除了沙拉味的个人不喜欢以外，其他的都很不错！,-,-,2021-06-22
391,c**b,口味: 格力高9口味12件,好评,还有两个月过期,-,-,2021-06-20
392,林**l,口味: 格力高7口味12件,好评,我看了一下评价 说什么临期 其实一星期就吃光了… (º﹃º ) ,-,-,2021-06-10
393,糖**i,口味: 格力高9口味12件,好评,店家给了冰袋，奶思。但是凯瑟沙拉那个味的真心不爱😭 ,-,-,2021-06-21
394,当**5,口味: 格力高9口味12件,好评,不是注心的，买错了,-,-,2021-06-22
395,d**7,口味: 格力高9口味12件,好评,临期的还行，只有3个月，可以吃的完,-,-,2021-06-21
396,失**0,口味: 格力高9口味12件,好评,日期超级不新鲜，请大家慎买,-,-,2021-06-21
397,s**4,口味: 百力滋10口味10盒,好评,一共10盒挺好吃的，抹茶口味比较好吃😋，买了10盒不知道能吃到啥时候。 ,-,-,2021-05-18
398,t**3,口味: 格力高9口味12件,好评,感觉一般 不知道划不划算,-,-,2021-06-21
399,t**6,口味: 格力高5口味8盒,好评,很便宜 但日期不是很新鲜 还有几个月过期了 ,-,-,2021-06-17
400,a**文,口味: 格力高9口味12件,好评,还不错，虽然外包装成这样了，但是里面都没有碎，收到很大一包，里面百奇和星奇是装在隔热袋里面的，旁边还放了一堆不保温的冰袋，不知道为什么是这样包装的 ,-,-,2021-06-19
401,独**年,口味: 格力高7口味12件,好评,以为是夹心的，结果买回来只是饼干，没有夹心！！没有想象中那么好！ ,-,-,2021-06-21
402,聆**恋,口味: 格力高6口味7盒,好评,包装非常好，很严实，值这个价格,-,-,2021-06-11
403,w**8,口味: 格力高9口味12件,好评,口感味道：不好吃！不好吃！不好吃！ ,-,-,2021-06-22
404,柒**e,口味: 格力高7口味12件,好评,四盒百醇，五盒百力滋，两盒百奇小饼干,-,-,2021-06-12
405,蓦**友,口味: 格力高9口味12件,好评,非常满意,-,-,2021-06-20
406,三**树,口味: 格力高9口味12件,好评,发货速度很快，物流也很快。包装完整数量足够。好吃。 ,-,-,2021-06-20
407,t**9,口味: 格力高7口味9件,好评,发的货和照片对不上，只发了四个百醇五个百力滋，真服了。,-,-,2021-06-23
408,借**g,口味: 格力高9口味12件,好评,还行吧 一般般吧 感觉拍的不一样,-,-,2021-06-20
409,w**9,口味: 格力高9口味12件,好评,海苔味吃出了酱油和香油的味道 ，色拉味更难吃 ，然后番茄味儿能吃进去 ，其他的还行。 ,-,-,2021-06-19
410,焰**舞,口味: 格力高7口味12件,好评,好吃，实惠,-,-,2021-06-09
411,w**4,口味: 格力高9口味12件,好评,都是一些奇奇怪怪的口味😷,-,-,2021-06-21
412,阿**黛,口味: 格力高9口味12件,好评,快递太暴力了。全碎了。客服给补偿我就当吃饼干碎了 ,-,-,2021-06-21
413,肖**0,口味: 格力高9口味12件,好评,吃了一种口味，还能接受吧。,-,-,2021-06-21
414,小**1,口味: 格力高9口味12件,好评,买之前也没看下面简介，不知道是临期的，收到货里面东西有几盒都被压坏了，反正注重日期的就不要买了 ,-,-,2021-06-19
415,麻**客,口味: 格力高9口味12件,好评,还行，就是全是临保的,-,-,2021-06-20
416,小**p,口味: 格力高7口味9件,好评,还不错，东西挺实惠！,-,-,2021-06-21
417,暧**留,口味: 格力高5口味8盒,好评,我感觉星星的那个太甜了 ,-,-,2021-06-09
418,z**r,口味: 格力高9口味12件,好评,好多口味都好难吃啊 ,-,-,2021-06-21
419,妖**果,口味: 格力高9口味12件,好评,很不满意  临期产品  没有提前说明 ,-,-,2021-06-20
420,骞**爱,口味: 格力高7口味12件,好评,最喜欢红酒味,-,-,2021-06-10
421,蓝**葵,口味: 格力高7口味12件,好评,买给弟弟的他喜欢,-,-,2021-06-12
422,t**9,口味: 格力高9口味12件,好评,发的货和照片对不上，真服了。再也不信什么旗舰店了,-,-,2021-06-23
423,喝**y,口味: 格力高9口味12件,好评,保质期：临期了 ,-,-,2021-06-20
424,l**5,口味: 格力高9口味12件,好评,保质期：临期的 ,-,-,2021-06-21
425,t**2,口味: 格力高5口味8盒,好评,很划算，饼干都非常好吃，每次必屯的零食 ,-,-,2021-06-21
426,t**4,口味: 格力高5口味8盒,好评,我买了两份，但是，种类不太行 ,-,-,2021-06-21
427,董**神,口味: 格力高9口味12件,好评,送过来全压碎了，乱七八糟的 ,-,-,2021-06-20
428,t**0,口味: 格力高5口味8盒,好评,那个百力滋海苔味的最难吃，其他都还不错，活动买的，近效期了，要赶紧吃 ,-,-,2021-06-23
429,t**9,口味: 格力高9口味12件,好评,很多都被压扁了，碎的没法吃,-,-,2021-06-23
430,p**1,口味: 格力高9口味12件,好评,货物很好，快递太垃圾了,-,-,2021-06-20
431,沉**6,口味: 格力高7口味12件,好评,是真不好吃，谁买谁后悔 ,-,-,2021-06-20
432,l**n,口味: 格力高9口味12件,好评,差评！说了不要把快递送到校外还是送到校外了！,-,-,2021-06-22
433,顺**会,口味: 格力高9口味12件,好评,包装品质：好几袋都挤变型了 保质期：都临期了，差评！ ,-,-,2021-06-19
434,t**5,口味: 格力高9口味12件,好评,都是临期产品，生产八个多月了 ,-,-,2021-06-20
435,兔**啊,口味: 格力高6口味7盒,好评,很喜欢吃，每一个口味都好吃的，不敢买太多，怕吃腻哈哈哈哈哈哈 ,-,-,2021-06-07
436,王**天,口味: 格力高9口味12件,好评,日期都是去年九月份的,-,-,2021-06-20
437,鹤**茉,口味: 格力高9口味12件,好评,物流快，就是食品挺失望的，口感不好,-,-,2021-06-22
438,f**3,口味: 格力高6口味7盒,好评,发货快 好,-,-,2021-06-10
439,像**张,口味: 格力高5口味8盒,好评,很划算啊，味道不错，买买买 ,-,-,2021-05-28
440,我**2,口味: 格力高7口味12件,好评,嗯，还行吧，就是口味不是我喜欢的，然后日期也不新鲜，还有三四个月就过期了，介意的慎买，买之前我都不知道是临期产品 ,-,-,2021-06-16
441,元**5,口味: 格力高9口味12件,好评,日期是去年九月十月的…,-,-,2021-06-20
442,l**9,口味: 格力高7口味9件,好评,断的太多了！ ,-,-,2021-06-22
443,小**黄,口味: 格力高9口味12件,好评,三盒那个味太咸了,-,-,2021-06-22
444,正**5,口味: 格力高9口味12件,好评,娃娃的最爱，超市好贵的 ,-,-,2021-06-19
445,1**a,口味: 格力高5口味8盒,好评,我曾经以为太阳永远不会和月亮相爱 直到后来我才知道 太阳在白天替月亮剥开黑暗 月亮在晚上为太阳包裹温柔 而星星则是他们的浪漫故事 🌞🌙✨,-,-,2021-05-31
446,j**1,口味: 格力高5口味8盒,好评,有8盒，孩子很爱吃，又怕她长胖  ,-,-,2021-06-05
447,a**阳,口味: 百力滋10口味10盒,好评,十盒，不同味道，这个套餐很棒 ,-,-,2021-05-28
448,我**爱,口味: 格力高7口味12件,好评,保质期：只有三个月，虽然是便宜，但是没办法自己选口味12盒里面只有3盒百醇，别的都不好吃 ,-,-,2021-06-16
449,悦**呦,口味: 格力高9口味12件,好评,来的时候还有冰袋，完美 ,-,-,2021-06-19
450,m**2,口味: 格力高5口味8盒,好评,口感味道：甜。 ,-,-,2021-05-31
451,z**8,口味: 格力高5口味8盒,好评,新鲜度：好 好吃好吃，夹心的好好吃 ,-,-,2021-05-28
452,t**0,口味: 格力高9口味12件,好评,还有2个多月就到期了 这是给孩子吃的 商家这么做 太不地道,-,-,2021-06-23
453,t**8,口味: 格力高9口味12件,好评,delicious  ,-,-,2021-06-21
454,心**5,口味: 百力滋10口味10盒,好评,有10种口味最好吃的还是那个巧克力跟香草的，其他的吃的也还可以，买的来蛮划算的。 包装品质：可以 保质期：新鲜 新鲜度：好 口感味道：好 商品分量：好 ,-,-,2021-06-08
455,t**9,口味: 百力滋10口味10盒,好评,太好了 价格优惠 口味很多 大力推荐喔,很好很好,-,2021-06-23
456,m**g,口味: 格力高6口味7盒,好评,虽然价格比超市便宜，不过这几个组合味道都一般,-,-,2021-05-31
457,邱**钰,口味: 格力高9口味12件,好评,10月初左右到期，都是12个月保质期。但是价格不到外面购买的一半。实惠。 ,-,-,2021-06-19
458,迪**迪,口味: 格力高5口味8盒,好评,价格很优惠，比超市便宜很多，就是韩式海苔味的不太好吃… ,-,-,2021-05-31
459,我**谁,口味: 格力高9口味12件,好评,看了下，脂肪含量高的吓人，就是看便宜买的，失策了，拿去给同事分了 ,-,-,2021-06-19
460,夏**然,口味: 格力高7口味12件,好评,保质期没多久了，味道不错，和市面上的一样，送的毯子掉毛严重 ,-,-,2021-06-17
461,t**7,口味: 格力高6口味7盒,好评,可以，推荐你们购买。,-,-,2021-06-20
462,h**2,口味: 格力高9口味12件,好评,包装各方便都挺好的。就是日期有点临期了。都是九月十月过期的 ,-,-,2021-06-19
463,t**6,口味: 百力滋10口味10盒,好评,从小就巨爱吃百醇，这次出了新品，就尝试着买了一些尝尝，一共十盒，份量还蛮大的，基本上所有味道都没有重复，每盒打开都有新鲜感。但是相比于百醇来说，这个味道的体现在饼干外面，不是夹心的，还吃不太习惯，准备多尝尝其他口味 ,-,-,2021-05-29
464,与**7,口味: 百力滋10口味10盒,好评,真的好好好吃，特别喜欢 ,-,-,2021-05-29
465,温**柔,口味: 格力高6口味7盒,好评,在一段稳定且长久的关系里， 感情绝不是仅仅只靠‘开心’， 就可以一直持续下去的。  所以，相比那些低成 本的表达， 我们更应该看重高成 本的付出。  因为最佳的伴侣， 应该是你人生战场的盟友， 你需要他一起来打怪兽， 一起来对抗生活的酸甜苦辣。 #爱的方程式# ,-,-,2021-05-19
466,t**6,口味: 格力高5口味8盒,好评,挺好吃的 ， 三天吃光🤤🤤🤤🤤,-,-,2021-05-29
467,t**7,口味: 格力高5口味8盒,好评,可以，很好，推荐你们购买。,-,-,2021-06-20
468,故**河,口味: 格力高5口味8盒,好评,收到货，第一时间拆包装，感觉质量还是比较好的，与卖家描述的还是一致的，非常满意，发货速度比较快，物流公司服务态度很好，运送速度很快，总的来说这次是很满意的一次购物，感谢卖家。 ,-,-,2021-06-02
469,t**6,口味: 格力高9口味12件,好评,随机的口味真的很奇怪，而且居然是去年九月份的，买的时候应该是没有说明的，真的是踩雷好几种口味 ,-,-,2021-06-19
470,冯**y,口味: 格力高9口味12件,好评,保质期：这……………都是去年九月份的，快过期了  ,-,-,2021-06-18
471,g**7,口味: 格力高7口味12件,好评,这几个口味一般，不好吃，不是记忆中的味道 ,-,-,2021-06-14
472,赤**屿,口味: 百力滋10口味10盒,好评,包装品质：包装完好 口感味道：是甜甜夏天 ,-,-,2021-06-04
473,t**7,口味: 格力高咸甜5口味7盒,好评,活动装里的奇蒂还有星奇更好吃😭，凯撒色拉味的百力滋有点“五味杂陈”,-,-,2021-06-20
474,友**9,口味: 格力高5口味8盒,好评,格力高精致好吃😋  天猫超市好价钱 ,-,-,2021-06-04
475,墨**利,口味: 格力高9口味12件,好评,都挺好，就是快递不好，都压扁了碎了,-,-,2021-06-19
476,p**7,口味: 格力高5口味8盒,好评,还行吧适合小孩吃，我更喜欢百醇的礼盒。 ,-,-,2021-05-31
477,l**3,口味: 格力高9口味12件,好评,最喜欢吃格力高，无论什么口味。商家客服态度也是非常好，有问题给积极的解决了，所以好评给商家！但是我要吐槽一下中通，我的包裹都挤坏了，里面东西碎掉两盒，人家快递驿站的人都看不过去了，结果中通公司居然让我拒收，我说我活动买的，现在没活动了，我凭什么拒收，结果他居然让我签字说包裹没坏，还不让我对商家说东西坏了这个事，我真是气*！物流给一颗星和商家没有关系，就是看不惯中通这种欺客行为！ ,-,-,2021-06-19
478,沁**谧,口味: 格力高5口味8盒,好评,下单前要看清楚，这个现象不全是百醇的饼干 ,-,-,2021-06-07
479,森**人,口味: 格力高9口味12件,好评,爱了爱了 ,-,-,2021-06-19
480,t**7,口味: 格力高5口味8盒,好评,觉得有点少，还没吃完，海苔味的是咸的，巧克力的很好吃,-,-,2021-06-20
481,a**8,口味: 百力滋10口味10盒,好评,真的办公室零食，分了好多给同事吃。好吃,-,-,2021-06-03
482,花**h,口味: 格力高5口味8盒,好评,质量没得说，跟专卖店一样，特别特别喜欢，而且价格优惠 ,-,-,2021-06-01
483,s**6,口味: 格力高6口味7盒,好评,跟我在实体店买的一模一样！还是一样的好用，开心,-,-,2021-06-08
484,t**1,口味: 格力高5口味8盒,好评,比超市划算，还可以,-,-,2021-06-17
485,j**7,口味: 格力高9口味12件,好评,保质期：日期都快过期了 ,-,-,2021-06-19
486,浪**提,口味: 格力高9口味12件,好评,就有两包融了，冰袋都捂热了，我直接好家伙 ,-,-,2021-06-19
487,黄**8,口味: 格力高5口味8盒,好评,很好吃，也很划算，已经多次购买了,-,-,2021-05-30
488,h**3,口味: 格力高5口味8盒,好评,很划算，味道都不错,-,-,2021-06-03
489,天**使,口味: 格力高6口味7盒,好评,跟上面一样的，很好吃，以后会继续购买的,-,-,2021-06-08
490,别**鑫,口味: 格力高5口味8盒,好评,特别特别特别好，没有任何破损的地方，外观也好看，好评！ ,-,-,2021-06-08
491,忧**5,口味: 格力高6口味7盒,好评,价格很实惠，性价比很高，算是平价好物，会回购的 ,-,-,2021-05-29
492,t**1,口味: 格力高9口味12件,好评,不好，没有超市的好，都是便宜的,-,-,2021-06-17
493,t**2,口味: 格力高7口味12件,好评,日期临近，这个为什么不提前说明，很不喜欢这样的！,-,-,2021-06-21
494,天**使,口味: 格力高5口味8盒,好评,还是一如既往地好吃，跟店里面买的一样的，很不错哎,-,-,2021-06-08
495,薄**使,口味: 格力高9口味12件,好评,此用户没有填写评价。,日期很久了，怪不得便宜😷,-,2021-06-18
496,听**n,口味: 格力高7口味12件,好评,收到货，打开没有一包是不断的！！！！,-,-,2021-06-19
497,t**7,口味: 格力高9口味12件,好评,快递箱子📦破了 都扁了 里面的东西压碎了 但是这是运输问题 东西不错的👌,-,-,2021-06-20
498,小**m,口味: 格力高5口味8盒,好评,保质期：新鲜 ,-,-,2021-05-29
499,麟**儿,口味: 格力高6口味7盒,好评,可可爱爱格力高，两包饼干好小,-,-,2021-06-05
500,w**y,口味: 格力高9口味12件,好评,日期不新鲜去年9月10月的,-,-,2021-06-19
501,黄**8,口味: 格力高6口味7盒,好评,领券购买的，很划算,-,-,2021-05-30
502,a**2,口味: 格力高7口味12件,好评,买的时候页面没有显示是临期食品，收到货一看是临期的，进去页面也显示是临期的，醉了 ,-,-,2021-06-19
503,l**9,口味: 格力高5口味8盒,好评,实惠，好吃 ,-,-,2021-06-02
504,l**a,口味: 格力高7口味12件,好评,挺失望的，官方旗舰店卖的是去年9、10月份的货，我在淘宝买了这么多次零食，每次都是近2个月内生产的，第一次遇到这种情况，估计官旗在清库存吧。算了下日期，今年9月到期，还有2个多月，虽然没过期，但是心里有点隔应。小伙伴们自己注意生产日期。 ,-,-,2021-06-07
505,水**成,口味: 百力滋10口味10盒,好评,搞活动时买的，性价比很高，一共十包都是不同口味，一次能吃到这么多口味也是很爽了，放在办公室里了，下午饿的时候当小点心吃，配点咖啡奶茶的很不错。 ,-,-,2021-05-24
506,t**8,口味: 格力高9口味12件,好评,日期不太好，其他还行,-,-,2021-06-19
507,t**5,口味: 格力高5口味8盒,好评,都是喜欢的味道，还行吧,-,-,2021-05-29
508,陆**i,口味: 格力高6口味7盒,好评,好吃便宜耶耶耶,-,-,2021-06-08
509,t**9,口味: 百力滋10口味10盒,好评,味道还可以 挺好吃的,-,-,2021-06-23
510,晏**莉,口味: 格力高5口味8盒,好评,那个番茄味的不好吃,-,-,2021-06-19
511,与**7,口味: 百力滋10口味10盒,好评,第二次购买了，我的天啦，不要太好吃了！！！ ,-,-,2021-05-29
512,j**9,口味: 格力高5口味8盒,好评,很好吃，女儿喜欢吃 ,-,-,2021-06-04
513,院**甜,口味: 格力高5口味8盒,好评,都是临期的（微笑） 想好了再买。还不如8块买一盒百醇,-,-,2021-05-26
514,千**座,口味: 百力滋10口味10盒,好评,保质期：保质期新鲜 口感味道：很好 商品分量：足量 百力滋强烈爱好者，定期囤货 ,-,-,2021-05-27
515,陇**红,口味: 格力高6口味7盒,好评,给孩子买的，孩子说好吃,-,-,2021-06-06
516,t**4,口味: 格力高9口味12件,好评,以为是百奇呢，感觉没有百奇好吃,-,-,2021-06-21
517,t**5,口味: 格力高7口味12件,好评,都好好吃，但是不能吃太多，会腻,-,-,2021-06-16
518,耍**庙,口味: 格力高5口味8盒,好评,挺好吃的 一共有好几种 多种选择 ,-,-,2021-06-08
519,十**步,口味: 格力高5口味8盒,好评,非常好吃，会再次购买的,-,-,2021-05-30
520,a**i,口味: 格力高5口味8盒,好评,还蛮好吃的，也很实惠 ,-,-,2021-05-28
521,四**黎,口味: 格力高5口味8盒,好评,性价比还可以，但是这种搭配着卖产品线不一样，价格高低不同，有的好吃，有的不好吃，要买这种组合装，就有这种风险 ,-,-,2021-06-10
522,小**1,口味: 格力高7口味12件,好评,也就是星奇最好吃！！！ ,-,-,2021-06-17
523,舞**瞳,口味: 格力高5口味8盒,好评,给小朋友买的，喜欢！,-,-,2021-05-31
524,i**陵,口味: 格力高5口味8盒,好评,吃着可以，偏甜 ,-,-,2021-05-31
525,s**高,口味: 格力高5口味8盒,好评,五星好评，会回购！,-,-,2021-05-29
526,可**云,口味: 格力高5口味8盒,好评,好吃，很快就吃完了,-,-,2021-06-05
527,c**5,口味: 格力高9口味12件,好评,压坏了好几盒哦。。。,-,-,2021-06-19
528,钢**b,口味: 格力高5口味8盒,好评,质量非常好，客服态度非常非常赞，有问题及时给解决了 ,-,-,2021-05-28
529,t**5,口味: 格力高7口味12件,好评,便宜事很便宜 但是都快过期了 介意的人慎买！ ,-,-,2021-06-11
530,y**9,口味: 格力高7口味12件,好评,好吃的没几个 ,-,-,2021-06-19
531,x**4,口味: 格力高5口味8盒,好评,大朋友的六一儿童节提前收到货品啦，划算种类多 ,-,-,2021-05-27
532,i**l,口味: 百力滋10口味10盒,好评,还可以，买来嘴馋吃吃，甜味的比较好吃，一口气吃完一盒，咸味的吃多了真的咸 ,-,-,2021-05-22
533,t**2,口味: 格力高9口味12件,好评,**超级扁！ ,-,-,2021-06-21
534,z**h,口味: 格力高6口味7盒,好评,还不错😊,-,-,2021-06-05
535,h**6,口味: 格力高5口味8盒,好评,口味不错，好评,-,-,2021-06-03
536,l**3,口味: 格力高9口味12件,好评,太难吃了,-,-,2021-06-19
537,夕**天,口味: 格力高人气6盒装,好评,饼干收到，很不错，比超市便宜，孩子很喜欢吃。 ,-,-,2021-05-16
538,慧**鱼,口味: 格力高9口味12件,好评,囤货，还没吃 ,-,-,2021-06-18
539,t**8,口味: 格力高9口味12件,好评,临期产品。,-,-,2021-06-19
540,t**7,口味: 格力高5口味8盒,好评,呜呜呜很好次！就是巧克力能不能给多点，那个海苔味实在不喜欢，太焦了,-,-,2021-06-20
