1119,可**水,口味: 酸奶果粒400g+芝士树莓400g,好评,在猫猫直播间买的 用了红包之后三袋58块多 真的超值了 之前一直没吃过芝士树莓的 正好也可以尝尝 ,-,-,2021-06-19
1120,莺**e,口味: 酸奶果粒400g+小仙桃麦片400g赠烘焙水果400g,好评,放在酸奶里特别好吃，干吃也不错，爱肖战 ,-,-,2021-06-03
1121,t**7,口味: 酸奶果粒400g+小仙桃麦片400g赠烘焙水果400g,好评,肖战粉丝小飞侠支持肖战代言！ 欧扎克真的是我吃过最好吃的麦片了，烘焙技术高级！酸奶块也很多很大，这次想尝一下小仙桃口味的😁 ,-,-,2021-06-22
1122,q**5,口味: 酸奶果粒400g+芝士树莓400g,好评,最好吃的燕麦 没有之一 就是涨价了。 回购的 ,-,-,2021-06-17
1123,石**1,口味: 酸奶果粒400g+芝士树莓400g,好评,吃着还不错，味道也不错，就是吃着吃着有点腻歪了,-,-,2021-06-18
1124,寒**f,口味: 酸奶果粒400g+芝士树莓400g,好评,这次买的要给差评哦。一点也不脆，像受潮了一样。只有我收到的不脆吗？,-,-,2021-06-18
1125,小**卉,口味: 酸奶果粒400g+小仙桃麦片400g赠烘焙水果400g,好评,很不错，好吃,-,-,2021-06-12
1126,r**守,口味: 酸奶果粒400g+芝士树莓400g,好评,这包装也没谁了 ,-,-,2021-06-17
1127,锦**8,口味: 酸奶果粒400g+小仙桃麦片400g赠烘焙水果400g,好评,直播间买的，比较划算。开了一袋来吃，水果多，干吃泡牛奶都不错，大人小孩都爱吃。支持代言人战战！,-,-,2021-06-05
1128,幸**9,口味: 酸奶果粒400g*2赠50%水果坚果400g,好评,很好吃 酥脆 可干吃也可以和牛奶一起泡着吃 儿子说怎么吃都好吃 已经快吃完了才想来评价来 里面的酸奶块 果干都很好吃,-,-,2021-04-20
1129,烟**澄,口味: 酸奶果粒400g+小仙桃麦片400g赠烘焙水果400g,好评,味道不错。麦片吃起来挺脆的。很喜欢，属于那种越吃越想吃的。里面水果干也很好吃。价格实惠，比在超市买的便宜多了。,-,-,2021-06-01
1130,a**a,口味: 酸奶果粒400g+小仙桃麦片400g赠50%水果坚果400g,好评,溶解难易：容易 包装品质：精美 外观品相：好看 口感味道：nice ,-,-,2021-06-08
1131,g**c,口味: 酸奶果粒400g+芝士树莓400g,好评,箱子压瘪了，里面的碎渣特别多，有一部分成粉了 ,-,-,2021-06-19
1132,t**0,口味: 酸奶果粒400g+小仙桃麦片400g赠50%水果坚果400g,好评,肖战粉丝小飞侠支持肖战代言！ ,-,-,2021-06-18
1133,哈**伤,口味: 酸奶果粒400g+小仙桃麦片400g赠烘焙水果400g,好评,很喜欢拌酸奶，加点水果 ,-,-,2021-06-05
1134,派**5,口味: 酸奶果粒400g+小仙桃麦片400g赠烘焙水果400g,好评,百香果支持肖战代言,-,-,2021-06-08
1135,y**6,口味: 酸奶果粒400g+芝士树莓400g,好评,东西可以。但是我真的得说说这个快递了。备注了放丰巢快递柜。都不看的吗？似乎有了代收点之后所有的快递都是扔到代收点，让自己去拿。让一个刚做了手术的人跑那么远去拿个快递，真真笑* ,-,-,2021-06-19
1136,珠**h,口味: 酸奶果粒400g+小仙桃麦片400g赠烘焙水果400g,好评,只要战战代言的东西都无条件支持，麦片果然很好吃！ ,-,-,2021-06-01
1137,y**悦,口味: 酸奶果粒400g+小仙桃麦片400g赠烘焙水果400g,好评,支持一下肖战的代言！ ,-,-,2021-06-04
1138,p**g,口味: 酸奶果粒400g+小仙桃麦片400g赠烘焙水果400g,好评,不错不错 给了战战小卡 耶耶耶 ,-,-,2021-06-04
1139,小**诚,口味: 酸奶果粒400g+芝士树莓400g,好评,差评，差评，差评，在猫猫直播间说各一包，发来的时候，发了两包芝士树莓的，一包水果的！一点都不责任，找客服，半天不回一句，下次还是不能在猫猫直播间买东西！说的跟发的都不一样,-,-,2021-06-18
1140,梅**芽,口味: 酸奶果粒400g+小仙桃麦片400g赠烘焙水果400g,好评,非常好吃，已经吃了两个口味的了，与牛奶酸奶椰汁都完美搭配，单独吃也非常好吃！,-,-,2021-05-29
1141,小**斯,口味: 酸奶果粒400g+小仙桃麦片400g赠烘焙水果400g,好评,小飞侠支持肖战代言！很好吃，早上泡牛奶当早餐，偶尔晚上饿了当夜宵，也不怕胖~~最近用酸奶尝试泡了下，发现更好吃耶！！😄️😄️ ,-,-,2021-06-05
1142,痴**肉,口味: 酸奶果粒400g+小仙桃麦片400g赠烘焙水果400g,好评,太划算了，买的价格很合适，收到孩子很爱吃，三五天就给吃了一多半 ,-,-,2021-06-03
1143,w**柔,口味: 酸奶果粒400g+芝士树莓400g,好评,非常的甜，脂肪含量也挺高的，真正减肥的人不建议，真的不太合适 ,不敢恭维真的是太甜太甜了，减肥的姐妹慎重，我是吃不了，送给我老公姐姐的孩子当零食吃吧,-,2021-06-19
1144,小**屋,口味: 酸奶果粒400g+芝士树莓400g,好评,生气日期很久了，在直播间大促销，请问猫猫为什么不说日期，光说补贴粉丝了，是厂家给你比平时优惠吧，骗子猫猫！,-,-,2021-06-18
1145,z**5,口味: 酸奶果粒400g+芝士树莓400g,好评,溶解难易：不太容易溶 配件问题：没 包装品质：好 外观品相：好 口感味道：好吃😋 ,-,-,2021-06-18
1146,t**9,口味: 酸奶果粒400g+芝士树莓400g,好评,说发三个就发了俩，没有树莓的,-,-,2021-06-19
1147,小**山,口味: 酸奶果粒400g+小仙桃麦片400g赠烘焙水果400g,好评,这个太好吃了，直播间买的还便宜，每次看到必买，酸奶，坚果，果干特别多！,-,-,2021-06-08
1148,w**6,口味: 酸奶果粒400g+芝士树莓400g,好评,活动的时候比较合适，就是这个包装，唉，幸亏里面没破，拿到快递时，一面是破了个大洞，路上也是坎坷,-,-,2021-06-18
1149,5**0,口味: 酸奶果粒400g+芝士树莓400g,好评,应该是挺便宜的了，毕竟单独包装在外边要二三十,-,-,2021-06-17
1150,y**悦,口味: 酸奶果粒400g+小仙桃麦片400g赠烘焙水果400g,好评,支持肖战！ ,-,-,2021-06-04
1151,郑**4,口味: 酸奶果粒400g+小仙桃麦片400g赠烘焙水果400g,好评,东西比我想象中的还要完美，十分给力，值得入手🎈商品收到了，包装得很好，物流非常快，客服态度很积极，有问题及时解答！总体来说非常满意！,-,-,2021-06-01
1152,筱**c,口味: 酸奶果粒400g+芝士树莓400g,好评,硝烟四起，为战而来！,-,-,2021-06-18
1153,茶**密,口味: 酸奶果粒400g+小仙桃麦片400g赠烘焙水果400g,好评,一定要买紫色包装那个，太好吃了！黄色那个果干太多太甜了,-,-,2021-06-07
1154,卡**0,口味: 酸奶果粒400g+芝士树莓400g,好评,不怎么理想，真正的麦片少的可怜，就像膨化食品一样，反正我是不会回购 ,-,-,2021-06-18
1155,k**9,口味: 酸奶果粒400g+小仙桃麦片400g赠烘焙水果400g,好评,喜欢干吃,-,-,2021-06-12
1156,t**3,口味: 酸奶果粒400g+芝士树莓400g,好评,明显没有以前东西多了，现在这个麦片香蕉片寥寥无几，咋的抽条成这样了,-,-,2021-06-22
1157,常**佳,口味: 酸奶果粒400g+小仙桃麦片400g赠烘焙水果400g,好评,溶解难易：我们最喜欢配热牛奶一起，很快就溶解了，还没有溶解透的时候是最好吃的！ 包装品质：包装不错，没有破损 外观品相：颜值高，味道赞 口感味道：很好吃！干吃，配酸奶牛奶都很绝 物流快，三天就到了，雪梨直播间买的，真的很划算，味道也好！ ,-,-,2021-05-22
1158,我**1,口味: 酸奶果粒400g+芝士树莓400g,好评,猫妹妹直播间买的，第一次吃欧扎克的麦片，发货快，非常好，已成为这个牌子的粉丝👍👍👍,🤟🏻,-,2021-06-18
1159,相**爱,口味: 酸奶果粒400g+芝士树莓400g,好评,里面的水果  坚果没有以前多，全部是麦片，里面一种小正方形的还不脆咬不动,-,-,2021-06-17
1160,璐**y,口味: 酸奶果粒400g+小仙桃麦片400g赠烘焙水果400g,好评,非常好吃非常好吃！！最爱酸奶口味的！！支持肖战代言！！♡. ,-,-,2021-06-05
1161,m**u,口味: 酸奶果粒400g+小仙桃麦片400g赠烘焙水果400g,好评,还挺好吃的，虽然不爱吃麦片这样的东西，但是这个可以接受 ,-,-,2021-06-01
1162,y**2,口味: 酸奶果粒400g+小仙桃麦片400g赠烘焙水果400g,好评,我和孩子都很喜欢吃，干吃比泡牛奶好吃。 支持代言人肖战！ ,-,-,2021-05-31
1163,t**5,口味: 酸奶果粒400g+小仙桃麦片400g赠烘焙水果400g,好评,买好几次了，不错～ ,-,-,2021-06-19
1164,李**6,口味: 酸奶果粒400g+芝士树莓400g,好评,非常好吃，打开就生吃了，我老公不爱吃零食的一个人，都说好吃👍🏻👍🏻,-,-,2021-06-18
1165,t**l,口味: 酸奶果粒400g+芝士树莓400g,好评,和其他燕麦不一样，像膨化食品一样，吃的还是很香的，还可以,-,-,2021-06-18
1166,季**滢,口味: 酸奶果粒400g+芝士树莓400g,好评,里面的草莓全部都反潮了，很难吃，燕麦片全部膨胀的很厉害和我第一次的完全不一样 ,-,-,2021-06-19
1167,蓝**6,口味: 酸奶果粒400g+小仙桃麦片400g赠烘焙水果400g,好评,之前在超市买了一包小的吃，大家都很喜欢吃，都在雪梨的直播间购买了，希望一如既往的好。 ,-,-,2021-06-03
1168,t**5,口味: 酸奶果粒400g+芝士树莓400g,好评,感觉猫猫卖贵了一点点，，其他主播那里才19.9一袋，38.6两袋,-,-,2021-06-19
1169,p**g,口味: 酸奶果粒400g+小仙桃麦片400g赠烘焙水果400g,好评,还不错，挺好吃的，搭配纯牛奶做早餐好吃，又方便 ,-,-,2021-06-04
1170,y**3,口味: 酸奶果粒400g+芝士树莓400g,好评,非常好吃，里面坚果也很多，一分钱一分货没毛病,-,-,2021-06-19
1171,陈**c,口味: 酸奶果粒400g+芝士树莓400g,好评,其实也没有很好吃 感觉一般 反正我吃不惯,-,-,2021-06-18
1172,t**3,口味: 酸奶果粒400g+小仙桃麦片400g赠烘焙水果400g,好评,这是第二次购买了，和上次买的口味不一样，争取早日集齐所有口味😃 ,-,-,2021-06-22
1173,微**5,口味: 酸奶果粒400g+芝士树莓400g,好评,这次的草莓都碎了,-,-,2021-06-18
1174,翁**东,口味: 酸奶果粒400g+小仙桃麦片400g赠50%水果坚果400g,好评,欧扎克确实味道不错，小朋友也很喜欢吃,-,-,2021-06-05
1175,我**2,口味: 酸奶果粒400g+小仙桃麦片400g赠烘焙水果400g,好评,博君一肖，百香果为肖战而来。 麦片很好吃，已经回购了好几次了,-,-,2021-06-02
1176,风**7,口味: 酸奶果粒400g+小仙桃麦片400g赠烘焙水果400g,好评,和描述的一样，非常好吃，孩子超喜欢！,-,-,2021-05-29
1177,青**美,口味: 酸奶果粒400g+小仙桃麦片400g赠烘焙水果400g,好评,脆脆的挺好吃的 包装也很少女 ,-,-,2021-06-01
1178,独**孩,口味: 酸奶果粒400g+小仙桃麦片400g赠烘焙水果400g,好评,吃过才知道，多种口味都不错，早餐最好的选择，又好吃，又方便快捷,-,-,2021-06-04
1179,雪**飞,口味: 酸奶果粒400g+小仙桃麦片400g赠烘焙水果400g,好评,没有好麦多用料好，下次不会回购,-,-,2021-06-04
1180,l**一,口味: 酸奶果粒400g+芝士树莓400g,好评,不如线下优惠的多 ,-,-,2021-06-19
1181,琴**3,口味: 酸奶果粒400g+小仙桃麦片400g赠烘焙水果400g,好评,很好吃，我家孩子也很爱吃，泡牛奶、酸奶都好吃😊 ,-,-,2021-06-03
1182,雅**芸,口味: 酸奶果粒400g+小仙桃麦片400g赠烘焙水果400g,好评,可以干吃的 很香很脆  泡酸奶牛奶都好喝 ,-,-,2021-05-29
1183,y**0,口味: 酸奶果粒400g+小仙桃麦片400g赠烘焙水果400g,好评,好吃，活动购买特实惠 ,-,-,2021-06-05
1184,x**g,口味: 酸奶果粒400g+芝士树莓400g,好评,这次也没便宜,-,-,2021-06-19
1185,伊**4,口味: 酸奶果粒400g+芝士树莓400g,好评,等了好久 终于在猫猫那里拍到了 好吃,-,-,2021-06-19
1186,x**8,口味: 酸奶果粒400g+芝士树莓400g,好评,好吃，就是有点小贵，没涨价前价格还可以,-,-,2021-06-17
1187,魔**呼,口味: 酸奶果粒400g+芝士树莓400g,好评,好好吃，跟以往的普通麦片不一样，吃到嘴里就是香香的感觉，好吃 ,-,-,2021-06-18
1188,t**0,口味: 酸奶果粒400g+芝士树莓400g,好评,这回没有之前的脆 黄色的草莓也太酸了吧,-,-,2021-06-18
1189,x**i,口味: 酸奶果粒400g+小仙桃麦片400g赠50%水果坚果400g,好评,买了很多次的，好多主播都在卖，续货赶上哪个主播卖就囤起来 ,-,-,2021-06-01
1190,l**8,口味: 酸奶果粒400g+芝士树莓400g,好评,老顾客了，这次最划算了。买了5次了。,-,-,2021-06-19
1191,8**霜,口味: 酸奶果粒400g+芝士树莓400g,好评,一分价钱一分货，不愧是大牌子，就是好吃。,-,-,2021-06-19
1192,z**n,口味: 酸奶果粒400g+小仙桃麦片400g赠烘焙水果400g,好评,因为战战代言才买的，但是也挺好吃的呢！特别喜欢吃酸奶块！ ,-,-,2021-06-03
1193,盛**歌,口味: 酸奶果粒400g+小仙桃麦片400g赠烘焙水果400g,好评,还可以，直播间买的挺划算的 ,-,-,2021-05-30
1194,舍**寸,口味: 酸奶果粒400g+芝士树莓400g,好评,在快递柜拿出来纸盒都是打开的，是被故意打开的那种，胶带撕开了，快递单都两截了！ ,-,-,2021-06-17
1195,t**2,口味: 酸奶果粒400g+芝士树莓400g,好评,价格比以前贵了，但是里边多了坚果，比以前的好吃了,-,-,2021-06-18
1196,靳**3,口味: 酸奶果粒400g+小仙桃麦片400g赠烘焙水果400g,好评,孩子特别喜欢吃，代言人也特别有魅力。,-,-,2021-06-05
1197,s**7,口味: 酸奶果粒400g+小仙桃麦片400g赠烘焙水果400g,好评,Nice发货速度很快，东西包装的很好，价格优惠，我很满意👍，还会回购 ,-,-,2021-05-30
1198,繁**诺,口味: 酸奶果粒400g+芝士树莓400g,好评,太甜了，不好，而且坚果什么的并不多，特别多葡萄干之类的果脯 ,-,-,2021-06-18
1199,w**7,口味: 酸奶果粒400g+芝士树莓400g,好评,还好吧，基本都一样有点小贵,-,-,2021-06-19
1200,李**0,口味: 酸奶果粒400g+芝士树莓400g,好评,好吃好吃好吃，就是希望别涨价了，那么多爱你的粉丝你怎么舍得涨价呢 ,-,-,2021-06-19
1201,小**3,口味: 酸奶果粒400g+芝士树莓400g,好评,看着还不错，就是包装不好，快递盒都破了,-,-,2021-06-18
1202,g**5,口味: 酸奶果粒400g+小仙桃麦片400g赠烘焙水果400g,好评,小飞侠支持代言人，二次回购，以后还会继续回购 ,-,-,2021-05-28
1203,v**9,口味: 酸奶果粒400g+小仙桃麦片400g赠50%水果坚果400g,好评,小飞侠上线，战哥代言！燕麦口感脆脆的，泡牛奶特别好 ,-,-,2021-06-07
1204,拒**，,口味: 酸奶果粒400g+芝士树莓400g,好评,买了几次了，就是不爱吃里面椰片，吃不习惯那个味道,-,-,2021-06-18
1205,d**0,口味: 酸奶果粒400g+小仙桃麦片400g赠烘焙水果400g,好评,雪梨直播买的 比较划算 ,-,-,2021-06-23
1206,黄**8,口味: 酸奶果粒400g+芝士树莓400g,好评,本来是要给孩子邮到学校去的，忘改地址了邮到家又给孩子邮走了，应该不错 ,-,-,2021-06-19
1207,x**6,口味: 酸奶果粒400g+芝士树莓400g,好评,一般，没有我买的来伊份好吃,-,-,2021-06-19
1208,c**a,口味: 酸奶果粒400g+小仙桃麦片400g赠烘焙水果400g,好评,还行，比较甜，果干啥的也蛮多的 ,-,-,2021-06-02
1209,别**8,口味: 酸奶果粒400g+小仙桃麦片400g赠烘焙水果400g,好评,肖战代言的，抱着试试看的心态，没想到是买过最好吃的,-,-,2021-06-07
1210,j**8,口味: 酸奶果粒400g+小仙桃麦片400g赠烘焙水果400g,好评,吵架好吃，无数次回购了，小飞虾支持肖战,-,-,2021-06-04
1211,m**m,口味: 酸奶果粒400g+小仙桃麦片400g赠烘焙水果400g,好评,好吃、很饱肚子、会回购的,-,-,2021-05-28
1212,鱼**夏,口味: 酸奶果粒400g+小仙桃麦片400g赠烘焙水果400g,好评,好吃，娃娃最爱,-,-,2021-05-31
1213,弄**归,口味: 酸奶果粒400g+小仙桃麦片400g赠烘焙水果400g,好评,肖战粉丝小飞侠支持肖战代言～肖战帮粉丝选的，肯定是最好的 ,-,-,2021-06-03
1214,y**5,口味: 酸奶果粒400g+小仙桃麦片400g赠烘焙水果400g,好评,超级好吃，麦片届的扛把子，感谢代言人肖战的推荐 ,-,-,2021-06-06
1215,t**3,口味: 酸奶果粒400g+小仙桃麦片400g赠烘焙水果400g,好评,终于收到我需要的宝贝了，东西很好，价美物廉，谢谢掌柜的！说实在，这是我淘宝购物来让我最满意的一次购物。无论是掌柜的态度还是对物品，我都非常满意的。掌柜态度很专业热情，有问必答，回复也很快，我问了不少问题，他都不觉得烦，都会认真回答我，这点我向掌柜表示由衷的敬意，这样的好掌柜可不多。再说宝贝，正是我需要的，收到的时候包装完整，打开后让我惊喜的是，宝贝比我想象中的还要好！不得不得竖起大拇指。下次需要的时候我还会再来的，到时候麻烦掌柜给个优惠哦！,-,-,2021-06-22
1216,幸**j,口味: 酸奶果粒400g+芝士树莓400g,好评,好吃，回购好几回了，就是价格有点高,-,-,2021-06-18
1217,敏**子,口味: 酸奶果粒400g+小仙桃麦片400g赠50%水果坚果400g,好评,实物与描述的一样，质量相当好，卖家态度也好，有问必答，发货速度杠杠的，值得购买哦 ,-,-,2021-05-29
1218,小**珍,口味: 酸奶果粒400g*2赠50%水果坚果400g,好评,此用户没有填写评价。,超级好比超市便宜很多,-,2021-04-23
1219,清**韵,口味: 酸奶果粒400g+小仙桃麦片400g赠烘焙水果400g,好评,支持代言人！每款麦片的颜值和口味都特别赞！,-,-,2021-06-05
1220,f**e,口味: 酸奶果粒400g+小仙桃麦片400g赠烘焙水果400g,好评,麦片还可以       当早餐吃的    减肥的人不合适    很甜     ,-,-,2021-06-17
1221,半**厅,口味: 酸奶果粒400g+小仙桃麦片400g赠烘焙水果400g,好评,一如既往的好吃，配牛奶酸奶真是绝配，强烈推荐。 ,-,-,2021-05-30
1222,l**y,口味: 酸奶果粒400g+小仙桃麦片400g赠烘焙水果400g,好评,百香果支持肖战！这个链接太划算了！67三大包！虽然送的那包麦片跟另外两包不太一样！第一次礼盒已经吃完了！泡酸奶好吃！以后多点这种大额优惠！ ,-,-,2021-05-22
1223,9**燕,口味: 酸奶果粒400g+小仙桃麦片400g赠50%水果坚果400g,好评,肖战粉丝小飞侠支持肖战代言 昨天下午下的单  今天中午收到 这速度 好久没体会过了🤣有周边和没周边的区别 上次抢的礼盒 这次还是这三个口味 超好吃 拿起我的大金勺子 开始干,酥脆麦片欧扎克 最爱小仙桃味的 太爱这个麦片了会一直回购,-,2021-05-10
1224,d**媛,口味: 酸奶果粒400g+小仙桃麦片400g赠50%水果坚果400g,好评,口味特别酥脆，坚果和水果也好多，家里人都挺喜欢吃的。还给妈妈拿去了两包，通过肖战知道的欧扎克，现在说家里必备的零食和早餐啦！老公经常开袋就吃完！小飞侠支持肖战代言！总能带来好产品！！ ,-,-,2021-05-16
1225,t**9,口味: 酸奶果粒400g+芝士树莓400g,好评,红薯干太多，其他的东西太少 ,-,-,2021-06-19
1226,t**0,口味: 酸奶果粒400g+芝士树莓400g,好评,此用户没有填写评价。,猫妹**东西必须屯起来,-,2021-06-18
1227,严**罐,口味: 酸奶果粒400g+小仙桃麦片400g赠50%水果坚果400g,好评,这是目前为止吃的所有麦片里面最好吃的，点赞,-,-,2021-05-28
1228,t**3,口味: 酸奶果粒400g*2赠可可坚果400g,好评,此用户没有填写评价。,非常好的一款，孩子喜欢,-,2021-06-22
1229,经**饰,口味: 酸奶果粒400g+小仙桃麦片400g赠烘焙水果400g,好评,直播间买的好吃的价格也便宜 ,-,-,2021-05-29
1230,k**s,口味: 酸奶果粒400g+芝士树莓400g,好评,搭配牛奶真真是绝绝子……,-,-,2021-06-18
1231,我**丶,口味: 酸奶果粒400g+芝士树莓400g,好评,还阔以吧，这次吃起来感觉有点齁甜,-,-,2021-06-18
1232,豆**6,口味: 酸奶果粒400g+小仙桃麦片400g赠烘焙水果400g,好评,直播间买的，孩子蛮喜欢 ,-,-,2021-06-03
1233,蔷**雨,口味: 酸奶果粒400g+小仙桃麦片400g赠烘焙水果400g,好评,便宜就入手,-,-,2021-06-01
1234,w**9,口味: 酸奶果粒400g+小仙桃麦片400g赠烘焙水果400g,好评,直播间划算,-,-,2021-06-08
1235,x**1,口味: 酸奶果粒400g+芝士树莓400g,好评,差评给店铺的，会员给的东西不让一起发，必须在从新下单，那不给就完了呗、 ,-,-,2021-06-19
1236,夏**阳,口味: 酸奶果粒400g+小仙桃麦片400g赠烘焙水果400g,好评,真的比大多数麦片好吃✓🐢🐢支持肖战 ,-,-,2021-06-04
1237,b**8,口味: 酸奶果粒400g+小仙桃麦片400g赠烘焙水果400g,好评,好吃，配酸奶很赞，这是回购的。肖战冲鸭,-,-,2021-06-26
1238,t**8,口味: 酸奶果粒400g+芝士树莓400g,好评,没有之前的燕麦多了，味道比之前好吃，没有那么甜了。,-,-,2021-06-18
1239,小**9,口味: 酸奶果粒400g+芝士树莓400g,好评,麦片太少了，酸奶粒也是两颗，不值得买 ,-,-,2021-06-19
1240,a**儿,口味: 酸奶果粒400g+芝士树莓400g,好评,我买过好几种麦片，还是欧扎克麦片好吃！爱了 爱了！！！,-,-,2021-06-18
1241,m**7,口味: 酸奶果粒400g+芝士树莓400g,好评,怪不得那么人要这个，原来是真的好吃,-,-,2021-06-17
1242,李**9,口味: 酸奶果粒400g+小仙桃麦片400g赠50%水果坚果400g,好评,好吃😊肖战粉丝小飞侠支持欧扎克,-,-,2021-06-07
1243,小**2,口味: 酸奶果粒400g+小仙桃麦片400g赠烘焙水果400g,好评,好吃，划算,-,-,2021-05-28
1244,t**7,口味: 酸奶果粒400g+小仙桃麦片400g赠烘焙水果400g,好评,搭配酸奶好喝的味道,-,-,2021-06-22
1245,1**g,口味: 酸奶果粒400g+芝士树莓400g,好评,一般，不太喜欢吃,-,-,2021-06-19
1246,拉**英,口味: 酸奶果粒400g+芝士树莓400g,好评,第一次买到那么好吃的麦片。下一次还买,-,-,2021-06-19
1247,1**6,口味: 酸奶果粒400g+芝士树莓400g,好评,越来越高了价格，以后不来买了,-,-,2021-06-18
1248,x**4,口味: 酸奶果粒400g+芝士树莓400g,好评,和直播间说的不一样，我没有收到芝士树莓的,-,-,2021-06-18
1249,p**8,口味: 酸奶果粒400g+小仙桃麦片400g赠烘焙水果400g,好评,肖战粉丝支持肖战代言，好吃的停不下来,-,-,2021-06-04
1250,亲**贝,口味: 酸奶果粒400g+芝士树莓400g,好评,味道不错，就是坚果没有想象中的多 ,-,-,2021-06-20
1251,t**9,口味: 酸奶果粒400g+芝士树莓400g,好评,太一般了，不值,-,-,2021-06-20
1252,c**7,口味: 酸奶果粒400g+小仙桃麦片400g赠烘焙水果400g,好评,水果麦片不错，早饭泡奶很方便。 ,-,-,2021-06-04
1253,c**8,口味: 酸奶果粒400g+芝士树莓400g,好评,还行，挺好吃,-,-,2021-06-19
1254,李**0,口味: 酸奶果粒400g+芝士树莓400g,好评,吃了好几个牌子的，还是欧扎克好吃,-,-,2021-06-18
1255,谨**1,口味: 酸奶果粒400g+小仙桃麦片400g赠烘焙水果400g,好评,好吃，包装也好！ ,-,-,2021-06-03
1256,金**女,口味: 酸奶果粒400g+小仙桃麦片400g赠烘焙水果400g,好评,好吃呀 而且是我偶像代言的 哈哈哈 ,-,-,2021-06-02
1257,z**4,口味: 酸奶果粒400g+小仙桃麦片400g赠烘焙水果400g,好评,性价比不高,-,-,2021-06-05
1258,y**9,口味: 酸奶果粒400g+芝士树莓400g,好评,什么玩意啊.树莓的没有几个树莓，失望,-,-,2021-06-17
1259,l**o,口味: 酸奶果粒400g+芝士树莓400g,好评,就喜欢欧扎克，别的都没有欧扎克好吃。,-,-,2021-06-17
1260,t**u,口味: 酸奶果粒400g+小仙桃麦片400g赠烘焙水果400g,好评,干吃也很不错，一回家就被秒了,-,-,2021-06-02
1261,橡**节,口味: 酸奶果粒400g+芝士树莓400g,好评,日期不错，两袋是五月份的，一袋是四月份的！,-,-,2021-06-18
1262,1**l,口味: 酸奶果粒400g+小仙桃麦片400g赠烘焙水果400g,好评,已经买很多次了  味道很好 👍,-,-,2021-05-29
1263,兜**女,口味: 酸奶果粒400g+芝士树莓400g,好评,大品牌就是不一样，好吃！ ,-,-,2021-06-17
1264,s**6,口味: 酸奶果粒400g+芝士树莓400g,好评,什么也不说，无数次回购,-,-,2021-06-18
1265,赵**5,口味: 酸奶果粒400g+芝士树莓400g,好评,味道特别好吃，一股奶香味儿,-,-,2021-06-19
1266,漪**儿,口味: 酸奶果粒400g+小仙桃麦片400g赠烘焙水果400g,好评,麦片挺好的，水果挺多的，口感不错,-,-,2021-05-30
1267,菊**0,口味: 酸奶果粒400g+小仙桃麦片400g赠烘焙水果400g,好评,以前买过，懒人必备  干吃好吃,-,-,2021-06-07
1268,s**6,口味: 酸奶果粒400g+小仙桃麦片400g赠烘焙水果400g,好评,好吃口感脆香，和酸奶绝配。,-,-,2021-06-02
1269,t**6,口味: 酸奶果粒400g+芝士树莓400g,好评,感觉有点少，吃不了几顿，太贵,-,-,2021-06-19
1270,花**8,口味: 酸奶果粒400g+小仙桃麦片400g赠烘焙水果400g,好评,回购很多次了，超级好吃,-,-,2021-06-04
1271,t**4,口味: 酸奶果粒400g+芝士树莓400g,好评,确实比之前买过别家的好吃，,-,-,2021-06-21
1272,邹**兰,口味: 酸奶果粒400g+小仙桃麦片400g赠烘焙水果400g,好评,直播间买的，价格优惠又好吃，当早餐，完美,-,-,2021-06-08
1273,5**u,口味: 酸奶果粒400g+芝士树莓400g,好评,还是欧扎克的好吃，买好多回了 ,-,-,2021-06-18
1274,t**9,口味: 酸奶果粒400g+小仙桃麦片400g赠烘焙水果400g,好评,非常好吃，就是有点上火 ,-,-,2021-05-31
