数据下载时间：2021-07-01 13:32:58 功能：看店宝【https://kandianbao.com/】 宝贝评价信息分析 相关查询网址：https://kandianbao.com/item/pingjia/622366572773/,,,,,,,
序号,评价用户,sku,评价类型,评价内容,追评,掌柜回评,评价时间
1,l**淳,口味: 酸奶果粒400g+芝士树莓400g,好评,这麦片太好吃了吧！是我吃过的麦片里最好吃的，毛妹妹直播间买的物美价廉拿了马上打开吃了太赞了！好吃坚果还多打开一个树莓，一个坚果水果的太完美了 ,-,-,2021-06-21
2,l**1,口味: 酸奶果粒400g+小仙桃麦片400g赠烘焙水果400g,好评,此用户没有填写评价。,本肖战粉丝小飞侠超喜欢吃麦片，肖战代言啥我买啥，支持肖战代言的欧扎克，囤货囤货,-,2021-06-12
3,z**物,口味: 酸奶果粒400g+芝士树莓400g,好评,孩子爱吃，比零食强多了。,-,-,2021-06-21
4,情**凉,口味: 酸奶果粒400g+芝士树莓400g,好评,非常好吃，第二次买了，比上次买便宜，多屯点 ,-,-,2021-06-18
5,q**9,口味: 酸奶果粒400g+芝士树莓400g,好评,猫妹妹直播间买的便宜又实惠，第一次尝试麦片不错，里面果干很多，坚果也很脆。酸奶块也挺多的！自己看图👇 ,-,-,2021-06-19
6,w**0,口味: 酸奶果粒400g+芝士树莓400g,好评,挺好吃的，孩子和大人都能吃，酸奶块燕麦片，混合几种口味，蛮不错的，物流很快，没几天就到了，给好评 ,-,-,2021-06-18
7,t**6,口味: 酸奶果粒400g+芝士树莓400g,好评,猫妹妹直播间抢的哦，中间那包是猫妹妹送的哦 ,奶香味扑鼻，满🈵的一大包，坚果也很多，赞👍🏻,-,2021-06-19
8,小**琪,口味: 酸奶果粒400g+芝士树莓400g,好评,最近在减肥，以后就用燕麦片代餐了，已经吃过了，里面坚果也挺多的，满意 ,-,-,2021-06-22
9,t**6,口味: 酸奶果粒400g+芝士树莓400g,好评,必须好评，多次回购.麦片只选欧扎克，别的吃不习惯猫猫直播间买的值得购买与信赖 ,-,-,2021-06-19
10,1**j,口味: 酸奶果粒400g+芝士树莓400g,好评,谢谢猫猫给的福利价，家人很喜欢吃，期待下次活动…… ,-,-,2021-06-20
11,露**6,口味: 酸奶果粒400g+芝士树莓400g,好评,感谢猫妹妹。带的好产品。特别好吃。性价比超高。值得购买 ,-,-,2021-06-17
12,芷**4,口味: 酸奶果粒400g+芝士树莓400g,好评,肖战粉丝小飞侠来啦 喜欢的牌子被喜欢的人代言就是开心喜欢呀 猫猫直播间也比较划算 肖战粉丝小飞侠支持肖战先生代言啦 祝欧扎克和肖战和猫猫三赢哈哈 ,-,-,2021-06-24
13,百**聂,口味: 酸奶果粒400g+芝士树莓400g,好评,已经是第四次回购了 炒鸡无敌好 就喜欢吃这个牌子的 ,-,-,2021-06-18
14,t**4,口味: 酸奶果粒400g+芝士树莓400g,好评,好吃，便宜，店里买的贵，这个好，喜欢 ,-,-,2021-06-21
15,浮**乱,口味: 酸奶果粒400g+芝士树莓400g,好评,口感味道：看了评论都说好吃，可能是因为明星效应，导致这款品销量提升，说实话我认为作为减肥的人应该才会多使用燕麦片代餐，但是这燕麦片的含量太少，并且里面还放大米，最意外的还是油炸的，各种添加剂都有，更别说糖了，评论都说好吃，只有我觉得齁甜嘛，话说哪个燕麦加糖会不好喝 ,-,-,2021-06-22
16,艺**1,口味: 酸奶果粒400g+芝士树莓400g,好评,麦片收到了~先吃了一包芝士的~之前都是拍酸奶的超好吃~没想到芝士的也特别好吃~而且这个价格也比较划算~欧扎克yyds~吃过这款就不想吃别的麦片~虽然贵点但是确实好吃~ ,-,-,2021-06-21
17,t**4,口味: 酸奶果粒400g+芝士树莓400g,好评,猫猫直播间买的，听人家说了好几次好吃。到了就迫不及待打开吃了。水果干是真的多，奶块也挺大，香脆好吃。宝宝特别喜欢吃！ ,-,-,2021-06-21
18,t**3,口味: 酸奶果粒400g+芝士树莓400g,好评,包装品质：收到货，第一时间拆包装，质量非常好，与卖家描述一致，完全超出我的期望值，包装很仔细、严实，总的来说这次是很满意的一次购物，感谢卖家。 ,-,-,2021-06-22
19,董**7,口味: 酸奶果粒400g+芝士树莓400g,好评,孩子大人都爱吃 ,-,-,2021-06-18
20,张**5,口味: 酸奶果粒400g+芝士树莓400g,好评,第二次在猫妹妹这买欧扎克了，吃过这个牌子的别的牌子都没这个好吃！自从肖战代言以后价格是蹭蹭的涨价呀！这次买的便宜！！ ,-,-,2021-06-22
21,d**6,口味: 酸奶果粒400g+芝士树莓400g,好评,"强烈t荐希望欧扎克🌋爆火大卖,很脆,会一直🌛回购的。营养健康又方💪便,果粒大。孩子和大📻人都能吃,便宜,料很📄绝，今😷天就带了这个来上学了📞。吃完了两包才来评价♉,共三个囗味,一直很喜欢吃✉这款麦片,  ",-,-,2021-06-20
22,一**0,口味: 酸奶果粒400g+芝士树莓400g,好评,好吃，比以前买的麦片都好吃，干吃就好吃,-,-,2021-06-17
23,晟**琳,口味: 酸奶果粒400g+芝士树莓400g,好评,真的是绝绝子，太好吃了，非常喜欢，而且还特别实惠，从猫妹妹直播间抢的，非常好 ,-,-,2021-06-22
24,两**8,口味: 酸奶果粒400g+芝士树莓400g,好评,相信代言人战战的眼光，口感非常棒，比我在超市里买的其它牌子的好吃太多了，直播间买的价钱还特别实惠，会一直回购的。希望欧扎克爆火大卖，肖战顺顺利利健健康康。,-,-,2021-06-17
25,夏**y,口味: 酸奶果粒400g+芝士树莓400g,好评,非常好吃，孩子特别喜欢，里面的东西也很多，吃完再买。 ,-,-,2021-06-21
26,叶**q,口味: 酸奶果粒400g+芝士树莓400g,好评,小飞侠支持肖战代言，这款是真的好吃，满满的都是料，真的真的很好吃，麦片也是鼓鼓的那种，吃着很脆，大力推荐😋,-,-,2021-06-21
27,b**8,口味: 酸奶果粒400g+芝士树莓400g,好评,肖战的小飞侠来咯 嘻嘻 解锁多种吃法 用麦片搭配做了布朗尼 好吃😋 ,-,-,2021-06-26
28,筱**m,口味: 酸奶果粒400g+芝士树莓400g,好评,包装品质：包装很好， 口感味道：吃起来很好吃回购好几次了，超级奈斯 ,-,-,2021-06-24
29,冰**8,口味: 酸奶果粒400g+芝士树莓400g,好评,麦片  包装精美  质量不错。满意 ,-,-,2021-06-24
30,t**5,口味: 酸奶果粒400g+芝士树莓400g,好评,在猫猫直播间下单的，她好久都没有带这款燕麦片了。因为我家肖战代言了这款麦片缺货很久了。这次是猫猫自己贴钱给粉丝们的福利。 ,-,-,2021-06-19
31,一**柔,口味: 酸奶果粒400g+芝士树莓400g,好评,溶解难易：用牛奶一泡就行了 配件问题：都很不错呢 包装品质：袋袋密封很好 外观品相：好看，好吃，好味道😋 口感味道：嘎嘣脆干吃一样好吃哦 ,-,-,2021-06-19
32,曹**爱,口味: 酸奶果粒400g+芝士树莓400g,好评,孩子要吃，买给孩子吃的，也是回购，妈呀，今天吃出来一个肉肉 ,-,-,2021-06-23
33,宝**儿,口味: 酸奶果粒400g+芝士树莓400g,好评,从猫妹妹直播间买的欧扎克太好吃了一股鲜奶的味道。孩子们很喜欢吃，共三个囗味，今天就带了这个来上学了。干吃也好吃，泡奶吃也好吃。太划算了 ,-,-,2021-06-18
34,雪**碍,口味: 酸奶果粒400g+芝士树莓400g,好评,正品，不错,-,-,2021-06-18
35,d**0,口味: 酸奶果粒400g+芝士树莓400g,好评,特别香，很好吃，女儿直接吃当零食哈哈😃,-,-,2021-06-23
36,1**闫,口味: 酸奶果粒400g+芝士树莓400g,好评,包装品质：包装品质挺好 外观品相：不错 口感味道：之前吃过  现在属于回购 好吃的 在猫猫直播间买的 性价比高 还好吃😋 每天早上来一勺 加上牛奶 早餐的问题就解决了  ,-,-,2021-06-20
37,t**0,口味: 酸奶果粒400g+芝士树莓400g,好评,超乎想象，足足的坚果，怎么吃都好吃！ ,-,-,2021-06-18
38,1**虎,口味: 酸奶果粒400g+芝士树莓400g,好评,自从肖战代言，欧扎克我就买不起了，多亏有猫猫，在她直播间有补贴连拍三单呀，真好还是以前的价格👍 包装品质：品质最好的麦片 ,-,-,2021-06-19
39,后**妹,口味: 酸奶果粒400g+芝士树莓400g,好评,这个燕麦特别饱满，很好吃，非常喜欢,-,-,2021-06-26
40,t**3,口味: 酸奶果粒400g+芝士树莓400g,好评,超级好吃，猫猫直播间买的，说是下次就要涨价了，屯了两份，第一次买真是爱了，吃完还会回购，作为早餐真的很方便呢，买的蓝胖子一起搭配着吃，真好 ,-,-,2021-06-22
41,t**0,口味: 酸奶果粒400g+芝士树莓400g,好评,收到货 三大包 一包400克  猫妹妹直播间买的 55块钱 水果 坚果麦片的 好吃*了  我吃过  最好吃得 麦片了 推荐推荐   其他俩包 还没品尝,从袋子里面。倒出来一只小虫子  恶心*了,-,2021-06-18
42,t**7,口味: 酸奶果粒400g+芝士树莓400g,好评,宝贝很好吃，是正品，而且比网上便宜了好多，会无限回购的，支持猫猫 ,-,-,2021-06-22
43,v**1,口味: 酸奶果粒400g+芝士树莓400g,好评,挺好吃，就是觉得太甜了，放牛奶泡一会还可以，吃完饱腹感太强了，基本就是一上午也不饿，好吃便宜,-,-,2021-06-19
44,乖**2,口味: 酸奶果粒400g+芝士树莓400g,好评,猫猫直播间买的，非常的好吃，量足，价格实惠。 ,-,-,2021-06-19
45,轩**8,口味: 酸奶果粒400g+芝士树莓400g,好评,很好吃，喜欢肖战，产品也没让我失望。 吃过好多麦片，都是一泡牛奶什么的接着就软软的，我不太喜欢那种感觉，这个麦片泡了还是脆脆的，太棒了 以后还会继续支持的，希望店家多搞活动哦，三天一包吃的太快了。  ,-,-,2021-06-20
46,我**b,口味: 酸奶果粒400g+芝士树莓400g,好评,我们这边三线城市一包400g的49.9，在直播间买的还挺优惠的，一直在猫猫直播间买的，味道也好， ,-,-,2021-06-17
47,杨**淇,口味: 酸奶果粒400g+芝士树莓400g,好评,包装品质：好 外观品相：非常好 大牌 口感味道：美味 非常好吃 ,-,-,2021-06-18
48,脑**的,口味: 酸奶果粒400g+芝士树莓400g,好评,很好吃的  我买过饱饱，买过麦多，感觉这个好吃 为了这个还特意买了蓝胖子泡着喝，但是我发现还是干吃最好吃  所以看评论的亲们可以别花冤枉钱了   ,-,-,2021-06-26
49,大**9,口味: 酸奶果粒400g+芝士树莓400g,好评,味道不错，怎么吃都好吃，支持一下 ,-,-,2021-06-26
50,w**x,口味: 酸奶果粒400g+芝士树莓400g,好评,老顾客了，家中早餐必备，推荐～ ,-,-,2021-06-22
51,往**8,口味: 酸奶果粒400g+芝士树莓400g,好评,欧扎克麦片收到了，包装完整，份量很足，一直喜欢吃这个牌子的麦片，吃完再来回购,-,-,2021-06-20
52,赵**衣,口味: 酸奶果粒400g+芝士树莓400g,好评,这款麦片是真的很好吃～打破以往对麦片的了解～这款香香甜甜  脆脆的～里面奶块和果仁也比较多～猫猫直播间的价位也很优惠！好吃好吃 ,-,-,2021-06-22
53,小**4,口味: 酸奶果粒400g+芝士树莓400g,好评,啊啊啊还是我家有钱哥哥代言的，欧扎克本来就是杠杠的第一特别爱吃，现在更爱了～,-,-,2021-06-26
54,t**7,口味: 酸奶果粒400g+小仙桃麦片400g赠烘焙水果400g,好评,因为肖战代言买的，第一次吃时真的有惊艳到，就再下单其他口味来吃吃看，相信肖战代言的一定好吃，肖战粉丝小飞侠支持肖战代言👍👍👍,-,-,2021-06-22
55,齐**y,口味: 酸奶果粒400g+芝士树莓400g,好评,都很好吃，尤其是芝士味道的，很香，很喜欢。 ,-,-,2021-06-23
56,x**x,口味: 酸奶果粒400g+芝士树莓400g,好评,味道不错，下次继续光顾 ,-,-,2021-06-24
57,小**5,口味: 酸奶果粒400g+芝士树莓400g,好评,好吃，我家孩子特别喜欢，泡酸奶，小孩能吃好多，每天早上都想吃，再猫猫直播间买了三单，囤货中😋😋😋😋,-,-,2021-06-24
58,杨**阳,口味: 酸奶果粒400g*2赠50%水果坚果400g,好评,此用户没有填写评价。,酸奶块挺不错的，很香的麦片，就是个人很不喜欢葡萄干，有点太甜太粘牙，有没有哪个口味无葡萄干呀！！对了，百香果支持肖战呀！,-,2021-04-29
59,海**游,口味: 酸奶果粒400g+芝士树莓400g,好评,溶解难易：易 包装品质：完好 外观品相：完好 口感味道：香香的脆脆的好吃 ,-,-,2021-06-21
60,静**轩,口味: 酸奶果粒400g+芝士树莓400g,好评,溶解难易：嗯 配件问题：没有 包装品质：很好 外观品相：好看 口感味道：好吃 ,-,-,2021-06-23
61,t**3,口味: 酸奶果粒400g+芝士树莓400g,好评,味道非常好，挺喜欢的，猫妹妹直播间买的，非常划算，宝宝非常爱吃,-,-,2021-06-22
62,张**0,口味: 酸奶果粒400g+芝士树莓400g,好评,很好吃，性价比很高，物超所值，孩子很喜欢吃，支持猫猫 ,-,-,2021-06-17
63,a**8,口味: 酸奶果粒400g+芝士树莓400g,好评,口感味道：好吃，低脂，比超市便宜！1周宝宝也爱吃！ ,-,-,2021-06-23
64,s**1,口味: 酸奶果粒400g+芝士树莓400g,好评,溶解难易：好 配件问题：好 包装品质：好 外观品相：好 口感味道：好 ,-,-,2021-06-17
65,林**珍,口味: 酸奶果粒400g+芝士树莓400g,好评,肖战粉丝小飞侠 因为战哥才买的麦片 没想到味道真的不错 干吃 泡奶吃都好吃😋 会继续支持战战的  会回购哦  ,-,-,2021-06-18
66,娟**8,口味: 酸奶果粒400g+芝士树莓400g,好评,回购  经济实惠 孩子也爱吃   好评,-,-,2021-06-17
67,啊**会,口味: 酸奶果粒400g+芝士树莓400g,好评,可以买来当早餐的 ,-,-,2021-06-21
68,果**3,口味: 酸奶果粒400g+芝士树莓400g,好评,支持肖战，欧扎克质量很好，味道也好吃，以后早餐就选欧扎克了！……肖战的小飞侠 ,-,-,2021-06-19
69,性**嘻,口味: 酸奶果粒400g+芝士树莓400g,好评,淘宝上有太多燕麦片都不敢买，这是我第一次买燕麦片，在快手猫猫直播间买的，还买了蓝胖子泡这个燕麦片当早餐吃，我儿子太喜欢吃了，在猫妹妹直播间买的东西，从来没让我失望过，关键价格还便宜，太满意了，谢谢猫猫。,-,-,2021-06-18
70,小**g,口味: 酸奶果粒400g+芝士树莓400g,好评,不会再买，少了一包，非说我朋友帮我拿的，我朋友拿我一袋，哈哈，笑*我了，包装胶带都没开，品牌大了，很是牛 ,-,-,2021-06-23
71,t**0,口味: 酸奶果粒400g+芝士树莓400g,好评,猫猫直播间买的，吃一次就种草的麦片，宝宝也喜欢吃，口感胜过吃过的所有麦片，强烈推荐 ,-,-,2021-06-18
72,缪**s,口味: 酸奶果粒400g+芝士树莓400g,好评,麦片我就吃欧扎克，真材实料，比别人家好吃多了，之前猫猫带别人家的我都不买，喜欢吃麦片的可以下手了,-,-,2021-06-21
73,上**0,口味: 酸奶果粒400g+芝士树莓400g,好评,在猫猫直播间买的，口感特别好，大人孩子都喜欢吃，价格还便宜 ,-,-,2021-06-21
74,傲**r,口味: 酸奶果粒400g+芝士树莓400g,好评,好吃，宝贝很喜欢，在猫妹妹直播间买的，味道炒鸡棒 ,-,-,2021-06-19
75,t**9,口味: 酸奶果粒400g+芝士树莓400g,好评,猫猫直播间拍的，吃过好几款麦片，还是欧扎克最好吃👍👍超级棒,-,-,2021-06-18
76,珊**7,口味: 酸奶果粒400g+小仙桃酸奶400g赠烘焙水果400g,好评,此用户没有填写评价。,算一下直播间买的还没有店铺便宜，店铺750克才39，这里800了65,-,2021-06-21
77,美**楠,口味: 酸奶果粒400g+芝士树莓400g,好评,好吃，特别的好吃，但这么好吃的东西，应该不能减肥，毕竟脂肪占比挺高的，代餐可以，不代表可以减肥 ,-,-,2021-06-23
78,王**e,口味: 酸奶果粒400g+芝士树莓400g,好评,因为喜欢一博，也顺带上了战战，谁让你俩关系好呢。 原来就挺喜欢欧扎克麦片的，现在因为战战更喜欢了。 ,-,-,2021-06-18
79,l**5,口味: 酸奶果粒400g+芝士树莓400g,好评,真心好吃😄😀😀 ,-,-,2021-06-21
80,元**艇,口味: 酸奶果粒400g+芝士树莓400g,好评,质量确实挺好的，挺好吃的，我喜欢泡着酸奶吃，里面料也挺足的，推荐大家购买,-,-,2021-06-24
81,x**1,口味: 酸奶果粒400g+芝士树莓400g,好评,猫妹妹直播间买的，早上不愿意做饭正好，很好吃还不贵，好评 ,-,-,2021-06-19
82,m**裤,口味: 酸奶果粒400g+芝士树莓400g,好评,个人感觉还是卡乐比好吃，这款价格合适，有性价比。 ,-,-,2021-06-24
83,t**7,口味: 酸奶果粒400g+芝士树莓400g,好评,口感味道：很好吃，孩子也很喜欢，二次购物了，在直播间买的 ,-,-,2021-06-22
84,嗯**哼,口味: 酸奶果粒400g+芝士树莓400g,好评,在猫猫直播间买的。第一次吃。巨好吃。希望下次直播还带这款产品,-,-,2021-06-17
85,t**4,口味: 酸奶果粒400g+芝士树莓400g,好评,东西很喜欢，质量也很好的，这个价格能买到是真的很划算,-,-,2021-06-21
86,高**顿,口味: 酸奶果粒400g+芝士树莓400g,好评,不好吃，根本没有麦片，少的可怜，都是麦粒，一点也不划算，麦粒太甜，连十分之一的麦片都没有，全是麦粒合成的东西，那还叫什么酸奶果粒麦片，叫麦粒得了,-,-,2021-06-23
87,p**3,口味: 酸奶果粒400g+芝士树莓400g,好评,一如既往的好吃，等了好久，每次都在直播间拍，实惠 ,-,-,2021-06-21
88,梅**涵,口味: 酸奶果粒400g+芝士树莓400g,好评,好吃，就这样拿着干吃也好吃，大人小孩都喜欢吃，必须回购 ,-,-,2021-06-18
89,a**9,口味: 酸奶果粒400g+芝士树莓400g,好评,非常好吃 我家宝宝非常爱吃 猫妹妹直播间拍的,-,-,2021-06-17
90,甜**6,口味: 酸奶果粒400g+芝士树莓400g,好评,超级超级超级好吃。 ,-,-,2021-06-21
91,t**1,口味: 酸奶果粒400g+芝士树莓400g,好评,好吃，刚从快递柜取回来就打开了。尝了酸奶和树莓芝士的。个人喜欢芝士，丫头喜欢酸奶，丫头晚餐就拌着牛奶当晚饭吃的。吃了两碗。猫猫直播间买的，三包还是比较划算。吃过最好吃的即食燕麦片，很香。吃完还会回购的。 ,-,-,2021-06-18
92,欣**2,口味: 酸奶果粒400g+芝士树莓400g,好评,纯属支持猫猫，实际上每次价格都一样 ,-,-,2021-06-22
93,刘**2,口味: 酸奶果粒400g+芝士树莓400g,好评,在猫猫直播间多次购买非常好吃，划算。 ,-,-,2021-06-25
94,m**8,口味: 酸奶果粒400g+芝士树莓400g,好评,✍ 一碗人间烟火也就是一碗热腾腾的饭菜。再多崇高的理想，再激昂的生活，最终不过是回归到生活。踏踏实实过日子。大家中午好！ 今日餐餐：蒜苔烧土豆，金枪鱼拌番杏，白米饭，黑芝麻核桃糊，桃子🍎 橘子。    ,-,-,2021-06-19
95,向**猫,口味: 酸奶果粒400g+芝士树莓400g,好评,打开闻着很香，我跟孩子都很爱吃，加酸奶或者纯奶泡着吃，既有饱腹感又增加了营养。 ,-,-,2021-06-23
96,姑**琳,口味: 酸奶果粒400g+芝士树莓400g,好评,是来回购的，这款经济实惠，口味又好，都是真材实料！,-,-,2021-06-24
97,乐**觉,口味: 酸奶果粒400g+芝士树莓400g,好评,好吃的呀 ,-,-,2021-06-26
98,t**7,口味: 酸奶果粒400g+芝士树莓400g,好评,泡纯奶 ,-,-,2021-06-22
99,t**5,口味: 酸奶果粒400g+芝士树莓400g,好评,包装品质：包装的很好 发货很快  口感味道：不错 超级无敌好吃 打开包装超级香 当早饭很不错 ,-,-,2021-06-19
100,l**政,口味: 酸奶果粒400g+芝士树莓400g,好评,这个麦片里面竟然有蚊子🦟，还是刚打开包装的.,-,-,2021-06-23
101,b**乎,口味: 酸奶果粒400g+芝士树莓400g,好评,之前买我对象说好吃，这次直播我又给他买了，直接寄到他那里，他说太好吃了，让我下次多买点儿😂,-,-,2021-06-24
102,孙**y,口味: 酸奶果粒400g+芝士树莓400g,好评,价格划算，口味很好，比较香，吃过很多种麦片，最喜欢这个牌子的，就是不喜欢葡萄干 ,-,-,2021-06-24
103,鑫**5,口味: 酸奶果粒400g+芝士树莓400g,好评,给老妈买的，不知道怎么样呢，猫猫直播间买的，应该可以 ,-,-,2021-06-21
104,y**4,口味: 酸奶果粒400g+芝士树莓400g,好评,支持战战，第一次吃麦片好吃好吃，战战代言东西都很好 ,-,-,2021-06-19
105,t**0,口味: 酸奶果粒400g+芝士树莓400g,好评,太太太好吃了，没有奇怪的味道，猫妹妹直播买的，超划算！,-,-,2021-06-18
106,t**8,口味: 酸奶果粒400g+芝士树莓400g,好评,猫猫直播间拍的 太划算 太好吃了 还会回购的,-,-,2021-06-22
107,t**8,口味: 酸奶果粒400g+芝士树莓400g,好评,啦啦啦 ,-,-,2021-06-26
108,s**9,口味: 酸奶果粒400g+芝士树莓400g,好评,超划算的价格 口感好 超值3大袋 ,-,-,2021-06-20
109,x**1,口味: 酸奶果粒400g+芝士树莓400g,好评,直播间买的无数次了，个人觉得所有麦片中欧扎克最好吃了，个人喜欢可可口味和芝士树莓派 ,-,-,2021-06-25
110,r**e,口味: 酸奶果粒400g+小仙桃麦片400g赠烘焙水果400g,好评,很好吃、很实惠，水果干、酸奶粒量很大，一直当零食直接吃，饿了就抓起来吃，比膨化食品吃着心里有底。 ,-,-,2021-06-22
111,耿**0,口味: 酸奶果粒400g+芝士树莓400g,好评,水果坚果麦片中水果只有几个香蕉片和几个坚果，含量太少了，上次购买水果坚果还挺多了，两次买的还不一样太扯淡了 ,-,-,2021-06-26
112,囡**9,口味: 酸奶果粒400g+芝士树莓400g,好评,欧扎克就是好吃，猫妹妹直播间买的，划算 ,-,-,2021-06-22
113,唱**v,口味: 酸奶果粒400g+芝士树莓400g,好评,口感味道：非常好吃 在猫妹妹直播间下的单 ,-,-,2021-06-18
114,陈**人,口味: 酸奶果粒400g+芝士树莓400g,好评,好吃，猫猫直播间买更便宜些❤️ ,-,-,2021-06-21
115,小**砰,口味: 酸奶果粒400g+芝士树莓400g,好评,比超市划算，孩子喜欢 ,-,-,2021-06-21
116,沉**1,口味: 酸奶果粒400g+芝士树莓400g,好评,姐姐最爱我也最爱吃，下次能自己拍味道就好了  ,-,-,2021-06-26
117,会**f,口味: 酸奶果粒400g+芝士树莓400g,好评,麦片收到了，真的好好吃，相信代言人的眼光，小飞侠的朋友支持肖战。,-,-,2021-06-23
118,醒**分,口味: 酸奶果粒400g+芝士树莓400g,好评,猫猫直播间下单 真是实惠  ,-,-,2021-06-21
119,w**0,口味: 酸奶果粒400g+小仙桃酸奶400g赠烘焙水果400g,好评,相信肖战的选择。麦片很好吃，小朋友很喜欢。会继续支持 ,-,-,2021-06-18
120,清**屋,口味: 酸奶果粒400g+芝士树莓400g,好评,这边买的都是我家宝贝闺女一直喜欢的口味  ,-,-,2021-06-21
121,邓**我,口味: 酸奶果粒400g+芝士树莓400g,好评,直播间购买的超级划算，这次试一下欧扎克麦片 ,-,-,2021-06-18
122,t**8,口味: 酸奶果粒400g+芝士树莓400g,好评,东西越卖越贵，品质越来越差！好坚果少的可怜，一包里就找到三四个腰果，都是用便宜的香蕉片和葡萄干，这种品质还怎么回购😓,-,-,2021-06-18
123,时**1,口味: 酸奶果粒400g+芝士树莓400g,好评,味道很好，给孩子做零食营养又健康，支持肖战😊,-,-,2021-06-21
124,y**素,口味: 酸奶果粒400g+芝士树莓400g,好评,好吃，但是怕胖不敢吃太多，直播买的，挺划算。 ,-,-,2021-06-21
125,张**1,口味: 酸奶果粒400g+芝士树莓400g,好评,搭配酸奶很营养，孩子喜欢吃坚果的那个 ,-,-,2021-06-22
126,爱**1,口味: 酸奶果粒400g+芝士树莓400g,好评,好吃，猫猫直播间买的很划算 ,-,-,2021-06-23
127,t**0,口味: 酸奶果粒400g+芝士树莓400g,好评,支持猫妹妹，很喜欢在他直播间买零食，不为别的，就为了比起平日的便宜，还是牌子的 ,-,-,2021-06-18
128,t**2,口味: 酸奶果粒400g+芝士树莓400g,好评,喜欢，实惠满意，好吃 买了好几次了,-,-,2021-06-19
129,韩**0,口味: 酸奶果粒400g+芝士树莓400g,好评,我实在猫妹妹直播间抢到的，这个牌子不错的，一直听说不错，看到直播间有货就拍一单试试，包装很结实哦，快递小哥送货也很及时，都很完美，麦片口味不错，吃过了其中一袋才来评价的，水果片很足，还有果仁啥的，干吃泡着吃都好吃，给卖家点个赞，赞👍👍👍 ,-,-,2021-06-20
130,云**h,口味: 酸奶果粒400g+芝士树莓400g,好评,特别好的东西，孩子很喜欢吃！而且很方便,-,-,2021-06-26
131,惊**8,口味: 酸奶果粒400g+小仙桃麦片400g赠烘焙水果400g,好评,吃完了两包才来评价，作为肖战粉丝小飞侠的我，一直很喜欢吃这款麦片，每天早餐和下午茶时间都会吃一点，营养健康又方便，而且遇到有活动的时候也很划算，会一如既往支持肖战代言，支持欧扎克！,-,-,2021-06-11
132,噜**6,口味: 酸奶果粒400g+芝士树莓400g,好评,知识的好香呀。 很好吃。特别好吃。吃了忘不了呀水果芝士混在一起了,-,-,2021-06-19
133,l**0,口味: 酸奶果粒400g+芝士树莓400g,好评,百香果支持肖战，优秀的人代言优秀的产品，完美！实力派欧扎克，实力派肖战，祝战战事事顺利，平安喜乐！,-,-,2021-06-24
134,q**5,口味: 酸奶果粒400g+芝士树莓400g,好评,味道真的很好 肖战代言的 好喜欢哦 大家快点入手吧 ,-,-,2021-06-19
135,大**2,口味: 酸奶果粒400g+芝士树莓400g,好评,还没吃，光看包装就觉得很好吃 ,-,-,2021-06-18
