1432,z**0,口味: 酸奶果粒400g+小仙桃麦片400g赠烘焙水果400g,好评,因为肖战代言 所以认识了这个牌子，在雪梨直播间看到果断下手购买，三个口味，每包400g，物美价廉，完美得狠。冲鸭 ,-,-,2021-05-22
1433,t**9,口味: 酸奶果粒400g*2赠可可坚果400g,好评,此用户没有填写评价。,非常非常好吃，早上搭配牛奶鸡蛋一起食用，已经买好几单了，支持辛巴相信辛巴,-,2021-03-24
1434,自**0,口味: 酸奶果粒400g+小仙桃麦片400g赠烘焙水果400g,好评,超级好吃，香酥脆材料实惠品种多。,-,-,2021-05-23
1435,m**a,口味: 酸奶果粒400g+小仙桃麦片400g赠烘焙水果400g,好评,肖战粉丝百香果 ,-,-,2021-05-20
1436,普**人,口味: 酸奶果粒400g+小仙桃麦片400g赠50%水果坚果400g,好评,紫色包装的酸奶块很多，送的红色的坚果多，好吃，泡奶，泡酸奶，泡白水都很好吃 ,-,-,2021-05-17
1437,t**1,口味: 酸奶果粒400g*2赠50%水果坚果400g,好评,好吃 猫猫直播间拍的68。买3袋。早晨孩子上学 用一杯牛奶泡一点吃。吃**蛋 又省时省力。 ,-,-,2021-04-06
1438,c**7,口味: 酸奶果粒400g+小仙桃麦片400g赠烘焙水果400g,好评,肖战代言才知道有这个好吃的麦片，买了很多，放在公司中午吃，方便，不胖，主要是好吃不胖，强烈推荐  ,-,-,2021-05-26
1439,c**7,口味: 酸奶果粒400g+小仙桃麦片400g赠烘焙水果400g,好评,肖战代言才知道有这个好吃的麦片，买了很多，放在公司中午吃，方便，不胖，主要是好吃不胖，强烈推荐 ,-,-,2021-05-26
1440,陈**1,口味: 酸奶果粒400g+小仙桃麦片400g赠烘焙水果400g,好评,不错，这个麦片超级好吃 ,-,-,2021-05-23
1441,西**桃,口味: 酸奶果粒400g+小仙桃麦片400g赠烘焙水果400g,好评,多吃购买，小朋友最喜欢欧扎克麦片，泡热牛奶，拌酸奶味道都可。,-,-,2021-05-27
1442,一**竺,口味: 酸奶果粒400g+小仙桃麦片400g赠50%水果坚果400g,好评,非常好吃，让我惊讶麦片居然能做的这么好吃！这是第三次购买了～买了2份6包～感觉也很快能吃完～,-,-,2021-05-25
1443,l**6,口味: 酸奶果粒400g+小仙桃麦片400g赠烘焙水果400g,好评,外观品相：直播间买的，两包送一包，没成想家门口超市都比买的便宜，口感还不错 ,-,-,2021-05-23
1444,z**9,口味: 酸奶果粒400g+小仙桃麦片400g赠烘焙水果400g,好评,今天收到了😊 ,-,-,2021-05-20
1445,雪**2,口味: 酸奶果粒400g*2赠50%水果坚果400g,好评,此用户没有填写评价。,最近在减肥就在猫妹妹直播间买了燕麦片，非常好吃快吃完了期待直播再买,-,2021-04-27
1446,王**i,口味: 酸奶果粒400g+小仙桃麦片400g赠50%水果坚果400g,好评,宝贝已经收到啦，已经购买过很多次了，算得上是所有品牌里面的麦片回购次数最多的，买二送一，很是划算的很。。,-,-,2021-05-24
1447,毓**侬,口味: 酸奶果粒400g+小仙桃麦片400g赠50%水果坚果400g,好评,包装品质：很好，完整无损。 口感味道：还不错，挺好吃的。比日本的好吃。 ,-,-,2021-05-11
1448,l**6,口味: 酸奶果粒400g+小仙桃麦片400g赠50%水果坚果400g,好评,肖战粉丝小飞侠报道，战战的选品跟他人一样靠谱，全家都喜欢 ,-,-,2021-05-11
1449,7**7,口味: 酸奶果粒400g+小仙桃麦片400g赠烘焙水果400g,好评,第二次购买了，非常好吃，家里小孩也说好吃，强烈推荐，还会回购的 ,-,-,2021-05-23
1450,z**m,口味: 酸奶果粒400g+小仙桃麦片400g赠50%水果坚果400g,好评,新口味小仙桃就蛮一般的 没啥大惊喜 支持一下肖战 嘿嘿 ,-,-,2021-05-25
1451,t**7,口味: 酸奶果粒400g+小仙桃麦片400g赠烘焙水果400g,好评,一如既往的好！直播间买的很实惠很划算！特别满意！ ,-,-,2021-06-22
1452,h**9,口味: 酸奶果粒400g+小仙桃麦片400g赠50%水果坚果400g,好评,百香果支持肖战，再次回购的，很好吃，以前都是日本卡乐比，现在都是欧扎克，很好吃😋,-,-,2021-05-17
1453,b**暖,口味: 酸奶果粒400g+小仙桃麦片400g赠50%水果坚果400g,好评,百香果支持肖战，味道不错，直播活动价格很可，会继续回购,-,-,2021-05-17
1454,l**3,口味: 酸奶果粒400g+小仙桃麦片400g赠烘焙水果400g,好评,第一次买这个口味的，吃过后追评，不过过，战战代言的东西肯定好,-,-,2021-05-23
1455,t**0,口味: 酸奶果粒400g+小仙桃麦片400g赠50%水果坚果400g,好评,我吃了好几袋了，泡蒙牛纯牛奶真的好吃，我女儿置喜欢里面的酸奶粒,-,-,2021-06-18
1456,轩**u,口味: 酸奶果粒400g+小仙桃麦片400g赠烘焙水果400g,好评,好吃，搭配牛奶或者是酸奶都好吃，感觉带点甜味。吃完了再来买。 ,-,-,2021-05-27
1457,宁**翔,口味: 酸奶果粒400g+小仙桃麦片400g赠烘焙水果400g,好评,属于在各大直播间看到必买的款，泡酸奶牛奶干吃都很好吃。 ,-,-,2021-05-21
1458,司**雪,口味: 酸奶果粒400g+小仙桃麦片400g赠烘焙水果400g,好评,直播间买的，但是赠送的那款不适合干吃是纯麦片，没有酸奶果粒和小仙桃好吃 ,-,-,2021-05-23
1459,b**6,口味: 酸奶果粒400g+小仙桃麦片400g赠烘焙水果400g,好评,多次买了，放在单位当早餐，配上各种奶泡着吃都不错,-,-,2021-05-23
1460,y**o,口味: 酸奶果粒400g+小仙桃麦片400g赠50%水果坚果400g,好评,百香果来支持肖战啦！麦片很好吃，营养搭配也很合理！,-,-,2021-05-16
1461,好**5,口味: 酸奶果粒400g+小仙桃麦片400g赠烘焙水果400g,好评,第一次买这款，直播间下单很优惠，感觉质量不错 ,-,-,2021-05-19
1462,l**g,口味: 酸奶果粒400g+小仙桃麦片400g赠烘焙水果400g,好评,孩子喜欢吃，不做饭了，牛奶泡麦片，简单养生又省事,-,-,2021-05-21
1463,夏**0,口味: 酸奶果粒400g+小仙桃麦片400g赠烘焙水果400g,好评,第二次回购了，味道很好，里面的配料非常丰富。上次因为战战代言买的，这次因为真的很好吃买的 ,-,-,2021-05-19
1464,t**6,口味: 酸奶果粒400g+小仙桃麦片400g赠烘焙水果400g,好评,描述与实物相符商品质量特别好下次还会光临滴！,-,-,2021-06-19
1465,t**光,口味: 酸奶果粒400g+小仙桃麦片400g赠50%水果坚果400g,好评,欧扎克确实好吃，宝宝很喜欢吃，直播间购买超级划算,-,-,2021-05-12
1466,此**7,口味: 酸奶果粒400g+小仙桃麦片400g赠50%水果坚果400g,好评,麦片很好吃，第二次买了，送给朋友一起吃！代言人超帅！！！,-,-,2021-05-13
1467,杨**5,口味: 酸奶果粒400g+小仙桃麦片400g赠50%水果坚果400g,好评,战哥代言的必须买呀  包装很好看  味道也好吃  当早餐吃的 ,-,-,2021-05-11
1468,t**1,口味: 酸奶果粒400g+小仙桃麦片400g赠50%水果坚果400g,好评,肖战粉丝小飞侠已经收到货啦，因为太好吃，所以回购啦，祝生意兴隆,-,-,2021-05-16
1469,t**3,口味: 酸奶果粒400g+小仙桃麦片400g赠烘焙水果400g,好评,很好吃呀，泡酸奶牛奶早餐奶都非常可，干吃也不错，绝绝子,-,-,2021-06-22
1470,5**以,口味: 酸奶果粒400g+小仙桃麦片400g赠烘焙水果400g,好评,宝贝收到了，大爱哦，份量很足，不同口味都是我喜欢的，棒棒哒 ,-,-,2021-05-20
1471,w**0,口味: 酸奶果粒400g+小仙桃麦片400g赠烘焙水果400g,好评,第一次买是因为肖战代言，吃过觉得很不错，这次直播间也很优惠，又买了！！！,-,-,2021-06-18
1472,不**n,口味: 酸奶果粒400g+小仙桃麦片400g赠50%水果坚果400g,好评,谢谢肖战代言让我知道了这个品牌，比我之前买的其他牌子都好吃，值得回购 ,-,-,2021-05-23
1473,向**6,口味: 酸奶果粒400g+小仙桃麦片400g赠烘焙水果400g,好评,第二次购买，很喜欢欧扎克的麦片，很好吃很脆很香，泡牛奶拌酸奶非常好吃。 ,-,-,2021-05-21
1474,土**司,口味: 酸奶果粒400g+小仙桃麦片400g赠50%水果坚果400g,好评,为战而来，吃完了补货，正好碰到直播，合算的很～ ,-,-,2021-05-18
1475,魅**5,口味: 酸奶果粒400g+小仙桃麦片400g赠烘焙水果400g,好评,试试吧 ,-,-,2021-05-21
1476,q**5,口味: 酸奶果粒400g+小仙桃麦片400g赠50%水果坚果400g,好评,挺好的第二次购买了，家人都喜欢吃，配酸奶牛奶都感吃,-,-,2021-05-19
1477,心**3,口味: 酸奶果粒400g+小仙桃麦片400g赠烘焙水果400g,好评,囤！ ,-,-,2021-05-27
1478,h**米,口味: 酸奶果粒400g+小仙桃麦片400g赠50%水果坚果400g,好评,一如既往的好吃，看到直播有优惠，下单 ,-,-,2021-05-15
1479,x**3,口味: 酸奶果粒400g+小仙桃麦片400g赠烘焙水果400g,好评,链接中的二个味道都还不错，送的那袋，口感就不行了！感觉只是凑数而已 ,-,-,2021-06-13
1480,黄**0,口味: 酸奶果粒400g+小仙桃麦片400g赠50%水果坚果400g,好评,很满意，就是不带个勺子，哪怕是塑料的也行啊！ ,-,-,2021-05-22
1481,h**7,口味: 酸奶果粒400g+小仙桃麦片400g赠烘焙水果400g,好评,挺喜欢的，通过代言人知道，第N次回购，已经安利给小姐妹了。,-,-,2021-05-20
1482,z**4,口味: 酸奶果粒400g+小仙桃麦片400g赠50%水果坚果400g,好评,味道很好，已经回购好几次了，每个味道都喜欢 ,-,-,2021-05-21
1483,桃**3,口味: 酸奶果粒400g+小仙桃麦片400g赠烘焙水果400g,好评,此用户没有填写评价。,一点都不好，雪梨直播间买的，简直就是没几个大果粒，也没几颗酸奶片,-,2021-06-12
1484,z**h,口味: 酸奶果粒400g*2赠50%水果坚果400g,好评,买了给外地的弟弟当早餐吃，百香果支持肖战代言。,-,-,2021-05-11
1485,0**0,口味: 酸奶果粒400g+小仙桃麦片400g赠50%水果坚果400g,好评,东西好便宜，赚信用很不错吗，呵呵，不错宝贝确实不错~,-,-,2021-05-22
1486,m**1,口味: 酸奶果粒400g+小仙桃麦片400g赠烘焙水果400g,好评,买过几次 这回直播间买是最划算的！,-,-,2021-05-20
1487,s**欣,口味: 酸奶果粒400g+小仙桃麦片400g赠烘焙水果400g,好评,直播间买的性价比很高 还没有吃应该不错 ,-,-,2021-05-22
1488,含**6,口味: 酸奶果粒400g+小仙桃麦片400g赠烘焙水果400g,好评,好吃。都是用牛奶泡着吃。我家娃天天都要吃，我用来当早餐吃。蛮饱腹得,-,-,2021-05-23
1489,z**9,口味: 酸奶果粒400g+小仙桃麦片400g赠烘焙水果400g,好评,好吃，孩子很喜欢里面的酸奶果粒，麦片也好吃。,-,-,2021-05-23
1490,戒**瑞,口味: 酸奶果粒400g+小仙桃麦片400g赠烘焙水果400g,好评,孩子特别喜欢，搭配牛奶特棒。,-,-,2021-05-23
1491,时**ぃ,口味: 酸奶果粒400g+小仙桃麦片400g赠50%水果坚果400g,好评,肖战粉丝小飞侠支持肖战代言，干吃非常好吃～我全当零食吃了哈哈哈哈哈哈 ,-,-,2021-05-19
1492,t**9,口味: 酸奶果粒400g+小仙桃麦片400g赠烘焙水果400g,好评,小孩子喜欢干吃，泡牛奶个人感觉太甜了,-,-,2021-05-25
1493,秋**贝,口味: 酸奶果粒400g+小仙桃麦片400g赠50%水果坚果400g,好评,好吃，战战代言的东西真的太棒，会继续支持 ,-,-,2021-05-19
1494,h**娇,口味: 酸奶果粒400g+小仙桃麦片400g赠烘焙水果400g,好评,做活动便宜很多，里面有坚果，酸奶块儿，水果干，饱腹感很强。 ,-,-,2021-05-23
1495,晓**a,口味: 酸奶果粒400g+小仙桃麦片400g赠烘焙水果400g,好评,第二次买了，味道很好，老妈也喜欢吃 ,-,-,2021-05-26
1496,w**h,口味: 酸奶果粒400g+小仙桃麦片400g赠50%水果坚果400g,好评,这个挺不错的，好吃！直播间买很合适！下次希望再有！ ,-,-,2021-05-15
1497,1**仔,口味: 酸奶果粒400g+小仙桃麦片400g赠烘焙水果400g,好评,肖战粉丝小飞侠支持肖战代言！买过很多次了，非常好吃！ ,-,-,2021-05-22
1498,刘**哦,口味: 酸奶果粒400g+小仙桃麦片400g赠烘焙水果400g,好评,回购，目前试的麦片中最爱吃的一种 ,-,-,2021-05-24
1499,顾**0,口味: 酸奶果粒400g+小仙桃麦片400g赠烘焙水果400g,好评,就是口味偏甜了点，很核算,-,-,2021-05-20
1500,9**x,口味: 酸奶果粒400g+小仙桃麦片400g赠烘焙水果400g,好评,爱了爱了。 很好吃～ 没有泡酸奶也好吃～ 战战代言的必须入手～ 哈哈哈哈～ 比心比心～,-,-,2021-05-21
1501,t**3,口味: 酸奶果粒400g+小仙桃麦片400g赠50%水果坚果400g,好评,先吃了仙桃的，好吃，不管是不是香精味，桃子味道很浓，会回购这款。 ,-,-,2021-06-22
1502,x**h,口味: 酸奶果粒400g+小仙桃麦片400g赠50%水果坚果400g,好评,非常好吃 直播间买性价比超高 ,-,-,2021-05-13
1503,安**2,口味: 酸奶果粒400g+小仙桃麦片400g赠烘焙水果400g,好评,口感味道：好吃好吃 有冻干酸奶粒 百香果为肖战而来～ ,-,-,2021-05-19
1504,孙**8,口味: 酸奶果粒400g+小仙桃麦片400g赠烘焙水果400g,好评,划算，泡牛奶泡酸奶都好吃 ,-,-,2021-05-21
1505,l**4,口味: 酸奶果粒400g+小仙桃麦片400g赠50%水果坚果400g,好评,第一感觉就是很好吃，麦片都很有口感，以后还会回购 ,-,-,2021-05-18
1506,p**7,口味: 酸奶果粒400g+小仙桃麦片400g赠烘焙水果400g,好评,味道很好，价格合适 ,-,-,2021-05-20
1507,e**9,口味: 酸奶果粒400g+小仙桃麦片400g赠烘焙水果400g,好评,第二次购买了，当然是因为好吃。下次换换海盐口味的。,-,-,2021-05-20
1508,西**界,口味: 酸奶果粒400g+小仙桃麦片400g赠50%水果坚果400g,好评,回购了好多次了，超爱泡牛奶吃，支持战哥斯拉,-,-,2021-05-20
1509,w**2,口味: 酸奶果粒400g+小仙桃麦片400g赠50%水果坚果400g,好评,直播买的，60多3包，便宜,-,-,2021-05-11
1510,玲**9,口味: 酸奶果粒400g+小仙桃麦片400g赠烘焙水果400g,好评, 非常好吃，已经推荐给同事！,-,-,2021-05-21
1511,赖**打,口味: 酸奶果粒400g+小仙桃麦片400g赠50%水果坚果400g,好评,好吃！一有活动就囤货！！百香果支持代言人肖战！！！ ,-,-,2021-05-11
1512,h**5,口味: 酸奶果粒400g+小仙桃麦片400g赠50%水果坚果400g,好评,回购很多次了，我认为是市面上最好吃的麦片 ,-,-,2021-05-26
1513,t**9,口味: 酸奶果粒400g+小仙桃麦片400g赠烘焙水果400g,好评,欧扎克针不戳，爱了爱了肖战粉丝小飞侠支持战战代言吖。,-,-,2021-05-20
1514,s**头,口味: 酸奶果粒400g+小仙桃麦片400g赠50%水果坚果400g,好评,不喜欢里面的椰片，其他还行,-,-,2021-06-10
1515,砂**酱,口味: 酸奶果粒400g+小仙桃麦片400g赠50%水果坚果400g,好评,第二次买了，划算…… ,-,-,2021-05-17
1516,无**9,口味: 酸奶果粒400g+小仙桃麦片400g赠50%水果坚果400g,好评,实惠又好吃,-,-,2021-05-19
1517,断**逝,口味: 酸奶果粒400g+小仙桃麦片400g赠50%水果坚果400g,好评,巨好吃，推荐小仙桃。肖战粉丝小飞侠支持肖战代言 ,-,-,2021-05-19
1518,r**开,口味: 酸奶果粒400g*2赠50%水果坚果400g,好评,直播间买的，价钱实惠，味道和超市一样正品！！ ,-,-,2021-04-15
1519,k**a,口味: 酸奶果粒400g+小仙桃麦片400g赠烘焙水果400g,好评,水果妹百香果支持肖战哥哥啦 ,-,-,2021-05-23
1520,1**凯,口味: 酸奶果粒400g*2赠50%水果坚果400g,好评,包装设计的很漂亮，高大上，很好看，里面的量很足，酸奶块和水果块也很大，大人小孩儿都喜欢吃，每天早上起来泡一碗非常不错，健康又营养，以后还会回购，希望商家一直保持这样的质量，做一个良心的商家，支持辛巴 ,-,-,2021-04-17
1521,米**0,口味: 酸奶果粒400g+小仙桃麦片400g赠50%水果坚果400g,好评,早上牛奶➕欧扎克完全够了……我爱肖战！ ,-,-,2021-05-10
1522,t**0,口味: 酸奶果粒400g+小仙桃麦片400g赠烘焙水果400g,好评,直播间买的蛮划算的,-,-,2021-06-18
1523,q**6,口味: 酸奶果粒400g+小仙桃麦片400g赠50%水果坚果400g,好评,不错，好吃！娃天天弄杯酸奶泡泡，爱吃的很,-,-,2021-05-14
1524,西**界,口味: 酸奶果粒400g+小仙桃麦片400g赠50%水果坚果400g,好评,回购了好多次了，超爱泡牛奶吃，支持战哥,-,-,2021-05-20
1525,c**i,口味: 酸奶果粒400g+小仙桃麦片400g赠烘焙水果400g,好评,非常可口美味！！因为战战认识了这个品牌，会一直购买哦！！为战而来，战放实力！ ,-,-,2021-05-24
1526,好**3,口味: 酸奶果粒400g+小仙桃麦片400g赠50%水果坚果400g,好评,好好吃呀！我每天下午不吃饭，酸奶泡麦片减肥。,-,-,2021-05-20
1527,w**4,口味: 酸奶果粒400g+小仙桃麦片400g赠50%水果坚果400g,好评,很好吃！甜度适中，香，脆，泡牛奶泡椰汁都狠好吃 ,-,-,2021-05-21
1528,小**天,口味: 酸奶果粒400g+小仙桃麦片400g赠50%水果坚果400g,好评,挺好吃的，最主要的是坚果都没有不好的味道。,-,-,2021-06-07
1529,顺**帆,口味: 酸奶果粒400g+小仙桃麦片400g赠烘焙水果400g,好评,啦啦啦啦，又来啦，吃了又买一波，好吃😊，支持肖战，支持欧扎克,-,-,2021-05-21
1530,e**0,口味: 酸奶果粒400g+小仙桃麦片400g赠50%水果坚果400g,好评,小飞侠支持肖战代言 小欧大卖 小赞顺顺利利♥ ,-,-,2021-05-23
1531,t**7,口味: 酸奶果粒400g+小仙桃麦片400g赠50%水果坚果400g,好评,喜欢欧扎克麦片，持续回购，支持肖战代言！,-,-,2021-06-22
1532,0**0,口味: 酸奶果粒400g+小仙桃麦片400g赠烘焙水果400g,好评,超级好吃，配牛奶🥛酸奶或者直接吃都很棒 ,-,-,2021-05-21
1533,彼**0,口味: 酸奶果粒400g*2赠50%水果坚果400g,好评,此用户没有填写评价。,买了好多次了，宝宝也爱吃,-,2021-04-29
1534,s**1,口味: 酸奶果粒400g+小仙桃麦片400g赠50%水果坚果400g,好评,肖战的小飞侠来评论，欧扎克超好吃，吃了还想吃。 ,-,-,2021-05-11
1535,3**m,口味: 酸奶果粒400g+小仙桃麦片400g赠50%水果坚果400g,好评,欧扎克我很喜欢吃～记得也是唐嫣代言的～ ,-,-,2021-05-17
1536,t**8,口味: 酸奶果粒400g+小仙桃麦片400g赠烘焙水果400g,好评,第二次在雪梨直播间买了，很好👍吃。,-,-,2021-05-22
1537,大**d,口味: 酸奶果粒400g+小仙桃麦片400g赠50%水果坚果400g,好评,好好吃 干吃泡牛奶拌酸奶都好吃 水果块和酸奶块都挺多的,-,-,2021-05-18
1538,金**娘,口味: 酸奶果粒400g+小仙桃麦片400g赠50%水果坚果400g,好评,小飞侠觉得很好吃，支持肖战，支持欧扎克 ,-,-,2021-05-12
1539,琳**2,口味: 酸奶果粒400g+小仙桃麦片400g赠烘焙水果400g,好评,非常好吃，很香脆，是我吃过最美味的麦片。 ,-,-,2021-05-22
1540,t**9,口味: 酸奶果粒400g*2赠可可坚果400g,好评,此用户没有填写评价。,姑娘爱吃，还会回购,-,2021-03-24
1541,喔**目,口味: 酸奶果粒400g+小仙桃麦片400g赠烘焙水果400g,好评,非常好吃，宝宝很喜欢吃,-,-,2021-05-21
1542,l**佳,口味: 酸奶果粒400g+小仙桃麦片400g赠50%水果坚果400g,好评,划算好吃,-,-,2021-05-11
1543,天**e,口味: 酸奶果粒400g+小仙桃麦片400g赠50%水果坚果400g,好评,肖战粉丝小飞侠支持代言人肖战支持欧扎克！,-,-,2021-05-12
1544,满**x,口味: 酸奶果粒400g+小仙桃麦片400g赠烘焙水果400g,好评,活动划算 ,-,-,2021-05-21
1545,c**n,口味: 酸奶果粒400g+小仙桃麦片400g赠50%水果坚果400g,好评,冲代言人买的，但真的很好吃哦，二次购买了,-,-,2021-05-17
1546,x**1,口味: 酸奶果粒400g+小仙桃麦片400g赠50%水果坚果400g,好评,最爱酸奶果粒,-,-,2021-05-24
1547,n**6,口味: 酸奶果粒400g+小仙桃麦片400g赠烘焙水果400g,好评,小仙桃比较好吃～水果燕麦片，燕麦片太多,-,-,2021-05-26
1548,笨**吖,口味: 酸奶果粒400g+小仙桃麦片400g赠烘焙水果400g,好评,挺好的，早晨拌酸奶当早餐吃，很方便。 ,早餐吃，火龙果 酸奶 麦片，很不错。,-,2021-05-26
1549,w**x,口味: 酸奶果粒400g+小仙桃麦片400g赠烘焙水果400g,好评,好吃，冲着肖战代言买的，果然很不错。 ,-,-,2021-06-22
1550,j**4,口味: 酸奶果粒400g+小仙桃麦片400g赠50%水果坚果400g,好评,不错孩子很爱吃 ,-,-,2021-05-19
1551,8**d,口味: 酸奶果粒400g+小仙桃麦片400g赠烘焙水果400g,好评,大人小孩都喜欢吃,-,-,2021-05-23
1552,j**3,口味: 酸奶果粒400g+小仙桃麦片400g赠烘焙水果400g,好评,可以当小零食的麦片，每款都还吃 ,-,-,2021-05-25
1553,于**3,口味: 酸奶果粒400g*2赠可可坚果400g,好评,此用户没有填写评价。,比其他品牌的好吃很多！尤其是可可味的，超好吃,-,2021-03-24
1554,致**n,口味: 酸奶果粒400g+小仙桃麦片400g赠烘焙水果400g,好评,这个品牌蛮好吃的 ，我比较喜欢的口味 ,-,-,2021-05-24
1555,f**1,口味: 酸奶果粒400g+小仙桃麦片400g赠50%水果坚果400g,好评,雪梨直播间买的比较划算，看评论有说里面果粒少的，开始还有些犹豫，收到货后发现真的料足，会回购。战战代言的还是很良心的👍图片是苹果手机自带相机拍出的原图没有加任何滤镜，光线不同，供后面的买家参考。 ,-,-,2021-05-03
1556,一**4,口味: 酸奶果粒400g+小仙桃麦片400g赠50%水果坚果400g,好评,此用户没有填写评价。,肖战粉丝为战而来哦⊙∀⊙！支持代言人肖战！！,-,2021-05-18
1557,j**7,口味: 酸奶果粒400g+小仙桃麦片400g赠50%水果坚果400g,好评,小飞侠的最爱,-,-,2021-05-12
1558,七**刺,口味: 酸奶果粒400g+小仙桃麦片400g赠50%水果坚果400g,好评,好吃，每次直播时候都囤点货 ,-,-,2021-05-19
1559,白**9,口味: 酸奶果粒400g+小仙桃麦片400g赠烘焙水果400g,好评,多次购买这个牌子，味道不错,-,-,2021-05-22
1560,李**5,口味: 酸奶果粒400g+小仙桃麦片400g赠50%水果坚果400g,好评,第一次买，拌酸奶真的超级好吃！,-,-,2021-05-25
1561,t**1,口味: 酸奶果粒400g+小仙桃麦片400g赠烘焙水果400g,好评,欧扎克的这个口感一直挺好的，挺喜欢的 ,-,-,2021-05-24
1562,t**7,口味: 酸奶果粒400g*2赠50%水果坚果400g,好评,尝了尝，很好吃！脆脆的，放心购买！,-,-,2021-06-22
1563,溺**2,口味: 酸奶果粒400g+小仙桃麦片400g赠烘焙水果400g,好评,送货很快，麦片好吃，代言人肖战很好，继续支持！,-,-,2021-05-26
1564,刘**年,口味: 酸奶果粒400g+小仙桃麦片400g赠烘焙水果400g,好评,孩子很喜欢吃。,-,-,2021-05-27
1565,w**丢,口味: 酸奶果粒400g+小仙桃麦片400g赠烘焙水果400g,好评,量足，好吃 ,-,-,2021-05-21
1566,不**6,口味: 酸奶果粒400g+小仙桃麦片400g赠50%水果坚果400g,好评,支持战战代言，一家人都爱吃,-,-,2021-05-19
1567,0**o,口味: 酸奶果粒400g+小仙桃麦片400g赠烘焙水果400g,好评,肖战代言的麦片，直播间购买，好吃,-,-,2021-05-20
1568,l**j,口味: 酸奶果粒400g+小仙桃麦片400g赠烘焙水果400g,好评,味道不错，但是好像买多了😂 ,-,-,2021-06-05
1569,王**y,口味: 酸奶果粒400g+小仙桃麦片400g赠烘焙水果400g,好评,11月份送到的呢大衣，冬天才穿，6个月时间没穿几次客服说时间太久了，不处理，不退换。这衣服还没洗过明显就是面料质量差，着色处理有问题导致氧化大面积掉色。客服重复反馈和他们没关系雪梨衣服没有保期的，他们不负责不退换这就是处理结果。关键客服当没事人还发微笑表情表示无所谓。这事没完，总有渠道平台能好好处理。  ,-,-,2021-05-30
1570,哈**忙,口味: 酸奶果粒400g+小仙桃麦片400g赠50%水果坚果400g,好评,酸奶口味最好吃小仙桃太甜了,-,-,2021-05-14
1571,圣**1,口味: 酸奶果粒400g+小仙桃麦片400g赠烘焙水果400g,好评,第二次给老公买，性价比高。,-,-,2021-05-22
1572,h**点,口味: 酸奶果粒400g+小仙桃麦片400g赠烘焙水果400g,好评,回购的，好吃😋！肖战粉丝小飞侠！,-,-,2021-05-23
1573,o**w,口味: 酸奶果粒400g+小仙桃麦片400g赠烘焙水果400g,好评,博君一肖支持肖战 麦片很好吃 ,-,-,2021-05-24
1574,n**a,口味: 酸奶果粒400g+小仙桃麦片400g赠烘焙水果400g,好评,麦片很好吃，小飞侠支持肖战,-,-,2021-05-26
1575,q**2,口味: 酸奶果粒400g+小仙桃麦片400g赠50%水果坚果400g,好评,东西很不错 ,-,-,2021-05-20
1576,盼**4,口味: 酸奶果粒400g+小仙桃麦片400g赠烘焙水果400g,好评,囤了好几袋了，干吃麦片只吃欧扎克 ,-,-,2021-05-19
1577,j**儿,口味: 酸奶果粒400g+小仙桃麦片400g赠烘焙水果400g,好评,酸奶麦片没酸奶，买过最坑的麦片，没有之一 ,-,-,2021-06-10
1578,潘**h,口味: 酸奶果粒400g+小仙桃麦片400g赠50%水果坚果400g,好评,吃过才来评价，雪梨直播购买，价格优惠，麦片很好吃呀，料很多～ ,-,-,2021-05-15
1579,移**网,口味: 酸奶果粒400g+小仙桃麦片400g赠烘焙水果400g,好评,又一次购买了，全5分好评。 ,-,-,2021-05-20
1580,漂**馆,口味: 酸奶果粒400g+小仙桃麦片400g赠50%水果坚果400g,好评,买过很多次啦，棒棒哒，爱吃,-,-,2021-05-13
1581,s**t,口味: 酸奶果粒400g+小仙桃麦片400g赠50%水果坚果400g,好评,味道一般 ,-,-,2021-06-06
1582,f**y,口味: 酸奶果粒400g+小仙桃麦片400g赠烘焙水果400g,好评,支持肖战哦，口感脆脆的，好吃推荐 ,-,-,2021-05-26
1583,t**7,口味: 酸奶果粒400g+小仙桃麦片400g赠烘焙水果400g,好评,很好吃，口味也是喜欢的很满意,-,-,2021-06-22
