1460,四**三,食品口味: 【新货特大颗粒】：1斤（250g*2包）（掌柜推荐）,好评,特大果个头挺大，大果小了点。特意买了两种对比一下。口感都不错。 ,-,-,2021-05-22
1461,w**5,食品口味: 【新货大颗粒】：2斤（250g*4包）,好评,回头客了，好,-,-,2021-06-02
1462,冰**伊,食品口味: 【新货特大颗粒】：2斤（250g*4包）（掌柜推荐）,好评,包装品质：包装非常好，每一袋都很完好 商品分量：份量很足，每一粒都是大大的 保质期：日期是4.30生产的，保质期半年 口感味道：非常好吃，同事们都很喜欢。 以后会在回购的。 ,-,-,2021-05-14
1463,晶**芯,食品口味: 【新货大颗粒】：1斤（250g*2包）,好评,不错，挺好的，很香，好吃，还会回购,-,-,2021-05-28
1464,凤**山,食品口味: 【新货特大颗粒】：1斤（250g*2包）（掌柜推荐）,好评,物美价廉！第二次购买。,-,-,2021-06-03
1465,t**4,食品口味: 【新货大颗粒】：2斤（250g*4包）,好评,好吃！回购！ ,-,-,2021-06-21
1466,d**1,食品口味: 【新货大颗粒】：1斤（250g*2包）,好评,不错 挺好的 ,-,-,2021-06-08
1467,s**3,食品口味: 【新货特大颗粒】【大包装】：2斤*1大包,好评,好吃，回购的,-,-,2021-06-07
1468,t**5,食品口味: 【新货大颗粒】：2斤（250g*4包）,好评,干净脆爽！,-,-,2021-06-26
1469,l**2,食品口味: 【体验装大颗粒】：250g*1包,好评,腰果收到了，物流很快，果子也很好吃 ,-,-,2021-06-04
1470,深**7,食品口味: 【新货大颗粒】：1斤（250g*2包）,好评,宝贝收到了，好几次购买了，不错 ,-,-,2021-06-07
1471,韩**5,食品口味: 【新货特大颗粒】：1斤（250g*2包）（掌柜推荐）,好评,宝贝收到了，很喜欢，第三次买了,-,-,2021-06-06
1472,a**6,食品口味: 【新货特大颗粒】：2斤（250g*4包）（掌柜推荐）,好评,腰果饱满,-,-,2021-05-25
1473,l**铭,食品口味: 【新货特大颗粒】：2斤（250g*4包）（掌柜推荐）,好评,收到好吃,-,-,2021-06-04
1474,我**9,食品口味: 【新货大颗粒】：1斤（250g*2包）,好评,非常好👍 ,-,-,2021-06-03
1475,x**a,食品口味: 【新货大颗粒】：1斤（250g*2包）,好评,此用户没有填写评价。,确实不错，,-,2021-06-15
1476,百**h,食品口味: 【新货大颗粒】：1斤（250g*2包）,好评,这个好吃,-,-,2021-06-01
1477,西**1,食品口味: 【新货大颗粒】：1斤（250g*2包）,好评,好吃，整颗,-,-,2021-06-04
1478,t**6,食品口味: 【新货大颗粒】：1斤（250g*2包）,好评,特别好 性价比超级超级高 很棒 便宜东西又很好 喜欢   ,-,-,2021-06-21
1479,马**泉,食品口味: 【新货大颗粒】：1斤（250g*2包）,好评,好吃不贵，都是新鲜果子，个头也很大，吃完回购！ ,-,-,2021-05-23
1480,靳**十,食品口味: 【新货特大颗粒】：1斤（250g*2包）（掌柜推荐）,好评,此带皮腰果味美特别香，食用对身有益，请中老朋友们，不要忘了这有益健康长寿美食。 ,-,-,2021-05-11
1481,星**5,食品口味: 【新货大颗粒】：1斤（250g*2包）,好评,货收到了，很好吃，发货速度快，下次还会购买 ,-,-,2021-06-06
1482,十**8,食品口味: 【新货大颗粒】：1斤（250g*2包）,好评,一如既往的好，值得购买！ ,-,-,2021-06-02
1483,t**0,食品口味: 【体验装大颗粒】：250g*1包,好评,没有上次的好了,-,-,2021-06-19
1484,m**9,食品口味: 【新货大颗粒】：1斤（250g*2包）,好评,质量很好，非常满意，好评。,-,-,2021-06-08
1485,暖**4,食品口味: 【新货特大颗粒】：1斤（250g*2包）（掌柜推荐）,好评,吃了还会再买的食品,-,-,2021-06-04
1486,w**1,食品口味: 【新货大颗粒】：1斤（250g*2包）,好评,好吃，好靓，好大，好评！,-,-,2021-06-03
1487,橄**7,食品口味: 【新货特大颗粒】：1斤（250g*2包）（掌柜推荐）,好评,宝贝收到，物流很快，全五星好评！！！,-,-,2021-06-07
1488,c**2,食品口味: 【新货特大颗粒】：2斤（250g*4包）（掌柜推荐）,好评,挺好的。一直在这里买。,-,-,2021-06-23
1489,t**9,食品口味: 【新货大颗粒】：2斤（250g*4包）,好评,第二次买了。 ,-,-,2021-06-22
1490,桃**4,食品口味: 【新货大颗粒】：2斤（250g*4包）,好评,买了好多次了,-,-,2021-06-08
1491,l**仔,食品口味: 【新货特大颗粒】【大包装】：2斤*1大包,好评,  果仁香脆，棵粒够大，非常满意，已经第三次购买，赞赞赞👍👍👍 ,-,-,2021-05-23
1492,t**4,食品口味: 【体验装大颗粒】：250g*1包,好评,已经多次购买，物有所值，不错,-,-,2021-06-21
1493,t**1,食品口味: 【新货特大颗粒】【大包装】：2斤*1大包,好评,大杏仁真的很大，也没有碎的，口感也很好。还有腰果个头也非常大，口感很棒，店家也很好，五星好评值得推荐。,-,-,2021-06-22
1494,n**0,食品口味: 【新货特大颗粒】：1斤（250g*2包）（掌柜推荐）,好评,昨天拍今天就到了.独立包装好评味道也很不错.会继续回购的.,-,-,2021-05-27
1495,w**9,食品口味: 【新货特大颗粒】：1斤（250g*2包）（掌柜推荐）,好评,非常好，物有所值！,-,-,2021-05-31
1496,我**颖,食品口味: 【新货大颗粒】：1斤（250g*2包）,好评,已经是第二回购买了！ 坚果的品质挺好的，挺新鲜的。 上次吃挺好，然后这次回购的。,-,-,2021-05-27
1497,豆**6,食品口味: 【新货特大颗粒】：1斤（250g*2包）（掌柜推荐）,好评,老客户了,-,-,2021-06-18
1498,四**3,食品口味: 【新货大颗粒】：1斤（250g*2包）,好评,脆脆的，个头挺大，皮和果实很容易分离。快递包装也很好，很完整。吃完会回购的。包装品质：质量非常好，已经回购多次，价格也便宜，果仁新鲜又颗粒大。价格又不贵，全家人都喜欢吃。还会继续买的！ ,保质期：新鲜日期，最近生产 新鲜度：酥脆可口，宝宝大人都爱吃，推荐朋友都来买 口感味道：香甜美味,-,2021-03-17
1499,张**6,食品口味: 【体验装大颗粒】：250g*1包,好评,第二次购买了，很不错 ,-,-,2021-06-08
1500,s**9,食品口味: 【体验装大颗粒】：250g*1包,好评,不错，很脆，好吃,-,-,2021-06-06
1501,张**1,食品口味: 【新货大颗粒】：2斤（250g*4包）,好评,一点都不脆 ,-,-,2021-06-16
1502,上**7,食品口味: 【新货特大颗粒】：2斤（250g*4包）（掌柜推荐）,好评,货真价实才是真的好，个头大味道不错！整真心值得好评！,-,-,2021-05-21
1503,淘**街,食品口味: 【新货特大颗粒】：1斤（250g*2包）（掌柜推荐）,好评,特大的一颗颗腰果仁，香脆好吃，份量足干净。 ,-,-,2021-05-27
1504,9**y,食品口味: 【新货特大颗粒】：1斤（250g*2包）（掌柜推荐）,好评,订单写着焗盐口味，吃到嘴里一点味道都没有，什么味道都没有，不好吃，~~大家千万别买，不要上当，太贵了，不值得买。,-,-,2021-06-06
1505,t**3,食品口味: 【新货特大颗粒】：1斤（250g*2包）（掌柜推荐）,好评,腰果比其它店买的个头大很多，味道不错，值得推荐。 ,-,-,2021-05-16
1506,帅**衣,食品口味: 【新货特大颗粒】：1斤（250g*2包）（掌柜推荐）,好评,第三次买他家的东西了，腰果味道特别好吃，干干催催的。其他的等吃了再评论。,-,-,2021-06-12
1507,d**0,食品口味: 【新货大颗粒】：1斤（250g*2包）,好评,和卖家介绍的一致，发货很快。半斤一袋的独立包装，没有破损，封袋完好。买了一斤腰果，一斤开心果，果粒完整，还没发现坏的。以后还会光顾的5分！ ,-,-,2021-05-23
1508,t**7,食品口味: 【新货大颗粒】：1斤（250g*2包）,好评,客服态度非常好,-,-,2021-06-22
1509,t**8,食品口味: 【新货特大颗粒】：1斤（250g*2包）（掌柜推荐）,好评,活动买的便宜10%划算，买腰果贵店是首选，货真价实，信得过产品👍 ,-,-,2021-06-23
1510,l**2,食品口味: 【新货特大颗粒】：2斤（250g*4包）（掌柜推荐）,好评,好吃，不错，值得购买。,-,-,2021-05-28
1511,t**4,食品口味: 【新货特大颗粒】：2斤（250g*4包）（掌柜推荐）,好评,挺好的，个大，挺脆的,-,-,2021-06-21
1512,j**8,食品口味: 【新货大颗粒】：2斤（250g*4包）,好评,一直在买,-,-,2021-06-03
1513,罗**8,食品口味: 【新货大颗粒】：1斤（250g*2包）,好评,一个字，值 ,-,-,2021-05-30
1514,t**0,食品口味: 【新货特大颗粒】：1斤（250g*2包）（掌柜推荐）,好评,东西不错，完全炒熟的腰果皮是可以吃的！下次还来～ ,-,-,2021-06-19
1515,墨**香,食品口味: 【新货大颗粒】：1斤（250g*2包）,好评,质量不错，多次购买了，满意。 ,-,-,2021-05-08
1516,f**m,食品口味: 【新货特大颗粒】：1斤（250g*2包）（掌柜推荐）,好评,腰果的颗粒很大，皮也很容易剥，味道也不错 ,-,-,2021-05-24
1517,x**1,食品口味: 【新货大颗粒】：1斤（250g*2包）,好评,包装品质：正规产品包装 商品分量：足斤 保质期：近期 新鲜度：各色蔬菜搭配鲜亮 口感味道：脆鲜，好吃 ,-,-,2021-05-19
1518,王**凹,食品口味: 【体验装大颗粒】：250g*1包,好评,饱满大颗，新鲜好吃。味道也合适。 ,-,-,2021-05-23
1519,h**1,食品口味: 【新货大颗粒】：1斤（250g*2包）,好评,第三次买了，很好,-,-,2021-06-06
1520,关**2,食品口味: 【新货大颗粒】：1斤（250g*2包）,好评,第二次买了，不错,-,-,2021-06-05
1521,h**8,食品口味: 【体验装大颗粒】：250g*1包,好评,腰果挺脆的，原味，日期很新鲜！满意！ ,-,-,2021-06-22
1522,l**8,食品口味: 【新货大颗粒】：1斤（250g*2包）,好评,腰果肯定不是今年的，好多坏的，请大家下单注意吧,另一袋也是很多坏的，请大家注意下单,-,2021-06-10
1523,t**0,食品口味: 【新货大颗粒】：1斤（250g*2包）,好评,多次购买，值得购买,-,-,2021-06-19
1524,杨**杭,食品口味: 【新货特大颗粒】：1斤（250g*2包）（掌柜推荐）,好评,挺大！不错！,-,-,2021-06-19
1525,c**1,食品口味: 【新货大颗粒】：1斤（250g*2包）,好评,还可以了，物有所值 ,-,-,2021-05-31
1526,z**5,食品口味: 【新货特大颗粒】：1斤（250g*2包）（掌柜推荐）,好评,物美价廉，好吃😋,-,-,2021-06-06
1527,d**哇,食品口味: 【新货大颗粒】：2斤（250g*4包）,好评,老买主了 ,-,-,2021-06-16
1528,t**0,食品口味: 【新货特大颗粒】：2斤（250g*4包）（掌柜推荐）,好评,挺好的，吃完了会再买 ,-,-,2021-06-19
1529,张**4,食品口味: 【新货特大颗粒】：1斤（250g*2包）（掌柜推荐）,好评,这个腰果真的很好吃，个头大，颗粒饱满。孩子吃的特别脆。包装非常完整。腰果颗粒大小比较均匀。味道特别好。没有油腻的味道。包装完整，分量十足。口感香脆。店家发货快。给儿子吃正好。补充多种维生素。值得回购。 ,特别好吃，物美价廉，一定会回购的,-,2021-04-15
1530,李**2,食品口味: 【新货特大颗粒】：1斤（250g*2包）（掌柜推荐）,好评,包装品质：包装严实 商品分量：分量够，颗粒大，饱满 口感味道：口感很好 拿回来就拆开吃了，家人都爱吃，已经无数次回购了，值得信赖 ,-,-,2021-05-22
1531,8**3,食品口味: 【新货大颗粒】：1斤（250g*2包）,好评,味道纯正，商品个个饱满，包装精美，价钱实惠。,-,-,2021-05-18
1532,吴**比,食品口味: 【新货大颗粒】：1斤（250g*2包）,好评,腰果很大一个，味道很好吃，分量很足，物流也很快，之前买过一次，来回购啦， ,-,-,2021-05-27
1533,陈**9,食品口味: 【新货大颗粒】：1斤（250g*2包）,好评,我刻意没有马上评价。开吃后：1，全部已经褐变，个别坏的。不新鲜。2，个人认为果型不属于大果。而且混有许多小小果。我在不同平台买了好几次，都是这样。今年不再买带皮腰果了。,-,-,2021-06-13
1534,仝**慧,食品口味: 【新货大颗粒】：2斤（250g*4包）,好评,很好，还会回购 ,-,-,2021-06-07
1535,未**5,食品口味: 【新货特大颗粒】【大包装】：2斤*1大包,好评,多次回购坚果了，每天适当补充，非常满意，性价比超高！ ,-,-,2021-05-16
1536,t**0,食品口味: 【新货特大颗粒】：2斤（250g*4包）（掌柜推荐）,好评,每日**老板玩套路，良心给🐶吃了。我买的是特大颗粒腰果仁二斤，你发二包便宜的混合果仁什么意思，里面葡萄干什么的我血糖高，扔大街没人要啊。 端午节，过年过节的，一大堆朋友家人等特大腰果仁，等来每日时光寄过来的便宜葡萄干混合果仁，叫我情何以堪！,我买的特大二包颗粒腰果仁，你发葡萄干之流混合果仁，你萝卜当人参卖啊。这个端午节特别不开心，每果si光！良心大大的坏！,-,2021-06-19
1537,y**程,食品口味: 【新货大颗粒】：1斤（250g*2包）,好评,包装品质：好 商品分量：足 保质期：好 新鲜度：好 ,-,-,2021-05-17
1538,王**6,食品口味: 【新货特大颗粒】：2斤（250g*4包）（掌柜推荐）,好评,口感不错，新鲜没陈味，与上次买的感觉一样，足够分量个大饱满，发货物流都挺快的，包装严实，开袋方便，直接买没皮的担心污染 ,-,-,2021-05-26
1539,牛**v,食品口味: 【新货特大颗粒】：1斤（250g*2包）（掌柜推荐）,好评,真的很好吃，没有坏果，就是吃的太快了两天一袋没了。 ,-,-,2021-05-13
1540,刘**9,食品口味: 【新货特大颗粒】：1斤（250g*2包）（掌柜推荐）,好评,好吃，很实惠,-,-,2021-05-29
1541,t**8,食品口味: 【新货特大颗粒】：1斤（250g*2包）（掌柜推荐）,好评,我真的无语了，买个两袋没多少就不说了，一吃一个坏，嘴巴都是臭的，可恶心*我了，差评！,-,-,2021-06-23
1542,舒**9,食品口味: 【新货大颗粒】：1斤（250g*2包）,好评,收到了，还可以,-,-,2021-06-08
1543,f**8,食品口味: 【新货特大颗粒】：2斤（250g*4包）（掌柜推荐）,好评,很好！继续买买买,-,-,2021-06-06
1544,完**d,食品口味: 【新货大颗粒】：2斤（250g*4包）,好评,腰果不大，有点儿碎，味道还行。 ,-,-,2021-06-09
1545,虎**子,食品口味: 【新货大颗粒】：2斤（250g*4包）,好评,买了好几次，这次不好，大小不一，碎的太多，还有坏的 ,-,-,2021-06-11
1546,川**丹,食品口味: 【新货特大颗粒】：1斤（250g*2包）（掌柜推荐）,好评,好吃，个头也很大 就是吃上停不下来，哎！又要长胖了 ,-,-,2021-05-21
1547,丰**果,食品口味: 【新货大颗粒】：1斤（250g*2包）,好评,味道好吃，颗粒饱满，孩子大人都很喜欢,-,-,2021-05-24
1548,w**h,食品口味: 【新货大颗粒】：1斤（250g*2包）,好评,质量不错，口感新香脆，第二次买了。 ,-,-,2021-05-16
1549,t**2,食品口味: 【新货特大颗粒】：2斤（250g*4包）（掌柜推荐）,好评,"收到,很好.",-,-,2021-06-06
1550,a**1,食品口味: 【新货特大颗粒】：1斤（250g*2包）（掌柜推荐）,好评,不够爽脆，入烤箱烤一下试试 ,-,-,2021-06-08
1551,w**明,食品口味: 【新货特大颗粒】【大包装】：2斤*1大包,好评,新鲜无异味，非常好吃,-,-,2021-05-18
1552,巫**伊,食品口味: 【体验装大颗粒】：250g*1包,好评,吃过了来评价，口感好，很香，腰果也不小。 ,-,-,2021-05-22
1553,山**1,食品口味: 【新货特大颗粒】：2斤（250g*4包）（掌柜推荐）,好评,这也是第二次购买了，腰果非常好，个儿大脆还新鲜。物流也非常快。 ,-,-,2021-05-16
1554,t**5,食品口味: 【新货特大颗粒】：2斤（250g*4包）（掌柜推荐）,好评,新鲜度：生产日期，连着购买了两次，确实不错 ,-,-,2021-06-26
1555,y**9,食品口味: 【新货特大颗粒】：2斤（250g*4包）（掌柜推荐）,好评,不是很脆 整体还可以 果挺大的 基本没有碎的 ,-,-,2021-06-06
1556,w**4,食品口味: 【新货大颗粒】：2斤（250g*4包）,好评,大腰果比特大的还是小很多的，也买了两斤！ ,-,-,2021-06-09
1557,星**闫,食品口味: 【新货特大颗粒】：1斤（250g*2包）（掌柜推荐）,好评,脆脆的，个头挺大，皮和果实很容易分离。快递包装也很好，很完整。吃完会回购的。包装品质：质量非常好，已经回购多次，价格也便宜，果仁新鲜又颗粒大。价格又不贵，全家人都喜欢吃。还会继续买的！  ,很好吃的，一直在他家买坚果吃，颗粒饱满，好吃😄，推荐大家购买,-,2021-04-09
1558,红**8,食品口味: 【新货特大颗粒】：2斤（250g*4包）（掌柜推荐）,好评,第二次买，大颗粒，味道也挺好。 ,-,-,2021-05-20
1559,花**霞,食品口味: 【新货特大颗粒】：2斤（250g*4包）（掌柜推荐）,好评,包装好分量足味道香,-,-,2021-05-20
1560,罗**4,食品口味: 【新货特大颗粒】：2斤（250g*4包）（掌柜推荐）,好评,颗粒很大，口感也很好，值得回购。 ,-,-,2021-05-17
1561,武**吊,食品口味: 【新货特大颗粒】：1斤（250g*2包）（掌柜推荐）,好评,坏果占两三层 皮特别特别难剥 这么多年头一次差评 真的不行 不信你就试试 绝对不买下一次 恶心人,-,-,2021-06-05
1562,铃**8,食品口味: 【新货特大颗粒】【大包装】：2斤*1大包,好评,在这家买过好几次了，这次的稍微小点，味道还可以。 ,-,-,2021-06-07
1563,陡**动,食品口味: 【新货特大颗粒】：1斤（250g*2包）（掌柜推荐）,好评,香脆可口，淡淡盐焗，口感更加好。 ,-,-,2021-05-14
1564,a**z,食品口味: 【新货特大颗粒】：2斤（250g*4包）（掌柜推荐）,好评,带皮大腰果不能买，里面有许多发霉的，花钱是小事，把人吃坏了咋办，希望商家重视质量，保证品质。现在的顾客最喜欢买高品质的东西，而不是低品质的便宜货。,-,-,2021-06-10
1565,玉**梅,食品口味: 【新货大颗粒】：1斤（250g*2包）,好评,颗粒大的很！口感特别好！回购,-,-,2021-05-13
1566,秋**淅,食品口味: 【新货特大颗粒】：2斤（250g*4包）（掌柜推荐）,好评,包装好，颗粒大，味道也不错。 ,-,-,2021-05-19
1567,c**3,食品口味: 【新货大颗粒】：1斤（250g*2包）,好评,颗粒不算很大，但是都很新鲜酥脆，很香，皮很脆，容易剥。总体满意。 ,-,-,2021-05-22
1568,石**5,食品口味: 【新货大颗粒】：2斤（250g*4包）,好评,腰果很好吃，已经回购很多次了，超级喜欢,-,-,2021-05-21
1569,y**9,食品口味: 【新货特大颗粒】【大包装】：2斤*1大包,好评,很大颗，挺有满足感，又买了3大包，送到给爸妈吃吃,-,-,2021-05-23
1570,t**9,食品口味: 【新货大颗粒】：1斤（250g*2包）,好评,这是第二次购买了   味道一如既往地好   ,-,-,2021-06-22
1571,我**9,食品口味: 【新货大颗粒】：1斤（250g*2包）,好评,分量足 吃不出来是不是新鲜的 ,-,-,2021-06-06
1572,t**1,食品口味: 【新货大颗粒】：2斤（250g*4包）,好评,包装品质：好 商品分量：好 保质期：好 新鲜度：好 口感味道：好 多次购买了，相当好，不含添加剂。 ,-,-,2021-06-22
1573,土**长,食品口味: 【新货特大颗粒】：1斤（250g*2包）（掌柜推荐）,好评,腰果个头大，味道好，不错，五星好评,-,-,2021-05-22
1574,去**讥,食品口味: 【新货大颗粒】：2斤（250g*4包）,好评,太好吃了！就是有点小贵！收藏一下，希望以后老客户有优惠！嘤嘤嘤嘤嘤嘤 ,我不是托，希望掌柜的下次能给我一个大大的折扣！非常大！55555555,-,2021-06-05
1575,残**4,食品口味: 【新货大颗粒】：1斤（250g*2包）,好评,按这个品质来说，这家卖的价格不贵！很贴心，绝对值得再次回购.已经推荐好几个邻居啦，下次我多买点嚼在嘴里香香的。这个口感没得说，还会再来买的。,腰果非常新鲜，没有添加太多调味品，就淡淡的一点盐味，无论是直接吃还是作炖品的调料都非常棒。,-,2021-03-27
1576,s**洋,食品口味: 【新货特大颗粒】：1斤（250g*2包）（掌柜推荐）,好评,颗粒挺大，看着挺新鲜，口感香脆，份量足，是净重，没有干燥剂。 ,-,-,2021-05-21
1577,h**a,食品口味: 【新货特大颗粒】【大包装】：2斤*1大包,好评,买了好几次了，很好吃，而且足量。没有所谓的“不可食用的防潮袋”空占分量。,-,-,2021-05-10
1578,林**s,食品口味: 【新货特大颗粒】：1斤（250g*2包）（掌柜推荐）,好评,拿到手惊喜到了，很好吃，跟我在杭州店里买的一样 口感味道：个头大，非常好，真的巨好吃，希望店家可以一直做下去，我也有地方买，哈哈哈啊哈哈哈腰果很赞，我上次买的普通，这次是特大颗粒 ,坚果吃起来很香！颗颗饱满 味道杠杠的 分量很足啊！坏子也很少，最重要的是价格很实惠， 服务态度也是超级超级好，物流也是超级超级快 非常满意的一次体验。,-,2021-03-27
1579,严**虎,食品口味: 【新货特大颗粒】：1斤（250g*2包）（掌柜推荐）,好评,差评，我一般都不给人差评的。因为这个太差了里面果差劲。原味的咸的很，而且里面的有的潮的。脆的没几个。建议大家购买谨慎点。真的垃圾货？？？？,-,-,2021-06-06
1580,柠**1,食品口味: 【新货特大颗粒】：1斤（250g*2包）（掌柜推荐）,好评,颗粒比较大，口感比之前买的一家是好很多，不过好像还差那么一点点的烘烤时间，如果表皮带金黄色那就松脆完美了 ,-,-,2021-05-19
1581,t**5,食品口味: 【新货特大颗粒】【大包装】：2斤*1大包,好评,带皮腰果，超大顆粒👍爽脆香濃，值得信賴，價格超實惠。,-,-,2021-06-26
1582,小**3,食品口味: 【新货大颗粒】：1斤（250g*2包）,好评,口感味道：不错好吃 ,-,-,2021-05-10
1583,t**5,食品口味: 【新货特大颗粒】：2斤（250g*4包）（掌柜推荐）,好评,口感味道：口感挺酥，值得购买，回购多次了 ,-,-,2021-06-26
1584,呆**9,食品口味: 【新货特大颗粒】：1斤（250g*2包）（掌柜推荐）,好评,口感味道：挺好的，买的是特大的吃起来过瘾。还以为收到货会像图上的一样的，全部是有商品包装。 ,-,-,2021-05-27
1585,t**8,食品口味: 【新货大颗粒】：1斤（250g*2包）,好评,腰果味道还不错，是咸味道的，喜欢吃，下次再来！ ,-,-,2021-06-23
1586,x**9,食品口味: 【新货特大颗粒】：1斤（250g*2包）（掌柜推荐）,好评,腰果一般般，不好掉皮，对付吃吧，不知哪来那么多好评，后悔看好评买了1斤，不会再来了,-,-,2021-06-05
1587,w**8,食品口味: 【体验装大颗粒】：250g*1包,好评,本来是回头客，以前买的还行，可这次以次充好，个头小而且而且还脱不掉皮儿。真的非常不满意。 ,-,-,2021-06-09
1588,t**0,食品口味: 【新货大颗粒】：1斤（250g*2包）,好评,孩子说很好吃，下次还要买。,-,-,2021-06-19
1589,s**n,食品口味: 【新货大颗粒】：1斤（250g*2包）,好评,此用户没有填写评价。,味道可以。个别的有点干硬。,-,2021-06-05
1590,乒**1,食品口味: 【新货特大颗粒】：2斤（250g*4包）（掌柜推荐）,好评,个大，肉脆，味甜，新鲜，推荐！ ,-,-,2021-05-24
1591,孙**7,食品口味: 【新货大颗粒】：2斤（250g*4包）,好评,保质期：不知道快过期了还是陈货 很难吃。跟前几次的品质完全不一样 口感味道：口感差 有过期的味道 ,买了不止一次两次了。前几次味道都特别好。这次发的八包每一个好的。都是那种过期陈货的味道。体验感极差。最讨厌对老顾客这种态度，仗着别人回购就见人下菜碟一样！,-,2021-06-05
1592,t**0,食品口味: 【新货特大颗粒】：2斤（250g*4包）（掌柜推荐）,好评,产品真实，口感也好，物流也快，购买两次了，还会在购买的,-,-,2021-06-19
1593,x**0,食品口味: 【新货大颗粒】：1斤（250g*2包）,好评,个头可以 也挺香的… ,-,-,2021-05-15
1594,t**j,食品口味: 【体验装大颗粒】：250g*1包,好评,干果还可以，包装不错，生产日期也很近。,-,-,2021-05-18
1595,菜**2,食品口味: 【新货大颗粒】：1斤（250g*2包）,好评,口感味道：特别好吃哈，本来想买来减肥补充坚果的，结果吃了停不下来，估计要肥了，吃完再来 ,-,-,2021-05-26
1596,中**8,食品口味: 【新货特大颗粒】：2斤（250g*4包）（掌柜推荐）,好评,包装品质：很好 商品分量：满意 保质期：满意 新鲜度：新鲜 口感味道：超极好 ,-,-,2021-05-10
1597,阿**郎,食品口味: 【体验装大颗粒】：250g*1包,好评,腰果不错，刚拆开尝了一下 ,-,-,2021-05-22
1598,n**7,食品口味: 【新货特大颗粒】：2斤（250g*4包）（掌柜推荐）,好评,第四次买了，不知道是不是错觉，皮特别难剥的比例变大了，用指甲都抠不下来,刚查过： 腰果属于漆树科，种皮有一定毒性，吃多了麻嘴。,-,2021-06-12
