1447,绿**麦,口味: 咖啡坚果*1+芋泥奶茶*1,好评,本来买来自己健身时吃，不过娃居然喜欢吃，真不错就是小贵,-,-,2021-06-14
1448,美**司,口味: 【热卖】奇亚籽芝士草莓*1+酸奶果然多*1,好评,很好吃，当做家里人当作零食了而且很优惠，下次还会再光顾，所以周深的拼图我有机会吗？❤️,-,-,2021-06-07
1449,e**i,口味: 榛子黑巧*1+酸奶果然多*1,好评,很好，果然是我想吃的味道，榛子黑巧的味道很浓郁，让我想起巧克力的味道，泡上牛奶很不错。酸奶味味道也不错，里面有很多冻果干，味道要比榛子的甜。 ,-,-,2021-06-03
1450,鱼**宝,口味: 【周深推荐】榛子黑巧*1+咖啡坚果*1,好评,优秀,-,-,2021-06-05
1451,1**洁,口味: 【周深推荐】榛子黑巧*1+咖啡坚果*1,好评,收货好几天了，比想象中的量多，我喜欢泡着酸奶吃，太美味了。等吃完再回购,-,-,2021-06-05
1452,t**5,口味: 【周深推荐】榛子黑巧*1+咖啡坚果*1,好评,完全没有宣传的那么好 不值这个金额 味道很廉价,-,-,2021-06-15
1453,a**1,口味: 【周深推荐】榛子黑巧*1+咖啡坚果*1,好评,我只能说太好吃了，要不是现在减肥中，放以前这一包我一上午就能吃完，真真好吃 ,-,-,2021-06-02
1454,向**6,口味: 榛子黑巧*1+草莓优脆乳*1,好评,燕麦片很好吃，早上用牛奶一冲即吃很方便！分量很足，这两款味道都很喜欢 ,-,-,2021-06-04
1455,m**5,口味: 榛子黑巧*1+草莓优脆乳*1,好评,物流很快 ,-,-,2021-06-09
1456,苏**6,口味: 咖啡坚果*1+奇亚籽芝士草莓*1,好评,麦片很快就收到了，早上冲一杯省时间，满满的麦香味，甜甜的草莓味，喝完饱腹感比较强。强烈推荐！ ,-,-,2021-06-02
1457,诱**火,口味: 榛子黑巧*1+酸奶果然多*1,好评,榛子果仁丰富，酸奶块特别多，早餐泡酸奶吃营养美味，也可以当零食吃，吃多了也不用担心长肉。,-,-,2021-06-03
1458,k**5,口味: 【周深推荐】榛子黑巧*1+咖啡坚果*1,好评,可以说实话吗？ 真的不好吃 尤其是咖啡坚果的是真心难吃 ,-,-,2021-06-17
1459,风**6,口味: 【热卖】奇亚籽芝士草莓*1+酸奶果然多*1,好评,好划算，几大袋，又可以吃很久了。,-,-,2021-06-06
1460,8**5,口味: 【周深推荐】榛子黑巧*1+咖啡坚果*1,好评,个人麦片吃的比较多，这款微苦的咖啡味，冷泡牛奶也比较香醇,-,-,2021-05-31
1461,x**2,口味: 【周深推荐】榛子黑巧*1+咖啡坚果*1,好评,榛子黑巧的也太好吃了吧。泡酸奶也很棒，解锁咖啡味酸奶，太喜欢了❤ ,-,-,2021-06-04
1462,石**w,口味: 榛子黑巧*1+奇亚籽芝士草莓*1,好评,味道不错，很满意，还很贴着的赠送了两袋小包装试吃。第一次尝试，以后会回购。 ,-,-,2021-06-06
1463,仔**1,口味: 榛子黑巧*1+奇亚籽芝士草莓*1,好评,宝贝收到了，一如既往得好哦，很喜欢这个口味，包装也很好，吃完了再来～￼ ,-,-,2021-05-30
1464,奚**良,口味: 【周深推荐】榛子黑巧*1+咖啡坚果*1,好评,回购，囤点货马上儿子放假回来了，有了这个，早餐基本不用费太大的心了 ,-,-,2021-06-07
1465,那**8,口味: 【周深推荐】榛子黑巧*1+咖啡坚果*1,好评,咖啡味道的燕麦不脆  买回来打开吃 没有榛子的脆，可能是有点潮了,-,-,2021-06-18
1466,这**名,口味: 【周深推荐】榛子黑巧*1+咖啡坚果*1,好评,榛子黑巧非常不错，咖啡坚果个人不太喜欢，个人感觉咖啡味太重啦 ,-,-,2021-06-02
1467,不**糖,口味: 【周深推荐】榛子黑巧*1+咖啡坚果*1,好评,特好，回购不知道多少次了，麦片王饱饱的最好吃。我买回家我妈我妹立刻抢光了，自己才吃了两次，哈哈哈哈哈哈  ,-,-,2021-06-05
1468,爱**7,口味: 榛子黑巧*1+酸奶果然多*1,好评,麦片味道很好，早餐用牛奶泡下口感极佳，里面坚果很多，营养健康又能充饥，给个赞！ ,-,-,2021-05-29
1469,胡**4,口味: 【周深推荐】榛子黑巧*1+咖啡坚果*1,好评,不错不错，当代餐吃的，可以用酸奶泡，也可以用开水冲泡，口味可以。 ,-,-,2021-06-04
1470,高**7,口味: 【单包低至29.9】果然多*2,好评,和酸奶搭配真的超好吃，每天早上来一碗饱腹感超好，已经回购了。,-,-,2021-06-07
1471,散**瑰,口味: 芋泥奶茶*1+草莓优脆乳*1,好评,此用户没有填写评价。,还是草莓的好吃，芋泥奶茶的有一股茶叶的苦味，不怎么喜欢,-,2021-04-16
1472,蝴**8,口味: 【周深推荐】榛子黑巧*1+咖啡坚果*1,好评,麦片收到了，我是用来当早餐的，很有饱腹感，吃起来也方便，平时也可以当零食，吃完还会来！ ,-,-,2021-06-05
1473,诚**l,口味: 【周深推荐】榛子黑巧*1+咖啡坚果*1,好评,味道还不错，是我胃口太大吗？一顿半包，下次采购需要量大一点,-,-,2021-06-06
1474,完**当,口味: 奇亚籽芝士草莓*1+芋泥奶茶*1,好评,我最爱的芝士草莓，客服推荐的没错，的确很好吃，不甜腻，哺乳期的减肥零食。下次再尝试其他口味 ,-,-,2021-06-05
1475,t**5,口味: 榛子黑巧*1+酸奶果然多*1,好评,麦片收到了味道挺好的，食用起来非常方便省事，没想到这个还挺耐饿的，非常不错的一款产品 ,-,-,2021-05-30
1476,强**思,口味: 【周深推荐】榛子黑巧*1+咖啡坚果*1,好评,为了周深买的，第一次为明星代言买产品，里面的葡萄干像石头,-,-,2021-06-08
1477,王**l,口味: 榛子黑巧*1+酸奶果然多*1,好评,燕麦片的家里人都爱吃～早餐夜宵的必备 而去榛子黑巧的好吃 打算多买几包 家里消耗品～ ,-,-,2021-06-03
1478,晚**虫,口味: 【周深推荐】榛子黑巧*1+咖啡坚果*1,好评,周深说好吃就买来试试，吃了榛子黑巧的，真挺好吃的，当早餐完全可以，是有饱腹感的 ,-,-,2021-06-06
1479,杨**儿,口味: 【热卖】奇亚籽芝士草莓*1+酸奶果然多*1,好评,太好吃了！喜欢～闭眼入吧～,-,-,2021-06-08
1480,开**5,口味: 榛子黑巧*1+酸奶果然多*1,好评,口感很好。每天早上不知道吃啥。买了王饱饱 就可以每天都吃到美味又营养的早餐啦 ,-,-,2021-06-05
1481,t**1,口味: 榛子黑巧*1+酸奶果然多*1,好评,配酸奶绝！ ,-,-,2021-06-19
1482,哎**1,口味: 咖啡坚果*1+肉松控*1,好评,在朋友都在喝这个，我也买了一份，口感不错，易冲泡易溶解，好喝！ ,-,-,2021-06-06
1483,可**9,口味: 咖啡坚果*1+芋泥奶茶*1,好评,燕麦片很好吃，买来早上当早餐吃哒😁😁和酸奶一块搅拌均匀，减肥又可口，棒棒哒🤗🤗 ,-,-,2021-05-31
1484,郑**6,口味: 【热卖】奇亚籽芝士草莓*1+酸奶果然多*1,好评,东西到货了，看着非常好吃哦，也冲了一杯特别香。,-,-,2021-06-06
1485,快**4,口味: 榛子黑巧*1+奇亚籽芝士草莓*1,好评,为了新口味特意买的尝尝。果真没失望，里面的榛子还有椰子片都特别好吃。我居然吃出了小时候麦乳精的味道。满意 ,-,-,2021-05-30
1486,t**8,口味: 【周深推荐】榛子黑巧*1+咖啡坚果*1,好评,再次回购了，味道不错，周深推荐的没错了，购买的新口味的还没发货，不知道咸口味的麦片是怎样的，看崽崽吃的那么香，一定很好吃吧！期待！,-,-,2021-06-06
1487,三**7,口味: 榛子黑巧*1+奇亚籽芝士草莓*1,好评,日期新鲜，味道也好，拿来当早餐真的太适合了，喜欢草莓味的，就像吃真的草莓一样好吃😋推荐哦 ,-,-,2021-06-02
1488,t**1,口味: 【周深推荐】榛子黑巧*1+咖啡坚果*1,好评,泡久了不会变软，脆脆的很好吃，果仁非常多，怎么搭配都喜欢 ,-,-,2021-06-19
1489,笨**8,口味: 【周深推荐】榛子黑巧*1+咖啡坚果*1,好评,支持周深，收到货两种都拆了，麦片不甜，配着酸奶吃刚刚好，好评！ ,-,-,2021-06-07
1490,t**8,口味: 【周深推荐】榛子黑巧*1+咖啡坚果*1,好评,没吃过这个味道，买来尝尝，咖啡味的还不错，挺好，喜欢吃， ,-,-,2021-06-02
1491,董**2,口味: 【热卖】奇亚籽芝士草莓*1+酸奶果然多*1,好评,买了两种热卖的口味，真好吃。早上配上酸奶面包，就很幸福啦，王饱饱值得信赖。 ,-,-,2021-06-03
1492,唔**哈,口味: 【热卖】奇亚籽芝士草莓*1+酸奶果然多*1,好评,味道不错 不想做饭泡着酸奶一起喝 最喜欢这个酸奶果然多 下次还会回购 ,-,-,2021-06-03
1493,哈**宝,口味: 榛子黑巧*1+草莓优脆乳*1,好评,蛮不擦的！ ,-,-,2021-06-16
1494,吃**啊,口味: 咖啡坚果*1+芋泥奶茶*1,好评,虽然是为了周深的代言才买的，但是不得不夸一下，是真的好吃，果干，坚果都有了，方便又美味,-,-,2021-06-06
1495,韩**5,口味: 【热卖】奇亚籽芝士草莓*1+酸奶果然多*1,好评,买来当早餐的，泡酸奶吃的，丰富下自己的早餐，味道不错，冲泡起来很方便，个人挺喜欢的～ ,-,-,2021-06-04
1496,小**1,口味: 奇亚籽芝士草莓*1+咖啡坚果*1,好评,吃过很多款燕麦片，但都没有王饱饱的口感好，真实燕麦片，而且很香，家中必备食物，看了王饱饱的健康饮食视频，才发现，什么才是好的燕麦片。下次继续回购王饱饱，家里两娃都爱吃 ,-,-,2021-04-24
1497,星**2,口味: 咖啡坚果*1+奇亚籽芝士草莓*1,好评,我吃咖啡味的不好吃！哈哈…不是很喜欢！水果味和酸奶味的很好吃！ ,-,-,2021-06-15
1498,t**9,口味: 【周深推荐】榛子黑巧*1+咖啡坚果*1,好评,黑巧榛子的太好吃了太好吃了，配上炭烧酸奶，绝绝子好嘛我太爱了，我天天不吃饭就吃它也不知道能不能减肥,-,-,2021-06-21
1499,高**朵,口味: 榛子黑巧*1+奇亚籽芝士草莓*1,好评,购买多次了，口感好而且一直有新口味出现，非膨化不易长胖，吃完又来！,-,-,2021-06-05
1500,文**逼,口味: 【周深推荐】榛子黑巧*1+咖啡坚果*1,好评,买二送一，太实惠了。晚饭一点麦片拌酸奶，太好吃了，买过别人家的都不如这个好吃。 ,-,-,2021-06-03
1501,水**n,口味: 咖啡坚果*1+肉松控*1,好评,周深的代言一定会支持咯！本身也好吃，肉松可以加点到粥里试试！ ,-,-,2021-06-05
1502,小**诗,口味: 榛子黑巧*1+酸奶果然多*1,好评,到货直接开了一包吃，味道不错，直接泡或者放酸奶都可，以后每天早餐就吃这个了～ ,-,-,2021-06-02
1503,在**中,口味: 草莓优脆乳*1（送贝贝南瓜体验装）,好评,第n次购买了，好好吃！女儿最爱的口味,-,-,2021-06-05
1504,h**颖,口味: 【周深推荐】榛子黑巧*1+咖啡坚果*1,好评,真的是非常好吃，每天都期盼吃早点，下午饿了，直接捏着当零食吃，一包很快吃完！,-,-,2021-06-08
1505,芳**7,口味: 【周深推荐】榛子黑巧*1+咖啡坚果*1,好评,从来不喜欢吃麦片的人居然喜欢吃这个了 香香的巧克力味 一点也不腻 喜欢干吃 有嚼劲,-,-,2021-05-31
1506,笑**1,口味: 【周深推荐】榛子黑巧*1+咖啡坚果*1,好评,榛子黑巧味道还不错！不过我更喜欢咖啡坚果,-,-,2021-06-06
1507,妃**g,口味: 咖啡坚果*1+奇亚籽芝士草莓*1,好评,不错哦。和描述的一样，哈哈，每天早上上班前都会喝一杯，精神一整天拉。哈哈。 ,-,-,2021-06-02
1508,大**5,口味: 【周深推荐】榛子黑巧*1+咖啡坚果*1,好评,比超市便宜。口感很好。性价比很高,-,-,2021-06-06
1509,l**2,口味: 咖啡坚果*1+奇亚籽芝士草莓*1,好评,自从周深代言后 我的早餐就被饱饱承包了 方便美味健康 吃完了会再来 ,-,-,2021-06-06
1510,c**2,口味: 【周深推荐】榛子黑巧*1+咖啡坚果*1,好评,好吃，非常喜欢,-,-,2021-05-30
1511,t**8,口味: 榛子黑巧*1+酸奶果然多*1,好评,昨天收到了，今天早上试喝了一下，口感很不错，价格不贵，棒棒哒！,-,-,2021-06-03
1512,你**子,口味: 【周深推荐】榛子黑巧*1+咖啡坚果*1,好评,味道很好孩子很喜欢大人也喜欢下次还会购买推荐购买 ,-,-,2021-06-04
1513,t**妞,口味: 【周深推荐】榛子黑巧*1+咖啡坚果*1,好评,口感味道：榛子黑巧不要太好吃哟，值得回购！干吃或者泡酸奶绝了绝了~ ,-,-,2021-06-08
1514,小**4,口味: 咖啡坚果*1+奇亚籽芝士草莓*1,好评,朋友介绍来的，吃起来也方便 味道不错，在来买其他口味  ,-,-,2021-05-31
1515,t**3,口味: 咖啡坚果*1+芋泥奶茶*1,好评,刚收到就迫不及待打开来尝了一下，好吃！谢谢深深的推荐哦！✿✿ヽ(°▽°)ノ✿,-,-,2021-06-05
1516,吕**4,口味: 咖啡坚果*1+奇亚籽芝士草莓*1,好评,买了两份，这一份开了试用装不好退了，还有一份退了，吃了半碗，胃半天不舒服，知道晚上，还是不能吃了  ,-,-,2021-06-18
1517,嘴**a,口味: 榛子黑巧*1+酸奶果然多*1,好评,麦片口味很好，给孩子当早餐不错，日期也是新的。 ,-,-,2021-06-03
1518,l**7,口味: 【周深推荐】榛子黑巧*1+咖啡坚果*1,好评,味道很不错，口感很多，多种口味，多种营养搭配，食用方便营养健康。 ,-,-,2021-05-31
1519,w**0,口味: 【周深推荐】榛子黑巧*1+咖啡坚果*1,好评,天哪！实在是好吃！这是我这辈子吃过最好吃的麦片！冲吧！618活动的时候我准备多屯点。 ,-,-,2021-06-08
1520,w**8,口味: 榛子黑巧*1+奇亚籽芝士草莓*1,好评,榛子味真是永远的神，纯巧克力配方，空嘴当零食吃都停不下来的程度,-,-,2021-06-18
1521,t**2,口味: 咖啡坚果*1+奇亚籽芝士草莓*1,好评,包装精美，吃着味道好，泡着很方便。好吃😊,-,-,2021-06-24
1522,在**6,口味: 【周深推荐】榛子黑巧*1+咖啡坚果*1,好评,外观品相：难吃，难吃，一点都不好吃，价格贵，那些好评都怎么来的，现在的商家真是弄虚作假 ,-,-,2021-06-16
1523,小**儿,口味: 【周深推荐】榛子黑巧*1+咖啡坚果*1,好评,做早餐再合适不过了，方便又营养，口味喜欢,-,-,2021-06-08
1524,张**0,口味: 【热卖】奇亚籽芝士草莓*1+酸奶果然多*1,好评,收到麦片就打开尝尝，味道喜欢哦，多种吃法，可以当早餐吃可以当零食吃，喜欢哦 ,-,-,2021-06-02
1525,k**妞,口味: 榛子黑巧*1+酸奶果然多*1,好评,太好吃了吧，每一个口味都想来一包好好吃😋我喜欢干吃和用酸奶拌着吃很赞哦。 ,-,-,2021-06-03
1526,枫**斐,口味: 【周深推荐】榛子黑巧*1+咖啡坚果*1,好评,口感味道：不脆，还特别的硬。说实话，不怎么样。下次绝对不会再买了 ,-,-,2021-06-19
1527,q**乐,口味: 【热卖】奇亚籽芝士草莓*1+酸奶果然多*1,好评,收到立刻吃！应该每个人的口味不同吧！我吃就不好吃,-,-,2021-06-19
1528,t**9,口味: 榛子黑巧*1+酸奶果然多*1,好评,榛子黑巧好好吃，每次多买一种口味，看看还能不能找到自己喜欢吃的,-,-,2021-06-21
1529,思**l,口味: 【周深推荐】榛子黑巧*1+咖啡坚果*1,好评,比那些直播直播间买的还便宜，618还是蛮给力的 ,-,-,2021-06-07
1530,霞**1,口味: 【周深推荐】榛子黑巧*1+咖啡坚果*1,好评,一般，吃了就拉肚子，不想说啥了 ,-,-,2021-06-17
1531,l**0,口味: 【周深推荐】榛子黑巧*1+咖啡坚果*1,好评,喜欢咖啡黑巧和芋泥的，泡燕麦奶很好吃 ,-,-,2021-06-05
1532,l**g,口味: 【周深推荐】榛子黑巧*1+咖啡坚果*1,好评,因为网上风很大所以试一试，实话实说，个人感觉一般，没有抖音里面说的巨好吃，试了咖啡味的，燕麦比较费牙，里面蔓越莓干有点像嚼蜡，咖啡奶块一包很少就几块，泡了一杯没吃完就感觉有点腻，后悔买多了。以前买过别的瑞士牌子的水果燕麦，感觉不如那个好。 ,-,-,2021-06-07
1533,雨**梓,口味: 咖啡坚果*1+芋泥奶茶*1,好评,第二次买了，换了个口味，也好吃，顺便表白下我们的代言人深深😘,-,-,2021-06-09
1534,桃**子,口味: 【周深推荐】榛子黑巧*1+咖啡坚果*1,好评,确实挺好吃的，要不是618还买不起呢 ,同志们这个太好吃了！咖啡的～特别好吃啊！自己一个人一次吃了半袋，减肥是不可能的了,-,2021-06-04
1535,t**2,口味: 【周深推荐】榛子黑巧*1+咖啡坚果*1,好评,一点都不好吃 也没有那么脆 还很苦 特别苦 很少差评 但确实难吃,-,-,2021-06-24
1536,t**0,口味: 芋泥奶茶*1+咖啡坚果*1,好评,真的很好吃，尤其喜欢咖啡的，香脆的，非常奈斯,-,-,2021-06-19
1537,t**8,口味: 【周深推荐】榛子黑巧*1+咖啡坚果*1,好评,麦片很好吃，坚果放的挺多，早餐充一碗正好。,-,-,2021-06-06
1538,龙**l,口味: 榛子黑巧*1+酸奶果然多*1,好评,卖家发货挺快的麦片口感很好，酸奶味的小朋友很喜欢。冲饮很好方便。最新日期，放心购买。 ,-,-,2021-06-04
1539,低**簿,口味: 咖啡坚果*1+奇亚籽芝士草莓*1,好评,燕麦片包装严实，口味好，坚果多，日期新鲜 ,-,-,2021-06-02
1540,v**糖,口味: 奇亚籽芝士草莓*1+芋泥奶茶*1,好评,东西口感很好，包装严实，宝贝与描述基本一致，发货很快，值得购买 ,-,-,2021-06-01
1541,y**6,口味: 榛子黑巧*1+酸奶果然多*1,好评,配酸奶真的绝的！早上起来泡一杯简单又好吃！料真的足足的，满分💯,-,-,2021-06-06
1542,蓝**子,口味: 【周深推荐】榛子黑巧*1+咖啡坚果*1,好评,此用户没有填写评价。,看了周深代言买两袋来尝尝，都吃完一袋了才想起来评价。里面有腰果，好像还有椰果就那种白色的干片。看到有买家说麦片碎，我买的没有这种情况哦，颗粒挺大。速溶的也很容易泡，对于早上不做饭只吃简餐的我太合适了，配上个煎蛋完事。准备吃完再回购两袋。,-,2021-05-12
1543,亦**你,口味: 【周深推荐】榛子黑巧*1+咖啡坚果*1,好评,打开了黑巧的，干吃有点苦，泡牛奶几分钟后，牛奶会有巧克力的味道，偏甜。,-,-,2021-06-02
1544,t**8,口味: 【热卖】奇亚籽芝士草莓*1+酸奶果然多*1,好评,真是不错，又送了两小袋其他的口味，好评好评。,-,-,2021-06-04
1545,王**志,口味: 【周深推荐】榛子黑巧*1+咖啡坚果*1,好评,还送了一袋  很意外  也很惊喜  麦片只吃王饱饱  口感和配料都很棒 ,-,-,2021-06-04
1546,f**3,口味: 咖啡坚果*1+芋泥奶茶*1,好评,咖啡坚果没有桂格的咖啡脆脆好吃，鉴定完毕。 ,-,-,2021-06-05
1547,姬**n,口味: 咖啡坚果*1+草莓优脆乳*1,好评,好吃还是蛮好吃的。跟其他家的味道也差不了多少。价格有的小贵。好评 ,-,-,2021-05-30
1548,e**g,口味: 榛子黑巧*1+酸奶果然多*1,好评,比预期的要好吃诶！谢谢周星星(๑╹ڡ╹)╭ ～ ♡~~,-,-,2021-06-07
1549,t**0,口味: 【周深推荐】榛子黑巧*1+咖啡坚果*1,好评,天~太好吃了~榛子黑巧和咖啡坚果~ 太好吃啦,-,-,2021-06-19
1550,河**涯,口味: 【周深推荐】榛子黑巧*1+咖啡坚果*1,好评,看周深吃的超香，忍不住剁手。第一口不是特别脆啊！再吃几口真香😄哈哈哈 ,-,-,2021-06-06
1551,连**英,口味: 【周深推荐】榛子黑巧*1+咖啡坚果*1,好评,深深推荐，支持(*^▽^)/★*☆不过也挺好吃的，嘻嘻(♡˙︶˙♡),-,-,2021-06-08
1552,雁**儿,口味: 【周深推荐】榛子黑巧*1+咖啡坚果*1,好评,好吃！第二次买咖啡坚果了。榛子黑巧第一次吃，不错！ ,-,-,2021-06-07
1553,小**q,口味: 【周深推荐】榛子黑巧*1+咖啡坚果*1,好评,五星好评，好吃小贵。 ,-,-,2021-05-30
1554,t**8,口味: 【周深推荐】榛子黑巧*1+咖啡坚果*1,好评,超级好吃的说值得建议购买，干吃不会腻,-,-,2021-06-02
1555,t**4,口味: 【周深推荐】榛子黑巧*1+咖啡坚果*1,好评,此用户没有填写评价。,榛子黑巧很好吃营养又方便😄会再买，还会尝试其它口味。,-,2021-06-25
1556,小**儿,口味: 【周深推荐】榛子黑巧*1+咖啡坚果*1,好评,我老公超爱 觉得味道非常正 浓郁 ❤️ ,-,-,2021-06-08
1557,耿**1,口味: 榛子黑巧*1+酸奶果然多*1,好评,这个麦片很好吃，已经买过多次了，放在酸奶里吃起来更好吃。,-,-,2021-06-07
1558,y**y,口味: 【周深推荐】榛子黑巧*1+咖啡坚果*1,好评,因为周深结识王饱饱麦片，结果爱上王饱饱！早餐吃，上班当零食吃，蛮好吃的麦片！ ,-,-,2021-06-05
1559,l**7,口味: 咖啡坚果*1+肉松控*1,好评,王饱饱真的太好吃了！！！！！！谢谢我的周深宝贝带我认识了一个宝藏！！！！ ,-,-,2021-06-08
1560,余**吖,口味: 【单包低至29.9】果然多*2,好评,好吃！划算 分量很足,-,-,2021-05-28
1561,婵**格,口味: 【周深推荐】榛子黑巧*1+咖啡坚果*1,好评,减肥人吃了越减越肥😂热量那么高光涨脂肪了，人体需要的营养又少,-,-,2021-06-19
1562,恋**伞,口味: 榛子黑巧*1+酸奶果然多*1,好评,挺好吃的，搭配牛奶做早餐，方便又快捷,-,-,2021-06-04
1563,w**9,口味: 【周深推荐】榛子黑巧*1+咖啡坚果*1,好评,王饱饱麦片很好吃！自从买了麦片之后就没有担心过早餐的问题，平时也能当零食吃，方便快捷,-,-,2021-06-03
1564,七**1,口味: 【周深推荐】榛子黑巧*1+咖啡坚果*1,好评,干吃也好好吃啊。买给一个喜欢周深的朋友的嘿嘿嘿。 ,-,-,2021-06-06
1565,t**1,口味: 榛子黑巧*1+奇亚籽芝士草莓*1,好评,还不错，就是价格再优惠点就更好了(⌒▽⌒),-,-,2021-06-19
1566,s**e,口味: 【周深推荐】榛子黑巧*1+咖啡坚果*1,好评,周深推荐的果然好好吃，榛子坚果好多，追剧的时候抱一袋真的巨爽 ,-,-,2021-06-03
1567,忆**鸟,口味: 【周深推荐】榛子黑巧*1+咖啡坚果*1,好评,618挺划算的 还没吃 习惯好评 ,-,-,2021-06-19
1568,妍**么,口味: 榛子黑巧*1+酸奶果然多*1,好评,好吃😋 家里人都很喜欢吃 已经回购好几次了 推荐入手  ,-,-,2021-06-08
1569,5**c,口味: 【周深推荐】榛子黑巧*1+咖啡坚果*1,好评,还不错，活动价比较划算，好吃,-,-,2021-06-06
1570,y**y,口味: 咖啡坚果*1+芋泥奶茶*1,好评,因为周深结识王饱饱麦片，结果爱上王饱饱！早餐吃，上班当零食吃，好吃好吃！ ,-,-,2021-06-05
1571,悦**宝,口味: 榛子黑巧*1+奇亚籽芝士草莓*1,好评,还没吃，主要新口味想尝试一下，价格便宜,-,-,2021-06-07
1572,y**0,口味: 【店长推荐】酸奶果然多*1+咖啡坚果*1,好评,味道还不错的，比较喜欢咖啡坚果🌰味的，味道也很香。就是有点难泡软，第一次泡的时间比较短，嚼的我腮帮子和脑仁疼。 ,-,-,2021-04-25
1573,竹**9,口味: 榛子黑巧*1+草莓优脆乳*1,好评,好吃营养，方便实惠。已经多次购买，这次店家还有赠品，好评。,-,-,2021-06-06
1574,混**涵,口味: 【周深推荐】榛子黑巧*1+咖啡坚果*1,好评,第三次回购了 麦片的种类越来越多了 但是都很好吃！爱了爱了 会回购 ,-,-,2021-06-05
1575,冰**5,口味: 【热卖】奇亚籽芝士草莓*1+酸奶果然多*1,好评,分量很足，味道很好，包装很精致 ,-,-,2021-06-02
1576,c**q,口味: 【周深推荐】榛子黑巧*1+咖啡坚果*1,好评,看到周深的广告视频买的，真的特别好吃，我喜欢直接当零食吃了,-,-,2021-06-06
1577,罗**9,口味: 奇亚籽芝士草莓*1+草莓优脆乳*1,好评,外观品相：外观破损 口感味道：一般 ,-,-,2021-06-02
1578,t**9,口味: 榛子黑巧*1+酸奶果然多*1,好评,燕麦片收到了，冲起来很方便，挺好喝的，下次需要还会再来，很满意 ,-,-,2021-06-21
1579,皮**e,口味: 【周深推荐】榛子黑巧*1+咖啡坚果*1,好评,说实话我个人不太爱吃甜食，真的是冲着周深去买的。,-,-,2021-06-16
1580,初**宝,口味: 【周深推荐】榛子黑巧*1+咖啡坚果*1,好评,呜呜呜深深推荐的好好吃，王饱饱赛高！（坐等希望能收到拼图） ,-,-,2021-06-08
1581,非**子,口味: 榛子黑巧*1+酸奶果然多*1,好评,你上次买的了觉得很好吃，又买了。 没吃过的一定要买了尝尝这味道真的很好吃,-,-,2021-06-04
1582,晚**s,口味: 【周深推荐】榛子黑巧*1+咖啡坚果*1,好评,还行，但是没有宣传上说的那么好吃,-,-,2021-06-19
1583,上**o,口味: 芋泥奶茶*1+酸奶果然多*1,好评,此用户没有填写评价。,一般，也就燕麦之外的块好吃，燕麦泡不开,-,2021-06-04
1584,猫**么,口味: 奇亚籽芝士草莓*1+芋泥奶茶*1,好评,超好吃😋芋泥奶茶控停不下来 ,-,-,2021-06-05
1585,嘿**媚,口味: 【共计5包】芋泥奶茶100g*4（加赠同款1包）,好评,香芋奶茶是我喜欢的口味，比较脆 ,-,-,2021-06-05
1586,展**油,口味: 【周深推荐】榛子黑巧*1+咖啡坚果*1,好评,很好吃，我喜欢榛子黑巧的，我同事也都很喜欢吃。,-,-,2021-05-29
1587,王**4,口味: 【热卖】奇亚籽芝士草莓*1+酸奶果然多*1,好评,不好吃，实物没有图片里面那么大颗，还挺贵。不会再买,-,-,2021-06-15
1588,c**8,口味: 【热卖】奇亚籽芝士草莓*1+酸奶果然多*1,好评,买了两大袋送了两小袋，还不错吧。 减肥餐 ,-,-,2021-06-08
1589,番**味,口味: 【热卖】奇亚籽芝士草莓*1+酸奶果然多*1,好评,凑单拍的 希望可以拿到周深的拼图吧૧(●´৺`●)૭ ,-,-,2021-06-14
