1314,我**良,口味: 套餐1：欢辣大剧场445g/1袋(含鸭脖，猪肉片等，约20小包 ),好评,收到了，挺好吃的！,-,-,2021-06-19
1315,q**q,口味: 套餐3：休闲食光组合475g/3袋(含虎皮凤爪，面筋卷等),好评,包装品质：精致 商品分量：中等，但也够了 保质期：新的 新鲜度：新鲜 口感味道：不错 ,-,-,2021-06-08
1316,t**g,口味: 套餐3：休闲食光组合475g/3袋(含虎皮凤爪，面筋卷等),好评,发货很快，味道不错,-,-,2021-06-17
1317,t**8,口味: 套餐1：欢辣大剧场445g/1袋(含鸭脖，猪肉片等，约20小包 ),好评,说好的东西里面都没有 一点都不好 我就是冲着猪肉片去 的居然没有,-,-,2021-06-18
1318,t**6,口味: 套餐8：荤素集合组合383g(含鸭锁骨、牛板筋等),好评,千万别买这个牛板筋，这样根本就咬不动，这种东西根本就吃不了，竟然还卖 ,-,-,2021-06-16
1319,原**j,口味: 套餐1：欢辣大剧场445g/1袋(含鸭脖，猪肉片等，约20小包 ),好评,整挺好的，为了张哲瀚以后都是百草味的常客了， 包装品质：包装完好 保质期：新的很好 口感味道：好吃好吃，买过好多次百草味了不错不错不错 ,-,-,2021-05-28
1320,维**x,口味: 套餐12：什锦素卤礼包510g(约16小包),好评,素包不好吃，笋还行，同事说不好吃，吃一口就扔了…泡椒味很重，笋的口感软嫩，已经吃不出笋的味道了；藕也很嫩，口感很脆，感觉是生的；土豆边边粉粉的中间脆脆的；海带很软很软很软了。整体来说全是调理和辣味，一点原料都味道都没有，调料带点苦味 ,-,-,2021-06-15
1321,z**3,口味: 套餐1：欢辣大剧场445g/1袋(含鸭脖，猪肉片等，约20小包 ),好评,突然发现鸭脖、鸭锁骨加热后再吃，更好吃了，甜辣下饭！！豆干、鱼丸也好吃。 不好吃的依旧是香辣素肉、香辣卤藕，有药味；泡椒脆笋太辣遭不住。,-,-,2021-06-05
1322,鱼**卿,口味: 套餐1：欢辣大剧场445g/1袋(含鸭脖，猪肉片等，约20小包 ),好评,包装品质：打开后满满一箱挺满足的，下次抢个更合适的 商品分量：足 新鲜度：吃了感觉可以，辣度有 ,-,-,2021-06-08
1323,t**2,口味: 套餐2：欢聚时刻组合374g/3袋(含麻辣牛肉、小鸡腿等),好评,物流公司服务态度很好，运送速度很快！ ,-,-,2021-06-17
1324,t**7,口味: 套餐3：休闲食光组合475g/3袋(含虎皮凤爪，面筋卷等),好评,难吃，买的辣条，特别硬，就是那种普通的大辣条，比一毛钱的还难吃，虎皮凤爪还是可以的， ,-,-,2021-06-17
1325,七**噜,口味: 套餐6：川蜀爽辣组合420g/3袋(含麻辣牛肉，虎皮凤爪等),好评,山人支持老婆！冲冲冲！赚大钱！ 百草味粑粑牛*！张哲瀚牛*！ ,好吃好吃好吃好吃好吃好吃好吃,-,2021-06-09
1326,独**身,口味: 套餐5：畅享食刻组合450g/3袋(含鸭脖，虎皮凤爪等),好评,活动的时候买的，这个价钱能买到我感觉还是值得的，味道还可以,-,-,2021-06-12
1327,不**呦,口味: 套餐6：川蜀爽辣组合425g/约21小包(含麻辣牛肉，虎皮萌蛋等),好评,味道还可以 很好吃   物流很快  包装完好 ,-,-,2021-05-16
1328,t**3,口味: 套餐6：川蜀爽辣组合420g/3袋(含麻辣牛肉，虎皮凤爪等),好评,鸡爪好吃，牛肉是甜的，也不麻也不辣，沙沙的，不太好吃，豆腐也还可以 ,-,-,2021-06-22
1329,快**3,口味: 套餐1：欢辣大剧场445g/1袋(含鸭脖，猪肉片等，约20小包 ),好评,挺好吃的，好评！ ,-,-,2021-06-15
1330,t**9,口味: 套餐1：欢辣大剧场445g/1袋(含鸭脖，猪肉片等，约20小包 ),好评,不错，就是买的时候没看全是辣的，最近吃不了，还有对快递不满意。明明前一天就到了，中午联系不上我，下午2.3点我回拨后拒绝配送，还说商店不让放，但是我买的其他东西放着都没问题，态度恶劣 ,-,-,2021-06-24
1331,t**9,口味: 套餐1：欢辣大剧场445g/1袋(含鸭脖，猪肉片等，约20小包 ),好评,感觉买小包装的更划算 花样更多。,-,-,2021-06-24
1332,缠**x,口味: 套餐4：有荤有素组合635g/3袋(含鸭脖，土豆片等),好评,完美！！ ,-,-,2021-06-14
1333,h**0,口味: 套餐2：欢聚时刻组合378g/约9小包(含麻辣牛肉、鸭翅根等),好评,此用户没有填写评价。,在这种情况下也不是一个、一切顺利就好了……不能去现场了……不知道我会一直记得那个样子呢！这种东西我还在一起吗……不能错过哦、一切顺利就好,-,2021-06-20
1334,必**记,口味: 套餐1：欢辣大剧场445g/1袋(含鸭脖，猪肉片等，约20小包 ),好评,感觉这次的不划算 东西其实蛮少的 物流还得催 ,-,-,2021-06-22
1335,李**磊,口味: 套餐1：欢辣大剧场445g/1袋(含鸭脖，猪肉片等，约20小包 ),好评,收到零食大礼包了，味道不错，口感很好！ ,-,-,2021-06-10
1336,亦**l,口味: 套餐5：畅享食刻组合485g/3袋(含鸭脖，面筋卷等),好评,面筋不好吃，不推荐，辣条一般，没有另一种辣条好吃，其他都还可,-,-,2021-06-20
1337,一**万,口味: 套餐1：欢辣大剧场445g/1袋(含鸭脖，猪肉片等，约20小包 ),好评,此用户没有填写评价。,价格不错，但味道确实不咋地，可能是我个人原因吃不惯,"赏味达人 ,这款套餐根据不同的口味进行了套餐搭配 ,性价比是非常高的哦，非常抱歉没有满足您的味蕾，小味重视客户的每一点声音和意见的呢，会反馈至产品部门不断优化产品的配方和工艺，给您带来更好的产品，期待您的再次光临",2021-06-09
1338,t**0,口味: 套餐6：川蜀爽辣组合420g/3袋(含麻辣牛肉，虎皮凤爪等),好评,和朋友拼着买的，一直都支持着百草味，好吃，零食首选。 ,-,-,2021-06-21
1339,w**8,口味: 套餐1：欢辣大剧场445g/1袋(含鸭脖，猪肉片等，约20小包 ),好评,货收到了。客服小姐姐服务很好 ，还会回购的,-,-,2021-06-09
1340,季**j,口味: 套餐1：欢辣大剧场445g/1袋(含鸭脖，猪肉片等，约20小包 ),好评,份量小的可怜，一包20也不划算,-,-,2021-06-22
1341,流**落,口味: 套餐5：畅享食刻组合450g/3袋(含鸭脖，虎皮凤爪等),好评,藕味道一般，凤爪超级好吃，一下就吃完了，爱了爱了 ,-,-,2021-06-09
1342,d**春,口味: 套餐12：什锦素卤礼包510g(约16小包),好评,包装品质：好 商品分量：可以 新鲜度：可以 ,-,-,2021-06-11
1343,假**钱,口味: 套餐1：欢辣大剧场445g/1袋(含鸭脖，猪肉片等，约20小包 ),好评,很久没买百草味的零食了，女朋友说还可以，下次再来买，,-,-,2021-06-12
1344,t**0,口味: 套餐1：欢辣大剧场445g/1袋(含鸭脖，猪肉片等，约20小包 ),好评,好吃呀，很实惠 ,-,-,2021-06-21
1345,冰**3,口味: 套餐1：欢辣大剧场445g/1袋(含鸭脖，猪肉片等，约20小包 ),好评,非常赞，很喜欢 ,-,-,2021-06-18
1346,彼**雨,口味: 套餐1：欢辣大剧场445g/1袋(含鸭脖，猪肉片等，约20小包 ),好评,哈哈哈，对客服百蜜瓜很满意。做活动时给小伙伴买的，价格可以，虽然这活动基本上天天做。快递神速，比预期的早到了两天。 ,-,-,2021-06-14
1347,t**0,口味: 套餐1：欢辣大剧场445g/1袋(含鸭脖，猪肉片等，约20小包 ),好评,物流很快，今天一收到就吃完了,-,-,2021-06-21
1348,太**了,口味: 套餐2：欢聚时刻组合374g/3袋(含麻辣牛肉、小鸡腿等),好评,口感味道：啊啊啊啊啊麻辣牛肉我好爱，那个味道绝了 ,-,-,2021-06-09
1349,t**6,口味: 套餐6：川蜀爽辣组合420g/3袋(含麻辣牛肉，虎皮凤爪等),好评,男朋友说挺多的 新鲜度：日期新鲜 ,-,-,2021-06-16
1350,太**亲,口味: 套餐11：鲜弹解馋礼包580g(约30小包),好评,haop ,-,-,2021-06-19
1351,t**6,口味: 套餐4：有荤有素组合635g/3袋(含鸭脖，土豆片等),好评,好吃，很好吃，，很喜欢，物流也很快。 ,-,-,2021-06-16
1352,哇**米,口味: 套餐11：鲜弹解馋礼包580g(约30小包),好评,618活动优惠还是很大的，味道很不错，很满意。以后再来 ,-,-,2021-06-14
1353,任**n,口味: 套餐1：欢辣大剧场445g/1袋(含鸭脖，猪肉片等，约20小包 ),好评,因为老婆，所以买了，味道还行，中规中矩 ,-,-,2021-06-14
1354,t**4,口味: 套餐7：夜半劲辣组合500g/约28小包(含鸭脖，素毛肚等),好评,包装品质：超级严实 口感味道：喜欢 ,-,-,2021-06-18
1355,t**6,口味: 套餐6：川蜀爽辣组合425g/约21小包(含麻辣牛肉，虎皮萌蛋等),好评,包装品质：真心不错 口感味道：真的好吃 ,-,-,2021-06-16
1356,t**2,口味: 套餐1：欢辣大剧场445g/1袋(含鸭脖，猪肉片等，约20小包 ),好评,很实惠，非常好用，物流也很快。,-,-,2021-06-17
1357,t**1,口味: 套餐3：休闲食光组合475g/3袋(含虎皮凤爪，面筋卷等),好评,面筋卷没卷起来，就是面筋块😅味道还行,-,-,2021-06-04
1358,l**4,口味: 套餐1：欢辣大剧场445g/1袋(含鸭脖，猪肉片等，约20小包 ),好评,针不戳 出了问题客服积极解决 不是推卸责任 这让我很舒服 东西也都挺好的 什么铺子什么🐿️ 以后就认准百草味了 ,-,-,2021-06-09
1359,t**6,口味: 套餐7：夜半劲辣组合500g/约28小包(含鸭脖，素毛肚等),好评,28小包？含素毛肚和鸭脖结果就只有这两个和一小盒辣条，其他评论嗮图区别也太大了吧鸭脖五小袋素毛肚八袋无语*了，客服也找不到跟机器人一样,-,-,2021-06-16
1360,爱**熙,口味: 套餐6：川蜀爽辣组合420g/3袋(含麻辣牛肉，虎皮凤爪等),好评,不错。快递速度很快。,-,-,2021-06-20
1361,t**9,口味: 套餐3：休闲食光组合475g/3袋(含虎皮凤爪，面筋卷等),好评,发货很快，包装的很好，价格也特别实惠，还有这么多也是不错了，值得购买 ,-,-,2021-06-24
1362,t**3,口味: 套餐4：有荤有素组合635g/3袋(含鸭脖，土豆片等),好评,略贵，性价比不高，一袋鸭脖只有9个，量少的可怜，大礼包什么的不划算 商品分量：少 ,-,-,2021-06-22
1363,哼**神,口味: 套餐4：有荤有素组合635g/3袋(含鸭脖，土豆片等),好评,味道一般，价格也贵，还没有之前的好吃，买的辣条真的垃圾，不过给退款了。但是今天发现有个不知道是不是发霉了，各位朋友还是不要买了，太差劲了。 ,-,-,2021-06-19
1364,t**4,口味: 套餐5：畅享食刻组合450g/3袋(含鸭脖，虎皮凤爪等),好评,包装品质：好 商品分量：足 新鲜度：好 口感味道：口感味道: 好，有很多不错的东西。 ,-,-,2021-06-18
1365,小**6,口味: 套餐1：欢辣大剧场445g/1袋(含鸭脖，猪肉片等，约20小包 ),好评,好吃，买了好多次了，尤其是搞活动的时候买，真的好划算呀 ,-,-,2021-06-10
1366,j**1,口味: 套餐12：什锦素卤礼包510g(约16小包),好评,非常实惠  但味道不是太好,-,-,2021-06-24
1367,t**2,口味: 套餐1：欢辣大剧场445g/1袋(含鸭脖，猪肉片等，约20小包 ),好评,唉，里面还有辣条，哎呀，真是，一定要和他那个说的，一点都不一样,-,-,2021-06-17
1368,冰**7,口味: 套餐6：川蜀爽辣组合420g/3袋(含麻辣牛肉，虎皮凤爪等),好评,包装品质：特别好 商品分量：量很多 口感味道：特别喜欢吃百草味，已经回购很多次了，物美价廉！ ,-,-,2021-06-08
1369,t**3,口味: 套餐2：欢聚时刻组合374g/3袋(含麻辣牛肉、小鸡腿等),好评,回购很多次了，感觉还不错，不喜欢吃藕的我都觉得这个藕片好吃 ,-,-,2021-06-22
1370,扛**浪,口味: 套餐1：欢辣大剧场445g/1袋(含鸭脖，猪肉片等，约20小包 ),好评,海哲支持张哲瀚张哲瀚😘😘😘😘😘😘超级好吃！！！！已经买了很多次百草味了 冲鸭！！！！！,-,-,2021-06-13
1371,百**九,口味: 套餐4：有荤有素组合635g/3袋(含鸭脖，土豆片等),好评,山人来啦！！！ ,-,-,2021-06-12
1372,张**风,口味: 套餐10：缤纷豆干大礼包500gx2袋(约52小包),好评,刚才拆了一包 里面有27小包 两包的话大概是54小包～味道的话一般 😂没有超级好吃哈哈 不过很划算 ,-,-,2021-06-04
1373,t**5,口味: 套餐7：夜半劲辣组合560g/3袋(含鸭脖，素毛肚等),好评,挺好的，奈斯 ,-,-,2021-06-18
1374,t**3,口味: 套餐10：缤纷豆干大礼包500g(约26小包),好评,包装品质：还不错， 商品分量：很少 口感味道：吃着好吃，就可惜这里套餐没有辣条套餐了 ,-,-,2021-06-22
1375,t**0,口味: 套餐7：夜半劲辣组合500g/约28小包(含鸭脖，素毛肚等),好评,鸭脖不是香辣的，不怎么喜欢，但是他的魔芋爽还有辣条还是很好吃的,-,-,2021-06-21
1376,l**6,口味: 套餐1：欢辣大剧场445g/1袋(含鸭脖，猪肉片等，约20小包 ),好评,包装品质：包装和品质是没得说的，非常好。 商品分量：套餐一的分量是真的很足，不错👍 口感味道：非常喜欢，会再来回购的。 ,-,-,2021-06-06
1377,t**2,口味: 套餐2：欢聚时刻组合378g/约9小包(含麻辣牛肉、鸭翅根等),好评,"xc尝了几个,很好吃哦,分装很好。停不💄下来,真的是无法言明🔩。没有坏的不好的,很🚴早之前就买过百草味。有📴礼物盒,早🚓上一包坚果。挺满意的⏳一次购物体验,",-,-,2021-06-17
1378,c**婷,口味: 套餐9：嗨辣过瘾组合610g/约23小包(含辣条，素毛肚等),好评,分量很足 味道好极了 一直很喜欢坚果 各种辣口的小零食，现在张哲瀚成为品牌大使， 海哲姐姐以后就选择百草味啦   ,-,-,2021-06-02
1379,纸**倾,口味: 套餐12：什锦素卤礼包510g(约16小包),好评,套餐9里面的鸡胸肉不好吃，套餐12里面，海带，笋尖，土豆片，藕都好吃，辣 ,-,-,2021-06-21
1380,千**苏,口味: 套餐1：欢辣大剧场445g/1袋(含鸭脖，猪肉片等，约20小包 ),好评,大礼包里种类很多，适合一个人过把嘴瘾没有负罪感,-,-,2021-06-11
1381,王**的,口味: 套餐4：有荤有素组合635g/3袋(含鸭脖，土豆片等),好评,当做办公室零食挺好的！！包装也很好！！！冲着易烊千玺买的，结果发现他不代言了！害！曾经合作过也对这个品牌有好感了！以后也会考虑继续买！！ ,-,-,2021-06-07
1382,k**8,口味: 套餐2：欢聚时刻组合378g/约9小包(含麻辣牛肉、鸭翅根等),好评,大辣片好吃，鸡腿很香，第一天孩子就吃完了 ,-,-,2021-06-12
1383,紫**星,口味: 套餐6：川蜀爽辣组合420g/3袋(含麻辣牛肉，虎皮凤爪等),好评,好吃，还便宜，喜欢吃麻辣猪肉脯,-,-,2021-06-11
1384,鬼**童,口味: 套餐1：欢辣大剧场445g/1袋(含鸭脖，猪肉片等，约20小包 ),好评,东西质量还可以，快递速度也很给力 里面的脆笋很辣很辣  ,-,-,2021-06-09
1385,晓**7,口味: 套餐7：夜半劲辣组合500g/约28小包(含鸭脖，素毛肚等),好评,商品分量：足  保质期：好，新鲜 ,-,-,2021-06-10
1386,t**3,口味: 套餐1：欢辣大剧场445g/1袋(含鸭脖，猪肉片等，约20小包 ),好评,猪肉片是肉脯吗，没吃到肉脯，其他味道还可以,-,-,2021-06-22
1387,w**u,口味: 套餐12：什锦素卤礼包510g(约16小包),好评,买了好多这个礼包，里面有每个人爱吃的东西，很实惠。 ,-,-,2021-06-12
1388,q**q,口味: 套餐4：有荤有素组合635g/3袋(含鸭脖，土豆片等),好评,包装品质：精致 商品分量：够吃 保质期：新的 新鲜度：新鲜 口感味道：好吃😋 ,-,-,2021-06-08
1389,我**6,口味: 套餐6：川蜀爽辣组合420g/3袋(含麻辣牛肉，虎皮凤爪等),好评,鸭脖比较好吃，虎皮凤爪就有股甜味,-,-,2021-06-11
1390,茄**瓜,口味: 套餐5：畅享食刻组合485g/3袋(含鸭脖，面筋卷等),好评,有点辣，其他味道还行，感觉量不多😂,-,-,2021-06-22
1391,机**0,口味: 套餐5：畅享食刻组合450g/3袋(含鸭脖，虎皮凤爪等),好评,虎皮凤爪味道不错，活动价格挺实惠的，分量挺足的，一共六大包！海哲支持张哲瀚！ ,-,-,2021-06-06
1392,他**情,口味: 套餐1：欢辣大剧场445g/1袋(含鸭脖，猪肉片等，约20小包 )·,好评,商品分量：不太多  口感味道：太辣了  ,-,-,2021-06-20
1393,奥**睛,口味: 套餐1：欢辣大剧场445g/1袋(含鸭脖，猪肉片等，约20小包 ),好评,商品分量：少 口感味道：还可以吧 ,-,-,2021-06-11
1394,梦**1,口味: 套餐4：有荤有素组合635g/3袋(含鸭脖，土豆片等),好评,份量很足，味道也不错，已经回购很多次了,-,-,2021-06-12
1395,l**0,口味: 套餐9：嗨辣过瘾组合610g/约23小包(含辣条，素毛肚等),好评,其实没有什么划算的！但是因为是张哲瀚代言我是没脾气的！ ,-,-,2021-06-22
1396,y**2,口味: 套餐7：夜半劲辣组合500g/约28小包(含鸭脖，素毛肚等),好评,太贵了，而且量特别少！！！不推荐购买！味道也不怎么样！ ,-,-,2021-06-20
1397,小**1,口味: 套餐1：欢辣大剧场445g/1袋(含鸭脖，猪肉片等，约20小包 ),好评,感觉太辣了，不符合我的口味，感觉一般不太好吃， ,-,-,2021-06-21
1398,t**7,口味: 套餐1：欢辣大剧场445g/1袋(含鸭脖，猪肉片等，约20小包 ),好评,第二天就到了非常奈斯两大包，里面有好几种，真的非常奈斯 ,-,-,2021-06-17
1399,t**5,口味: 套餐1：欢辣大剧场445g/1袋(含鸭脖，猪肉片等，约20小包 ),好评,没吃，不过百草味的东西肯定是有保证的 ,-,-,2021-06-18
1400,来**2,口味: 套餐9：嗨辣过瘾组合610g/约23小包(含辣条，素毛肚等),好评,好吃实惠，就是辣条有点干了咀嚼起来费劲儿，鸭脖要是再辣一点就更好吃了，没想到里面还有鸡胸肉。不错不错，哈哈哈哈哈哈，下次还来 ,-,-,2021-06-04
1401,t**8,口味: 套餐1：欢辣大剧场445g/1袋(含鸭脖，猪肉片等，约20小包 ),好评,活动做下来还是比较划算噢～等下次活动买 ,-,-,2021-06-18
1402,古**名,口味: 套餐5：畅享食刻组合450g/3袋(含鸭脖，虎皮凤爪等),好评,难吃心仪很久了，趁活动时候买真的太划算了，喜欢的不要犹豫啊,-,-,2021-06-14
1403,x**家,口味: 套餐6：川蜀爽辣组合420g/3袋(含麻辣牛肉，虎皮凤爪等),好评,本来就是百草味家老客户了，吃的图看详情就行，就不上啦  强推：卤味鸡爪，麻辣牛肉，素毛肚 都很可，闭眼入  ps：阿絮和老温要好好的，温周yyds！,-,-,2021-06-05
1404,灵**奇,口味: 套餐10：缤纷豆干大礼包500g(约26小包),好评,量其实并没有想象中的优惠,-,-,2021-06-22
1405,小**t,口味: 套餐1：欢辣大剧场445g/1袋(含鸭脖，猪肉片等，约20小包 ),好评,支持老婆张哲瀚！开开心心浪浪钉！没给任何老婆的周边，只好自己摆上点。 凤爪超极好吃！太划算啦！百草味yyds！ ,-,-,2021-05-31
1406,纸**倾,口味: 套餐10：缤纷豆干大礼包500g(约26小包),好评,豆干种类不多，味道一般 ,-,-,2021-06-21
1407,李**磊,口味: 套餐5：畅享食刻组合450g/3袋(含鸭脖，虎皮凤爪等),好评,口感味道：有点微辣的，很喜欢吃这个！ ,-,-,2021-06-10
1408,掠**摇,口味: 套餐1：欢辣大剧场445g/1袋(含鸭脖，猪肉片等，约20小包 ),好评,这个脆笋真是巨辣无比，刚入口没感觉，后来越来越辣 ,-,-,2021-06-20
1409,云**光,口味: 套餐3：休闲食光组合475g/3袋(含虎皮凤爪，面筋卷等),好评,又来买张哲瀚代言的百草味啦，爱吃肉肉别错过 ,-,-,2021-06-13
1410,陈**2,口味: 套餐1：欢辣大剧场445g/1袋(含鸭脖，猪肉片等，约20小包 ),好评,买给我家狗吃的，不出我所料，那只狗表示很喜欢 ,-,-,2021-06-20
1411,t**3,口味: 套餐2：欢聚时刻组合374g/3袋(含麻辣牛肉、小鸡腿等),好评,挺少的，呃，牛肉不是很好吃，鸡腿还行 ,-,-,2021-06-22
1412,t**6,口味: 套餐1：欢辣大剧场445g/1袋(含鸭脖，猪肉片等，约20小包 ),好评,包装品质：好看 商品分量：好 保质期：没过期 新鲜度：新鲜 口感味道：好吃 ,-,-,2021-06-16
1413,不**8,口味: 套餐1：欢辣大剧场445g/1袋(含鸭脖，猪肉片等，约20小包 ),好评,非常棒，很多喜欢的，而且小包装吃起来没负担,-,-,2021-06-12
1414,文**8,口味: 套餐9：嗨辣过瘾组合610g/约23小包(含辣条，素毛肚等),好评,里面都是辣条和毛肚，并没有所说的里面有23包组合装的大礼包，辣条太硬了，个人感觉没有卫龙牌的辣条味道好，感觉此次购物上当了☹️,-,-,2021-06-18
1415,彭**8,口味: 套餐3：休闲食光组合475g/3袋(含虎皮凤爪，面筋卷等),好评,"张哲瀚家海哲看小哲推荐来买百草味啦！以前只吃过百草味的坚果！第一次吃百草味的零食,味道真的不错,分量也挺好的！还会购买！ ",-,-,2021-05-29
1416,t**9,口味: 套餐5：畅享食刻组合450g/3袋(含鸭脖，虎皮凤爪等),好评,虎皮凤爪炒鸡好吃，而且不辣,-,-,2021-06-24
1417,酷**x,口味: 套餐1：欢辣大剧场445g/1袋(含鸭脖，猪肉片等，约20小包 ),好评,还可以吧整体挺好吃的就是想和他们合作 ,-,-,2021-06-11
1418,姑**5,口味: 套餐3：休闲食光组合475g/3袋(含虎皮凤爪，面筋卷等),好评,面筋有点不太好吃，有点硬吧，面筋太实了，藕好吃，鸭脖好吃，鸡爪也不错 ,-,-,2021-06-22
1419,t**2,口味: 套餐3：休闲食光组合475g/3袋(含虎皮凤爪，面筋卷等),好评,味道不错，挺好的，价格也实惠,-,-,2021-06-17
1420,鄂**地,口味: 套餐6：川蜀爽辣组合420g/3袋(含麻辣牛肉，虎皮凤爪等),好评,东西还是很好吃的，特别推荐虎皮鸡爪，味道特别棒，快递也很快！,-,-,2021-06-14
1421,x**家,口味: 套餐9：嗨辣过瘾组合610g/约23小包(含辣条，素毛肚等),好评,本来就是百草味家老客户了，吃的图看详情就行，就不上啦  强推：卤味鸡爪，麻辣牛肉，素毛肚 都很可  ps：阿絮和老温要好好的，温周yyds！,-,-,2021-06-05
1422,0**0,口味: 套餐2：欢聚时刻组合374g/3袋(含麻辣牛肉、小鸡腿等),好评,鸡腿味道不太行，麻辣牛肉满分！！！！ ,-,-,2021-06-22
1423,t**9,口味: 套餐9：嗨辣过瘾组合610g/约23小包(含辣条，素毛肚等),好评,不值，辣条很硬不好吃 其他东西很少,-,-,2021-06-24
1424,t**9,口味: 套餐8：荤素集合组合403g/约16小包(含牛板筋，鸭锁骨等),好评,没啥优惠的感觉，平时买也就这个价钱。,-,-,2021-06-24
1425,t**9,口味: 套餐7：夜半劲辣组合500g/约28小包(含鸭脖，素毛肚等),好评,买了两份百草味的东西，非常喜欢吃百草味的东西，都超好吃的，这次买了两份，有点后悔买太少了，之前吃过一次鸭脖就感觉很好吃了，这次抓紧买了一些，真的超级喜欢的，喜欢吃百草味的，可以买这家的,-,-,2021-06-24
1426,z**1,口味: 套餐4：有荤有素组合635g/3袋(含鸭脖，土豆片等),好评,不太好吃，有点贵，上当了感觉，土豆很多，肉很少,-,-,2021-06-20
1427,z**7,口味: 套餐4：海的味道组合425g/约20小包(含蟹味棒，小鱼仔等),好评,挺划算的，百草味也挺好吃的 ,-,-,2021-06-09
1428,纸**倾,口味: 套餐9：嗨辣过瘾组合610g/约23小包(含辣条，素毛肚等),好评,海带，笋尖，藕，土豆片都好吃，辣辣的 ,-,-,2021-06-21
1429,唯**空,口味: 套餐1：欢辣大剧场445g/1袋(含鸭脖，猪肉片等，约20小包 ),好评,物流很快，好吃 ,-,-,2021-06-24
1430,t**0,口味: 套餐4：有荤有素组合635g/3袋(含鸭脖，土豆片等),好评,其他的都还好，土豆片是真的难吃，一股子怪味,-,-,2021-06-21
1431,t**3,口味: 套餐7：夜半劲辣组合500g/约28小包(含鸭脖，素毛肚等),好评,六一节日的优惠买了两百一大箱，满足~ ,-,-,2021-06-22
1432,w**u,口味: 套餐3：休闲食光组合475g/3袋(含虎皮凤爪，面筋卷等),好评,礼包很不错，而且都是喜欢吃的，日期包装很好。 ,-,-,2021-06-12
1433,紫**星,口味: 套餐1：欢辣大剧场445g/1袋(含鸭脖，猪肉片等，约20小包 ),好评,这个里面猪肉脯，还有鱼丸喜欢吃好吃，推荐,-,-,2021-06-11
1434,沐**落,口味: 套餐3：休闲食光组合475g/3袋(含虎皮凤爪，面筋卷等),好评,支持小哲商务，和同事，也是海哲小姐姐，合买了6种组合套餐，满满一箱超级幸福，以后上完课就可以补充能量ξ( ✿＞◡❛),-,-,2021-05-30
1435,c**9,口味: 套餐1：欢辣大剧场445g/1袋(含鸭脖，猪肉片等，约20小包 ),好评,还行…比实体便宜,-,-,2021-06-11
1436,l**r,口味: 套餐1：欢辣大剧场445g/1袋(含鸭脖，猪肉片等，约20小包 ),好评, 本人网购非常多，压根评价不过来 也几乎没有给过差评，复制这个评价就说明东西没有缺陷，各方面都可以 还会会再买！   东西已经吃完了没有照片了 随便拍一张 反正蛮好吃的 ,-,-,2021-06-03
1437,2**y,口味: 套餐2：欢聚时刻组合374g/3袋(含麻辣牛肉、小鸡腿等),好评,牛肉里面全是芝麻，没牛肉味，小差评，不开心！,-,-,2021-06-20
1438,伊**4,口味: 套餐2：欢聚时刻组合374g/3袋(含麻辣牛肉、小鸡腿等),好评,外包装有破损，还好没丢东西,-,-,2021-06-20
1439,t**1,口味: 套餐1：欢辣大剧场445g/1袋(含鸭脖，猪肉片等，约20小包 ),好评,味道不错，里面的肉片特别好吃,-,-,2021-06-04
