871,t**8,口味: 套餐1：欢辣大剧场445g/1袋(含鸭脖，猪肉片等，约20小包 ),好评,他那肉质挺好吃的辣度适中,-,-,2021-06-18
872,小**y,口味: 套餐7：夜半劲辣组合500g/约28小包(含鸭脖，素毛肚等),好评,东西不错，挺好吃的，好评，价格也还可以,-,-,2021-06-17
873,九**°,口味: 套餐1：欢辣大剧场445g/1袋(含鸭脖，猪肉片等，约20小包 ),好评,一起二十小包 素多肉少。都很小一包。 ,-,-,2021-06-24
874,t**5,口味: 套餐7：夜半劲辣组合500g/约28小包(含鸭脖，素毛肚等),好评,好吃，小贵 ,-,-,2021-06-18
875,汤**醴,口味: 套餐9：嗨辣过瘾组合610g/约23小包(含辣条，素毛肚等),好评,辣条有点难吃，其他的都还好-_-  ,-,-,2021-06-23
876,t**8,口味: 套餐1：欢辣大剧场445g/1袋(含鸭脖，猪肉片等，约20小包 ),好评,停不下来,-,-,2021-06-18
877,q**m,口味: 套餐10：缤纷豆干大礼包500g(约26小包),好评,抢到了活动1送1  太划算了。 ,-,-,2021-06-18
878,韩**哈,口味: 套餐1：欢辣大剧场445g/1袋(含鸭脖，猪肉片等，约20小包 ),好评,量很少，而且我没看到有猪肉片啊 ,-,-,2021-06-23
879,t**1,口味: 套餐6：川蜀爽辣组合420g/3袋(含麻辣牛肉，虎皮凤爪等),好评,味道好吃，很好吃，一直吃这个牌子的，味道挺好的,-,-,2021-06-04
880,幸**6,口味: 套餐11：鲜弹解馋礼包580g(约30小包),好评,量足  味道也好,-,-,2021-06-19
881,t**9,口味: 套餐4：有荤有素组合635g/3袋(含鸭脖，土豆片等),好评,给妹妹买的，她很喜欢，也很实惠，大赞 ,-,-,2021-06-24
882,瘦**卷,口味: 套餐1：欢辣大剧场445g/1袋(含鸭脖，猪肉片等，约20小包 ),好评,百澜澜服务满意。东西很划算哦 ,-,-,2021-06-17
883,爱**7,口味: 套餐3：休闲食光组合475g/3袋(含虎皮凤爪，面筋卷等),好评,舍友们有给妹妹买的 我也给侄子买了一份 还加赠品太超值了 舍友也买了回来 个人有个人的口味 不过总体来说好吃的 猪肉脯带点辣味配饼子吃太好吃了 客服服务满意 ,-,-,2021-06-09
884,t**9,口味: 套餐7：夜半劲辣组合500g/约28小包(含鸭脖，素毛肚等),好评,非常不错！618买的，感觉对得起他的价格,-,-,2021-06-24
885,m**迪,口味: 套餐2：欢聚时刻组合394g/3袋(含铁板鱿鱼、小鸡腿等),好评,鸡腿一般而且还小,-,-,2021-06-25
886,t**6,口味: 套餐1：欢辣大剧场445g/1袋(含鸭脖，猪肉片等，约20小包 ),好评,感觉味道比较好，下次再来买。 ,-,-,2021-06-16
887,t**4,口味: 套餐7：夜半劲辣组合500g/约28小包(含鸭脖，素毛肚等),好评,口感味道：味道很好，很有味 ,-,-,2021-06-18
888,t**0,口味: 套餐1：欢辣大剧场445g/1袋(含鸭脖，猪肉片等，约20小包 ),好评,带劲，藕非常好吃还有猪肉片,-,-,2021-06-21
889,t**9,口味: 套餐8：荤素集合组合403g/约16小包(含牛板筋，鸭锁骨等),好评,还没吃，不过量很多，16块多6包，值了，一直吃他们家零食 ,-,-,2021-06-24
890,赵**0,口味: 套餐2：欢聚时刻组合374g/3袋(含麻辣牛肉、小鸡腿等),好评,收到啦，辣辣的蛮好吃的，618很便宜,-,-,2021-06-18
891,t**6,口味: 套餐1：欢辣大剧场445g/1袋(含鸭脖，猪肉片等，约20小包 ),好评,有20小包，还行 ,-,-,2021-06-16
892,t**4,口味: 套餐1：欢辣大剧场445g/1袋(含鸭脖，猪肉片等，约20小包 ),好评,口感味道：味道很好，很入味 ,-,-,2021-06-18
893,罗**魇,口味: 套餐5：畅享食刻组合450g/3袋(含鸭脖，虎皮凤爪等),好评,口感味道：还不错  ,-,-,2021-06-20
894,t**7,口味: 套餐1：欢辣大剧场445g/1袋(含鸭脖，猪肉片等，约20小包 ),好评,口感味道：好吃😋 ,-,-,2021-06-17
895,t**9,口味: 套餐6：川蜀爽辣组合420g/3袋(含麻辣牛肉，虎皮凤爪等),好评,口感味道：口感真不错 ,-,-,2021-06-24
896,a**4,口味: 套餐2：欢聚时刻组合374g/3袋(含麻辣牛肉、小鸡腿等),好评,(๑•̀ㅂ•́)و✧价格超优惠,-,-,2021-06-19
897,t**9,口味: 套餐9：嗨辣过瘾组合610g/约23小包(含辣条，素毛肚等),好评,包装品质：太牛！！ 商品分量：好多！！！ 保质期：好久！！ 新鲜度：牛啊！ 口感味道：太棒了！ ,-,-,2021-06-24
898,t**8,口味: 套餐1：欢辣大剧场445g/1袋(含鸭脖，猪肉片等，约20小包 ),好评,还不错，品类丰富，味道也还可以 ,-,-,2021-06-18
899,z**1,口味: 套餐8：荤素集合组合403g/约16小包(含牛板筋，鸭锁骨等),好评,藕不好吃，豆干还行吧，有不是很好吃 ,-,-,2021-06-24
900,泰**3,口味: 套餐1：欢辣大剧场445g/1袋(含鸭脖，猪肉片等，约20小包 ),好评,活动入的感觉挺划算,-,-,2021-06-19
901,嵩**3,口味: 套餐6：川蜀爽辣组合420g/3袋(含麻辣牛肉，虎皮凤爪等),好评,实惠，好吃😋,-,-,2021-06-16
902,y**e,口味: 套餐6：川蜀爽辣组合420g/3袋(含麻辣牛肉，虎皮凤爪等),好评,老婆代言的能不好吃嘛 买就完事了！（开开心心浪浪钉,-,-,2021-06-20
903,t**6,口味: 套餐8：荤素集合组合403g/约16小包(含牛板筋，鸭锁骨等),好评,我觉得好好吃，不愧是百草味,-,-,2021-06-16
904,t**7,口味: 套餐8：荤素集合组合403g/约16小包(含牛板筋，鸭锁骨等),好评,保质期：可以 新鲜度：行 ,-,-,2021-06-17
905,1**a,口味: 套餐6：川蜀爽辣组合420g/3袋(含麻辣牛肉，虎皮凤爪等),好评,牛肉里吃出了石子，直接丢掉了,-,-,2021-06-23
906,t**3,口味: 套餐1：欢辣大剧场445g/1袋(含鸭脖，猪肉片等，约20小包 ),好评,经济又实惠，还是牌子货呢！,-,-,2021-06-22
907,t**5,口味: 套餐3：休闲食光组合475g/3袋(含虎皮凤爪，面筋卷等),好评,太太太好吃了，以后买零食不用挑了。,-,-,2021-06-18
908,t**1,口味: 套餐1：欢辣大剧场445g/1袋(含鸭脖，猪肉片等，约20小包 ),好评,🎈商品收到了，包装得很好，物流非常快，客服态度很积极，有问题及时解答！总体来说非常满意！,-,-,2021-06-04
909,a**6,口味: 套餐1：欢辣大剧场445g/1袋(含鸭脖，猪肉片等，约20小包 ),好评,口感味道：不错的 ,-,-,2021-06-17
910,风**4,口味: 套餐1：欢辣大剧场445g/1袋(含鸭脖，猪肉片等，约20小包 ),好评,很好吃，比较还吃辣的，一包里边种类很多，值得入手 ,-,-,2021-06-17
911,t**0,口味: 套餐1：欢辣大剧场445g/1袋(含鸭脖，猪肉片等，约20小包 ),好评,还行吧40块挺划算的 ,-,-,2021-06-21
912,冰**骨,口味: 套餐10：缤纷豆干大礼包500g(约26小包),好评,喜欢，多次购买，满分 ,-,-,2021-06-25
913,d**o,口味: 套餐1：欢辣大剧场445g/1袋(含鸭脖，猪肉片等，约20小包 ),好评,一次买两份，一大包，满足,-,-,2021-06-19
914,胥**人,口味: 套餐1：欢辣大剧场445g/1袋(含鸭脖，猪肉片等，约20小包 ),好评,还挺好吃，减肥路的拦路虎啊！,-,-,2021-06-20
915,t**8,口味: 套餐1：欢辣大剧场445g/1袋(含鸭脖，猪肉片等，约20小包 ),好评,味道不错，不辣,-,-,2021-06-18
916,t**8,口味: 套餐3：休闲食光组合475g/3袋(含虎皮凤爪，面筋卷等),好评,简直太好吃了，只能用完美来形容！强烈推荐！ ,-,-,2021-06-18
917,求**e,口味: 套餐1：欢辣大剧场445g/1袋(含鸭脖，猪肉片等，约20小包 ),好评,好吃，味道都不错，会回购,-,-,2021-06-16
918,谢**水,口味: 套餐11：鲜弹解馋礼包580g(约30小包),好评,尝过的味道都还不错，礼包里每样的分量都不多但总体还算可以，一定要活动期间买才比较划算哦 ,-,-,2021-06-11
919,顽**雨,口味: 套餐1：欢辣大剧场445g/1袋(含鸭脖，猪肉片等，约20小包 ),好评,不是在逗我？  40块  就这一小包  不够塞牙缝的   ,-,-,2021-06-21
920,t**9,口味: 套餐1：欢辣大剧场445g/1袋(含鸭脖，猪肉片等，约20小包 ),好评,送我大侄子的，他喜欢就好 ,-,-,2021-06-24
921,t**2,口味: 套餐9：嗨辣过瘾组合610g/约23小包(含辣条，素毛肚等),好评,包装品质：非常快就收到了， 因为有不同的发货仓 ,-,-,2021-06-17
922,逗**逗,口味: 套餐1：欢辣大剧场445g/1袋(含鸭脖，猪肉片等，约20小包 ),好评,好评，但是好小包,-,-,2021-06-26
923,浑**人,口味: 套餐2：欢聚时刻组合374g/3袋(含麻辣牛肉、小鸡腿等),好评,包装品质：好 商品分量：足 新鲜度：很新鲜 口感味道：味道不错 ,-,-,2021-06-10
924,t**9,口味: 套餐1：欢辣大剧场445g/1袋(含鸭脖，猪肉片等，约20小包 ),好评,除了鸭脖不好吃，其他的都挺好,-,-,2021-06-24
925,t**3,口味: 套餐2：欢聚时刻组合374g/3袋(含麻辣牛肉、小鸡腿等),好评,好多，值得购买,-,-,2021-06-22
926,暖**r,口味: 套餐1：欢辣大剧场445g/1袋(含鸭脖，猪肉片等，约20小包 ),好评,很多好吃的，很实惠 ,-,-,2021-06-24
927,爱**姐,口味: 套餐3：休闲食光组合475g/3袋(含虎皮凤爪，面筋卷等),好评,包装品质：✿✿ヽ(°▽°)ノ✿ ,-,-,2021-06-20
928,k**5,口味: 套餐1：欢辣大剧场445g/1袋(含鸭脖，猪肉片等，约20小包 ),好评,非常好吃，大礼包很实在,-,-,2021-06-17
929,t**2,口味: 套餐1：欢辣大剧场445g/1袋(含鸭脖，猪肉片等，约20小包 ),好评,抢到了前一千很开心，但是两袋一天就吃完了哈哈哈哈 ,-,-,2021-06-17
930,t**8,口味: 套餐8：荤素集合组合403g/约16小包(含牛板筋，鸭锁骨等),好评,挺好吃的，女朋友几天就吃完了,-,-,2021-06-18
931,茶**o,口味: 套餐5：畅享食刻组合450g/3袋(含鸭脖，虎皮凤爪等),好评,收到啦！！！海哲来评论啦！！！！ 超级好吃就是藕有点太甜了哈哈哈 小哲吃了都说好！ ,-,-,2021-06-12
932,爱**0,口味: 套餐11：鲜弹解馋礼包580g(约30小包),好评,真的很划算，非常划算。 ,-,-,2021-06-20
933,t**7,口味: 套餐2：欢聚时刻组合374g/3袋(含麻辣牛肉、小鸡腿等),好评,很划算，会回购的,-,-,2021-06-17
934,t**3,口味: 套餐1：欢辣大剧场445g/1袋(含鸭脖，猪肉片等，约20小包 ),好评,物流快   女朋友很喜欢   包装也很好,-,-,2021-06-22
935,t**4,口味: 套餐3：休闲食光组合475g/3袋(含虎皮凤爪，面筋卷等),好评,非常好吃，一直选的百草味,-,-,2021-06-18
936,t**3,口味: 套餐8：荤素集合组合403g/约16小包(含牛板筋，鸭锁骨等),好评,瀚瀚子代言的零食就是好吃！ ,-,-,2021-06-22
937,赵**寒,口味: 套餐1：欢辣大剧场445g/1袋(含鸭脖，猪肉片等，约20小包 ),好评,卖给男朋友的，应该很不错 ,-,-,2021-06-18
938,t**7,口味: 套餐7：夜半劲辣组合500g/约28小包(含鸭脖，素毛肚等),好评,gl经常买百草味的产品！！不管是面包还是零食类🍜这个品牌值得信赖！！！🐾💎真的好吃，🎁包装完整非常好👸两大袋很好看🎉里面是独立小包商品分量挺多的🔦这个品牌值得信赖🏣迫不及待拆了一袋无骨凤爪和辣味包 ,-,-,2021-06-17
939,毓**昳,口味: 套餐1：欢辣大剧场445g/1袋(含鸭脖，猪肉片等，约20小包 ),好评,口感味道：👍👍👍 ,-,-,2021-06-23
940,t**8,口味: 套餐1：欢辣大剧场445g/1袋(含鸭脖，猪肉片等，约20小包 ),好评,可以，不错,-,-,2021-06-18
941,唐**长,口味: 套餐4：有荤有素组合635g/3袋(含鸭脖，土豆片等),好评,真的很不错哦，很好吃。包装也不错！ ,-,-,2021-06-16
942,t**3,口味: 套餐6：川蜀爽辣组合420g/3袋(含麻辣牛肉，虎皮凤爪等),好评,太实惠了,-,-,2021-06-22
943,t**6,口味: 套餐1：欢辣大剧场445g/1袋(含鸭脖，猪肉片等，约20小包 ),好评,喜欢的朋友可以购买 ,-,-,2021-06-16
944,流**落,口味: 套餐2：欢聚时刻组合374g/3袋(含麻辣牛肉、小鸡腿等),好评,鸡腿味道还行，但是有点干，牛肉很香辣，喜欢。藕不太行，没有很入味，都是浮在表面的辣 ,-,-,2021-06-09
945,臣**忙,口味: 套餐1：欢辣大剧场445g/1袋(含鸭脖，猪肉片等，约20小包 ),好评,还可以吧 豆腐干超好吃 ,-,-,2021-06-15
946,殇**5,口味: 套餐1：欢辣大剧场445g/1袋(含鸭脖，猪肉片等，约20小包 ),好评,挺不错的，喜欢,-,-,2021-06-24
947,t**9,口味: 套餐4：有荤有素组合635g/3袋(含鸭脖，土豆片等),好评,好吃的零食和我的老婆相比，老婆yyds ,-,-,2021-06-24
948,墨**秋,口味: 套餐7：夜半劲辣组合500g/约28小包(含鸭脖，素毛肚等),好评,好吃，很喜欢,-,-,2021-06-22
949,确**o,口味: 套餐1：欢辣大剧场445g/1袋(含鸭脖，猪肉片等，约20小包 ),好评,很实惠，好吃 ,-,-,2021-06-23
950,t**8,口味: 套餐2：欢聚时刻组合374g/3袋(含麻辣牛肉、小鸡腿等),好评,喜欢这个味道，味道也不错。 ,-,-,2021-06-18
951,李**0,口味: 套餐1：欢辣大剧场445g/1袋(含鸭脖，猪肉片等，约20小包 ),好评,种类丰富 味道还不错,-,-,2021-06-20
952,常**b,口味: 套餐1：欢辣大剧场445g/1袋(含鸭脖，猪肉片等，约20小包 ),好评,好吃，划算，棒！ ,-,-,2021-06-15
953,t**6,口味: 套餐1：欢辣大剧场445g/1袋(含鸭脖，猪肉片等，约20小包 ),好评,开开心心浪浪钉。支持张老师。 ,-,-,2021-06-16
954,t**0,口味: 套餐6：川蜀爽辣组合420g/3袋(含麻辣牛肉，虎皮凤爪等),好评,个人喜欢这个组合，好吃 ,-,-,2021-06-21
955,t**6,口味: 套餐4：有荤有素组合635g/3袋(含鸭脖，土豆片等),好评,百草味值得信赖，好吃,-,-,2021-06-16
956,等**呢,口味: 套餐1：欢辣大剧场445g/1袋(含鸭脖，猪肉片等，约20小包 ),好评,喜欢里面藕丁，超好吃。 ,-,-,2021-06-18
957,尘**年,口味: 套餐3：休闲食光组合475g/3袋(含虎皮凤爪，面筋卷等),好评,凤爪好评，其他的也不错,-,-,2021-06-19
958,d**9,口味: 套餐1：欢辣大剧场445g/1袋(含鸭脖，猪肉片等，约20小包 ),好评,不错，这价格没的说,-,-,2021-06-24
959,飞**w,口味: 套餐1：欢辣大剧场445g/1袋(含鸭脖，猪肉片等，约20小包 ),好评,味道不错，趁活动，囤货,-,-,2021-06-20
960,t**8,口味: 套餐2：欢聚时刻组合374g/3袋(含麻辣牛肉、小鸡腿等),好评,大牌子值得信赖，很好吃，觉得最好吃的是藕,-,-,2021-06-18
961,l**9,口味: 套餐1：欢辣大剧场445g/1袋(含鸭脖，猪肉片等，约20小包 ),好评,对我不太能吃辣的人，是有点辣的，但是好吃，素的都很好吃,-,-,2021-06-15
962,1**留,口味: 套餐11：鲜弹解馋礼包580g(约30小包),好评,还是百草味的零食好吃,-,-,2021-06-17
963,3**y,口味: 套餐1：欢辣大剧场445g/1袋(含鸭脖，猪肉片等，约20小包 ),好评,"还不错,猪肉片是真的香 ",-,-,2021-06-15
964,天**邪,口味: 套餐4：有荤有素组合635g/3袋(含鸭脖，土豆片等),好评,给对象买的，他说还可以 ,-,-,2021-06-20
965,镜**框,口味: 套餐3：休闲食光组合475g/3袋(含虎皮凤爪，面筋卷等),好评,感觉鸡爪子还是不错的 ,-,-,2021-06-24
966,小**2,口味: 套餐10：缤纷豆干大礼包500g(约26小包),好评,他们家的东西都挺好吃的。 ,-,-,2021-06-18
967,t**5,口味: 套餐10：缤纷豆干大礼包500gx2袋(约52小包),好评,好吃，很多，吃多了拉肚子,-,-,2021-06-18
968,t**9,口味: 套餐11：鲜弹解馋礼包580g(约30小包),好评,真的好，真的划算，发货速度一流，赞赞赞 ,-,-,2021-06-24
969,t**7,口味: 套餐7：夜半劲辣组合500g/约28小包(含鸭脖，素毛肚等),好评,感觉不太好，东西好少呀，大部分都是那种像是散装的小袋辣条，不太划算,-,-,2021-06-17
970,t**1,口味: 套餐2：欢聚时刻组合374g/3袋(含麻辣牛肉、小鸡腿等),好评,网上买便宜,-,-,2021-06-04
971,t**9,口味: 套餐1：欢辣大剧场445g/1袋(含鸭脖，猪肉片等，约20小包 ),好评,好吃，依旧是老味道 ,-,-,2021-06-24
972,t**1,口味: 套餐1：欢辣大剧场445g/1袋(含鸭脖，猪肉片等，约20小包 ),好评,满满的两大包  买一送一  晚上可以愉快的吃辣辣～ ,-,-,2021-06-04
973,t**4,口味: 套餐1：欢辣大剧场445g/1袋(含鸭脖，猪肉片等，约20小包 ),好评,一大袋一会就吃完了 ,-,-,2021-06-18
974,无**4,口味: 套餐9：嗨辣过瘾组合610g/约23小包(含辣条，素毛肚等),好评,不是我说呀，就冲百草味这个服务态度，我爱了，以后买零食必买百草味 ,-,-,2021-06-19
975,t**5,口味: 套餐11：鲜弹解馋礼包580g(约30小包),好评,挺好的！分量很足！味道也🉑 ,-,-,2021-06-18
976,快**哥,口味: 套餐6：川蜀爽辣组合420g/3袋(含麻辣牛肉，虎皮凤爪等),好评,拜拜咯够累的了解封符咒我是黄金叶片子出来的时候我的问题是,-,-,2021-06-26
977,木**玖,口味: 套餐1：欢辣大剧场445g/1袋(含鸭脖，猪肉片等，约20小包 ),好评,不错的 种类很多 味道不错,-,-,2021-06-15
978,t**9,口味: 套餐10：缤纷豆干大礼包500gx2袋(约52小包),好评,挺好的，推荐 ,-,-,2021-06-24
979,t**9,口味: 套餐7：夜半劲辣组合560g/3袋(含鸭脖，素毛肚等),好评,服务很周到 快递也很快,-,-,2021-06-24
980,黑**啦,口味: 套餐6：川蜀爽辣组合420g/3袋(含麻辣牛肉，虎皮凤爪等),好评,鸡脚不好吃，牛肉挺好吃的 ,-,-,2021-06-23
981,t**5,口味: 套餐9：嗨辣过瘾组合610g/约23小包(含辣条，素毛肚等),好评,零食还是要看百草味，服务好物流快，零食还好吃,-,-,2021-06-18
982,丹**杰,口味: 套餐4：有荤有素组合635g/3袋(含鸭脖，土豆片等),好评,都还不错，分量便小,-,-,2021-06-18
983,t**1,口味: 套餐1：欢辣大剧场445g/1袋(含鸭脖，猪肉片等，约20小包 ),好评,味道特别好，肉很多 ,-,-,2021-06-04
984,熙**儿,口味: 套餐1：欢辣大剧场445g/1袋(含鸭脖，猪肉片等，约20小包 ),好评,种类多，味道也不错,-,-,2021-06-17
985,雨**m,口味: 套餐9：嗨辣过瘾组合610g/约23小包(含辣条，素毛肚等),好评,味道不错，种类也多 ,-,-,2021-06-16
986,大**3,口味: 套餐6：川蜀爽辣组合420g/3袋(含麻辣牛肉，虎皮凤爪等),好评,包装品质：包装很精致 口感味道：味道偏辣 商品分量：份量足 保质期：保质期上个月 ,-,-,2021-06-10
987,t**6,口味: 套餐4：有荤有素组合635g/3袋(含鸭脖，土豆片等),好评,鸭脖真的很好吃，狼牙土豆也好吃，而且快递很快 ,-,-,2021-06-16
988,向**油,口味: 套餐1：欢辣大剧场445g/1袋(含鸭脖，猪肉片等，约20小包 ),好评,非常喜欢！,-,-,2021-06-21
989,t**7,口味: 套餐3：休闲食光组合475g/3袋(含虎皮凤爪，面筋卷等),好评,很好哦，很划算,-,-,2021-06-17
990,t**9,口味: 套餐5：畅享食刻组合485g/3袋(含鸭脖，面筋卷等),好评,送闺密的，挺棒的看起来,-,-,2021-06-24
991,年**l,口味: 套餐1：欢辣大剧场445g/1袋(含鸭脖，猪肉片等，约20小包 ),好评,鸡爪  藕片 超级好吃 ,-,-,2021-06-15
992,t**9,口味: 套餐7：夜半劲辣组合500g/约28小包(含鸭脖，素毛肚等),好评,虎皮鸡爪真的超好吃,-,-,2021-06-24
993,糖**9,口味: 套餐1：欢辣大剧场445g/1袋(含鸭脖，猪肉片等，约20小包 ),好评,为哲瀚而来。味道还不错，值得购买 ,-,-,2021-06-19
994,飘**铃,口味: 套餐8：荤素集合组合403g/约16小包(含牛板筋，鸭锁骨等),好评,超级好吃😋，买了几次了，每次都很满意。,-,-,2021-06-16
995,1**e,口味: 套餐4：有荤有素组合635g/3袋(含鸭脖，土豆片等),好评,发货速度快  东西也好吃  推荐购买的,-,-,2021-06-20
996,一**间,口味: 套餐4：有荤有素组合635g/3袋(含鸭脖，土豆片等),好评,好吃We are facing a dark time right now.  我们正在面临着黑暗时刻  Some of us are stuck at home.  我们中有人不得不禁足在家  Some are stuck far away from home.  有人不得不被迫滞留他乡  Some of us have lost their jobs.  我们中有人失去了工作  And some have to shut down their businesses.  有人不得不关停了赖以为生的生意  Some of us are cutting down their expenses.  我们中有人不得不节衣缩食  And some can’t even pay their rent and bills.  有人甚至已经无力支付房租和账单  Some can’t go back to ,-,-,2021-06-21
997,t**1,口味: 套餐1：欢辣大剧场445g/1袋(含鸭脖，猪肉片等，约20小包 ),好评,发货超快，一天就到了,-,-,2021-06-04
998,彭**g,口味: 套餐1：欢辣大剧场445g/1袋(含鸭脖，猪肉片等，约20小包 ),好评,不错，物美价廉，挺好的。 ,-,-,2021-06-21
999,呆**沐,口味: 套餐1：欢辣大剧场445g/1袋(含鸭脖，猪肉片等，约20小包 ),好评,给女朋友买的，不知道,-,-,2021-06-23
1000,与**底,口味: 套餐4：有荤有素组合635g/3袋(含鸭脖，土豆片等),好评,好吃！好吃！狼牙土豆绝了,-,-,2021-06-16
1001,t**7,口味: 套餐2：欢聚时刻组合394g/3袋(含铁板鱿鱼、小鸡腿等),好评,感觉不值这个价格 贵,-,-,2021-06-17
1002,l**1,口味: 套餐1：欢辣大剧场445g/1袋(含鸭脖，猪肉片等，约20小包 ),好评,真不好，，，不怪值得给三只松鼠抢生意啦，，快递都不舍得选好的,-,-,2021-06-23
1003,洛**3,口味: 套餐6：川蜀爽辣组合420g/3袋(含麻辣牛肉，虎皮凤爪等),好评,海哲来评价啦！ 虎皮凤爪真的超级好吃！微波炉叮20秒和现做的一模一样！软糯！一抿脱骨 藕丁香脆微辣！特别开胃 豆干QQ弹弹的，不是那种很面的口感 牛肉吃起来很惊艳！不是很辣，后味很甜！ 感谢张哲瀚代言让我买到这么好吃的零食❤,-,-,2021-06-01
1004,q**羽,口味: 套餐1：欢辣大剧场445g/1袋(含鸭脖，猪肉片等，约20小包 ),好评,618套餐买一送一超级划算，送的鱿鱼条也超级好吃！ ,-,-,2021-06-17
1005,王**6,口味: 套餐11：鲜弹解馋礼包580g(约30小包),好评,味道不错 挺好吃的 ,-,-,2021-06-17
1006,王**6,口味: 套餐5：畅享食刻组合440g/约14小包(含猪肉脯，泡椒凤爪等),好评,味道不错  挺好吃的 ,-,-,2021-06-17
1007,t**2,口味: 套餐9：嗨辣过瘾组合610g/约23小包(含辣条，素毛肚等),好评,就量还挺多，搞活动买的，还巴错，鸡胸肉啊鸡胸肉  ,-,-,2021-06-17
1008,l**7,口味: 套餐8：荤素集合组合403g/约16小包(含牛板筋，鸭锁骨等),好评,支持张哲瀚，积分兑换的立牌好好看（开开心心浪浪钉） ,-,-,2021-06-17
1009,c**s,口味: 套餐9：嗨辣过瘾组合610g/约23小包(含辣条，素毛肚等),好评,很好吃，孩子喜欢,-,-,2021-06-19
1010,t**0,口味: 套餐3：休闲食光组合475g/3袋(含虎皮凤爪，面筋卷等),好评,凤爪我真的好喜欢！ ,-,-,2021-06-21
1011,c**s,口味: 套餐1：欢辣大剧场445g/1袋(含鸭脖，猪肉片等，约20小包 ),好评,很好吃，孩子喜欢。,-,-,2021-06-19
1012,一**间,口味: 套餐11：鲜弹解馋礼包580g(约30小包),好评,好We are facing a dark time right now.  我们正在面临着黑暗时刻  Some of us are stuck at home.  我们中有人不得不禁足在家  Some are stuck far away from home.  有人不得不被迫滞留他乡  Some of us have lost their jobs.  我们中有人失去了工作  And some have to shut down their businesses.  有人不得不关停了赖以为生的生意  Some of us are cutting down their expenses.  我们中有人不得不节衣缩食  And some can’t even pay their rent and bills.  有人甚至已经无力支付房租和账单  Some can’t go back to  ,-,-,2021-06-21
1013,茫**求,口味: 套餐4：夜半劲辣组合500g/3袋(含鸭脖，素毛肚等),好评,此用户没有填写评价。,好吃！非常好吃！无法用再多的语言来形容了,-,2021-01-31
1014,a**5,口味: 套餐1：欢辣大剧场445g/1袋(含鸭脖，猪肉片等，约20小包 ),好评,非常好！！！感谢客服小姐姐耐心的解答，非常感谢，我都觉得我烦人哈哈哈哈 ,-,-,2021-06-15
1015,简**人,口味: 套餐11：鲜弹解馋礼包580g(约30小包),好评,物流很快，东西很多很划算很好吃。值！,-,-,2021-06-19
1016,流**栀,口味: 套餐3：休闲食光组合475g/3袋(含虎皮凤爪，面筋卷等),好评,包装品质：一般 商品分量：少，就只有四包，有点无语，应该是加价后又放优惠，只有亏的份， 保质期：还行 新鲜度：一般 口感味道：刚拿到味道非常大，不知道是不是哪漏了，比一般的味道更大 ,-,-,2021-06-16
1017,西**风,口味: 套餐1：欢辣大剧场445g/1袋(含鸭脖，猪肉片等，约20小包 ),好评,分量足，好吃的不多,-,-,2021-06-18
1018,j**n,口味: 套餐11：鲜弹解馋礼包580g(约30小包),好评,不错  是我喜欢的素食袋，有藕和笋就更好了 ,-,-,2021-06-17
1019,t**4,口味: 套餐3：休闲食光组合475g/3袋(含虎皮凤爪，面筋卷等),好评,虎皮鸡爪真的好吃,-,-,2021-06-18
1020,t**3,口味: 套餐3：休闲食光组合475g/3袋(含虎皮凤爪，面筋卷等),好评,虎皮凤爪很好吃 ,-,-,2021-06-22
1021,t**5,口味: 套餐1：欢辣大剧场445g/1袋(含鸭脖，猪肉片等，约20小包 ),好评,都很好吃，鸭脖很👍,-,-,2021-06-18
1022,放**梦,口味: 套餐3：休闲食光组合475g/3袋(含虎皮凤爪，面筋卷等),好评,虎皮鸡爪巨好吃 ,-,-,2021-06-18
1023,小**6,口味: 套餐12：什锦素卤礼包510g(约16小包),好评,一直在这里购买零食 百子瑞服务满意 ,-,-,2021-06-19
