439,y**e,口味: 套餐5：畅享食刻组合485g/3袋(含鸭脖，面筋卷等),好评,非常划算，很好吃，三大包。 ,-,-,2021-06-23
440,t**7,口味: 套餐1：欢辣大剧场445g/1袋(含鸭脖，猪肉片等，约20小包 ),好评,开开心心浪浪钉来支持商务啦！！！,-,-,2021-06-17
441,新**我,口味: 套餐1：欢辣大剧场445g/1袋(含鸭脖，猪肉片等，约20小包 ),好评,挺好吃的 已经吃完了 分量不多 ,-,-,2021-06-23
442,m**7,口味: 套餐1：欢辣大剧场445g/1袋(含鸭脖，猪肉片等，约20小包 ),好评,好吃，尤其鸭锁骨，泡椒的太辣了,-,-,2021-06-22
443,t**8,口味: 套餐1：欢辣大剧场445g/1袋(含鸭脖，猪肉片等，约20小包 ),好评,百草味yyds，太好吃了，618活动买一送一，大爱，无限回购 ,-,-,2021-06-18
444,c**7,口味: 套餐2：欢聚时刻组合394g/3袋(含铁板鱿鱼、小鸡腿等),好评,好吃小小一包里面挺多的！！,-,-,2021-06-23
445,钰**祥,口味: 套餐6：川蜀爽辣组合420g/3袋(含麻辣牛肉，虎皮凤爪等),好评,嘿嘿嘿开开心心浪浪钉🥳恭喜我们小哲成为品牌大使，百草味的好吃从来都不会让人失望😋希望我们俊哲以后的日子都走花路吧，祝他们永远自由快乐。 ,-,-,2021-06-13
446,t**0,口味: 套餐9：嗨辣过瘾组合610g/约23小包(含辣条，素毛肚等),好评,第二次买这个零食了，挺好的,-,-,2021-06-21
447,一**一,口味: 套餐1：欢辣大剧场445g/1袋(含鸭脖，猪肉片等，约20小包 ),好评,非常好吃，我媳妇已经吃伤了,-,-,2021-06-25
448,东**7,口味: 套餐3：休闲食光组合475g/3袋(含虎皮凤爪，面筋卷等),好评,挺好吃的，买的也便宜 ,-,-,2021-06-25
449,t**8,口味: 套餐1：欢辣大剧场445g/1袋(含鸭脖，猪肉片等，约20小包 ),好评,一如既往的好吃，多多支持,-,-,2021-06-18
450,j**2,口味: 套餐6：川蜀爽辣组合420g/3袋(含麻辣牛肉，虎皮凤爪等),好评,感谢lp哲瀚，让我认识了百草味这个品牌。东西确实味道不错！ ,-,-,2021-06-17
451,1**z,口味: 套餐2：欢聚时刻组合374g/3袋(含麻辣牛肉、小鸡腿等),好评,40块钱😖😖😖😖😖真心不划算，味道没有xx铺子好，量没有xx松鼠多，说实话，真的亏 ,-,-,2021-06-21
452,n**欣,口味: 套餐1：欢辣大剧场445g/1袋(含鸭脖，猪肉片等，约20小包 ),好评,包装品质：质感很好 商品分量：量很足 口感味道：很好吃 ,-,-,2021-06-19
453,e**y,口味: 套餐9：嗨辣过瘾组合610g/约23小包(含辣条，素毛肚等),好评,因为张哲瀚开始买百草味，结果现在根本停不下来，又买了好多辣味小零食，重点表扬这**胸肉和笋干，太好吃了！（一条海蜇姐姐的小尾巴～）,-,-,2021-06-10
454,t**6,口味: 套餐11：鲜弹解馋礼包580g(约30小包),好评,30包左右没少。口味不错，实惠划算！ ,-,-,2021-06-16
455,哔**咔,口味: 套餐9：嗨辣过瘾组合610g/约23小包(含辣条，素毛肚等),好评,没有异样，安装很好，全密封性，口味合适广东人，微辣,-,-,2021-06-16
456,水**呀,口味: 套餐8：荤素集合组合403g/约16小包(含牛板筋，鸭锁骨等),好评,好吃实惠,-,-,2021-06-26
457,z**4,口味: 套餐11：鲜弹解馋礼包580g(约30小包),好评,好吃，支持张哲瀚，支持百草味 ,-,-,2021-06-21
458,m**a,口味: 套餐1：欢辣大剧场445g/1袋(含鸭脖，猪肉片等，约20小包 ),好评,回购的！里面的东西都挺好吃的 ,-,-,2021-06-25
459,t**3,口味: 套餐4：有荤有素组合620g/3袋(含鸭脖，辣条等),好评,鸭脖很好吃，土豆片超级好吃,-,-,2021-06-22
460,t**8,口味: 套餐12：什锦素卤礼包510g(约16小包),好评,很好吃 最喜欢里面的藕片！ ,-,-,2021-06-18
461,t**8,口味: 套餐9：嗨辣过瘾组合610g/约23小包(含辣条，素毛肚等),好评,一如既往地支持百草味,-,-,2021-06-18
462,浅**雪,口味: 套餐3：休闲食光组合475g/3袋(含虎皮凤爪，面筋卷等),好评,意外发现面筋卷蛮好吃的 ,-,-,2021-06-21
463,学**2,口味: 套餐10：缤纷豆干大礼包500gx2袋(约52小包),好评,很划算，两大包，吃好久的，味道也不错😁😁😁 ,好好好好好好好好好好好好好好好好好好好好好,感谢我们的相遇，感谢共同的配合和努力，终于做成了一单双赢的交易!我将更加热情，更加努力，更加专业的为您服务!也希望能得到您的继续关注哦^-^【香草】,2021-06-15
464,t**0,口味: 套餐1：欢辣大剧场445g/1袋(含鸭脖，猪肉片等，约20小包 ),好评,开开心心浪浪钉，支持张哲瀚 ,-,-,2021-06-21
465,青**0,口味: 套餐3：休闲食光组合475g/3袋(含虎皮凤爪，面筋卷等),好评,君不见，黄河之水天上来，奔流到海不复回。  君不见，高堂明镜悲白发，朝如青丝暮成雪。  人生得意须尽欢，莫使金樽空对月。  天生我材必有用，千金散尽还复来   ,-,-,2021-06-19
466,汤**星,口味: 套餐1：欢辣大剧场445g/1袋(含鸭脖，猪肉片等，约20小包 ),好评,给对象买的，他说超级好吃～ ,-,-,2021-06-23
467,长**o,口味: 套餐7：夜半劲辣组合500g/约28小包(含鸭脖，素毛肚等),好评,东西很实惠，速度也很快！,-,-,2021-06-16
468,t**7,口味: 套餐11：鲜弹解馋礼包580g(约30小包),好评,24买了两包，送了两包，味道还可以 ,-,-,2021-06-17
469,t**9,口味: 套餐8：荤素集合组合383g(含鸭锁骨、牛板筋等),好评,整天很不错，但就是量有那么一丢丢的少，嘻嘻😁,-,-,2021-06-24
470,t**0,口味: 套餐8：荤素集合组合383g(含鸭锁骨、牛板筋等),好评,物美价廉，超级划算，买到就是赚到,-,-,2021-06-21
471,t**6,口味: 套餐1：欢辣大剧场445g/1袋(含鸭脖，猪肉片等，约20小包 ),好评,给小伙伴买的，她说很喜欢 ,-,-,2021-06-16
472,你**静,口味: 套餐4：有荤有素组合620g/3袋(含鸭脖，辣条等),好评,鸭脖刚入口吃的时候，觉得有股鸭肉坏了的味道，可是吃到后面又没有。是不是赶着618，坏的鸭脖都拿出来卖啊,-,-,2021-06-25
473,唯**8,口味: 套餐1：欢辣大剧场445g/1袋(含鸭脖，猪肉片等，约20小包 ),好评,客服小姐姐真的好有耐心，虽然是618活动，但物流也很快。麻辣小零食很别致，里面都是一小包一小包的，方便经济实惠，家里人都很喜欢。 ,-,-,2021-06-19
474,t**5,口味: 套餐12：什锦素卤礼包510g(约16小包),好评,卖肉的比较划算 ,-,-,2021-06-18
475,席**悦,口味: 套餐2：欢聚时刻组合374g/3袋(含麻辣牛肉、小鸡腿等),好评,包装品质：分量很足 保质期新鲜 很大的一包 满意！ ,-,-,2021-06-20
476,t**2,口味: 套餐12：什锦素卤礼包510g(约16小包)·,好评,hin好吃喜欢那个笋尖 ,-,-,2021-06-17
477,c**王,口味: 套餐3：休闲食光组合475g/3袋(含虎皮凤爪，面筋卷等),好评,好快就到了，日期还ok ,-,-,2021-06-17
478,t**2,口味: 套餐7：夜半劲辣组合500g/约28小包(含鸭脖，素毛肚等),好评,颜值高，还好吃，真的很好。,-,-,2021-06-17
479,文**0,口味: 套餐2：欢聚时刻组合374g/3袋(含麻辣牛肉、小鸡腿等),好评,支持小哲，零食不错的哈哈 ,-,-,2021-06-24
480,y**6,口味: 套餐1：欢辣大剧场445g/1袋(含鸭脖，猪肉片等，约20小包 ),好评,有点贵了啊 就味道还是可以的 希望少添加一点对身体有害的东西吧(*^ω^*),-,-,2021-06-23
481,t**5,口味: 套餐12：什锦素卤礼包510g(约16小包),好评,素卤这个礼包非常非常非常非常难吃，这是我吃到最难吃的卤菜，藕一股中药味，其它的也或多或少有股中药味，但藕最严重最难吃，吃一口就吐出来了,-,-,2021-06-18
482,陈**啦,口味: 套餐1：欢辣大剧场445g/1袋(含鸭脖，猪肉片等，约20小包 ),好评,味道好，服务棒，活动更棒！ ,-,-,2021-06-17
483,洋**5,口味: 套餐1：欢辣大剧场445g/1袋(含鸭脖，猪肉片等，约20小包 ),好评,好吃，大人小孩都连吃好几包,-,-,2021-06-21
484,爱**仔,口味: 套餐2：欢聚时刻组合394g/3袋(含铁板鱿鱼、小鸡腿等),好评,好吃！辣片勾起了我的回忆啊！,-,-,2021-06-23
485,古**6,口味: 套餐1：欢辣大剧场445g/1袋(含鸭脖，猪肉片等，约20小包 ),好评,味道不错挺值得购买,-,-,2021-06-21
486,钰**祥,口味: 套餐1：欢辣大剧场445g/1袋(含鸭脖，猪肉片等，约20小包 ),好评,开开心心浪浪钉🥳恭喜我们小哲成为品牌大使，百草味的好吃从来都不会让人失望😋希望我们俊哲以后的日子都走花路吧，祝他们自由快乐。 ,-,-,2021-06-13
487,小**幺,口味: 套餐11：鲜弹解馋礼包580g(约30小包),好评,给朋友买的，应该可以,-,-,2021-06-22
488,n**5,口味: 套餐1：欢辣大剧场445g/1袋(含鸭脖，猪肉片等，约20小包 ),好评,包装品质：味道很好，每次想吃零食了都会买百草味的，品种也很多。 ,-,-,2021-06-16
489,t**8,口味: 套餐6：川蜀爽辣组合420g/3袋(含麻辣牛肉，虎皮凤爪等),好评,非常好吃，我很开心,-,-,2021-06-18
490,t**7,口味: 套餐6：川蜀爽辣组合420g/3袋(含麻辣牛肉，虎皮凤爪等),好评,开开心心浪浪钉支持商务,-,-,2021-06-17
491,c**w,口味: 套餐1：欢辣大剧场445g/1袋(含鸭脖，猪肉片等，约20小包 ),好评,非常好 送给朋友的 非常喜欢 ,-,-,2021-06-22
492,t**6,口味: 套餐1：欢辣大剧场445g/1袋(含鸭脖，猪肉片等，约20小包 ),好评,好吃，特别是虎皮凤爪,-,-,2021-06-16
493,t**7,口味: 套餐3：休闲食光组合475g/3袋(含虎皮凤爪，面筋卷等),好评,肉脯好好吃，其他也不错啊,-,-,2021-06-17
494,墨**衣,口味: 套餐1：欢辣大剧场445g/1袋(含鸭脖，猪肉片等，约20小包 ),好评,挺不错的，鸭锁骨最好吃 ,-,-,2021-06-22
495,谢**1,口味: 套餐6：川蜀爽辣组合420g/3袋(含麻辣牛肉，虎皮凤爪等),好评,猪肉脯微甜，很合胃口,-,-,2021-06-26
496,晨**默,口味: 套餐1：欢辣大剧场445g/1袋(含鸭脖，猪肉片等，约20小包 ),好评,支持张老师，山人爱你❤❤❤,-,-,2021-06-21
497,t**8,口味: 套餐1：欢辣大剧场445g/1袋(含鸭脖，猪肉片等，约20小包 ),好评,包装品质：很好 保质期：还很长 口感味道：还可以 ,-,-,2021-06-18
498,思**瘾,口味: 套餐1：欢辣大剧场445g/1袋(含鸭脖，猪肉片等，约20小包 ),好评,有点辣，感觉还行吧。挺划算的，支持小哲！！ 星星和月亮一起闪耀⭐🌙 ,-,-,2021-06-15
499,金**上,口味: 套餐9：嗨辣过瘾组合610g/约23小包(含辣条，素毛肚等),好评,好吃还划算 ,-,-,2021-06-26
500,t**6,口味: 套餐9：嗨辣过瘾组合610g/约23小包(含辣条，素毛肚等),好评,也是给对象买的。好吃😋,-,-,2021-06-16
501,t**8,口味: 套餐1：欢辣大剧场445g/1袋(含鸭脖，猪肉片等，约20小包 ),好评,一直喜欢百草家的零食 ,-,-,2021-06-18
502,a**y,口味: 套餐1：欢辣大剧场445g/1袋(含鸭脖，猪肉片等，约20小包 ),好评,就是一袋装的 不懂为什么店铺助手要发信息说不是一个包😓  里面品种挺多 朋友说甜味居多 微辣,-,-,2021-06-23
503,t**8,口味: 套餐1：欢辣大剧场445g/1袋(含鸭脖，猪肉片等，约20小包 ),好评,"非常满意,真的很喜欢，完全超出期望值。 ",-,-,2021-06-18
504,呓**4,口味: 套餐2：欢聚时刻组合374g/3袋(含麻辣牛肉、小鸡腿等),好评,划算又实惠，我对象很喜欢💕,-,-,2021-06-20
505,学**人,口味: 套餐1：欢辣大剧场445g/1袋(含鸭脖，猪肉片等，约20小包 ),好评,全是小包装，几十份 ,-,-,2021-06-26
506,那**过,口味: 套餐1：欢辣大剧场445g/1袋(含鸭脖，猪肉片等，约20小包 ),好评,包装的很好，东西日期都是新鲜的，就是漏发了一个，很快就解决了，客服彩虹草服务超级周到，解决的的很快。 ,-,-,2021-06-15
507,c**7,口味: 套餐7：夜半劲辣组合560g/3袋(含鸭脖，素毛肚等),好评,还行╮(￣▽￣)╭ ,-,-,2021-06-24
508,e**s,口味: 套餐3：休闲食光组合475g/3袋(含虎皮凤爪，面筋卷等),好评,不错，活动买的便宜，好吃。,-,-,2021-06-24
509,思**i,口味: 套餐1：欢辣大剧场445g/1袋(含鸭脖，猪肉片等，约20小包 ),好评,不好吃不好吃分量也很少 ,-,-,2021-06-26
510,t**4,口味: 套餐2：欢聚时刻组合374g/3袋(含麻辣牛肉、小鸡腿等),好评,味道吃起来很香，鸭脖甜度适中，以前卖了卫某品牌的辣条，吃的很甜，让我扔了一箱。鸡爪还是比较喜欢王某某的鸡爪，够脆。卖了两包不同的，不知道哪个是哪个商品，牛肉好未吃，看的感觉很辣，不予以评价,-,-,2021-06-18
511,t**0,口味: 套餐1：欢辣大剧场445g/1袋(含鸭脖，猪肉片等，约20小包 ),好评,商品分量：还行 口感味道：一般般，不怎么好吃 ,-,-,2021-06-21
512,雪**6,口味: 套餐3：休闲食光组合430g/3袋(含牛肉片，素毛肚等),好评,味道非常好 不错😊,-,-,2021-06-23
513,t**5,口味: 套餐1：欢辣大剧场445g/1袋(含鸭脖，猪肉片等，约20小包 ),好评,真的不是很好吃！做再多的活动都不要买好吗。,-,-,2021-06-18
514,小**妹,口味: 套餐4：有荤有素组合620g/3袋(含鸭脖，辣条等),好评,赶脚口感真的很一般，辣包的味道有种放置很久的那种感觉 ,-,-,2021-06-24
515,t**5,口味: 套餐1：欢辣大剧场445g/1袋(含鸭脖，猪肉片等，约20小包 ),好评,不觉得好，买到的东西跟图片根本不一样，个人差评，都是小零食，平均两块一包 ,-,-,2021-06-18
516,夏**8,口味: 套餐1：欢辣大剧场445g/1袋(含鸭脖，猪肉片等，约20小包 ),好评,好吃，分量很足，👍🏻 ,-,-,2021-06-26
517,传**右,口味: 套餐3：休闲食光组合475g/3袋(含虎皮凤爪，面筋卷等),好评,好好吃，十多块钱买的物美价廉,尤其是那个面筋,小味还是喜欢您，像小时候吃辣条，不看日期,2021-06-21
518,c**x,口味: 套餐1：欢辣大剧场445g/1袋(含鸭脖，猪肉片等，约20小包 ),好评,好吃！划算！ ,-,-,2021-06-21
519,t**2,口味: 套餐1：欢辣大剧场445g/1袋(含鸭脖，猪肉片等，约20小包 ),好评,给对象买的，他很喜欢 ,-,-,2021-06-17
520,生**≤,口味: 套餐1：欢辣大剧场445g/1袋(含鸭脖，猪肉片等，约20小包 ),好评,这个已经回购好几次了，依旧的还吃 ,-,-,2021-06-23
521,c**7,口味: 套餐3：休闲食光组合475g/3袋(含虎皮凤爪，面筋卷等),好评,东西不错，好好吃，每天都是买买买，又有活动，大家买呀，就是好吃啊，还有百布丁服务好 加工资啊 ,-,-,2021-06-18
522,t**0,口味: 套餐11：鲜弹解馋礼包580g(约30小包),好评,商品分量：还好 口感味道：一般般，不怎么好吃 ,-,-,2021-06-21
523,t**9,口味: 套餐9：嗨辣过瘾组合610g/约23小包(含辣条，素毛肚等),好评,呦西收到了，质量很好，穿着很舒服。 ,-,-,2021-06-24
524,t**2,口味: 套餐1：欢辣大剧场445g/1袋(含鸭脖，猪肉片等，约20小包 ),好评,此用户没有填写评价。,这个是真好吃,感谢我们的相遇，感谢共同的配合和努力，终于做成了一单双赢的交易!,2021-06-17
525,l**7,口味: 套餐3：休闲食光组合475g/3袋(含虎皮凤爪，面筋卷等),好评,分量满满物有所值 ,-,-,2021-06-26
526,g**e,口味: 套餐1：欢辣大剧场445g/1袋(含鸭脖，猪肉片等，约20小包 ),好评,包装很卫生，好吃 ,-,-,2021-06-23
527,璐**2,口味: 套餐2：欢聚时刻组合374g/3袋(含麻辣牛肉、小鸡腿等),好评,麻辣牛肉是一块纯肉，要是佐料少裹点就好了，影响口感 ,-,-,2021-06-18
528,t**1,口味: 套餐5：畅享食刻组合485g/3袋(含鸭脖，面筋卷等),好评,全都拆开了 有这么多  也没发现破损的 涨袋的 包装完好 日期都是近几个月的   挺值的 还没开始尝,-,-,2021-06-04
529,t**1,口味: 套餐7：夜半劲辣组合500g/约28小包(含鸭脖，素毛肚等),好评,完美，推荐给舍友,-,-,2021-06-04
530,t**4,口味: 套餐9：嗨辣过瘾组合610g/约23小包(含辣条，素毛肚等),好评,味道不错，东西还好，买了四个套餐六十多，物流也挺快的，但是快递服务不好，拿的时候发现箱子已经被打开了，是那种被刀把胶布完全划开的那种，找快递点的人也很凶。 ,-,-,2021-06-18
531,t**3,口味: 套餐1：欢辣大剧场445g/1袋(含鸭脖，猪肉片等，约20小包 ),好评,很好吃，买了两包，还很便宜，一到货就吃了一包🤣,-,-,2021-06-22
532,雪**爱,口味: 套餐6：川蜀爽辣组合420g/3袋(含麻辣牛肉，虎皮凤爪等),好评,商品分量：牛肉有点少，豆腐干，土豆很多，味道不错，很好吃 ,-,-,2021-06-17
533,雨**行,口味: 套餐9：嗨辣过瘾组合610g/约23小包(含辣条，素毛肚等),好评,不错😃,-,-,2021-06-24
534,说**人,口味: 套餐1：欢辣大剧场445g/1袋(含鸭脖，猪肉片等，约20小包 ),好评,没数多少包，反正很便宜。不错 ,-,-,2021-06-24
535,t**6,口味: 套餐10：缤纷豆干大礼包500g(约26小包),好评,好吃，给对象买的😋😋😋😋😋😋😋😋😋😋😋,-,-,2021-06-16
536,y**9,口味: 套餐2：欢聚时刻组合374g/3袋(含麻辣牛肉、小鸡腿等),好评,每一款都美味！,-,-,2021-06-25
537,m**达,口味: 套餐1：欢辣大剧场445g/1袋(含鸭脖，猪肉片等，约20小包 ),好评,甜辣味的，很好吃 ,-,-,2021-06-22
538,t**7,口味: 套餐5：畅享食刻组合485g/3袋(含鸭脖，面筋卷等),好评,划算味道不错最爱鸭脖 ,-,-,2021-06-17
539,t**5,口味: 套餐1：欢辣大剧场445g/1袋(含鸭脖，猪肉片等，约20小包 ),好评,此用户没有填写评价。,兰花草服务是真的不错很满意。,赏味达人不客气的呢，小味要做的就是让您享受到美食，您的满意就是小味不断前进的动力哟(*^__^*) 嘻嘻……,2021-06-18
540,h**3,口味: 套餐1：欢辣大剧场445g/1袋(含鸭脖，猪肉片等，约20小包 ),好评,为了张哲瀚买的，老婆老婆,-,-,2021-06-26
541,t**2,口味: 套餐1：欢辣大剧场445g/1袋(含鸭脖，猪肉片等，约20小包 ),好评,包装品质：很不错～ ,-,-,2021-06-17
542,轩**子,口味: 套餐1：欢辣大剧场445g/1袋(含鸭脖，猪肉片等，约20小包 ),好评,笋跟藕占多数，没我想象的那么好吃。 ,-,-,2021-06-26
543,t**4,口味: 套餐2：欢聚时刻组合394g/3袋(含铁板鱿鱼、小鸡腿等),好评,很好吃，日期是今年四月六月的，还算近。,-,-,2021-06-18
544,没**名,口味: 套餐1：欢辣大剧场445g/1袋(含鸭脖，猪肉片等，约20小包 ),好评,这个肉片不是猪肉,-,-,2021-06-26
545,t**9,口味: 套餐1：欢辣大剧场445g/1袋(含鸭脖，猪肉片等，约20小包 ),好评,挺好的，质量也不错，值得购买。 包装品质：也很好，趁着活动买的，划算 ,-,-,2021-06-24
546,m**4,口味: 套餐1：欢辣大剧场445g/1袋(含鸭脖，猪肉片等，约20小包 ),好评,吃完了才想起来评价 忘了有些啥 鸡爪还是啥不辣 个人觉得不太好吃 不太欢辣 ,-,-,2021-06-25
547,张**闹,口味: 套餐4：有荤有素组合620g/3袋(含鸭脖，辣条等),好评,不错  不错   味道很好,-,-,2021-06-25
548,杨**q,口味: 套餐6：川蜀爽辣组合420g/3袋(含麻辣牛肉，虎皮凤爪等),好评,麻辣牛肉里只有五小包，味道不错。不喜欢豆干,-,-,2021-06-17
549,c**1,口味: 套餐1：欢辣大剧场445g/1袋(含鸭脖，猪肉片等，约20小包 ),好评,口味偏咸，没有想象中的好吃，量偏少吧,-,-,2021-06-24
550,花**萎,口味: 套餐7：夜半劲辣组合500g/约28小包(含鸭脖，素毛肚等),好评,不错不错，买了很多 ,-,-,2021-06-16
551,t**0,口味: 套餐1：欢辣大剧场445g/1袋(含鸭脖，猪肉片等，约20小包 ),好评,非常好，物流很快，东西也更好吃 ,-,-,2021-06-21
552,白**7,口味: 套餐4：有荤有素组合635g/3袋(含鸭脖，土豆片等),好评,男朋友超喜欢~,-,-,2021-06-21
553,t**6,口味: 套餐1：欢辣大剧场445g/1袋(含鸭脖，猪肉片等，约20小包 ),好评,"结果果然不会让人失🐬望,每天早上一包坚果。👄个种类,力度一样大,🎯马上就吃完了继续买起❎。出来以后尝了一个,🍧笋辣辣的。我应该买更😍辣才对,上头慢,水分😹超级大。期待收货吃上📰口,藕丁很喜欢,作为✒喜欢张哲瀚的一枚小海🔎哲必须支持一下 ",-,-,2021-06-16
554,禹**1,口味: 套餐11：鲜弹解馋礼包580g(约30小包),好评,还不错小零食 ,-,-,2021-06-21
555,t**5,口味: 套餐1：欢辣大剧场445g/1袋(含鸭脖，猪肉片等，约20小包 ),好评,豆干非常好吃,-,-,2021-06-18
556,席**悦,口味: 套餐1：欢辣大剧场445g/1袋(含鸭脖，猪肉片等，约20小包 ),好评,包装品质：包装可以 分量很足 味道也很好 满意n ,-,-,2021-06-20
557,我**鑫,口味: 套餐1：欢辣大剧场445g/1袋(含鸭脖，猪肉片等，约20小包 ),好评,卤味特好吃,-,-,2021-06-23
558,t**0,口味: 套餐2：欢聚时刻组合394g/3袋(含铁板鱿鱼、小鸡腿等),好评,包装品质：不错 不错 ,-,-,2021-06-21
559,r**k,口味: 套餐11：鲜弹解馋礼包580g(约30小包),好评,白千骨服务满意。零食不错,-,-,2021-06-23
560,任**子,口味: 套餐3：休闲食光组合495g/约14小包(含虎皮凤爪，面筋卷等),好评,买给男朋友吃的，他说笋子好辣辣辣，笋子这么好吃辣一点咋啦，那也要给我吃完😋放**排大家一起恰～ ,-,-,2021-06-11
561,l**1,口味: 套餐1：欢辣大剧场445g/1袋(含鸭脖，猪肉片等，约20小包 ),好评,好吃量足 ,-,-,2021-06-23
562,t**5,口味: 套餐4：有荤有素组合635g/3袋(含鸭脖，土豆片等),好评,鸭脖和土豆片是好吃的，但土豆条还是算了吧（也可能是我吃不惯川味）,-,-,2021-06-18
563,m**3,口味: 套餐12：什锦素卤礼包510g(约16小包)·,好评,口感味道：素食也不好吃。口感很差。还有邮政快递到货后4天不派送，实物有一种馊了的味道！ ,-,-,2021-06-25
564,来**女,口味: 套餐1：欢辣大剧场445g/1袋(含鸭脖，猪肉片等，约20小包 ),好评,种类挺多的，每种都有2-3包，好吃 ,-,-,2021-06-22
565,t**9,口味: 套餐2：欢聚时刻组合374g/3袋(含麻辣牛肉、小鸡腿等),好评,面筋好吃，其他两袋还没开 包装品质：好 商品分量：足 ,-,-,2021-06-24
566,t**9,口味: 套餐2：欢聚时刻组合394g/3袋(含铁板鱿鱼、小鸡腿等),好评,我的口水掉了,-,-,2021-06-24
567,h**安,口味: 套餐1：欢辣大剧场445g/1袋(含鸭脖，猪肉片等，约20小包 ),好评,海哲来支持张哲瀚商务啦，买了板栗，鸭脖，凤爪和零食大礼包，吃了一些才想起还没拍照评论，大礼包里面种类很多，都挺好吃的，会回购的！ ,-,-,2021-06-10
568,朱**同,口味: 套餐12：什锦素卤礼包510g(约16小包),好评,味道可以哦！,-,-,2021-06-21
569,t**9,口味: 套餐4：有荤有素组合635g/3袋(含鸭脖，土豆片等),好评,很不错，味道也可以，一直喜欢百草味家的小零食，这次依然没让我失望😄,-,-,2021-06-24
570,t**1,口味: 套餐5：畅享食刻组合450g/3袋(含鸭脖，虎皮凤爪等),好评,贼棒，想给你一个眼花缭乱的赞,-,-,2021-06-04
571,t**3,口味: 套餐11：鲜弹解馋礼包580g(约30小包),好评,好吃，价格也便宜。 ,-,-,2021-06-22
572,t**1,口味: 套餐12：什锦素卤礼包510g(约16小包),好评,看剧最佳 ,-,-,2021-06-04
573,雅**x,口味: 套餐7：夜半劲辣组合500g/约28小包(含鸭脖，素毛肚等),好评,此用户没有填写评价。,零食我的最爱了,见到您后那日夜思君不见君的落寞感也油然而去啦~,2021-06-14
574,c**1,口味: 套餐2：欢聚时刻组合374g/3袋(含麻辣牛肉、小鸡腿等),好评,味道非常好，,-,-,2021-06-26
575,o**6,口味: 套餐10：缤纷豆干大礼包500gx2袋(约52小包),好评,618活动购入的，之前就买过这个豆干，价格很划算，都挺好吃的也不会很咸 ,-,-,2021-06-17
576,t**9,口味: 套餐1：欢辣大剧场445g/1袋(含鸭脖，猪肉片等，约20小包 ),好评,挺好吃的 我看评论说吃了会拉肚子 也有点害怕但是这几天吃都没有这个现象呢,-,-,2021-06-24
577,i**她,口味: 套餐1：欢辣大剧场445g/1袋(含鸭脖，猪肉片等，约20小包 ),好评,鸭架鸭脖好吃 ,-,-,2021-06-21
578,流**1,口味: 套餐2：欢聚时刻组合394g/3袋(含铁板鱿鱼、小鸡腿等),好评,鸭脖好吃😋 ,-,-,2021-06-24
579,t**9,口味: 套餐8：荤素集合组合403g/约16小包(含牛板筋，鸭锁骨等),好评,好吃，不错，很好吃，价格也便宜。 ,-,-,2021-06-24
580,t**8,口味: 套餐9：嗨辣过瘾组合610g/约23小包(含辣条，素毛肚等),好评,售后三的让我服务很满意 态度很好。 ,-,-,2021-06-18
581,岚**冰,口味: 套餐4：有荤有素组合635g/3袋(含鸭脖，土豆片等),好评,包装品质：包装很严实~ 商品分量：满满的三包 保质期：放着排队不怕过期 ,-,-,2021-06-19
582,t**5,口味: 套餐11：鲜弹解馋礼包580g(约30小包),好评,物流挺快的。已经开始吃了，口感不错，味道我挺喜欢的。分给室友室友也挺喜欢的，已经推荐给她们了。好评。 ,-,-,2021-06-18
583,荷**，,口味: 套餐7：夜半劲辣组合560g/3袋(含鸭脖，素毛肚等),好评,挺多包的，也都挺好吃，都是辣口的 ,-,-,2021-06-21
