939,j**3,净含量: 100g 口味: 【每袋仅7.9】干裙带菜100g*3袋,好评,味道不错，孩子也喜欢吃,-,-,2021-06-10
940,w**9,净含量: 100g 口味: 【新品】免切干裙带菜200g*1袋,好评,比较实惠，吃完还会回购,-,-,2021-06-12
941,t**9,净含量: 100g 口味: 【每袋仅7.9】干裙带菜100g*3袋,好评,一点点可以泡很多，也适合小孩吃，小孩也爱吃 ,-,-,2021-06-10
942,申**6,净含量: 100g 口味: 【每袋仅7.9】干裙带菜100g*3袋,好评,很好，跟想象中一样美味。,-,-,2021-06-12
943,出**包,净含量: 100g 口味: 【特惠尝鲜价】干裙带菜100g*1袋,好评,怎么弄都好吃，凉拌，煮汤，或者做酸菜鱼里的配菜，都是绝佳,-,-,2021-06-14
944,t**3,净含量: 100g 口味: 【每袋仅9.4】干裙带菜100g*2袋,好评,第一次买，期待好的美味。,-,-,2021-06-24
945,b**泡,净含量: 100g 口味: 【每袋仅8.9】干裙带菜100g*2袋,好评,完美的一次购物，太好吃了，全家都喜欢！,-,-,2021-06-10
946,特**死,净含量: 100g 口味: 【特惠尝鲜价】干裙带菜100g*1袋,好评,发货很快   吃的时候泡一点就可以了    没有沙口感不错,-,-,2021-06-09
947,c**8,净含量: 100g 口味: 【特惠尝鲜价】干裙带菜100g*1袋,好评,没有含沙的感觉，口感不错的。据说能助长高  ,-,-,2021-06-10
948,q**0,净含量: 100g 口味: 【每袋仅7.1】干裙带菜100g*5袋,好评,试吃后来评价，很不错，没有沙子，好吃 ,-,-,2021-06-10
949,北**1,净含量: 100g 口味: 【每袋仅9.4】干裙带菜100g*2袋,好评,这个产品和它价位相比来说，还是很合适的 ,-,-,2021-06-10
950,陌**w,净含量: 100g 口味: 【每袋仅7.9】干裙带菜100g*3袋,好评,一点点就可以泡发出来很多 用来煮鲜虾豆腐汤真的是太鲜了,-,-,2021-06-12
951,l**6,净含量: 100g 口味: 【特惠尝鲜价】干裙带菜100g*1袋,好评,一点点就能泡发很多，汤很鲜美，很好吃，值得购买。,-,-,2021-06-10
952,小**颜,净含量: 100g 口味: 【每袋仅8.4】干裙带菜100g*2袋,好评,快递物流：物流快 性价比：性价比高 口感味道：好吃 ,-,-,2021-06-13
953,l**n,净含量: 100g 口味: 【每袋仅8.9】干裙带菜100g*2袋,好评,裙带菜干净，无沙，做豆腐汤绝配 ,-,-,2021-06-14
954,阿**y,净含量: 100g 口味: 【特惠尝鲜价】干裙带菜100g*1袋,好评,好几种口味都挺好吃的，满意还会再来。 ,-,-,2021-06-12
955,8**q,净含量: 100g 口味: 【每袋仅9.4】干裙带菜100g*2袋,好评,看起来很干净，确黑的，吃起来有点腻歪呀 ,-,-,2021-06-21
956,路**d,净含量: 100g 口味: 【每袋仅7.1】干裙带菜100g*5袋,好评,泡出来，煮了还是有点硬孩子不爱吃,-,-,2021-06-22
957,z**1,净含量: 100g 口味: 【加6元购】裙带菜100g*1袋+0脂油醋汁268g,好评,以前没买过油醋汁，也不知道油醋汁该是什么味，但吃起来味道一般，味道偏酸，还不如直接用鲜味酱油，裙带菜很薄，看起来和一些美食博主视频里的不大一样，没有肉感，不过吃起来还不错,-,-,2021-06-16
958,l**承,净含量: 100g 口味: 【新品】免切干裙带菜200g*2袋,好评,很好吃，吃完继续购买，干净无沙 ,-,-,2021-06-10
959,d**g,净含量: 100g 口味: 【每袋仅7.9】干裙带菜100g*3袋,好评,这个菜好吃，一包煮汤够好多次，拿了一点点泡开就一大盘了,-,-,2021-06-11
960,a**婧,净含量: 100g 口味: 【每袋仅7.9】干裙带菜100g*3袋,好评,还没做，以前是买的别的品牌的，不过他家的拌饭紫菜挺好吃的 ,-,-,2021-06-09
961,开**啦,净含量: 100g 口味: 【每袋仅9.4】干裙带菜100g*2袋,好评,感觉比盐渍的好吃，泡开了没有海腥味，下次继续回购。,-,-,2021-06-12
962,w**7,净含量: 100g 口味: 【特惠尝鲜价】干裙带菜100g*1袋,好评,一般般吧可以是自个不爱吃这个 ,-,-,2021-06-21
963,安**民,净含量: 100g 口味: 【每袋仅7.2】干裙带菜100g*3袋,好评,宝贝收到，试吃了再来评价。比海带嫩，做汤时~干净方便，宝宝也喜欢恰，吃完再回购！ ,-,-,2021-05-14
964,易**2,净含量: 100g 口味: 【新品】免切干裙带菜200g*2袋,好评,易泡发，口感好，减肥餐操作容易。,-,-,2021-06-10
965,o**o,净含量: 100g 口味: 【特惠尝鲜价】干裙带菜100g*1袋,好评,挺干净的。烧汤我家小朋友很爱吃 ,-,-,2021-06-09
966,皮**妈,净含量: 100g 口味: 【每袋仅8.2】干裙带菜100g*3袋,好评,东西收到，挺快的，等吃过再来评价。,-,-,2021-06-14
967,大**n,净含量: 100g 口味: 【每袋仅9.4】干裙带菜100g*2袋,好评,怎么说，两袋够我一年了，😱 掰了一点结果泡了一碗，吃不完浪费了！ 而且不是碎的，大片的   ,-,-,2021-06-18
968,t**2,净含量: 100g 口味: 【每袋仅6.9】干裙带菜100g*5袋,好评,这个裙带菜硬硬的，没有那么嫩，感觉只适合炒，不适合打汤 ,-,-,2021-06-24
969,t**5,净含量: 100g 口味: 【每袋仅7.9】干裙带菜100g*3袋,好评,宝贝收到就就做的吃了，好吃，下次还会回购,-,-,2021-06-10
970,鱼**雯,净含量: 100g 口味: 【特惠尝鲜价】干裙带菜100g*1袋,好评,干裙带菜特级干货旗舰店韩式韩国海带汤的裙边海群裙菜脂肪儿童，干裙带菜特级干货旗舰店韩式韩国海带汤的裙边海群裙菜脂肪干裙带菜特级干货旗舰店韩式韩国海带汤的裙边海群裙菜脂肪儿童，宝贝很方便，懒人必备  ,-,-,2021-06-08
971,鞠**8,净含量: 100g 口味: 【新品】盐渍半干裙带菜5斤（大包装）,好评,真好吃还会再来的,-,-,2021-06-13
972,维**骞,净含量: 100g 口味: 【每袋仅9.4】干裙带菜100g*2袋,好评,煮一下下就好了哦，不然会太烂了。最后一锅汤，海带、香油、胡椒一放，香味和康师傅海鲜泡面味的一模一样。 ,-,-,2021-06-04
973,t**8,净含量: 100g 口味: 【特惠尝鲜价】干裙带菜100g*1袋,好评,口感不错，百搭！,-,-,2021-06-06
974,y**0,净含量: 100g 口味: 【加6元购】裙带菜100g*3袋+0脂油醋汁268g,好评,口感不错，鲜美,-,-,2021-06-10
975,h**3,净含量: 100g 口味: 【每袋仅7.9】干裙带菜100g*3袋,好评,物流发货很快，卖家服务态度很好 ,-,-,2021-06-16
976,歌**里,净含量: 100g 口味: 【每袋仅7.2】干裙带菜100g*3袋,好评,我第一次买，还不错！吃完可能还会继续在你家买,-,-,2021-06-10
977,t**3,净含量: 100g 口味: 【每袋仅7.1】干裙带菜100g*5袋,好评,第一次买口感挺好，下次继续,-,-,2021-06-24
978,可**敌,净含量: 100g 口味: 【每袋仅7.1】干裙带菜100g*5袋,好评,多次购买，口感不错，非常好 ,-,-,2021-06-09
979,c**9,净含量: 100g 口味: 【每袋仅9.4】干裙带菜100g*2袋,好评,口感很好！煮汤鲜甜！,-,-,2021-06-22
980,l**8,净含量: 100g 口味: 【每袋仅7.9】干裙带菜100g*3袋,好评,味道很鲜美,-,-,2021-06-11
981,r**4,净含量: 100g 口味: 【每袋仅7.9】干裙带菜100g*3袋,好评,口感味道：味道还可以 ,-,-,2021-06-14
982,这**美,净含量: 100g 口味: 【特惠尝鲜价】干裙带菜100g*1袋,好评,口感味道：裙带很脆很爽口，泡上吃了一次后来评，煮汤孩子喜欢，泡后变大 ,-,-,2021-05-28
983,j**u,净含量: 100g 口味: 【每袋仅9.4】干裙带菜100g*2袋,好评,一点点可以泡出不少，第一次没有掌握到量 ,-,-,2021-06-14
984,张**g,净含量: 100g 口味: 【每袋仅8.4】干裙带菜100g*2袋,好评,口感味道：口感不错，减肥神食，一天一斤的瘦，想瘦的美女们可以买起来！ ,-,-,2021-06-06
985,t**4,净含量: 100g 口味: 【每袋仅7.9】干裙带菜100g*3袋,好评,基本无砂！很嫩！,-,-,2021-06-26
986,m**3,净含量: 100g 口味: 【每袋仅7.1】干裙带菜100g*5袋,好评,老大一包了，实惠装,-,-,2021-06-20
987,小**孩,净含量: 100g 口味: 【每袋仅9.4】干裙带菜100g*2袋,好评,很喜欢，很好 ,-,-,2021-06-19
988,t**5,净含量: 100g 口味: 【每袋仅7.1】干裙带菜100g*5袋,好评,做了汤非常好吃，味道不错。 ,-,-,2021-06-09
989,m**g,净含量: 100g 口味: 【每袋仅7.9】干裙带菜100g*3袋,好评,真的很好，一会就泡好了，颜色也好,-,-,2021-06-09
990,购**活,净含量: 100g 口味: 【特惠尝鲜价】干裙带菜100g*1袋,好评,挺好的，喜欢裙带菜排骨。放辣酱豆腐也好吃。大家尝试哦。 ,-,-,2021-06-09
991,g**3,净含量: 100g 口味: 【每袋仅8.2】干裙带菜100g*3袋,好评,还行吧，但是挺划算的！,-,-,2021-06-22
992,相**3,净含量: 100g 口味: 【新品】免切干裙带菜200g*2袋,好评,口感不错，泡几分钟就好了 ,-,-,2021-06-11
993,t**1,净含量: 100g 口味: 【新品】盐渍半干裙带菜5斤（大包装）,好评,这个咋是盐渍的，不是袋装干的包装的,-,-,2021-06-20
994,有**8,净含量: 100g 口味: 【每袋仅7.9】干裙带菜100g*3袋,好评,可以购买，干度可以,-,-,2021-06-13
995,我**天,净含量: 100g 口味: 【每袋仅6.9】干裙带菜100g*5袋,好评,裙带菜很干净，一点点泡涨好多，也很好吃，吃完还买,-,-,2021-06-13
996,t**5,净含量: 100g 口味: 【新品】免切干裙带菜200g*2袋,好评,好泡，好清洗，非常好吃😋,-,-,2021-06-11
997,z**1,净含量: 100g 口味: 【新品】免切干裙带菜200g*2袋,好评,泡了一下，非常好，比海带好吃，但是不知道是***工的,-,-,2021-06-10
998,1**o,净含量: 100g 口味: 【特惠尝鲜价】干裙带菜100g*1袋,好评,想不到宝宝不怎么喜欢吃海带，却喜欢吃这个。好评,-,-,2021-06-12
999,梨**0,净含量: 100g 口味: 【特惠尝鲜价】干裙带菜100g*1袋,好评,还没吃，感觉外包装还可以,-,-,2021-06-22
1000,b**二,净含量: 100g 口味: 【特惠尝鲜价】干裙带菜100g*1袋,好评,闻着好香啊，应该很好吃,-,-,2021-06-14
1001,y**8,净含量: 100g 口味: 【每袋仅8.2】干裙带菜100g*3袋,好评,还没吃，看起来就很不错,-,-,2021-06-23
1002,王**9,净含量: 100g 口味: 【每袋仅9.4】干裙带菜100g*2袋,好评,第二次买的，还不错，给婆婆买的,-,-,2021-06-11
1003,陵**风,净含量: 100g 口味: 【新品】免切干裙带菜200g*1袋,好评,昨晚收到先弄了一点，吃着还是不错的，放几个大虾，打两**蛋进去，美得很，总体来说还是挺满意的，！！！ ,-,-,2021-05-28
1004,j**9,净含量: 100g 口味: 【特惠尝鲜价】干裙带菜100g*1袋,好评,好，孩子喜欢，干净卫生 ,-,-,2021-06-10
1005,最**a,净含量: 100g 口味: 【每袋仅9.4】干裙带菜100g*2袋,好评,第一次买来试试感觉还不错，煮汤好喝！,-,-,2021-06-12
1006,z**g,净含量: 100g 口味: 【每袋仅7.9】干裙带菜100g*3袋,好评,第一次买，含钙高做汤给宝宝喝，质量好,-,-,2021-06-14
1007,y**0,净含量: 100g 口味: 【特惠尝鲜价】干裙带菜100g*1袋,好评,宝贝收到了，品质不错，下次还会继续光顾！,-,-,2021-06-11
1008,y**贝,净含量: 100g 口味: 【特惠尝鲜价】干裙带菜100g*1袋,好评,还没有用了。。明天泡泡。。 ,-,-,2021-06-20
1009,d**点,净含量: 100g 口味: 【特惠尝鲜价】干裙带菜100g*1袋,好评,不错不错 蛮好吃的 孩子也爱吃,-,-,2021-06-10
1010,来**8,净含量: 100g 口味: 【每袋仅7.9】干裙带菜100g*3袋,好评,货收到了，煮了几次了，挺好吃的，小孩也爱吃,-,-,2021-06-10
1011,四**姥,净含量: 100g 口味: 【每袋仅7.9】干裙带菜100g*3袋,好评,网购最成功干裙带菜，泡发不掉色，会回购。,-,-,2021-06-11
1012,w**慧,净含量: 100g 口味: 【每袋仅7.9】干裙带菜100g*3袋,好评,没想到这么好吃，对减脂期的我来说，太棒了,-,-,2021-06-11
1013,l**乘,净含量: 100g 口味: 【特惠尝鲜价】干裙带菜100g*1袋,好评,抓了一小点点，泡了一大锅。。。。加了排骨玉米胡萝卜一起煮了一锅汤，绝了～～小朋友平时不喜欢吃海带，觉得太硬了。这个就是软软的，很好吃。营养用高。。。。。。后悔怎么没有早一点知道这个菜 ,-,-,2021-06-14
1014,l**5,净含量: 100g 口味: 【新品】免切干裙带菜200g*2袋,好评,挺好吃的，凉拌，煮汤都可以，减肥佳品,-,-,2021-06-10
1015,谨**r,净含量: 100g 口味: 【每袋仅9.4】干裙带菜100g*2袋,好评,发货速度很快，而且也挺好用的耶，就很好看，自己特别喜欢呀，推荐推荐,-,-,2021-06-10
1016,t**4,净含量: 100g 口味: 【新品】免切干裙带菜200g*1袋,好评,颜色绿绿的 很好 ,-,-,2021-06-26
1017,t**0,净含量: 100g 口味: 【每袋仅7.2】干裙带菜100g*3袋,好评,一点泡发了就有很多，专门买来减肥期做汤喝，买了全麦面包，欧包，鸡胸肉丸，买点这个换换口味，加点蔬菜做汤 ,-,-,2021-06-24
1018,夏**4,净含量: 100g 口味: 【每袋仅7.9】干裙带菜100g*3袋,好评,泡发快，口感也不错 ,-,-,2021-06-11
1019,t**0,净含量: 100g 口味: 【每袋仅7.2】干裙带菜100g*3袋,好评,第一次买这个菜，泡出来还不错，没买过被我泡多了😿吃了在追评哈😊,-,-,2021-06-24
1020,鹏**1,净含量: 100g 口味: 【新品】免切干裙带菜200g*1袋,好评,挺干净，味道很好！,-,-,2021-06-11
1021,l**6,净含量: 100g 口味: 【新品】免切干裙带菜200g*1袋,好评,还不错而且很方便，一点点能泡发许多 ,-,-,2021-06-10
1022,娟**事,净含量: 100g 口味: 【每袋仅7.9】干裙带菜100g*3袋,好评,真的很干净，凉拌做汤都很好吃，还会购买的,-,-,2021-06-11
1023,l**8,净含量: 100g 口味: 【新品】免切干裙带菜200g*2袋,好评,很干净，没有沙，吃起有点脆，还会再来买。 ,-,-,2021-06-12
1024,老**麻,净含量: 100g 口味: 【每袋仅7.6】干裙带菜100g*3袋,好评,小孩子特别喜欢吃,-,-,2021-06-10
1025,c**3,净含量: 100g 口味: 【新品】免切干裙带菜200g*2袋,好评,很好泡发，鲜嫩 ,-,-,2021-06-10
1026,t**8,净含量: 100g 口味: 【每袋仅7.1】干裙带菜100g*5袋,好评,肉质不怎么厚,-,-,2021-06-06
1027,w**9,净含量: 100g 口味: 【新品】免切干裙带菜200g*2袋,好评,之前买过，感觉挺好，这次重购这种。,-,-,2021-06-20
1028,回**7,净含量: 100g 口味: 【每袋仅7.9】干裙带菜100g*3袋,好评,还可以 口感不错,-,-,2021-06-13
1029,露**2,净含量: 100g 口味: 【新品】免切干裙带菜200g*2袋,好评,感觉碎的没有整的好  下次还是买整的吧 ,-,-,2021-06-21
1030,t**7,净含量: 100g 口味: 【每袋仅8.2】干裙带菜100g*3袋,好评,还没吃  看着还可以,-,-,2021-06-21
1031,偏**政,净含量: 100g 口味: 【每袋仅9.4】干裙带菜100g*2袋,好评,吃了，没有沙。打汤喝。比那种厚的好吃一些。 ,-,-,2021-06-21
1032,轻**2,净含量: 100g 口味: 【特惠尝鲜价】干裙带菜100g*1袋,好评,裙带菜很好吃，一袋可以吃好久,-,-,2021-06-13
1033,t**2,净含量: 100g 口味: 【特惠尝鲜价】干裙带菜100g*1袋,好评,收到啦，包装很好很用心，先买一包试试口味，觉得好吃会继续回来买的。,-,-,2021-06-24
1034,小**0,净含量: 100g 口味: 【每袋仅7.9】干裙带菜100g*3袋,好评,没有杂质，挺好,-,-,2021-06-20
1035,我**3,净含量: 100g 口味: 【每袋仅6.9】干裙带菜100g*5袋,好评,还没吃看着不错先好评吧 ,干净，容易清洗，好搭配，烧汤，炖煮，凉拌都不错，低卡减脂，吃多少都不担心长胖,-,2021-05-22
1036,c**2,净含量: 100g 口味: 【新品】免切干裙带菜200g*2袋,好评,裙带菜挺干净的，家人都喜欢吃,-,-,2021-06-12
1037,嫣**觞,净含量: 100g 口味: 【每袋仅7.9】干裙带菜100g*3袋,好评,挺好的，发来很多，挺好吃，适合小孩,-,-,2021-06-09
1038,t**5,净含量: 100g 口味: 【每袋仅9.4】干裙带菜100g*2袋,好评,收到啦，两大包,-,-,2021-06-10
1039,燕**鬼,净含量: 100g 口味: 【每袋仅8.2】干裙带菜100g*3袋,好评,还没吃，三大包,-,-,2021-06-20
1040,t**0,净含量: 100g 口味: 【新品】免切干裙带菜200g*1袋,好评,不是我想要的，很碎，不是整片或是大条的，就是碎的， ,-,-,2021-06-24
1041,精**6,净含量: 100g 口味: 【每袋仅6.9】干裙带菜100g*5袋,好评,很方便开袋用水泡一下就好了！,-,-,2021-06-09
1042,催**2,净含量: 100g 口味: 【每袋仅7.9】干裙带菜100g*3袋,好评,做汤很鲜美！,-,-,2021-06-11
1043,t**8,净含量: 100g 口味: 【每袋仅9.4】干裙带菜100g*2袋,好评,好吃，煮在螺蛳粉里面也很不错哦 ,-,-,2021-06-06
1044,赵**1,净含量: 100g 口味: 【每袋仅7.9】干裙带菜100g*3袋,好评,看起来还可以 ,-,-,2021-06-11
1045,t**5,净含量: 100g 口味: 【每袋仅7.9】干裙带菜100g*3袋,好评,东西非常好吃,-,-,2021-06-10
1046,冰**灵,净含量: 100g 口味: 【每袋仅9.4】干裙带菜100g*2袋,好评,味道挺不错的 ,-,-,2021-06-13
1047,丰**坊,净含量: 100g 口味: 【新品】免切干裙带菜200g*1袋,好评,味道还可以,-,-,2021-06-13
1048,t**8,净含量: 100g 口味: 【每袋仅6.9】干裙带菜100g*5袋,好评,很好，一丢丢泡了好多，而且夏季比较好放，推荐购买 ,-,-,2021-06-06
1049,自**痛,净含量: 100g 口味: 【每袋仅7.9】干裙带菜100g*3袋,好评,还可以，一般。 ,-,-,2021-06-20
1050,木**果,净含量: 100g 口味: 【每袋仅7.2】干裙带菜100g*3袋,好评,很不错的一款产品，质量很好，价格也很实惠，物流很快。 ,-,-,2021-06-10
1051,t**6,净含量: 100g 口味: 【每袋仅9.4】干裙带菜100g*2袋,好评,好吃又脆,-,-,2021-06-24
1052,0**p,净含量: 100g 口味: 【特惠尝鲜价】干裙带菜100g*1袋,好评,挺大一包 还没吃 到时候来追平,-,-,2021-06-22
1053,j**j,净含量: 100g 口味: 【新品】免切干裙带菜200g*2袋,好评,还没有食用，后期追加评价，先好评,-,-,2021-06-09
1054,宝**萌,净含量: 100g 口味: 【每袋仅7.6】干裙带菜100g*3袋,好评,此用户没有填写评价。,我一直是主张好评的人，理解店家的不容易 ，但今天不得不追评一下 ，店家的好评哪儿来的 ？发的这是些什么 ？货品的品质出现问题，提出补偿三块钱，现在大家是缺三块钱吗 ？明显的一个态度问题 ，如果还有想拍的亲，可以看一看，了解一下再做决定 。,-,2021-05-31
1055,t**9,净含量: 100g 口味: 【每袋仅7.9】干裙带菜100g*3袋,好评,非常方便，只要泡一下就好了 ,-,-,2021-06-11
1056,那**8,净含量: 100g 口味: 【每袋仅7.6】干裙带菜100g*3袋,好评,吃了两次了，每次只要一小坨，好吃，脆！ ,-,-,2021-06-11
1057,z**人,净含量: 100g 口味: 【新品】免切干裙带菜200g*1袋,好评,裙带菜一般般 ,-,-,2021-06-21
1058,你**c,净含量: 100g 口味: 【每袋仅8.9】干裙带菜100g*2袋,好评,不好硬的都泡不软打算重新买！,-,-,2021-06-20
1059,闲**香,净含量: 100g 口味: 【每袋仅7.1】干裙带菜100g*5袋,好评,建议商家不要发韵达快递，服务态度极差，私自签收后15个小时才送货，打电话也不接，网购以来最闹心的一次 ,-,-,2021-06-22
1060,t**4,净含量: 100g 口味: 【每袋仅7.6】干裙带菜100g*3袋,好评,挺好的，一大包挺多的，能吃好久 ,-,-,2021-06-26
1061,t**7,净含量: 100g 口味: 【每袋仅7.6】干裙带菜100g*3袋,好评,挺好吃的，一点点就可以发很多,-,-,2021-06-21
1062,y**3,净含量: 100g 口味: 【每袋仅7.9】干裙带菜100g*3袋,好评,裙带菜很干净，也很美味，已回购！,-,-,2021-06-13
1063,熙**3,净含量: 100g 口味: 【每袋仅7.9】干裙带菜100g*3袋,好评,看着可以,-,-,2021-06-11
1064,静**气,净含量: 100g 口味: 【每袋仅7.2】干裙带菜100g*3袋,好评,性价比：挺好的 ,-,-,2021-06-13
1065,分**o,净含量: 100g 口味: 【特惠尝鲜价】干裙带菜100g*1袋,好评,口感不错，娃喜欢吃，物流给力 ,-,-,2021-06-12
1066,t**3,净含量: 100g 口味: 【每袋仅9.4】干裙带菜100g*2袋,好评,感觉不是很好，泡发发现有烂的😁,-,-,2021-06-24
1067,z**4,净含量: 100g 口味: 【特惠尝鲜价】干裙带菜100g*1袋,好评,口感还可以，,-,-,2021-06-22
1068,湛**7,净含量: 100g 口味: 【每袋仅9.4】干裙带菜100g*2袋,好评,质量相当好,-,-,2021-06-11
1069,风**购,净含量: 100g 口味: 【每袋仅6.9】干裙带菜100g*5袋,好评,裙带菜好吃，用来煮汤特别香。,-,-,2021-06-12
1070,c**7,净含量: 100g 口味: 【每袋仅8.2】干裙带菜100g*3袋,好评,味道挺好的。,-,-,2021-06-22
1071,陈**3,净含量: 100g 口味: 【特惠尝鲜价】干裙带菜100g*1袋,好评,不错味道 ,-,-,2021-06-10
1072,t**8,净含量: 100g 口味: 【每袋仅7.9】干裙带菜100g*3袋,好评,一点点都能泡发很多，煮汤很好喝的 ,-,-,2021-06-06
1073,周**林,净含量: 100g 口味: 【每袋仅7.9】干裙带菜100g*3袋,好评,整整三大包,-,-,2021-06-11
1074,t**3,净含量: 100g 口味: 【新品】盐渍半干裙带菜5斤（大包装）,好评,感觉怎么那么少！最多2斤左右吧！我买的是5斤的哦🙄🙄🙄,-,-,2021-06-24
1075,江**8,净含量: 100g 口味: 【特惠尝鲜价】干裙带菜100g*1袋,好评,一点点可以泡好多啊，很嫩很软,-,-,2021-06-11
1076,茶**q,净含量: 100g 口味: 【特惠尝鲜价】干裙带菜100g*1袋,好评,经常回购的，东西不错，很好,-,-,2021-06-10
1077,m**猪,净含量: 100g 口味: 【每袋仅6.9】干裙带菜100g*5袋,好评,泡一下煮汤凉拌都很好吃,-,-,2021-06-11
1078,t**2,净含量: 100g 口味: 【每袋仅6.9】干裙带菜100g*5袋,好评,看着还不错，买了很多包，能吃很久咯。 ,-,-,2021-06-24
1079,w**y,净含量: 100g 口味: 【每袋仅7.6】干裙带菜100g*3袋,好评,比海带干净，好吃，性价比高，打算再购买,-,-,2021-06-14
1080,d**9,净含量: 100g 口味: 【每袋仅7.2】干裙带菜100g*3袋,好评,吃还不错，就是不减肥呀，吃了还是饿,-,-,2021-06-11
1081,a**8,净含量: 100g 口味: 【每袋仅8.4】干裙带菜100g*2袋,好评,好吃量大 ,-,-,2021-06-11
1082,t**7,净含量: 100g 口味: 【每袋仅7.9】干裙带菜100g*3袋,好评,确实有点嫩，很好吃，我家宝宝一下吃了很多，都不吃其他的就吃这个菜，还会购买,-,-,2021-06-21
1083,娜**亭,净含量: 100g 口味: 【特惠尝鲜价】干裙带菜100g*1袋,好评,减脂期必备，喝汤很不错,-,-,2021-06-12
1084,窗**飞,净含量: 100g 口味: 【每袋仅7.1】干裙带菜100g*5袋,好评,二次回购了，非常不错 ,-,-,2021-06-13
1085,l**7,净含量: 100g 口味: 【每袋仅8.2】干裙带菜100g*3袋,好评,还可以吧，感觉没有紫菜鲜,-,-,2021-06-22
1086,d**4,净含量: 100g 口味: 【每袋仅7.9】干裙带菜100g*3袋,好评,非常好吃，多次购买了,-,-,2021-06-13
1087,晴**7,净含量: 100g 口味: 【每袋仅7.6】干裙带菜100g*3袋,好评,很喜欢吃这个，第二次买了，泡一点点就够吃了，感觉一包能吃好多次。减肥的人吃这个绝对没问题。好评好评好评好评！,-,-,2021-05-31
1088,李**哒,净含量: 100g 口味: 【每袋仅9.4】干裙带菜100g*2袋,好评,好吃不贵，回购走起来,-,-,2021-06-11
1089,t**5,净含量: 100g 口味: 【新品】免切干裙带菜200g*1袋,好评,非常愉快的一次购物,-,-,2021-06-09
1090,饭**3,净含量: 100g 口味: 【每袋仅7.9】干裙带菜100g*3袋,好评,真的不错，第二次购买,-,-,2021-06-14
1091,t**1,净含量: 100g 口味: 【每袋仅7.6】干裙带菜100g*3袋,好评,泡发了一大盘子。好超值啊。,-,-,2021-06-13
1092,晓**发,净含量: 100g 口味: 【每袋仅9.4】干裙带菜100g*2袋,好评,已经拿到了，明天泡点煮着吃吃看 ,-,-,2021-06-09
1093,解**9,净含量: 100g 口味: 【每袋仅8.2】干裙带菜100g*3袋,好评,还没吃呢，习惯好评！等吃过再追评吧,-,-,2021-06-21
1094,阿**y,净含量: 100g 口味: 【每袋仅7.2】干裙带菜100g*3袋,好评,性价比：很划算 规格重量：一次一点点就可以泡发很多 口感味道：很好吃，没有海带那么硬，很鲜 ,-,-,2021-05-29
1095,熊**9,净含量: 100g 口味: 【每袋仅9.4】干裙带菜100g*2袋,好评,看着挺好。做了再来评价。 ,-,-,2021-06-12
1096,刘**瑗,净含量: 100g 口味: 【特惠尝鲜价】干裙带菜100g*1袋,好评,吃起来一股糊味，不咋的,-,-,2021-06-22
1097,t**0,净含量: 100g 口味: 【每袋仅6.9】干裙带菜100g*5袋,好评,泡了大概十分钟就开了  拌菜和煲汤都试了 很好吃 这个价钱很值 ,-,-,2021-06-24
1098,张**6,净含量: 100g 口味: 【每袋仅7.9】干裙带菜100g*3袋,好评,还没尝试，应该可以,-,-,2021-06-13
1099,阿**9,净含量: 100g 口味: 【特惠尝鲜价】干裙带菜100g*1袋,好评,裙带菜很好吃，也很干净 ,-,-,2021-06-09
1100,叮**砾,净含量: 100g 口味: 【特惠尝鲜价】干裙带菜100g*1袋,好评,一点点，泡出来特别多，特别鲜,-,-,2021-06-10
1101,易**果,净含量: 100g 口味: 【特惠尝鲜价】干裙带菜100g*1袋,好评,发货地标的江苏，怎么从广州发过来的,-,-,2021-06-20
1102,天**y,净含量: 100g 口味: 【每袋仅7.2】干裙带菜100g*3袋,好评,此用户没有填写评价。,吃上了才来评价，鲜 嫩 好吃,-,2021-05-31
1103,吉**0,净含量: 100g 口味: 【每袋仅6.9】干裙带菜100g*5袋,好评,好大一袋哦！太划算了！还没开始泡，等吃了再来追评。,-,-,2021-06-02
1104,t**3,净含量: 100g 口味: 【每袋仅8.4】干裙带菜100g*2袋,好评,此用户没有填写评价。,挺好吃的，用来做汤很鲜的,-,2021-06-24
