1417,t**2,净含量: 100g 口味: 【新品】盐渍半干裙带菜5斤（大包装）,好评,此用户没有填写评价。,非常好吃，大人小孩都爱，减肥佳品，今天继续下单。,-,2021-06-24
1418,张**6,净含量: 100g 口味: 【每袋仅6.9】干裙带菜100g*5袋,好评,宝贝收到了，裙带菜很好干净无沙，易泡开做汤的首选,-,-,2021-05-31
1419,杨**臻,净含量: 100g 口味: 【每袋仅7.1】干裙带菜100g*5袋,好评,很大的袋子，还没吃呢，看着还不错 ,-,-,2021-06-14
1420,g**挡,净含量: 100g 口味: 【每袋仅7.6】干裙带菜100g*3袋,好评,口感不错，没有泥沙,-,-,2021-06-14
1421,w**8,净含量: 100g 口味: 【特惠尝鲜价】干裙带菜100g*1袋,好评,取一点就能泡发好多，一点沙都没有，和虾仁豆腐一起煮的汤，特别鲜，好喝,-,-,2021-05-29
1422,t**2,净含量: 100g 口味: 【每袋仅8.4】干裙带菜100g*2袋,好评,专门买给宝宝吃的，结果不太好颜色很暗，也不嫩，比我之前吃的口感差很多，而且煮久了表面还皱皱巴巴的，不建议买l,-,-,2021-06-24
1423,剑**丝,净含量: 100g 口味: 【每袋仅7.9】干裙带菜100g*3袋,好评,里面有的泡不开，咬不动。,-,-,2021-06-18
1424,t**6,净含量: 100g 口味: 【特惠尝鲜价】干裙带菜100g*1袋,好评,宝贝收到了，包装很结实，应该是个好东西，先给好评了,-,-,2021-06-24
1425,张**6,净含量: 100g 口味: 【每袋仅7.2】干裙带菜100g*3袋,好评,一点就可以泡发很多 也很有营养 不咸 ,-,-,2021-06-01
1426,t**4,净含量: 100g 口味: 【每袋仅7.2】干裙带菜100g*3袋,好评,质量没得说，跟专卖店一样，特别特别喜欢，而且价格优惠,-,-,2021-06-26
1427,t**8,净含量: 100g 口味: 【每袋仅7.1】干裙带菜100g*5袋,好评,昨晚煮了，味道不错，就是自己第一次煮太多了，值得购买 ,-,-,2021-06-06
1428,1**5,净含量: 100g 口味: 【每袋仅8.9】干裙带菜100g*2袋,好评,很好，泡的很快,-,-,2021-05-29
1429,w**n,净含量: 100g 口味: 【新品】免切干裙带菜200g*2袋,好评,规格重量：超级好 非常满意 裙带很不错 ,-,-,2021-06-04
1430,x**i,净含量: 100g 口味: 【每袋仅7.6】干裙带菜100g*3袋,好评,很好吃的裙带菜 价格比超市便宜 买买买,-,-,2021-06-04
1431,小**咔,净含量: 100g 口味: 【每袋仅7.2】干裙带菜100g*3袋,好评,口感味道：无敌无敌无敌好吃  赶紧来买 ,-,-,2021-06-03
1432,t**5,净含量: 100g 口味: 【新品】免切干裙带菜200g*1袋,好评,裙带菜质量很好泡出来很干净，回购多次了。 ,-,-,2021-06-02
1433,d**e,净含量: 100g 口味: 【加14元购】裙带菜100g*3袋+日本进口味噌酱300g,好评,发货很快，包装的很好，价格也特别实惠，值得购买。,-,-,2021-06-01
1434,王**生,净含量: 100g 口味: 【每袋仅8.4】干裙带菜100g*2袋,好评,美味可口，孩子爱吃,-,-,2021-06-04
1435,刁**乖,净含量: 100g 口味: 【新品】免切干裙带菜200g*1袋,好评,拿到手留煮了吃了，无沙，不用切，省心省力 ,-,-,2021-05-28
1436,阿**0,净含量: 100g 口味: 【每袋仅6.9】干裙带菜100g*5袋,好评,满满的五大包很实惠，给我吃好长一段时间了  ,-,-,2021-06-06
1437,放**6,净含量: 100g 口味: 【新品】免切干裙带菜200g*1袋,好评,口感味道：挺好，吃着方便，干净 ,-,-,2021-06-03
1438,t**5,净含量: 100g 口味: 【新品】免切干裙带菜200g*2袋,好评,是假货，大家别买,-,-,2021-06-14
1439,t**9,净含量: 100g 口味: 【每袋仅7.9】干裙带菜100g*3袋,好评,宝贝已收到味道不错值得购买,-,-,2021-06-08
1440,范**哲,净含量: 100g 口味: 【每袋仅9.4】干裙带菜100g*2袋,好评,泡几分钟就可以了，很方便，味道也可以,-,-,2021-06-06
1441,柳**3,净含量: 100g 口味: 【每袋仅7.9】干裙带菜100g*3袋,好评,买回来就做的汤，很容易泡发，做的汤味道很鲜，推荐购买哟,-,-,2021-06-07
1442,l**5,净含量: 100g 口味: 【每袋仅7.2】干裙带菜100g*3袋,好评,还可以，一次性买了三包很划算！！,-,-,2021-06-01
1443,萌**酱,净含量: 100g 口味: 【每袋仅8.9】干裙带菜100g*2袋,好评,泡出来贼多，很鲜美，煮汤和蒸鸡一流,-,-,2021-06-06
1444,x**n,净含量: 100g 口味: 【每袋仅7.9】干裙带菜100g*3袋,好评,很喜欢吃这个菜，我们这边烫火锅味道很棒 ,-,-,2021-06-08
1445,睿**a,净含量: 100g 口味: 【特惠尝鲜价】干裙带菜100g*1袋,好评,划算。味道也不错,-,-,2021-06-01
1446,m**2,净含量: 100g 口味: 【每袋仅7.6】干裙带菜100g*3袋,好评,下单后才发现家里还有一包 以后多多煮吧 ,-,-,2021-05-30
1447,t**9,净含量: 100g 口味: 【每袋仅7.1】干裙带菜100g*5袋,好评,好评 老妈给的评价很高 就是我忘了她是咋夸的了😂😂😂 ,-,-,2021-06-18
1448,t**4,净含量: 100g 口味: 【每袋仅7.2】干裙带菜100g*3袋,好评,味道鲜美干净没有沙子,-,-,2021-06-26
1449,孙**1,净含量: 100g 口味: 【每袋仅7.2】干裙带菜100g*3袋,好评,很干净，味道也不错。已经吃了好几回了，很不错，还会回购 ,-,-,2021-06-03
1450,s**杰,净含量: 100g 口味: 【每袋仅7.9】干裙带菜100g*3袋,好评,真不错，没有泥沙，很干净 ,-,-,2021-06-06
1451,惘**9,净含量: 100g 口味: 【特惠尝鲜价】干裙带菜100g*1袋,好评,还没吃，好大一袋，感觉很划算,-,-,2021-05-29
1452,旧**3,净含量: 100g 口味: 【特惠尝鲜价】干裙带菜100g*1袋,好评,不错的，好喝，味道非常棒，很干净推荐 ,-,-,2021-06-03
1453,t**6,净含量: 100g 口味: 【每袋仅6.9】干裙带菜100g*5袋,好评,东西挺好的，孩子也特别爱吃,-,-,2021-06-24
1454,微**7,净含量: 100g 口味: 【新品】免切干裙带菜200g*2袋,好评,第二次买了，品质很好，这次是买给妈**，妈妈也说很好,-,-,2021-06-04
1455,t**6,净含量: 100g 口味: 【每袋仅7.2】干裙带菜100g*3袋,好评,口感味道：挺好的，干净清爽 ,-,-,2021-06-24
1456,唐**3,净含量: 100g 口味: 【每袋仅8.4】干裙带菜100g*2袋,好评,很划算，可以做好多次,-,-,2021-06-03
1457,王**艳,净含量: 100g 口味: 【每袋仅7.9】干裙带菜100g*3袋,好评,烧汤做凉菜都挺好吃，可是，有时候泡发的时候有一部分泡不好，很硬不好吃,-,-,2021-06-18
1458,虫**儿,净含量: 100g 口味: 【特惠尝鲜价】干裙带菜100g*1袋,好评,口感味道：好吃，继续回购  ,-,-,2021-06-05
1459,草**3,净含量: 100g 口味: 【特惠尝鲜价】干裙带菜100g*1袋,好评,当时买的时候还在犹豫价格，买来之后一点都不后悔，而且物流还快，可以入手 ,-,-,2021-05-30
1460,j**6,净含量: 100g 口味: 【每袋仅8.9】干裙带菜100g*2袋,好评,营养美味,-,-,2021-06-05
1461,贾**8,净含量: 100g 口味: 【每袋仅7.1】干裙带菜100g*5袋,好评,不好，有一股味，熬汤也不好喝，不建议购买,-,-,2021-06-18
1462,水**呀,净含量: 100g 口味: 【每袋仅7.2】干裙带菜100g*3袋,好评,宝宝爱吃，我也爱吃，上网查可以补钙，买了3袋试一下，不错，会回购 ,-,-,2021-06-02
1463,百**1,净含量: 100g 口味: 【每袋仅7.6】干裙带菜100g*3袋,好评,海带清爽，口感味道不错 ,-,-,2021-05-30
1464,t**3,净含量: 100g 口味: 【每袋仅7.6】干裙带菜100g*3袋,好评,刚收到，应该不错吧，改天给孩子们做吃的 ,-,-,2021-06-24
1465,j**6,净含量: 100g 口味: 【每袋仅7.9】干裙带菜100g*3袋,好评,特别好，包装也很干净。客服态度真是耐心，客服应该就是店主了，耐心到我感动。还会继续购买。下次继续购买。  ,-,-,2021-06-06
1466,任**鹃,净含量: 100g 口味: 【新品】免切干裙带菜200g*2袋,好评,第二次买，之前买的蛮好吃的，给爸妈买一包 ,-,-,2021-05-30
1467,亭**5,净含量: 100g 口味: 【每袋仅8.4】干裙带菜100g*2袋,好评,感觉像海带的边边，哈哈，不知道真假 ,-,-,2021-05-28
1468,蘑**鱼,净含量: 100g 口味: 【特惠尝鲜价】干裙带菜100g*1袋,好评,一点点就泡了好大一盆，特地煮了以后再来评价的，还不错，挺好吃的 ,-,-,2021-05-31
1469,t**3,净含量: 100g 口味: 【每袋仅7.9】干裙带菜100g*3袋,好评,没吃过裙带菜，头一次买回来照着视频做了还挺好吃的。,-,-,2021-06-24
1470,z**8,净含量: 100g 口味: 【特惠尝鲜价】干裙带菜100g*1袋,好评,家人代收货，没拆开看到实物，直播间买的，希望是好物,-,-,2021-05-30
1471,冯**5,净含量: 100g 口味: 【每袋仅7.2】干裙带菜100g*3袋,好评,快递物流：快递也很快 性价比：性价比比较高，能吃很长时间的 规格重量：非常耐吃，泡一点就做可多汤了 口感味道：口感非常耐煮的，以前买的别的家的是泡过以后都是可烂糊这个煮了很长时间还是很筋道的 ,-,-,2021-05-12
1472,z**1,净含量: 100g 口味: 【特惠尝鲜价】干裙带菜100g*1袋,好评,口感味道：太难喝了，想吐 ,-,-,2021-06-19
1473,华**兴,净含量: 100g 口味: 【每袋仅9.4】干裙带菜100g*2袋,好评,吃了两次了，超级喜欢，本人比较喜欢裙带菜，这个很满意 ,-,-,2021-06-08
1474,孔**3,净含量: 100g 口味: 【加14元购】裙带菜100g*3袋+日本进口味噌酱300g,好评,第一次吃到口感这么差的裙带菜,-,-,2021-06-18
1475,c**8,净含量: 100g 口味: 【每袋仅7.1】干裙带菜100g*5袋,好评,还没吃呢。应该不错。给孩子烧汤……,-,-,2021-06-19
1476,x**0,净含量: 100g 口味: 【特惠尝鲜价】干裙带菜100g*1袋,好评,看别人评价说是吃了有助于长高，买了试下，用了再追评。。。,-,-,2021-06-06
1477,t**5,净含量: 100g 口味: 【每袋仅6.9】干裙带菜100g*5袋,好评,第二次买，很嫩，没有沙子，好评,-,-,2021-05-29
1478,茹**时,净含量: 100g 口味: 【每袋仅7.9】干裙带菜100g*3袋,好评,孩子爱吃，味道不错,-,-,2021-06-04
1479,花**g,净含量: 100g 口味: 【特惠尝鲜价】干裙带菜100g*1袋,好评,味道还不错！感觉和海带差不多 ,-,-,2021-06-02
1480,吴**7,净含量: 100g 口味: 【每袋仅6.9】干裙带菜100g*5袋,好评,好吃，质量刚刚的。比海带干净方便多了,-,-,2021-06-06
1481,t**4,净含量: 100g 口味: 【每袋仅7.9】干裙带菜100g*3袋,好评,说实话我是第一次买这个裙带菜，蛮好的，挺满意的,-,-,2021-06-26
1482,m**6,净含量: 100g 口味: 【每袋仅7.2】干裙带菜100g*3袋,好评,干裙带菜吃起来很方便，一下就泡开了。好吃。还会回购的 ,-,-,2021-05-28
1483,彩**7,净含量: 100g 口味: 【加6元购】裙带菜100g*3袋+0脂油醋汁268g,好评,一泡发好多，实惠,-,-,2021-06-06
1484,宝**墨,净含量: 100g 口味: 【每袋仅6.9】干裙带菜100g*5袋,好评,回来泡发了一点吃火锅，挺好吃的，容易泡发，质量不错。,-,-,2021-06-02
1485,d**6,净含量: 100g 口味: 【每袋仅8.9】干裙带菜100g*2袋,好评,海带一样的，启了个高级的名字。,-,-,2021-06-05
1486,l**5,净含量: 100g 口味: 【每袋仅7.2】干裙带菜100g*3袋,好评,裙带菜非常不错，很干净，口感好,-,-,2021-05-31
1487,t**5,净含量: 100g 口味: 【每袋仅6.9】干裙带菜100g*5袋,好评,宝贝质量很好值得购买,-,-,2021-06-04
1488,麦**m,净含量: 100g 口味: 【每袋仅8.4】干裙带菜100g*2袋,好评,能泡特别多，很干净 ，处理的非常干净，这家值得加购多几件 ,-,-,2021-06-02
1489,s**x,净含量: 100g 口味: 【每袋仅8.9】干裙带菜100g*2袋,好评,挺好吃的，泡一点就有好多，孩子喜欢吃 ,-,-,2021-05-29
1490,t**2,净含量: 100g 口味: 【每袋仅9.4】干裙带菜100g*2袋,好评,还行，味道也不错，,-,-,2021-06-24
1491,红**花,净含量: 100g 口味: 【每袋仅7.2】干裙带菜100g*3袋,好评,泡发率高，干净无杂质，很好吃。 ,-,-,2021-05-29
1492,t**9,净含量: 100g 口味: 【特惠尝鲜价】干裙带菜100g*1袋,好评,口感味道：干净好吃 ,-,-,2021-05-28
1493,d**e,净含量: 100g 口味: 【新品】免切干裙带菜200g*2袋,好评,感觉泡发后还是太柴了，口感不是很好。,-,-,2021-06-19
1494,t**0,净含量: 100g 口味: 【特惠尝鲜价】干裙带菜100g*1袋,好评,还没吃，看着还不错，会推荐给明友的,-,-,2021-06-24
1495,y**i,净含量: 100g 口味: 【每袋仅7.9】干裙带菜100g*3袋,好评,味道非常好，家人都很喜欢！,-,-,2021-06-07
1496,猪**仪,净含量: 100g 口味: 【特惠尝鲜价】干裙带菜100g*1袋,好评,干透透的，特别好，煮面煮菜下点，特别鲜 ,-,-,2021-06-06
1497,李**y,净含量: 100g 口味: 【每袋仅8.2】干裙带菜100g*3袋,好评,不好吃，我朋友买的泡的很绿，这个不会,-,-,2021-06-19
1498,t**3,净含量: 100g 口味: 【每袋仅6.9】干裙带菜100g*5袋,好评,裙带菜质量很好，第二次购买。 ,-,-,2021-06-24
1499,a**4,净含量: 100g 口味: 【每袋仅7.1】干裙带菜100g*5袋,好评,不错，很干净，放在水里一会儿就泡开了，口感不错,-,-,2021-06-07
1500,x**6,净含量: 100g 口味: 【每袋仅7.9】干裙带菜100g*3袋,好评,性价比：可以的，我觉得值得购买 ,-,-,2021-06-08
1501,t**8,净含量: 100g 口味: 【每袋仅7.6】干裙带菜100g*3袋,好评,确实一点点就可以泡出很多   嫩  下次试试凉拌,-,-,2021-06-06
1502,付**板,净含量: 100g 口味: 【每袋仅8.9】干裙带菜100g*2袋,好评,裙带太喜欢了，要的就是这个品种，很满意特等好评！,-,-,2021-05-29
1503,t**9,净含量: 100g 口味: 【每袋仅6.9】干裙带菜100g*5袋,好评,没我想象中的那样。视频明明拍的很美好，我自己煮就没有那个味道，还有我发现，裙带菜里面很多洞洞是被虫蛀掉吗？有点恶心，都不敢吃 ,-,-,2021-06-11
1504,t**5,净含量: 100g 口味: 【特惠尝鲜价】干裙带菜100g*1袋,好评,物美，美味！！！值得推荐！！！ ,-,-,2021-06-07
1505,l**恼,净含量: 100g 口味: 【特惠尝鲜价】干裙带菜100g*1袋,好评,用来煮汤，煮火锅都很不错，每次泡一点点就够吃了。 ,-,-,2021-06-02
1506,z**n,净含量: 100g 口味: 【每袋仅8.9】干裙带菜100g*2袋,好评,头部那没下面的好嚼，头部的更硬 ,头部的硬,-,2021-06-18
1507,快**0,净含量: 100g 口味: 【每袋仅7.6】干裙带菜100g*3袋,好评,裙带菜口感好，比海带好吃，会回购,-,-,2021-06-06
1508,沈**1,净含量: 100g 口味: 【特惠尝鲜价】干裙带菜100g*1袋,好评,孕期每周吃 现在孩子2岁  继续吃 ,-,-,2021-05-28
1509,盼**峤,净含量: 100g 口味: 【每袋仅7.9】干裙带菜100g*3袋,好评,看包装还不错，等吃了再来追评,-,-,2021-06-07
1510,t**5,净含量: 100g 口味: 【每袋仅6.9】干裙带菜100g*5袋,好评,回来吃了两顿，很好泡发，口感也好。,-,-,2021-06-08
1511,活**己,净含量: 100g 口味: 【每袋仅7.9】干裙带菜100g*3袋,好评,东西很干净，买了300克，感觉太多了， ,-,-,2021-06-16
1512,t**2,净含量: 100g 口味: 【每袋仅7.9】干裙带菜100g*3袋,好评,这个菜确实不错，味道很好 ,-,-,2021-06-24
1513,t**4,净含量: 100g 口味: 【每袋仅7.6】干裙带菜100g*3袋,好评,拌凉菜，打汤首选，味道极佳！ ,-,-,2021-06-26
1514,各**用,净含量: 100g 口味: 【每袋仅8.9】干裙带菜100g*2袋,好评,发货迅速，收到当即试做，的确不错，孩子喜欢吃。,-,-,2021-05-29
1515,5**i,净含量: 100g 口味: 【特惠尝鲜价】干裙带菜100g*1袋,好评,裙带菜收到了，小孩非常喜欢吃,-,-,2021-06-05
1516,阚**0,净含量: 100g 口味: 【每袋仅7.2】干裙带菜100g*3袋,好评,口感味道：味道不咋地 ,-,-,2021-06-14
1517,呐**双,净含量: 100g 口味: 【每袋仅7.6】干裙带菜100g*3袋,好评,分量很足但是家人不喜欢吃 ,-,-,2021-05-31
1518,t**4,净含量: 100g 口味: 【新品】免切干裙带菜200g*2袋,好评,口感味道：非常好 ,-,-,2021-06-26
1519,l**8,净含量: 100g 口味: 【每袋仅7.6】干裙带菜100g*3袋,好评,第二次购买了，全家都喜欢吃。 ,-,-,2021-06-04
1520,街**3,净含量: 100g 口味: 【每袋仅7.6】干裙带菜100g*3袋,好评,好吃，准备再买一点给我爷爷奶奶吃 ,-,-,2021-06-06
1521,a**0,净含量: 100g 口味: 【特惠尝鲜价】干裙带菜100g*1袋,好评,泡发挺快干净清爽口感好 ,-,-,2021-05-30
1522,m**g,净含量: 100g 口味: 【新品】免切干裙带菜200g*1袋,好评,容易发泡，干净 ,-,-,2021-05-29
1523,徐**6,净含量: 100g 口味: 【每袋仅7.9】干裙带菜100g*3袋,好评,还没有吃，不知道味道怎么样。,-,-,2021-06-16
1524,用**部,净含量: 100g 口味: 【每袋仅7.2】干裙带菜100g*3袋,好评,好，一般都可以发到好多,-,-,2021-06-05
1525,a**1,净含量: 100g 口味: 【每袋仅7.2】干裙带菜100g*3袋,好评,分量很足，准备给宝宝的 ,-,-,2021-06-24
1526,墨**晗,净含量: 100g 口味: 【特惠尝鲜价】干裙带菜100g*1袋,好评,口感不错，煮冬瓜汤好吃😋 ,-,-,2021-06-05
1527,曾**绒,净含量: 100g 口味: 【特惠尝鲜价】干裙带菜100g*1袋,好评,一点点可以泡发好多，很干净冲下就可以煮了 ,-,-,2021-05-28
1528,c**9,净含量: 100g 口味: 【每袋仅7.6】干裙带菜100g*3袋,好评,很好吃，小孩特喜欢，吃完再买,-,-,2021-06-22
1529,l**e,净含量: 100g 口味: 【每袋仅9.4】干裙带菜100g*2袋,好评,给爸妈买的没说不好就是挺好的 ,-,-,2021-06-19
1530,c**沫,净含量: 100g 口味: 【新品】免切干裙带菜200g*1袋,好评,回购了，几分钟就能泡开，下班回来煮个汤超方便 ,-,-,2021-06-03
1531,x**2,净含量: 100g 口味: 【每袋仅7.9】干裙带菜100g*3袋,好评,还行，不怎么好吃，挺干净的 ,-,-,2021-06-19
1532,x**1,净含量: 100g 口味: 【每袋仅7.9】干裙带菜100g*3袋,好评,很脆嫩，很干净,-,-,2021-06-07
1533,w**状,净含量: 100g 口味: 【特惠尝鲜价】干裙带菜100g*1袋,好评,最近一直有被裙带菜洗脑，所以买来尝试下 ,-,-,2021-05-28
1534,t**9,净含量: 100g 口味: 【特惠尝鲜价】干裙带菜100g*1袋,好评,还不错，煮了汤喝，就是自己水平太差了，不咋好喝，哈哈哈,-,-,2021-06-15
1535,晴**晴,净含量: 100g 口味: 【特惠尝鲜价】干裙带菜100g*1袋,好评,比在菜市场便宜,-,-,2021-06-02
1536,t**9,净含量: 100g 口味: 【特惠尝鲜价】干裙带菜100g*1袋,好评,实惠好吃,-,-,2021-06-02
1537,x**豚,净含量: 100g 口味: 【每袋仅7.9】干裙带菜100g*3袋,好评,快递物流：速度很快，第二天就到了！ 收到后还没有煮，等吃后再来追评 ,-,-,2021-06-08
1538,t**5,净含量: 100g 口味: 【特惠尝鲜价】干裙带菜100g*1袋,好评,吃肯定能吃，就是口感略老了， ,-,-,2021-06-15
1539,c**6,净含量: 100g 口味: 【每袋仅7.2】干裙带菜100g*3袋,好评,挺好吃的，泡几分钟就开了，一点点可以煮一碗汤,-,-,2021-05-29
1540,春**明,净含量: 100g 口味: 【加6元购】裙带菜100g*3袋+牛肉粉150g,好评,还不错，家人们都喜欢喝汤,-,-,2021-06-04
1541,z**1,净含量: 100g 口味: 【每袋仅6.9】干裙带菜100g*5袋,好评,今天刚收到晚饭就泡发了一点，煮到汤里，还满好喝的，喜欢。 ,-,-,2021-05-29
1542,t**0,净含量: 100g 口味: 【每袋仅8.4】干裙带菜100g*2袋,好评,还没开袋呢，等吃后再来追评！先全五分好评！,-,-,2021-06-24
1543,畅**轩,净含量: 100g 口味: 【特惠尝鲜价】干裙带菜100g*1袋,好评,看着不错，还没吃呢，挺大一袋. 能吃很长时间呢,-,-,2021-06-01
1544,小**2,净含量: 100g 口味: 【新品】免切干裙带菜200g*1袋,好评,很好的东西，需要的可以入手啊,-,-,2021-06-02
1545,娇**9,净含量: 100g 口味: 【特惠尝鲜价】干裙带菜100g*1袋,好评,超级好吃儿子特别喜欢,-,-,2021-05-31
1546,t**1,净含量: 100g 口味: 【每袋仅6.9】干裙带菜100g*5袋,好评,给爸妈买的，说很好吃  满意 ,-,-,2021-06-07
1547,金**亮,净含量: 100g 口味: 【每袋仅7.2】干裙带菜100g*3袋,好评,密封性好，干净。裙带菜晒的干净，非常干，炖的牛肉非常鲜美。吃完了还会来的。三大袋实惠，提示，一小块就能泡好多。,-,-,2021-05-21
1548,l**j,净含量: 100g 口味: 【加14元购】裙带菜100g*3袋+日本进口味噌酱300g,好评,好吃，很嫩，很划算 ,-,-,2021-05-29
1549,t**2,净含量: 100g 口味: 【每袋仅7.6】干裙带菜100g*3袋,好评,看着好多，要吃很久的感觉 ,-,-,2021-06-24
1550,t**5,净含量: 100g 口味: 【每袋仅8.9】干裙带菜100g*2袋,好评,物流真快，味道不错.质量放心!,-,-,2021-05-31
1551,t**4,净含量: 100g 口味: 【每袋仅6.9】干裙带菜100g*5袋,好评,非常好吃，非常简单方便，终于实现吃海带自由了,-,-,2021-06-26
1552,元**d,净含量: 100g 口味: 【每袋仅7.9】干裙带菜100g*3袋,好评,东西还没吃不过看着很好，客服很尽心哦，帮我解决问题，谢谢瑶瑶,-,-,2021-06-04
1553,陪**0,净含量: 100g 口味: 【每袋仅8.4】干裙带菜100g*2袋,好评,此用户没有填写评价。,烂了，黏黏糊糊的，煮的汤跟胡辣汤一样粘稠，直接扔了,-,2021-06-07
1554,兴**代,净含量: 100g 口味: 【每袋仅7.2】干裙带菜100g*3袋,好评,不错，小孩很喜欢吃，比较软，容易煮,-,-,2021-06-03
1555,y**2,净含量: 100g 口味: 【每袋仅8.4】干裙带菜100g*2袋,好评,味道不错、值得购买 ,-,-,2021-06-21
1556,林**5,净含量: 100g 口味: 【每袋仅6.9】干裙带菜100g*5袋,好评,一点都不好，用水泡一下里面就鼓起水来了，一点都不好吃,-,-,2021-06-14
1557,蔡**2,净含量: 100g 口味: 【每袋仅7.6】干裙带菜100g*3袋,好评,非常好吃，我女儿非常喜欢吃。,-,-,2021-05-31
1558,w**4,净含量: 100g 口味: 【每袋仅7.1】干裙带菜100g*5袋,好评,回购的，没有沙，孩子爱吃,-,-,2021-06-07
1559,j**4,净含量: 100g 口味: 【每袋仅7.6】干裙带菜100g*3袋,好评,很干净味道不错👍,-,-,2021-06-03
1560,t**0,净含量: 100g 口味: 【每袋仅6.9】干裙带菜100g*5袋,好评,特别好，营养也高,-,-,2021-06-24
1561,t**8,净含量: 100g 口味: 【新品】免切干裙带菜200g*1袋,好评,收到货了，今天炖了那个裙带菜，对你那个排骨给宝宝吃，现在还没有开吃的，实现在凳子嗯，不知道味道怎么样？但是比较干净，没有沙，就是这个碎片啊，是不是没有像在抖音上看的那种大片大片大片大片大片大片的了？,-,-,2021-06-06
1562,诗**人,净含量: 100g 口味: 【每袋仅7.1】干裙带菜100g*5袋,好评,宝贝收到了，使用了一下，感觉还不错，喜欢，点赞。,-,-,2021-06-06
1563,s**6,净含量: 100g 口味: 【每袋仅7.2】干裙带菜100g*3袋,好评,不带咸淡，泡发好快  ,-,-,2021-05-30
1564,r**8,净含量: 100g 口味: 【每袋仅7.6】干裙带菜100g*3袋,好评,给孩子买的希望孩子能长高,-,-,2021-06-04
1565,s**7,净含量: 100g 口味: 【每袋仅6.9】干裙带菜100g*5袋,好评,质量超好，干燥生鲜，物流也很快送上门，给好评,-,-,2021-06-04
1566,丽**1,净含量: 100g 口味: 【每袋仅7.9】干裙带菜100g*3袋,好评,裙带菜可以！一包都能吃很多次！ ,-,-,2021-06-17
1567,慧**1,净含量: 100g 口味: 【每袋仅7.6】干裙带菜100g*3袋,好评,我姥爷觉得很好吃 又回购的 物流很快 我很满意 ,-,-,2021-06-04
1568,小**0,净含量: 100g 口味: 【特惠尝鲜价】干裙带菜100g*1袋,好评,一次要少弄点 不然泡出来很多哈哈哈哈哈哈哈哈哈,-,-,2021-06-15
1569,t**8,净含量: 100g 口味: 【加6元购】裙带菜100g*3袋+0脂油醋汁268g,好评,少发我醋汁，与客服说过这个问题，但还是没发，只能给差评,-,-,2021-06-06
1570,秀**0,净含量: 100g 口味: 【每袋仅7.1】干裙带菜100g*5袋,好评,不是一小袋装的而是一大袋装的,-,-,2021-06-15
1571,杨**成,净含量: 100g 口味: 【特惠尝鲜价】干裙带菜100g*1袋,好评,还不错吧！推荐同事买了 ,-,-,2021-06-07
1572,双**0,净含量: 100g 口味: 【特惠尝鲜价】干裙带菜100g*1袋,好评,第一次买，家里人想吃，买来试试，好吃会再买,-,-,2021-06-06
1573,洮**耋,净含量: 100g 口味: 【新品】免切干裙带菜200g*2袋,好评,千万不要买免切的，我以为就是那种大的切成段的，没想到一打开全是像渣渣一样的，也怪我提前没有问清楚，就当给大家避雷了，当然喜欢这种小的也可以下手哟~ ,-,-,2021-06-05
1574,大**8,净含量: 100g 口味: 【特惠尝鲜价】干裙带菜100g*1袋,好评,还可以吧，味道挺好 ,-,-,2021-06-16
1575,随**敏,净含量: 100g 口味: 【特惠尝鲜价】干裙带菜100g*1袋,好评,味好，易熟，含铁高,-,-,2021-06-08
1576,s**h,净含量: 100g 口味: 【特惠尝鲜价】干裙带菜100g*1袋,好评,吃了一次感觉不错，也没有太多碎的 ,-,-,2021-06-05
1577,黄**4,净含量: 100g 口味: 【每袋仅7.6】干裙带菜100g*3袋,好评,算好吃吧！不过我个人还是觉得海带更好吃！,-,-,2021-06-07
1578,a**情,净含量: 100g 口味: 【特惠尝鲜价】干裙带菜100g*1袋,好评,宝宝不讨厌吃 大人也能吃  ,-,-,2021-06-18
1579,t**1,净含量: 100g 口味: 【特惠尝鲜价】干裙带菜100g*1袋,好评,看着还不错，吃了再评！,-,-,2021-05-29
1580,优**子,净含量: 100g 口味: 【每袋仅7.6】干裙带菜100g*3袋,好评,裙带菜收到，物品包装很好，快递很快。满意,-,-,2021-05-28
