1388,t**7,颜色分类: 【22.5W超级快充款★新升级】经典白,好评,速度很快，听朋友介绍买的罗马仕，快充感觉还不错,-,-,2021-06-22
1389,t**5,颜色分类: 【22.5W超级快充款★新升级】经典白,好评,不错，刚到货充电呢,-,-,2021-06-10
1390,f**开,颜色分类: 【18W双向快充款】心形红,好评,活动的时候购买真的划算，上个月买了个被老公拿去用了，这次有活动又买了个同款，还在店里买了原装保护套，都非常的棒,-,-,2021-05-10
1391,梅**立,颜色分类: 【18W双向快充款★新升级】心形红色,好评,服务态度很好，充电宝用起来不错，虽然收到货的过程有些曲折，好在结局是好的,-,-,2021-06-19
1392,s**6,颜色分类: 【22.5W超级快充款★新升级】经典白,好评,买第三次了！很好 ,-,-,2021-06-22
1393,t**3,颜色分类: 【22.5W超级快充款★新升级】经典白,好评,不错，那在手里有重量感，后续再来评论使用感受👀 ,-,-,2021-06-13
1394,昀**骞,颜色分类: 【18W双向快充款★新升级】经典白,好评,重，可以充4次多，比原来买的另外的牌子好多了,-,-,2021-06-17
1395,h**i,颜色分类: 【22.5W超级快充款★新升级】经典白,好评,又说充得五六次，充两次就没电了,-,-,2021-06-15
1396,c**2,颜色分类: 【22.5W超级快充款★新升级】经典白色,好评,能充多次，不错,-,-,2021-06-20
1397,为**靓,颜色分类: 【22.5W超级快充款★新升级】经典白,好评,还不错，看上去挺好看。不知道用起来怎么样，先用用看,-,-,2021-06-15
1398,源**春,颜色分类: 【22.5W超级快充款★新升级】经典白色,好评,此用户没有填写评价。,不错不错，罗马仕充电宝永远的神yyds爱了爱了超级好超级棒,那些长长浅浅细细密密的思念，就像一粒粒断了线的珍珠，颗颗饱满而敦实的散落在思绪里的每个幽暗角落。然而思念是一种蛊惑，任凭我跋山涉水，依然无法逃逸。期待亲下次来的那一刻,2021-05-26
1399,b**u,颜色分类: 【22.5W超级快充款★新升级】经典白色,好评,此用户没有填写评价。,用了一段时间，给手机充电很快，接口也很多,风风雨雨，一路有您，陪伴才是最长情的告白，我们一定不会辜负您的期望，用最好的产品回报您的喜爱，感谢您对罗马仕官方旗舰店的支持，祝您生活愉快。,2021-06-01
1400,q**4,颜色分类: 【22.5W超级快充款★新升级】经典白,好评,比之前的慢，还是以前的线，插上了只有一个闪电⚡，以前的都有双闪,-,-,2021-06-21
1401,t**1,颜色分类: 【22.5W超级快充款★新升级】经典白色,好评,好，续航在长点就更好了,-,-,2021-06-24
1402,艳**1,颜色分类: 【22.5W超级快充款★新升级】经典白,好评,很好哦，超级满意，物流也很快,-,-,2021-06-24
1403,t**9,颜色分类: 【22.5W超级快充款★新升级】经典白,好评,收到货了,-,-,2021-06-17
1404,刘**0,颜色分类: 【22.5W超级快充款★新升级】经典白色,好评,可以。不错的产品,-,-,2021-06-20
1405,杀**1,颜色分类: 【22.5W超级快充款★新升级】经典白色,好评,很好用，一直买你家的充电宝,-,-,2021-06-13
1406,t**6,颜色分类: 【18W双向快充款★新升级】经典白,好评,充电很快电量很足也很重,-,-,2021-06-23
1407,w**伤,颜色分类: 【22.5W超级快充款★新升级】经典白,好评,大容量确实不错很重，收到时有两格电，就接着往里面充满，充了一晚上才满的，现在用了两次，还显示4格电，期待用得久，以前买过一万毫安的用了八年，所以很信赖这个品牌的，推荐购买 ,-,-,2021-06-11
1408,t**8,颜色分类: 【18W双向快充款★新升级】心形红,好评,物流挺快 ,-,-,2021-06-23
1409,杨**欧,颜色分类: 【18W双向快充款★新升级】经典白色,好评,电宝收到了 领卷买的 优惠了20元 目前刚到货几天 用了感觉还没什么问题 罗马仕不会让我们失望的吧！寝室好几个人都买了 希望都能用很久哦！可推荐！ ,-,-,2021-05-09
1410,t**6,颜色分类: 【10.5W标准款】经典白,好评,容量大小：两万毫安大容量，很可 尺寸大小：容量大的尺寸要比一万毫安的大一些，也能接受的。 外观材质：纯白色，很好看 ,-,-,2021-06-23
1411,乙**未,颜色分类: 【22.5W超级快充款★新升级】经典白,好评,是灯显款的，配送的数据线不能用充电宝给手机充电！但接上充电头又能充电！问客股也没给个明确解释。 ,-,-,2021-06-23
1412,我**4,颜色分类: 【22.5W超级快充款★新升级】经典白,好评,跟你说了我的是苹果，你给的这个能充吗，敷衍了事，垃圾,-,-,2021-06-18
1413,t**1,颜色分类: 【18W双向快充款★新升级】经典白色,好评,感觉挺不错的 款式很美观牛* ,-,-,2021-06-24
1414,t**5,颜色分类: 【18W双向快充款★新升级】心形红,好评,物流挺快，至于质量如何等我用一段时间后追评吧 ,-,-,2021-06-10
1415,t**6,颜色分类: 【18W双向快充款★新升级】心形红,好评,多喝插电孔，不大不小正好 ,-,-,2021-06-23
1416,t**2,颜色分类: 【18W双向快充款★新升级】经典白,好评,有点重 插座需单独购买 ,-,-,2021-06-13
1417,浪**鲦,颜色分类: 【18W双向快充款★新升级】经典白,好评,很好，用着还不错,-,-,2021-06-20
1418,t**5,颜色分类: 【22.5W超级快充款★新升级】经典白色,好评,很不错，一直用这个牌子，这次买是想给我妈妈用,-,-,2021-06-10
1419,万**9,颜色分类: 【22.5W超级快充款★新升级】经典白,好评,还行，接口有点松，线很差,-,-,2021-06-20
1420,t**2,颜色分类: 【22.5W超级快充款★新升级】经典白,好评,还是有点厚了，电量是足的,-,-,2021-06-13
1421,t**5,颜色分类: 【18W双向快充款★新升级】经典白色,好评,室友推荐，回来后感觉不错,-,-,2021-06-10
1422,t**1,颜色分类: 【22.5W超级快充款★新升级】经典白,好评,除了快充那个接口有点松，其他没什么大问题 ,-,-,2021-06-24
1423,郁**颜,颜色分类: 【18W双向快充款★新升级】经典白,好评,一如既往地好用，等使用几次后再来加评,-,-,2021-06-14
1424,t**1,颜色分类: 【22.5W超级快充款★新升级】经典白,好评,充很多次电了，一直用的这个牌子，这次买了一个，很好用，充电也很快。,-,-,2021-06-24
1425,大**司,颜色分类: 【22.5W超级快充款★新升级】经典白色,好评,"这是一个不错的产品，很给力,  ，淘宝上面买东西真的是很划算，这家店也是非常划算哦，挑了这么多家挑到这家，特别开心买对产品了，必须的好评 ",-,-,2021-05-08
1426,爱**晓,颜色分类: 【18W双向快充款★新升级】心形红,好评,收到还没用。看起来不错,-,-,2021-06-18
1427,必**9,颜色分类: 【22.5W超级快充款★新升级】经典白,好评,第三次买，这个还没用，不过应该可以,-,-,2021-06-14
1428,t**8,颜色分类: 【22.5W超级快充款★新升级】经典白,好评,第二次购买罗马仕的 不错 值得购买 用的时间长,-,-,2021-06-23
1429,豆**桑,颜色分类: 【18W双向快充款★新升级】经典白,好评,很帅很简约的外观 ,-,-,2021-06-13
1430,2**9,颜色分类: 【22.5W超级快充款★新升级】经典白,好评,支持快充，很好,-,-,2021-06-19
1431,t**1,颜色分类: 【10.5W标准款】经典白,好评,容量大小：非常。非常非常大，效果非常好，我总是单身去上课。 尺寸大小：这很好 外观材质：外观高级高大上。 ,-,-,2021-06-24
1432,w**0,颜色分类: 【18W双向快充款★新升级】心形红,好评,挺好用的，以前买的一个送人了。这是又一次买这个牌子。 ,-,-,2021-06-15
1433,十**4,颜色分类: 【22.5W超级快充款★新升级】经典白,好评,外观材质：好看 ,-,-,2021-06-16
1434,王**2,颜色分类: 【22.5W超级快充款★新升级】经典白,好评,不好用 不如小米的 买完就降价了 ,-,-,2021-06-21
1435,d**n,颜色分类: 【22.5W超级快充款★新升级】经典白,好评,很重，充电快，是超级快充，觉得满意再入手一个 ,-,-,2021-06-14
1436,t**8,颜色分类: 【22.5W超级快充款★新升级】经典白色,好评,很不错，充电快还耐用，爱了爱了，大家可以多多购买,-,-,2021-06-23
1437,q**1,颜色分类: 【22.5W超级快充款★新升级】经典白色,好评,此用户没有填写评价。,东西很好用呢，充电时间也很快能充四台手机,亲，感谢您购买罗马仕的产品，并非常感谢您抽出时间为我们产品做出的宝贵的评价，很高兴亲一直以来的支持，希望宝贝能给亲带来惊喜，我们会一直努力的哟。罗马仕旗舰店的成长需要您一直的鼓励和支持，祝您生活愉快,2021-05-26
1438,等**你,颜色分类: 【22.5W超级快充款★新升级】经典白,好评,充电充不进，就这样充了一天。其他也不行啊客服态度也不好,-,-,2021-06-17
1439,有**于,颜色分类: 【18W双向快充款★新升级】心形红色,好评,此用户没有填写评价。,除了重点总体可以的,相逢即是缘，感谢您在茫茫网络中选中了我们，纵使万水千山，小罗都想陪您走这一程；往后余生，开心是您，暴富是您，成功是您，健康也是您哦~,2021-06-14
1440,t**4,颜色分类: 【22.5W超级快充款★新升级】经典白,好评,不错，很好用，货真价实,-,-,2021-06-23
1441,t**6,颜色分类: 【18W双向快充款★新升级】经典白色,好评,容量大小：xs充满三次左右 出差必备了 ,-,-,2021-06-23
1442,纯**0,颜色分类: 【18W双向快充款★新升级】经典白,好评,很不错！充电快,-,-,2021-06-23
1443,t**8,颜色分类: 【18W双向快充款★新升级】经典白,好评,回购产品，不错,-,-,2021-06-23
1444,t**6,颜色分类: 【10.5W标准款】经典白,好评,性价比高，耐用 ,-,-,2021-06-23
1445,ε**о,颜色分类: 【18W双向快充款★新升级】经典白色,好评,充电速度：充电很快，充电很快 产品质量：质量很好，很喜欢。 ,-,-,2021-06-08
1446,橘**7,颜色分类: 【22.5W超级快充款★新升级】经典白,好评,有点重，很不错的,-,-,2021-06-22
1447,娟**6,颜色分类: 【22.5W超级快充款★新升级】经典白色,好评,价格实惠，值得拥有！ ,-,-,2021-06-15
1448,t**9,颜色分类: 【18W双向快充款★新升级】经典白,好评,晚上10:00订的货。，第二天早上9:00就到了，十分的快。Nice。,-,-,2021-06-17
1449,少**氏,颜色分类: 【18W双向快充款★新升级】心形红,好评,店家服务态度挺好的，有问题能及时回馈，目前用过一次，挺耐用的 ,-,-,2021-06-24
1450,1**输,颜色分类: 【22.5W超级快充款★新升级】经典白,好评,给男朋友买的 他说很喜欢 ,-,-,2021-06-22
1451,刘**4,颜色分类: 【22.5W超级快充款★新升级】经典白,好评,东西不错，物美价廉，真的是首选推荐！！,-,-,2021-06-16
1452,t**3,颜色分类: 【18W双向快充款★新升级】心形红,好评,此用户没有填写评价。,差，无语，一句换了两次了,相逢即是缘，感谢您在茫茫网络中选中了我们，同时也非常抱歉没能给您带来满意的购物体验，小罗这就为您解答问题：充电宝无法充进电可能是电芯休眠导致，建议您可以更换充电线以及使用5V2A适配器再尝试一下呢，或者将充电宝连接至电脑USB接口充电4-5小时；如还是不行，可以联系我们在线客服及时为您处理。小罗希望您能天天开心，事事顺利~,2021-03-25
1453,晴**y,颜色分类: 【18W双向快充款★新升级】经典白,好评,直播时讲拍下送充电线，并备注。收货时无，问客服讲你找直播的人。差评。 ,-,-,2021-06-23
1454,t**2,颜色分类: 【22.5W超级快充款★新升级】经典白色,好评,一天充电口就坏了。。。。。。。。。。,-,-,2021-06-13
1455,刚**品,颜色分类: 【22.5W超级快充款★新升级】经典白,好评,物流速度非常快，商家服务态度也很好！质量很不错！很满意的一次购物！,-,-,2021-06-22
1456,傲**4,颜色分类: 【22.5W超级快充款★新升级】经典白色,好评,充电很快，便携好看,-,-,2021-06-15
1457,t**1,颜色分类: 【18W双向快充款】经典白,好评,此用户没有填写评价。,电池很耐用，产品性能很好，外形美观大气，冲一次，可用一周左右，老牌子的产品，用起来很放心，有多个插口，很棒,相逢是百年许下的愿，相知是今生美丽的兑现，清晨的阳光便是我们的祝福，祝您永远开心!,2021-06-24
1458,乐**0,颜色分类: 【22.5W超级快充款★新升级】经典白,好评,一般吧  一分价格一分货 ,-,-,2021-06-22
1459,t**0,颜色分类: 【22.5W超级快充款★新升级】经典白,好评,物流速度真的很快，颜值也很高，刚到手三格电，送了一根便携充电线，期待使用,-,-,2021-06-21
1460,润**野,颜色分类: 【18W双向快充款★新升级】经典白色,好评,此用户没有填写评价。,充电宝很实用，20000毫安，充一次电可以用好多天了，白色也好好看，很经典，以后充电宝还是买罗马仕的，想要的姐妹冲啦！,您的满意就像蜂蜜一样甜蜜了我们的心，软化了我们一天紧张忙碌的工作，感谢您对罗马仕的支持，祝您每天拥有阳光般的笑容~,2021-06-03
1461,易**4,颜色分类: 【18W双向快充款★新升级】经典白色,好评,充满电得20小时可以给手机充三次多电，还那么笨重,-,-,2021-06-20
1462,t**7,颜色分类: 【18W双向快充款★新升级】经典白色,好评,罗马仕是真的好，所说换货麻烦，但换货后是新的，真的很好。,-,-,2021-06-22
1463,t**0,颜色分类: 【10.5W标准款】经典白,好评,好评，质量很好，有活动不到50就有了，大家参考。 ,-,-,2021-06-21
1464,t**4,颜色分类: 【18W双向快充款★新升级】经典白,好评,罗马仕的充电宝确实不错！为它点赞👍 ,-,-,2021-06-23
1465,易**举,颜色分类: 【22.5W超级快充款★新升级】经典白色,好评,非常好，很好用，大小合适，非常满意。 ,-,-,2021-06-13
1466,n**9,颜色分类: 【18W双向快充款★新升级】经典白,好评,很好，非常棒,-,-,2021-06-23
1467,s**o,颜色分类: 【22.5W超级快充款★新升级】经典白,好评,够大！很好👍,-,-,2021-06-21
1468,x**7,颜色分类: 【22.5W超级快充款★新升级】经典白,好评,不错，挺大个 ,-,-,2021-06-22
1469,乐**儿,颜色分类: 【22.5W超级快充款★新升级】经典白,好评,发货快，好用,-,-,2021-06-19
1470,f**7,颜色分类: 【22.5W超级快充款★新升级】经典白色,好评,第二次购买，品牌值得推荐 ,-,-,2021-06-13
1471,t**3,颜色分类: 【22.5W超级快充款★新升级】经典白,好评,第二次购买，一直信任的品牌,-,-,2021-06-18
1472,t**2,颜色分类: 【10.5W标准款】经典白,好评,电宝不错，同学很喜欢 ,-,-,2021-06-13
1473,t**7,颜色分类: 【22.5W超级快充款★新升级】经典白,好评,有点分量，东西不错，还没使用 ,-,-,2021-06-22
1474,天**0,颜色分类: 【22.5W超级快充款★新升级】经典白,好评,充电宝不错，充的非常快！,-,-,2021-06-18
1475,t**6,颜色分类: 【22.5W超级快充款★新升级】经典白,好评,生活好帮手，物流很给力,-,-,2021-06-23
1476,心**7,颜色分类: 【22.5W超级快充款★新升级】经典白,好评,2W挺大容量的，耐用 ,-,-,2021-06-14
1477,b**7,颜色分类: 【22.5W超级快充款★新升级】经典白,好评,期待效果，希望耐用！,-,-,2021-06-13
1478,t**8,颜色分类: 【22.5W超级快充款★新升级】经典白,好评,good 很不错 很有分量不过挺重的 ,-,-,2021-06-23
1479,t**8,颜色分类: 【10.5W标准款】经典白,好评,一般，充电不快 ,-,-,2021-06-23
1480,小**5,颜色分类: 【22.5W超级快充款★新升级】经典白,好评,容量很大，很沉，不戳,-,-,2021-06-18
1481,t**7,颜色分类: 【18W双向快充款★新升级】经典白色,好评,此用户没有填写评价。,好用 大容量。like。,我想宝贝的好，只有在它身边的那个主人才知道。您说好，才是真的好！您满意，我们就非常开心了，您的支持是我们前进的动力，我们会努力做的更好的，期待您的再次光临！,2021-06-22
1482,q**6,颜色分类: 【18W双向快充款★新升级】经典白,好评,活动买便宜。,-,-,2021-06-17
1483,y**g,颜色分类: 【22.5W超级快充款★新升级】经典白,好评,买回来就试了充电超级快，第二次购买了 ,-,-,2021-06-15
1484,思**2,颜色分类: 【18W双向快充款★新升级】经典白色,好评,充电宝拿回来了，之前我哥给我买过一次罗马仕的充电宝，因为太大了也太重。担心飞机票不让带。就没要。一直用别的牌子。这次没有犹豫直接买了罗马仕的充电宝。很满意没让失望。很好,-,-,2021-05-11
1485,紫**璇,颜色分类: 【22.5W超级快充款★新升级】经典白,好评,挺好的，朋友送过一个，感觉挺好用的，又买了一个 ,-,-,2021-06-16
1486,果**熊,颜色分类: 【22.5W超级快充款★新升级】经典白,好评,送人的，只能评价包装，包的巨**nice ,-,-,2021-06-22
1487,t**2,颜色分类: 【18W双向快充款★新升级】经典白,好评,充电宝搭配快充充电挺快的 不错,-,-,2021-06-13
1488,t**4,颜色分类: 【18W双向快充款★新升级】心形红,好评,充电稳定，质量很好，以后还会买的。,-,-,2021-06-23
1489,一**8,颜色分类: 【22.5W超级快充款★新升级】经典白色,好评,续航还可以啊,-,-,2021-06-16
1490,飘**2,颜色分类: 【10.5W标准款】经典白,好评,物流快，品质一如既往的好,-,-,2021-06-20
1491,t**6,颜色分类: 【18W双向快充款★新升级】心形红,好评,男朋友很喜欢，多次购买了，不错。 ,-,-,2021-06-23
1492,t**2,颜色分类: 【22.5W超级快充款★新升级】经典白色,好评,充电特别慢，一天一夜都充不满，用的也挺快,-,-,2021-06-13
1493,t**7,颜色分类: 【10.5W标准款】经典白,好评,就一个接口…… ,-,-,2021-06-22
1494,l**3,颜色分类: 【22.5W超级快充款★新升级】经典白,好评,挺好的是正品,-,-,2021-06-21
1495,t**2,颜色分类: 【18W双向快充款★新升级】经典白,好评,质量很好，耐用，颜值高，设计也好，总之就是灰常nice ,-,-,2021-06-13
1496,h**人,颜色分类: 【22.5W超级快充款★新升级】经典白,好评,男朋友很喜欢 好评,-,-,2021-06-16
1497,d**g,颜色分类: 【22.5W超级快充款★新升级】经典白色,好评,容量大小：不符合  冲两次都没电了 ,-,-,2021-06-22
1498,r**6,颜色分类: 【22.5W超级快充款★新升级】经典白,好评,可以给手机充两次，确实是快充,-,-,2021-06-21
1499,t**4,颜色分类: 【10.5W标准款】经典白,好评,挺好用的，容量挺大的 ,-,-,2021-06-23
1500,f**7,颜色分类: 【18W双向快充款★新升级】经典白色,好评,虽然大了点，重了点，充电杠杠的，特别是快充，很棒,-,-,2021-06-17
1501,t**8,颜色分类: 【18W双向快充款★新升级】心形红色,好评,值得信赖！,-,-,2021-06-23
1502,t**3,颜色分类: 【18W双向快充款★新升级】心形红色,好评,此用户没有填写评价。,挺好 便宜,往往感动的时刻来自于亲对我们的肯定，常常美好的时刻来自于亲对我们的赞许，我们即使付出再多心血也是值得的，因为您的满意才是我们的最高追求。同时感谢您对罗马仕产品的支持，祝您生活愉快！ ~,2021-06-10
1503,羽**习,颜色分类: 【22.5W超级快充款★新升级】经典白,好评,外观材质：不错，可以 ,-,-,2021-06-16
1504,星**夜,颜色分类: 【22.5W超级快充款★新升级】经典白,好评,这个容量算轻了,-,-,2021-06-14
1505,z**7,颜色分类: 【22.5W超级快充款★新升级】经典白色,好评,之前买过一个，丢了，再买一个，充点宝就认准这个了,-,-,2021-06-17
1506,t**7,颜色分类: 【18W双向快充款★新升级】心形红,好评,此用户没有填写评价。,颜值高。 闪充也非常给力，买了保证想要回购新产品,感谢您的支持与厚爱，若后续使用过程中遇到任何问题，请及时联系旺旺在线客服。罗马仕祝您生活愉快，心情美美哒~,2021-06-22
1507,t**2,颜色分类: 【22.5W超级快充款★新升级】经典白,好评,真的很棒，建议购买 ,-,-,2021-06-13
1508,t**0,颜色分类: 【22.5W超级快充款★新升级】经典白,好评,好像还可以呢,-,-,2021-06-21
1509,t**4,颜色分类: 【22.5W超级快充款★新升级】经典白,好评,好 有分量 充电时间长 给手机充电又快 值得购买 而且物有所值 物流快递 客服都给力,-,-,2021-06-23
1510,t**4,颜色分类: 【22.5W超级快充款★新升级】经典白,好评,物流小哥非常给力，由于我有急事。给物流小哥打电话，他专门跑了一趟。衷心感谢。,-,-,2021-06-23
1511,t**3,颜色分类: 【22.5W超级快充款★新升级】经典白色,好评,此用户没有填写评价。,只能说棒 ，很不错的一次购物体验 。,我的心是一条弯弯曲曲的小溪，千回百转，兜兜转转，最终都将流向你。--罗马仕旗舰店祝您购物愉快~,2021-06-07
1512,t**2,颜色分类: 【22.5W超级快充款★新升级】经典白,好评,充电宝今天收到了 ,-,-,2021-06-13
1513,t**1,颜色分类: 【10.5W标准款】经典白,好评,第二次买，第一个用了2年吧，前两天坏了。 ,-,-,2021-06-24
1514,噔**1,颜色分类: 【18W双向快充款★新升级】心形红,好评,已经是第n次来这买充电宝了，充电线也是在这买，好评！ ,-,-,2021-06-12
1515,t**1,颜色分类: 【22.5W超级快充款★新升级】经典白色,好评,性价比不错，快充不错 ,-,-,2021-06-24
1516,周**2,颜色分类: 【18W双向快充款★新升级】心形红色,好评,可以，耐用，可以充满4－5次吧 ,-,-,2021-06-17
1517,雁**溪,颜色分类: 【18W双向快充款★新升级】经典白,好评,店大欺客的****儿🤙🏻🤙🏻🤙🏻，大家快撤退 ,-,-,2021-06-23
1518,香**0,颜色分类: 【22.5W超级快充款★新升级】经典白,好评,朋友推荐的，先好评了。,-,-,2021-06-17
1519,此**9,颜色分类: 【18W双向快充款★新升级】心形红,好评,太重了 旅游太重了,-,-,2021-06-22
1520,躲**海,颜色分类: 【22.5W超级快充款★新升级】经典白,好评,好重啊，不过质量不错,-,-,2021-06-22
1521,薛**9,颜色分类: 【22.5W超级快充款★新升级】经典白,好评,充电速度很快，值得购买！,-,-,2021-06-13
1522,t**1,颜色分类: 【18W双向快充款★新升级】心形红,好评,物流快，一天就到了，质量也不错，手感也十分舒服,-,-,2021-06-24
1523,t**5,颜色分类: 【22.5W超级快充款★新升级】经典白,好评,买到手才知道快充充电宝没有充电线 欺骗消费者 实在是恶心,-,-,2021-06-10
1524,晴**倾,颜色分类: 【22.5W超级快充款★新升级】经典白色,好评,容量大小：可以充三四次电 ,-,-,2021-06-16
1525,王**喵,颜色分类: 【18W双向快充款★新升级】心形红色,好评,容量大小：容量挺大 ,-,-,2021-06-15
1526,曦**6,颜色分类: 【22.5W超级快充款★新升级】经典白,好评,尺寸大小：挺好的 ,-,-,2021-06-17
1527,长**m,颜色分类: 【22.5W超级快充款★新升级】经典白,好评,好看，好用，推荐,-,-,2021-06-16
1528,猫**5,颜色分类: 【10.5W标准款】经典白,好评,容量很大，很值 ,-,-,2021-06-18
1529,t**0,颜色分类: 【22.5W超级快充款★新升级】经典白,好评,稍微有点重量，还是有点厚,-,-,2021-06-21
1530,浪**外,颜色分类: 【22.5W超级快充款★新升级】经典白色,好评,此用户没有填写评价。,产品非常好，可以充ns，还可以一次性充3部手机,亲，您的满意像夏日甘甜的泉水，浇灌我们的心灵！您的满意是我们的宗旨,2021-05-25
1531,t**6,颜色分类: 【18W双向快充款★新升级】心形红,好评,就那样吧，能快充，就是充电有点麻烦。,-,-,2021-06-23
1532,x**6,颜色分类: 【18W双向快充款★新升级】经典白色,好评,容量大小：还不错 尺寸大小：太大了，如果能小个一半大小就好了 外观材质：纯白色，还可以 ,-,-,2021-05-20
1533,吉**n,颜色分类: 【22.5W超级快充款★新升级】经典白,好评,第二次买了，很实用，就是有点重。,-,-,2021-06-21
1534,t**7,颜色分类: 【18W双向快充款★新升级】经典白,好评,质量不错👍,-,-,2021-06-22
1535,t**6,颜色分类: 【22.5W超级快充款★新升级】经典白,好评,非常棒冲电非常快,-,-,2021-06-23
1536,w**2,颜色分类: 【22.5W超级快充款★新升级】经典白,好评,我的那个有裂痕，我到现在还没有用的,-,-,2021-06-23
1537,小**9,颜色分类: 【22.5W超级快充款★新升级】经典白,好评,已经买过很多次了，质量没的说，前两个被我不小心短路搞坏了，就买了这个快充新款，小米11可以实现快充，指示灯是蓝色的，不错不错，就是下单的保护套还要分着邮过来，不解 ,-,-,2021-06-10
