818,杏**号,颜色分类: 【22.5W超级快充款★新升级】经典白,好评,反向折扣平时84，活动时89,-,-,2021-06-19
819,冫**你,颜色分类: 【22.5W超级快充款★新升级】经典白,好评,最近没出行计划，还没用，到手3格电，确实是快充，不过多少w没显示，是锂离子电池，应该还行 ,-,-,2021-06-21
820,阿**s,颜色分类: 【10.5W标准款】经典白,好评,这个充电宝太精巧便利了，🚉充电很快，💌质量非常好，👟容量大能冲好几次的电，❕出远门必备。容量大，😻不担心手机没电了，🍞方便携带，👱续航时间也很长，🐎容Lucky量大比较厚插口很紧电量很足，🔎用了看可以冲几次，🏢质量特别好。,-,-,2021-05-13
821,放**释,颜色分类: 【22.5W超级快充款★新升级】经典白色,好评,大容量，好用，棒棒哒,-,-,2021-06-24
822,粉**蜜,颜色分类: 【22.5W超级快充款★新升级】经典白,好评,还不错，刚充了一次，用了一次，很好。,-,-,2021-06-22
823,t**0,颜色分类: 【18W双向快充款★新升级】心形红,好评,非常不错推荐购买的,-,-,2021-06-21
824,s**8,颜色分类: 【22.5W超级快充款★新升级】经典白,好评,买回来没怎么用，充满电要挺久的，充满一次可以给手机充三次电，质量还不清楚怎么样，现在还算正常。,-,-,2021-06-23
825,t**9,颜色分类: 【22.5W超级快充款★新升级】经典白,好评,朋友推荐来的，应该不错,-,-,2021-06-17
826,t**8,颜色分类: 【22.5W超级快充款★新升级】经典白,好评,总而言还不错，就是开关有点小问题,-,-,2021-06-23
827,t**0,颜色分类: 【22.5W超级快充款★新升级】经典白,好评,很持久而且白色很酷,-,-,2021-06-21
828,紫**0,颜色分类: 【18W双向快充款★新升级】经典白,好评,一个充电宝可以用三天 续航能力超级强！砖头就是粗暴的好用😂 ,-,-,2021-06-14
829,高**号,颜色分类: 【22.5W超级快充款★新升级】经典白,好评,收到货的人说很好，大气，上挡次，全5分好评。物流快，满意的一次购物。,-,-,2021-06-21
830,t**8,颜色分类: 【22.5W超级快充款★新升级】经典白,好评,特别好呀，充电没问题，我手机充满结果充电宝一格电都没用完，重量也是可以接受的,-,-,2021-06-23
831,t**1,颜色分类: 【22.5W超级快充款★新升级】经典白,好评,绝绝子，手感很好。而且充电很快，质量更别说，第一次买的那个用了一年都没坏，还是很奈斯，相信这个也能用好久 ,-,-,2021-06-24
832,t**9,颜色分类: 【22.5W超级快充款★新升级】经典白,好评,充满一次，大约手机能充6次电，还可以吧,-,-,2021-06-17
833,红**5,颜色分类: 【10.5W标准款】经典白,好评,开始充满电用了26个小时，试了一下还不错！,-,-,2021-06-24
834,h**6,颜色分类: 【22.5W超级快充款★新升级】经典白,好评,便宜质量好,-,-,2021-06-19
835,允**班,颜色分类: 【22.5W超级快充款★新升级】经典白,好评,一般，充电不是很快,-,-,2021-06-24
836,c**7,颜色分类: 【22.5W超级快充款★新升级】经典白,好评,充电宝收到了，发货很快，还没有开始用，等用了之后再来评价 ,-,-,2021-06-22
837,蘸**瓜,颜色分类: 【22.5W超级快充款★新升级】经典白,好评,这个充电宝真是废的一笔 根本充不了Switch 还让我买他的线 我20多块钱的都能充 客服还找各种理由让我找任天堂 外壳上的支持功率全是虚标 这下记住了罗马仕 一次用 终身黑,-,-,2021-06-18
838,t**1,颜色分类: 【22.5W超级快充款★新升级】经典白,好评,非常不错，建议购买！ ,-,-,2021-06-24
839,t**5,颜色分类: 【10.5W标准款】经典白,好评,充电宝还是比较有分量的，电量完全不需要担心，只是充电有点慢。,-,-,2021-06-10
840,残**梦,颜色分类: 【22.5W超级快充款★新升级】经典白,好评,挺不错的，充电挺快的，手机也能充三次左右。,-,-,2021-06-23
841,t**0,颜色分类: 【22.5W超级快充款★新升级】经典白,好评,刚刚拿到货，包装可以，质量还没用不知道哎，充电的线太短了，不好充电，寝室的插头有点儿高😂 ,-,-,2021-06-21
842,童**实,颜色分类: 【22.5W超级快充款★新升级】经典白,好评,很好用，冲的也好快。就是，除了沉一切都好类型。 ,-,-,2021-06-23
843,t**2,颜色分类: 【18W双向快充款★新升级】经典白,好评,物流挺快，充电宝挺大的容量,-,-,2021-06-13
844,火**1,颜色分类: 【22.5W超级快充款★新升级】经典白,好评,非常的帮非常好用点个赞👍非常方便我很喜欢,-,-,2021-06-24
845,t**3,颜色分类: 【18W双向快充款★新升级】心形红,好评,真的有两万毫安，充一次用的时间很长,-,-,2021-06-23
846,h**2,颜色分类: 【22.5W超级快充款★新升级】经典白,好评,物有所值、值得信赖 ！ ,-,-,2021-06-14
847,c**3,颜色分类: 【22.5W超级快充款★新升级】经典白,好评,不错的，到手后试用了几天才来的，充电啥都都不错,-,-,2021-06-20
848,t**2,颜色分类: 【22.5W超级快充款★新升级】经典白,好评,还不错包装也很好,-,-,2021-06-13
849,高**1,颜色分类: 【22.5W超级快充款★新升级】经典白色,好评,非常好俩手机充电可以用两天半,-,-,2021-06-20
850,黛**墨,颜色分类: 【22.5W超级快充款★新升级】经典白色,好评,二次回购，量大够用,-,-,2021-06-19
851,m**1,颜色分类: 【22.5W超级快充款★新升级】经典白,好评,卖家发货快物流给力 超大一个充电很快有提示灯 满意满意满意推荐 ,-,-,2021-06-19
852,给**理,颜色分类: 【22.5W超级快充款★新升级】经典白色,好评,宝贝收到了，很不错，质量很好，快递很给力,充电宝充不进电,相逢即是缘，感谢您在茫茫网络中选中了我们，同时也非常抱歉没能给您带来满意的购物体验，小罗这就为您解答问题：充电宝无法充进电可能是电芯休眠导致，建议您可以更换充电线以及使用5V2A适配器再尝试一下呢，或者将充电宝连接至电脑USB接口充电4-5小时；如还是不行，可以联系我们在线客服及时为您处理。小罗希望您能天天开心，事事顺利~,2021-06-23
853,t**1,颜色分类: 【18W双向快充款★新升级】经典白,好评,"依旧经典,不错不错 ",-,-,2021-06-24
854,t**1,颜色分类: 【22.5W超级快充款★新升级】经典白,好评,还不错，电池耐用,-,-,2021-06-24
855,t**9,颜色分类: 【22.5W超级快充款★新升级】经典白,好评,东西还不错，我很喜欢，以后会再来的,-,-,2021-06-17
856,黄**3,颜色分类: 【22.5W超级快充款★新升级】经典白,好评,刚开始用感觉很好的，重重的,-,-,2021-06-23
857,t**4,颜色分类: 【18W双向快充款★新升级】心形红色,好评,不错不错，好看也好用,-,-,2021-06-23
858,韩**崎,颜色分类: 【10.5W标准款】经典白,好评,一直喜欢的牌子   非常好 终于满血复活 ,-,-,2021-06-22
859,t**8,颜色分类: 【22.5W超级快充款★新升级】经典白,好评,正在用。首先充电的话，根本充不了三个手机，两个出头极限了;充电有问题，部分型号的插头和数据线充不进电，其他的问题我发现了再告诉你们，但是总之这个东西，不是很行👐。,-,-,2021-06-23
860,兄**颜,颜色分类: 【18W双向快充款★新升级】经典白色,好评,容量大小：大小合适 ,-,-,2021-06-22
861,t**9,颜色分类: 【18W双向快充款★新升级】心形红色,好评,非常好 性价比之王,去**的 骗啊爷说好评返现 结果没有 *浪费我时间,-,2021-06-17
862,t**6,颜色分类: 【18W双向快充款★新升级】心形红,好评,挺不错的，建议购买,-,-,2021-06-23
863,t**2,颜色分类: 【18W双向快充款★新升级】心形红,好评,既好看又实用！ ,-,-,2021-06-13
864,炎**脱,颜色分类: 【22.5W超级快充款★新升级】经典白,好评,掌柜发货速度非常快，隔天就到了，充电宝分量很足，一直都挺喜欢用这个牌子，车充也是买的这个牌子，充电速度非常快，总体感觉性价比很高。 ,-,-,2021-06-10
865,b**0,颜色分类: 【18W双向快充款★新升级】心形红,好评,充电宝很奥力给,-,-,2021-06-21
866,m**5,颜色分类: 【22.5W超级快充款★新升级】经典白,好评,续航强劲,-,-,2021-06-21
867,t**5,颜色分类: 【10.5W标准款】经典白,好评,回来包装的很好，物流也很快，充电速度也快，很不错 ,-,-,2021-06-10
868,t**6,颜色分类: 【18W双向快充款★新升级】心形红,好评,包装的十分“走心” ,-,-,2021-06-23
869,桐**z,颜色分类: 【22.5W超级快充款★新升级】经典白,好评,东西能用，只是有点小问题不影响使用，角有点磕碰，按键有点凹陷,-,-,2021-06-19
870,c**1,颜色分类: 【22.5W超级快充款★新升级】经典白,好评,还可以吧，但是我的手机充电，能充3—4次，我买之前以为最少充4次呢。充电速度是快充，这个挺给力的,-,-,2021-06-22
871,菇**x,颜色分类: 【18W双向快充款★新升级】心形红色,好评,耐用，能充12次,-,-,2021-06-18
872,t**4,颜色分类: 【22.5W超级快充款★新升级】经典白,好评,一直相信的牌子，物流也非常的快,-,-,2021-06-23
873,你**平,颜色分类: 【22.5W超级快充款★新升级】经典白,好评,很棒.男朋友推荐的 ,-,-,2021-06-24
874,t**5,颜色分类: 【18W双向快充款★新升级】心形红,好评,说给代快充线结果给了我个啥玩意呀,-,-,2021-06-10
875,p**磊,颜色分类: 【22.5W超级快充款★新升级】经典白,好评,劝各位慎重下单，买了没几天充不上电了，太垃圾了，也不能退换，容量大快递不收 ,大牌子也不行，也是一坨💩,亲爱哒，对于此次购物没有给到您愉快的体验深感歉意，我们是罗马仕官方旗舰店，所有商品均为全新未拆封正品，可根据正规三包政策享受7天无理由退换、一个月内质量问题包退换、1年保修（人为不在保修服务范围）售后如有任何问题请联系我们或致电我们的售后 4006-51-7000 电话哦，我们将积极妥善地为您解决。祝您生活愉快，越来越美丽！,2021-06-23
876,6**4,颜色分类: 【22.5W超级快充款★新升级】经典白,好评,充电宝很有重量感，容量也很大，充电孔很多，我充三次手机才掉一格，还有送条数据线，包装也很严实，真的很好👍,-,-,2021-06-11
877,t**1,颜色分类: 【22.5W超级快充款★新升级】经典白,好评,很满意，也很合适，很实用很方便。,-,-,2021-06-24
878,t**7,颜色分类: 【18W双向快充款★新升级】经典白色,好评,耐用，外观简约好看。买过45个罗马仕充电宝了，好用yyds ,-,-,2021-06-22
879,q**5,颜色分类: 【22.5W超级快充款★新升级】经典白,好评,质量还是很不错的,-,-,2021-06-20
880,k**贝,颜色分类: 【22.5W超级快充款★新升级】经典白,好评,好大，好重，不方便，买回来还没用,-,-,2021-06-24
881,w**8,颜色分类: 【22.5W超级快充款★新升级】经典白色,好评,大容量充的快,-,-,2021-06-19
882,夏**涛,颜色分类: 【22.5W超级快充款★新升级】经典白色,好评,好用，以前买过一个，感觉不错才又买的,-,-,2021-06-21
883,亲**比,颜色分类: 【18W双向快充款★新升级】经典白,好评,宝贝颜值很高哦，很喜欢呢 ,-,-,2021-06-20
884,t**1,颜色分类: 【18W双向快充款★新升级】经典白,好评,容量大小：还行 ,-,-,2021-06-24
885,t**8,颜色分类: 【18W双向快充款★新升级】经典白,好评,大品牌，值得信赖，性价比很高，值得购买！,-,-,2021-06-23
886,生**聪,颜色分类: 【22.5W超级快充款★新升级】经典白,好评,真垃圾，寄过来就是坏的,-,-,2021-06-23
887,南**e,颜色分类: 【18W双向快充款★新升级】心形红,好评,2w大容量充电宝，很好 ,-,-,2021-06-21
888,浅**°,颜色分类: 【22.5W超级快充款★新升级】经典白,好评,真的容量很大,-,-,2021-06-20
889,丢**啊,颜色分类: 【18W双向快充款★新升级】经典白,好评,我买了好几个，都被掳走了，再买一个，好用 ,-,-,2021-06-20
890,素**白,颜色分类: 【18W双向快充款★新升级】心形红色,好评,充电挺快的，续航得用一段时间才知道，罗马仕的充电宝真滴不错,-,-,2021-06-14
891,t**2,颜色分类: 【22.5W超级快充款★新升级】经典白,好评,不知道那些有问题的是怎么回事，我买的这个就没出现那些问题。出于担心我还延迟几天看了看，用了用，没发现问题。,-,-,2021-06-13
892,t**1,颜色分类: 【22.5W超级快充款★新升级】经典白色,好评,容量大小：容量很大用着可以一直买罗马仕的充电宝挺好的 ,-,-,2021-06-24
893,灰**曲,颜色分类: 【22.5W超级快充款★新升级】经典白,好评,在外地，放在菜鸟驿站几天了。今天才到家拿到货，好好好。 ,-,-,2021-06-20
894,1**j,颜色分类: 【18W双向快充款★新升级】经典白色,好评,此用户没有填写评价。,有过一段时间很不错，可以买,云在青天水在瓶，多夸两句行不行？,2021-04-12
895,t**9,颜色分类: 【22.5W超级快充款★新升级】经典白色,好评,此用户没有填写评价。,这个充电宝充电太慢了，一点不用，三个下午还没充满，火大了，这个怎么带出门用，充的慢用的快的节奏，不推荐买,感谢亲爱哒购买本店的产品哦，关于您反馈充电宝充电慢，建议您更换充电宝协议9V2A适配器搭配原装充电线连接快充接口充电哟，若有什么问题可以随时联系我们在线客服人员为您服务，给您带来的不便我们深表歉意！谢谢亲的支持和理解！,2021-06-17
896,w**2,颜色分类: 【18W双向快充款★新升级】经典白,好评,发货速度很快，隔天就收到了，快充效果也不错，赞一个,-,-,2021-06-21
897,t**4,颜色分类: 【18W双向快充款★新升级】经典白色,好评,用了好久了特别好，电也耐冲.,很好的一家店铺，客服也很好说话.,收到亲满意的话语，心中难免激动，让我赠您一枝梦中的百合，它是吉祥的花，寄托着美好的希望！愿您我亲爱的朋友天天开心，美梦成真，感谢您的光临~罗马仕祝您生活愉快！,2021-06-23
898,c**t,颜色分类: 【22.5W超级快充款★新升级】经典白,好评,孩子喜欢就好 ,-,-,2021-06-24
899,雪**霞,颜色分类: 【18W双向快充款★新升级】心形红,好评,感觉实际没有2w，我一边打游戏一边充电，没多久，就没了。感觉罗马仕越来越不行了啊，不过便宜是真的便宜。充电的口设计还不错，不管什么插口都有。 ,-,-,2021-06-19
900,t**7,颜色分类: 【22.5W超级快充款★新升级】经典白,好评,充不了电，不支持退换，比起其他品牌太差,-,-,2021-06-22
901,t**7,颜色分类: 【22.5W超级快充款★新升级】经典白,好评,暂时用的还好。,-,-,2021-06-22
902,微**7,颜色分类: 【22.5W超级快充款★新升级】经典白,好评,目前还好，好大，好用，充了两次了，还满格,-,-,2021-06-22
903,w**c,颜色分类: 【22.5W超级快充款★新升级】经典白,好评,商家服务态度恶劣，产品质量差，合作的物流服务态度也差，没体验过这么差的购物经历，请大家谨慎购买甚至不购买此店铺产品，钱不是问题，服务态度决定一切 ,-,-,2021-06-24
904,祈**爱,颜色分类: 【18W双向快充款★新升级】经典白,好评,罗马仕的老顾客了，每个都能用很久，希望这个快充也一样～,-,-,2021-06-14
905,j**4,颜色分类: 【18W双向快充款★新升级】经典白,好评,电源键快速按两下指示灯一个一个连续的跳动是什么意思？,-,-,2021-06-23
906,第**m,颜色分类: 【22.5W超级快充款★新升级】经典白,好评,又划算又好用，喜欢,物流很快哦，已经买了好几个了,情不知所起，一往情深；也许就在于您毫不犹豫选择我们来陪伴您日后生活的时候开始吧，愿我们可以陪您看尽这世间的繁华盛世~,2021-06-13
907,浅**7,颜色分类: 【18W双向快充款★新升级】心形红,好评,儿子说的还不错 ,-,-,2021-06-22
908,醉**露,颜色分类: 【22.5W超级快充款★新升级】经典白,好评,充电宝已收到，第一次买这个牌子的，看包装就给人感觉还不错，现在正给他充电，好不好用暂时还不知道，先就说到这里吧！ ,-,-,2021-06-07
909,z**g,颜色分类: 【22.5W超级快充款★新升级】经典白,好评,罗马仕 一直信赖 这是买了第三个了,-,-,2021-06-19
910,a**0,颜色分类: 【22.5W超级快充款★新升级】经典白色,好评,"怎么说呢？快递地址是寄回家的,原本打算6月1号休假回去拿来用的,因为疫情的原因,现在都还没回家拿到,质量等问题,就不确定了,等迟些回到家拿到了。如果有质量问题,再来追评,如果没有追评,就说明质量还可以或很好。 ",-,-,2021-06-15
911,愤**i,颜色分类: 【22.5W超级快充款★新升级】经典白,好评,还行挺好用的  ,-,-,2021-06-23
912,t**1,颜色分类: 【18W双向快充款★新升级】心形红,好评,好看轻薄 ,-,-,2021-06-24
913,t**3,颜色分类: 【18W双向快充款★新升级】心形红,好评,容量很大 ,-,-,2021-06-24
914,1**d,颜色分类: 【18W双向快充款★新升级】经典白色,好评,此用户没有填写评价。,不错的一次购物，还是会光顾,尊敬的顾客您好，感谢您对罗马仕的支持与肯定。您的满意是对我们最大的支持与鼓励，也将是我们不断前进的动力。期待下次给您带来更优质的购物体验,2021-05-03
915,临**8,颜色分类: 【18W双向快充款★新升级】经典白,好评,此用户没有填写评价。,用了没两次，容量急剧下降，充电很慢。劣质产品，对不住罗马仕的牌子，差评！！,亲，非常抱歉给您带来了不好的购物心情~~如果产品出现质量问题，可随时联系我们售后客服及时为您处理喔，感谢您对小罗家的支持。,2021-02-19
916,m**f,颜色分类: 【18W双向快充款★新升级】经典白,好评,描述很好，希望好用，目前还没用,-,-,2021-06-20
917,艾**3,颜色分类: 【18W双向快充款★新升级】经典白,好评,已经用上了，很好用，就是有点重 ,-,-,2021-06-20
918,t**7,颜色分类: 【18W双向快充款★新升级】心形红,好评,刚拿到快递 快递速度跟快 但是充电宝也太大了吧！超级大！也很重，还有一根线 关键是充电宝太重太大了容量应该是挺大的 ,-,-,2021-06-22
919,往**0,颜色分类: 【22.5W超级快充款★新升级】经典白,好评,快退款，5月25号下单，到现在都没结果，见鬼了,-,-,2021-06-24
920,枫**落,颜色分类: 【22.5W超级快充款★新升级】经典白,好评,经常买她家的充电宝，之前买的用了大学3年坏了，现在这个也是一如既往的好用，坐几天的长途火车下来还剩一格电，中间还用来充过平板，不错不错 ,-,-,2021-06-12
921,绘**8,颜色分类: 【22.5W超级快充款★新升级】经典白,好评,物美价廉，我的包都快容不下充电宝了 ,-,-,2021-06-23
922,t**3,颜色分类: 【18W双向快充款★新升级】经典白,好评,一次充满电能给手机充三四次 ,-,-,2021-06-24
923,t**6,颜色分类: 【22.5W超级快充款★新升级】经典白,好评,没看到实物，别人帮忙收货的,-,-,2021-06-23
924,k**g,颜色分类: 【10.5W标准款】经典白,好评,"物有所值,包装严实，应该是正品，性价比不错。",-,-,2021-06-14
925,大**凉,颜色分类: 【22.5W超级快充款★新升级】经典白,好评,拿到给手机充了一次电，充电速度很快，罗马仕值得信赖，认准这个牌子了 ,-,-,2021-06-18
926,骏**q,颜色分类: 【22.5W超级快充款★新升级】经典白,好评,容量很大 很好用 有点重(毕竟2w毫安) 但是充电的时候会有滋滋声(怎么解）,-,-,2021-06-15
927,萍**5,颜色分类: 【22.5W超级快充款★新升级】经典白,好评,其他都还好，就是很重有点大 ,-,-,2021-06-24
928,杨**1,颜色分类: 【18W双向快充款★新升级】心形红,好评,很不错的卖家，很有耐心~东东也超好呢~,-,-,2021-06-19
929,x**1,颜色分类: 【18W双向快充款★新升级】心形红,好评,收到，挺好的，充电也快 满意 ,-,-,2021-06-16
930,t**7,颜色分类: 【18W双向快充款★新升级】经典白,好评,外观好看，充电高效，方便实用。,-,-,2021-06-22
931,j**3,颜色分类: 【22.5W超级快充款★新升级】经典白,好评,价格便宜又好用,-,-,2021-06-20
932,侯**1,颜色分类: 【22.5W超级快充款★新升级】经典白,好评,非常好用，质量不错，容量大，值得购买 ,-,-,2021-06-23
933,胡**啊,颜色分类: 【10.5W标准款】经典白,好评,不是很好给手机充电冲了一晚上没冲满,千万别买太坑人了买之前啥都好说买完之后就爱搭不理的钱花了就行了后面的就不管了啥玩意啊电还充不进去充一晚上电都充不满手机还让你拍充不进去电的视频我拿什么给你拍啊,相逢即是缘，感谢您在茫茫网络中选中了我们，同时也非常抱歉没能给您带来满意的购物体验，小罗这就为您解答问题：充电宝无法充进电可能是电芯休眠导致，建议您可以更换充电线以及使用5V2A适配器再尝试一下呢，或者将充电宝连接至电脑USB接口充电4-5小时；如还是不行，可以联系我们在线客服及时为您处理。小罗希望您能天天开心，事事顺利~,2021-06-23
934,t**9,颜色分类: 【22.5W超级快充款★新升级】经典白,好评,巴适得很,-,-,2021-06-17
935,嫣**港,颜色分类: 【22.5W超级快充款★新升级】经典白,好评,令人忧心,-,-,2021-06-13
936,t**8,颜色分类: 【22.5W超级快充款★新升级】经典白,好评,顶天一年,-,-,2021-06-23
937,s**g,颜色分类: 【22.5W超级快充款★新升级】经典白,好评,不错，做工再精细点就更好了，这个品牌还是值得信赖的 ,-,-,2021-06-18
938,h**b,颜色分类: 【22.5W超级快充款★新升级】经典白,好评,挺好的，上一个买的也是罗马仕，就这个牌子了，发货还特别快 ,-,-,2021-06-21
939,r**7,颜色分类: 【22.5W超级快充款★新升级】经典白,好评,性价比很高！ ,-,-,2021-06-23
940,爱**性,颜色分类: 【22.5W超级快充款★新升级】经典白,好评,很好，充电也很快，挺重的，可以放心购买，,-,-,2021-06-24
941,t**2,颜色分类: 【22.5W超级快充款★新升级】经典白,好评,东西很喜欢,-,-,2021-06-13
942,t**5,颜色分类: 【22.5W超级快充款★新升级】经典白色,好评,容量大小：这么大个充电宝，容量肯定是够的应该也不会有虚电， 尺寸大小：尺寸比手机大点，拿起来像一个砖头一样。 外观材质：白色磨砂材质，不容易刮花，外形简介好看。而且还支持快充功能充电速度很快。外出也不用再担心手机没电了。 ,-,-,2021-06-10
943,黄**婷,颜色分类: 【22.5W超级快充款★新升级】经典白,好评,可以冲三次苹果11pro吧，容量不算大，而且很重 ,-,-,2021-06-22
944,我**着,颜色分类: 【18W双向快充款★新升级】经典白,好评,很快就拿到货了！多次回购 ,-,-,2021-06-20
945,成**2,颜色分类: 【22.5W超级快充款★新升级】经典白,好评,质量确实很好，就是太大了，跟快砖一样重。出乎意料！ ,-,-,2021-06-22
946,m**9,颜色分类: 【18W双向快充款★新升级】经典白,好评,挺好的，充满苹果xr四次，做工也不错，我已经是我用第六个罗马仕充电宝了，赞,-,-,2021-06-17
947,学**、,颜色分类: 【22.5W超级快充款★新升级】经典白,好评,不错不错，非常满意的一次购物。,-,-,2021-06-20
948,j**g,颜色分类: 【22.5W超级快充款★新升级】经典白,好评,第二次购买，很强大耐用,-,-,2021-06-23
949,t**0,颜色分类: 【18W双向快充款★新升级】经典白,好评,真的还是那么大，买了罗马仕3个充电宝了，家里人也买了好几个，真的希望有小巧容量大的😭😭😭 ,-,-,2021-06-21
950,适**6,颜色分类: 【22.5W超级快充款★新升级】经典白,好评,已经买第二个了 特别好用。,-,-,2021-06-22
951,w**4,颜色分类: 【18W双向快充款★新升级】心形红,好评,非常棒的充电宝，已经购买多次了，物流很快，与店家描述的一样 ,-,-,2021-06-23
952,小**午,颜色分类: 【10.5W标准款】经典白,好评,很耐电，也很难充满，哈哈哈哈，还不错,-,-,2021-06-22
953,t**6,颜色分类: 【22.5W超级快充款★新升级】经典白色,好评,外观材质：特别精致 特别好.建议购买.  ,-,-,2021-06-23
954,t**6,颜色分类: 【18W双向快充款★新升级】经典白,好评,此用户没有填写评价。,感觉挺好的，容量很大，充满应该能给我手机冲个两次多，室友是他们家的1w，个人喜欢大一点。,亲每次的好评让我们万分的期待，亲的好评就是对我们最大的鼓励，是我们向前看的最大动力。,2021-06-23
955,绿**姐,颜色分类: 【18W双向快充款★新升级】经典白,好评,蛮重的，还行 ,-,-,2021-06-23
