1387,t**6,颜色分类: 原装正品-2200W-胶原蛋白-9000万负离子,好评,噪音有些大，其他还行。,客服不错，以前在淘宝买东西都是系统自动好评，花了好多好多钱，后来才知道淘宝评论得积分可以涨淘气值，才知道评论的重要性,-,2021-05-28
1388,毋**8,颜色分类: 原装正品-2200W-胶原蛋白-9000万负离子,好评,试用了三天，感觉挺不错的，吹出来的风香香的，味道可以接受，声音也不大，真不错，这次算是没买错，哈哈 ,颜值真的非常高，买之前真的是看了很多家，不知道买哪个，最终选择这家的宝贝，特意用了几天后才来评价的，真的很不错，香香的，哈哈,-,2021-06-13
1389,陈**6,颜色分类: 原装正品-2200W-胶原蛋白-9000万负离子,好评,很好用 ,-,-,2021-06-09
1390,疯**b,颜色分类: 原装正品-2200W-胶原蛋白-9000万负离钛灰蓝,好评,吹起来香气飘飘，就是不知道负离子是不是真的,服务态度很不错，以前在淘宝买东西都是系统自动好评，花了好多好多钱，后来才知道淘宝评论得积分可以涨淘气值，才知道评论的重要性,-,2021-06-16
1391,h**6,颜色分类: 原装正品-2200W-胶原蛋白-9000万负离钛灰蓝,好评,好,-,-,2021-06-09
1392,彤**家,颜色分类: 原装正品-2200W-胶原蛋白-9000万负离钛灰蓝,好评,吹风机收到了，效果很好，风力大吹干很快，造型效果棒棒的，而且还有护发的效果，头发吹完顺滑，不毛躁，不会伤头发，使用起来也不错，质量很好哦，拿到手很喜欢，多个档位调节，有蓝光还有香味，颜值超高，价格合适实惠，爱了 ,太喜欢了💕多档调节很方便，吹的很快就干了，最重要的是还有负离子✨✨护发功效很满意，吹干后不伤发🥰头发顺滑，声音很小💓再购买个给家里。真心好用☑️,-,2021-06-18
1393,z**9,颜色分类: 原装正品-2200W-胶原蛋白-9000万负离钛灰蓝,好评,很好,-,-,2021-06-01
1394,r**魂,颜色分类: 原装正品-2200W-胶原蛋白-9000万负离子,好评,"风力大，好用，白色的看着干净，简单大气有档次，吹风机手感舒适吹的快速‘颜值高! 风力非常大，没一会就可以吹干头发，冷热交替,调节方便，负离子护发的，头发吹后比之前的柔顺，摸着也很柔，很舒服，吹出来的风还带有一点点香味，还配套两个风口，做发型用的，物美价廉!特别喜欢!会回购的 ",-,-,2021-06-03
1395,刘**5,颜色分类: 原装正品-2200W-胶原蛋白-9000万负离子,好评,还可以 ,-,-,2021-06-15
1396,t**1,颜色分类: 原装正品-2200W-胶原蛋白-9000万负离子,好评,吹风机收到了，这颜值真的爱了，看起来美观，简约，用起来效果不错，负离子的，也不损伤发质，吹风机温度吹到头上很舒服，风力够大，没一会头发就干了，非常好用，并且拿着也很舒服，体积，设计感都非常好，并且吹出来的风很自然， 款式时尚，大方，功率超大，出风超快，护发效果好，吹后发丝更柔顺，更光泽，值得购买！ ,颜色是我喜欢的💗，质量很好，家人也都很喜欢，😋，风力很大，一下子就吹干，吹干的头发也很柔顺，负离子真的太好用了😍 真的很喜欢呢,-,2021-05-14
1397,t**3,颜色分类: 原装正品-2200W-胶原蛋白-9000万负离子,好评,吹风机温度吹到头上很舒服，😎 风力大，不一会头发就干了，非常好用👍 ，并且拿着也很舒服，款式设计很好，很有手感，并且吹出来的风很自然，还带有一点香味😍 ，设计很时尚大方，蓝光很炫酷😚 ，负离子功能强大，使用几次头发比之前好，更柔顺更有光泽，✌ 质量好大品牌，电线特别粗，做工特别精细，值得购买！👌 ,比普通吹风机风量大速度快，😃温度恒温，风速均匀，😛还有负离子护发所以吹出的头发也就感觉顺滑，光泽度好，不怕伤发了。😁😁,-,2021-06-08
1398,t**9,颜色分类: 原装正品-2200W-胶原蛋白-9000万负离子,好评,还可以,-,-,2021-06-20
1399,淘**9,颜色分类: 原装正品-2200W-胶原蛋白-9000万负离子,好评,"物流快，服务好，🌸 包装很精美,白色和金色很简洁又非常高级,喜欢这个配色,风力非常大，很快就可以吹干，🌺 有蓝光和香气，很高级。吹出来的风香香的很好闻，而且还送了两个造型用的风嘴，🍃 风力很大，多个档位调节的，冷热交替，负离子护发效果也还不错，🌴 使用了几次目前感觉发丝有些柔顺，不毛躁，很好用  ",-,-,2021-06-10
1400,7**痴,颜色分类: 原装正品-2200W-胶原蛋白-9000万负离子,好评,吹风机收到物流很快非常惊喜外观好看，白色的看着很舒服，颜值控☺ 护发效果还不错，使用了几次，头发明显比之前柔顺一些，也不会毛躁有多个档位调节，冷风，恒温，还有热风都有，一年四季都可以使用，风力也是多档位调节的，大风档位风力超级大，没一会就可以吹干。 ,🥇🥇负离子滋养过的头发很柔顺，风力很大，使用了一下很满意，吹干效果超快，🌞没一会就可以干，颜值高、又好用、多档位调节，冷热风，🌱负离子护发功效很赞！,-,2021-06-04
1401,瞌**b,颜色分类: 原装正品-2200W-胶原蛋白-9000万负离子,好评,太差了，买回来第二次使用就开始吱吱作响，听着吱吱的声音就难受，都不敢用了 ,服务很好，以前在淘宝买东西都是系统自动好评，花了好多好多钱，后来才知道淘宝评论得积分可以涨淘气值，才知道评论的重要性,-,2021-06-13
1402,t**9,颜色分类: 原装正品-2200W-胶原蛋白-9000万负离钛灰蓝,好评,好,-,-,2021-06-20
1403,k**4,颜色分类: 原装正品-2200W-胶原蛋白-9000万负离子,好评,好用,-,-,2021-06-19
1404,夕**墓,颜色分类: 原装正品-2200W-胶原蛋白-9000万负离钛灰蓝,好评,风大，但也没夸张到理发店吹风机那么大，噪音相对于来说小咯点，就是不知道为什么吹出来的风有香味儿。好用,服务态度很不错，以前在淘宝买东西都是系统自动好评，花了好多好多钱，后来才知道淘宝评论得积分可以涨淘气值，才知道评论的重要性,-,2021-06-07
1405,t**7,颜色分类: 原装正品-2200W-胶原蛋白-9000万负离子,好评,电吹风邮回来。就马上用了，非常好，比我以前用的吹风要省很多时间，一会就吹干了，大家放心购买，质量也是相当的不错！良心卖家，祝卖家生意兴隆，财源广进！,-,-,2021-06-04
1406,t**9,颜色分类: 原装正品-2200W-胶原蛋白-9000万负离钛灰蓝,好评,好用,-,-,2021-06-20
1407,y**o,颜色分类: 原装正品-2200W-胶原蛋白-9000万负离钛灰蓝,好评,还可以,-,-,2021-06-17
1408,刘**1,颜色分类: 原装正品-2200W-胶原蛋白-9000万负离钛灰蓝,好评,吹风机有噪音，吹得里面一直响声,客服不错以前在淘宝买东西都是系统自动好评，花了好多好多钱，后来才知道淘宝评论得积分可以涨淘气值，才知道评论的重要性,-,2021-06-09
1409,白**0,颜色分类: 原装正品-2200W-胶原蛋白-9000万负离钛灰蓝,好评,满意,-,-,2021-06-01
1410,d**7,颜色分类: 原装正品-2200W-胶原蛋白-9000万负离钛灰蓝,好评,物流很快就收到了，质量很好，使用了几次，挺满意的， 跟理发店差不多，风力很大，👍🏻吹着快，吹发型也好用，送了两个发型辅助造型口，负离子吹风机吹着很舒服，😌吹完头发也很柔顺。 ,-,-,2021-06-14
1411,阿**福,颜色分类: 原装正品-2200W-胶原蛋白-9000万负离子,好评,很高大上的一款吹风机，外观简洁大方！风力够大，😚 跟理发店差不多，吹干效果好，吹风机拿着手感也非常好！主要的是价格性价比很高！很方便，最重要的是，我个人头发很厚，这个风力很大😘  ，没一会就能完全吹干，吹出来的风很舒服，而且对头发也没有伤害。质量信得过👍  。风量和温度都可调节，冷热风都有，吹后头发很柔顺，护发效果很好🌴  ，价格很实惠，是我买到的比较满意的一款了！ ,电风吹用一段时间了，很好用，轻便实用，吹完之后感觉头发更顺，小姐妹们都很喜欢！很喜欢，吹出来的头发很柔顺。价格也很合适，看起来很高大上，风力还可以的，而且分了几个档，风大优势很明显，非常棒的一款吹风机。,-,2021-05-17
1412,c**5,颜色分类: 原装正品-2200W-胶原蛋白-9000万负离子,好评,不错,-,-,2021-06-10
1413,叫**哥,颜色分类: 原装正品-2200W-胶原蛋白-9000万负离子,好评,不错,-,-,2021-06-19
1414,f**y,颜色分类: 原装正品-2200W-胶原蛋白-9000万负离钛灰蓝,好评,吹风机颜值很高 好看 晚上吹了头发 有香味 吹完柔顺 噪音不大 很满意 ,-,-,2021-06-20
1415,t**3,颜色分类: 原装正品-2200W-胶原蛋白-9000万负离子,好评,出貨迅速，實品比預期的大一點，風量很大，吹了頭髮柔亮。除了聲音有點大，其他都很好，手拿不重，非常滿意。 ,以前在淘宝买东西都是系统自动好评，花了好多好多钱，后来才知道淘宝评论得积分可以涨淘气值，才知道评论的重要性！,-,2021-06-13
1416,飞**m,颜色分类: 原装正品-2200W-胶原蛋白-9000万负离钛灰蓝,好评,试用一下 声音还是有点大。,服务态度很不错，以前在淘宝买东西都是系统自动好评，花了好多好多钱，后来才知道淘宝评论得积分可以涨淘气值，才知道评论的重要性,-,2021-06-20
1417,小**1,颜色分类: 原装正品-2200W-胶原蛋白-9000万负离子,好评,吹风机收到了[胜利]中午洗完头发用着吹风机风力🌀挺大的，头发吹干很快 ，吹完头发很顺滑 一点都不毛躁 ，感觉比其他品牌好用多了，价格也不贵，很满意[呲牙] ,超级喜欢这款吹风机，白色的好好看，很高级、有质感，很喜欢这个颜色。风大很给力，声音小，吹完头发很顺，护发效果非常好，发丝更光滑，价格也挺优惠的，满意推荐下,-,2021-05-29
1418,乔**猫,颜色分类: 原装正品-2200W-胶原蛋白-9000万负离子,好评,风力很大，之前的头发要吹10多分钟才干，这个不到十分钟就干了，我都没开最大风。是我会回购的单品🥰🥰🥰🥰🥰,服务态度很不错，以前在淘宝买东西都是系统自动好评，花了好多好多钱，后来才知道淘宝评论得积分可以涨淘气值，才知道评论的重要性,-,2021-06-08
1419,1**p,颜色分类: 原装正品-2200W-胶原蛋白-9000万负离子,好评,挺好,-,-,2021-06-24
1420,秋**人,颜色分类: 原装正品-2200W-胶原蛋白-9000万负离子,好评,风力还可以，噪音不小,服务很好，以前在淘宝买东西都是系统自动好评，花了好多好多钱，后来才知道淘宝评论得积分可以涨淘气值，才知道评论的重要性,-,2021-06-18
1421,初**3,颜色分类: 原装正品-2200W-胶原蛋白-9000万负离子,好评,收到货了，质量很好，很满意，物流也很快。,宝贝收到了，很惊喜，发货速度很快，东西包装的很好，价格优惠，质量非常好 今天拿回家用了用，风力很大，物超所值，很满意的一次购物店家值得信赖,-,2021-06-17
1422,有**亮,颜色分类: 原装正品-2200W-胶原蛋白-9000万负离钛灰蓝,好评,好用,-,-,2021-06-08
1423,a**4,颜色分类: 原装正品-2200W-胶原蛋白-9000万负离子,好评,还可以,-,-,2021-06-01
1424,f**s,颜色分类: 原装正品-2200W-胶原蛋白-9000万负离子,好评,白金很好看也很时尚，拿出来就有一阵香味，味道还不错（介意味道的姐妹也可以购买哦，香味大概一次使用后就很淡了），风力很大，声音不刺耳，很不错的购物体验,商家服务很好，以前在淘宝买东西都是系统自动好评，花了好多好多钱，后来才知道淘宝评论得积分可以涨淘气值，才知道评论的重要性,-,2021-06-01
1425,星**7,颜色分类: 原装正品-2200W-胶原蛋白-9000万负离子,好评,吹风机很好看，很精致，大小合适，感觉挺护发的，吹后头发挺柔软的，两个孩子也都挺喜欢的，客服态度很好，点赞 ,-,-,2021-06-16
1426,糖**y,颜色分类: 原装正品-2200W-胶原蛋白-9000万负离子,好评,收到货了，就迫不及待的打开了，很美观，外包装也很好，大气，风力够大，风筒还能散发一种很香的味道，使用起来特别方便，吹出来的头发后很柔和，冷热自行调节，风力大，档位也可以调很不错的一款吹风机。最核心的是它的负离子效果，使用效果超级好，吹出来发丝都非常柔顺，有光泽。 ,-,-,2021-05-14
1427,溺**3,颜色分类: 原装正品-2200W-胶原蛋白-9000万负离钛灰蓝,好评,"质量非常好，与卖家描述的完全一致，非常满意,真的很喜欢，完全超出期望值，发货速度非常快，包装非常仔细、严实，很满意的一次购物质量很好，祝生意兴隆！！",-,-,2021-06-04
1428,董**2,颜色分类: 原装正品-2200W-胶原蛋白-9000万负离钛灰蓝,好评,很好用,-,-,2021-06-23
1429,小**c,颜色分类: 原装正品-2200W-胶原蛋白-9000万负离子,好评,吹风机真的很完美，设计很贴心，有好几个档位可以调节，很方便的，做工很精细，线是加粗的，风力很大，吹干很快，而且吹出来的头发很柔顺，负离子护发，很好的吹风机，最主要的是这款吹风机声音小，特别好用  ,-,-,2021-06-24
1430,p**y,颜色分类: 原装正品-2200W-胶原蛋白-9000万负离子,好评,好,-,-,2021-05-19
1431,韩**2,颜色分类: 原装正品-2200W-胶原蛋白-9000万负离子,好评,使用了几天，款式很高级，耐看，质感很好，质量很好，做工精美，客服服务也好，还有赠品，多个挡位可以调节，冷风 暖风 热风也可以调节，而且吹出来的风竟然还有点淡淡的香味，负离子护发效果好，吹后头发柔顺，很有光泽，风力够大，吹干也快！晚班回家洗头没一下子就可以吹干，而且声音小，太棒了！满意 ,-,-,2021-06-11
1432,杨**欢,颜色分类: 原装正品-2200W-胶原蛋白-9000万负离子,好评,可以,-,-,2021-06-19
1433,慕**2,颜色分类: 原装正品-2200W-胶原蛋白-9000万负离子,好评,挺好的 ,-,-,2021-05-25
1434,与**陈,颜色分类: 原装正品-2200W-胶原蛋白-9000万负离钛灰蓝,好评,吹风还可以，吹的风香香的，风力不是很大但是家用足够了，送的直的吹风嘴与吹风接触部分有一点凸起直接把吹风一部分漆给蹭掉了，稍微有点心痛,服务很好，以前在淘宝买东西都是系统自动好评，花了好多好多钱，后来才知道淘宝评论得积分可以涨淘气值，才知道评论的重要性,-,2021-06-20
1435,大**1,颜色分类: 原装正品-2200W-胶原蛋白-9000万负离子,好评,质量非常好，与卖家描述一致，包装很仔细、严实，款式好看，风力也非常大😘 😘 ，速干还护发，吹头发没一会就可以吹干😍😍 负离子护发效果很好，使用了几次，发丝比以前柔顺许多了 😚 滑滑揉揉的很舒服，总的来说这次是很满意的一次购物 ,很高兴买到心仪的吹风机✅使用了一段时间后来追评一下😉吹风机的效果也是对于这价钱的来说绝对是超值，比之前用过的吹风机声音小很多，护发效果也是非常棒👍的。吹出来很舒服，发丝也柔顺,-,2021-05-26
1436,我**8,颜色分类: 原装正品-2200W-胶原蛋白-9000万负离钛灰蓝,好评,吹风机的质量挺不错的，体积大小挺合适的，出门旅行带着也挺方便的，款式也亮丽，风力大，吹干快，而且吹出来的风大而且柔和，吹着挺舒适，线也挺长的，还送了几个赠品，负离子也挺不错，使用后发丝柔顺了许多，摸起来揉揉，滑滑的，发丝蛮顺，挺好用的。 ,-,-,2021-06-10
1437,x**5,颜色分类: 原装正品-2200W-胶原蛋白-9000万负离钛灰蓝,好评,物流很快，隔天就收到了，电吹风机好用，使用了几次，宝贝外观设计高大上，用起来很方便，使用手感好，可多档调节，负离子护发效果好，吹后头发有光泽，连吹出来的风都是香香的，风量超大，吹干也是超快的，我超级喜欢，性价比很高 ,真是物超所值，吹头发，做造型都非常好用，风力超快，风量十足，一下子就可以吹干头发，吹风机温度吹到头上很舒服，负离子护发效果佳 吹后头发柔顺，很滑,-,2021-05-15
1438,d**4,颜色分类: 原装正品-2200W-胶原蛋白-9000万负离子,好评,感觉一般 家里的坏了 买个顶着用 ,客服不错，以前在淘宝买东西都是系统自动好评，花了好多好多钱，后来才知道淘宝评论得积分可以涨淘气值，才知道评论的重要性,-,2021-06-19
1439,x**1,颜色分类: 原装正品-2200W-胶原蛋白-9000万负离子,好评,吹风机很好用 外观漂亮 还有一股淡淡的香味 吹完头发很顺滑 细节、品质、做工都非常好，发货贼快  快递也给力 棒棒哒~🌸🌸🌸性价比高～ ,-,-,2021-06-11
1440,6**1,颜色分类: 原装正品-2200W-胶原蛋白-9000万负离子,好评,挺好的,-,-,2021-06-05
1441,陈**7,颜色分类: 原装正品-2200W-胶原蛋白-9000万负离钛灰蓝,好评,可以,-,-,2021-06-22
1442,鲤**5,颜色分类: 原装正品-2200W-胶原蛋白-9000万负离子,好评,家里吹风机坏了，就赶紧上网找了一个。拿着手感还行吧，试了一下不是那么静音，就是正常吹风机的声音。风力也还算大吧。然后有很大的香味儿，呛鼻子。就是那种鞋盒里常放的香包味。希望慢慢味道能散掉。整体还可以。 ,商家服务很好，以前在淘宝买东西都是系统自动好评，花了好多好多钱，后来才知道淘宝评论得积分可以涨淘气值，才知道评论的重要性,-,2021-05-30
1443,t**0,颜色分类: 原装正品-2200W-胶原蛋白-9000万负离子,好评,吹风的时候味道香香的，风力没有以为的大，声音在可以接受的范围内。很轻巧。 ,服务态度很不错，以前在淘宝买东西都是系统自动好评，花了好多好多钱，后来才知道淘宝评论得积分可以涨淘气值，才知道评论的重要性,-,2021-06-03
1444,a**a,颜色分类: 原装正品-2200W-胶原蛋白-9000万负离钛灰蓝,好评,好用,-,-,2021-06-24
1445,y**0,颜色分类: 原装正品-2200W-胶原蛋白-9000万负离子,好评,特地用了才来评价，吹完头发润润的，也不会太干燥，声音风大时会大一些，风小时还可以。这款还是挺推荐的，希望耐用一些。 ,服务很好，以前在淘宝买东西都是系统自动好评，花了好多好多钱，后来才知道淘宝评论得积分可以涨淘气值，才知道评论的重要性。,-,2021-05-25
1446,t**3,颜色分类: 原装正品-2200W-胶原蛋白-9000万负离子,好评,还不错 ,-,-,2021-06-06
1447,啰**了,颜色分类: 原装正品-2200W-胶原蛋白-9000万负离子,好评,东西收到了，使用了一次，颜值很高，白色很耐看，吹头发也挺快的，小巧，放在哪里都方便，客服的态度也很好，有问题及时回答，值得推荐！ ,-,-,2021-06-19
1448,阿**u,颜色分类: 原装正品-2200W-胶原蛋白-9000万负离子,好评,吹风机颜值很高，吹风有香香的味道，声音也不是很大，我是中长发，干发速度很快，点赞 ,质量不错，以前在淘宝买东西都是系统自动好评，花了好多好多钱，后来才知道淘宝评论得积分可以涨淘气值，才知道评论的重要性,-,2021-06-16
1449,坟**橙,颜色分类: 原装正品-2200W-胶原蛋白-9000万负离子,好评,可以，挺好的,-,-,2021-06-20
1450,q**蓝,颜色分类: 原装正品-2200W-胶原蛋白-9000万负离钛灰蓝,好评,好评,-,-,2021-06-20
1451,5**g,颜色分类: 原装正品-2200W-胶原蛋白-9000万负离子,好评,挺好,-,-,2021-06-18
1452,辛**d,颜色分类: 原装正品-2200W-胶原蛋白-9000万负离钛灰蓝,好评,很好,-,-,2021-06-22
1453,韦**2,颜色分类: 原装正品-2200W-胶原蛋白-9000万负离钛灰蓝,好评,超级满意，很高大上的一款吹风机，外观简洁大方！风力够大，😚 跟理发店差不多，吹干效果好，吹风机拿着手感也非常好！主要的是价格性价比很高！很方便，最重要的是，我个人头发很厚，这个风力很大😘 ，没一会就能完全吹干，吹出来的风很舒服，而且对头发保护的很好。👍  。风量和温度都可调节，冷热风都有，吹后头发很柔顺，护发效果很好  ,-,-,2021-06-25
1454,共**酒,颜色分类: 原装正品-2200W-胶原蛋白-9000万负离子,好评,外观材质：塑料 白色 不重 护发功效：昨晚第一次用还没看出来 风量大小：适中 较大 不小 ,质量不错，以前在淘宝买东西都是系统自动好评，花了好多好多钱，后来才知道淘宝评论得积分可以涨淘气值，才知道评论的重要性,-,2021-06-19
1455,小**5,颜色分类: 原装正品-2200W-胶原蛋白-9000万负离子,好评,还行哦，风力没有很大，有香味，吹风机很吵，风有点不聚拢的感觉,客服不错以前在淘宝买东西都是系统自动好评，花了好多好多钱，后来才知道淘宝评论得积分可以涨淘气值，才知道评论的重要性,-,2021-06-03
1456,t**0,颜色分类: 原装正品-2200W-胶原蛋白-9000万负离钛灰蓝,好评,好 ,-,-,2021-05-29
1457,t**6,颜色分类: 原装正品-2200W-胶原蛋白-9000万负离子,好评,挺好的,-,-,2021-06-02
1458,经**光,颜色分类: 原装正品-2200W-胶原蛋白-9000万负离钛灰蓝,好评,声音有点大，尾部有点吸头发。颜值还是可以的，最大风量风机有点其它声音也不知道正常不。,服务态度很不错，以前在淘宝买东西都是系统自动好评，花了好多好多钱，后来才知道淘宝评论得积分可以涨淘气值，才知道评论的重要性,-,2021-06-25
1459,t**9,颜色分类: 原装正品-2200W-胶原蛋白-9000万负离钛灰蓝,好评,头发吹了特别直 风大！！！ 不好的就是 前面白色部分 严重发烫 甚至焦臭 我头发不算长 也吹不到多久5分钟的样子就特别烫 别的都很满意 ,服务态度很不错，以前在淘宝买东西都是系统自动好评，花了好多好多钱，后来才知道淘宝评论得积分可以涨淘气值，才知道评论的重要性,-,2021-06-20
1460,g**i,颜色分类: 原装正品-2200W-胶原蛋白-9000万负离子,好评,做工精细，风量非常大，有六档调节，用起来很方便。 ,-,-,2021-06-01
1461,郭**2,颜色分类: 原装正品-2200W-胶原蛋白-9000万负离钛灰蓝,好评,还可以,-,-,2021-06-26
1462,微**伤,颜色分类: 原装正品-2200W-胶原蛋白-9000万负离钛灰蓝,好评,外观材质：外观很好看，之前也是冲着它的颜值最后选了它 护发功效：感觉比我原来的吹风机(40左右)好太多了，用这个吹风机吹起来没有那么毛躁，和我室友的比起来没那么好，我室友的更不毛躁（价值129元），还是一分钱一分货，性价比还可以。 风量大小：风量还是挺大的，一开始觉得声音有些大，习惯了就无所谓了。 ,以前在淘宝买东西都是系统自动好评，花了好多好多钱，后来才知道淘宝评论得积分可以涨淘气值，才知道评论的重要性😊,-,2021-06-15
1463,x**4,颜色分类: 原装正品-2200W-胶原蛋白-9000万负离钛灰蓝,好评,此用户没有填写评价。,东西不错，质量很好，值得购买,-,2021-06-22
1464,聪**5,颜色分类: 原装正品-2200W-胶原蛋白-9000万负离钛灰蓝,好评,说实话没有描述的那么好，看描述期望值挺高的，结果除了颜值在线，其他方面都很一般，功率2200感觉实际达不到，没有我之前几十块买的风力大，更别说堪比发廊用机了，另外就是噪音大，话说功率大的噪音大很正常，但这个噪音不是那种嗡嗡声，听起来比较刺耳。总之用了一段总之体验感差强人意。 ,服务很好，以前在淘宝买东西都是系统自动好评，花了好多好多钱，后来才知道淘宝评论得积分可以涨淘气值，才知道评论的重要性,-,2021-06-25
1465,w**e,颜色分类: 原装正品-2200W-胶原蛋白-9000万负离钛灰蓝,好评,挺好,-,-,2021-06-24
1466,马**旺,颜色分类: 原装正品-2200W-胶原蛋白-9000万负离钛灰蓝,好评,宝贝收到感觉很不错可能是刚到风吹出来香香的味道，风力很大，个人感觉声音有点大但也还可以,客服不错，以前在淘宝买东西都是系统自动好评，花了好多好多钱，后来才知道淘宝评论得积分可以涨淘气值，才知道评论的重要性,-,2021-05-27
1467,爱**5,颜色分类: 原装正品-2200W-胶原蛋白-9000万负离子,好评,很不错哦，👍 性价比很高，吹风机吹出来的风香香的，还好精致！做工非常完美，🍀 买过颜值最高的吹风机了 🌸 ！！太棒了吧！使用几次这款吹风机吹头发比之前柔顺一些，头发也都很顺，😍 不需要怎么打理发型都很好看，更有光泽，👍 风力超大，吹干很快，用着舒服，超级满意👏  ,质量没得说，挺好的，🤗真的可以让头发非常的顺滑不毛躁，风力够大，👍吹头发非常好速干还护发,-,2021-05-28
