943,秀**大,颜色分类: 原装正品-2200W-胶原蛋白-9000万负离子,好评,看着还不错,-,-,2021-05-28
944,t**6,颜色分类: 原装正品-2200W-胶原蛋白-9000万负离钛灰蓝,好评,吹风机拿到🌙啦！质感不错，实物看🌙着还蛮上🌙档次的🌙，轻便拿着也不累~风机🌙挺强的吹风机温度吹到头上很🌙舒服，风力很大，🌙不一会头发就干了🌙，非常好用 拿🌙着吹不觉得累手 一挡的风吹🌙着温和 声音不大  而🌙且这个配色蛮高级🌙,-,-,2021-05-27
945,珍**周,颜色分类: 原装正品-2200W-胶原蛋白-9000万负离钛灰蓝,好评,可以的，如果又想买的可以考虑,-,-,2021-06-04
946,坐**望,颜色分类: 原装正品-2200W-胶原蛋白-9000万负离子,好评,很好用 很快就可以吹干 ,-,-,2021-06-03
947,慧**2,颜色分类: 原装正品-2200W-胶原蛋白-9000万负离子,好评,很不错  风很大 节约时间,-,-,2021-06-06
948,愿**8,颜色分类: 原装正品-2200W-胶原蛋白-9000万负离子,好评,噪音太大了，其他还好,以前在淘宝买东西都是系统自动好评，花了好多好多钱，后来才知道淘宝评论得积分可以涨淘气值，才知道评论的重要性,-,2021-06-11
949,罗**w,颜色分类: 原装正品-2200W-胶原蛋白-9000万负离子,好评,很精致，质量非常好，很满意的一次购物。谢谢店家！ ,-,-,2021-05-29
950,苦**8,颜色分类: 原装正品-2200W-胶原蛋白-9000万负离子,好评,喜欢，声音不算大,-,-,2021-06-14
951,2**y,颜色分类: 原装正品-2200W-胶原蛋白-9000万负离子,好评,买回来就用了，吹了后头发蓬松，不像之前那个吹飞机吹了软塌，对油头的我太友好了。,第一次买这种负离子的吹风机，里面还送了两个吹造型的，附带9000万的负离子，价格还地道，吹的时候还不会烫头发，对头发很温和，真的太好用了。,-,2021-06-04
952,人**顾,颜色分类: 原装正品-2200W-胶原蛋白-9000万负离子,好评,就是风不怎么大,-,-,2021-06-11
953,最**1,颜色分类: 原装正品-2200W-胶原蛋白-9000万负离钛灰蓝,好评,恒温的，很舒服。关键是十年包换 ,-,-,2021-05-28
954,t**3,颜色分类: 原装正品-2200W-胶原蛋白-9000万负离子,好评,风力和温度都可以调，节风力很大，而且吹头发干的速度很快，好用不错。吹出来的风还有一股香香的味道。😄😄😄 ,-,-,2021-05-27
955,笑**问,颜色分类: 原装正品-2200W-胶原蛋白-9000万负离子,好评,声音太大了有杂音,服务很好，以前在淘宝买东西都是系统自动好评，花了好多好多钱，后来才知道淘宝评论得积分可以涨淘气值，才知道评论的重要性,-,2021-06-17
956,c**0,颜色分类: 原装正品-2200W-胶原蛋白-9000万负离钛灰蓝,好评,还可以吧，风还挺大,-,-,2021-06-10
957,s**1,颜色分类: 原装正品-2200W-胶原蛋白-9000万负离钛灰蓝,好评,出风很大杠杠滴 ,-,-,2021-05-29
958,j**喜,颜色分类: 原装正品-2200W-胶原蛋白-9000万负离子,好评,非常好，干得快,-,-,2021-06-03
959,孙**y,颜色分类: 原装正品-2200W-胶原蛋白-9000万负离子,好评,试用了一下不错 ,-,-,2021-06-07
960,t**7,颜色分类: 原装正品-2200W-胶原蛋白-9000万负离子,好评,宝贝收到了，试了一下非常好用，服务态度非常好,-,-,2021-05-31
961,姐**美,颜色分类: 原装正品-2200W-胶原蛋白-9000万负离子,好评,风挺大的好用 ,-,-,2021-06-01
962,何**服,颜色分类: 原装正品-2200W-胶原蛋白-9000万负离钛灰蓝,好评,很好用，很舒服！ ,-,-,2021-06-02
963,你**讲,颜色分类: 原装正品-2200W-胶原蛋白-9000万负离钛灰蓝,好评,试了一下感觉还可以，有股香味，小小巧巧的，就是送的圆圆那个不知道怎么用 ,-,-,2021-06-08
964,等**7,颜色分类: 原装正品-2200W-胶原蛋白-9000万负离子,好评,不错，用着还行,-,-,2021-06-05
965,饭**风,颜色分类: 原装正品-2200W-胶原蛋白-9000万负离子,好评,好用，推荐！ ,-,-,2021-05-30
966,我**爱,颜色分类: 原装正品-2200W-胶原蛋白-9000万负离钛灰蓝,好评,品质杠杠滴,-,-,2021-05-28
967,m**敏,颜色分类: 原装正品-2200W-胶原蛋白-9000万负离子,好评,声音太大了,-,-,2021-06-11
968,倒**8,颜色分类: 原装正品-2200W-胶原蛋白-9000万负离钛灰蓝,好评,风还可以,-,-,2021-06-08
969,s**u,颜色分类: 原装正品-2200W-胶原蛋白-9000万负离钛灰蓝,好评,非常棒，很好，值得用！,-,-,2021-06-08
970,l**3,颜色分类: 原装正品-2200W-胶原蛋白-9000万负离钛灰蓝,好评,很不错的，风也很大，中间有点小问题商家也很愉快的解决了，值得购买。,-,-,2021-05-29
971,t**2,颜色分类: 原装正品-2200W-胶原蛋白-9000万负离钛灰蓝,好评,太喜欢了,-,-,2021-06-23
972,陈**婷,颜色分类: 原装正品-2200W-胶原蛋白-9000万负离钛灰蓝,好评,不错，吹头发香香的 ,-,-,2021-06-03
973,x**d,颜色分类: 原装正品-2200W-胶原蛋白-9000万负离钛灰蓝,好评,试用了十来天感觉还不错，赞,-,-,2021-06-07
974,一**忆,颜色分类: 原装正品-2200W-胶原蛋白-9000万负离子,好评,很好，味道香,-,-,2021-05-28
975,永**2,颜色分类: 原装正品-2200W-胶原蛋白-9000万负离钛灰蓝,好评,不错，吹一会儿就干了。 ,-,-,2021-06-14
976,无**哈,颜色分类: 原装正品-2200W-胶原蛋白-9000万负离子,好评,很好看!!!!!!而且吹头发有香味!!!!风力也挺大的 ,-,-,2021-05-28
977,w**1,颜色分类: 原装正品-2200W-胶原蛋白-9000万负离子,好评,电吹风颜值爆表，质量很好，凤力很大，头发一下就吹干了，物美价廉！ ,-,-,2021-05-27
978,t**0,颜色分类: 原装正品-2200W-胶原蛋白-9000万负离子,好评,吹风机超级好，吹风口是蓝色灯红漂亮，吹出的风淡淡香味，风力也很大，质量超级好比超市买的还好，最愉快的一次网购。,-,-,2021-05-22
979,茜**0,颜色分类: 原装正品-2200W-胶原蛋白-9000万负离钛灰蓝,好评,拿出你的心暖暖的女明星们明星面对面的梦想吗明星妈妈大妈出门想念那些年才能难兄难弟你才能拿出奶粉 ,-,-,2021-06-07
980,z**3,颜色分类: 原装正品-2200W-胶原蛋白-9000万负离子,好评,做工略显粗糙，1档位声音确实还好,-,-,2021-06-08
981,春**8,颜色分类: 原装正品-2200W-胶原蛋白-9000万负离子,好评,收到很多天了才来评价    吹风机真心好用   比我之前的好用太多了   吹出来的头发顺顺滑滑的   闺女之前不爱吹头发现在都爱上了洗头吹头发   真的是值得购买的哦 ,-,-,2021-05-24
982,t**2,颜色分类: 原装正品-2200W-胶原蛋白-9000万负离钛灰蓝,好评,其他特色：快递很快 外观材质：非常漂亮 护发功效：风力柔和 ,-,-,2021-06-23
983,阳**岁,颜色分类: 原装正品-2200W-胶原蛋白-9000万负离子,好评,很好，没有损坏,-,-,2021-06-03
984,l**4,颜色分类: 原装正品-2200W-胶原蛋白-9000万负离子,好评,挺好的，放心买,-,-,2021-06-06
985,d**0,颜色分类: 原装正品-2200W-胶原蛋白-9000万负离子,好评,质量很好，喜欢 ,-,-,2021-06-07
986,香**缘,颜色分类: 原装正品-2200W-胶原蛋白-9000万负离钛灰蓝,好评,质量很好，喜欢,-,-,2021-05-31
987,青**0,颜色分类: 原装正品-2200W-胶原蛋白-9000万负离子,好评,风力很大，吹头发很快就干了，很好用 ,吹头发很快就干了，而且头发不枯燥，好用,-,2021-06-05
988,m**o,颜色分类: 原装正品-2200W-胶原蛋白-9000万负离子,好评,声音挺小，风力足够，还可以。,买回来就用了，有股香味，挺好,-,2021-06-04
989,青**t,颜色分类: 原装正品-2200W-胶原蛋白-9000万负离钛灰蓝,好评,宝贝收到了。与描述相符，看起来很大牌，颜色特别漂亮，买过的吹风机中最爱的一个了，有需要还会回购的,-,-,2021-05-26
990,林**0,颜色分类: 原装正品-2200W-胶原蛋白-9000万负离子,好评,质量很好，也好看，风力大还有一点点香味，好评,-,-,2021-05-22
991,回**0,颜色分类: 原装正品-2200W-胶原蛋白-9000万负离子,好评,拿到手挺轻的，不过挺好用，声音不算大，风力挺强的，我的头发很难吹干，但这也就六七分钟。吹完头发也不是很毛糙，还是很好用的,-,-,2021-06-05
992,t**4,颜色分类: 原装正品-2200W-胶原蛋白-9000万负离子,好评,宝贝收到了。颜值爆表！温度适宜超喜欢！好评必须滴 ,-,-,2021-05-26
993,许**9,颜色分类: 原装正品-2200W-胶原蛋白-9000万负离子,好评,质量不错 ,-,-,2021-05-29
994,t**8,颜色分类: 原装正品-2200W-胶原蛋白-9000万负离子,好评,吹风机很好看，手感也很好，摸起来有质感，吹干头发也很快，包装无破损，整体来说非常满意,-,-,2021-06-17
995,日**8,颜色分类: 原装正品-2200W-胶原蛋白-9000万负离子,好评,外观材质：真的很好看很高级 风量大小：风蛮大的 声音却又没有那么吵 母亲节礼物买给妈妈 她很喜欢很满意 ,-,-,2021-05-18
996,王**哈,颜色分类: 原装正品-2200W-胶原蛋白-9000万负离钛灰蓝,好评,此用户没有填写评价。,用了一段时间，字母掉色了，用着风力不大，吹出来有点香，还行,-,2021-06-02
997,t**4,颜色分类: 原装正品-2200W-胶原蛋白-9000万负离子,好评,简单快乐，体验愉快，价格实惠 ,-,-,2021-05-23
998,z**i,颜色分类: 原装正品-2200W-胶原蛋白-9000万负离钛灰蓝,好评,用了感觉还不错，声音也挺小的。 ,-,-,2021-06-04
999,t**6,颜色分类: 原装正品-2200W-胶原蛋白-9000万负离子,好评,质量很好，收到货第一时间打开看了，很不错，很满意，虽然有点小差曲但是很快就解决了,-,-,2021-05-22
1000,t**7,颜色分类: 原装正品-2200W-胶原蛋白-9000万负离钛灰蓝,好评,真的不错 颜值高 质量好  还有淡淡香味 ,-,-,2021-05-27
1001,8**生,颜色分类: 原装正品-2200W-胶原蛋白-9000万负离子,好评,挺好的，也很喜欢！有需要还会再来的，会介绍朋友来的！,-,-,2021-05-27
1002,球**0,颜色分类: 原装正品-2200W-胶原蛋白-9000万负离子,好评,很好，性价比高,-,-,2021-06-05
1003,久**3,颜色分类: 原装正品-2200W-胶原蛋白-9000万负离钛灰蓝,好评,其他特色：好 外观材质：好 护发功效：好 风量大小：好 太好了除了好我无法形容 太喜欢了 ,-,-,2021-05-26
1004,彭**8,颜色分类: 原装正品-2200W-胶原蛋白-9000万负离子,好评,吹完头发还可以，不太毛躁。噪音一般，普通吹风机的分贝，家用可以，给小朋友吹头发也行 ,-,-,2021-06-07
1005,王**1,颜色分类: 原装正品-2200W-胶原蛋白-9000万负离子,好评,用着还可以。风力大，吹风机有股香气，就是这个头安上去不能旋转，要不会掉色，拔的时候有点不好拔 ,-,-,2021-06-06
1006,s**1,颜色分类: 原装正品-2200W-胶原蛋白-9000万负离钛灰蓝,好评,吹风机外观有划痕，毛边大 ,客服不错，以前在淘宝买东西都是系统自动好评，花了好多好多钱，客服很热情帮我解决了吹风机上的小问题，用起来很有热冷两个档，送有卷发器材，看起来很大气。,-,2021-06-07
1007,静**5,颜色分类: 原装正品-2200W-胶原蛋白-9000万负离钛灰蓝,好评,风力很好，很好用,-,-,2021-05-22
1008,一**啦,颜色分类: 原装正品-2200W-胶原蛋白-9000万负离钛灰蓝,好评,就是普通的吹风机啊，不是很重，吹头发还算快，颜值不错，我没有吸头发 ,诶，还挺好用，最近忽然发现了它吹完头发，头发好柔顺啊，还感觉头发润润的，而且吹头发真的快，至少比我以前用的那个好用很多，声音也不算大，推荐,-,2021-06-06
1009,淘**3,颜色分类: 原装正品-2200W-胶原蛋白-9000万负离子,好评,好评！特意用了一下才来评价的，风劲可以，外观也挺好看小巧的，吹出来的头发也挺柔顺的！,-,-,2021-05-25
1010,土**l,颜色分类: 原装正品-2200W-胶原蛋白-9000万负离钛灰蓝,好评,声音巨大，吹个头发像人家搞装修样。不建议购买 ,以前在淘宝买东西都是系统自动好评，花了好多好多钱，后来才知道淘宝评论得积分可以涨淘气值，才知道评论的重要性。,-,2021-06-06
1011,2**6,颜色分类: 原装正品-2200W-胶原蛋白-9000万负离钛灰蓝,好评,看着好高大上，风力很大很好，就是为啥里面香香的😂😂😂😂,-,-,2021-05-23
1012,l**8,颜色分类: 原装正品-2200W-胶原蛋白-9000万负离钛灰蓝,好评,昨晚吹了下，头发吹出来跟理发店一样那么顺，不毛躁！有热风跟冷风！,-,-,2021-05-25
1013,h**4,颜色分类: 原装正品-2200W-胶原蛋白-9000万负离钛灰蓝,好评,挺好的 吹的风很舒服 头发很快干掉 不像之前的吹风机吹的头发很毛躁 这个很顺滑,-,-,2021-05-27
1014,w**贝,颜色分类: 原装正品-2200W-胶原蛋白-9000万负离子,好评,我记得我买的是折叠的，为啥这个回来。不是折叠的，😂 ,虽然不是折叠的，但是用着很不错，我没有记错的话应该是第二次在他家回购。质量杠杠的，没问题。,-,2021-05-31
1015,你**吧,颜色分类: 原装正品-2200W-胶原蛋白-9000万负离钛灰蓝,好评,几十块钱的东西包装很用心，打开一股香味！挺不错的,-,-,2021-05-27
1016,冰**1,颜色分类: 原装正品-2200W-胶原蛋白-9000万负离子,好评,吹风机风力大，颜值高，卷发直发都适合，好用有性价比好！喜欢的赶紧入手 ,-,-,2021-05-22
1017,y**c,颜色分类: 原装正品-2200W-胶原蛋白-9000万负离钛灰蓝,好评,风速挺好的，就是换风口的地方有点掉漆，其他都挺好的,-,-,2021-06-05
1018,q**8,颜色分类: 原装正品-2200W-胶原蛋白-9000万负离钛灰蓝,好评,是不是刚用有点糊味，其他的都满意 ,声音个人觉得有点大,-,2021-05-28
1019,溪**澈,颜色分类: 原装正品-2200W-胶原蛋白-9000万负离子,好评,吹起来有一种香香的味道，风力挺大的，吹干很快，吹完挺柔顺的,-,-,2021-05-22
1020,懒**界,颜色分类: 原装正品-2200W-胶原蛋白-9000万负离子,好评,此用户没有填写评价。,使用感挺不错的，声音不大风力挺大，头发吹完很顺滑不毛燥,-,2021-05-23
1021,h**x,颜色分类: 原装正品-2200W-胶原蛋白-9000万负离钛灰蓝,好评,颜值挺高的，用起来也不错就是声音没有想象中的那么小。但是还是挺好用的 ,-,-,2021-06-08
1022,c**4,颜色分类: 原装正品-2200W-胶原蛋白-9000万负离子,好评,质量还不错，用过之后才来评价的，干的挺快，吹出来还有香味  ,-,-,2021-05-25
1023,t**8,颜色分类: 原装正品-2200W-胶原蛋白-9000万负离子,好评,超级喜欢，长得好看，真的好好看，而且吹出来还是香香的，真的好爱好爱，还会发蓝光，太爱了吧,-,-,2021-06-17
1024,萱**1,颜色分类: 原装正品-2200W-胶原蛋白-9000万负离钛灰蓝,好评,好用呀 负离子的 而且风力大头发很快就吹干了 ,-,-,2021-05-26
1025,何**9,颜色分类: 原装正品-2200W-胶原蛋白-9000万负离子,好评,香香的☺ ,-,-,2021-05-19
1026,a**8,颜色分类: 原装正品-2200W-胶原蛋白-9000万负离钛灰蓝,好评,超级好用，很喜欢，还有香香的味道，风力也很大，关键颜值又高，值得推荐，,-,-,2021-05-22
1027,t**7,颜色分类: 原装正品-2200W-胶原蛋白-9000万负离钛灰蓝,好评,真的很不错呀 吹完头发很顺 给身边的朋友都安利了一波 ,-,-,2021-05-24
1028,t**2,颜色分类: 原装正品-2200W-胶原蛋白-9000万负离钛灰蓝,好评,功率有三档，很快就吹好了。就是比想象中要大，而且不能折叠。,-,-,2021-06-23
1029,腊**飘,颜色分类: 原装正品-2200W-胶原蛋白-9000万负离钛灰蓝,好评,亲自用了一次，风力很大，温度也可以调节，值得购买,-,-,2021-05-23
1030,j**1,颜色分类: 原装正品-2200W-胶原蛋白-9000万负离子,好评,声音不是很大，风力也还可以，主要是颜值有点高 ,-,-,2021-05-29
1031,t**2,颜色分类: 原装正品-2200W-胶原蛋白-9000万负离子,好评,颜值高，吹干还是比较快，就是声音没有想的那么小，但是能接受，满意,-,-,2021-06-23
1032,城**e,颜色分类: 原装正品-2200W-胶原蛋白-9000万负离钛灰蓝,好评,包装不错，也比较漂亮，用起来有香味，就是不知道能用多久 ,-,-,2021-05-22
1033,0**0,颜色分类: 原装正品-2200W-胶原蛋白-9000万负离钛灰蓝,好评,试用了一下，用的时候有一股香味，和理发店里的差不多，不知道什么原理！ ,-,-,2021-06-07
1034,邓**晗,颜色分类: 原装正品-2200W-胶原蛋白-9000万负离钛灰蓝,好评,很容易吹干，颜值也高，但是说有护发效果，没发现。,-,-,2021-06-01
1035,s**8,颜色分类: 原装正品-2200W-胶原蛋白-9000万负离子,好评,风力可以，带点香味，不算难闻,-,-,2021-06-08
1036,江**9,颜色分类: 原装正品-2200W-胶原蛋白-9000万负离子,好评,其他特色：收到  晚上洗好澡就用了   感觉都不错 ,-,-,2021-05-19
1037,t**9,颜色分类: 原装正品-2200W-胶原蛋白-9000万负离钛灰蓝,好评,发货速度快，客服人也不错。。。很细心。。 ,-,-,2021-06-20
1038,岁**k,颜色分类: 原装正品-2200W-胶原蛋白-9000万负离子,好评,吹出来的风很柔和，声音也不大。,-,-,2021-05-23
1039,李**1,颜色分类: 原装正品-2200W-胶原蛋白-9000万负离钛灰蓝,好评,声音不大，还有香香的味道，真心的不错！,-,-,2021-05-28
1040,岛**蓝,颜色分类: 原装正品-2200W-胶原蛋白-9000万负离钛灰蓝,好评,说实话 吹风机一般 真的  😅😅😅😅 ,-,-,2021-06-02
1041,邓**邓,颜色分类: 原装正品-2200W-胶原蛋白-9000万负离钛灰蓝,好评,用着味道都比较香，风力还蛮大的 ,-,-,2021-05-27
1042,m**7,颜色分类: 原装正品-2200W-胶原蛋白-9000万负离钛灰蓝,好评,拍的深色的 很高档的感觉 风力很大 里面发出蓝光 吹出来还有香香的味道 ,送了两个吹风嘴 客服也耐心讲解用途 挺好的,-,2021-05-24
1043,刘**9,颜色分类: 原装正品-2200W-胶原蛋白-9000万负离子,好评,吹得时候有股香味，但我不喜欢，不知道多久就没了 ,-,-,2021-06-02
1044,魅**罗,颜色分类: 原装正品-2200W-胶原蛋白-9000万负离子,好评,是谁说的声音不吵的？老公说声音比电锯还大 物流倒是快,-,-,2021-06-04
1045,1**1,颜色分类: 原装正品-2200W-胶原蛋白-9000万负离子,好评,估计是我头发有些长，吹的时候进风口能搅到头发 ,-,-,2021-06-07
1046,快**7,颜色分类: 原装正品-2200W-胶原蛋白-9000万负离钛灰蓝,好评,一般，没有她们说的那么好用,-,-,2021-05-31
1047,j**2,颜色分类: 原装正品-2200W-胶原蛋白-9000万负离子,好评,吹风筒很香，声音特小。用着很舒适,-,-,2021-05-17
1048,z**2,颜色分类: 原装正品-2200W-胶原蛋白-9000万负离钛灰蓝,好评,不错，声音不是很大。比我以前飞利浦的声音小多了。,-,-,2021-06-01
1049,啦**x,颜色分类: 原装正品-2200W-胶原蛋白-9000万负离钛灰蓝,好评,吹出的风是香香的，不是很吵，风力十足 ,-,-,2021-06-06
1050,t**1,颜色分类: 原装正品-2200W-胶原蛋白-9000万负离钛灰蓝,好评,包装完好，质量也不错 ,-,-,2021-05-26
1051,你**了,颜色分类: 原装正品-2200W-胶原蛋白-9000万负离子,好评,风力不是很大声音有点大,-,-,2021-06-02
1052,我**冒,颜色分类: 原装正品-2200W-胶原蛋白-9000万负离子,好评,挺好，头发吹得蛮快，也不那么毛燥,-,-,2021-06-07
1053,欢**1,颜色分类: 原装正品-2200W-胶原蛋白-9000万负离钛灰蓝,好评,用了3次，风力有几个档 还可以，好评吧！,-,-,2021-06-08
1054,t**4,颜色分类: 原装正品-2200W-胶原蛋白-9000万负离钛灰蓝,好评,还可以，就是声音大了点,-,-,2021-06-04
1055,王**的,颜色分类: 原装正品-2200W-胶原蛋白-9000万负离钛灰蓝,好评,哪都挺好，就是出来的香味不喜欢，,-,-,2021-06-02
1056,绿**盟,颜色分类: 原装正品-2200W-胶原蛋白-9000万负离子,好评,宝贝收到了，看着还不错，用过再来评价,-,-,2021-05-24
1057,m**1,颜色分类: 原装正品-2200W-胶原蛋白-9000万负离子,好评,胶原蛋白就感觉不到，但有香味 ,-,-,2021-05-19
1058,沈**9,颜色分类: 原装正品-2200W-胶原蛋白-9000万负离钛灰蓝,好评,宝贝真的不错哦！还有香味哦！,-,-,2021-05-24
1059,小**6,颜色分类: 原装正品-2200W-胶原蛋白-9000万负离钛灰蓝,好评,吹头发很爽。吹完不会干枯毛躁 ,-,-,2021-05-26
1060,d**爱,颜色分类: 原装正品-2200W-胶原蛋白-9000万负离子,好评,试用了一下，风力不错,-,-,2021-05-23
1061,t**6,颜色分类: 原装正品-2200W-胶原蛋白-9000万负离钛灰蓝,好评,还可以，风力挺大的,-,-,2021-05-30
1062,h**1,颜色分类: 原装正品-2200W-胶原蛋白-9000万负离钛灰蓝,好评,风挺大就是没法挂起来也没法折起来有电占地方,-,-,2021-06-03
1063,冰**界,颜色分类: 原装正品-2200W-胶原蛋白-9000万负离子,好评,还没用，感觉质量挺好的,-,-,2021-06-05
1064,a**i,颜色分类: 原装正品-2200W-胶原蛋白-9000万负离子,好评,挺好的，很下香，声音也不算大。 ,-,-,2021-06-01
1065,m**1,颜色分类: 原装正品-2200W-胶原蛋白-9000万负离钛灰蓝,好评,特别好，风大，还有淡淡香气 ,-,-,2021-05-24
1066,陈**云,颜色分类: 原装正品-2200W-胶原蛋白-9000万负离钛灰蓝,好评,风不算太大，但很温柔，吹得也算快了，头发吹完都很柔顺 ,-,-,2021-06-04
1067,2**0,颜色分类: 原装正品-2200W-胶原蛋白-9000万负离钛灰蓝,好评,宝贝收到了，很有质感，很漂亮，用着挺好的,-,-,2021-05-17
1068,k**7,颜色分类: 原装正品-2200W-胶原蛋白-9000万负离子,好评,不错，风力大，声音不算大！,-,-,2021-06-08
1069,卧**可,颜色分类: 原装正品-2200W-胶原蛋白-9000万负离子,好评,风量大小：风量大，质量很好物流很快，卖家服务态度很好 ,-,-,2021-05-25
1070,非**a,颜色分类: 原装正品-2200W-胶原蛋白-9000万负离子,好评,很好用还有香味,-,-,2021-05-24
1071,t**2,颜色分类: 原装正品-2200W-胶原蛋白-9000万负离钛灰蓝,好评,用了一次，吹出来的风又大又香，爱了爱了,-,-,2021-06-23
1072,沁**9,颜色分类: 原装正品-2200W-胶原蛋白-9000万负离钛灰蓝,好评,比我想象中的要大，但是风还是挺大的。,-,-,2021-06-05
1073,5**h,颜色分类: 原装正品-2200W-胶原蛋白-9000万负离子,好评,整体可以！发货到货快！ ,-,-,2021-05-31
1074,康**龙,颜色分类: 原装正品-2200W-胶原蛋白-9000万负离钛灰蓝,好评,试了一下，没有异味，还不错 ,-,-,2021-05-23
1075,w**6,颜色分类: 原装正品-2200W-胶原蛋白-9000万负离钛灰蓝,好评,不错，声音挺小的！！,-,-,2021-06-04
1076,小**嘟,颜色分类: 原装正品-2200W-胶原蛋白-9000万负离子,好评,还不错…… 啊……还不错……就是有点太香,-,-,2021-06-06
1077,t**3,颜色分类: 原装正品-2200W-胶原蛋白-9000万负离钛灰蓝,好评,用了几次了，感觉还不错， ,-,-,2021-06-03
1078,1**瑾,颜色分类: 原装正品-2200W-胶原蛋白-9000万负离子,好评,看着不错～还没用呢。,-,-,2021-05-24
1079,a**娇,颜色分类: 原装正品-2200W-胶原蛋白-9000万负离子,好评,颜值很高，还没用。,-,-,2021-05-28
1080,t**2,颜色分类: 原装正品-2200W-胶原蛋白-9000万负离子,好评,🉑️ 目前看来较好 ,-,-,2021-06-23
1081,t**5,颜色分类: 原装正品-2200W-胶原蛋白-9000万负离子,好评,颜值高，很好用。爱了爱了,-,-,2021-06-19
1082,璀**空,颜色分类: 原装正品-2200W-胶原蛋白-9000万负离子,好评,质量很好，不错不错，,-,-,2021-05-26
1083,s**9,颜色分类: 原装正品-2200W-胶原蛋白-9000万负离子,好评,用了一次，还好,-,-,2021-06-04
1084,m**0,颜色分类: 原装正品-2200W-胶原蛋白-9000万负离子,好评,喜欢，风好大，也很香，不错不错,-,-,2021-05-22
1085,l**8,颜色分类: 原装正品-2200W-胶原蛋白-9000万负离钛灰蓝,好评,般般，风声太大 ,-,-,2021-06-02
1086,f**曦,颜色分类: 原装正品-2200W-胶原蛋白-9000万负离子,好评,挺不错的 很好看 也很好用 客服态度也很好 ,-,-,2021-05-22
1087,t**9,颜色分类: 原装正品-2200W-胶原蛋白-9000万负离钛灰蓝,好评,用了一下香香的,-,-,2021-06-20
1088,t**1,颜色分类: 原装正品-2200W-胶原蛋白-9000万负离子,好评,非常不错,-,-,2021-05-25
1089,a**4,颜色分类: 原装正品-2200W-胶原蛋白-9000万负离子,好评,真的非常nice ,-,-,2021-05-19
1090,t**8,颜色分类: 原装正品-2200W-胶原蛋白-9000万负离子,好评,还没用，用了评论,-,-,2021-06-17
1091,云**水,颜色分类: 原装正品-2200W-胶原蛋白-9000万负离钛灰蓝,好评,很好用，风大，好评！,-,-,2021-05-26
1092,z**0,颜色分类: 原装正品-2200W-胶原蛋白-9000万负离子,好评,还没有用,-,-,2021-05-28
1093,t**2,颜色分类: 原装正品-2200W-胶原蛋白-9000万负离子,好评,非常满意，大功率。 ,-,-,2021-06-23
1094,h**8,颜色分类: 原装正品-2200W-胶原蛋白-9000万负离钛灰蓝,好评,质量好，商品好，服务好，物流好,-,-,2021-05-25
1095,美**人,颜色分类: 原装正品-2200W-胶原蛋白-9000万负离子,好评,虽有小贵，风力很大。值得购买！ ,-,-,2021-05-18
