374,晨**8,颜色分类: 原装正品-2200W-胶原蛋白-9000万负离钛灰蓝,好评,很高大上的一款电吹风😊 ，质量好，很轻便！比我以前那个吹风机好用很多！主要的是价格性价比很高！这个风力很大，没一下就能完全吹干[耶]，吹完后头发还很柔顺，不伤头发，有护发效果  ,满意使用了几天，吹风机声音小，但是风力很大🐰冷热均匀可调节，使用起来很方便🌸吹了很久也不会觉得烫，能很好的保护头发和头皮，🐰还有负离子护发功能，小巧精致不占地方，用着很满意哦⊙∀⊙！🌹,-,2021-05-18
375,长**3,颜色分类: 原装正品-2200W-胶原蛋白-9000万负离子,好评,超级好，出乎意料！吹出来的风都是香香的！喜欢！快去买！ ,-,-,2021-06-18
376,小**9,颜色分类: 原装正品-2200W-胶原蛋白-9000万负离子,好评,开始很香，现在用着没那么香了，但是吹头发还很快，可以可以，希望可以多用些时间，上一个别的牌子的吹风机用了7年了，还在，嘿嘿 ,-,-,2021-06-19
377,乖**4,颜色分类: 原装正品-2200W-胶原蛋白-9000万负离钛灰蓝,好评,刚收到宝贝，外观非常漂亮，也非常好用，吹起来，头发的发质瞬间变的好柔顺，吹风机声音也不大，价格也真的很实惠,-,-,2021-06-13
378,万**0,颜色分类: 原装正品-2200W-胶原蛋白-9000万负离子,好评,物流很快，质量很好，包装也好看很有档次，也很细心，设计简约大方，时尚又有档次，风力很大，多个档位调节，吹出来的风很舒服而且是负离子的，发质柔和，还有一点香香的味道，负离子护发的喜欢 ,这个吹头发香香的真好啊🤩，而且声音还小，大爱！看了好多家店铺最终还是相中了这一款，护发功能立马就能体验出来🥰，比之前家里的好用很多，简直太超出我的想象力了，吹完发质马上就能感受很柔滑，而且风力也大💨，性价比特别高。,-,2021-05-21
379,林**桦,颜色分类: 原装正品-2200W-胶原蛋白-9000万负离钛灰蓝,好评,那个扁嘴的装上去拿不下来，手感还行，风力的话，应该也可以吧,-,-,2021-06-24
380,比**3,颜色分类: 原装正品-2200W-胶原蛋白-9000万负离子,好评,吹风机风力够大，吹完头发比较柔顺，很满意 ,-,-,2021-06-22
381,1**f,颜色分类: 原装正品-2200W-胶原蛋白-9000万负离子,好评,风量大小：很大 还香香的 ,-,-,2021-06-22
382,七**0,颜色分类: 原装正品-2200W-胶原蛋白-9000万负离子,好评,金色那里褪色，看上去很劣质，声音也很大 ,-,-,2021-06-24
383,t**2,颜色分类: 原装正品-2200W-胶原蛋白-9000万负离钛灰蓝,好评,风量大小：声音很大 ,-,-,2021-06-23
384,t**7,颜色分类: 原装正品-2200W-胶原蛋白-9000万负离子,好评,很可 这个价钱 东西也不错 颜值也不错,-,-,2021-06-21
385,h**2,颜色分类: 原装正品-2200W-胶原蛋白-9000万负离钛灰蓝,好评,质量很好，风力十足！很满意！ ,-,-,2021-06-19
386,于**川,颜色分类: 原装正品-2200W-胶原蛋白-9000万负离子,好评,质量很好，外观很漂亮，风也很大，不错 ,-,-,2021-06-19
387,y**o,颜色分类: 原装正品-2200W-胶原蛋白-9000万负离子,好评,不清楚负离子和胶原蛋白有没有效果，反正用起来还可以,-,-,2021-06-24
388,r**o,颜色分类: 原装正品-2200W-胶原蛋白-9000万负离子,好评,功能全面，外观时尚。希望可以久用。发货及时,-,-,2021-06-24
389,j**7,颜色分类: 原装正品-2200W-胶原蛋白-9000万负离子,好评,功率挺大的，温度挺适宜的，挺好用的！,-,-,2021-06-15
390,f**8,颜色分类: 原装正品-2200W-胶原蛋白-9000万负离子,好评,风力挺大的，就是声音再小点就好了 ,-,-,2021-06-26
391,丛**1,颜色分类: 原装正品-2200W-胶原蛋白-9000万负离钛灰蓝,好评,护发功效：看着还可以 ,-,-,2021-06-21
392,丁**n,颜色分类: 原装正品-2200W-胶原蛋白-9000万负离子,好评,吹风机不错，喜欢的可以下单,-,-,2021-06-25
393,樱**0,颜色分类: 原装正品-2200W-胶原蛋白-9000万负离子,好评,特别满意，风力柔和，,-,-,2021-06-22
394,y**x,颜色分类: 原装正品-2200W-胶原蛋白-9000万负离子,好评,忘记备注了，客服人很好，还是给我补发了，非常感谢，昨天用了，功率很大，几分钟头发就干了，,-,-,2021-06-22
395,爱**狂,颜色分类: 原装正品-2200W-胶原蛋白-9000万负离钛灰蓝,好评,有香味，吹干的头发不枯燥，真神奇,-,-,2021-06-26
396,t**3,颜色分类: 原装正品-2200W-胶原蛋白-9000万负离钛灰蓝,好评,"吹风机温度吹到头上很舒服,风力很大,不一会头发就干了,非常好用,并且拿着也很舒",-,-,2021-06-08
397,z**9,颜色分类: 原装正品-2200W-胶原蛋白-9000万负离子,好评,还没开始用，看着质量还不错,-,-,2021-06-22
398,我**戴,颜色分类: 原装正品-2200W-胶原蛋白-9000万负离子,好评,风力很强，很够用，声音也不怎么大，满满的科技感，不比大品牌差，家用绰绰有余，很满意。 ,-,-,2021-06-20
399,止**香,颜色分类: 原装正品-2200W-胶原蛋白-9000万负离钛灰蓝,好评,吹出来的风还挺舒服的，吹风机的做工也很精致，价钱也不贵，家人用过都说好用，好用还好看，还说再买多一个 ,-,-,2021-06-17
400,有**弟,颜色分类: 原装正品-2200W-胶原蛋白-9000万负离子,好评,收到货几天了。感觉特别好用。👌这个外观很时尚，颜色好看，整个电吹风做的很精致，看着很舒服，洗头以后用这个电吹风很快就把头发吹干了个，吹完头发滑滑的！👍这个电吹风选择的特别满意！👏价格也实惠！ ,-,-,2021-05-25
401,缺**℡,颜色分类: 原装正品-2200W-胶原蛋白-9000万负离子,好评,超级喜欢，风挺大的，刚开始还有一点点香味,-,-,2021-06-25
402,安**5,颜色分类: 原装正品-2200W-胶原蛋白-9000万负离钛灰蓝,好评,风力还是大的，吹完头发也很顺！不错,-,-,2021-06-22
403,l**0,颜色分类: 原装正品-2200W-胶原蛋白-9000万负离钛灰蓝,好评,挺好的，声音不是特别大，头发易干，就是有一股特别浓的香味，不太习惯 ,-,-,2021-06-19
404,丶**哥,颜色分类: 原装正品-2200W-胶原蛋白-9000万负离子,好评,跟描述的是一样的，很显高档，物美价廉，要买的朋友可以下单噢！风力没有想象的那么大！！！,-,-,2021-06-20
405,m**城,颜色分类: 原装正品-2200W-胶原蛋白-9000万负离钛灰蓝,好评,非常棒的吹风机。风大但是舒服。,-,-,2021-06-25
406,雪**8,颜色分类: 原装正品-2200W-胶原蛋白-9000万负离钛灰蓝,好评,好看 喜欢 质量不错,-,-,2021-06-23
407,t**5,颜色分类: 原装正品-2200W-胶原蛋白-9000万负离子,好评,吹风机的款式真好看，颜值高呢😀，而且这个颜色显得好精致，用了几天，这个负离子效果真的好！有两款吹风头，个人爱了喜欢聚风的。风力也大，吹干很快，吹完头发还是很顺的。还有淡淡的香味。赞哦！❤️ ,之前在这家买过，用着很满意💕💕，这次搬新居刚好家再来买一个新款看看怎么样，很满意。买了这个吹风筒很喜欢哈哈哈，拿在手上的质感也非常的好。😍😍风力挺大的，吹没一会儿就干了，吹出来也挺柔顺的，是一个黑科技。👍👍👍,-,2021-06-19
408,天**乔,颜色分类: 原装正品-2200W-胶原蛋白-9000万负离子,好评,颜值超赞的一款吹风机，吹了感觉头发比较柔软，不会打结，机身不会重可是风挺大的，而且吹风机还带有一股香香的味道，价格来说真的值得,-,-,2021-06-12
409,无**5,颜色分类: 原装正品-2200W-胶原蛋白-9000万负离钛灰蓝,好评,物流快，质量好，风力大，太喜欢了 ,太好用了，一点噪音都没有，下次继续光顾这家,-,2021-06-20
410,w**2,颜色分类: 原装正品-2200W-胶原蛋白-9000万负离子,好评,做工精细   风力强劲   挺好的！,-,-,2021-06-21
411,s**3,颜色分类: 原装正品-2200W-胶原蛋白-9000万负离钛灰蓝,好评,吹风机很不错 物美价廉 ,-,-,2021-06-21
412,七**g,颜色分类: 原装正品-2200W-胶原蛋白-9000万负离子,好评,很不错一款吹风机！👍一个,-,-,2021-06-22
413,t**9,颜色分类: 原装正品-2200W-胶原蛋白-9000万负离钛灰蓝,好评,宝贝收到了，试用了一下，很不错。之间出了一些小问题，是我自己的问题，商家很贴心的解决了。祝商家生意兴隆，越做越好。 ,-,-,2021-06-20
414,芭**1,颜色分类: 原装正品-2200W-胶原蛋白-9000万负离子,好评,质量很好，吹完后头发也很柔顺，噪音也不大,-,-,2021-06-21
415,龙**儿,颜色分类: 原装正品-2200W-胶原蛋白-9000万负离子,好评,还不错呢，价廉物美！看着也比较大气而且好用 ,-,-,2021-06-23
416,t**0,颜色分类: 原装正品-2200W-胶原蛋白-9000万负离子,好评,用着真的很好，三个档   有股淡淡的香味👍,-,-,2021-06-24
417,似**居,颜色分类: 原装正品-2200W-胶原蛋白-9000万负离子,好评,颜值高，风量大，希望耐用。 ,-,-,2021-06-23
418,d**5,颜色分类: 原装正品-2200W-胶原蛋白-9000万负离钛灰蓝,好评,好用，风大，干得快，颜值高。 ,-,-,2021-06-02
419,h**h,颜色分类: 原装正品-2200W-胶原蛋白-9000万负离钛灰蓝,好评,非常好看，试用了一下，威力非常大,-,-,2021-06-19
420,齐**圣,颜色分类: 原装正品-2200W-胶原蛋白-9000万负离子,好评,这个是回购的了，之前自己买了一个，很好用，又买了一个送给妈妈👩🏻，风力够大，吹头发非常好速干还护发，温度适中，使用过程中比较舒服得劲儿，吹出头发很软，发质改善了很多，护发效果好，质量棒棒哒👍🏻❤️ ,质量没得说，挺好的，真的可以让头发非常的顺滑不毛躁，风力也很大，声音小，也可以自由切换冷热风，很快就可以吹干头发，最主要的是，吹头发是负离子的！,-,2021-05-22
421,t**6,颜色分类: 原装正品-2200W-胶原蛋白-9000万负离钛灰蓝,好评,质量不错，有一股淡淡的香味,-,-,2021-06-20
422,t**0,颜色分类: 原装正品-2200W-胶原蛋白-9000万负离子,好评,洗完澡用了，感觉非常好用，棒棒哒 ,-,-,2021-06-19
423,漂**0,颜色分类: 原装正品-2200W-胶原蛋白-9000万负离子,好评,孩子去学校用的，本来想这个价格也不会有太高要求，拿到以后发现很好，还有香香的味道,-,-,2021-06-16
424,丁**4,颜色分类: 原装正品-2200W-胶原蛋白-9000万负离子,好评,风很大，好用。 短头发很快就吹干了。,-,-,2021-06-22
425,卉**5,颜色分类: 原装正品-2200W-胶原蛋白-9000万负离子,好评,还可以，开始有淡淡的香味，声音也比较小，但是风力没想象中的大，一般吧,-,-,2021-06-23
426,l**8,颜色分类: 原装正品-2200W-胶原蛋白-9000万负离子,好评,非常满意风力很大,-,-,2021-06-23
427,t**9,颜色分类: 原装正品-2200W-胶原蛋白-9000万负离子,好评,吹着头发有股淡淡的香味,-,-,2021-06-20
428,t**5,颜色分类: 原装正品-2200W-胶原蛋白-9000万负离子,好评,颜值高， 好用。风力大 ,-,-,2021-06-19
429,t**2,颜色分类: 原装正品-2200W-胶原蛋白-9000万负离钛灰蓝,好评,宝贝收到了，不过寄到老家了给女儿买的。暂时不知质量如何。颜值挺高的。喜欢等问过家人如何再评论。给个好评吧,-,-,2021-06-23
430,风**9,颜色分类: 原装正品-2200W-胶原蛋白-9000万负离子,好评,非常好用，以后还会购买的 ,-,-,2021-06-20
431,王**9,颜色分类: 原装正品-2200W-胶原蛋白-9000万负离子,好评,好用，颜值高，头发吹出来香香的 ,-,-,2021-06-24
432,s**怡,颜色分类: 原装正品-2200W-胶原蛋白-9000万负离子,好评,试用过了，感觉还行，而且吹出来的风都是香的！,-,-,2021-06-23
433,叶**9,颜色分类: 原装正品-2200W-胶原蛋白-9000万负离钛灰蓝,好评,风力挺的，吹风机吹出的风香香的,-,-,2021-06-21
434,t**8,颜色分类: 原装正品-2200W-胶原蛋白-9000万负离钛灰蓝,好评,颜值很高的一款吹风机，物流也很快！ ,-,-,2021-06-17
435,彤**忘,颜色分类: 原装正品-2200W-胶原蛋白-9000万负离钛灰蓝,好评,这个吹风机小巧还好用，风吹起来也特别舒服，而且还没有什么噪音，吹完头发都是光滑的，发型不再乱糟糟的，我觉得价格不贵还好用，真心划算！店家发货速度快，物流也快，好评！ ,-,-,2021-06-20
436,夏**4,颜色分类: 原装正品-2200W-胶原蛋白-9000万负离子,好评,感觉挺不错的这个价钱很实惠，吹出来的风香香的，不知道是不是功效，总是很不错，颜值也高，喜欢喜欢 ,-,-,2021-06-19
437,哓**咪,颜色分类: 原装正品-2200W-胶原蛋白-9000万负离钛灰蓝,好评,风力足，吹发不伤发！ ,-,-,2021-06-22
438,凌**9,颜色分类: 原装正品-2200W-胶原蛋白-9000万负离钛灰蓝,好评,外形很好看，太热的时候会自动暂停，不错 ,-,-,2021-06-23
439,王**8,颜色分类: 原装正品-2200W-胶原蛋白-9000万负离钛灰蓝,好评,风力很大！推荐！ ,-,-,2021-06-26
440,我**叶,颜色分类: 原装正品-2200W-胶原蛋白-9000万负离子,好评,宝贝已收到，还是挺好用的。,-,-,2021-06-17
441,t**3,颜色分类: 原装正品-2200W-胶原蛋白-9000万负离子,好评,好，真的是好!不管你信不信就是好 ,-,-,2021-06-18
442,q**0,颜色分类: 原装正品-2200W-胶原蛋白-9000万负离钛灰蓝,好评,此用户没有填写评价。,这吹风机真的很垃圾，吹完头发，头发像草一样打结，真无语😓,-,2021-06-20
443,文**世,颜色分类: 原装正品-2200W-胶原蛋白-9000万负离子,好评,风筒样子比我想象🉐要大，不过吹头发很快就干了，对得起这个价格,-,-,2021-06-16
444,t**9,颜色分类: 原装正品-2200W-胶原蛋白-9000万负离钛灰蓝,好评,吹风收到了，好用,-,-,2021-06-20
445,嗯**边,颜色分类: 原装正品-2200W-胶原蛋白-9000万负离子,好评,吹风机收到了哦！外貌非常的高大上，外观简洁大方[色]，性价比非常好，就连吹出来的风都有淡淡的香味，风力比较大，长头发没一会就可以吹干，负离子不伤发质，🌴吹出来非常的柔顺，带有淡淡的清香，还配有负离子，🌺总的来说，非常喜欢， ,-,-,2021-05-16
446,泳**客,颜色分类: 原装正品-2200W-胶原蛋白-9000万负离子,好评,感觉还行。消音效果一般，制热可以，风量看声音就知道了，可以,-,-,2021-06-20
447,s**o,颜色分类: 原装正品-2200W-胶原蛋白-9000万负离钛灰蓝,好评,吹风机挺好的  价格不仅实惠划算  质量也很好,-,-,2021-06-12
448,t**1,颜色分类: 原装正品-2200W-胶原蛋白-9000万负离子,好评,用过最好用的吹风机，风大，吹的头发顺溜，不毛糙。,已经用了一段时间，非常好用！推荐给同事，都说好用！风大，吹的头发顺滑！,-,2021-06-09
449,j**5,颜色分类: 原装正品-2200W-胶原蛋白-9000万负离子,好评,外观材质：外观很好看，高端大气 护发功效：暂时没有发现 ,-,-,2021-06-20
450,t**2,颜色分类: 原装正品-2200W-胶原蛋白-9000万负离钛灰蓝,好评,声音很大,-,-,2021-06-23
451,f**现,颜色分类: 原装正品-2200W-胶原蛋白-9000万负离钛灰蓝,好评,风力很大 ,-,-,2021-06-24
452,败**1,颜色分类: 原装正品-2200W-胶原蛋白-9000万负离子,好评,拿在手里很有质感。用起来也挺好,-,-,2021-06-24
453,t**2,颜色分类: 原装正品-2200W-胶原蛋白-9000万负离子,好评,吹风机吹出来的风是香香的，吹完头发很顺，没有干燥的感觉，吹的时候声音也很小 ,-,-,2021-06-23
454,l**儿,颜色分类: 原装正品-2200W-胶原蛋白-9000万负离子,好评,颜值好看，风力也大，吹出来的风柔和，最主要的是，吹出来的风怎么是香的！！这个价位值了 ,-,-,2021-06-13
455,我**0,颜色分类: 原装正品-2200W-胶原蛋白-9000万负离子,好评,特别棒，真的不伤头发。,-,-,2021-06-22
456,翁**5,颜色分类: 原装正品-2200W-胶原蛋白-9000万负离子,好评,吹风机风力很大一会就可以吹干，吹出来的头发很丝滑🥰而且有护发效果，也不伤发真的太适合我这个发质不好的了！白色的颜值很高~🤩小小一个用起来很方便，出门带着也不占地方，整体很满意，让我很喜欢的一个吹风机 ,-,-,2021-05-15
457,m**a,颜色分类: 原装正品-2200W-胶原蛋白-9000万负离子,好评,外型乾淨俐落，風很強，好評！ ,-,-,2021-06-23
458,王**8,颜色分类: 原装正品-2200W-胶原蛋白-9000万负离钛灰蓝,好评,还有香味，真不错,-,-,2021-06-22
459,t**5,颜色分类: 原装正品-2200W-胶原蛋白-9000万负离子,好评,不错啊不错真的不错。吹完头发不枯燥。搭配一个精油都开始变得顺滑了！以前用的火吹风 擦了精油都不**管用。现在这个感觉真的不错。可以养护发质。风力也够 没有理发店风力大 但是比一般的家用吹风机要打。姐妹们可以买啊这么便宜的 ,-,-,2021-06-19
460,赵**8,颜色分类: 原装正品-2200W-胶原蛋白-9000万负离钛灰蓝,好评,颜值不错，很有质感，还没用。,-,-,2021-06-21
461,d**9,颜色分类: 原装正品-2200W-胶原蛋白-9000万负离子,好评,风力很大，吹出来香香的，质量挺好，不伤头发,-,-,2021-06-21
462,t**1,颜色分类: 原装正品-2200W-胶原蛋白-9000万负离子,好评,造型看上去还不错，按钮开关按起来不是很灵活要费很大劲，不知道以后用用会不会灵活一点。,-,-,2021-06-19
463,往**事,颜色分类: 原装正品-2200W-胶原蛋白-9000万负离子,好评,吹风机质量太好了，拿在手上高级感满满的。风力跟发廊一样，每次洗头好了都爱上吹头发了，可以造出我想要的型，声音很小，符合我的所有要求，优点多多，满意呢！这个真的太🉑了，🎁包装很精美，宝贝做工比较精细，商家特别好❤，有问题都及时处理👍，确实是一次相当满意的网购，还会再来的😘 ,-,-,2021-06-12
464,t**6,颜色分类: 原装正品-2200W-胶原蛋白-9000万负离子,好评,整体很满意！颜值和风力都很好！还有一股香味！,补图给大家参考！,-,2021-06-19
465,苏**呀,颜色分类: 原装正品-2200W-胶原蛋白-9000万负离钛灰蓝,好评,目前为止不错的，用了好几次了。,-,-,2021-06-26
466,t**4,颜色分类: 原装正品-2200W-胶原蛋白-9000万负离子,好评,好的我真的是太喜欢这个节目的啦我们都已经看到了这个节目了不是说什么都喜欢这个综艺版本还是很不错👌👍👍👍👌👍,-,-,2021-06-06
467,t**5,颜色分类: 原装正品-2200W-胶原蛋白-9000万负离子,好评,挺不错吹干也很快风也很大很香 ,-,-,2021-06-19
468,t**8,颜色分类: 原装正品-2200W-胶原蛋白-9000万负离子,好评,整体来说还是很不错的，店家服务态度很好，而且质量也很好，没有异味 ,-,-,2021-06-17
469,t**3,颜色分类: 原装正品-2200W-胶原蛋白-9000万负离钛灰蓝,好评,风力强，头发干的块，关键是这款吹风机颜值太高了,-,-,2021-06-20
470,大**w,颜色分类: 原装正品-2200W-胶原蛋白-9000万负离子,好评,目前用着还可以  以后在追评,-,-,2021-06-24
471,c**1,颜色分类: 原装正品-2200W-胶原蛋白-9000万负离钛灰蓝,好评,宝贝超级超级好用,-,-,2021-06-23
472,待**评,颜色分类: 原装正品-2200W-胶原蛋白-9000万负离子,好评,比较轻巧，噪音小，吹干可以，不适用于吹造型。 ,-,-,2021-06-22
473,t**0,颜色分类: 原装正品-2200W-胶原蛋白-9000万负离子,好评,收到了很好用，第三次买了，吹了头发有光泽柔顺不伤发，大爱,-,-,2021-06-19
474,t**8,颜色分类: 原装正品-2200W-胶原蛋白-9000万负离钛灰蓝,好评,外观材质：挺好的 风量大小：风力很大 ,-,-,2021-06-17
475,w**8,颜色分类: 原装正品-2200W-胶原蛋白-9000万负离子,好评,跟描述的是一样的，很显高档，物美价廉，要买的朋友可以下单噢！ ,-,-,2021-06-15
476,h**7,颜色分类: 原装正品-2200W-胶原蛋白-9000万负离子,好评,外观好看风量还行，希望用的时间能久一点。 ,-,-,2021-06-21
477,t**4,颜色分类: 原装正品-2200W-胶原蛋白-9000万负离钛灰蓝,好评,质量还可以，值得购买！,-,-,2021-06-26
478,l**s,颜色分类: 原装正品-2200W-胶原蛋白-9000万负离子,好评,宝贝挺好用的,-,-,2021-06-24
479,x**2,颜色分类: 原装正品-2200W-胶原蛋白-9000万负离钛灰蓝,好评,很好用的宝贝 ,-,-,2021-06-22
480,j**5,颜色分类: 原装正品-2200W-胶原蛋白-9000万负离钛灰蓝,好评,质量好，吹头发特别柔顺，非常满意一次购物，质量棒棒的，给五颗星好评,-,-,2021-06-20
481,t**3,颜色分类: 原装正品-2200W-胶原蛋白-9000万负离钛灰蓝,好评,不是说静音吗？今天收到货，晚上洗头了那吹，声音很大，很吵,-,-,2021-06-22
482,t**1,颜色分类: 原装正品-2200W-胶原蛋白-9000万负离子,好评,外观漂亮，风力很大，还有一股淡淡的香味 ,-,-,2021-06-10
483,t**1,颜色分类: 原装正品-2200W-胶原蛋白-9000万负离子,好评,挺好的，618活动很划算,-,-,2021-06-21
484,t**5,颜色分类: 原装正品-2200W-胶原蛋白-9000万负离子,好评,好用 一开始风感觉很小  没想到干的那么快 吹完头发也不那么炸毛 爱了,-,-,2021-06-19
485,s**5,颜色分类: 原装正品-2200W-胶原蛋白-9000万负离子,好评,和飞科的一起买的，准备把这款退了的，主要是不知道什么品牌，体验了发现有淡淡的香味，颜值也在线，就留下了～吹一会机器就会发烫.... 希望寿命长点吧,-,-,2021-06-21
486,清**子,颜色分类: 原装正品-2200W-胶原蛋白-9000万负离子,好评,声音不大，手感好，淡淡的香味，挺好用的。,-,-,2021-06-19
487,m**7,颜色分类: 原装正品-2200W-胶原蛋白-9000万负离钛灰蓝,好评,用过一次，还不错 ,-,-,2021-06-26
488,铃**丹,颜色分类: 原装正品-2200W-胶原蛋白-9000万负离钛灰蓝,好评,很满意的一次购物,-,-,2021-06-25
489,1**白,颜色分类: 原装正品-2200W-胶原蛋白-9000万负离钛灰蓝,好评,好用 刚开始用还有香味 小巧方便 风也合适 ,-,-,2021-06-19
490,y**2,颜色分类: 原装正品-2200W-胶原蛋白-9000万负离钛灰蓝,好评,货收到了，回来迫不及待试了下，真的挺好用的，性价比挺高的！,外观很漂亮，没有噪音，很愉快的一次购物,-,2021-06-18
491,0**0,颜色分类: 原装正品-2200W-胶原蛋白-9000万负离钛灰蓝,好评,风力可以，但是感觉制热还是欠缺了一点点，但是也够热了,-,-,2021-06-22
492,天**娃,颜色分类: 原装正品-2200W-胶原蛋白-9000万负离子,好评,声音是正常的 ，对小孩子来说声音有点大,-,-,2021-06-21
493,戒**3,颜色分类: 原装正品-2200W-胶原蛋白-9000万负离子,好评,好评返现这个东西。。真的。。。就普通吹风机阿，吹完头发该怎样还是怎样。。,-,-,2021-06-23
494,g**e,颜色分类: 原装正品-2200W-胶原蛋白-9000万负离钛灰蓝,好评,各方面还可以，主要声音不吵 ,-,-,2021-06-21
495,静**2,颜色分类: 原装正品-2200W-胶原蛋白-9000万负离钛灰蓝,好评,宝贝的颜值真高，用起来也比较方便，还有淡淡的香味，喜欢的宝宝可以入手哦,-,-,2021-06-14
496,l**o,颜色分类: 原装正品-2200W-胶原蛋白-9000万负离钛灰蓝,好评,特地试用了几天过来评价，这款吹风机颜值很赞，吹风噪音小，负离子修护头发发质，风力很大，短发1分钟就搞定，其他都不用说了，买了这款吹风机，我儿子也爱上这款吹风机了（以前洗完头从来不吹头发的） ,用了之后你会爱上这款吹风机的，吹出风的时候还带点香气。,-,2021-05-27
497,b**6,颜色分类: 原装正品-2200W-胶原蛋白-9000万负离子,好评,吹风机好用，噪音小，还有一股香味道,-,-,2021-06-23
498,福**8,颜色分类: 原装正品-2200W-胶原蛋白-9000万负离子,好评,用了一段时间，真好。,-,-,2021-06-23
499,t**8,颜色分类: 原装正品-2200W-胶原蛋白-9000万负离子,好评,"风力大吹干快，吹出来的造型效果好看 就很喜欢😘有护发效果,，外观设计很好看。我的发型是前不久才做的，配上吹筒真的有很好的保护效果🥳档位调节也都很合理！ ",-,-,2021-06-17
500,购**8,颜色分类: 原装正品-2200W-胶原蛋白-9000万负离子,好评,漂亮，喜欢。 ,-,-,2021-06-25
501,落**宇,颜色分类: 原装正品-2200W-胶原蛋白-9000万负离钛灰蓝,好评,风大，噪音还好 ,-,-,2021-06-24
502,t**5,颜色分类: 原装正品-2200W-胶原蛋白-9000万负离子,好评,还不错，可以的！,-,-,2021-06-19
503,t**颜,颜色分类: 原装正品-2200W-胶原蛋白-9000万负离子,好评,可以 风很大,-,-,2021-06-22
504,晚**歆,颜色分类: 原装正品-2200W-胶原蛋白-9000万负离子,好评,用了两三次，功率很大。吹的很快，还有香味。目前感觉还不错 ,-,-,2021-06-19
505,张**e,颜色分类: 原装正品-2200W-胶原蛋白-9000万负离子,好评,真的很不错，风力很大，吹出的冯香香的味道！,-,-,2021-06-20
