131,晨**9,颜色分类: 星空灰,好评,性价比高，就是燥声大了点。 ,-,-,2021-06-22
132,l**0,颜色分类: 星空灰,好评,噪音太大,-,-,2021-06-15
133,耗**4,颜色分类: 星空灰,好评,从里到外都挺好，也没什么噪音 有买来听得到嗡嗡响的，是冰箱门上的储物格共振了，挨个活动活动就好。  ,-,-,2021-06-08
134,张**4,颜色分类: 星空灰,好评,太好了，无论质量还是细节都很满意。  ,-,-,2021-06-06
135,天**坡,颜色分类: 星空灰,好评,空间很大，物美价廉。,-,-,2021-06-11
136,婵**麻,颜色分类: 星空灰,好评,送货服务：一般般 外观材质：感觉还不错，买给父母用的 ,-,-,2021-06-04
137,h**4,颜色分类: 星空灰,好评,好不好用还不知道，但冰箱漂亮，我喜欢……服务也好，送货上门,-,-,2021-06-02
138,t**1,颜色分类: 星空灰,好评,很不错呢 价格也很划算 值得购买,-,-,2021-06-02
139,毅**天,颜色分类: 星空灰,好评,安排及时，服务非常满意！,-,-,2021-06-11
140,h**i,颜色分类: 星空灰,好评,此用户没有填写评价。,难用至极！ 千万别买，调个温度，又是让你下APP又是要连接wifi，年轻人都不一定能弄好，更别说老人。云米从此一生黑，再也不会买。,-,2021-06-05
141,我**琪,颜色分类: 星空灰,好评,这冰箱太差了 声音特别大 还不给退货 售后态度特别差 上门去看 就照了张照片 就说 没*** 我还找他 她们就说自己找技术监督局,-,-,2021-06-14
142,叶**琪,颜色分类: 星空灰,好评,此用户没有填写评价。,挺好的，非常实用，价格也合理，送物流师傅很不错,-,2021-06-03
143,蒲**n,颜色分类: 星空灰,好评,不错，蛮大的哦,-,-,2021-06-11
144,炎**0,颜色分类: 星空灰,好评,送货服务：感恩送货小哥，服务很好，很耐心热心 外观材质：待通电中，看起来很不错，期待 ,-,-,2021-06-05
145,t**6,颜色分类: 星空灰,好评,挺不错的，值得大家去购买！,-,-,2021-06-23
146,t**6,颜色分类: 星光金,好评,服务很好，冰箱很漂亮,-,-,2021-06-23
147,f**8,颜色分类: 星空灰,好评,外观材质：好 冰箱容量：好看 制冷效果：不知道 ,-,-,2021-06-08
148,白**4,颜色分类: 星空灰,好评,很不错，卖家很细心，送货很快，希望后期用上没问题，以后还会回头的 ,-,-,2021-06-02
149,爱**1,颜色分类: 星空灰,好评,此用户没有填写评价。,质量很好，已使用过一段时间了，没出现什么问题。,-,2021-06-03
150,快**y,颜色分类: 星空灰,好评,好用，又便宜，值得购买,便宜又好用，又省电，在实体店买很贵，很值得购买,-,2021-06-01
151,c**0,颜色分类: 星空灰,好评,买了2天，才收到就降价了，质量也很差，涂层一点质感都没有~客服讲话乱七八糟，回复也不清晰，理解能力差，业务不熟悉,便宜好用，可以存放很多东西，也比较安静,-,2021-06-16
152,郑**2,颜色分类: 星空灰,好评,送货服务：送货速度快也会送上门也会帮忙拆包装服务态度很好 外观材质：个人感觉材质非常好，外观也很漂亮，颜值是绝对过关的 冰箱容量：这个容量够大，是我想要的，绝对物有所值 制冷效果：还未插上电源测试，期待我后面的评论 ,-,-,2021-06-06
153,z**4,颜色分类: 星空灰,好评,大气，上档次 ,-,-,2021-05-28
154,她**哥,颜色分类: 星空灰,好评,两侧的什么管发烫很严重，烫伤的程度了，有点儿夸张，而且好像很容易带静电，电手,-,-,2021-06-19
155,逛**2,颜色分类: 星光金,好评,宝贝已收到漂亮棒棒的,很满意,-,2021-04-20
156,曹**魁,颜色分类: 星光金,好评,此用户没有填写评价。,冰箱不错，很好👌,-,2021-05-26
157,d**2,颜色分类: 星空灰,好评,送货服务：服务好 外观材质：很好 冰箱容量：够用够大 制冷效果：很好 ,-,-,2021-06-03
158,林**1,颜色分类: 星空灰,好评,什么垃圾 都安装不了 全是借口 都安装不了你卖什么东西 ？一会这了一会呢了 合着包安装我不花钱 都不会装  ,-,-,2021-06-19
159,m**s,颜色分类: 星空灰,好评,感觉噪音不算太大，能接受。省电也是和功率挂钩的，够用。,-,-,2021-06-19
160,若**头,颜色分类: 星空灰,好评,真的很好用，我自己用了，送给爸妈，婆婆一家一台,-,-,2021-06-03
161,t**4,颜色分类: 星空灰,好评,送货服务：非常好，便宜真的很好用，而且没有声音，特别好用的冰箱 ,-,-,2021-06-05
162,j**4,颜色分类: 星空灰,好评,挺不错，可以跟橱柜一样深。 ,-,-,2021-06-04
163,k**2,颜色分类: 星空灰,好评,送货服务：司机师傅特别热情十分周到 还提醒静置 外观材质：不到两千就可以买到这样的冰箱 很划算 冰箱容量：冰箱很大 设计很合理  制冷效果：还在静置中 随后会追评 ,-,-,2021-05-24
164,a**8,颜色分类: 星空灰,好评,送货师傅人很好，冰箱还没有开，要放到明天可以插电。 ,-,-,2021-06-07
165,滕**作,颜色分类: 星空灰,好评,很喜欢云米的电器，很大气，外观好看，简洁，不错，朋友推荐来的，互联网时代的好产品，已经连接wifi了，好用，唯一美中不足的就是没有显示屏，不太好，希望下次出个升级版，带显示屏的比较好 ,-,-,2021-05-17
166,m**7,颜色分类: 星空灰,好评,高端大气上档次。实惠，送货及时。 ,-,-,2021-06-03
167,李**葆,颜色分类: 星光金,好评,很大，很高级。里面的垫台是玻璃的担心以后质量问题。不过我相信小米品牌，小子正在打市场，所以它的用料和服务都是非常棒的。尤其是性价比，很高，再加上售后和客服的优质服务，让我很放心。而且10年保修。很赞,-,-,2021-05-12
168,l**k,颜色分类: 星空灰,好评,用了几天才来评价，真心觉得不错，小米的忠粉,-,-,2021-06-09
169,梁***,颜色分类: 星空灰,好评,质量不错，物流也很比较快，尺寸刚刚好，功能很不错 ,-,-,2021-06-02
170,百**业,颜色分类: 星空灰,好评,冰箱收到 送货师傅态度很好 目前新房装修还未使用 等后续去追评 ,-,-,2021-06-06
171,康**宇,颜色分类: 星空灰,好评,东西很好，物流小哥也尽职尽责，推荐大家购买，好评哦(*^▽^)/★*☆,-,-,2021-06-05
172,一**0,颜色分类: 星空灰,好评,还可以，等待后续使用,-,-,2021-06-17
173,a**0,颜色分类: 星光金,好评,颜色外观很大气，家里留的位置放下刚刚好。冰箱容量很大，性价比很高 ,-,-,2021-06-20
174,t**1,颜色分类: 星空灰,好评,送货服务：挺快的 外观材质：还不错 挺舒服 冰箱容量：挺大 但布局感觉还能优化。 制冷效果：刚送来静止了8小时通电开机z 刚开机回声音比较大，但运行稳定后声音很小。 ,-,-,2021-05-16
175,a**3,颜色分类: 星光金,好评,非常喜欢云米冰箱，高端大气，然后制冷效果非常棒。下次我还要买洗衣机还会再来回购其它系列产品。,-,-,2021-05-23
176,归**偌,颜色分类: 星空灰,好评,大小合适，很满意！,-,-,2021-06-08
177,s**2,颜色分类: 星空灰,好评,送货服务：送货快，服务好 外观材质：非常满意 冰箱容量：400多升相当满意 制冷效果：嘎嘎棒 ,-,-,2021-06-01
178,祈**折,颜色分类: 星空灰,好评,物流真的是太垃圾了，看冰箱太重了不愿意送，打电话不接，发信息不回,-,-,2021-06-16
179,t**8,颜色分类: 星空灰,好评,噪音大，其他的还好 ,-,-,2021-06-16
180,w**5,颜色分类: 星光金,好评,冰箱容量：跟想象的刚刚好颜色也行 制冷效果：效果可以，客服很有耐心 ,-,-,2021-05-13
181,岳**8,颜色分类: 星空灰,好评,送货服务：速度很快 外观材质：很美观 冰箱容量：大 制冷效果：好 ,-,-,2021-06-06
182,小**6,颜色分类: 星空灰,好评,买了送人的，挺好的,-,-,2021-06-05
183,a**8,颜色分类: 星光金,好评,此用户没有填写评价。,售后服务很好,-,2021-05-28
184,李**2,颜色分类: 星空灰,好评,非常不错,-,-,2021-05-28
185,y**1,颜色分类: 星空灰,好评,第三次买云米冰箱了，自己买一个，推荐朋友也买，性价比超高的冰箱，容量大，噪音小，推荐购买。,-,-,2021-05-25
186,股**囊,颜色分类: 星空灰,好评,云米的这款冰箱没得说，性价比超高！颜值高，效果好，风冷冰箱这个价位简直无敌！,-,-,2021-05-20
187,我**7,颜色分类: 星空灰,好评,冰箱压缩机工作频率高，机箱过热，噪音大。 优点：制冷迅速效果明显，冷藏温度适宜。储存空间很大，能装。外观大气颜色漂亮。,-,-,2021-05-24
188,t**7,颜色分类: 星空灰,好评,很大气，送货服务态度也好，点赞！,-,-,2021-06-22
189,1**r,颜色分类: 星空灰,好评,送货服务：快 外观材质：外观不错 冰箱容量：容量大 制冷效果：非常好！ ,-,-,2021-06-06
190,雷**丹,颜色分类: 星空灰,好评,谢谢小哥帮我运上来，好评！ ,-,-,2021-06-03
191,z**6,颜色分类: 星空灰,好评,送货服务：送货人员服务态度很好 ,-,-,2021-06-03
192,x**3,颜色分类: 星空灰,好评,送货师傅非常敬业，老房子还抬上去，谢谢🙏 ,-,-,2021-06-03
193,伟**6,颜色分类: 星空灰,好评,物流很快，性价比很高 ,-,-,2021-06-06
194,乐**2,颜色分类: 星空灰,好评,冰箱收到了，很好,-,-,2021-06-05
195,y**3,颜色分类: 星空灰,好评,替换了家里的老冰箱，几年前买过一台云米冰箱，效果很棒，毋庸置疑，好评  ,-,-,2021-05-26
196,李**0,颜色分类: 星光金,好评,云米的冰箱确实很好，我家用的云米，这次给妈妈也买个，一如既往的好！,-,-,2021-05-14
197,我**花,颜色分类: 星光金,好评,东西很不错，价格也实惠。售后客服耐心教导讲解。,-,-,2021-05-14
198,快**人,颜色分类: 星空灰,好评,性价比高，质量好，快递快。,-,-,2021-06-06
199,宝**5,颜色分类: 星光金,好评,第三次购买云米冰箱了，自己家和老人家里用的都是云米的冰箱，性价比高，使用方便。 ,-,-,2021-05-14
200,t**0,颜色分类: 星空灰,好评,家里买了小米这个冰箱，大小刚好，还能手机上操作，空间很够用,-,-,2021-06-14
201,a**e,颜色分类: 星空灰,好评,非常靠谱 值得推荐 家里是第二台小米冰箱，一如既往的支持依赖,-,-,2021-05-20
202,梦**菡,颜色分类: 星空灰,好评,性价比没的说，空间布局合理，外观大气漂亮，物流态度好,-,-,2021-05-11
203,游**9,颜色分类: 星空灰,好评,物流快，直接送货上楼，，服务好,-,-,2021-06-05
204,蜗**7,颜色分类: 星光金,好评,价格实惠，相当不错的，耗电也还蛮好，,-,-,2021-05-21
205,脱**光,颜色分类: 星光金,好评,老妈非常喜欢！空间很大！性价比高！！强烈推荐购买！！！,-,-,2021-05-10
206,橙**g,颜色分类: 星空灰,好评,快递很负责任 送货上门 冰箱不错 总体还是不错的 智能加分  ,-,-,2021-05-17
207,l**o,颜色分类: 星空灰,好评,此用户没有填写评价。,说实话这个冰箱不好。 声音太大了。吵得睡觉都睡不好。真的很差。还是要买专业做冰箱的牌子稳当。,-,2021-06-22
208,h**u,颜色分类: 星空灰,好评,第二天就送来了，空间够大，性价比挺高！ ,-,-,2021-05-13
209,博**3,颜色分类: 星光金,好评,摆放空间很满意安装师傅也很热情物流速度也很快非常的满意,-,-,2021-05-11
210,h**m,颜色分类: 星光金,好评,外觀漂亮上檔次性價比高，下次還會光顧云米,-,-,2021-05-23
211,波**5,颜色分类: 星空灰,好评,美观大方很不错的没有噪声，值得购买祝老板生意兴隆！就是配送服务有点差,宝贝不错，美观大方，声音很小值得购买,简单的日子就像一杯芳香的茶，越品就会越有味道，好品质的宝贝都会在时间的验证下证明它独特的价值。相信我们的宝贝不会让亲爱的失望。云米官方旗舰店祝您及您的家人生活愉快，健康生活每一天！,2021-05-13
212,m**d,颜色分类: 星空灰,好评,好评，物流也很快！ ,-,-,2021-06-19
213,慕**1,颜色分类: 星光金,好评,颜值和容量非常高，而且售后服务很到位，值得入手 送货服务：非常快 ,-,-,2021-05-24
214,m**d,颜色分类: 星空灰,好评,颜色很正，质量很好，空间大，非常喜欢。,-,-,2021-05-14
215,顾**路,颜色分类: 星空灰,好评,空间很大，制冷效果刚刚的，很好，送货上门,-,-,2021-05-20
216,小**8,颜色分类: 星光金,好评,空间很大 非常实用 操作简单 值得购买 ,-,-,2021-05-10
217,f**8,颜色分类: 星光金,好评,留的位置刚刚好，容量大，很实用，非常喜欢，送货很快,-,-,2021-05-19
218,f**9,颜色分类: 星空灰,好评,外观样子都差不多，价位也合理。做工还可以期待使用效果,师傅耐心讲解，机器不错，好评！！！,-,2021-05-20
219,t**3,颜色分类: 星空灰,好评,宝贝很好，纤薄机身，空间利用率很高。颜值担当，容量大。,-,-,2021-06-25
220,洋**森,颜色分类: 星空灰,好评,外观好看，内空也特别大，服务态度很好，有任何问题，都有专业人员上门服务。 ,-,-,2021-05-20
221,神**s,颜色分类: 星空灰,好评,送货服务：原本感觉送货进度慢，但看到送货师傅人力搬到6楼，感到送货上门不易。 ,-,-,2021-06-08
222,s**生,颜色分类: 星光金,好评,性价比很高，冰箱很大一个，很满意 ,-,-,2021-05-10
223,贝**9,颜色分类: 星空灰,好评,冰箱大气、通完电运行正常、声音小，非常不错，性价比高！ ,-,-,2021-05-24
224,恒**0,颜色分类: 星光金,好评,送货速度很快，性价比很高，客服回复快，满意一次购物 ,-,-,2021-05-25
225,t**3,颜色分类: 星光金,好评,快递服务特别周到细致，用了再来评价 ,-,-,2021-06-25
226,蒋**3,颜色分类: 星空灰,好评,非常喜欢，我很满意，还自动控制 ,空间很大，用起很好用，价格很优惠,每一个笑容，都定格在那个相遇与回眸中，如果交易是一种方式，那么友谊才是真正的永恒，当您收到心爱的宝贝，欣慰的同时，我们也在由衷的高兴，您的赞美，您的好评，让我们深深的感动，祝您开心每一天！,2021-05-22
227,潘**妍,颜色分类: 星空灰,好评,此用户没有填写评价。,大家不要买，冰箱有问题的，买了还不能退款。,-,2021-06-07
228,江**0,颜色分类: 星空灰,好评,还是很不错的，空间很大 ,-,-,2021-05-16
229,a**1,颜色分类: 星空灰,好评,送货服务：感觉东西还不错，先用着看看。 ,-,-,2021-06-06
230,两**号,颜色分类: 星光金,好评,此用户没有填写评价。,整体来说还不错，就是有时候门打不开，吸住了，怎么都拉不开，过一会又好了，就很恼火,-,2021-05-05
231,小**伪,颜色分类: 星光金,好评,送货服务：送货速度快，快递员的服务素质高，派送前会提前电话通知 外观材质：外观高端大气上档次，是我最喜欢的颜色 冰箱容量：容量大，冷冻冷藏都能放很多的东西了 制冷效果：制冷速度快，食材保鲜好  ,-,-,2021-05-20
232,k**n,颜色分类: 星空灰,好评,好 ,-,-,2021-05-13
233,俊**2,颜色分类: 星空灰,好评,整体来说冰箱还不错，这个价位买这样的冰箱很好了。 ,-,-,2021-05-19
234,玖**志,颜色分类: 星空灰,好评,电器异响，运营噪音太大。差评！跟客服沟通回复“插过电就叫使用过，影响二次销售不给退货”。瞎扯！电器产品不插电我咋知道能不能用。这个售后服务逻辑太扯了。说是退货包邮，又要我自己承担邮费，申请两次无理由退货退款，驳回两次。最后关闭退款退货申请通道。,-,-,2021-05-24
235,刘**i,颜色分类: 星光金,好评,送货服务：非常好 外观材质：很不错 冰箱容量：非常的大 制冷效果：特别的好 ,-,-,2021-05-22
236,海**览,颜色分类: 星空灰,好评,值得购买，性价比高,-,-,2021-05-23
237,烨**0,颜色分类: 星空灰,好评,刚刚送到，还可以，还没插电，等用一段时间之后再来评价,-,-,2021-06-10
238,w**0,颜色分类: 星空灰,好评,不错，空间大，价格合适,-,-,2021-05-19
239,d**9,颜色分类: 星光金,好评,此用户没有填写评价。,冰箱声音特别大，影响睡眠，客服售后不管，都让自己联系！！！下次再也不会来了。,-,2021-05-10
240,t**2,颜色分类: 星空灰,好评,送货服务：送货上门，服务态度非常好 外观材质：外观设计非常好 冰箱容量：冰箱容量大， 制冷效果：制冷效果好，声音轻 ,-,-,2021-05-20
241,心**星,颜色分类: 星光金,好评,送货服务：送货上门 外观材质：很漂亮 冰箱容量：2人足够了 制冷效果：尚未使用，相信品质！ ,-,-,2021-05-21
242,j**9,颜色分类: 星空灰,好评,太神速了，明天下午买，今天上午就送到，赞一个,-,-,2021-05-11
243,t**7,颜色分类: 星空灰,好评,声音很大像火车,-,-,2021-06-22
244,何**o,颜色分类: 星光金,好评,够大人都可以躲进去，还没放东西进去，简单插电试了一下，里面还有两个风冷口，这个位置冰啤酒肯定快。冰了东西再来追评和大家分享。 ,-,-,2021-05-07
245,大**9,颜色分类: 星空灰,好评,非常高大上,-,-,2021-05-11
246,世**4,颜色分类: 星空灰,好评,声音太大太大了，,-,-,2021-06-13
247,涛**v,颜色分类: 星空灰,好评,服务太差,-,-,2021-06-13
248,强**3,颜色分类: 星光金,好评,冰箱刚收到，外观漂亮大气，这个价格已经跟实惠了,-,-,2021-05-03
249,王**1,颜色分类: 星空灰,好评,物流师傅很好👍,-,-,2021-05-13
250,l**8,颜色分类: 星空灰,好评,细节不到位啊，声音有点大，毕竟便宜啊凑合吧，评论有赠送 ,-,-,2021-06-04
251,淘**货,颜色分类: 星空灰,好评,送货服务：好 冰箱容量：满意 外观材质：好 制冷效果：暂时还没使用。 ,-,-,2021-05-27
252,a**9,颜色分类: 星光金,好评,挺牛*这冰箱，噪音小 还省电，挺实用，底下是轱辘的来回动非常方便，固定的时候一拧那个小玩意就OK了，价格还不高，啥功能几乎都有，商家挺良心，放心购买吧,-,-,2021-05-02
253,思**嘴,颜色分类: 星光金,好评,此用户没有填写评价。,冰箱到货的时候少了一个冷藏置物架，联系客服多次都是反馈反馈再反馈，15天又15天的，一直不给发货。强调过并不是赠品，这办事效率，真不敢想象冰箱要是坏了这维修效率能气**。,-,2021-05-26
254,f**3,颜色分类: 星光金,好评,送货服务：好  外观材质：漂亮 冰箱容量：大容量 制冷效果：非常快 ,-,-,2021-05-19
255,叫**哥,颜色分类: 星空灰,好评,冰箱内布局不合理，层板很短放不到东西，发热与声响严重，使用感觉很差 ,-,-,2021-05-31
256,t**2,颜色分类: 星空灰,好评,"送货師傅專业,商家老实,大力支持。",-,-,2021-05-27
257,俞**2,颜色分类: 星空灰,好评,东西是真的很一般 机子打开的绝缘体边很烫手 客服处理问题一直都是机器人在的多数 总之是很差的一种体验吧 不建议购买 退货很麻烦 ,-,-,2021-05-28
258,丑**3,颜色分类: 星空灰,好评,此用户没有填写评价。,宝贝很好,-,2021-05-21
259,x**1,颜色分类: 星光金,好评,冰箱不错，大小真合适，手机控温也挺好的 ,-,-,2021-05-09
260,k**n,颜色分类: 星光金,好评,买的是金色的，结果给发个灰色的,-,-,2021-05-26
261,q**9,颜色分类: 星光金,好评,冰箱很给力。很漂亮。 ,-,-,2021-04-27
262,z**2,颜色分类: 星光金,好评,送货很快 冰箱很大气 不错👍,-,-,2021-05-09
263,t**0,颜色分类: 星光金,好评,一如既往的好，价格实惠，朋友看到我买的好用，他也让我帮他买了一个。 ,-,-,2021-06-14
264,邬**刚,颜色分类: 星空灰,好评,建议大家别买，声音太大了，吵的晚上都睡不着，压缩机一直响。,很大声音，大家别买,-,2021-06-02
265,z**5,颜色分类: 星光金,好评,收到了。宝贝不错 ,-,-,2021-05-05
266,西**妈,颜色分类: 星空灰,好评,说送货上门，楼道上不去，雇升降机我自己出钱，卖家一分不出，讲好是五楼以下送货上门。从网上购物十几年了，头一回这么生气，从头午十点到下午才弄到家，嗓子都发炎了。,-,-,2021-05-24
267,浮**玲,颜色分类: 星光金,好评,此用户没有填写评价。,质量一般，手机APP无法连接，打电话找的售后，售后小哥来打开机器的主板还原后，才能连接,-,2021-05-24
268,风**破,颜色分类: 星空灰,好评,这些售后一点都不专业，问问题又要转这个又要转那个，下次不会了,-,-,2021-06-03
269,粉**4,颜色分类: 星空灰,好评,此用户没有填写评价。,六一早上买的冰箱，晚上到的，第二天插上电感觉声音响，还连接不到WIFI,-,2021-06-01
270,t**1,颜色分类: 星光金,好评,非常好，二次购买，本人很喜欢 ,-,-,2021-05-09
271,r**m,颜色分类: 星空灰,好评,完全不行，千萬別買 。,-,-,2021-05-27
272,l**3,颜色分类: 星空灰,好评,差的很 制冰不起来 吵得很 ,-,-,2021-06-01
273,b**龙,颜色分类: 星空灰,好评,正常使用，就是噪音大 ,-,-,2021-06-01
274,媛**笔,颜色分类: 星光金,好评,制冷效果：好 外观材质：美观 冰箱容量：大 ,-,-,2021-04-27
275,晓**哒,颜色分类: 星光金,好评,送货服务：快 外观材质：很高级 冰箱容量：还蛮大的 制冷效果：很好 ,-,-,2021-04-29
276,向**吉,颜色分类: 星光金,好评,此用户没有填写评价。,物流满意,-,2021-04-29
277,m**2,颜色分类: 星光金,好评,此用户没有填写评价。,烦*了，从安装插电开始，不停嗡嗡嗡的响，调了高度也不行，消停一会儿，过一会还是继续响，特别大声。第一次打电话叫人来维修，当时师傅来的时候，刚好不响了。第二天上午又开始响，发给师傅，师傅也不回复，无奈只能打云米客服电话，说给我安排了，现在三天了师傅还是没来，那么大件又不好退货，真的太差了，服务态度也烂,-,2021-03-30
278,a**夭,颜色分类: 星光金,好评,此用户没有填写评价。,4.9号买的，5.16号就破了，冰箱里面发烫，好嘛，大夏天的里面的肉啊，海鲜啊都臭了，还是我自己催的售后来修，修不好，一个月就破了严重怀疑质量问题，要求换机，过了三天，总算拉走了，我问问客服什么时候送新的来，还问我冰箱拉走没，你们自己售后拉不拉走没点数吗，夏天没个冰箱多不方便，冰的里面的牛肉海鲜猪肉都臭了，不快点解决问题，还一个劲和我说反馈给专业客服，大家买东西谨慎吧,-,2021-04-27
279,沉**3,颜色分类: 星光金,好评,购买体验一般，说说我的体验，挺失望的一次购物体验，本身我购买的显示是星空金，下面晒图里面也都是星空金，结果到来一看是灰色，而且货到以后手机app怎么也连接不上，整的没办法调整温度，没办法只能找商家呢，结果商家告诉我一个全国售后地那话就把我打发了，打售后电话又让我关注官方微信找客服，没办法又只能添加微信召唤人工客服，我找人工客服找了3次历时4天左右就因为连接不上手机app的问题沟通不下来，每次找客服都问我亲您有什么问题呢，我真不知道原来我反应的问题你们到底用没用心呢，本身一个小小的问题折腾了一个礼拜解决不了，后来还是我说的再不给解决就退货，客服才勉强联系售后上门维修，说是一个配件需要拆开弄一下，那请问我新买的冰箱就出现这个问题吗？这种体验别说推荐给别人了，我自己都不会在购买这个品牌了，说实话这个价位还不如买牌海尔格力的好，最起码真有售后一点电话就能到，生的这么折腾,-,-,2021-05-11
280,k**p,颜色分类: 星空灰,好评,此用户没有填写评价。,空间超级大感觉能站一下一个人，而且非常的薄是最薄的，我见到过的就是完全没有按钮，不适合老年人用是需要手机的。,-,2021-05-13
281,1**p,颜色分类: 星光金,好评,试用两天来评价。外观漂亮，制冷非常快。亲试冷冻350毫升水2小时结冰，且无噪音。物流提前电话告知。送货小师傅服务好。提示各种注意事项。,-,-,2021-03-27
282,t**2,颜色分类: 星空灰,好评,商家态度不好，新冰箱有问题，不给退，还让我找人报修坚定，保护膜都没有，客服也没给出解释。冰箱顶部有膜的痕迹。第一个客服跟我说通电也算新机，让我通电试验几天。有问题可以退，第二个客服后来跟我说通电之后不能退，前后矛盾，我想问商家家电不通电我怎么知道产品有没有问题。难道我看外边就能看出有没有问题，通电之后发现问题只能我们自己吃哑巴亏吗，首次退货包运费也是骗人的，店大欺客。但是这次对云米很是失望。对商家很失望，买家永远是弱小的，有问题都不能退。,-,-,2021-05-14
