283,w**1,颜色分类: 星光金,好评,外观可以，里面空间感觉两边各再加一个抽屉才比较实用，通电不启动时没什么声音，一启动给我吓一跳。启动频繁，声音较大，比较费电。 制冷速度比较快，效果比较好。 正式投运才一周。 以观后效。。。 ,-,-,2021-04-10
284,奔**5,颜色分类: 星光金,好评,不错  和介绍的一样  很喜欢,-,-,2021-03-17
285,a**5,颜色分类: 星空灰,好评,此用户没有填写评价。,大家别被骗   特别不好   刚用两天冷冻室结冰严重  一直嗡嗡响  压缩机不停机  卖家不管不顾  都是套路,-,2021-05-16
286,t**9,颜色分类: 星光金,好评,"测试使用中，噪音偶尔比较大！优点是容量大；缺点是隔板有点短,抽屉少，分类存储不方便，机身无控温面板，冷冻温度调节范围较小!望改进！",-,-,2021-06-23
287,z**8,颜色分类: 星光金,好评,给父母买的，挺好用的,-,-,2021-04-07
288,l**3,颜色分类: 星光金,好评,非常好，服务也很周到，米家的就是好 ,-,-,2021-03-18
289,天**0,颜色分类: 星空灰,好评,大意了，这款冰箱门板没有显屏板的用不了手动调节工能的！,-,-,2021-05-14
290,幸**1,颜色分类: 星光金,好评,冰箱收到了，外观很漂亮，制冷效果很好 ,-,-,2021-03-17
291,t**8,颜色分类: 星空灰,好评,服务不行！ ,-,-,2021-05-17
292,z**3,颜色分类: 星光金,好评,用了后，来评价，冰箱确实很好，商家服务态度也很好，会介绍朋友来买的,-,-,2021-06-21
293,l**5,颜色分类: 星光金,好评,朋友推荐的，实惠,-,-,2021-03-29
294,w**x,颜色分类: 星光金,好评,好用，又实惠，懂的人白知道,-,-,2021-03-23
295,t**2,颜色分类: 星光金,好评,外观漂亮，比较大，送货快服务好。,-,-,2021-03-18
296,绚**椒,颜色分类: 星光金,好评,此用户没有填写评价。,没有一个月就坏了。。客服态度恶劣。,-,2021-04-21
297,c**0,颜色分类: 星空灰,好评,还行，就是声音有点大,-,-,2021-05-23
298,1**j,颜色分类: 星光金,好评,冰箱不错，空间很大,-,-,2021-03-24
299,李**6,颜色分类: 星光金,好评,此用户没有填写评价。,声音太大,-,2021-03-23
300,b**3,颜色分类: 星光金,好评,物美价廉，发货快。,-,-,2021-03-18
301,t**6,颜色分类: 星光金,好评,此用户没有填写评价。,屏幕设置不了冷冻调节，联网不好使，冰箱声音太大，好像拖拉机一样，实在受不了，看看售后怎么解决吧,-,2021-06-23
302,h**g,颜色分类: 星光金,好评,多次购买，够大，够漂亮。 ,-,-,2021-02-12
303,t**3,颜色分类: 星光金,好评,好看实用值得， ,-,-,2021-06-25
304,1**吴,颜色分类: 星光金,好评,第一天拍的，第二天就送到了，客服也很耐心，噪音很小，性价比很高，非常不错的一次购物体验,-,-,2021-03-16
305,t**4,颜色分类: 星光金,好评,非常不到位，买回来和图片是两款，颜色也和图片不同，不知道这个商家是怎么搞的。这么大的冰箱拆了包装叫我怎么退，也没有后续服务，一个字：差……,-,-,2021-06-05
306,飞**3,颜色分类: 星光金,好评,不错不错。用段时间在追评,-,-,2021-03-07
307,脾**9,颜色分类: 星光金,好评,棒棒哒支持,-,-,2021-02-22
308,c**y,颜色分类: 星光金,好评,又大有好看，关键是价格实惠,-,-,2021-03-11
309,孙**6,颜色分类: 星光金,好评,发货很快 ，送货上门，质量一如既往地好，第二次买了，物美价廉，想买的小伙伴赶紧行动吧！,-,-,2021-03-09
310,哼**歌,颜色分类: 星光金,好评,买第二个了，很好用，和我买的6千多冰箱功能差不多。 ,-,-,2021-03-11
311,f**8,颜色分类: 星光金,好评,下单星光金，送来个星空灰   ,千万不要买，冰箱吵的要命，也连不上手机温度也调不了，售后服务也是敷衍,-,2021-04-24
312,a**6,颜色分类: 星光金,好评,特别好，已经第三次购买了。我就不拍图片了，买就对了,-,-,2021-03-02
313,爱**1,颜色分类: 星光金,好评,服务非常满意🈵不是第一次购买了 非常值得购买,-,-,2021-03-09
314,a**8,颜色分类: 星光金,好评,非常好看，性价比OK,-,-,2021-03-01
315,z**8,颜色分类: 星光金,好评,简单大方 很实用 用了几天挺好的 ,-,-,2021-03-11
316,t**9,颜色分类: 星光金,好评,挺好的 声音也是有 能接受 ,-,-,2021-06-23
317,l**8,颜色分类: 星光金,好评,实惠好用，性价比高 ,-,-,2021-03-05
318,小**网,颜色分类: 星光金,好评,噪音大，其他还可以吧,-,-,2021-04-30
319,人**5,颜色分类: 星光金,好评,挺好的，质量也挺好的，服务态度也挺好，暂时没问题,-,-,2021-03-07
320,哲**5,颜色分类: 星光金,好评,本人感觉可以,-,-,2021-02-24
321,t**7,颜色分类: 星光金,好评,不错第二爱买了,-,-,2021-06-22
322,w**8,颜色分类: 星光金,好评,速度快 服务好,-,-,2021-06-17
323,贾**琦,颜色分类: 星光金,好评,挺好的，高端大气，空间宽敞。 ,-,-,2021-03-03
324,t**8,颜色分类: 星光金,好评,第二次购买了，很满意！,-,-,2021-03-04
325,l**啤,颜色分类: 星光金,好评,此用户没有填写评价。,快递小哥  服务超级棒   给100个赞,-,2021-02-19
326,d**0,颜色分类: 星光金,好评,安装工特别给力。上门快，服务态度好，十分热情。,-,-,2021-03-10
327,z**3,颜色分类: 星光金,好评,用后再追评吧,-,-,2021-06-21
328,t**7,颜色分类: 星光金,好评,送货服务：不错，都很好。好评。 ,-,-,2021-06-22
329,t**0,颜色分类: 星光金,好评,此用户没有填写评价。,服务很好，提前通知送货。,-,2021-06-14
330,s**4,颜色分类: 星光金,好评,发货速度很快！ ,-,-,2021-05-02
331,t**5,颜色分类: 星光金,好评,很不错，物流很快，服务态度也很好,-,-,2021-02-21
332,t**7,颜色分类: 星光金,好评,冰箱门没法关严实，冷冻室里面的温度也没法结冰冷冻，说明书是注明出厂设置是—18摄氏度，结果是连冷藏的温度都达不到。我家在闽南现在的气温是20度，买回来的东西都没地方放了。请问该如何评价？,-,-,2021-06-22
333,y**h,颜色分类: 星光金,好评,先赞物流送货师傅，送到家、摆到位，反复交待注意事项👍👍👍。云米是第一次听说，朋友推荐后查阅了资料、认真看了评价，果断下手。特意用了几天才确认，从几天情况看，外观靓、制冷快、声音小、空间大，是我原来用的海尔、西门子的两个大，但价格仅是它们的一半，非常实惠，希望能用得久一点。淘宝十五年，第一次写这么长的评价。🤗 ,-,-,2021-01-10
334,z**1,颜色分类: 星光金,好评,送货服务：服务非常好 冰箱容量：门上置物架偏少，空间利用不充分。 制冷效果：非常好 ,-,-,2021-02-03
335,雪**9,颜色分类: 星光金,好评,送货服务：物流员很专业很负责 外观材质：外观很好看 冰箱容量：超级大 制冷效果：蛮好的 已经用了两天了，风冷的很好，不结霜，声音也不大 ,-,-,2021-01-19
336,7**我,颜色分类: 星光金,好评,送货服务：师傅很好，速度也很快 外观材质：很好看 冰箱容量：很大了，满足需求 制冷效果：应该可以 ,-,-,2021-01-24
337,t**9,颜色分类: 星光金,好评,冰箱容量很大活动便宜。,-,-,2021-06-23
338,回**子,颜色分类: 星光金,好评,空间特别大   颜色也好看，目前正在使用中没有遇到什么特别大的问题，物流特别好，速度也很快，下单第二天就到了。 ,-,-,2021-01-22
339,d**o,颜色分类: 星光金,好评,冰箱送来送货人员态度很好，但是冰箱侧面一个很深的大坑好不容易买的到货了觉得太麻烦所以客服给补了170元。拿个贴纸贴下吧。后续使用体验再来追评吧,-,-,2021-01-24
340,t**0,颜色分类: 星光金,好评,发货很快，物流运输快，还送货上门，配送员要第二天插电使用。云米冰箱价格实惠，以后看质量。,-,-,2021-06-14
341,一**啊,颜色分类: 星光金,好评,确实大，实惠，物流也快 ,-,-,2021-02-03
342,拿**照,颜色分类: 星光金,好评,送货服务：刚到！先用着吧，物流及时，很好！五星好评！ ,-,-,2021-02-07
343,燕**吖,颜色分类: 星光金,好评,此用户没有填写评价。,质量什么的都不提了，最关键是售后还不行，用了几个月了门已经关不上了，制不了冷，问题已经反应了两天没有任何反应，没有人上门维修！！！真的让人很火大,-,2021-01-16
344,申**3,颜色分类: 星光金,好评,特意用了多天才评价，非常好可以放很多东西。直得购买五粒星评！,-,-,2021-01-11
345,陈**2,颜色分类: 星光金,好评,自己两年前买了一台好用现在又给妈妈买一台！,-,-,2021-02-03
346,t**9,颜色分类: 星光金,好评,货已收到，空间可以，还没使用后期在点评,-,-,2021-06-23
347,刘**6,颜色分类: 星光金,好评,外观大气。容量大，价格便宜。物流很快。  ,-,-,2021-04-04
348,阿**巴,颜色分类: 星光金,好评,此用户没有填写评价。,无线连接不上  客服售后都整不好！ 闹心到家了！,-,2021-04-16
349,王**飞,颜色分类: 星光金,好评,第二次购买了 很不错 ,-,-,2021-02-04
350,l**e,颜色分类: 星光金,好评,很幸运！冰箱暂时没有任何问题 ,-,-,2021-01-06
351,h**2,颜色分类: 星光金,好评,可以备用 ,-,-,2021-01-24
352,h**8,颜色分类: 星光金,好评,送货服务：非常快，师傅态度好 ,-,-,2021-01-09
353,梦**风,颜色分类: 星光金,好评,物流送货很好，辛苦了,-,-,2021-02-01
354,t**6,颜色分类: 星光金,好评,小哥，辛苦了,-,-,2021-06-23
355,x**生,颜色分类: 星光金,好评,宝贝很好用，客服很耐心，服务一流的，快递很快！,-,-,2021-01-27
356,t**2,颜色分类: 星光金,好评,送货快，服务好！很满意！,-,-,2021-02-06
357,h**i,颜色分类: 星光金,好评,货已收到！物流很快！服务态度非常好！,-,-,2021-01-15
358,w**8,颜色分类: 星光金,好评,物超所值👍🏻,-,-,2021-06-17
359,美**3,颜色分类: 星光金,好评,此用户没有填写评价。,这个冰箱买了7-8个了，主要是相信这个品牌，但是这质量真是让人担心，家里爷爷奶奶用，一个没有腿就这么放了2个月，两个老人7-8多岁了，一直在催，有截图大家自己看吧！两个字失望太失望了！,尊敬的用户您好，非常抱歉给您带来不好的体验，由于售后问题未能及时给您解决，在此给您道歉了。我们会反馈到售后总部核实，后期会加强售后人员管理及培训，优化售后流程，在后续的工作中也会不断改进的，希望您一直关注我们哦，如有疑问欢迎随时联系我们，谢谢您的这次反馈，祝您生活愉快！,2021-01-27
360,城**5,颜色分类: 星光金,好评,商品好，物流非常快，送货到户，服务好,-,-,2021-01-03
361,w**p,颜色分类: 星光金,好评,中奖了，真的退款500，不错！好！,-,-,2021-01-03
362,卧**彤,颜色分类: 星光金,好评,送货服务：很好，很满意 ,-,-,2020-12-31
363,中**汉,颜色分类: 星光金,好评,冻的是真快啊，放里瓶啤酒，2小时给我冻炸了,-,-,2021-02-24
364,东**家,颜色分类: 星光金,好评,冰箱很大，空间很足，这个价格知足了，物流很快！ ,-,-,2021-02-06
365,因**3,颜色分类: 星光金,好评,感觉可以，先用几天看看。,-,-,2021-01-27
366,d**庆,颜色分类: 星光金,好评,晚上声音有点大！ ,-,-,2021-01-25
367,t**4,颜色分类: 星光金,好评,冰箱声音太大了,-,-,2021-06-05
368,l**5,颜色分类: 星空灰,好评,冰箱收到已经使用了一段时间了，很好用，很静音，而且效果也不错。云米的东西第一次用，但是真的很惊喜。而且性价比超级高。推荐购买，五星好评。。 ,-,-,2021-06-27
369,t**0,颜色分类: 星空灰,好评,给妈妈买的，冰箱很不错空间也大，颜色也是妈妈喜欢的要个耐脏，好看价格实惠，很不错。邻居看到问我要了链接也买一个 ,-,-,2021-06-14
370,蒋**民,颜色分类: 星空灰,好评,宝贝用了好几天啦 非常好用 空间也很大 好多东西都放下啦 空间给力 制冷效果非常好 很棒的一次购物 卖家服务态度非常好 给五星,-,-,2021-06-28
371,北**5,颜色分类: 星空灰,好评,以旧换新的 中间闹了好多事情 天猫客服推咸鱼客服 咸鱼客服推天猫 没一个解决的 很不好的体验 下次买大件物品还是建议去京东 ,-,-,2021-06-29
372,任**5,颜色分类: 星空灰,好评,为物流小弟点赞，服务热情周到，文明用语，服装整洁，百分百满意的服务流程。,-,-,2021-06-28
373,冷**吧,颜色分类: 星空灰,好评,新房装修，放在柜子后边刚刚好。外观真心不错。刚通上电源，冰箱两侧特别烫，不知道后续会不会没那么烫。,-,-,2021-06-27
374,热**了,颜色分类: 星空灰,好评,送货服务：送货速度特别快 外观材质：外边挺好看的 冰箱容量：容量大 制冷效果：制冷效果kuai 就是噪音很大 ,-,-,2021-06-28
375,小**贺,颜色分类: 星空灰,好评,价位合理物超所值，容量特别大   家里人都很喜欢  非常愉快的购物  物流也很快,-,-,2021-06-29
376,霞**影,颜色分类: 星空灰,好评,冰箱不错奥，颜色好看，布局合理，真心不错，下次还来买,-,-,2021-06-28
377,陈**来,颜色分类: 星空灰,好评,充电24小时后来评价，冰箱箱体温度正常，制冷效果好，外观也大气，抽屉能再多一个就更完美了，打算买个置物蓝。,-,-,2021-06-28
378,梦**1,颜色分类: 星空灰,好评,售后服务好，冰箱外形小巧，内里大气，非常好 ,-,-,2021-06-28
379,s**燕,颜色分类: 星空灰,好评,收到就联系师傅安装了，冰箱好看，是我想要的，容量也够用，暂时还没入住，后期使用看看 ,-,-,2021-06-27
380,万**4,颜色分类: 星空灰,好评,到家了！感觉不错，大气智能,-,-,2021-06-28
381,花**忧,颜色分类: 星空灰,好评,用了一段时间，冰箱很大，噪音不大，制冷效果也不错。 ,-,-,2021-06-28
382,t**8,颜色分类: 星空灰,好评,发烫很厉害，有时候手都碰不上去那种，不建议买 ,冰箱有时候发烫很厉害，起码五十几度，想退货换货找维修人员，说好今天来又没来，差评，不建议买，真心不好,-,2021-06-28
383,h**9,颜色分类: 星空灰,好评,真的很大，感觉物有所值。唯一担心有点费电了 ,-,-,2021-06-28
384,缃**洋,颜色分类: 星空灰,好评,刚开机，声音惊人的响，问了下客服，客服说大概48小时就会好。,-,-,2021-06-27
385,m**8,颜色分类: 星空灰,好评,送货服务：速度挺快 制冷效果：效果挺好 ,-,-,2021-06-27
386,妩**n,颜色分类: 星空灰,好评,不错，效果很满意 ,-,-,2021-06-27
387,添**有,颜色分类: 星空灰,好评,认真听送货小哥讲解，果然冰箱没声音，满满的夏天,-,-,2021-06-27
388,l**6,颜色分类: 星空灰,好评,帮婆婆买的，价格不贵，很能装。 ,-,-,2021-06-27
389,f**3,颜色分类: 星空灰,好评,给妈妈买的，麻麻说挺不错滴😁 ,-,-,2021-06-27
390,a**4,颜色分类: 星空灰,好评,好用，无霜，买他,-,-,2021-06-28
391,s**8,颜色分类: 星空灰,好评,价廉物美,-,-,2021-03-17
392,李**7,颜色分类: 星空灰,好评,太棒了非常好性价比超高1999能买那么大的冰箱朋友都不相信,-,-,2021-06-05
393,岚**轩,颜色分类: 星光金,好评,客服真心不咋滴，我订单出问题，直接不理我，我在天猫家卖了好多冰箱，客服我真的无语了 ,-,-,2021-01-30
394,一**头,颜色分类: 星空灰,好评,快递小哥挺好的，还帮忙放好，空间够大，性价比高，刚开始使用，感觉冰箱外面温度有点高，里面温度不够低，先好评了，使用一段时间再来追加评价。 ,使用一段时间了，来说说使用后的感受，首先是冷藏室，之前放蔬菜放上三天以上会脱水，菜叶会烂，用这个放一个礼拜也没之前的情况，而且还很新鲜，冷冻无霜的冻的牛肉解冻也比老冰箱快，老妈大人表示非常满意，特意来追加评价，个人觉得性价比超高，非常值得入手。最后再补充一下，空调非常大，可放整只鸡，整个西瓜，这个是之前的小冰箱无法做到的。,-,2021-06-03
395,凸**芄,颜色分类: 星空灰,好评,差评！冰箱差！无法连接手机！换了三个手机！无法调节温度！导致冷藏室全冻住了！ 另外客服更差！翻来覆去说车轱辘话，根本解决不了实际问题！ 千万不要买！坑！ ,-,-,2021-06-09
396,宏**弟,颜色分类: 星光金,好评,送错颜色了，心情不好 ,云米双开门冰箱高端大气上档次，价格实惠，主播推荐的尺寸非常适合，客服人员服务态度好，满意。,亲爱的买家，感谢您发自肺腑的评价，产品能得到您的认可，对于我们来说是一种鼓励，一种支持，我们一定会再接再厉，为您提供更优质的产品与服务，感谢您的惠顾，愿我们的产品能给您带来健康舒适的生活！,2021-05-01
397,科**0,颜色分类: 星空灰,好评,冰箱很好，好，好，好，好。冰凉，冰凉。,-,-,2021-06-18
398,妮**鸡,颜色分类: 星光金,好评,满意,-,-,2021-05-09
399,d**5,颜色分类: 星光金,好评,此用户没有填写评价。,等售后,-,2021-05-06
400,张**3,颜色分类: 星空灰,好评,挺好的,-,-,2021-05-14
401,石**祥,颜色分类: 星光金,好评,不错！ ,-,-,2021-01-27
402,滋**4,颜色分类: 星光金,好评,！,-,-,2021-02-11
403,失**贝,颜色分类: 星空灰,好评,可以可以,-,-,2021-06-21
404,b**7,颜色分类: 星光金,好评,一般 ,-,-,2021-03-30
405,6**娜,颜色分类: 星光金,好评,还不错   ,-,-,2021-02-27
406,亡**e,颜色分类: 星空灰,好评,服务好,-,-,2021-05-20
407,仙**9,颜色分类: 星空灰,好评,垃圾,-,-,2021-06-12
408,申**轩,颜色分类: 星空灰,好评,噪音大 ,-,-,2021-06-14
409,y**9,颜色分类: 星光金,好评,此用户没有填写评价。,-,-,2021-01-18
410,呵**o,颜色分类: 星光金,好评,此用户没有填写评价。,外观干净漂亮，做工很不错，没发现什么瑕疵，个人感觉大小也挺合适，找了很久选的这款，大爱！,-,2021-01-12
411,东**王,颜色分类: 星光金,好评,很好，不错，还可以，非常好，我喜欢，666下次一定，不错的产品。,-,-,2021-03-06
412,x**8,颜色分类: 星光金,好评,冰箱收到了，很好，价格实惠，外观大气，容量大，外观漂亮。 ,-,-,2021-05-18
413,一**9,颜色分类: 星光金,好评,第二次买了  性价比不错   送货服务：配送师傅也不错 四楼背上来的  ,-,-,2021-02-08
414,b**华,颜色分类: 星光金,好评,冰箱很不错，很喜欢，空间也大，制冷效果也很好。特意试了试才评论的，很不错,-,-,2021-05-08
415,m**4,颜色分类: 星光金,好评,特别特别满意，超级好看，客服很有礼貌，很客气，良心商家，支持！,-,-,2021-01-13
416,t**3,颜色分类: 星空灰,好评,此用户没有填写评价。,-,-,2021-06-25
417,t**4,颜色分类: 星空灰,好评,此用户没有填写评价。,-,-,2021-06-05
418,z**w,颜色分类: 星空灰,好评,好评,-,-,2021-06-07
419,穆**1,颜色分类: 星空灰,好评,好,-,-,2021-06-21
420,a**川,颜色分类: 星光金,好评,此用户没有填写评价。,-,-,2021-04-07
421,娜**1,颜色分类: 星空灰,好评,很好,-,-,2021-06-17
422,w**7,颜色分类: 星光金,好评,此用户没有填写评价。,-,-,2021-03-12
423,s**0,颜色分类: 星空灰,好评,到货就迫不及待打开了，果真没有让我失望，质量特别好，颜值也相当高，满意的一次购物,真的很喜欢，完全超出期望值，发货速度非常快，包装非常仔细、严实，运送速度很快，很满意的一次购物,赞美别人是种温馨，被别人赞美更是一种幸福，您的肯定让我们充满了动力，我们会再接再厉，把最好的宝贝最贴心的服务带给您，感谢您的支持，祝您生活愉快~,2021-06-13
424,q**8,颜色分类: 星空灰,好评,很好,-,-,2021-06-12
425,t**2,颜色分类: 星空灰,好评,非常好，物美价廉，非常好，物美价廉。非常好，物美价廉，非常好，物美价廉。非常好，物美价廉，非常好，物美价廉。非常好，物美价廉，非常好，物美价廉。非常好，物美价廉，非常好，物美价廉。非常好，物美价廉，非常好，物美价廉。非常好，物美价廉，非常好，物美价廉。非常好，物美价廉，非常好，物美价廉。 ,-,-,2021-06-10
426,爱**心,颜色分类: 星空灰,好评,发货蛮快，昨天买的今天就到了，冰箱很大，制冷效果不错，颜色也很喜欢，很满意的一次购物！推荐大家购买！ ,用的第一天噪音很大，噪音异常，售后过来看了，也修不好！退货，质量有问题！,-,2021-06-13
427,q**3,颜色分类: 星光金,好评,冰箱空间很大，性价比很高，实用性也好，看起来高大上。物流也快，服务也好,-,-,2021-05-20
428,为**l,颜色分类: 星光金,好评,宝贝收到货了，外观好看大气，容量也很大，已经开始用了，还不错哦！制冷效果很好，感觉物超所值，第一次用这个品牌，挺不错👍 ,-,-,2021-05-08
429,冯**x,颜色分类: 星空灰,好评,此用户没有填写评价。,外观干净漂亮，做工很不错，没发现什么瑕疵，个人感觉大小也挺合适，找了很久选的这款，大爱！,-,2021-06-14
430,难**代,颜色分类: 星空灰,好评,挺不错的，值得拥有，很便宜，值得推荐。挺不错的，值得拥有，很便宜，值得推荐。挺不错的，值得拥有，很便宜，值得推荐。挺不错的，值得拥有，很便宜，值得推荐。挺不错的，值得拥有，很便宜，值得推荐。挺不错的，值得拥有，很便宜，值得推荐。挺不错的，值得拥有，很便宜，值得推荐。挺不错的，值得拥有，很便宜，值得推荐。挺不错的，值得拥有，很便宜，值得推荐。 ,-,-,2021-06-08
431,无**爱,颜色分类: 星空灰,好评,好产品、好品质、好服务，宝贝确实值这个价钱，在这给商家点个赞👍 ,-,-,2021-06-21
432,g**7,颜色分类: 星空灰,好评,价格美丽，使用方便，声音小，用着方便，会推荐朋友购买 ,-,-,2021-06-01
433,t**7,颜色分类: 星光金,好评,此用户没有填写评价。,-,-,2021-06-22
434,t**1,颜色分类: 星空灰,好评,此用户没有填写评价。,-,-,2021-06-21
435,同**翠,颜色分类: 星光金,好评,很好,-,-,2021-05-10
436,t**9,颜色分类: 星空灰,好评,物流很快,-,-,2021-06-23
437,t**8,颜色分类: 星光金,好评,此用户没有填写评价。,-,-,2021-05-05
438,m**1,颜色分类: 星光金,好评,物流很快,-,-,2021-03-03
439,t**7,颜色分类: 星空灰,好评,此用户没有填写评价。,-,-,2021-06-22
440,石**祥,颜色分类: 星光金,好评,此用户没有填写评价。,-,-,2021-01-26
441,s**o,颜色分类: 星空灰,好评,此用户没有填写评价。,-,-,2021-05-28
442,法**旦,颜色分类: 星空灰,好评,此用户没有填写评价。,-,-,2021-06-14
443,t**3,颜色分类: 星空灰,好评,此用户没有填写评价。,-,-,2021-06-25
444,z**9,颜色分类: 星空灰,好评,冰箱到货了，还没用，家里这几天停电，外观漂亮，容量也大，喜欢。,-,-,2021-06-17
445,l**n,颜色分类: 星空灰,好评,好评,-,-,2021-06-20
446,a**7,颜色分类: 星空灰,好评,此用户没有填写评价。,好,-,2021-06-01
447,南**军,颜色分类: 星空灰,好评,此用户没有填写评价。,-,-,2021-06-16
448,金**士,颜色分类: 星空灰,好评,此用户没有填写评价。,-,-,2021-06-04
449,t**1,颜色分类: 星空灰,好评,很大，颜值很好，能放好多东西。价格也合适，值得购买。,-,-,2021-05-27
450,巧**2,颜色分类: 星光金,好评,好,-,-,2021-01-17
451,中**宇,颜色分类: 星光金,好评,不错,-,-,2021-04-04
452,t**1,颜色分类: 星光金,好评,宝贝收到了，质量很不错，包装精致，材质优秀，比想象中好，送礼自用非常合适，下次继续购买 ,-,-,2021-04-25
453,t**3,颜色分类: 星光金,好评,物美价廉，冷冻超快，物流的工作人员也很棒！好评！,-,-,2021-06-25
454,昊**6,颜色分类: 星光金,好评,此用户没有填写评价。,-,-,2021-04-26
455,w**2,颜色分类: 星空灰,好评,挺好的，空间大，性价比高，给妈妈买的很实用。外观也好看，容量比较大。 ,-,-,2021-06-08
456,b**y,颜色分类: 星空灰,好评,好,-,-,2021-05-21
457,愤**3,颜色分类: 星光金,好评,不错,-,-,2021-02-23
458,s**b,颜色分类: 星光金,好评,此用户没有填写评价。,-,-,2021-05-03
459,稷**l,颜色分类: 星空灰,好评,好,-,-,2021-05-11
460,鹏**6,颜色分类: 星光金,好评,不错,-,-,2021-02-03
461,t**9,颜色分类: 星光金,好评,此用户没有填写评价。,物美价廉，冷冻超快，物流的工作人员也很棒！好评！,-,2021-06-23
462,寂**爱,颜色分类: 星空灰,好评,发货快，包装严实，商品质量非常好，比专柜便宜很多，客服服务态度也特别好，好评,-,-,2021-06-09
