491,d**0,颜色分类: 佛缘款,好评,我一直想买一个终于买到了，很喜欢的式样，小巧精致,-,-,2021-06-01
492,龙**存,颜色分类: 直充网纹款+原装刀头,好评,外观材质：很好也很好看 使用时长：一次能够用俩月吧 理发效果：很奈斯 ,-,-,2021-06-06
493,t**2,颜色分类: 直充佛缘款+原装刀头,好评,和图片一样,试了挺好的,-,2021-06-10
494,l**e,颜色分类: 佛缘款,好评,好评了,-,-,2021-06-12
495,t**2,颜色分类: 佛缘款+理发套装,好评,怎么说呢。。。夏天了弟弟让我给他剃个光头。正好买个这个剃头器就给他试一下。结果这个光头剃了不光还留有头发。我本来要拍照发一下弟弟不肯。就只能评论一下了。其他还没用到以后再追评～,-,-,2021-06-16
496,t**3,颜色分类: 直充网纹款+原装刀头,好评,手感很好，卖家很耐心，让雕刻更方便顺手，建议大家购买,-,-,2021-06-26
497,t**林,颜色分类: 佛缘款,好评,宝贝收到，很好用，声音又小，力度大。我第二次购买，主要是客服态度很好。 ,-,-,2021-05-20
498,t**2,颜色分类: 直充网纹款,好评,东西可以,-,-,2021-06-13
499,t**0,颜色分类: 佛缘款,好评,夹头发不咋滴,-,-,2021-06-15
500,刘**5,颜色分类: 直充网纹款,好评,很好用，家里两娃，真是特别实用,-,-,2021-06-12
501,农**丘,颜色分类: 佛缘款+备用电池,好评,宝贝收到了   很满意,-,-,2021-06-10
502,请**4,颜色分类: 直充佛缘款,好评,理发器真的动力十足 自己动手理得也非常干净 确实不错,-,-,2021-05-15
503,t**6,颜色分类: 网纹款,好评,目前还没用，不知好不好，用了追评,-,-,2021-06-25
504,t**9,颜色分类: 佛缘款,好评,打开看了一下。款式。颜色很满意.终至于好不好用。要等用了才知道,-,-,2021-06-26
505,t**3,颜色分类: 直充佛缘款+原装刀头,好评,还可以不错下次在买谢了,-,-,2021-06-26
506,t**4,颜色分类: 直充佛缘款+原装刀头,好评,小巧玲珑收到货我就用了👍,-,-,2021-06-24
507,混**钱,颜色分类: 佛缘款+备用电池,好评,挺好用的，这是我第二个入手的了， ,-,-,2021-06-18
508,t**2,颜色分类: 直充佛缘款,好评,本想抱着试试的心态，想着三四十块钱会买把电推剪能好用吗？结果收到货试了一下特别好用，比在抖音上面六七十买的都好用，不错下次还会再来这家店买的，很好。物流也很快,-,-,2021-05-30
509,t**0,颜色分类: 直充网纹款+理发套装,好评,宝贝收到挺好,-,-,2021-06-15
510,鹿**雨,颜色分类: 直充网纹款+原装刀头,好评,很好，简单最美！关键能发挥实用！ ,-,-,2021-06-14
511,酷**哥,颜色分类: 直充网纹款+理发套装,好评,宝贝很不错，动力强劲。也很实用。以后自己就是理发师了。 ,-,-,2021-05-29
512,旧**6,颜色分类: 网纹款+备用电池,好评,特别好看.包装精细.谢谢送的礼物,试用了一下，非常好用，推荐,-,2021-06-01
513,y**5,颜色分类: 直充网纹款+原装刀头,好评,蛮好的！电推剪理发很给力！,-,-,2021-06-13
514,t**9,颜色分类: 佛缘款,好评,东西刚刚拿到，物流非常快，效果和我想象的一模一样，简直就是物超所值。非常喜欢。 ,-,-,2021-06-26
515,s**2,颜色分类: 佛缘款+备用电池+原装刀头,好评,挺好用的，物美价廉颜值高，充电快续航强，值得拥有！ ,-,-,2021-06-04
516,飞**8,颜色分类: 直充佛缘款+理发套装,好评,还没用过，不知道好不好用。,-,-,2021-06-20
517,t**9,颜色分类: 网纹款+备用电池+原装刀头,好评,"剛剛收到, 套件齊整，開機正常！待用後再追評！",-,-,2021-06-26
518,猫**5,颜色分类: 直充网纹款+原装刀头,好评,不错不错，精致小巧，送的东西也多👌,-,-,2021-06-04
519,s**0,颜色分类: 佛缘款,好评,包装的很好，一次一定还要买,-,-,2021-05-11
520,瑶**0,颜色分类: 直充网纹款,好评,并不能清皮，不要想太多。 ,-,-,2021-06-20
521,t**9,颜色分类: 直充佛缘款,好评,电推很好用 昨天试过了 大人小孩都能用 颜值特好,不错哦 价格便宜 质量好,-,2021-06-26
522,笑**购,颜色分类: 佛缘款,好评,东西收到和图片一样，动力强劲还行，,好评，，，，，，，，，，，，，,-,2021-06-11
523,q**5,颜色分类: 直充佛缘款+原装刀头+理发套装,好评,宝贝收到了，试了一下很好用，还漂亮，不错值得购买,值得推荐购买，棒棒哒,-,2021-06-03
524,亲**n,颜色分类: 直充佛缘款+原装刀头,好评,东西很好！质量可以！看着大气！挺喜欢的 ,-,-,2021-05-30
525,y**n,颜色分类: 佛缘款,好评,货收到试用了，和描述一样很好，款式好看满意加好评！,一款不错的理发器，艺术性很强，值得推荐。,-,2021-06-01
526,t**8,颜色分类: 佛缘款+备用电池,好评,质量蛮好的，送的东西也很齐备，可以购买哦 ,-,-,2021-06-14
527,为**彩,颜色分类: 网纹款+备用电池,好评,做工精细，电池容量给力，客服服务态度很好，有了它托尼老师就下岗了全五星好评，下次再来！,-,-,2021-06-06
528,古**人,颜色分类: 直充网纹款,好评,完美极了！立即理发，美！,-,-,2021-06-14
529,y**1,颜色分类: 网纹款,好评,推光头好用昨晚上收到今天自己理个光头,-,-,2021-05-10
530,t**5,颜色分类: 网纹款,好评,不好用  动力太小,-,-,2021-06-24
531,t**4,颜色分类: 网纹款,好评,感觉噪音有点大,-,-,2021-06-24
532,h**芳,颜色分类: 直充网纹款+原装刀头,好评,剃头发的，剃的很干净，很好  ,-,-,2021-06-10
533,t**6,颜色分类: 直充网纹款,好评,忘了收到货没评论的，现在还不错，削的不怕卡，值得购买,-,-,2021-06-25
534,宝**京,颜色分类: 佛缘款+备用电池,好评,宝贝收到了不错还很好看赠品也不少,用过啦已经效果很好理出发型很自然很好值得购买,-,2021-06-02
535,家**0,颜色分类: 网纹款,好评,****，还想要好评。,-,-,2021-06-10
536,李**7,颜色分类: 佛缘款+备用电池,好评,好用质量好，需要的亲们赶快下单吧,-,-,2021-05-24
537,t**1,颜色分类: 佛缘款,好评,这款电推子灵巧好用 充电式 不用换电池 耐用 使用很方便   ,推了几个脑袋噪音很小 安全不伤皮肤 大人小孩 都适用,-,2021-06-11
538,z**5,颜色分类: 佛缘款+原装刀头,好评,不咋滴，剃不干净,-,-,2021-06-19
539,l**6,颜色分类: 佛缘款,好评,很不错👍🏻棒棒棒,-,-,2021-06-17
540,t**2,颜色分类: 网纹款,好评,感觉劲还挺大,-,-,2021-06-18
541,m**1,颜色分类: 直充网纹款+原装刀头,好评,不错非常满意,-,-,2021-06-10
542,t**6,颜色分类: 直充网纹款,好评,电推剪很好用,-,-,2021-06-25
543,a**6,颜色分类: 佛缘款,好评,还不错，推的很光,-,-,2021-06-12
544,w**9,颜色分类: 佛缘款,好评,质量非常好，外观也很美丽，值得大家购买,质量非常好，值得大家购买,-,2021-06-24
545,兰**蓬,颜色分类: 直充网纹款+原装刀头,好评,理发器收到了，实物跟拍好了一样，跟商家说的一致，真的很好用，收到了立马试用，效果真的很好。 ,-,-,2021-05-30
546,王**1,颜色分类: 网纹款+备用电池,好评,物美价廉，看着挺不错，很理想的一次购物 ,剪刀很精美，用的挺好的，没有噪音！,-,2021-06-05
547,自**y,颜色分类: 网纹款+备用电池,好评,物流很快，服务质量非常满意。 货物与网上的描述完全相同。推子很好用，很流利，刃口很锋利。立即给家人使用了，操作很顺手，方便。不一会儿，就 理完了，头发茬很顺。 是一次，得心应手的理发，全归功于这款 利锐理发器。非常满意的一次购物！ ,-,-,2021-04-25
548,t**8,颜色分类: 直充网纹款,好评,还可以挺好的,-,-,2021-06-14
549,吴**笑,颜色分类: 佛缘款,好评,宝贝很不错，已经多次购买了，很锋利 ,很不错的宝贝，已经多次购买了！！感谢商家的产品,-,2021-06-06
550,迷**娃,颜色分类: 网纹款,好评,用着还不错。就是连接处有点不得劲儿。稍微不注意会碰到，虽然不疼吧，还是有点别扭的,收到东西好几天了，一直剃光头，一共用了三次。第一次用着还不错，第二次用的时候有点卡了。我还以为没电了，充上电，用第三次的时候，就夹头发夹的厉害了。刀头也不好用了。虽然说这玩意儿不是一次性的东西吧，三次性也不行呐！！！,-,2021-06-15
551,王**6,颜色分类: 网纹款+备用电池,好评,宝贝已经收到还没有用，等过俩天头发长了的 ,很不错，给一个赞，可以入手一个,-,2021-06-09
552,志**s,颜色分类: 佛缘款,好评,不怎么静音,-,-,2021-06-18
553,b**0,颜色分类: 直充网纹款+原装刀头,好评,刚收到货，非常不错，值得拥有 ,超级棒，非常好用,-,2021-05-30
554,t**7,颜色分类: 佛缘款+备用电池+原装刀头+理发套装,好评,满怀期待的等到收货试用，声音震动的很吵不说，另外一个电池充电了两个半小时左右，结果一个头都没剪好就没电不够动力了。。送的牙剪也根本剪不了。。哎，还是上了79的当。。,-,-,2021-06-25
555,t**5,颜色分类: 网纹款+原装刀头,好评,不错挺好,-,-,2021-06-24
556,分**9,颜色分类: 网纹款,好评,好用不错,-,-,2021-06-14
557,c**u,颜色分类: 佛缘款,好评,好用。👍赞,-,-,2021-06-12
558,t**0,颜色分类: 网纹款,好评,方便好用,-,-,2021-06-15
559,w**5,颜色分类: 直充网纹款,好评,推不干净,-,-,2021-06-18
560,蔡**超,颜色分类: 佛缘款+原装刀头,好评,此用户没有填写评价。,使用方便,-,2021-06-07
561,t**7,颜色分类: 网纹款,好评,此用户没有填写评价。,效果不错！！,-,2021-06-25
562,t**9,颜色分类: 网纹款,好评,差评昨天才拿到的不能用,-,-,2021-06-26
563,z**m,颜色分类: 网纹款+备用电池,好评,货品收到了，刚刚试用了一下感觉非常不错，,-,-,2021-06-08
564,幸**8,颜色分类: 直充网纹款,好评,千万别买，买完不停给你发信息骚扰你，不信大家就试试吧 ,-,-,2021-06-18
565,t**6,颜色分类: 网纹款,好评,买回来就用一回，第二次就夹头发，我联系客服，客服说没电了，让我充电，我冲完电还剪头发，再联系客服，客服就不搭理我了，我八点钟联系的客服，现在都八点半多了，也没回个信儿，信息已读了，就是不回,-,-,2021-06-25
566,t**7,颜色分类: 佛缘款,好评,产品真的很好，剃头狠干净。,-,-,2021-06-25
567,w**8,颜色分类: 直充网纹款+理发套装,好评,这个套装很齐全，可以剪很多种花样,试用了一下，很不错的，声音不是很大,-,2021-06-04
568,t**1,颜色分类: 网纹款+备用电池,好评,非常好喜欢货真价实,-,-,2021-06-11
569,t**9,颜色分类: 佛缘款+备用电池,好评,宝贝收到，用了一下很有劲,连续剃两个头，还很有劲，值得购买,-,2021-06-26
570,t**8,颜色分类: 佛缘款+备用电池,好评,跟图片的一模一样，又不贵值得入手😍 ,-,-,2021-06-14
571,大**5,颜色分类: 直充佛缘款,好评,噪音小，刮胡子剃头都阔以,-,-,2021-06-10
572,大**1,颜色分类: 直充网纹款+原装刀头,好评,好，是真**好，全身剃得干干净 ,-,-,2021-06-04
573,若**8,颜色分类: 直充网纹款,好评,东西收到了，挺好用的，声音不大， ,-,-,2021-06-13
574,t**3,颜色分类: 直充网纹款,好评,垃圾东西，动力超级差推不干净,-,-,2021-06-26
575,z**8,颜色分类: 直充佛缘款,好评,不错很方便的用起来下次有需要还会来 ,儿子很喜欢,-,2021-05-29
576,t**5,颜色分类: 直充佛缘款,好评,小巧玲珑，动力足，刚用完了，挺好用的，不卡头发。 ,挺好用的。很喜欢。,-,2021-06-24
577,p**2,颜色分类: 佛缘款+原装刀头,好评,货己收到，非常满意！,-,-,2021-06-11
578,a**6,颜色分类: 佛缘款+原装刀头,好评,好快收到佛缘款＋原装刀头,几十元的佛缘款剪头发器物美价廉，应该好用,-,2021-06-05
579,s**1,颜色分类: 直充佛缘款+原装刀头,好评,东西小巧好用不错 值得购买,-,-,2021-05-30
580,t**9,颜色分类: 佛缘款+备用电池+原装刀头,好评,此用户没有填写评价。,收到宝贝后，迫不及待地同剪胡子，感觉不错，声音比想像小。用一段时间感觉好用，才来追评的，有需要者下单吧。望该产品耐用。,-,2021-06-26
581,t**0,颜色分类: 网纹款+原装刀头,好评,推子质量不错 很干净 挺好用的,-,-,2021-06-15
582,姐**3,颜色分类: 直充佛缘款,好评,东西收到了。感觉挺好的,-,-,2021-05-25
583,t**7,颜色分类: 佛缘款+备用电池+原装刀头,好评,宝贝收到了，超喜欢，小巧玲珑，以后出门就带他了,-,-,2021-06-25
584,t**5,颜色分类: 网纹款+备用电池,好评,还不错，挺好的。,-,-,2021-06-24
585,月**6,颜色分类: 直充网纹款,好评,非常好！用了一下很好！转速很快！非常满意的一次购物！,-,-,2021-05-29
586,清**q,颜色分类: 直充佛缘款,好评,到货就用上了，自己剪了个头！满意！,不错，爱了爱了,-,2021-06-06
587,侯**2,颜色分类: 网纹款,好评,外观看着不错，推头发也推得干干净净，刻字顺手，要是买来剃光头本人建议买推剪刀头稍微大点的 ,-,-,2021-06-06
588,c**0,颜色分类: 直充网纹款,好评,很好，动力十足，物有所值,-,-,2021-06-10
589,t**4,颜色分类: 直充网纹款+原装刀头,好评,东西很好，动力实足，很满意的一次购物 ,-,-,2021-06-24
590,t**5,颜色分类: 佛缘款,好评,第二次购买产品很好用大家放心购买,-,-,2021-06-24
591,w**3,颜色分类: 直充网纹款+原装刀头,好评,蛮好的，物美价廉,-,-,2021-06-13
592,l**0,颜色分类: 佛缘款+备用电池,好评,推子特别好用，很好用不错，质量挺好的。,-,-,2021-06-07
593,t**3,颜色分类: 佛缘款+备用电池+原装刀头,好评,我是专业理发店帮客户理发的理发师，我理发好漂亮啊，技术杠杠的，现在购买的理发器光头神器收到了，客服态度很好，很有耐心讲解给我听，快递很快很准时送达，值得推荐给我的亲戚朋友们购买！,这个光头神器非常的非常的非常的好用，我一个专业理发大师都觉得好使，理发光光的，客户的非常的满意，特别是小孩，不觉得疼，可以讲不听话的小孩都听话了，质量不错杠杠的，值得推荐给我的亲戚朋友们购买！,-,2021-06-26
594,t**4,颜色分类: 佛缘款+备用电池+原装刀头,好评,东西不错，专业发型师评价，刀口对齐就很好用。客服很耐心。,-,-,2021-06-24
595,芳**p,颜色分类: 网纹款+备用电池+原装刀头,好评,外观材质：满意 理发效果：好，刚跟儿子剪了个光头试了试不错，以后就不用去理发店剪头了！全5分好评！ ,-,-,2021-05-06
596,婷**嫂,颜色分类: 佛缘款+原装刀头,好评,店家发货挺快的 推子试用了还不错 图案和照片一样好看 好评 ,买来本来想试试   试了还不错。有需要再来,-,2021-06-01
597,寒**良,颜色分类: 直充佛缘款+原装刀头,好评,宝贝不错。剃🉐🈵干净的。,-,-,2021-05-28
598,t**0,颜色分类: 佛缘款+原装刀头,好评,很好用 ，用起来刮的挺干净,很好用的，建议大家购买,-,2021-06-15
599,刺**7,颜色分类: 网纹款+备用电池+原装刀头+理发套装,好评,质量不错，货真价实，发货迅速！,使用简单方便快捷！给孩子用很适合！,-,2021-06-07
600,王**0,颜色分类: 网纹款,好评,外观材质：好看实用 使用时长：充一次电使用时间长 理发效果：不夹头发非常好用 ,-,-,2021-06-02
601,若**装,颜色分类: 佛缘款,好评,不好  和普通推子没区别 儿童剪不一个头 就没电了。 噪音也大   根本不像视频里推的那么干净 谁买谁后悔,-,-,2021-06-11
602,t**0,颜色分类: 网纹款+备用电池,好评,货已收到不错，用好了再来买,-,-,2021-06-15
603,g**5,颜色分类: 网纹款,好评,非常喜欢，,-,-,2021-06-12
604,小**0,颜色分类: 直充网纹款,好评,大家看看这就是所谓的零刀距，问客服怎么回事，客服还强行狡辩，拿买家的智商按在地上摩擦🖕,-,-,2021-06-10
605,神**陈,颜色分类: 网纹款+备用电池+原装刀头,好评,用了十来天就开始漏发，联系商家什么也没有回复 ,-,-,2021-06-05
606,t**5,颜色分类: 直充网纹款,好评,宝贝很好，谢谢商家,-,-,2021-06-24
607,蔡**幸,颜色分类: 直充佛缘款,好评,昨天收到货，今天我才回家，理了光头感觉不错，习惯留光头，随时随地可以剃光头了，满意，期待经久耐用 ,-,-,2021-05-02
608,w**3,颜色分类: 直充网纹款+原装刀头,好评,非常好用 物美价廉 超赞哦,非常好用 用着很顺手 超赞哦,-,2021-06-06
609,t**7,颜色分类: 网纹款+备用电池+原装刀头,好评,宝贝以收到、我很喜欢快递很快,宝贝很好我很喜欢,-,2021-06-25
610,发**5,颜色分类: 网纹款,好评,不好用，剪头发卡顿，刀头不锋利。跟视频的没法比可以说是货不对版,-,-,2021-06-13
611,v**5,颜色分类: 直充网纹款,好评,外观材质：好，用的舒服。 使用时长：耐用 理发效果：不错，达到想要的效果。 会推荐给身边朋友，好评。 ,-,-,2021-05-29
612,t**4,颜色分类: 网纹款+备用电池+原装刀头,好评,此用户没有填写评价。,回来直接用了，好用，刮的干净,-,2021-06-24
613,t**9,颜色分类: 网纹款+备用电池,好评,正在冲电，充满电试试，期待！,-,-,2021-06-26
614,c**r,颜色分类: 直充网纹款,好评,（｡ӧ◡ӧ｡）买回来就用了！这个剃头效果很好！很丝滑，不卡推头！价格也便宜！绝对值得！,-,-,2021-06-05
615,c**5,颜色分类: 直充网纹款,好评,不错的选择，非常方便 ,-,-,2021-06-01
616,c**1,颜色分类: 佛缘款,好评,收到隔天试了一下，才来评价的，这个剪推我很喜欢，主要是有佛像阿弥陀佛嘿嘿，收到货的确很精致 ,我是试用了的，才评价的，周边处理没有问题的，而且小而精致，我很喜欢,-,2021-04-23
617,方**凯,颜色分类: 直充佛缘款,好评,外观很漂亮，拿在手里蛮有分量的。客服的态度也很好，有问必答👍🏻为客服点赞👍🏻现在充电中，用过之后再来追评。 ,效果不错，动力很足👍🏻,-,2021-04-27
618,林**琳,颜色分类: 佛缘款,好评,质量好，物流快，理发漂亮，满意的购物。,使用方便，满意的购物。,-,2021-06-08
619,叶**1,颜色分类: 网纹款,好评,到手后使用了一次，感觉还好吧，好评,-,-,2021-06-06
620,阿**3,颜色分类: 直充佛缘款,好评,推子做工细致精美，有艺术感，噪音低动力强，很满意！ ,非常完美的推子，太喜欢啦哈哈😄,-,2021-04-27
621,李**北,颜色分类: 网纹款,好评,此用户没有填写评价。,这推子没法用，质量太差了夹头发声音大，用了两次用不了了,-,2021-06-15
622,不**生,颜色分类: 网纹款,好评,差评，抖动特别厉害，用了两次就坏了，找客服客服读完消息还不理人。,客服服务态度也很差。电推剪用了两次，现在没反应了。,-,2021-06-13
623,t**1,颜色分类: 佛缘款,好评,感觉还可以，速度剃的可以…… ,-,-,2021-06-11
624,y**3,颜色分类: 直充网纹款,好评,外观材质：机器不错很满意就是带的卡尺质量太差了…不好戴，戴上很难扣下来  ,-,-,2021-06-09
625,杨**芬,颜色分类: 网纹款,好评,剃的很干净，非常好，物超所值！！！ ,-,-,2021-06-02
626,t**5,颜色分类: 直充佛缘款,好评,挺好看的 劲也挺大。。。。。。。。。。。。。 ,-,-,2021-06-24
627,钱**宝,颜色分类: 佛缘款+备用电池+原装刀头+理发套装,好评,买回去给我婆婆让她给我小孩剃头的他说好好挺好用的  刚开始找不到开关，后面还是叫别人帮忙找才找到的 ,-,-,2021-06-04
628,g**族,颜色分类: 佛缘款+备用电池,好评,东西不错，非常感谢商家，物流也很快哟！ ,-,-,2021-06-07
629,t**7,颜色分类: 佛缘款,好评,质量非常好特别好用价钱还便宜真是物美价廉,-,-,2021-06-25
630,z**7,颜色分类: 网纹款+备用电池+原装刀头,好评,马力挺强劲有力的，声音不大，手感不错，值得购买，值得推荐！ ,-,-,2021-04-16
631,t**8,颜色分类: 佛缘款+备用电池+原装刀头,好评,理发效果：质量很好不错，下次还来买物流也很快， ,商家太差了，给评价又不发红包，不讲诚信，而且现在又不是很好用，差评一个，有点拔头发,-,2021-06-14
632,寇**2,颜色分类: 网纹款+备用电池+原装刀头+理发套装,好评,整体来说不错，个人觉得声音大了点而已,-,-,2021-06-11
633,c**e,颜色分类: 直充网纹款,好评,真的好用 虽然不是真正的0刀距 还有一点安全距离 但足够灵巧好用了。这性价比！ ,-,-,2021-06-01
634,a**1,颜色分类: 佛缘款+理发套装,好评,便宜没好货，做工一般，用了一次还夹头发，失望,-,-,2021-06-10
635,t**0,颜色分类: 直充佛缘款,好评,非常漂亮的电推子，usb充电很方便。 ,确实很好的推子，嗓音非常小。,-,2021-06-15
636,l**6,颜色分类: 佛缘款+原装刀头,好评,收到了，很好，太漂亮了,太有质感了，喜欢,-,2021-06-17
637,肖**1,颜色分类: 网纹款+备用电池+原装刀头+理发套装,好评,宝贝用了一段时间才来评论真心说不错有希要的朋友赶紧下手吧 ,-,-,2021-06-08
638,t**3,颜色分类: 直充网纹款,好评,小巧好用 孩子从出生就是我一直给他剪 这回来了新工具更得心应手了 ,-,-,2021-06-26
639,南**技,颜色分类: 网纹款,好评,很好用，不卡发，便宜又实惠 ,-,-,2021-06-08
640,5**你,颜色分类: 佛缘款+备用电池+原装刀头,好评,外形一致，动力确实强劲，强劲到有点拿久了手有点麻，主要是光头一个人很难剃 ,-,-,2021-06-02
641,a**0,颜色分类: 佛缘款+原装刀头,好评,宝贝非常好，锋利，小巧，精致。,-,-,2021-06-21
642,你**里,颜色分类: 网纹款+备用电池+原装刀头,好评,刀头锋利不伤肌肤，机体轻盈，物有所值！,-,-,2021-06-02
643,大**邕,颜色分类: 网纹款,好评,物有所值 ,-,-,2021-06-10
644,t**8,颜色分类: 网纹款,好评,手感很好，刀片锋利，很好用的 ,-,-,2021-06-14
645,t**1,颜色分类: 网纹款,好评,不做假，绝对的物超所值物美价廉，买回来就把头发理了，理发店理一次25还不如直接买个这个自己理。,-,-,2021-06-11
646,地**的,颜色分类: 网纹款+备用电池+原装刀头+理发套装,好评,外观材质：很好 使用时长：现在使用先 理发效果：可以 ,-,-,2021-06-07
647,w**a,颜色分类: 网纹款+备用电池,好评,油推收到了，劲很大。还送了备用电池。,刚才理发特别好，刻的挺好看。,-,2021-05-04
648,t**9,颜色分类: 直充网纹款+原装刀头,好评,外观不错，就是使用时间太短，充了12个小时，用了不到十分钟，真心不好 ,-,-,2021-06-26
649,1**t,颜色分类: 直充佛缘款,好评,刚给没满月闺女推了个光头，真心不错！,-,-,2021-04-21
650,张**凤,颜色分类: 佛缘款,好评,宝贝非常好，用着也跟顺手，下次还要来 ,用了一段时间了，推子确实好用，特别的快，理发店用正好,-,2021-06-06
651,笑**生,颜色分类: 佛缘款+备用电池+原装刀头,好评,货已收到，超好用，果断又下一单，给好兄弟买了一个,-,-,2021-05-06
652,项**伦,颜色分类: 网纹款,好评,构造内部有点简陋，电机和手把筒共振有点大，声音乱糟糟的。刀头挺快的，理发没问题！ ,-,-,2021-04-30
653,吴**2,颜色分类: 直充佛缘款+原装刀头+理发套装,好评,好用  买回来后媳妇马上就帮我理发了  确实很好用  满分好评！,-,-,2021-06-06
654,夜**友,颜色分类: 网纹款,好评,你们看 ,-,-,2021-06-12
655,2**9,颜色分类: 直充网纹款,好评,不错 便宜实惠 ,-,-,2021-06-07
656,t**7,颜色分类: 佛缘款+备用电池,好评,质量好，速度快,-,-,2021-06-25
657,s**2,颜色分类: 直充网纹款+原装刀头,好评,东西质量一般，物流特别特别特别慢,-,-,2021-06-09
658,t**2,颜色分类: 直充网纹款,好评,很快就到了，全新正品👑，包装很仔细，没有问题,-,-,2021-06-08
659,t**1,颜色分类: 网纹款+备用电池,好评,价格很优惠   但确实很难用  根本不吃头发,-,-,2021-06-11
660,t**8,颜色分类: 网纹款+原装刀头,好评,东西还是不错的 跟描述一样,-,-,2021-06-14
661,霍**5,颜色分类: 网纹款,好评,电池一点也不好，一个头都理发不完就没有电了 ,-,-,2021-06-16
662,e**y,颜色分类: 网纹款,好评,充电后，今天啟用，太好用了！理起来顺畅极了！超值！,-,-,2021-06-02
663,s**苗,颜色分类: 网纹款+原装刀头,好评,东西很好用，以后会推荐给朋友。,-,-,2021-05-31
664,t**4,颜色分类: 网纹款,好评,此用户没有填写评价。,第一次用就沒劲，以为没电了，也就用了十来次雕刻，现在已经坏了，千万不要上当，好评都昰好评返现才有的。,-,2021-06-24
665,t**0,颜色分类: 佛缘款,好评,好非常好完美。太棒了🌟👏👏👏,-,-,2021-06-15
