1375,b**3,颜色分类: 佛缘款,好评,不是新的有碎头发，划痕，电池也是头发，估计是谁觉得不好用，给退的货，又给发货了,-,-,2021-05-17
1376,s**8,颜色分类: 直充网纹款+原装刀头,好评,回来了，用了一下，挺好用，声音不大，好用 ,这两天用的越来越顺手了,-,2021-05-09
1377,神**加,颜色分类: 佛缘款,好评,货收到了.很好.便宜.值得买… ,-,-,2021-05-05
1378,梁**6,颜色分类: 直充网纹款+理发套装,好评,宝贝非常漂亮，灵巧好用 ,-,-,2021-04-26
1379,t**1,颜色分类: 网纹款+备用电池,好评,买回来试了一下，还可以，不知道能不能用住，随后追加看评论。 ,-,-,2021-06-11
1380,t**3,颜色分类: 直充网纹款,好评,发货快，外观没问题，还没试用。先好评并十五星！,-,-,2021-06-26
1381,t**9,颜色分类: 直充佛缘款,好评,物流非常快，包装完好，迫不及待打开试了一下，感觉还不错，好评。。。,宝贝很好，非常满意的一次购物。。。,-,2021-06-26
1382,我**t,颜色分类: 直充网纹款+原装刀头,好评,货刚收到了，回来试一下，期待效果,-,-,2021-04-19
1383,史**3,颜色分类: 网纹款,好评,宝贝还行就是噪音有点大 ,-,-,2021-05-20
1384,t**7,颜色分类: 直充网纹款+原装刀头+理发套装,好评,商品很棒，老婆给我当场开剪。非常好用！,-,-,2021-06-25
1385,封**光,颜色分类: 直充网纹款,好评,宝贝特别好用，朋友看了也要买一把，谢谢老板送的礼物很实用,-,-,2021-05-08
1386,华**9,颜色分类: 直充佛缘款+原装刀头,好评,做工手感不错，声音稍大，很锋利，还算满意。,-,-,2021-04-16
1387,顺**清,颜色分类: 佛缘款+备用电池+原装刀头+理发套装,好评,此用户没有填写评价。,可以推荐买，性价比蛮高，点赞。,-,2021-04-25
1388,l**s,颜色分类: 网纹款,好评,好用，声音也不大，今天给孩子剪刘海，好整齐，以前用剪刀剪的不好剪齐，用这个非常好弄，非常整齐 ,-,-,2021-05-05
1389,小**宣,颜色分类: 佛缘款+备用电池,好评,宝贝已经收到，高端大气上档次，实用！,-,-,2021-04-23
1390,t**8,颜色分类: 直充佛缘款,好评,非常喜欢下次还会来买这家,非常美观有要的可以下单了,-,2021-06-14
1391,m**w,颜色分类: 佛缘款+备用电池,好评,很好的理发器，你值得拥有！！ ,-,-,2021-04-18
1392,t**1,颜色分类: 佛缘款+备用电池+原装刀头,好评,宝贝收到了，特别满意，质量也是棒棒的,已经用过了，特别好用。,-,2021-06-11
1393,j**8,颜色分类: 直充佛缘款+原装刀头,好评,前面买了一个好用现在又帮朋友买一个 ,好用，真的好用,-,2021-04-28
1394,w**1,颜色分类: 网纹款+备用电池+原装刀头,好评,拿到手好小的 以为不会好用，结果用了试试，还真挺好滴呢，不错哦！！,不用担心了，买了使用就行！！,-,2021-05-03
1395,t**9,颜色分类: 佛缘款+原装刀头,好评,收到宝贝忙试一下，非常好用，很喜欢。,推荐想购买的小伙伴，赶快入手吧。值得购买。,-,2021-06-26
1396,a**全,颜色分类: 网纹款+原装刀头,好评,刚刚收到了，还没有用呢，看起来很高大上，满意 ,-,-,2021-05-06
1397,顾**学,颜色分类: 直充网纹款,好评,就这****？明明是残次品，还***说是复古？！,-,-,2021-05-20
1398,b**e,颜色分类: 直充网纹款+原装刀头,好评,看着结实，用着爽利，好评 ,-,-,2021-04-24
1399,c**7,颜色分类: 网纹款,好评,质量很好的，是正品，用起来很不错，满意 ,-,-,2021-05-03
1400,4**崔,颜色分类: 佛缘款,好评,外观好看，刀子快，剃的头发很干净 ,-,-,2021-04-22
1401,大**邪,颜色分类: 直充网纹款+理发套装,好评,很喜欢，东西也很齐全，特别棒，店主很自信，棒棒哒！！！,用着非常好用，很方便。不错,-,2021-04-19
1402,c**9,颜色分类: 网纹款+备用电池+原装刀头,好评,非常实用，效果也非常好，很舒服！ ,-,-,2021-05-01
1403,t**7,颜色分类: 直充佛缘款,好评,剃的非常干净不卡头发非常满意棒棒的,满意棒棒的,-,2021-06-25
1404,朱**野,颜色分类: 直充佛缘款,好评,小巧实用，比上次买的别家产品顺手多了，好产品！,好产品，得心应手！,-,2021-05-03
1405,y**0,颜色分类: 网纹款+备用电池,好评,东西拿到了，非常有劲，真的很好用。,-,-,2021-04-21
1406,煜**处,颜色分类: 网纹款,好评,没用那到货头一天就给你发信息让你给好评，还买贵了看看人家的 ,-,-,2021-05-20
1407,无**g,颜色分类: 佛缘款+备用电池+原装刀头,好评,手感很好！相当不错！下次还会光顾！ ,哈哈哈哈哈！很不错,-,2021-04-20
1408,t**1,颜色分类: 佛缘款+备用电池+原装刀头,好评,货收到了，和商家说的一样，质量很不错。,东西质量很好，值得下手，还会再来。,-,2021-06-11
1409,1**店,颜色分类: 佛缘款+原装刀头,好评,锂电池充电式理发刀，小巧玲珑，使用起来很方便，质量还可以吧，物流发货很快，客服态度很好。,-,-,2021-04-24
1410,w**9,颜色分类: 佛缘款+备用电池+原装刀头+理发套装,好评,外观材质：真精致，漂亮极了， 使用时长：电量很足，很喜欢 理发效果：很好很喜欢  ,-,-,2021-06-24
1411,柴**峰,颜色分类: 直充佛缘款,好评,好用，漂亮的电推剪，强烈推荐！ ,-,-,2021-04-25
1412,情**3,颜色分类: 佛缘款+备用电池+原装刀头,好评,用着很顺手  值这个价   非常满意 ,手感很好  很好用,-,2021-04-26
1413,爽**贝,颜色分类: 直充网纹款+原装刀头,好评,收到，老公试了试，非常好用！ ,这次购物很满意，以后省理发钱了！,-,2021-04-19
1414,w**0,颜色分类: 佛缘款+备用电池,好评,此用户没有填写评价。,干脆不能用，卡发，一次都没用，刀头有问题，,-,2021-06-24
1415,董**醉,颜色分类: 网纹款,好评,宝贝收到了挺不错的！小巧玲珑挺喜欢的！,-,-,2021-04-24
1416,林**1,颜色分类: 网纹款,好评,使用了下，有点夹头发，其它还好,-,-,2021-05-16
1417,l**0,颜色分类: 直充网纹款+原装刀头+理发套装,好评,真正的物美价廉，必须好评，下次还来、✌️ ,-,-,2021-05-06
1418,s**5,颜色分类: 佛缘款,好评,我这个买39元和24元的一样的。,-,-,2021-04-23
1419,t**1,颜色分类: 网纹款+备用电池+原装刀头,好评,家用很方便 给舅舅买的很实用 ,还不错 大家放心购买吧,-,2021-06-11
1420,百**2,颜色分类: 直充佛缘款,好评,这么多年第一次遇见这样的商家 不评论一直发信息要求五星好评  而且更换手机号发 很烦  不知道大家遇见过没有！,-,-,2021-05-25
1421,7**0,颜色分类: 网纹款,好评,理发效果： 我非常喜欢 ,-,-,2021-04-29
1422,神**草,颜色分类: 佛缘款,好评,宝贝己收到了，试用了一下非常满意! ,-,-,2021-05-09
1423,孤**0,颜色分类: 网纹款+备用电池+原装刀头,好评,宝贝收到了，质量很好，很满意,收到货就用了一下，剃的非常干净，以后再也不用去理发店了，满意,-,2021-04-29
1424,t**3,颜色分类: 直充佛缘款,好评,这家店的剃头推子效果棒棒哒，客服服务态度好而且物流速度也很快，点赞,希望大家能够来这家店买，真心不错的,-,2021-06-26
1425,z**e,颜色分类: 直充佛缘款,好评,效果不错，动力很强，是家里必备神器。,确实好用，理发又快又光。,-,2021-04-25
1426,t**0,颜色分类: 直充佛缘款,好评,颜值是真高 性格比挺高,-,-,2021-06-15
1427,老**w,颜色分类: 佛缘款,好评,宝贝收到了 货真价实    非常满意,-,-,2021-04-30
1428,1**婷,颜色分类: 直充网纹款+原装刀头,好评,回来了用了下真好，快行动吧 ,用了2回了，真心好便宜,-,2021-04-17
1429,阿**0,颜色分类: 网纹款+备用电池+原装刀头,好评,此用户没有填写评价。,刚买来时就一个电池不能，用了三个月就推子没反应了，坏了很久了在哪里放着了，客服说维修师傅晚上九点半上班，一到晚上就下班忘记了，买了那么多次雕刻剪，这是最垃圾的一个，,-,2021-01-16
1430,徐**8,颜色分类: 网纹款,好评,还没有用，看起来挺好的,-,-,2021-05-14
1431,龚**吧,颜色分类: 佛缘款+原装刀头,好评,太垃级了，刻痕，刻不出来。搞半天电池也不耐用。。,垃圾刻痕没用。,-,2021-05-27
1432,本**帅,颜色分类: 直充佛缘款,好评,推的白，各方面都很好。 ,-,-,2021-04-22
1433,狼**岭,颜色分类: 直充佛缘款+原装刀头+理发套装,好评,这个剃须刀很好用，剃的也很干净！发货很快，良心商家！五星好评！ ,已经用了几天了，很不错，剃头一点都不卡头发！很好用！,-,2021-04-16
1434,t**9,颜色分类: 佛缘款+备用电池,好评,东西不错，剃头挺干净。款式好看。又送一个备用电池。 ,大家千万不要买啊，这个刀头一点都不快。而且也剃不掉。说返三元也不返，说让追评再返。商家不讲信用。大家千万不要买。谁买谁上当？,-,2021-06-26
1435,付**4,颜色分类: 网纹款,好评,剃的不错👍性价比超高,-,-,2021-05-08
1436,l**3,颜色分类: 网纹款+备用电池+原装刀头,好评,非常好用，东西不错😊 ,-,-,2021-04-23
1437,t**5,颜色分类: 网纹款+备用电池,好评,买来试了下质量很好很好用,-,-,2021-06-24
1438,沉**6,颜色分类: 直充佛缘款+原装刀头+理发套装,好评,很好用，给宝宝的头发剃的很干净,宝宝的头发剃的干净，非常喜欢,-,2021-05-08
1439,日**没,颜色分类: 网纹款+备用电池+原装刀头,好评,外观材质：好看美观 理发效果：效果可以 就是有点疼 刮的干净 ,-,-,2021-04-29
1440,申**6,颜色分类: 直充佛缘款+理发套装,好评,小推子非常好看 也比较好用值得入手 ,-,-,2021-04-21
1441,t**2,颜色分类: 佛缘款,好评,最恶心的就这种人 货不咋地还一直催 ,-,-,2021-05-17
1442,老**花,颜色分类: 直充网纹款+原装刀头,好评,很棒很好用很喜欢一直想买很方便,很好很喜欢小巧很方便   刀头也很快😀,-,2021-04-22
1443,收**号,颜色分类: 佛缘款+备用电池,好评,精致，雕刻好用 能做到想要的图形状！,雕刻推子拿起来比较重，真材实料,-,2021-05-02
1444,吴**2,颜色分类: 佛缘款+备用电池,好评,好漂亮的油头剪，太好用了,刚刚连续用来剪了几个头太好用了,-,2021-04-17
1445,梦**姣,颜色分类: 网纹款+原装刀头,好评,值得购买的产品，做工非常精细，比想象中的好，推荐大家尝试 ,价格超优惠，性能也非常棒，完美的一次购物,-,2021-04-23
1446,那**4,颜色分类: 直充佛缘款+原装刀头,好评,很精致的推子，备件很多，很好用,准备再买一个送朋友,-,2021-04-30
1447,t**5,颜色分类: 网纹款,好评,此用户没有填写评价。,喜欢 好看.好用,-,2021-06-24
1448,q**2,颜色分类: 网纹款,好评,货收到了，也试过了，很好用，刚才有帮朋友买了一件，价格实慧，值得拥有，大家可以放心购买。好的商品，我会继续介绍。有奖励吗？,-,-,2021-04-19
1449,㊣**㊣,颜色分类: 佛缘款,好评,货已收到，非常满意的一次购物,体验过后，效果非常不错,-,2021-04-19
1450,h**7,颜色分类: 网纹款+备用电池+原装刀头,好评,好用那着也方便便宜，良心商家。,-,-,2021-05-05
1451,t**9,颜色分类: 网纹款+原装刀头,好评,第一次用这种电推剪，还可以,-,-,2021-06-26
1452,三**5,颜色分类: 网纹款+备用电池+原装刀头,好评,宝贝已收到，效果确实不赖，货真价实,-,-,2021-04-30
1453,t**6,颜色分类: 网纹款,好评,质量很好！用起来很方便，刀刃很快，胡子推的干净，比剃须刀实用多了，一推多用，以后需要还会购买，很满意。 ,-,-,2021-06-25
1454,周**云,颜色分类: 网纹款,好评,东西很好 小巧精致还实惠 试了很好用 喜欢的亲可以放心购买  ,-,-,2021-03-01
1455,n**n,颜色分类: 网纹款+备用电池+原装刀头,好评,动力强劲，可换电池，这个没得说。,-,-,2021-04-16
1456,w**6,颜色分类: 网纹款,好评,宝贝收到了，开始有点小问题，卖家服务态度很好，耐心仔细，问题已解决。,-,-,2021-05-18
1457,2**泽,颜色分类: 直充佛缘款,好评,质量不错，干净不咬头发，,-,-,2021-05-24
1458,g**g,颜色分类: 网纹款,好评,正常充电剃须刀的动静，手感比较轻巧。,-,-,2021-04-30
1459,t**8,颜色分类: 网纹款+备用电池+原装刀头+理发套装,好评,这电推㇏剪那不错 真好使,这个电剪刀真的不错 棒棒,-,2021-06-14
1460,飞**子,颜色分类: 佛缘款+备用电池,好评,电推剪非常好用，商家也非常实在，下次还在他家，购物,-,-,2021-04-19
1461,t**2,颜色分类: 网纹款+备用电池+原装刀头+理发套装,好评,只用了一次，感觉很好，噪音很小，很精致，做工也很好满意！,宝贝很满意，设计精致，灵活，好用，会推荐朋友购买。,-,2021-05-05
1462,b**8,颜色分类: 佛缘款,好评,今天刚收到货，推子不错好用，值得购买！ ,-,-,2021-04-26
1463,宇**逛,颜色分类: 佛缘款+备用电池+原装刀头+围布,好评,非常不错的一次购物，看着很小巧，功能非常不错！理发很方便！,非常好！理发很快！还能搞出很多造型！小巧灵珑！方便携带！,-,2021-03-12
1464,z**5,颜色分类: 佛缘款+备用电池+原装刀头,好评,回来就用了、效果不错、还会回购 ,-,-,2021-05-09
1465,寒**7,颜色分类: 直充网纹款+原装刀头+理发套装,好评,收到，非常好，试了一下很有劲！,-,-,2021-04-17
1466,日**s,颜色分类: 直充佛缘款+原装刀头,好评,有重量，有质感，还好看，喜欢 ,-,-,2021-04-24
1467,王**3,颜色分类: 网纹款+备用电池,好评,此用户没有填写评价。,东西真的很好用，值得购买！！,-,2021-04-08
1468,胡**贝,颜色分类: 网纹款,好评,小巧又方便，看起来不错，质量也很好，经济实惠！ ,收到货之后隔壁的老爷爷就试用了一下，他连连称好，确实不错！,-,2021-03-09
1469,f**4,颜色分类: 网纹款,好评,宝贝收到了！看起来做工非常精致！是我想要的！,收到货迫不及待的给老爷子理了发！本人感觉声音不大！动力强劲！刃口锋利！不夹头发！非常满意的一次购物！发货快！客服也很热情！,-,2021-02-20
1470,莱**7,颜色分类: 佛缘款+备用电池,好评,挺好的，动力十足，，噪音小,不错哦，好用,-,2021-04-30
1471,t**5,颜色分类: 佛缘款+备用电池+原装刀头,好评,外观材质：外观材质非常精细，是我喜欢的一款 使用时长：使用时间特别长久 理发效果：效果特别好，跟刀刮的一样 ,雕刻的效果非常好，用着的时候也很灵活，值得五星好评，祝老板生意兴隆,-,2021-06-24
1472,6**郭,颜色分类: 佛缘款+备用电池+原装刀头+理发套装,好评,做工精细，剃头噪音不大。,-,-,2021-05-27
1473,g**6,颜色分类: 直充网纹款,好评,一分钱一分货，这个东西拿来相当的简陋 ,-,-,2021-05-12
1474,t**6,颜色分类: 佛缘款+备用电池+原装刀头+理发套装,好评,光头神器产品非常好用,-,-,2021-06-25
1475,江**六,颜色分类: 佛缘款+备用电池+原装刀头+理发套装,好评,外观材质：外包装完好无损，打开看看配件齐全，质量不错，值得信赖值得推广。 ,-,-,2021-05-08
1476,赵**2,颜色分类: 直充佛缘款+原装刀头,好评,东西很精致，值得推荐。 ,-,-,2021-04-24
1477,t**3,颜色分类: 佛缘款+备用电池+原装刀头+理发套装,好评,此用户没有填写评价。,昨天收到货今天用了一下质质很好老板发货快百问不烦没有骗人敬请放心购买这店的服务态度我十分满意谢谢,-,2021-06-26
1478,w**o,颜色分类: 直充佛缘款+原装刀头,好评,非常满意的一次购物！！！！！！！ ,-,-,2021-05-22
1479,t**1,颜色分类: 网纹款+备用电池+原装刀头,好评,收到电推剪还没有使用，外观黑色大方，物美价廉。 ,-,-,2021-06-11
1480,t**2,颜色分类: 佛缘款,好评,0刀口0距离貌似还做不到，还是有些许差别，其次非静音。但差距不大。总体来说还行。,-,-,2021-05-27
1481,好**人,颜色分类: 直充佛缘款+原装刀头,好评,非常好特别给力非常感谢,-,-,2021-04-26
1482,于**9,颜色分类: 直充佛缘款,好评,宝贝收到了，真是物有所值。 ,-,-,2021-04-22
1483,轻**愿,颜色分类: 网纹款,好评,震动声和动感特别大，都不敢给宝宝用，打开开关大人手都发麻，购买需谨慎。物流也是超级慢 ,-,-,2021-05-21
1484,t**6,颜色分类: 网纹款,好评,剪四五次刀锋就慢了 ,-,-,2021-06-25
1485,明**4,颜色分类: 网纹款+备用电池+原装刀头+理发套装,好评,收到就操作了一下，声音不大，动力十足，值得拥有,-,-,2021-04-19
1486,s**达,颜色分类: 网纹款,好评,东西看起来挺不错的，还没使用，等用了就来追加评论,挺不错的，剪头发操作也很简单，用起来不错，,-,2021-02-27
1487,t**9,颜色分类: 网纹款+备用电池,好评,非常好看 实用,真不错,-,2021-06-26
1488,t**4,颜色分类: 网纹款+备用电池+原装刀头,好评,推剪收到  总体来说还是可以的  没什么瑕疵  希望质量没问题  不要用几次就坏了,-,-,2021-06-24
1489,t**9,颜色分类: 佛缘款,好评,这东西不好用，，卡头发的，害我女儿哭了几小时，，真心的差，，，差评，，，,-,-,2021-06-26
1490,t**3,颜色分类: 直充网纹款+理发套装,好评,质量很好，放心购买,-,-,2021-06-26
1491,t**9,颜色分类: 直充佛缘款+原装刀头+理发套装,好评,我对本商品很满意，轻便小巧值得拥有。 ,-,-,2021-06-26
1492,q**3,颜色分类: 直充网纹款,好评,商品介绍是说可以理光头，实际还是有很明显一截头发，换角度也一样。 ,-,-,2021-05-20
1493,t**0,颜色分类: 网纹款+原装刀头,好评,非常好用，质感很好，满意，下次再来买 ,-,-,2021-06-15
1494,紫**8,颜色分类: 直充网纹款,好评,很好用，自己理发够用,晚上用了一下，不错，很干净,-,2021-04-22
1495,t**7,颜色分类: 网纹款,好评,好东西，不错不错,-,-,2021-06-25
1496,勿**l,颜色分类: 网纹款+原装刀头,好评,东西不错很满意，商家服务态度好值得购买。,-,-,2021-04-29
1497,t**3,颜色分类: 佛缘款,好评,非常好用，物美价廉，我喜欢,-,-,2021-06-26
1498,t**2,颜色分类: 网纹款,好评,very happy with the quality and price of this device. My hair dresser suggested this product for my beard trimming. Could not be more satisfied with this recommendation ,-,-,2021-05-06
1499,t**1,颜色分类: 直充佛缘款+原装刀头+理发套装,好评,此用户没有填写评价。,这非常好用。,-,2021-06-11
1500,王**奇,颜色分类: 佛缘款+备用电池+原装刀头+理发套装,好评,挺好用的，而且送了很多，发货快,-,-,2021-04-19
1501,山**明,颜色分类: 佛缘款,好评,正经玩意！真心推荐！ ,值得购买！,-,2021-04-25
1502,田**会,颜色分类: 佛缘款,好评,刀不够锋利，充电器太松，后期看电池怎么样吧,-,-,2021-05-22
1503,x**人,颜色分类: 直充佛缘款+原装刀头,好评,此用户没有填写评价。,拿回来就给孩子用了，声音小，不会的也可以用，方便携带,-,2021-05-08
1504,小**人,颜色分类: 直充佛缘款+原装刀头+理发套装,好评,货收到了，还没有用呢，看着挺好， ,这款小型电推剪真的是很好用，质量很好，外壳也时尚，,-,2021-05-26
1505,t**0,颜色分类: 网纹款+原装刀头,好评,还不错，价钱很实惠，好用，快递很快，服务态度很好，,-,-,2021-06-15
1506,语**y,颜色分类: 网纹款+备用电池,好评,此用户没有填写评价。,刚开始声音并算太大。现在声音超级大，而且也非常抖动，基本上完全没法用。,-,2021-01-09
1507,黑**常,颜色分类: 佛缘款+理发套装,好评,刚收到，还没用，看起来很不错。小巧精致。 ,-,-,2021-04-20
1508,福**咯,颜色分类: 直充佛缘款,好评,宝贝收到了，好用，快递也给力,-,-,2021-04-24
1509,奔**昊,颜色分类: 佛缘款,好评,电剪比较好看，但是刀头要2个池子卡头发，不知道是不是所有都这样还是只是我运气比较好，唉,-,-,2021-05-21
1510,t**8,颜色分类: 佛缘款,好评,外观材质：质感很好 使用时长：自己理10分钟 理发效果：光头神奇 ,-,-,2021-06-14
1511,t**2,颜色分类: 直充网纹款,好评,好用，锋利！而且可以剪得很短很干净！,-,-,2021-05-02
1512,l**3,颜色分类: 直充佛缘款,好评,东西噪音太大，震动也大，大家一定被卖，手都能震麻了， ,-,-,2021-05-14
1513,耕**叔,颜色分类: 佛缘款,好评,在理发店看到挺好看的，入手一个玩，动力不错，好评！,-,-,2021-04-28
1514,t**4,颜色分类: 直充佛缘款,好评,挺好的，满意，挺荐大家购买,质量不错，非常满意,-,2021-06-24
1515,董**凡,颜色分类: 直充网纹款,好评,振动声大点，配的卡扣变形塑料的好假,-,-,2021-05-23
1516,t**4,颜色分类: 直充网纹款,好评,刚到手就开不了机，充电也不行。客服说换一个，但说要再下单才行，等他们那边收到有问题的货再退款，可我不想这么麻烦，毕竟也不贵就当打水漂得了。,-,-,2021-06-24
1517,赵**5,颜色分类: 网纹款,好评,不错，推得很好，很干净 ,-,-,2021-04-26
1518,太**宝,颜色分类: 直充佛缘款+原装刀头,好评,好！ 很好！ 非常 好！就是 好啊！,-,-,2021-04-20
1519,蒋**仔,颜色分类: 直充网纹款,好评,刀头不是很锋利，剃胡子留余很长。,-,-,2021-04-26
1520,t**3,颜色分类: 网纹款,好评,款式新颖，质量很好，值得购买，下次还会光临😊,这款电推剪真心好用，而且款式也很漂亮。,-,2021-06-26
1521,t**5,颜色分类: 佛缘款,好评,看着还不错，很有手感，还没用里，等用过了再追加评价,-,-,2021-06-24
1522,不**1,颜色分类: 佛缘款,好评,货已收，小巧精致。还没用。等头发长了试试,-,-,2021-04-30
1523,t**2,颜色分类: 网纹款,好评,推子收到了 推头发还卡头发 感觉一般 毕竟价格在,-,-,2021-05-20
1524,t**5,颜色分类: 直充佛缘款+原装刀头+理发套装,好评,一般吧推剪也不是很快。我也不习惯开关的位置。觉得不方便，这个是个人喜欢吧？,-,-,2021-06-24
1525,小**吖,颜色分类: 网纹款,好评,声音不大 小巧方便 拿着顺手 不错不错 ,美发师朋友推荐的 真的挺好用的 物美价廉,-,2021-03-10
1526,实**好,颜色分类: 网纹款,好评,此用户没有填写评价。,买回来时空试一下觉得很好给了个5星，但是昨晚上真正用时根本就无力，太卡发了，慎拍,-,2021-05-18
1527,t**4,颜色分类: 佛缘款,好评,客服服务很到位，质量很好,剃刀很不错，剃的很干净,-,2021-06-24
1528,都**了,颜色分类: 佛缘款,好评,实物更精致好用 帮朋友又买一个,-,-,2021-04-19
1529,d**e,颜色分类: 网纹款+原装刀头,好评,家伙没全拿出来，最近入的。可以准备进军美发业了，完全没有问题，等我晒作品。 ,-,-,2021-03-10
1530,t**6,颜色分类: 网纹款+备用电池+原装刀头+理发套装,好评,物流挺快的，东西轻巧方便，外观漂亮，不错,-,-,2021-06-25
1531,多**1,颜色分类: 佛缘款+备用电池+原装刀头,好评,外观材质：剪头上有点塑料配件设计不好。 ,大家不要电池太差了。,-,2021-05-24
1532,s**2,颜色分类: 直充网纹款,好评,东西不错买回来都使用了，效果是自己理想的状态 ,-,-,2021-05-06
1533,爱**超,颜色分类: 网纹款,好评,很好劲挺大的，和介绍的一模一样，给个赞！,买来剃胡子用的，剃的挺干净，物美价廉值得购买！,-,2021-03-16
1534,小**5,颜色分类: 佛缘款,好评,理发器动力一般吧，理发时最好洗洗头在剪，头发厚了油了理发器会吃力。  ,-,-,2021-05-06
1535,t**0,颜色分类: 网纹款+备用电池+原装刀头+围布,好评,收到了宝贝，外观不错跟我已前买的比这个更好。,-,-,2021-06-15
1536,2**u,颜色分类: 直充网纹款,好评,宝贝不错，收到货立即使用，哈哈省出理发钱已足够购买电推剪了，满意非常满意，而且物流也快。,-,-,2021-04-21
1537,t**1,颜色分类: 直充网纹款+原装刀头,好评,产品设计不理想卡机动力不足,-,-,2021-06-11
1538,s**t,颜色分类: 直充网纹款+理发套装,好评, 宝贝收到了，非常喜欢，货物与商家的描述相同。赠品很多推子很好用，刃口也很锋利。回来后立即给老爸使用了，操作很顺手，方便物流很快，客服服务也非常满意。,-,-,2021-05-06
1539,1**z,颜色分类: 直充网纹款,好评,不喜欢他家的某个方式，我这边一显示货已签收，客服立马跟过来消息，让怎样怎样的，你也得容人家试过之后自然会来评论的 ,-,-,2021-04-27
1540,b**7,颜色分类: 直充佛缘款+原装刀头,好评,便宜实用，还可以用来刮胡子。 ,-,-,2021-04-20
1541,x**2,颜色分类: 直充佛缘款,好评,货已收到，用时顺手方便，比实体店便宜,发货很快，推子锋利，理想的选择,-,2021-05-06
