948,l**7,颜色分类: 少女粉【充电款5000毫安】超长续航推荐,好评,宝贝收到了，非常喜欢，很满意，下次还会光顾,-,-,2021-06-11
949,t**8,颜色分类: 少女粉【充电款3600毫安】续航推荐,好评,小巧，方便,-,-,2021-06-17
950,凉**f,颜色分类: 象牙白【充电款2500毫安】,好评,很好  很喜欢 ,-,-,2021-06-09
951,1**晨,颜色分类: 梦幻蓝【不充电款】,好评,都坏了，不转了！ ,-,-,2021-06-20
952,抬**5,颜色分类: 少女粉【不充电款+2米延长线】,好评,商品质量不错，细节、品质、做工都非常好，发货贼快，快递也给力，棒棒哒~🌸🌸🌸 ,-,-,2021-06-05
953,t**9,颜色分类: 象牙白【充电款3600毫安+2米延长线】续航推荐,好评,感觉好小，,-,-,2021-06-17
954,y**妮,颜色分类: 象牙白【充电款2500毫安】,好评,第二次买了，很好，很不错哦 ,-,-,2021-06-09
955,p**6,颜色分类: 象牙白【充电款5000毫安】超长续航推荐,好评,很实用，携带方便，满意,-,-,2021-06-12
956,2**s,颜色分类: 象牙白【充电款5000毫安】超长续航推荐,好评,不错很喜欢有声音也正常 ,-,-,2021-06-03
957,t**5,颜色分类: 象牙白【充电款3600毫安】续航推荐,好评,物美价廉  就是声音有点大  ,-,-,2021-06-17
958,g**g,颜色分类: 梦幻蓝【充电款3600毫安】续航推荐,好评,此用户没有填写评价。,什么****啊，吹了不到一小时就没电了，早知道就不贪便宜去买别家贵一点的了，又不给退换货，只好花一二十块钱买了几节电池换用，无语,-,2021-06-05
959,n**h,颜色分类: 象牙白【充电款2500毫安】,好评,挺不错的，质量做工确实蛮好，三档可以调节的，风扇迷你的，风力还可以 ,-,-,2021-06-01
960,t**6,颜色分类: 梦幻蓝【充电款2500毫安+2米延长线】,好评,风扇是迷你型的超爱的，也很容易携带，特别的精致颜色很好看呢，底座是夹子的 的特别稳， ,-,-,2021-06-18
961,飘**7,颜色分类: 象牙白【充电款5000毫安】超长续航推荐,好评,很好，宿舍够用了，很凉快 ,-,-,2021-06-10
962,2**芳,颜色分类: 少女粉【充电款3600毫安】续航推荐,好评,很好用，风也很大，夹在婴儿床给我女儿用的。,-,-,2021-06-01
963,t**8,颜色分类: 象牙白【充电款3600毫安】续航推荐,好评,很费电噢  不存点噢,-,-,2021-06-17
964,t**6,颜色分类: 象牙白【不充电款】,好评,声音不大，颜值很高，棒棒哒！ ,-,-,2021-06-18
965,曰**十,颜色分类: 少女粉【充电款2500毫安】,好评,此用户没有填写评价。,很便宜，就是质量有些堪忧，买了好几个，跟舍友一起买的，五个有一个是坏的，然后再补发，第一次补发的也还是个坏的，第二次补发的还没到货，风扇好用，风力很大,-,2021-06-03
966,石**狗,颜色分类: 少女粉【充电款5000毫安】超长续航推荐,好评,这款小风扇质量非常好，外观也很漂亮，安装起来很简单，风力也很大。,-,-,2021-06-08
967,t**2,颜色分类: 象牙白【充电款2500毫安】,好评,客服态度极差，风扇很小，风力也很小，不值这么多钱，我同学十五块钱买的都比这大，大多了，什么玩意，太差了，千万别买，服了！,-,-,2021-06-19
968,t**5,颜色分类: 少女粉【充电款5000毫安+2米延长线】超长续航推荐,好评,很耐用也很好看,-,-,2021-06-17
969,t**0,颜色分类: 梦幻蓝【充电款3600毫安+2米延长线】续航推荐,好评,物流发货很快，客服小姐姐服务态度也很好。,-,-,2021-06-20
970,t**1,颜色分类: 梦幻蓝【不充电款】,好评,非常好用  风速也挺大的！！！！！！！！！,-,-,2021-06-18
971,爱**颖,颜色分类: 少女粉【充电款3600毫安】续航推荐,好评,东西太小太一般了,-,-,2021-06-11
972,t**2,颜色分类: 梦幻蓝【充电款5000毫安】超长续航推荐,好评,客服态度很好物流很快推荐大家购买,-,-,2021-06-19
973,女**情,颜色分类: 象牙白【充电款2500毫安】,好评,问客服说可以一边充电一边吹结果充电时怎么按都打不开 后来说是电池问题 补发了电池 结果开关又不管用了 连档位都没有了 差差差 客服也不理人 呵呵,-,-,2021-06-16
974,杨**2,颜色分类: 少女粉【充电款5000毫安+2米延长线】超长续航推荐,好评,还不错，精致 ,-,-,2021-05-31
975,t**9,颜色分类: 少女粉【不充电款+2米延长线】,好评,很不错，扇起来很舒服,-,-,2021-06-17
976,米**药,颜色分类: 少女粉【充电款2500毫安+2米延长线】,好评,别看小巧玲珑的，风力挺大的，颜色很正好看发，放在写字台吹吹刚刚好，力荐力荐。 ,-,-,2021-06-08
977,就**3,颜色分类: 象牙白【不充电款+2米延长线】,好评,享年一天  电路板烧了😪,-,-,2021-06-10
978,洁**3,颜色分类: 少女粉【充电款3600毫安+2米延长线】续航推荐,好评,宝贝漂亮小巧精致，风力不错三档，而且风力也挺不错，风速适中 声音也不大 不会产生很大的噪音 便携性：小巧而且很好携带 。三个风级很轻巧，可以拿在手上，可以放在桌子上，这么便宜就买到一个风扇，而且效果也超级给力 ,-,-,2021-05-04
979,t**7,颜色分类: 少女粉【充电款2500毫安】,好评,电扇买来几天就不能用了，去联系客服，也不知道是客服装傻，还是没有人工客服，就是不给我转人工，一直在重复那几句话，问运费险的事，一直说不清，有那退运费的钱，我都直接买个新的了，还说让我去详情页自己看，看得懂我要客服干啥呀？要不是下限只有一星，我都想打负星了，各位朋友看着买，能承受住，那我不拦你，一个破电扇而已，在哪买不是买呢，就当**十几块钱吧！ ,-,-,2021-06-17
980,西**0,颜色分类: 少女粉【充电款3600毫安+2米延长线】续航推荐,好评,风扇收到了，粉粉的很可爱，主要是风力够大声音很小可以，可充电三挡调节，推荐购买,-,-,2021-06-04
981,王**6,颜色分类: 少女粉【充电款5000毫安】超长续航推荐,好评,很好很好满意，物流也很快，质量也很好,-,-,2021-06-14
982,t**0,颜色分类: 象牙白【不充电款】,好评,非常好 还会发光 ,-,-,2021-06-20
983,1**呀,颜色分类: 少女粉【充电款2500毫安】,好评,很可爱，风力也很大，值得购买,-,-,2021-05-29
984,t**9,颜色分类: 梦幻蓝【充电款5000毫安】超长续航推荐,好评,此用户没有填写评价。,建议大家不要来他家买，东西质量真心差，小风扇吹不了半小时就没电了，两节电池都是如此。咨询客服，没有一个好的回复。差评！差评！差评！,-,2021-06-17
985,冬**阳,颜色分类: 象牙白【充电款3600毫安】续航推荐,好评,不错，非常棒👍,-,-,2021-06-09
986,t**1,颜色分类: 少女粉【充电款3600毫安】续航推荐,好评,用的还可以，不错,-,-,2021-06-18
987,叫**1,颜色分类: 象牙白【不充电款】,好评,超级棒，喜欢😍,-,-,2021-06-14
988,t**0,颜色分类: 象牙白【充电款2500毫安】,好评,很棒，性价比高,-,-,2021-06-20
989,x**7,颜色分类: 象牙白【充电款5000毫安】超长续航推荐,好评,我买的是象牙白，给我发个蓝色的，而且主图和这一点也不符，主图看起来挺大的，结果……反正就很无语,别买，太坑了，噪音太大,-,2021-05-15
990,t**m,颜色分类: 象牙白【充电款5000毫安】超长续航推荐,好评,外型美觀，寧靜，風力很強！,需要的亲们可以放心购买 便携性：正品，买的放心，价钱也公道，满意！ 外观材质：物流超级超级快！质量也非常不错，的确物有所值yu,-,2021-06-05
991,奔**1,颜色分类: 少女粉【充电款2500毫安】,好评,风力效果：风挺大的 然后携带也便捷 而且这个价位好惊喜 外观挺好看的粉粉嫩嫩 ,-,-,2021-06-06
992,懵**霓,颜色分类: 少女粉【不充电款】,好评,haokq ,-,-,2021-06-11
993,对**承,颜色分类: 梦幻蓝【不充电款+2米延长线】,好评,质量差，物流慢。,-,-,2021-06-05
994,t**4,颜色分类: 少女粉【充电款2500毫安】,好评,货真价实物美价廉，下次还来你家 ,-,-,2021-06-18
995,z**9,颜色分类: 少女粉【充电款5000毫安】超长续航推荐,好评,做工真的非常棒，我觉着我可以推荐给我朋友买小身材，大风力，说的就是这个迷你小小风扇了。真的特别小巧可爱，可以随意外带。 这次安排了个小风扇，以备天热时使用，风力够用了，真是小小的身体大大的能量啊。档数的风速可以调节，过段时间夏季了就不怕了 ,-,-,2021-06-04
996,连**信,颜色分类: 少女粉【充电款5000毫安】超长续航推荐,好评,风扇质量挺好的，迷你可爱，风力还不小，携带特别方便。,-,-,2021-06-01
997,林**沙,颜色分类: 梦幻蓝【不充电款】,好评,做工不错，噪音小，一个按键三档风力还是电源开关，风力够用还节能！满意！！,-,-,2021-06-07
998,t**4,颜色分类: 少女粉【充电款2500毫安+2米延长线】,好评,产品质量，客服服务态度特别好，很喜欢，好评 ,-,-,2021-06-18
999,张**1,颜色分类: 少女粉【充电款5000毫安+2米延长线】超长续航推荐,好评,风扇质量很好，风力也挺大的。放到学习桌上给孩子用很合适 ,-,-,2021-06-07
1000,a**3,颜色分类: 梦幻蓝【充电款5000毫安】超长续航推荐,好评,还可以换挡调节风力，睡觉时放在床头柜，写作业是放在书桌，吃饭时放在餐桌，上课时可以带到学校，真心不错！还是USB接口充电，随时随地可以充电的吖！ 外观材质：材质看起来很奈斯，摸起来也很舒服,-,-,2021-05-04
1001,l**r,颜色分类: 少女粉【充电款5000毫安】超长续航推荐,好评,风扇小巧实用。粉色好看，动力足，扇起风来凉快,-,-,2021-06-06
1002,t**5,颜色分类: 少女粉【充电款2500毫安】,好评,东西到货拿到手，用了不到一小时没电了，充不上电。联系客服服务态度恶劣，不解决问题,-,-,2021-06-17
1003,艾**a,颜色分类: 梦幻蓝【充电款2500毫安】,好评,风力挺大，很满意。👍,-,-,2021-06-08
1004,凌**灵,颜色分类: 少女粉【充电款2500毫安】,好评,风力效果：风挺大的 便携性：迷你装方便携带 外观材质：美观 ,-,-,2021-06-01
1005,t**6,颜色分类: 象牙白【充电款5000毫安+2米延长线】超长续航推荐,好评,风力挺足的，噪音也不大，外观设计合理好看，宿舍里用很方便，奈斯～ ,-,-,2021-06-18
1006,琦**3,颜色分类: 象牙白【充电款5000毫安】超长续航推荐,好评,物流很快，挺不错的。好评。,-,-,2021-06-12
1007,芩**哒,颜色分类: 少女粉【充电款3600毫安+2米延长线】续航推荐,好评,便携小风扇就是夏天的必备物，粉色的颜值超高，很有少女心，质量也很好 ,-,-,2021-06-02
1008,心**n,颜色分类: 梦幻蓝【充电款5000毫安+2米延长线】超长续航推荐,好评,充一次 若用最大功率 只能用两小时左右,-,-,2021-06-13
1009,t**6,颜色分类: 少女粉【充电款2500毫安】,好评,我自己不会弄，先是电池按错了，又是冲坏了电池，客服一直很耐心的给我讲解，还补发了电池，必须好评,-,-,2021-06-18
1010,1**丁,颜色分类: 梦幻蓝【充电款2500毫安】,好评,风扇是坏的电池没有用，只能插着吹 ,蓝色的电池坏的只可插电用，粉色少配件，反应给售后一直推责任不处理,-,2021-06-15
1011,t**7,颜色分类: 少女粉【充电款2500毫安】,好评,挺好用的   就是有点小   巴掌大点 ,-,-,2021-06-17
1012,傻**左,颜色分类: 少女粉【充电款3600毫安】续航推荐,好评,此用户没有填写评价。,电池没有标明是多大的，买的3600，说是可用4-6小时，其实一个小时就没电了，因为排队打疫苗用的时间很准，虽说客服补发了一个电池，补发的还不如原来的，两个加一起都没2小时，差评,-,2021-06-03
1013,w**4,颜色分类: 象牙白【充电款5000毫安+2米延长线】超长续航推荐,好评,不能直接插电用。只能插电池充电，买之前还特意问了，说是可以的，买回来之后只能插电池充电，不能直接插USB使用，跟客服阐明情况，客服不解决。客服态度差！态度差！不推荐购买！！！风音风噪特别大。物流也是差，有快递驿站不放，不知道跑哪去了。 风力效果：一般 ,-,-,2021-05-23
1014,远**物,颜色分类: 象牙白【充电款2500毫安】,好评,宝贝很好，很给力。非常满意。,用了一段时间了，宝贝很好，非常棒，十分满意。,-,2021-06-07
1015,m**0,颜色分类: 梦幻蓝【充电款5000毫安】超长续航推荐,好评,这个小电风扇小巧玲珑，可爱精致，夏天到了，再也不怕热了。 ,-,-,2021-06-08
1016,秦**军,颜色分类: 梦幻蓝【充电款5000毫安】超长续航推荐,好评,小风扇不错，颜值杠杠的，风力也正好，价格便宜。 ,-,-,2021-06-04
1017,君**9,颜色分类: 少女粉【充电款2500毫安】,好评,收到货，很好用强烈推荐 ,-,-,2021-05-31
1018,l**丝,颜色分类: 梦幻蓝【不充电款】,好评,便宜不是货，是货不便宜是真的如此，视频拍了也是卖家自己说坏了，结果。。。。。 真的根本用不了，建议不要买为好 ,-,-,2021-05-23
1019,0**r,颜色分类: 少女粉【充电款5000毫安】超长续航推荐,好评,小风扇质量非常好，风力很大，放在宿舍床头吹很凉快，很实用 ,-,-,2021-06-02
1020,o**女,颜色分类: 少女粉【充电款5000毫安】超长续航推荐,好评,物流时效快，产品质量好，卖家服务态度好，好评 ,-,-,2021-06-11
1021,一**3,颜色分类: 梦幻蓝【不充电款】,好评,微型小电扇真的很不错 风力大 无杂音 外观吗 也很好看 ,-,-,2021-06-01
1022,崇**子,颜色分类: 少女粉【充电款3600毫安+2米延长线】续航推荐,好评,本来不想评价的，特意买的大毫宝的，可以电池使用时间太短了，需要经常充电,-,-,2021-06-15
1023,t**0,颜色分类: 象牙白【充电款3600毫安+2米延长线】续航推荐,好评,风扇收到了，做工质量都不错，便宜 ,-,-,2021-06-20
1024,婷**7,颜色分类: 少女粉【充电款3600毫安】续航推荐,好评,风速还行，有三档风速，模式声音也不大，粉色的很可爱！,-,-,2021-06-15
1025,花**0,颜色分类: 少女粉【不充电款】,好评,很好，在宿舍里用很方便，比较满意。 ,-,-,2021-06-06
1026,t**3,颜色分类: 少女粉【不充电款】,好评,细节非常完美，整体来说真的很不错。性价比很高，下次还会继续光顾！,-,-,2021-06-17
1027,l**0,颜色分类: 少女粉【充电款3600毫安+2米延长线】续航推荐,好评,带出门太方便了，电池容量大，可以用很久哟，质量很好，颜色满意,-,-,2021-06-02
1028,t**3,颜色分类: 少女粉【充电款3600毫安+2米延长线】续航推荐,好评,真的很合适啊，充一次电可以用好久，风力也很足，建议购买呀,-,-,2021-06-17
1029,t**4,颜色分类: 梦幻蓝【充电款2500毫安+2米延长线】,好评,此用户没有填写评价。,己经用了一段时间了图色跟货没有色差，你别看他小，但是风力是三个档的丶很好用更方便带走真的是小巧玲珑比我想想的还更贴心。,-,2021-06-18
1030,搜**站,颜色分类: 象牙白【不充电款】,好评,颜色发错，底座下面很脏,-,-,2021-05-15
1031,t**7,颜色分类: 象牙白【充电款2500毫安】,好评,颜色给我发错了，拍的白色发的粉色，但是也很好看,-,-,2021-06-17
1032,t**5,颜色分类: 少女粉【充电款3600毫安+2米延长线】续航推荐,好评,风扇小小的，不占空间，风力也还可以，适合宿舍用 ,-,-,2021-06-17
1033,开**w,颜色分类: 象牙白【充电款5000毫安】超长续航推荐,好评,小迷你风扇。携带方便，风力十足，凉快极了。 ,-,-,2021-06-08
1034,t**7,颜色分类: 少女粉【充电款2500毫安+2米延长线】,好评,不错哦 晚上放床上 睡觉时用 风力刚刚好，宝贝颜值真的高,-,-,2021-06-17
1035,t**0,颜色分类: 象牙白【充电款5000毫安】超长续航推荐,好评,风扇好大的风，我喜欢，声音不会很大，小小的风扇大大的能量，,-,-,2021-06-20
1036,不**赎,颜色分类: 象牙白【充电款5000毫安】超长续航推荐,好评,此用户没有填写评价。,就是坨屎  什么****儿 电要充三个小时 充了只能用十分钟左右 送的两个电池用完就没用了 充电都不管用  真垃圾,-,2021-06-05
1037,t**1,颜色分类: 象牙白【充电款2500毫安】,好评,颜值可可可，就是续航能力好像不大行，满电的还撑不过一堂大课（差不多两个小时左右） ,-,-,2021-06-18
1038,银**萍,颜色分类: 象牙白【充电款5000毫安+2米延长线】超长续航推荐,好评,这款迷你小风扇真的实用，一星期回家充一次，又小又方便，小巧玲珑超爱 ,-,-,2021-05-29
1039,t**7,颜色分类: 象牙白【不充电款+2米延长线】,好评,东西已经收到！手感不错！用料扎实！质量很好！平常用基本没有问题！挺好的，价格适中，质量看着不错，就是买的白色结果发的是粉色，总体来说很漂亮的，,-,-,2021-06-17
1040,范**6,颜色分类: 少女粉【充电款2500毫安】,好评,风力效果：合适 便携性：小巧便捷 外观材质：可爱 ,-,-,2021-05-29
1041,t**2,颜色分类: 象牙白【充电款2500毫安】,好评,风力很***档和一档根本没什么区别！！！而且耗电很快，充满了电，不到一节课就不能用了！！垃圾🙃 ,-,-,2021-06-19
1042,t**7,颜色分类: 梦幻蓝【充电款3600毫安】续航推荐,好评,用起来很方便，风也很大，良心商家,-,-,2021-06-17
1043,t**4,颜色分类: 象牙白【不充电款】,好评,丶像玩具但又很实用物小可任意放风吹在上身又很舒服老人特别实用价也很便宜我还想买去送人。,-,-,2021-06-18
1044,婷**子,颜色分类: 少女粉【充电款5000毫安+2米延长线】超长续航推荐,好评,风力挺强的，白天放在办公司里面吹，好舒服(✪▽✪)，晚上还可以带回家，方便 ,-,-,2021-06-07
1045,金**饰,颜色分类: 少女粉【充电款2500毫安+2米延长线】,好评,很小巧玲珑的一款风扇，外观很好看也实用，风力很足，很喜欢，推荐购买 ,-,-,2021-06-08
1046,j**7,颜色分类: 少女粉【充电款5000毫安】超长续航推荐,好评,小风扇的声音小，价格实惠，还可以充电,-,-,2021-06-08
1047,r**o,颜色分类: 象牙白【充电款2500毫安】,好评,小型号迷你风力可以静充电快比其它此可选择。,-,-,2021-05-31
1048,爱**在,颜色分类: 梦幻蓝【充电款3600毫安+2米延长线】续航推荐,好评,这款产品方便携带，风大，形状好看，功能性很强，棒棒哒！,-,-,2021-06-02
1049,t**2,颜色分类: 梦幻蓝【充电款3600毫安】续航推荐,好评,电风扇挺好的，风大也挺好看，但是续航时间没有店家说的那么就但是也挺好的了，快递包装很简单没有保护措施，还有就是店家很烦一直发消息叫我给好评。,-,-,2021-06-19
1050,t**3,颜色分类: 少女粉【充电款2500毫安】,好评,好用 也好看便携 ,-,-,2021-06-17
1051,t**0,颜色分类: 象牙白【充电款3600毫安】续航推荐,好评,之前买了别家的退货了，又买了这家的，这个做工精细，材料很好，质感很不错，很硬实，风力挺大的，三个挡位，静音，就是颜色发错了，不过也挺好看的，,-,-,2021-06-20
1052,邓**鹏,颜色分类: 梦幻蓝【不充电款】,好评,三档风速，风蛮大的，数据线够长。晚上把两个电池都充满，孩子第二天带到学校用，开低档，只上课时间开的话，电量可以坚持到下午放学。目前来说还不错，希望耐用。,-,-,2021-05-30
1053,李**2,颜色分类: 少女粉【充电款2500毫安+2米延长线】,好评,很好的迷你风扇，放在办公桌上用真好，真心不错，闺蜜们看了都要买。,-,-,2021-06-01
1054,t**5,颜色分类: 梦幻蓝【充电款3600毫安】续航推荐,好评,风力效果：不好开了几分钟就停了，根本没用，坑人的，还不如几块钱的东西 ,-,-,2021-06-17
1055,呼**2,颜色分类: 少女粉【充电款2500毫安+2米延长线】,好评,风扇挺小的，但是风力比较大，携带方便，外观挺好的。 ,-,-,2021-06-08
1056,a**9,颜色分类: 少女粉【充电款2500毫安+2米延长线】,好评,挺好，风力大，精致漂亮 ,-,-,2021-06-02
1057,李**9,颜色分类: 少女粉【充电款2500毫安】,好评,风扇小巧迷你，风力大，无噪音，移动方便，很喜欢,-,-,2021-06-05
1058,钟**2,颜色分类: 梦幻蓝【不充电款】,好评,果然是迷你的，比图片小很多，但能凑合,-,-,2021-06-10
1059,认**k,颜色分类: 象牙白【充电款3600毫安+2米延长线】续航推荐,好评,风扇颜值高，最近天气热在宿舍用，风扇风挺大的，续航能力不错 ,-,-,2021-06-05
1060,t**4,颜色分类: 少女粉【充电款5000毫安】超长续航推荐,好评,风扇收到了粉粉的很好看，还可以调1，2，3挡风特别好用很喜欢，值得入手 ,-,-,2021-06-18
1061,r**8,颜色分类: 少女粉【不充电款】,好评,欺骗消费者，匪夷所思。 只是个简单的退换货问题，我反馈了不能用并且提供了视频后就不回复了？？？ ,垃圾中的战斗鸡,-,2021-05-22
1062,昔**0,颜色分类: 少女粉【充电款2500毫安】,好评,买给朋友的生日礼物，颜色很好看，她很喜欢。 ,-,-,2021-05-30
1063,t**7,颜色分类: 梦幻蓝【充电款3600毫安+2米延长线】续航推荐,好评,风力很大，不低于大的风扇，非常适合学生用 ,-,-,2021-06-17
1064,生**3,颜色分类: 象牙白【充电款3600毫安+2米延长线】续航推荐,好评,风扇风很大，在炎热的夏季送来一丝清凉，可以缓解一下。,-,-,2021-06-07
1065,t**3,颜色分类: 少女粉【充电款3600毫安】续航推荐,好评,此用户没有填写评价。,我只能说心累，才买了一个月，就坏了然后保修不包运费，说一个月内包我上个月八号，现在才九号就差一天，他就不包了，本身就不是我的原因，真是恼火,-,2021-06-17
1066,6**萍,颜色分类: 象牙白【充电款3600毫安】续航推荐,好评,质量很好很实用便携的小风扇，充电一次也可以用蛮久的！ ,-,-,2021-06-02
1067,疾**雨,颜色分类: 梦幻蓝【充电款2500毫安】,好评,买了不到两天电池就坏了，商家说补发，补了10天了也没补，找客服，客服要么不搭理，要么就敷衍，说话驴唇不对马嘴，非常生气。 ,-,-,2021-06-09
1068,t**3,颜色分类: 梦幻蓝【不充电款】,好评,此用户没有填写评价。,特别好用，,-,2021-06-17
1069,l**8,颜色分类: 少女粉【充电款3600毫安】续航推荐,好评,此用户没有填写评价。,用了一段时间来评论 买的第一天就充满电开始用 不到2个小时就没电 然后找客服 客服说可能电池不好 重新寄了一个 结果 没有什么** 这次居然用不到1个小时就停了 差评,-,2021-06-07
1070,余**9,颜色分类: 梦幻蓝【充电款2500毫安】,好评,质量很好，很凉快 ,-,-,2021-06-02
1071,泉**花,颜色分类: 少女粉【充电款5000毫安+2米延长线】超长续航推荐,好评,颜色粉嫩粉嫩的，线够长，出风凉爽，风力大 ,-,-,2021-06-05
1072,罗**搓,颜色分类: 梦幻蓝【不充电款】,好评,风力效果：还可以三个档位 便携性：小巧 外观材质：不错 ,-,-,2021-06-02
1073,t**9,颜色分类: 象牙白【充电款2500毫安】,好评,风力效果：舒适 便携性：便捷 外观材质：好看 ,-,-,2021-06-17
1074,何**i,颜色分类: 象牙白【充电款3600毫安+2米延长线】续航推荐,好评,质量可以的，风力强劲，充好电能用挺久的，挺不错的。 ,-,-,2021-06-02
1075,d**灵,颜色分类: 梦幻蓝【充电款2500毫安】,好评,风力很大，外观很喜欢，不错的小风扇喜欢的就入手吧，售后服务也很棒 ,-,-,2021-05-30
1076,t**1,颜色分类: 少女粉【充电款2500毫安】,好评,很可爱的小风扇，虽然一开始送来用了一次就坏了（可能是我的问题），但是客服态度非常好噢又给我发了一台，风力也大，很方便。这个价格也很划算！！,-,-,2021-06-18
1077,世**人,颜色分类: 少女粉【充电款5000毫安】超长续航推荐,好评,风扇很轻便，风量很大，续航也挺长，而且噪音很小。,-,-,2021-06-08
1078,t**9,颜色分类: 少女粉【充电款5000毫安】超长续航推荐,好评,真的特别迷你，孩子写作业不用愁了，每天都会用，特别凉快,-,-,2021-06-17
1079,坏**丿,颜色分类: 少女粉【充电款5000毫安】超长续航推荐,好评,小风扇风力很大，有3个档，充一次电可以用好久，大赞。,-,-,2021-06-08
1080,t**9,颜色分类: 梦幻蓝【充电款2500毫安】,好评,小风扇很好用！风不是很硬，给宝宝用正合适,-,-,2021-06-17
1081,小**潘,颜色分类: 象牙白【充电款3600毫安+2米延长线】续航推荐,好评,客服晶晶特别暖，谢谢你🙏 ,-,-,2021-05-31
