1326,l**5,颜色分类: 香槟金★送收纳盒+耳机+充电线+录音线+麦罩 套餐名称: 唱将级K歌神器,好评,样式非常喜欢，话筒声音挺正的，自己在家也可以唱歌了，音响声音很洪亮，音质清晰，唱歌收音播放也是很清晰的，没有杂音电流啥的，用蓝牙连接贼方便了，无聊连接蓝牙可以放歌，完全可以满足我了，而且商家的服务也特别到位，有需要会再买的！  价格实惠，方便好用，一次性买了两个，再也不用边提扩音喇叭边拿话筒了，绝对的好货！！！,-,-,2021-01-05
1327,幽**梦,颜色分类: 玫瑰金★送收纳盒+耳机+充电线+录音线+麦罩 套餐名称: 唱将级K歌神器,好评,此用户没有填写评价。,拿着很有质感，拿在手上很舒服。在别家买的音质一般，这家买的是真的音质不错，外观大小很合适唱歌音质很清晰没有听到杂音，麦克风功能齐全，颜色和图片描述的一样，还自带音箱。宝贝给力，特别好，音质音量很清晰，颜色也很好看，售后也挺好的有问必答的，在家就可以唱歌，等假期的时候在家里玩简直太方便了,-,2021-01-02
1328,马**9,颜色分类: 雅典黑★送收纳盒+耳机+充电线+录音线+麦罩 套餐名称: 唱将级K歌神器,好评,这个麦克风很适合玩全民K歌，录歌清晰，还有混响效果也好，调节了下唱出来的效果杠杠的，评分也比之前容易上去啦，总之用着满意的，姐姐也是K歌迷哦，打算给她也推荐一下 ,主要是录歌的时候没有喷麦了，效果很好🎶，音量和混响大小还可以单独控制，功能也齐全，可玩性很好😊,^_^ 亲，索爱话筒音响一体麦克风，众多资深音响师鼎力推荐，数十年国民品牌匠心研发，K歌及音响效果杠杠滴。手机、电脑、电视随时随地无线嗨唱。索爱K歌产品已狂销300万件+，音质有口皆碑，中国好声音冠名品牌，质量保证，值得亲的信赖！【德荣盛·天猫TOP商家·8年天猫老店·22年专注音响行业】,2021-01-21
1329,y**g,颜色分类: 香槟金★送收纳盒+耳机+充电线+录音线+麦罩+支架+蓝牙发射器 套餐名称: 唱将级K歌神器,好评,话筒真的超给力的，款式新颖声音很大，不知道的人以为最起码要几百元以上，蓝牙连接速度超级快，这下就能唱出优美的歌声了，很有质感，还可以连接蓝牙设备，在K歌房里朋友都在问哪里买的音效真不错，也想买一个，在家里也可以像K歌房一样，很是喜欢！  ,音质也很好，非常满意，会推荐给朋友的,^_^ 亲，索爱话筒音响一体麦克风，众多资深音响师鼎力推荐，数十年国民品牌匠心研发，K歌及音响效果杠杠滴。手机、电脑、电视随时随地无线嗨唱。索爱K歌产品已狂销300万件+，音质有口皆碑，中国好声音冠名品牌，质量保证，值得亲的信赖！【德荣盛·天猫TOP商家·8年天猫老店·22年专注音响行业】,2021-02-02
1330,这**6,颜色分类: 雅典黑★送收纳盒+耳机+充电线+录音线+麦罩 套餐名称: 唱将级K歌神器,好评,音质很好，去年有买过，这次再买一个，好才会再购，质量非常棒，即是音响又是麦克风，宝贝自带音箱，每天晚上家人就开始开启KTV模式唱歌，放松气氛，在家唱唱歌娱乐一下，也可以培养唱歌的习惯哈哈，非常满意,质量很好，音效很棒，买回来非常满意，五星好评,^_^ 亲，索爱话筒音响一体麦克风，众多资深音响师鼎力推荐，数十年国民品牌匠心研发，K歌及音响效果杠杠滴。手机、电脑、电视随时随地无线嗨唱。索爱K歌产品已狂销300万件+，音质有口皆碑，中国好声音冠名品牌，质量保证，值得亲的信赖！【德荣盛·天猫TOP商家·8年天猫老店·22年专注音响行业】 ,2021-01-04
1331,s**3,颜色分类: 香槟金★送收纳盒+耳机+充电线+录音线+麦罩 套餐名称: 唱将级K歌神器,好评,外观看上去高大上，音质非常好⚡，声音很大，混响比我原来的麦克还🐶好，不管高音还是低音，都很好，还有话筒收集音⭐源的准确度也很高，不会把杂音也收录进😃去，唱歌的时候手机音量都不用调大，🌊拿在手里感觉不轻不重，刚刚好。 ,颜色好看，话筒音质好，送了配件都很齐全，很满意,^_^ 亲，索爱话筒音响一体麦克风，众多资深音响师鼎力推荐，数十年国民品牌匠心研发，K歌及音响效果杠杠滴。手机、电脑、电视随时随地无线嗨唱。索爱K歌产品已狂销300万件+，音质有口皆碑，中国好声音冠名品牌，质量保证，值得亲的信赖！【德荣盛·天猫TOP商家·8年天猫老店·22年专注音响行业】 ,2021-06-15
1332,t**2,颜色分类: 雅典黑★送收纳盒+耳机+充电线+录音线+麦罩 套餐名称: 唱将级K歌神器,好评,麦克风我觉得蛮好的，在同等价位算得上不错。性价比可以说蛮不错，手机连接蓝牙蛮稳定，用了不会断连，款式看起来也非常漂亮❤，音质效果也好，音量放大也没有杂音，拿着手感也不错👍 ,真的很不错，现在每天晚上都必须拿来K几首歌，很喜欢,^_^ 亲，索爱话筒音响一体麦克风，众多资深音响师鼎力推荐，数十年国民品牌匠心研发，K歌及音响效果杠杠滴。手机、电脑、电视随时随地无线嗨唱。索爱K歌产品已狂销300万件+，音质有口皆碑，中国好声音冠名品牌，质量保证，值得亲的信赖！【德荣盛·天猫TOP商家·8年天猫老店·22年专注音响行业】,2021-02-02
1333,l**y,颜色分类: 玫瑰金★送收纳盒+耳机+充电线+录音线+麦罩 套餐名称: 唱将级K歌神器,好评,此用户没有填写评价。,之前帮朋友买了一个回来玩了玩觉得特别好，然后又回购了一个，音质效果：非常好 外观材质：很漂亮 话筒很快就到了 感觉拿上话筒唱歌都自信了 音效很不错，麦克风质量真好，颜色又漂亮，可以满足我的需求，还有魔音很好玩,-,2021-01-17
1334,x**3,颜色分类: 玫瑰金★送收纳盒+耳机+充电线+录音线+麦罩 套餐名称: 唱将级K歌神器,好评,服务很好👍,-,-,2021-02-24
1335,泪**华,颜色分类: 玫瑰金★送收纳盒+耳机+充电线+录音线+麦罩+支架+蓝牙发射器 套餐名称: 唱将级K歌神器,好评,麦克风外观很漂亮，买的金色，很好看，买来没事自己练歌的，链接手机唱歌很棒，比手机用耳机唱歌好太多了，以前在别家买的音质一般，但是索爱这家买的音质真的很好。好评！！！！，我太爱这个麦克风🎤了,音质效果：音质很好，我很喜欢，混响声音什么的都可以调节的，挺好玩的还有魔音,^_^ 亲，索爱话筒音响一体麦克风，众多资深音响师鼎力推荐，数十年国民品牌匠心研发，K歌及音响效果杠杠滴。手机、电脑、电视随时随地无线嗨唱。索爱K歌产品已狂销300万件+，音质有口皆碑，中国好声音冠名品牌，质量保证，值得亲的信赖！【德荣盛·天猫TOP商家·8年天猫老店·22年专注音响行业】,2021-02-07
1336,牡**卡,颜色分类: 雅典黑★送收纳盒+耳机+充电线+录音线+麦罩 套餐名称: 唱将级K歌神器,好评,网上看到动圈麦唱歌是上品，买回来了这款话筒果然没让我失望，店家也是很用心，采用动圈麦，话筒的抗噪很强，唱起来声音很细致，很饱满，音质非常好，金属质感的机身，拿起来手感很棒，很舒适，满意的一次购物  ,这款话筒音响非常好，音质清，没有杂音，外观也很漂亮，拿在手中也很有份量，如有需要的朋友将介绍拍你家的产品！,^_^ 亲，索爱话筒音响一体麦克风，众多资深音响师鼎力推荐，数十年国民品牌匠心研发，K歌及音响效果杠杠滴。手机、电脑、电视随时随地无线嗨唱。索爱K歌产品已狂销300万件+，音质有口皆碑，中国好声音冠名品牌，质量保证，值得亲的信赖！【德荣盛·天猫TOP商家·8年天猫老店·22年专注音响行业】,2021-01-13
1337,s**9,颜色分类: 雅典黑★送收纳盒+耳机+充电线+录音线+麦罩 套餐名称: 唱将级K歌神器,好评,音质效果：很不错 这个颜色特别喜欢 连着手机唱歌效果特别好 真的 挺有用的 自己想多会唱就能多会唱 音效也特别好。这款话筒真是K歌神器，设备功能齐全，还可以听歌。话筒外观精致漂亮,功能还很多，话筒款式新潮包装也高大尚，家里大家一起唱，音感效果挺好，播放出来也很清晰，设备容易使用不复杂，物有所值，正品，一次满意的购物！,^_^ 亲，感谢您的再次评价，祝您使用愉快，期待您的再次光临！【德荣盛·天猫TOP商家·8年天猫老店·22年专注音响行业】 ,2021-01-16
1338,t**1,颜色分类: 香槟金★送收纳盒+耳机+充电线+录音线+麦罩 套餐名称: 唱将级K歌神器,好评,音质效果：音效挺不错的，值得入手！试了很多款，这款比较好！外观也比较有档次，家人都挺喜欢玩的还能当一个音响听歌，或在家K歌，直播喊麦都可以。,看了很多家话筒，最后选择索爱，唱着玩，外观也挺好看的，这个话筒声音很大，混响挺好听，还有魔音可以切换着玩很有氛围，唱着很开心不错的选择,^_^ 亲，感谢您的再次评价，祝您使用愉快，期待您的再次光临！【德荣盛·天猫TOP商家·8年天猫老店·22年专注音响行业】 ,2021-06-17
1339,甜**力,颜色分类: 香槟金★送收纳盒+耳机+充电线+录音线+麦罩+支架+蓝牙发射器 套餐名称: 唱将级K歌神器,好评, 质量很好声音很清晰。很方便 音质ok 质量 不错。 性价比高 值得买，可以唱K歌 音质 效果：好， 外观材质：货真价实 质量强硬 物流服务差没有的哦 东西很好，不错的宝 贝，音质很好 音质非常好，唱歌很方便， 质量也很好，很满意 ,有了这款麦克风就可以在家无线蓝牙 连接手机唱歌K歌了,^_^ 亲，索爱话筒音响一体麦克风，众多资深音响师鼎力推荐，数十年国民品牌匠心研发，K歌及音响效果杠杠滴。手机、电脑、电视随时随地无线嗨唱。索爱K歌产品已狂销300万件+，音质有口皆碑，中国好声音冠名品牌，质量保证，值得亲的信赖！【德荣盛·天猫TOP商家·8年天猫老店·22年专注音响行业】,2021-01-11
1340,蓝**思,颜色分类: 雅典黑★送收纳盒+耳机+充电线+录音线+麦罩+支架+蓝牙发射器 套餐名称: 唱将级K歌神器,好评,本来是买来随便玩玩的，没想到这个价格能买到心意的宝贝，款式漂亮，音质还好，比之前买的别的牌子的效果好一些，之前的音质很一般，这款孩子也喜欢，准备在入手一件送给送给朋友，值得推荐 ,试了一下，音质很好，使用方便，小巧精致。, ^_^ 亲，索爱话筒音响一体麦克风，众多资深音响师鼎力推荐，数十年国民品牌匠心研发，K歌及音响效果杠杠滴。手机、电脑、电视随时随地无线嗨唱。索爱K歌产品已狂销300万件+，音质有口皆碑，中国好声音冠名品牌，质量保证，值得亲的信赖！【德荣盛·天猫TOP商家·8年天猫老店·22年专注音响行业】,2021-02-03
1341,p**4,颜色分类: 雅典黑★送收纳盒+耳机+充电线+录音线+麦罩+支架+蓝牙发射器 套餐名称: 唱将级K歌神器,好评,麦克风外观很漂亮，买的玫瑰金很好看，买来没事自己练歌的，链接手机唱歌很棒，比手机用耳机唱歌好太多了， 音质效果：音质很好，我很喜欢，混响什么的都挺有感觉 ,麦克风音质真的不错，适合各类人唱歌，而且声音也大！非常满意的一次购物,^_^ 亲，索爱话筒音响一体麦克风，众多资深音响师鼎力推荐，数十年国民品牌匠心研发，K歌及音响效果杠杠滴。手机、电脑、电视随时随地无线嗨唱。索爱K歌产品已狂销300万件+，音质有口皆碑，中国好声音冠名品牌，质量保证，值得亲的信赖！【德荣盛·天猫TOP商家·8年天猫老店·22年专注音响行业】 ,2021-02-05
1342,p**7,颜色分类: 香槟金★送收纳盒+耳机+充电线+录音线+麦罩 套餐名称: 唱将级K歌神器,好评,麦克风收到了，外观质感看着不错丰富了在家的娱乐时间，也不会轻得很廉价，音质效果：好。功能很齐全，而且充一次电可以用好久。客户挺好的,挺好用的，孩子喜欢，价格也便宜，好评了。增加业余爱好不错,^_^ 亲，索爱话筒音响一体麦克风，众多资深音响师鼎力推荐，数十年国民品牌匠心研发，K歌及音响效果杠杠滴。手机、电脑、电视随时随地无线嗨唱。索爱K歌产品已狂销300万件+，音质有口皆碑，中国好声音冠名品牌，质量保证，值得亲的信赖！【德荣盛·天猫TOP商家·8年天猫老店·22年专注音响行业】,2021-02-02
1343,精**大,颜色分类: 香槟金★送收纳盒+耳机+充电线+录音线+麦罩 套餐名称: 唱将级K歌神器,好评,这次在这家买的这个麦克风，质量强硬，用起来声音很清晰，蓝牙连接也很快，平时当蓝牙音箱比较多，声音挺大的，放在客厅里面听音乐整个客厅都能听的很清楚,音效很好，功能齐全，很喜欢,^_^ 亲，索爱话筒音响一体麦克风，众多资深音响师鼎力推荐，数十年国民品牌匠心研发，K歌及音响效果杠杠滴。手机、电脑、电视随时随地无线嗨唱。索爱K歌产品已狂销300万件+，音质有口皆碑，中国好声音冠名品牌，质量保证，值得亲的信赖！【德荣盛·天猫TOP商家·8年天猫老店·22年专注音响行业】,2021-01-31
1344,j**1,颜色分类: 雅典黑★送收纳盒+耳机+充电线+录音线+麦罩 套餐名称: 唱将级K歌神器,好评,话筒的音质和做工都很好，这个价格很划算的，很值了，外观精美很有质感，音质也很好，唱出来的声音很干净、很通透 ，还有混响功能，可以关掉原音，拿上它唱歌，有种在KTV唱歌的效果！满意的一次购物！ ,话筒的音质和做工都很好，这个价格很划算的，很值了，外观精美很有质感，音质也很好，唱出来的声音很干净、很通透 ，还有混响功能,^_^ 亲，索爱话筒音响一体麦克风，众多资深音响师鼎力推荐，数十年国民品牌匠心研发，K歌及音响效果杠杠滴。手机、电脑、电视随时随地无线嗨唱。索爱K歌产品已狂销300万件+，音质有口皆碑，中国好声音冠名品牌，质量保证，值得亲的信赖！【德荣盛·天猫TOP商家·8年天猫老店·22年专注音响行业】,2021-01-15
1345,杨**0,颜色分类: 玫瑰金★送收纳盒+耳机+充电线+录音线+麦罩 套餐名称: 唱将级K歌神器,好评,蓝牙麦克风非常好用，颜色也美美哒，可以在全民K歌上录歌，使用起来也很方便，只要连接手机蓝牙就可以用啦，我已经用它玩了一下午了，开心。还可以再买一个送给我的小伙伴... ,上手很舒服，音质不错，声音很宏亮，操作也简单，居家必备，k歌必选,^_^ 亲，索爱话筒音响一体麦克风，众多资深音响师鼎力推荐，数十年国民品牌匠心研发，K歌及音响效果杠杠滴。手机、电脑、电视随时随地无线嗨唱。索爱K歌产品已狂销300万件+，音质有口皆碑，中国好声音冠名品牌，质量保证，值得亲的信赖！【德荣盛·天猫TOP商家·8年天猫老店·22年专注音响行业】,2021-01-13
1346,美**8,颜色分类: 玫瑰金★送收纳盒+耳机+充电线+录音线+麦罩+支架 套餐名称: 唱将级K歌神器,好评,一直想买个这样的话筒，收到货后简直太满意，音质效果很好，很满意，以后天天在家都可以唱歌了,麦克风用了才来评价，颜色鲜亮真的很漂亮，做工精美音质清晰无杂音，外观高端大气上档次，操作简单方便，全民K歌可以试试这款麦克风真的很不错，值得推荐！唱歌很好听，无聊的时候还可以当做音箱用来听歌。,-,2021-01-31
1347,许**7,颜色分类: 雅典黑★送收纳盒+耳机+充电线+录音线+麦罩+支架 套餐名称: 唱将级K歌神器,好评,外光颜值高有份量。音质效果也好，感觉就像在歌厅里唱一样有气氛。值得购买。 ,质量很好。有KTV的音质效果，很喜欢。之前买过别家的觉得质量一般，这次换索爱品牌。 在家也可以k歌了，很有氛围感，唱的很起劲。已经推荐朋友了，大家喜欢都快去入手吧！,-,2021-01-13
1348,我**生,颜色分类: 香槟金★送收纳盒+耳机+充电线+录音线+麦罩 套餐名称: 唱将级K歌神器,好评,反复的试唱过录歌效果不错很好听，录好的歌听起没有杂音，特别清晰，平时在家放歌也很好自带音响好嗨皮的，我特别喜欢唱歌🎤选了几家最终决定了你家这款索爱麦克风没让我失望，喜欢的很美美哒,这款麦克风🎤唱歌好棒，爱了爱了，喜欢唱歌的朋友选他没得错，值得推荐,-,2021-01-08
1349,嗨**5,颜色分类: 香槟金★送收纳盒+耳机+充电线+录音线+麦罩 套餐名称: 唱将级K歌神器,好评,样式非常喜欢，话筒声音挺正的，自己在家也可以唱歌了，音响声音很洪亮，音质清晰，唱歌收音播放也是很清晰的，没有杂音电流啥的，用蓝牙连接贼方便了，无聊连接蓝牙可以放歌，完全可以满足我了，而且商家的服务也特别到位，有需要会再买的！ ,价格实惠，方便好用，一次性买了两个，再也不用边提扩音喇叭边拿话筒了，绝对的好货！！！,^_^ 亲，索爱话筒音响一体麦克风，众多资深音响师鼎力推荐，数十年国民品牌匠心研发，K歌及音响效果杠杠滴。手机、电脑、电视随时随地无线嗨唱。索爱K歌产品已狂销300万件+，音质有口皆碑，中国好声音冠名品牌，质量保证，值得亲的信赖！【德荣盛·天猫TOP商家·8年天猫老店·22年专注音响行业】,2021-01-27
1350,皮**6,颜色分类: 香槟金★送收纳盒+耳机+充电线+录音线+麦罩+支架 套餐名称: 唱将级K歌神器,好评,质感好，孩子和我都很喜欢，疫情就在家唱歌吧 ,质量强硬物流很快，快递小哥也很有礼貌，以后宅在家也不怕无聊啦，可以唱到天黑天亮～话筒功能也很齐全，可以连蓝牙，有混音模式和消音模式。音质很棒，音质上乘呢！音响效果也很干净，爱啦爱啦！,^_^ 亲，感谢您的再次评价，祝您使用愉快，期待您的再次光临！【德荣盛·天猫TOP商家·8年天猫老店·22年专注音响行业】 ,2021-01-13
1351,韦**萍,颜色分类: 香槟金★送收纳盒+耳机+充电线+录音线+麦罩 套餐名称: 唱将级K歌神器,好评,已经收到货啦，用了几次没有出现问题，自我感觉效果不错，录出来的声音很清晰，我试录了一首歌曲，完全没有延迟，节奏点精准，确实是K歌神器来的值得入手 ,麦克风做工良，手握舒适，音质音效饱满，蓝牙连接灵敏，功能齐全，切换自如非常喜欢,^_^ 亲，索爱话筒音响一体麦克风，众多资深音响师鼎力推荐，数十年国民品牌匠心研发，K歌及音响效果杠杠滴。手机、电脑、电视随时随地无线嗨唱。索爱K歌产品已狂销300万件+，音质有口皆碑，中国好声音冠名品牌，质量保证，值得亲的信赖！【德荣盛·天猫TOP商家·8年天猫老店·22年专注音响行业】,2021-01-04
1352,s**德,颜色分类: 香槟金★送收纳盒+耳机+充电线+录音线+麦罩+支架 套餐名称: 唱将级K歌神器,好评,音质不错，非常专业，看了好多家才选的这款，因为这款有氛围功能是别的卖家里同等价位没有的，果然没有让我失望，宝贝很喜欢。  ,做工精细。质感手感都非常棒，颜色大气，对平时喜欢唱歌的我很是喜欢，而且唱歌一点都不费劲，音量大小也可以随自己来调节，是正品。,^_^ 亲，索爱话筒音响一体麦克风，众多资深音响师鼎力推荐，数十年国民品牌匠心研发，K歌及音响效果杠杠滴。手机、电脑、电视随时随地无线嗨唱。索爱K歌产品已狂销300万件+，音质有口皆碑，中国好声音冠名品牌，质量保证，值得亲的信赖！【德荣盛·天猫TOP商家·8年天猫老店·22年专注音响行业】,2021-01-06
1353,t**0,颜色分类: 雅典黑★送收纳盒+耳机+充电线+录音线+麦罩 套餐名称: 唱将级K歌神器,好评,性价比高 大家喜欢的可以放心购买了，话筒收到音质挺好外观漂亮是我想要的效果非常满意。还能够当音响用，放出来的歌音质非常好的，颜值超高我喜欢，有点爱不释手的感觉。,买回家家里人都很喜欢，争先把玩，价格很合适，主要是质量还很好，很有质感，拿手里的重量就知道不是便宜货能比的，非常喜欢，喜欢的不要犹豫了,^_^ 亲，索爱话筒音响一体麦克风，众多资深音响师鼎力推荐，数十年国民品牌匠心研发，K歌及音响效果杠杠滴。手机、电脑、电视随时随地无线嗨唱。索爱K歌产品已狂销300万件+，音质有口皆碑，中国好声音冠名品牌，质量保证，值得亲的信赖！【德荣盛·天猫TOP商家·8年天猫老店·22年专注音响行业】,2021-06-15
1354,q**2,颜色分类: 雅典黑★送收纳盒+耳机+充电线+录音线+麦罩+支架 套餐名称: 唱将级K歌神器,好评,音质效果：音效用着小东西说真的不错啊。没想过这么便宜就买到手了 外观材质：外表看着不错。很好看。最主要的是材质窝在手里真不错,东西很不多，声音清晰无杂音，大人小孩都非常喜欢,^_^ 亲，索爱话筒音响一体麦克风，众多资深音响师鼎力推荐，数十年国民品牌匠心研发，K歌及音响效果杠杠滴。手机、电脑、电视随时随地无线嗨唱。索爱K歌产品已狂销300万件+，音质有口皆碑，中国好声音冠名品牌，质量保证，值得亲的信赖！【德荣盛·天猫TOP商家·8年天猫老店·22年专注音响行业】,2021-01-09
1355,w**b,颜色分类: 雅典黑★送收纳盒+耳机+充电线+录音线+麦罩 套餐名称: 唱将级K歌神器,好评,话筒质量挺好的，挺适合年纪大的人使用的，使用的挺简单的，开机连接手机蓝牙就可以用的，超级完美，特别是自带音响，效果真的不错，很满意的  ,使用正常，音质清晰，我们全家都在用，当初就是因为是索爱的，买的放心，用的安心,^_^ 亲，索爱话筒音响一体麦克风，众多资深音响师鼎力推荐，数十年国民品牌匠心研发，K歌及音响效果杠杠滴。手机、电脑、电视随时随地无线嗨唱。索爱K歌产品已狂销300万件+，音质有口皆碑，中国好声音冠名品牌，质量保证，值得亲的信赖！【德荣盛·天猫TOP商家·8年天猫老店·22年专注音响行业】 ,2021-01-16
1356,t**1,颜色分类: 雅典黑★送收纳盒+耳机+充电线+录音线+麦罩 套餐名称: 唱将级K歌神器,好评,话筒用起来 真的比想象中更好，颜色精致，用了这么久还没充过几次电，挺耐用的，给孩子练习口才真的很实用，非常满意是我想要的东西，音量也标准。 ,话筒使用简单，续航能力强，售后也很棒，点赞，。,^_^ 亲，索爱话筒音响一体麦克风，众多资深音响师鼎力推荐，数十年国民品牌匠心研发，K歌及音响效果杠杠滴。手机、电脑、电视随时随地无线嗨唱。索爱K歌产品已狂销300万件+，音质有口皆碑，中国好声音冠名品牌，质量保证，值得亲的信赖！【德荣盛·天猫TOP商家·8年天猫老店·22年专注音响行业】,2021-06-17
1357,苏**1,颜色分类: 香槟金★送收纳盒+耳机+充电线+录音线+麦罩 套餐名称: 唱将级K歌神器,好评,心心念念的麦克风到了，试了一下 音质质感都很ok。唱出来的声音明显比平时好听很多，功能也挺丰富的 有好几种模式可以切换。这下在家里也能KK歌玩一玩了，挺好 不用跑出去消费，间接在给自己省钱了。。 ,音质很好，价格也挺实惠的，性价比不错，值得购买,^_^ 亲，索爱话筒音响一体麦克风，众多资深音响师鼎力推荐，数十年国民品牌匠心研发，K歌及音响效果杠杠滴。手机、电脑、电视随时随地无线嗨唱。索爱K歌产品已狂销300万件+，音质有口皆碑，中国好声音冠名品牌，质量保证，值得亲的信赖！【德荣盛·天猫TOP商家·8年天猫老店·22年专注音响行业】,2021-02-06
