778,w**钦,颜色分类: 香槟金★送收纳盒+耳机+充电线+录音线+麦罩 套餐名称: 唱将级K歌神器,好评,这个话筒是特意用了一段时间才来评价的挺好用的，在说这款索爱自带声卡一体麦克风音响真心非常好用！外观大气上档次音质非常好！做工精致漂亮！质量好没话说非常喜欢！店家客服也很好喜欢您！,手感很舒服，有一定的重量，还自带有蓝牙音响，并有很多别的功能，打开蓝牙功能连接手机就可以放歌听了！还可以一边放伴奏一边唱歌，不唱歌时也可以专程用来听歌！真的特别方便！,^_^ 亲，索爱话筒音响一体麦克风，众多资深音响师鼎力推荐，数十年国民品牌匠心研发，K歌及音响效果杠杠滴。手机、电脑、电视随时随地无线嗨唱。索爱K歌产品已狂销300万件+，音质有口皆碑，中国好声音冠名品牌，质量保证，值得亲的信赖！【德荣盛·天猫TOP商家·8年天猫老店·22年专注音响行业】 ,2021-01-04
779,k**u,颜色分类: 香槟金★送收纳盒+耳机+充电线+录音线+麦罩 套餐名称: 唱将级K歌神器,好评,外观漂亮，音色很好！操作简单，适合大众人群！以后还会回购！ ,音质比五六百的都要好！不失真！值得购买！需要的朋友们可以放心购买了！,^_^ 亲，索爱话筒音响一体麦克风，众多资深音响师鼎力推荐，数十年国民品牌匠心研发，K歌及音响效果杠杠滴。手机、电脑、电视随时随地无线嗨唱。索爱K歌产品已狂销300万件+，音质有口皆碑，中国好声音冠名品牌，质量保证，值得亲的信赖！【德荣盛·天猫TOP商家·8年天猫老店·22年专注音响行业】,2021-04-15
780,唐**9,颜色分类: 玫瑰金★送收纳盒+耳机+充电线+录音线+麦罩 套餐名称: 唱将级K歌神器,好评,故意用了几天才来评论，非常不错，很有质感，声音很大，效果也很好，可以连接电脑当音响用 ,非常好，电池续航能力也不错,-,2021-04-10
781,t**3,颜色分类: 香槟金★送收纳盒+耳机+充电线+录音线+麦罩 套餐名称: 唱将级K歌神器,好评,索爱多年的老客户了，买了三个索爱音响，和好几款麦克风，效果当当的好，又第一次买这款音响一体的麦克风，原以为声音不够响，没想到在室外唱歌也是很响，足够玩的，好宝贝，以后有好的款式继续跟进，谢谢老板，祝生意兴隆，财源滚滚来！,音质也比较好，混响可以选择，本身也很有质感，我觉得特别棒，推荐给你。,^_^ 亲，索爱话筒音响一体麦克风，众多资深音响师鼎力推荐，数十年国民品牌匠心研发，K歌及音响效果杠杠滴。手机、电脑、电视随时随地无线嗨唱。索爱K歌产品已狂销300万件+，音质有口皆碑，中国好声音冠名品牌，质量保证，值得亲的信赖！【德荣盛·天猫TOP商家·8年天猫老店·22年专注音响行业】,2021-06-21
782,t**1,颜色分类: 香槟金★送收纳盒+耳机+充电线+录音线+麦罩+支架+蓝牙发射器 套餐名称: 唱将级K歌神器,好评,用了好几天了，这音质一点都不比外面买的差，可以调节，非常方便，音质特别好，款式和颜色也非常喜欢。质量很棒，音质很纯正，没有燥音！价格实惠！ ,客服十分有耐心，解释的很清楚。话筒声音比较不错，唱出来也挺好的,^_^ 亲，索爱话筒音响一体麦克风，众多资深音响师鼎力推荐，数十年国民品牌匠心研发，K歌及音响效果杠杠滴。手机、电脑、电视随时随地无线嗨唱。索爱K歌产品已狂销300万件+，音质有口皆碑，中国好声音冠名品牌，质量保证，值得亲的信赖！【德荣盛·天猫TOP商家·8年天猫老店·22年专注音响行业】,2021-06-17
783,t**8,颜色分类: 香槟金★送收纳盒+耳机+充电线+录音线+麦罩 套餐名称: 唱将级K歌神器,好评,话筒非常好，唱歌也没有回音，而且音质特别好听，简单容易很好操作。可以和手机电视只要有蓝牙的都可以连接，非常方便。 ,-,-,2021-03-29
784,水**达,颜色分类: 罗兰紫★送收纳盒+耳机+充电线+录音线+麦罩+支架+蓝牙发射器 套餐名称: 唱将级K歌神器,好评,音质效果：特意用了一段时间才来评价的，音效很不错，大人小孩唱起来都非常喜欢。都争着抢着唱呢！看来还要入手一个才行。 外观材质：相当有颜值的一款，很漂亮。,携带方便，拿在手里很有质感，使用上也很方便，老少皆宜,^_^ 亲，索爱话筒音响一体麦克风，众多资深音响师鼎力推荐，数十年国民品牌匠心研发，K歌及音响效果杠杠滴。手机、电脑、电视随时随地无线嗨唱。索爱K歌产品已狂销300万件+，音质有口皆碑，中国好声音冠名品牌，质量保证，值得亲的信赖！【德荣盛·天猫TOP商家·8年天猫老店·22年专注音响行业】,2021-01-14
785,t**6,颜色分类: 罗兰紫★送收纳盒+耳机+充电线+录音线+麦罩 套餐名称: 唱将级K歌神器,好评,物流挺快的，麦克风很好，还能当音响用，还送了很多东西，音质也可以，在家唱唱歌，完全可以啦，里面的几种魔音，也特别逗，麦克风做的也很人性化，每个按键都有提示音，使用挺满意的,确实不错，我这个唱歌跑调的人居然在全民k歌上唱出来了2个s，很满意的一次购物，高端大气上档次,^_^ 亲，索爱话筒音响一体麦克风，众多资深音响师鼎力推荐，数十年国民品牌匠心研发，K歌及音响效果杠杠滴。手机、电脑、电视随时随地无线嗨唱。索爱K歌产品已狂销300万件+，音质有口皆碑，中国好声音冠名品牌，质量保证，值得亲的信赖！【德荣盛·天猫TOP商家·8年天猫老店·22年专注音响行业】,2021-06-23
786,雪**8,颜色分类: 雅典黑★送收纳盒+耳机+充电线+录音线+麦罩 套餐名称: 唱将级K歌神器,好评,给妈妈买来K歌的，音响效果不错，麦克风质量也很好，满意好评！ ,-,-,2021-03-17
787,t**7,颜色分类: 玫瑰金★送收纳盒+耳机+充电线+录音线+麦罩 套餐名称: 唱将级K歌神器,好评,真是一次愉快的购物，麦克风包装精美，看起来高雅大气上档次，用起来简单方便效果还蛮不错的。,特意用了几天再来评论的，效果还是蛮好的，会推荐给朋友来买的。,^_^ 亲，索爱话筒音响一体麦克风，众多资深音响师鼎力推荐，数十年国民品牌匠心研发，K歌及音响效果杠杠滴。手机、电脑、电视随时随地无线嗨唱。索爱K歌产品已狂销300万件+，音质有口皆碑，中国好声音冠名品牌，质量保证，值得亲的信赖！【德荣盛·天猫TOP商家·8年天猫老店·22年专注音响行业】,2021-06-20
788,t**6,颜色分类: 雅典黑★送收纳盒+耳机+充电线+录音线+麦罩+支架 套餐名称: 唱将级K歌神器,好评,"音质效果：不错，有点ktv的味道， 音质不是一般的好 外观材质：还是有质感的，拿在手里不会有轻飘飘的感觉，还是很喜欢的，客服态度也很好,颜色也很好看没有色差，给小孩玩是挺核实的 ",功能多，他们客服服务态度很好。家人觉得好，所以又买了一个给侄子。小孩玩的开心就好, ^_^ 亲，索爱话筒音响一体麦克风，众多资深音响师鼎力推荐，数十年国民品牌匠心研发，K歌及音响效果杠杠滴。手机、电脑、电视随时随地无线嗨唱。索爱K歌产品已狂销300万件+，音质有口皆碑，中国好声音冠名品牌，质量保证，值得亲的信赖！【德荣盛·天猫TOP商家·8年天猫老店·22年专注音响行业】,2021-06-23
789,t**5,颜色分类: 香槟金★送收纳盒+耳机+充电线+录音线+麦罩 套餐名称: 唱将级K歌神器,好评,音效超级好啊 还有魔音音效 好可爱啊 长得也很好看 颜色的搭配很耐看，做工精美，拿在手里感觉很舒服，大小也合适。有一定重量，音质音效挺好，适合各种歌曲,刚收到就迫不及待的试用了一下，K歌效果比预想的要好的多，打开麦克，连接蓝牙就能用，简单,^_^ 亲，索爱话筒音响一体麦克风，众多资深音响师鼎力推荐，数十年国民品牌匠心研发，K歌及音响效果杠杠滴。手机、电脑、电视随时随地无线嗨唱。索爱K歌产品已狂销300万件+，音质有口皆碑，中国好声音冠名品牌，质量保证，值得亲的信赖！【德荣盛·天猫TOP商家·8年天猫老店·22年专注音响行业】,2021-01-04
790,h**8,颜色分类: 香槟金★送收纳盒+耳机+充电线+录音线+麦罩 套餐名称: 唱将级K歌神器,好评,已经试过了，手机蓝牙连上，非常方便，音色也挺好的，就是有时候有其他手机干扰。小孩唱歌有兴趣，值得推荐 ,-,-,2021-04-07
791,q**3,颜色分类: 香槟金★送收纳盒+耳机+充电线+录音线+麦罩 套餐名称: 唱将级K歌神器,好评,娱乐下还是很不错的，声音清晰。做工精良。细节的地方做的都很到位。拿回来孩子玩的很开心。,再晒一下还是很不错的哦。孩儿玩的高兴。,^_^ 亲，索爱话筒音响一体麦克风，众多资深音响师鼎力推荐，数十年国民品牌匠心研发，K歌及音响效果杠杠滴。手机、电脑、电视随时随地无线嗨唱。索爱K歌产品已狂销300万件+，音质有口皆碑，中国好声音冠名品牌，质量保证，值得亲的信赖！【德荣盛·天猫TOP商家·8年天猫老店·22年专注音响行业】,2021-01-31
792,w**逸,颜色分类: 雅典黑★送收纳盒+耳机+充电线+录音线+麦罩 套餐名称: 唱将级K歌神器,好评,音质好，无杂音，唱歌自带混响，下午可以和老伙伴们一起嗨歌了 ,今天和老伙伴们试一哈，嗯嗯，不错，都说效果好,^_^ 亲，索爱话筒音响一体麦克风，众多资深音响师鼎力推荐，数十年国民品牌匠心研发，K歌及音响效果杠杠滴。手机、电脑、电视随时随地无线嗨唱。索爱K歌产品已狂销300万件+，音质有口皆碑，中国好声音冠名品牌，质量保证，值得亲的信赖！【德荣盛·天猫TOP商家·8年天猫老店·22年专注音响行业】,2021-04-03
793,l**帅,颜色分类: 玫瑰金★送收纳盒+耳机+充电线+录音线+麦罩 套餐名称: 唱将级K歌神器,好评,此用户没有填写评价。,卖家真是太给力了，充电插口坏了本想要他们维修的，没想到直接跟我换新的，选择这家店真是我的荣幸！,-,2021-01-14
794,悠**3,颜色分类: 雅典黑★送收纳盒+耳机+充电线+录音线+麦罩 套餐名称: 唱将级K歌神器,好评,给小孩买的，音质还不错，可以消除原音，可以连接蓝牙，操作简单，儿子很喜欢 ,-,-,2021-04-03
795,爱**3,颜色分类: 雅典黑★送收纳盒+耳机+充电线+录音线+麦罩 套餐名称: 唱将级K歌神器,好评,此用户没有填写评价。,音质很好，声音也很大，家里用很方便，休息在家唱唱歌心情也很好，也省去了去KTV的钱，非常不错！,-,2021-03-17
796,田**狼,颜色分类: 香槟金★送收纳盒+耳机+充电线+录音线+麦罩+支架 套餐名称: 唱将级K歌神器,好评,这款话筒音响非常好，音质清，没有杂音，外观也很漂亮，拿在手中也很有份量，如有需要的朋友将介绍拍你家的产品！ ,外观大气上档次音质非常好！做工精致漂亮！质量好没话说非常喜欢！,^_^ 亲，索爱话筒音响一体麦克风，众多资深音响师鼎力推荐，数十年国民品牌匠心研发，K歌及音响效果杠杠滴。手机、电脑、电视随时随地无线嗨唱。索爱K歌产品已狂销300万件+，音质有口皆碑，中国好声音冠名品牌，质量保证，值得亲的信赖！【德荣盛·天猫TOP商家·8年天猫老店·22年专注音响行业】,2021-01-13
797,1**g,颜色分类: 香槟金★送收纳盒+耳机+充电线+录音线+麦罩 套餐名称: 唱将级K歌神器,好评,想练练唱歌就买了这个话筒，颜值挺高的，带上耳机效果更好，总体来说可以。 ,没事就拿它唱唱歌，挺好的,^_^ 亲，索爱话筒音响一体麦克风，众多资深音响师鼎力推荐，数十年国民品牌匠心研发，K歌及音响效果杠杠滴。手机、电脑、电视随时随地无线嗨唱。索爱K歌产品已狂销300万件+，音质有口皆碑，中国好声音冠名品牌，质量保证，值得亲的信赖！【德荣盛·天猫TOP商家·8年天猫老店·22年专注音响行业】,2021-01-10
798,t**4,颜色分类: 罗兰紫★送收纳盒+耳机+充电线+录音线+麦罩 套餐名称: 唱将级K歌神器,好评,很好用，天天想唱就可以唱了,音质效果：音质不错 外观材质：手感很好，做工精细，颜色好看 音量够大，价格合适！家人都很喜欢！正品,^_^ 亲，索爱话筒音响一体麦克风，众多资深音响师鼎力推荐，数十年国民品牌匠心研发，K歌及音响效果杠杠滴。手机、电脑、电视随时随地无线嗨唱。索爱K歌产品已狂销300万件+，音质有口皆碑，中国好声音冠名品牌，质量保证，值得亲的信赖！【德荣盛·天猫TOP商家·8年天猫老店·22年专注音响行业】,2021-05-31
799,n**2,颜色分类: 香槟金★送收纳盒+耳机+充电线+录音线+麦罩+支架 套餐名称: 唱将级K歌神器,好评,此用户没有填写评价。,不错的麦克风，音质不失真，正好合适，就是不懂的人，也不需要怎么调试，很适合家庭用。在买之前，咨询客服，解释的很清楚，做到有问必答，态度温馨可敬,-,2021-01-03
800,陈**k,颜色分类: 罗兰紫★送收纳盒+耳机+充电线+录音线+麦罩 套餐名称: 唱将级K歌神器,好评,音质效果： 音质还算可以，清澈透明，但是离专业的还有很大一段距离！ 外观材质：外表看起来还可以，高大上！ ,-,-,2021-01-19
801,张**0,颜色分类: 雅典黑★送收纳盒+耳机+充电线+录音线+麦罩+支架+蓝牙发射器 套餐名称: 唱将级K歌神器,好评,外观漂亮，音质很好，服务贴心，赞赞赞！,麦克风本身外观显得很大气，使用也非常简单，蓝牙连接就能使用，蓝牙连接也很快，蓝牙音响播放音质也很好，唱歌的声音也很清晰，效果简直太赞，整体很赞。,^_^ 亲，索爱话筒音响一体麦克风，众多资深音响师鼎力推荐，数十年国民品牌匠心研发，K歌及音响效果杠杠滴。手机、电脑、电视随时随地无线嗨唱。索爱K歌产品已狂销300万件+，音质有口皆碑，中国好声音冠名品牌，质量保证，值得亲的信赖！【德荣盛·天猫TOP商家·8年天猫老店·22年专注音响行业】,2021-03-20
802,y**6,颜色分类: 香槟金★送收纳盒+耳机+充电线+录音线+麦罩 套餐名称: 唱将级K歌神器,好评,音质效果：听起来音质磁性  非常满意的一次购物 外观材质：高档   大气    ,-,-,2021-01-04
803,c**5,颜色分类: 玫瑰金★送收纳盒+耳机+充电线+录音线+麦罩 套餐名称: 唱将级K歌神器,好评,音质效果：效果杠杠的，立体声环绕，可以投屏，非常好用，推荐购买 ,非常好用，简单操作，声音效果棒棒的，非常喜欢，推荐大家购买,^_^ 亲，索爱话筒音响一体麦克风，众多资深音响师鼎力推荐，数十年国民品牌匠心研发，K歌及音响效果杠杠滴。手机、电脑、电视随时随地无线嗨唱。索爱K歌产品已狂销300万件+，音质有口皆碑，中国好声音冠名品牌，质量保证，值得亲的信赖！【德荣盛·天猫TOP商家·8年天猫老店·22年专注音响行业】,2021-03-20
804,t**7,颜色分类: 罗兰紫★送收纳盒+耳机+充电线+录音线+麦罩+支架+蓝牙发射器 套餐名称: 唱将级K歌神器,好评,超级喜欢，可以在家唱歌了，像KTV一样，最重要的是可以宅在家不用出门啦，好评哦！,用着可以,^_^ 亲，索爱话筒音响一体麦克风，众多资深音响师鼎力推荐，数十年国民品牌匠心研发，K歌及音响效果杠杠滴。手机、电脑、电视随时随地无线嗨唱。索爱K歌产品已狂销300万件+，音质有口皆碑，中国好声音冠名品牌，质量保证，值得亲的信赖！【德荣盛·天猫TOP商家·8年天猫老店·22年专注音响行业】,2021-06-20
805,l**茵,颜色分类: 香槟金★送收纳盒+耳机+充电线+录音线+麦罩 套餐名称: 唱将级K歌神器,好评,这个好，妈妈无聊可以在家唱了，声音特别棒，简单操作,-,-,2021-03-24
806,我**9,颜色分类: 香槟金★送收纳盒+耳机+充电线+录音线+麦罩 套餐名称: 唱将级K歌神器,好评,音响效果还不错，孩子们用还是可以的，算是比较满意的一次购物吧，还不错不错不错不错 ,用了几天，效果还可以,-,2021-01-31
807,千**情,颜色分类: 香槟金★送收纳盒+耳机+充电线+录音线+麦罩+支架+蓝牙发射器 套餐名称: 唱将级K歌神器,好评,麦克风收到，功能🔒齐全，蓝牙连接很简单很🔑方便的，选择无线话筒很方便使用，有时👑候还拿到公园里唱，还可以蓝牙链接听歌，功能挺全🌺的，家人都开心就好~谢谢店家啦👻,真的超级好用！连上蓝牙就行了！很方便！还可以听歌，不错,^_^ 亲，索爱话筒音响一体麦克风，众多资深音响师鼎力推荐，数十年国民品牌匠心研发，K歌及音响效果杠杠滴。手机、电脑、电视随时随地无线嗨唱。索爱K歌产品已狂销300万件+，音质有口皆碑，中国好声音冠名品牌，质量保证，值得亲的信赖！【德荣盛·天猫TOP商家·8年天猫老店·22年专注音响行业】,2021-03-26
808,y**7,颜色分类: 玫瑰金★送收纳盒+耳机+充电线+录音线+麦罩 套餐名称: 唱将级K歌神器,好评,买回好几天今天才试用，效果特别好，音质问很好，妈妈非常喜欢😍,-,-,2021-06-23
809,x**d,颜色分类: 香槟金★送收纳盒+耳机+充电线+录音线+麦罩 套餐名称: 唱将级K歌神器,好评,看起来还不错 好评 不好意思 还没怎么使用 等用了效果好再来追加评论,麦克风效果确实挺赞的，很喜欢，拿在手里挺有的范的，配色真的做的很好，颜色很纯正，唱歌长时间捏在手里也不累，而且很方便，是我理想中的样子，最赞的就是质感，很光滑，真的做的很光滑，摸着很舒服，我觉得还挺不错的,-,2021-01-15
810,x**哥,颜色分类: 香槟金★送收纳盒+耳机+充电线+录音线+麦罩 套餐名称: 唱将级K歌神器,好评,宝贝还可以，用这个在手机上K歌比用手机🎧效果好多了，拍个玩玩不错,-,-,2021-03-29
811,d**1,颜色分类: 香槟金★送收纳盒+耳机+充电线+录音线+麦罩 套餐名称: 唱将级K歌神器,好评,外观材质：很漂亮，音质效果很好。会推荐给身边朋友 ,-,-,2021-04-06
812,亲**3,颜色分类: 雅典黑★送收纳盒+耳机+充电线+录音线+麦罩 套餐名称: 唱将级K歌神器,好评,此用户没有填写评价。,买回来果然没有让我失望。颜值高、音质好、与手机和电视连接十分方便。,-,2021-04-14
813,t**9,颜色分类: 香槟金★送收纳盒+耳机+充电线+录音线+麦罩 套餐名称: 唱将级K歌神器,好评,之前买了款黑色的给爸妈唱歌，他们蛮喜欢。这款香槟金帮舅妈买的，下面这个视频是我用一档混响音唱的，连接投影仪类似小型家庭ktv，很方便！ ,-,-,2021-06-09
814,t**9,颜色分类: 香槟金★送收纳盒+耳机+充电线+录音线+麦罩+支架+蓝牙发射器 套餐名称: 唱将级K歌神器,好评,声音好听，孩子非常喜欢,-,-,2021-06-09
815,春**合,颜色分类: 雅典黑★送收纳盒+耳机+充电线+录音线+麦罩+支架 套餐名称: 唱将级K歌神器,好评,用过了，音质很好，手柄拿到手上质感好，有那种重的感觉，颜色也很好，我们K歌，拿出来。朋友都问从哪里卖的，要去购买，说明我的眼光不错，老板的东西好,产品质量不错，音质音量都还可以，是一款k歌理想选择！客服态度也好，不懂可以咨询，他们也会耐心解答的！不错的一次购物, ^_^ 亲，索爱话筒音响一体麦克风，众多资深音响师鼎力推荐，数十年国民品牌匠心研发，K歌及音响效果杠杠滴。手机、电脑、电视随时随地无线嗨唱。索爱K歌产品已狂销300万件+，音质有口皆碑，中国好声音冠名品牌，质量保证，值得亲的信赖！【德荣盛·天猫TOP商家·8年天猫老店·22年专注音响行业】,2021-01-05
816,德**1,颜色分类: 香槟金★送收纳盒+耳机+充电线+录音线+麦罩+支架+蓝牙发射器 套餐名称: 唱将级K歌神器,好评,产品一收到，回家就迫不及待的打开，看上去很漂亮，试了一下，声音很响亮，说话声音也很大，其它功能还不会用，要慢慢研究，很开心，,-,-,2021-04-05
817,m**9,颜色分类: 雅典黑★送收纳盒+耳机+充电线+录音线+麦罩+支架+蓝牙发射器 套餐名称: 唱将级K歌神器,好评,已收到  用了很不错  也很方便 连手机蓝牙就可以唱歌，音质回响都很好。点赞 ,母亲喜欢唱歌，用着很高兴。,-,2021-02-03
818,t**6,颜色分类: 香槟金★送收纳盒+耳机+充电线+录音线+麦罩+支架+蓝牙发射器 套餐名称: 唱将级K歌神器,好评,音质非常好 ，声音还挺大的 ，外观漂亮 ，很喜欢  ,用了一段时间了 ，宝贝很好 ，值得购买,^_^ 亲，索爱话筒音响一体麦克风，众多资深音响师鼎力推荐，数十年国民品牌匠心研发，K歌及音响效果杠杠滴。手机、电脑、电视随时随地无线嗨唱。索爱K歌产品已狂销300万件+，音质有口皆碑，中国好声音冠名品牌，质量保证，值得亲的信赖！【德荣盛·天猫TOP商家·8年天猫老店·22年专注音响行业】,2021-06-23
819,嘉**4,颜色分类: 香槟金★送收纳盒+耳机+充电线+录音线+麦罩 套餐名称: 唱将级K歌神器,好评,音质效果：音质还好，外观大气，材质很好 ,该麦克风很好用的,^_^ 亲，索爱话筒音响一体麦克风，众多资深音响师鼎力推荐，数十年国民品牌匠心研发，K歌及音响效果杠杠滴。手机、电脑、电视随时随地无线嗨唱。索爱K歌产品已狂销300万件+，音质有口皆碑，中国好声音冠名品牌，质量保证，值得亲的信赖！【德荣盛·天猫TOP商家·8年天猫老店·22年专注音响行业】,2021-04-15
820,雪**1,颜色分类: 玫瑰金★送收纳盒+耳机+充电线+录音线+麦罩 套餐名称: 唱将级K歌神器,好评,此用户没有填写评价。,货已到，外观不错，高大上。音响效果非常好！但是消音效果并不好，只是把原有的生音小了一点，原音还是有的。后来用了手机的K歌还挺好的！这个价位还算不错，值得买！,-,2021-03-31
821,n**9,颜色分类: 香槟金★送收纳盒+耳机+充电线+录音线+麦罩 套餐名称: 唱将级K歌神器,好评,挺好的，可以去原音，音质也挺好的 ,一个字（好）东西 不用去KTV浪费钱了 在家想唱就唱 完美 一个朋友抢着要试一试,^_^ 亲，索爱话筒音响一体麦克风，众多资深音响师鼎力推荐，数十年国民品牌匠心研发，K歌及音响效果杠杠滴。手机、电脑、电视随时随地无线嗨唱。索爱K歌产品已狂销300万件+，音质有口皆碑，中国好声音冠名品牌，质量保证，值得亲的信赖！【德荣盛·天猫TOP商家·8年天猫老店·22年专注音响行业】,2021-03-17
822,季**3,颜色分类: 香槟金★送收纳盒+耳机+充电线+录音线+麦罩+支架 套餐名称: 唱将级K歌神器,好评,麦克风效果不错👍，声音很清晰，录音效果很满意，使用上面没有问题，操作也很简单， 在室内室外用都没有问题，整体很好，还可以消除原音，好评👍 ,功能强大，赠品丰富。简单易上手，很好,^_^ 亲，索爱话筒音响一体麦克风，众多资深音响师鼎力推荐，数十年国民品牌匠心研发，K歌及音响效果杠杠滴。手机、电脑、电视随时随地无线嗨唱。索爱K歌产品已狂销300万件+，音质有口皆碑，中国好声音冠名品牌，质量保证，值得亲的信赖！【德荣盛·天猫TOP商家·8年天猫老店·22年专注音响行业】,2021-01-17
823,飞**3,颜色分类: 玫瑰金★送收纳盒+耳机+充电线+录音线+麦罩+支架 套餐名称: 唱将级K歌神器,好评,麦克风很好，音质也不错，高端大气上档次，老板还送了小支架，好评,试用了一下音质很好，美观大方，真的很不错，还会光顾的。,^_^ 亲，索爱话筒音响一体麦克风，众多资深音响师鼎力推荐，数十年国民品牌匠心研发，K歌及音响效果杠杠滴。手机、电脑、电视随时随地无线嗨唱。索爱K歌产品已狂销300万件+，音质有口皆碑，中国好声音冠名品牌，质量保证，值得亲的信赖！【德荣盛·天猫TOP商家·8年天猫老店·22年专注音响行业】,2021-04-15
