379,t**8,颜色分类: 雅典黑★送收纳盒+耳机+充电线+录音线+麦罩+支架+蓝牙发射器 套餐名称: 唱将级K歌神器,好评,此用户没有填写评价。,"本人很喜欢唱歌,这回也可以在家唱歌了抗噪强音 质饱满,外观很漂亮拿在手里沉甸甸的,打开蓝牙连 接手机音量很大音质很清晰没有杂质,真的很不错, 有不会的问了客服都很贴心的回答了,很满意的一次 购物,我等不及了,不说了我要唱歌了。",^_^ 亲，感谢您的再次评价，祝您使用愉快，期待您的再次光临！【德荣盛·天猫TOP商家·9年天猫老店·22年专注音响行业】 ,2021-05-11
380,梦**空,颜色分类: 罗兰紫★送收纳盒+耳机+充电线+录音线+麦罩+支架+蓝牙发射器 套餐名称: 唱将级K歌神器,好评,声音清晰，还有混🔑响可以调节，价格也很便宜，音质很🏁好，还自带有蓝牙音响，并有很多别的功能，适💡用于各种场合，很是方便，价格又相当的便宜，性🔔价比相当的高，个人觉得买的是太值了👍 ,手感很舒服，有一定的重量，还自带有蓝牙音响，并有很多别的功能，适用于各种场合,^_^ 亲，索爱话筒音响一体麦克风，众多资深音响师鼎力推荐，数十年国民品牌匠心研发，K歌及音响效果杠杠滴。手机、电脑、电视随时随地无线嗨唱。索爱K歌产品已狂销300万件+，音质有口皆碑，中国好声音冠名品牌，质量保证，值得亲的信赖！【德荣盛·天猫TOP商家·8年天猫老店·22年专注音响行业】,2021-03-26
381,1**a,颜色分类: 香槟金★送收纳盒+耳机+充电线+录音线+麦罩+支架+蓝牙发射器 套餐名称: 唱将级K歌神器,好评,音质效果：麦克风效果还是挺不错的 音质很喜欢🐛 拿在手里就可以唱歌了 而且还自带音响的麦克风 功能很齐全🏈 可以调节音量混响 录歌效果不错 🎈性价比挺高的 非常满意👾 ,麦克风很喜欢🐛 做工也很不错 配件都带的很齐全还送了收纳盒🍟，不错好评🌺,-,2021-04-15
382,1**h,颜色分类: 雅典黑★送收纳盒+耳机+充电线+录音线+麦罩 套餐名称: 唱将级K歌神器,好评,话筒收到很好用的👑，连接手机蓝牙上面用唱🐸吧或者其他的软件☔，上面直接消原音的，👍很方便的，音质效果非😍常好，音质清晰 外观材质漂亮😝，手感好，不重，拿在手里手感很好的，喜欢👗,麦克风唱出来的声音很干净🔊，很通透好、还有混响功能，拿上它👔唱歌😏，有种在KTV唱歌的效果，音色和音量都占优，手持便捷🌺，存放方便,^_^ 亲，索爱话筒音响一体麦克风，众多资深音响师鼎力推荐，数十年国民品牌匠心研发，K歌及音响效果杠杠滴。手机、电脑、电视随时随地无线嗨唱。索爱K歌产品已狂销300万件+，音质有口皆碑，中国好声音冠名品牌，质量保证，值得亲的信赖！【德荣盛·天猫TOP商家·8年天猫老店·22年专注音响行业】,2021-06-10
383,l**7,颜色分类: 雅典黑★送收纳盒+耳机+充电线+录音线+麦罩 套餐名称: 唱将级K歌神器,好评,蓝牙连接速度快，音质很好，声音很大声。是正品。,用了一段时间很好。,-,2021-06-12
384,微**0,颜色分类: 玫瑰金★送收纳盒+耳机+充电线+录音线+麦罩 套餐名称: 唱将级K歌神器,好评,蓝牙连上手机随时随地就可以唱，👾质量不错很划算，这个也很方便，🎈整个带喇叭的麦克风我都看了，🐛效果真是很棒，感觉是正品，🏀外观也超靓价格很实惠，性价比高，看着就喜欢 主要是不贵🎤 ,感觉很好，🎈同事来家里K歌了，玩的很开心，🌺要了链接，也要在家里开演唱会了🎤,^_^ 亲，索爱话筒音响一体麦克风，众多资深音响师鼎力推荐，数十年国民品牌匠心研发，K歌及音响效果杠杠滴。手机、电脑、电视随时随地无线嗨唱。索爱K歌产品已狂销300万件+，音质有口皆碑，中国好声音冠名品牌，质量保证，值得亲的信赖！【德荣盛·天猫TOP商家·8年天猫老店·22年专注音响行业】,2021-04-05
385,t**3,颜色分类: 香槟金★送收纳盒+耳机+充电线+录音线+麦罩+支架 套餐名称: 唱将级K歌神器,好评,麦克风收到，造型好看，喜欢。,-,-,2021-06-21
386,t**1,颜色分类: 雅典黑★送收纳盒+耳机+充电线+录音线+麦罩+支架+蓝牙发射器 套餐名称: 唱将级K歌神器,好评,还不错，音质还行吧，声音不大,还可以，到手就开唱,-,2021-06-17
387,w**3,颜色分类: 雅典黑★送收纳盒+耳机+充电线+录音线+麦罩 套餐名称: 唱将级K歌神器,好评,一个人在家hi歌，哈哈哈，😘唱的异常开心，🎵音质我觉得很不错，跟KTV的话筒效果也没差，💖价格也实惠本来🙋担心，质量一般，声音差，效果不好，这些问题👏但是完全没有出现，✨效果也很棒，💭买的很值啦✔ ,音效种类也很多，现在全家人只要有空那就离不开用它高歌一曲！嗨皮的很那场面🙈,^_^ 亲，索爱话筒音响一体麦克风，众多资深音响师鼎力推荐，数十年国民品牌匠心研发，K歌及音响效果杠杠滴。手机、电脑、电视随时随地无线嗨唱。索爱K歌产品已狂销300万件+，音质有口皆碑，中国好声音冠名品牌，质量保证，值得亲的信赖！【德荣盛·天猫TOP商家·8年天猫老店·22年专注音响行业】,2021-03-24
388,w**2,颜色分类: 香槟金★送收纳盒+耳机+充电线+录音线+麦罩 套餐名称: 唱将级K歌神器,好评,东西质量很好，拿上也很🍺有质感，小朋友要比赛🌂唱歌，收到后果然👜没人我失望，性价比高，价格可以，平时🍻在家可以练习，也有盒子方便外☕带，赞  ,太开心了，非常喜欢，音质很好值得购买。,^_^ 亲，索爱话筒音响一体麦克风，众多资深音响师鼎力推荐，数十年国民品牌匠心研发，K歌及音响效果杠杠滴。手机、电脑、电视随时随地无线嗨唱。索爱K歌产品已狂销300万件+，音质有口皆碑，中国好声音冠名品牌，质量保证，值得亲的信赖！【德荣盛·天猫TOP商家·8年天猫老店·22年专注音响行业】,2021-06-26
389,s**8,颜色分类: 香槟金★送收纳盒+耳机+充电线+录音线+麦罩+支架+蓝牙发射器 套餐名称: 唱将级K歌神器,好评,真的是一分价钱一分货！正品，手感不错，音质清晰响亮，外观颜值挺高的，效果真的很赞！喜欢K歌的宝宝们，一定不要错过！家里人都喜欢唱歌，很专业的设备. ,宝贝太棒了👏👏效果真的很好👍，音响效果好携带方便！,^_^ 亲，索爱话筒音响一体麦克风，众多资深音响师鼎力推荐，数十年国民品牌匠心研发，K歌及音响效果杠杠滴。手机、电脑、电视随时随地无线嗨唱。索爱K歌产品已狂销300万件+，音质有口皆碑，中国好声音冠名品牌，质量保证，值得亲的信赖！【德荣盛·天猫TOP商家·8年天猫老店·22年专注音响行业】,2021-03-18
390,一**1,颜色分类: 雅典黑★送收纳盒+耳机+充电线+录音线+麦罩 套餐名称: 唱将级K歌神器,好评,麦克风和音响一体，拿到手就迫不及待的高歌一曲啦，🐬效果很不错，回音效果也很好，音质也非常棒，🍻效果简直是太赞，完全没有色差，没有掉漆🍦，摸起来是金属质感。产品很强硬！🌺蓝牙连接非常的快，与方便，还兼容多种播放模式，大爱索爱品牌。🐠,外观材质：平滑不划手很上档次，🌴配色也好看，握感细腻！可以连接手机蓝牙播放音乐，也可以当成音响使用，🐳用起来挺方便的，我很喜欢🌵,-,2021-05-05
391,飘**灵,颜色分类: 玫瑰金★送收纳盒+耳机+充电线+录音线+麦罩+支架+蓝牙发射器 套餐名称: 唱将级K歌神器,好评,挺好的，女朋友很喜欢唱歌，所以就买了这款，不错,-,-,2021-05-16
392,长**5,颜色分类: 香槟金★送收纳盒+耳机+充电线+录音线+麦罩 套餐名称: 唱将级K歌神器,好评,话筒到啦，很方便，蓝牙连接上就能使用了，🍣麦克风音质清晰，唱歌的时候也不会喷麦，挺不错的。⛳现在有了这个话筒之后基本下班回家都要唱上两首练练歌喉，🍟唱出来的效果比之前用耳机唱好多了，喜欢🌺 ,质量强硬，颜色特别正🐬，很喜欢这款香槟金的颜色。音色很好🌴，声音调节简单，打开手机和话筒，就可以想唱什么歌都可以。🍣随心所欲的在家歌唱，很赞的一点就话筒充电很快，一次充电可以用好久.🍎,^_^ 亲，索爱话筒音响一体麦克风，众多资深音响师鼎力推荐，数十年国民品牌匠心研发，K歌及音响效果杠杠滴。手机、电脑、电视随时随地无线嗨唱。索爱K歌产品已狂销300万件+，音质有口皆碑，中国好声音冠名品牌，质量保证，值得亲的信赖！【德荣盛·天猫TOP商家·9年天猫老店·22年专注音响行业】,2021-05-08
393,t**6,颜色分类: 雅典黑★送收纳盒+耳机+充电线+录音线+麦罩 套餐名称: 唱将级K歌神器,好评,此用户没有填写评价。,刚刚昨天收到货，客服还说不是他们的问题，退了一点运费给补偿，还要好评，还不要换配件，这种次品也旧货发出来，**，无话可说,-,2021-06-23
394,第**1,颜色分类: 玫瑰金★送收纳盒+耳机+充电线+录音线+麦罩+支架+蓝牙发射器 套餐名称: 唱将级K歌神器,好评,做工不错，音质很好,-,-,2021-05-18
395,w**g,颜色分类: 雅典黑★送收纳盒+耳机+充电线+录音线+麦罩 套餐名称: 唱将级K歌神器,好评,麦克风已经收👉到很好。音质清💤晰。链接蓝牙就可以唱了。声音调大小🎵很好用。没有杂音。闲暇时间可以在👍家享受KTV的效果。颜值也很高，用🌊起来非常喜欢，孩子大人都很喜欢。。,这几天都一直都很好用。麦克风充电方便，很喜欢，好评！,^_^ 亲，索爱话筒音响一体麦克风，众多资深音响师鼎力推荐，数十年国民品牌匠心研发，K歌及音响效果杠杠滴。手机、电脑、电视随时随地无线嗨唱。索爱K歌产品已狂销300万件+，音质有口皆碑，中国好声音冠名品牌，质量保证，值得亲的信赖！【德荣盛·天猫TOP商家·8年天猫老店·22年专注音响行业】,2021-03-22
396,t**0,颜色分类: 香槟金★送收纳盒+耳机+充电线+录音线+麦罩+支架+蓝牙发射器 套餐名称: 唱将级K歌神器,好评,商品非常棒，音质很好，满意的购货！,-,-,2021-06-15
397,t**5,颜色分类: 雅典黑★送收纳盒+耳机+充电线+录音线+麦罩+支架 套餐名称: 唱将级K歌神器,好评,质量不错，用起来很好，下次还得购买,己用一段时间，很不错，充电一次用时间还长！,_^ 亲，索爱话筒音响一体麦克风，众多资深音响师鼎力推荐，数十年国民品牌匠心研发，K歌及音响效果杠杠滴。手机、电脑、电视随时随地无线嗨唱。索爱K歌产品已狂销300万件+，音质有口皆碑，中国好声音冠名品牌，质量保证，值得亲的信赖！【德荣盛·天猫TOP商家·9年天猫老店·22年专注音响行业】,2021-05-14
398,小**发,颜色分类: 雅典黑★送收纳盒+耳机+充电线+录音线+麦罩 套餐名称: 唱将级K歌神器,好评,很好用，不错 ,麦克风效果不错，音质挺好的，马上6.1了买给孩子玩也是非常不错的选择，操作都很简单，大人小孩都可以玩，推荐,-,2021-05-27
399,t**3,颜色分类: 香槟金★送收纳盒+耳机+充电线+录音线+麦罩 套餐名称: 唱将级K歌神器,好评,话筒收到，了用比🍸较满意喜欢，特别是客服服务态🍦度很好，颜值很高，做工也很好，客👜服耐心给我指导操作，本来没用过蓝💎牙连接的，还担心搞不好，经客🎸服的指导就好了 ,质量很不错，音色也很好，宝贝很喜欢，拿来全民K歌，这样可以🎤个过瘾了。值得拥有。,^_^ 亲，索爱话筒音响一体麦克风，众多资深音响师鼎力推荐，数十年国民品牌匠心研发，K歌及音响效果杠杠滴。手机、电脑、电视随时随地无线嗨唱。索爱K歌产品已狂销300万件+，音质有口皆碑，中国好声音冠名品牌，质量保证，值得亲的信赖！【德荣盛·天猫TOP商家·8年天猫老店·22年专注音响行业】,2021-06-21
400,t**5,颜色分类: 香槟金★送收纳盒+耳机+充电线+录音线+麦罩+支架+蓝牙发射器 套餐名称: 唱将级K歌神器,好评,本人很喜欢唱歌，这回也可以在家唱歌了抗噪强 🐳音质饱满，外观很漂亮拿在手里沉甸甸的👾，打开蓝牙连接手机音量很大音质很清晰没有杂质，🏈真的很不错，有不会的问了客服都很贴心的回答了，🍻很满意的一次购物，我等不及了，不说了我要唱歌了。🍎  ,外观很好看，声音也很清晰质量强硬，🌴还能蓝牙连接，自带蓝牙音箱效果，🐳回音功能也挺不错的，还有伴奏功能，🍟非常的棒， 没想到这样的价款可以买到这样的产品，真是物美价廉。🍣,^_^ 亲，索爱话筒音响一体麦克风，众多资深音响师鼎力推荐，数十年国民品牌匠心研发，K歌及音响效果杠杠滴。手机、电脑、电视随时随地无线嗨唱。索爱K歌产品已狂销300万件+，音质有口皆碑，中国好声音冠名品牌，质量保证，值得亲的信赖！【德荣盛·天猫TOP商家·8年天猫老店·22年专注音响行业】,2021-04-27
401,l**0,颜色分类: 玫瑰金★送收纳盒+耳机+充电线+录音线+麦罩 套餐名称: 唱将级K歌神器,好评,音质是非常超💘乎想象[爱心]，趁着活动下单这款话筒💦音响，索爱果然大牌子，值得信赖[得意]🎵操作也是挺简单的，使用🐮时只需长按2秒开机🐠，[强]手机蓝牙连接，打开app就可以开始Ｋ歌了，[666]降噪功能挺不错💝,还能美化音线，两个小孩抢着唱，很不错！店家送的防喷罩比较厚实，😘非常满意满意！！,^_^ 亲，索爱话筒音响一体麦克风，众多资深音响师鼎力推荐，数十年国民品牌匠心研发，K歌及音响效果杠杠滴。手机、电脑、电视随时随地无线嗨唱。索爱K歌产品已狂销300万件+，音质有口皆碑，中国好声音冠名品牌，质量保证，值得亲的信赖！【德荣盛·天猫TOP商家·8年天猫老店·22年专注音响行业】,2021-04-03
402,尝**5,颜色分类: 雅典黑★送收纳盒+耳机+充电线+录音线+麦罩+支架+蓝牙发射器 套餐名称: 唱将级K歌神器,好评,非常不错唱歌拿着手机就可以唱了非常方便简单直接连蓝牙就可以了！🍎效果也非常好颜色也非常大气🐳个人比较喜欢唱歌用这个神麦非常好这款麦克风的价格也是可以的！🏈喜欢唱歌的小伙伴们放心购买吧真的非常棒！🎈,这个麦克风很适合玩全民K歌🍣，录歌清晰，还有混响效果也好，🍦调节了下唱出来的效果杠杠的，评分也比之前容易上去啦，⛳总之用着满意的，姐姐也是K歌迷哦，打算给她也推荐一下🌺,^_^ 亲，索爱话筒音响一体麦克风，众多资深音响师鼎力推荐，数十年国民品牌匠心研发，K歌及音响效果杠杠滴。手机、电脑、电视随时随地无线嗨唱。索爱K歌产品已狂销300万件+，音质有口皆碑，中国好声音冠名品牌，质量保证，值得亲的信赖！【德荣盛·天猫TOP商家·8年天猫老店·22年专注音响行业】,2021-05-04
403,t**5,颜色分类: 香槟金★送收纳盒+耳机+充电线+录音线+麦罩 套餐名称: 唱将级K歌神器,好评,🐷闺蜜推荐的，上手以后，✨ 立刻便粉上了，果断下单。卖家🚚发货也快次日便收到了，迫不及待的开唱了一首。音质很棒，娱乐嗨歌完全没问题，之前还想买别家的，💭但是价格有些些贵，还是买这个实惠😜,音质和KTV一样好，音效模式也多，👸总的来说，还可以的,^_^ 亲，索爱话筒音响一体麦克风，众多资深音响师鼎力推荐，数十年国民品牌匠心研发，K歌及音响效果杠杠滴。手机、电脑、电视随时随地无线嗨唱。索爱K歌产品已狂销300万件+，音质有口皆碑，中国好声音冠名品牌，质量保证，值得亲的信赖！【德荣盛·天猫TOP商家·8年天猫老店·22年专注音响行业】,2021-03-25
404,w**5,颜色分类: 香槟金★送收纳盒+耳机+充电线+录音线+麦罩 套餐名称: 唱将级K歌神器,好评,好用，孩子很喜欢,-,-,2021-05-27
405,t**5,颜色分类: 香槟金★送收纳盒+耳机+充电线+录音线+麦罩+支架 套餐名称: 唱将级K歌神器,好评,音质效果：很好 外观材质：也很漂亮 关键是配套齐全，而且店铺的客服服务态度超好，期待可以再出新高度。 ,是朋友推荐买的，妈妈喜欢唱歌，所以直接搜的店铺在他家买的，值得信赖音质绝了，还保修。真是不错，希望大家多多选购,^_^ 亲，感谢您的再次评价，祝您使用愉快，期待您的再次光临！【德荣盛·天猫TOP商家·8年天猫老店·22年专注音响行业】 ,2021-04-05
406,远**1,颜色分类: 雅典黑★送收纳盒+耳机+充电线+录音线+麦罩+支架+蓝牙发射器 套餐名称: 唱将级K歌神器,好评,包装很好，材质也是不错的， ,-,-,2021-05-22
407,h**6,颜色分类: 雅典黑★送收纳盒+耳机+充电线+录音线+麦罩 套餐名称: 唱将级K歌神器,好评,麦克风与描述相符，雅典黑大气显档次，音质也可以，这个价格买到也是不错的了。客服服务很好，有不懂的很有耐心回复。 ,今晚再次认真唱K和录歌使用，满意！,^_^ 亲，索爱话筒音响一体麦克风，众多资深音响师鼎力推荐，数十年国民品牌匠心研发，K歌及音响效果杠杠滴。手机、电脑、电视随时随地无线嗨唱。索爱K歌产品已狂销300万件+，音质有口皆碑，中国好声音冠名品牌，质量保证，值得亲的信赖！【德荣盛·天猫TOP商家·8年天猫老店·22年专注音响行业】,2021-04-15
408,追**越,颜色分类: 香槟金★送收纳盒+耳机+充电线+录音线+麦罩+支架+蓝牙发射器 套餐名称: 唱将级K歌神器,好评,漂亮，音质很好,-,-,2021-05-18
409,乐**o,颜色分类: 雅典黑★送收纳盒+耳机+充电线+录音线+麦罩+支架 套餐名称: 唱将级K歌神器,好评,已经收到货啦 🔊已经用了好多天了没有问题，续航还😝很久的 晚上一直在唱歌还有电呢，说的美化声音😍确实可以，带上混响功能效果很好，每次唱歌都要唱好几小时，很喜欢自己的声音哈哈哈🍺  ,麦克风音质不错👌，价廉物美，商家服务周到。货刚到小朋友们抢着唱。尤其是妈妈爱不释手。很满意,^_^ 亲，索爱话筒音响一体麦克风，众多资深音响师鼎力推荐，数十年国民品牌匠心研发，K歌及音响效果杠杠滴。手机、电脑、电视随时随地无线嗨唱。索爱K歌产品已狂销300万件+，音质有口皆碑，中国好声音冠名品牌，质量保证，值得亲的信赖！【德荣盛·天猫TOP商家·8年天猫老店·22年专注音响行业】,2021-03-18
410,天**6,颜色分类: 香槟金★送收纳盒+耳机+充电线+录音线+麦罩 套餐名称: 唱将级K歌神器,好评,宝贝好漂亮，高大上的感觉！在家练歌很实用。混响，音亮调节都很方便，效果不错。客服也很耐心，指导如何蓝牙连接，如何使用…已推荐给歌友了,试用了，蛮好玩的。有这个宝贝，唱歌的兴趣也提高。马上帮朋友下单。,^_^ 亲，索爱话筒音响一体麦克风，众多资深音响师鼎力推荐，数十年国民品牌匠心研发，K歌及音响效果杠杠滴。手机、电脑、电视随时随地无线嗨唱。索爱K歌产品已狂销300万件+，音质有口皆碑，中国好声音冠名品牌，质量保证，值得亲的信赖！【德荣盛·天猫TOP商家·8年天猫老店·22年专注音响行业】,2021-03-27
411,t**4,颜色分类: 雅典黑★送收纳盒+耳机+充电线+录音线+麦罩 套餐名称: 唱将级K歌神器,好评,索爱话筒音响一体麦克风收到了，太喜欢了，款式音响效果都非常好，赞赞赞,-,-,2021-05-31
412,t**0,颜色分类: 玫瑰金★送收纳盒+耳机+充电线+录音线+麦罩+支架+蓝牙发射器 套餐名称: 唱将级K歌神器,好评,音响话筒一体音质效果很好！外观村质也不错！特别是客户服务态度很满意！有问必答，有问题能及时帮改决，这是我在淘上最满意的一次购物！真心点赞给满星！物流也快！服务态度也很好！满分！ ,-,-,2021-06-15
413,寒**蕊,颜色分类: 罗兰紫★送收纳盒+耳机+充电线+录音线+麦罩+支架+蓝牙发射器 套餐名称: 唱将级K歌神器,好评,大宝二宝都非常喜欢，大宝用它讲故事、唱歌，小宝用他背诗。玩得非常开心 ,试了一下，确实很好，声音够大，混响够用，不像有些人说的那样，声音小，效果不好什么的！这个价格在各品牌对比，确实性价比最高，肯定没法和专业声卡比，但是自己唱，和软件k歌，属实够用！买吧，肯定不后悔！,-,2021-05-22
414,t**6,颜色分类: 香槟金★送收纳盒+耳机+充电线+录音线+麦罩+支架 套餐名称: 唱将级K歌神器,好评,很好 买回来给小朋友唱着玩的 娃唱得很开心 🐳音质不错，好早就想着买个蓝牙话筒的 ，🐠朋友推荐这个牌子的，找了好久，找到这家 ，锁定了这款 ，🍎外貌漂亮，包装也是这么上档次，方便收纳 ⛳ ,麦克风蛮好看滴 材质很不错 有颜质音响效果也很好 🐳音质清晰，没有杂音和电流声，k歌超级过瘾，很喜欢有需要再来买🌺,^_^ 亲，索爱话筒音响一体麦克风，众多资深音响师鼎力推荐，数十年国民品牌匠心研发，K歌及音响效果杠杠滴。手机、电脑、电视随时随地无线嗨唱。索爱K歌产品已狂销300万件+，音质有口皆碑，中国好声音冠名品牌，质量保证，值得亲的信赖！【德荣盛·天猫TOP商家·8年天猫老店·22年专注音响行业】,2021-06-23
415,我**贝,颜色分类: 香槟金★送收纳盒+耳机+充电线+录音线+麦罩 套餐名称: 唱将级K歌神器,好评,买回来差点退了。家人试了下。很不错。就留下来。客服很不错。？,-,-,2021-05-13
416,l**0,颜色分类: 雅典黑★送收纳盒+耳机+充电线+录音线+麦罩 套餐名称: 唱将级K歌神器,好评,收到试用了下，室内用声音够大，不知室外怎样，先好评！,麦克风效果不错，音质挺好的，用起来也方便。蓝牙链接很稳定，还可以接手机播放音乐，好评！,-,2021-05-23
417,向**儿,颜色分类: 香槟金★送收纳盒+耳机+充电线+录音线+麦罩+支架+蓝牙发射器 套餐名称: 唱将级K歌神器,好评,此用户没有填写评价。,特备好。 再买一个去,-,2021-04-11
418,b**3,颜色分类: 玫瑰金★送收纳盒+耳机+充电线+录音线+麦罩 套餐名称: 唱将级K歌神器,好评,筒很实用，说话、放音乐声音都很大，🍣孩子老人都喜欢，孩子拿着都不松手，一个明显都不够用了，🍟还要在买一个，学习娱乐都可以用，质量强硬，很理想中的麦克风。©挺好玩的，总之很喜欢，直接上图！🍎 ,挺惊喜的，没想到话筒音效那么好🍣，唱歌清晰有力，没有杂音的感觉声音特别干净，🍟忍不住一下子在全民K歌上面录了好几首歌呢，效果都比之前要好🍎，关键是这个话筒还有美声降噪的效果🐬，唱出来的声音仿佛就像修过音一样好听~💝,^_^ 亲，索爱话筒音响一体麦克风，众多资深音响师鼎力推荐，数十年国民品牌匠心研发，K歌及音响效果杠杠滴。手机、电脑、电视随时随地无线嗨唱。索爱K歌产品已狂销300万件+，音质有口皆碑，中国好声音冠名品牌，质量保证，值得亲的信赖！【德荣盛·天猫TOP商家·8年天猫老店·22年专注音响行业】,2021-05-04
419,c**1,颜色分类: 雅典黑★送收纳盒+耳机+充电线+录音线+麦罩+支架 套餐名称: 唱将级K歌神器,好评,东西收到了，快递真快，深圳到成都，再到青城山，三天就到了，包装完好，從外观上看，是正规专业大厂出品。第一次购买，也從未用过，待学会用后，有体会了，再评。,-,-,2021-05-23
420,莲**菲,颜色分类: 罗兰紫★送收纳盒+耳机+充电线+录音线+麦罩+支架+蓝牙发射器 套餐名称: 唱将级K歌神器,好评,话筒做工精致有份量，音质好没什么杂音，家人们都喜欢，性价比较高，值得推介！ ,-,-,2021-04-07
