数据下载时间：2021-06-28 13:17:08 功能：看店宝【https://kandianbao.com/】 宝贝评价信息分析 相关查询网址：https://kandianbao.com/item/pingjia/620668727019/,,,,,,,
序号,评价用户,sku,评价类型,评价内容,追评,掌柜回评,评价时间
1,王**浩,颜色分类: 玫瑰金★送收纳盒+耳机+充电线+录音线+麦罩+支架+蓝牙发射器 套餐名称: 唱将级K歌神器,好评,音质效果：麦克风[烟花]颜色很漂亮，外观造型挺好看的，看起来蛮有质感的，挺好的。在别家[爱心]买的音质一般，这家买的是真的音质不错，外观大小很合适，质量强硬，实是很不错的选择,买个这，没事就唱唱，物流也很快，设备很齐全，真心好评,^_^ 亲，索爱话筒音响一体麦克风，众多资深音响师鼎力推荐，数十年国民品牌匠心研发，K歌及音响效果杠杠滴。手机、电脑、电视随时随地无线嗨唱。索爱K歌产品已狂销300万件+，音质有口皆碑，中国好声音冠名品牌，质量保证，值得亲的信赖！【德荣盛·天猫TOP商家·9年天猫老店·22年专注音响行业】 ,2021-06-21
2,t**0,颜色分类: 雅典黑★送收纳盒+耳机+充电线+录音线+麦罩 套餐名称: 唱将级K歌神器,好评,宝贝不错，宝贝非常好用，用着很顺手，🍣建议喜欢K歌的朋友们入手这款话筒，🐬录制出来的效果没得说的🌴，用了这个话筒之后高音部分也比之前容易唱上去了，外放声音不会很大 ,除了外放声音小点，其他还不错！音质效果：混响很亮，可以调节大小声，🌺可以蓝牙连接，刚收到的时候没有电，充电后用的时间也是挺久的🐳外观材质：也挺好的 黑色的挺好看的🍣,^_^ 亲，索爱话筒音响一体麦克风，众多资深音响师鼎力推荐，数十年国民品牌匠心研发，K歌及音响效果杠杠滴。手机、电脑、电视随时随地无线嗨唱。索爱K歌产品已狂销300万件+，音质有口皆碑，中国好声音冠名品牌，质量保证，值得亲的信赖！【德荣盛&middot;天猫TOP商家&middot;9年天猫老店&middot;22年专注音响行业】,2021-06-15
3,o**p,颜色分类: 香槟金★送收纳盒+耳机+充电线+录音线+麦罩+支架+蓝牙发射器 套餐名称: 唱将级K歌神器,好评,"挺好的，比耳机K歌好很多，🍣价格也不贵，性价比挺高的，收音效果很棒，🐬性价比很高。声音都也能清楚的收录进去，比我想象中还好，🍎声音大了好多,到时再买几个回家给家里人玩",-,-,2021-06-22
4,f**1,颜色分类: 香槟金★送收纳盒+耳机+充电线+录音线+麦罩 套餐名称: 唱将级K歌神器,好评,宝贝很喜欢，音色很好，🍟颜色也很漂亮，每次连接蓝牙速度而已挺很快的🍎，家里人都很喜欢，每天都会使用，会介绍朋友买的。🐬 ,音质效果：这款话筒音质不错，🐳一直比较担心这么小的话筒音质不会太好，没想到音质这么好，这个价格超值了，🍦我对话筒的要求还是挺高的，这款颜值和效果俱佳,^_^ 亲，索爱话筒音响一体麦克风，众多资深音响师鼎力推荐，数十年国民品牌匠心研发，K歌及音响效果杠杠滴。手机、电脑、电视随时随地无线嗨唱。索爱K歌产品已狂销300万件+，音质有口皆碑，中国好声音冠名品牌，质量保证，值得亲的信赖！【德荣盛&middot;天猫TOP商家&middot;9年天猫老店&middot;22年专注音响行业】,2021-06-22
5,一**8,颜色分类: 香槟金★送收纳盒+耳机+充电线+录音线+麦罩+支架+蓝牙发射器 套餐名称: 唱将级K歌神器,好评,宝贝收🌺到了，物流也快，话筒蛮好的，音质很🎃强硬，样式也蛮好看的，平时没事就喜欢🌊K歌，以前用耳机唱声音很杂，现在用话筒🍻唱就好多了，收到了很喜欢，配件齐全，操作也不是很复杂🌵,非常好，跟ktv效果一样！很喜欢，音质各方面都没问题,^_^ 亲，索爱话筒音响一体麦克风，众多资深音响师鼎力推荐，数十年国民品牌匠心研发，K歌及音响效果杠杠滴。手机、电脑、电视随时随地无线嗨唱。索爱K歌产品已狂销300万件+，音质有口皆碑，中国好声音冠名品牌，质量保证，值得亲的信赖！【德荣盛·天猫TOP商家·8年天猫老店·22年专注音响行业】,2021-06-20
6,小**6,颜色分类: 香槟金★送收纳盒+耳机+充电线+录音线+麦罩+支架+蓝牙发射器 套餐名称: 唱将级K歌神器,好评,自从我🐬买了这个声卡话筒，基本上我天天都唱一次歌。🐹真的很好，相信很多人跟我一样爱好唱👾歌，有了这个话筒非常方便，🍻想唱就唱了。嗨！我们开心就好。棒棒的，很好用的💎麦克风，赞赞！ ,我已经用了好几天了，每天用的很开心，唱歌也有了自信心了。,^_^ 亲，索爱话筒音响一体麦克风，众多资深音响师鼎力推荐，数十年国民品牌匠心研发，K歌及音响效果杠杠滴。手机、电脑、电视随时随地无线嗨唱。索爱K歌产品已狂销300万件+，音质有口皆碑，中国好声音冠名品牌，质量保证，值得亲的信赖！【德荣盛·天猫TOP商家·9年天猫老店·22年专注音响行业】 ,2021-06-25
7,l**2,颜色分类: 雅典黑★送收纳盒+耳机+充电线+录音线+麦罩 套餐名称: 唱将级K歌神器,好评,话筒自带音响🐬效果还不错，声音挺大的，家用特🌺别合适，还可以自己调节音效跟音量，主🌵要价格还很实惠，很满意的，外观材质挺有🎃质感的，刚收到的时候不会使用🎈客服耐心指导我，好评 ,喜欢  超级爱了  我女儿也喜欢,^_^ 亲，索爱话筒音响一体麦克风，众多资深音响师鼎力推荐，数十年国民品牌匠心研发，K歌及音响效果杠杠滴。手机、电脑、电视随时随地无线嗨唱。索爱K歌产品已狂销300万件+，音质有口皆碑，中国好声音冠名品牌，质量保证，值得亲的信赖！【德荣盛&middot;天猫TOP商家&middot;9年天猫老店&middot;22年专注音响行业】,2021-06-17
8,阿**牛,颜色分类: 雅典黑★送收纳盒+耳机+充电线+录音线+麦罩+支架+蓝牙发射器 套餐名称: 唱将级K歌神器,好评,宝贝收到，非常美观大气，🍟音色纯凈，扩音效果良好，是很满意的一次购物，🍎商家服务细心周到，客服热情耐心，🌴物流及时便捷，给予五星好评。 ,这次买到这个宝贝，🐳真的很喜欢，这下在家在外面都可以放开喉咙唱了，好评🍎,^_^ 亲，索爱话筒音响一体麦克风，众多资深音响师鼎力推荐，数十年国民品牌匠心研发，K歌及音响效果杠杠滴。手机、电脑、电视随时随地无线嗨唱。索爱K歌产品已狂销300万件+，音质有口皆碑，中国好声音冠名品牌，质量保证，值得亲的信赖！【德荣盛·天猫TOP商家·8年天猫老店·22年专注音响行业】,2021-06-23
9,t**6,颜色分类: 香槟金★送收纳盒+耳机+充电线+录音线+麦罩+支架+蓝牙发射器 套餐名称: 唱将级K歌神器,好评,"东西是🐬真的很不错，爱了爱了质效果棒棒哒，而且大🌴人孩子都可以用, 东西很好, 价美物廉，满意🌺物流很快，用了几天了，最近晚上回到🍻家一有空就拿着这个麦克风，声音大小正🌊合适，没有杂音 ",使用手机蓝牙连接后就可以K歌了。音量大小可以按照自己的喜好调节非常棒,^_^ 亲，索爱话筒音响一体麦克风，众多资深音响师鼎力推荐，数十年国民品牌匠心研发，K歌及音响效果杠杠滴。手机、电脑、电视随时随地无线嗨唱。索爱K歌产品已狂销300万件+，音质有口皆碑，中国好声音冠名品牌，质量保证，值得亲的信赖！【德荣盛&middot;天猫TOP商家&middot;9年天猫老店&middot;22年专注音响行业】,2021-06-23
10,y**7,颜色分类: 香槟金★送收纳盒+耳机+充电线+录音线+麦罩 套餐名称: 唱将级K歌神器,好评,麦克风挺好用的，孩子学唱歌，买了这个后在家也能练习了，老师也给看了一下，还不错，质量也挺好的 ,试用了一段，效果不错，孩子喜欢,-,2021-06-23
11,a**9,颜色分类: 香槟金★送收纳盒+耳机+充电线+录音线+麦罩+支架+蓝牙发射器 套餐名称: 唱将级K歌神器,好评,麦克风收到货了，年前就收到了，效果非常喜欢，过年期间没事做的时候就用这个麦克风唱歌，家里的小孩都抢着要玩，非常不错的，音质很好，没有杂音，使用也非常简单，开机都有提示音，接上手机还可以放歌 ,之前买的价格都差不过，效果没有这个好，喜欢唱歌的朋友建议购买这款，好评 ,^_^ 亲，索爱话筒音响一体麦克风，众多资深音响师鼎力推荐，数十年国民品牌匠心研发，K歌及音响效果杠杠滴。手机、电脑、电视随时随地无线嗨唱。索爱K歌产品已狂销300万件+，音质有口皆碑，中国好声音冠名品牌，质量保证，值得亲的信赖！【德荣盛&middot;天猫TOP商家&middot;9年天猫老店&middot;22年专注音响行业】,2021-06-17
12,陌**4,颜色分类: 玫瑰金★送收纳盒+耳机+充电线+录音线+麦罩+支架+蓝牙发射器 套餐名称: 唱将级K歌神器,好评,很热情的卖家，下次还来希望下次还有机会合作祝你生意兴隆质量非常好真出乎我的意料包装非常仔细非常感谢。祝生意兴隆！！！  ;’  ,演唱效果好，,^_^ 亲，索爱话筒音响一体麦克风，众多资深音响师鼎力推荐，数十年国民品牌匠心研发，K歌及音响效果杠杠滴。手机、电脑、电视随时随地无线嗨唱。索爱K歌产品已狂销300万件+，音质有口皆碑，中国好声音冠名品牌，质量保证，值得亲的信赖！【德荣盛·天猫TOP商家·9年天猫老店·22年专注音响行业】 ,2021-06-21
13,l**7,颜色分类: 雅典黑★送收纳盒+耳机+充电线+录音线+麦罩+支架+蓝牙发射器 套餐名称: 唱将级K歌神器,好评,唱出来的声音很干净、很通透 ，🍣音质量非常好！还有混响功能，可以关掉原音🌴，拿上它唱歌，有种在KTV唱歌的效果！🍦音效调试的很棒而且声音很大，拿在手里感觉有质感，做工很好。🐬,质量很好这个价格这个音质已经非常好了，🍔自带混响效果是很方便，大致调节一下音质出来就很好了。🍣完全超出我的预想效果了非常的高大上哦，🐬没想过这么便宜能买到这么好的,^_^ 亲，索爱话筒音响一体麦克风，众多资深音响师鼎力推荐，数十年国民品牌匠心研发，K歌及音响效果杠杠滴。手机、电脑、电视随时随地无线嗨唱。索爱K歌产品已狂销300万件+，音质有口皆碑，中国好声音冠名品牌，质量保证，值得亲的信赖！【德荣盛·天猫TOP商家·8年天猫老店·22年专注音响行业】,2021-06-12
14,敢**在,颜色分类: 玫瑰金★送收纳盒+耳机+充电线+录音线+麦罩 套餐名称: 唱将级K歌神器,好评,外观材质：外观很漂亮，音质也挺好，宝贝用着正好，孩子奶奶也喜欢拿来唱歌，挺不错的 ,-,-,2021-06-15
15,t**6,颜色分类: 香槟金★送收纳盒+耳机+充电线+录音线+麦罩 套餐名称: 唱将级K歌神器,好评,外形和卖家图片上描述的一模一样，🍦简单大气，外包装的盒子方便收纳和携带，买来主要是用于户外搞活动用的🍎，音响声音很洪亮、回声都可以调节👾，还可以一键消原音，很棒，给个五星好评！🌴,没有杂音。是正品，变声很有意思，🐳连上手机的蓝牙唱几首抖音里面的热门歌曲，🍎简直是过瘾，这种质量实在是很好，价格很实惠🍦，性价比高。可以放心购买。其他朋友看了要再买一个🌴,^_^ 亲，索爱话筒音响一体麦克风，众多资深音响师鼎力推荐，数十年国民品牌匠心研发，K歌及音响效果杠杠滴。手机、电脑、电视随时随地无线嗨唱。索爱K歌产品已狂销300万件+，音质有口皆碑，中国好声音冠名品牌，质量保证，值得亲的信赖！【德荣盛&middot;天猫TOP商家&middot;8年天猫老店&middot;22年专注音响行业】,2021-06-23
16,l**7,颜色分类: 玫瑰金★送收纳盒+耳机+充电线+录音线+麦罩 套餐名称: 唱将级K歌神器,好评,很喜欢，我试了试音质很棒哦！⛳不比家里的大音响差哦！感觉自己唱歌水平不是一般的好啦！ 🐳原来就想买一个这样的，但是价格太高，👾不过现在在咱这店里真是物美价廉，值得购买！🌵 ,一家人抢着唱，我觉得多买几个🍔，一人手中一个，来个比赛，家里热闹起来啦！颜色也很漂亮哦！🌺,^_^ 亲，索爱话筒音响一体麦克风，众多资深音响师鼎力推荐，数十年国民品牌匠心研发，K歌及音响效果杠杠滴。手机、电脑、电视随时随地无线嗨唱。索爱K歌产品已狂销300万件+，音质有口皆碑，中国好声音冠名品牌，质量保证，值得亲的信赖！【德荣盛&middot;天猫TOP商家&middot;9年天猫老店&middot;22年专注音响行业】,2021-06-12
17,逍**者,颜色分类: 香槟金★送收纳盒+耳机+充电线+录音线+麦罩 套餐名称: 唱将级K歌神器,好评,麦克风颜值很高，拿到手几个朋友都来试了🍣，说还是第一次用这样的麦克风，很新奇，都觉得很实用，🍔以后做什么活动都可以用得上，价格也实惠，非常满意🐳,质量很不错，音色也很好，🍔宝贝很喜欢，拿来全民K歌，这样可以🎤个过瘾了。值得拥有。,^_^ 亲，索爱话筒音响一体麦克风，众多资深音响师鼎力推荐，数十年国民品牌匠心研发，K歌及音响效果杠杠滴。手机、电脑、电视随时随地无线嗨唱。索爱K歌产品已狂销300万件+，音质有口皆碑，中国好声音冠名品牌，质量保证，值得亲的信赖！【德荣盛·天猫TOP商家·9年天猫老店·22年专注音响行业】,2021-06-10
18,李**2,颜色分类: 香槟金★送收纳盒+耳机+充电线+录音线+麦罩 套餐名称: 唱将级K歌神器,好评,这款话筒是我买到最好最棒棒哒的话筒！🍣自带声卡音箱一体麦克风非常棒！🐬音质好外观大气美观非常漂亮喜欢！有需要还介绍朋友也来拍您家话筒音响！🍎客服非常棒的有问题一下就解决了非常棒！⛳,话筒收到有惊艳到我，话筒质感挺好的，🍔我很喜欢这个颜色挺温柔的，好好看的，🐬唱歌的效果也挺好的，我很喜欢，🐛连接手机用全名K歌唱歌还能录音，很满意,^_^ 亲，感谢您的再次评价，祝您使用愉快，期待您的再次光临！【德荣盛·天猫TOP商家·9年天猫老店·22年专注音响行业】 ,2021-06-12
19,1**h,颜色分类: 雅典黑★送收纳盒+耳机+充电线+录音线+麦罩 套餐名称: 唱将级K歌神器,好评,此用户没有填写评价。,挺好的，东🌴西功能很丰富，外观也很漂亮，用的比较顺🍻手，重量也比较合适。适配性很强，🎃和手机电脑都能连接，在家就可以体会到k🌺tv的感觉。音质不是一般的🐙好，拿到手还是特别满意的 ,^_^ 亲，索爱话筒音响一体麦克风，众多资深音响师鼎力推荐，数十年国民品牌匠心研发，K歌及音响效果杠杠滴。手机、电脑、电视随时随地无线嗨唱。索爱K歌产品已狂销300万件+，音质有口皆碑，中国好声音冠名品牌，质量保证，值得亲的信赖！【德荣盛·天猫TOP商家·8年天猫老店·22年专注音响行业】,2021-06-10
20,符**0,颜色分类: 雅典黑★送收纳盒+耳机+充电线+录音线+麦罩 套餐名称: 唱将级K歌神器,好评,麦克风用了才来评价，颜色鲜亮真的很漂亮，做工精美音质清晰无杂音，外观高端大气上档次，操作简单方便，全民K歌可以试试这款麦克风真的很不错，值得推荐！唱歌很好听，无聊的时候还可以当做音箱用来听歌 ,宝贝很漂亮！音质也很好！可以在家嗨唱起来！值得购买！,^_^ 亲，索爱话筒音响一体麦克风，众多资深音响师鼎力推荐，数十年国民品牌匠心研发，K歌及音响效果杠杠滴。手机、电脑、电视随时随地无线嗨唱。索爱K歌产品已狂销300万件+，音质有口皆碑，中国好声音冠名品牌，质量保证，值得亲的信赖！【德荣盛&middot;天猫TOP商家&middot;8年天猫老店&middot;22年专注音响行业】,2021-06-21
21,手**0,颜色分类: 香槟金★送收纳盒+耳机+充电线+录音线+麦罩 套餐名称: 唱将级K歌神器,好评,"质量和外观都不错,这个皮包装盒我很喜欢！感觉麦克风放在里面很有安全感！音质也还不错,总体来说性价比很高！ ","主要买给孩子练的,这是6岁的儿子唱的,100多这个音质质量我很满意了！已经推荐给朋友😄",^_^ 亲，索爱话筒音响一体麦克风，众多资深音响师鼎力推荐，数十年国民品牌匠心研发，K歌及音响效果杠杠滴。手机、电脑、电视随时随地无线嗨唱。索爱K歌产品已狂销300万件+，音质有口皆碑，中国好声音冠名品牌，质量保证，值得亲的信赖！【德荣盛·天猫TOP商家·9年天猫老店·22年专注音响行业】,2021-06-14
22,t**3,颜色分类: 香槟金★送收纳盒+耳机+充电线+录音线+麦罩 套餐名称: 唱将级K歌神器,好评,很好用，调式💦几次就得心应手了👌，，录音效果确实不错，音质很好，没有杂音，充一次电可以🌊用好久，适合所有喜欢唱歌的朋友们，生活不只有苟且，🐠还有诗和远方😊😊！索爱开启我更爱唱歌，更爱生活！！！👍👍  ,精致大气，录音效果也非常号，试用很方便，好评,^_^ 亲，索爱话筒音响一体麦克风，众多资深音响师鼎力推荐，数十年国民品牌匠心研发，K歌及音响效果杠杠滴。手机、电脑、电视随时随地无线嗨唱。索爱K歌产品已狂销300万件+，音质有口皆碑，中国好声音冠名品牌，质量保证，值得亲的信赖！【德荣盛&middot;天猫TOP商家&middot;8年天猫老店&middot;22年专注音响行业】,2021-06-21
23,冰**4,颜色分类: 雅典黑★送收纳盒+耳机+充电线+录音线+麦罩 套餐名称: 唱将级K歌神器,好评,话筒做工时尚💦美观，那在手里很有质感，手感舒适。唱歌🐯清晰无杂音，功能也很齐全，麦克🌊风和图片描述的一样，跟劣质仿品完全不同，电池也很耐用，买来🐠充了一次电唱好几次了都还有电。方便 ,话筒做工精致，外观漂亮，音质很好，声音很响，手机蓝牙连接非常方便，放音乐和唱歌都不错,^_^ 亲，索爱话筒音响一体麦克风，众多资深音响师鼎力推荐，数十年国民品牌匠心研发，K歌及音响效果杠杠滴。手机、电脑、电视随时随地无线嗨唱。索爱K歌产品已狂销300万件+，音质有口皆碑，中国好声音冠名品牌，质量保证，值得亲的信赖！【德荣盛&amp;middot;天猫TOP商家&amp;middot;9年天猫老店&amp;middot;22年专注音响行业】,2021-06-18
24,云**9,颜色分类: 香槟金★送收纳盒+耳机+充电线+录音线+麦罩 套餐名称: 唱将级K歌神器,好评,打开手机蓝牙，与话筒马上连接上👾，音质清晰，没有杂音，🍎空闲时与家人一起听听音乐，唱唱歌，就像在KTV一样，很棒~🐠 ,东西不错，已经使用好几天了，🍣每天几乎都要拿出来玩一下，收纳包很好，🐳质量还是一如既往的好，不用担心质量问题了🍦，质量有保障，售后给力。,^_^ 亲，索爱话筒音响一体麦克风，众多资深音响师鼎力推荐，数十年国民品牌匠心研发，K歌及音响效果杠杠滴。手机、电脑、电视随时随地无线嗨唱。索爱K歌产品已狂销300万件+，音质有口皆碑，中国好声音冠名品牌，质量保证，值得亲的信赖！【德荣盛·天猫TOP商家·9年天猫老店·22年专注音响行业】,2021-06-13
25,m**2,颜色分类: 玫瑰金★送收纳盒+耳机+充电线+录音线+麦罩+支架 套餐名称: 唱将级K歌神器,好评,总想着去KTV唱歌，现在自己买了个话筒，🍣自己可以在家里开歌了，而且音质很好。品质量很好，🍦与图片描述的一样，音质超级好，挺满意的一次🌺,录的歌也很好听，还有好几种魔音，🍣好好玩，弟弟也喜欢玩，很喜欢这个话筒音响🍎，下次有朋友会推荐给朋友，很满意🍸,^_^ 亲，索爱话筒音响一体麦克风，众多资深音响师鼎力推荐，数十年国民品牌匠心研发，K歌及音响效果杠杠滴。手机、电脑、电视随时随地无线嗨唱。索爱K歌产品已狂销300万件+，音质有口皆碑，中国好声音冠名品牌，质量保证，值得亲的信赖！【德荣盛·天猫TOP商家·9年天猫老店·22年专注音响行业】 ,2021-06-09
26,t**7,颜色分类: 香槟金★送收纳盒+耳机+充电线+录音线+麦罩 套餐名称: 唱将级K歌神器,好评,特别🔥好 刚拿到手迫不及待试了一下 音质很好，没什☔么杂音，外观材质：看起来好像主播在直播 颜值🎄棒棒哒 很好用，非常好用，操作简单一学就会👾，一款好用的唱歌神器。是正品🍎,音量也够大，录歌还是需要耳机来听伴奏会更好，总的来说很不错，也优惠的,^_^ 亲，索爱话筒音响一体麦克风，众多资深音响师鼎力推荐，数十年国民品牌匠心研发，K歌及音响效果杠杠滴。手机、电脑、电视随时随地无线嗨唱。索爱K歌产品已狂销300万件+，音质有口皆碑，中国好声音冠名品牌，质量保证，值得亲的信赖！【德荣盛·天猫TOP商家·9年天猫老店·22年专注音响行业】,2021-06-20
27,t**4,颜色分类: 香槟金★送收纳盒+耳机+充电线+录音线+麦罩 套餐名称: 唱将级K歌神器,好评,麦克风实物与图一致，没色差，🍣拿在手上厚重，有份量，🌺总之刚刚好的感觉，虽然按键多，但是使用很方便，🍦不难操作，唱歌出来的音质音色都很满意，这个价位的麦克风能做到这种质量，🍎真的很不错了，大家有需要可以买来试试，真的不错！ ,和手机蓝牙链接，操作方便，音响效果很好🌺，马上在家就高歌了一曲，外观设计非常漂亮，选了自己喜欢的颜色，赞👍🍝, ^_^ 亲，索爱话筒音响一体麦克风，众多资深音响师鼎力推荐，数十年国民品牌匠心研发，K歌及音响效果杠杠滴。手机、电脑、电视随时随地无线嗨唱。索爱K歌产品已狂销300万件+，音质有口皆碑，中国好声音冠名品牌，质量保证，值得亲的信赖！【德荣盛·天猫TOP商家·9年天猫老店·22年专注音响行业】,2021-05-31
28,l**9,颜色分类: 香槟金★送收纳盒+耳机+充电线+录音线+麦罩 套餐名称: 唱将级K歌神器,好评,老公和孩子都喜欢K歌，看了不少麦克风卖家，最终选了这款。发货快，包装精美，功能全，收到后老公试唱了一首歌，声音饱满，全民K歌给打了很高的分数，上传后好评如潮。 ,好用，不用去KTV了,-,2021-06-23
29,z**0,颜色分类: 雅典黑★送收纳盒+耳机+充电线+录音线+麦罩 套餐名称: 唱将级K歌神器,好评,选购了这款手机麦克风，让人用着放心踏实。👾我选购的是黑色的，高端大气上档次，麦克风还可以当播放器，🍣音质也还可以对得起价格。声音清晰，🍎没有噪音杂音，用电省，音色形象*真，我们一家人都特别喜欢！正品，有保障！  ,麦克风不错，外放效果还可以，🍟适合在家或者聚会时候唱，很好看，宝宝也很喜欢，🍳无论外观还是音效都是喜出望外啊！！！太赞了！,^_^ 亲，索爱话筒音响一体麦克风，众多资深音响师鼎力推荐，数十年国民品牌匠心研发，K歌及音响效果杠杠滴。手机、电脑、电视随时随地无线嗨唱。索爱K歌产品已狂销300万件+，音质有口皆碑，中国好声音冠名品牌，质量保证，值得亲的信赖！【德荣盛·天猫TOP商家·9年天猫老店·22年专注音响行业】,2021-06-01
30,s**3,颜色分类: 香槟金★送收纳盒+耳机+充电线+录音线+麦罩+支架+蓝牙发射器 套餐名称: 唱将级K歌神器,好评,宝贝的质量好，音质清晰🍟，手感不错，本来买一个抱着试试的心态的🍦，收到后还挺喜欢的，使用也挺简单的，🐬带出去也很方便，价格也很实惠。🍎 ,音效很好 性价比太高了吧 👾在家练歌居然能唱出KTV的感觉 太开心了 选的金色 🍦比较高大上 如果搞活动带出去也十分方便呢🌺 收纳盒可以把所有的小零碎都放进去 设计合理💝, ^_^ 亲，索爱话筒音响一体麦克风，众多资深音响师鼎力推荐，数十年国民品牌匠心研发，K歌及音响效果杠杠滴。手机、电脑、电视随时随地无线嗨唱。索爱K歌产品已狂销300万件+，音质有口皆碑，中国好声音冠名品牌，质量保证，值得亲的信赖！【德荣盛·天猫TOP商家·9年天猫老店·22年专注音响行业】,2021-06-15
