1498,风**谁,颜色分类: 高配置双杆【蓝色】,好评,产品不错，满意。生手也可以用的很好， ,-,-,2021-04-25
1499,a**2,颜色分类: 高配置双杆【蓝色】,好评,操作简单，使用方便，好用,-,-,2021-04-25
1500,傻**鱼,颜色分类: 米色 高配置【升级版】,好评,好用又方便，简单操作 ,-,-,2021-04-21
1501,t**1,颜色分类: 圆杆简易配置,好评,一分价钱一分货吧 ,-,-,2021-06-19
1502,t**1,颜色分类: 高配置双杆【蓝色】,好评,东西挺好的,-,-,2021-06-19
1503,t**2,颜色分类: 高配置双杆【蓝色】,好评,熨烫机收到了，是正品，质量很好，好用，很满意,-,-,2021-06-12
1504,发**8,颜色分类: 米色 高配置【升级版】,好评,挂烫机收到了，蒸汽均匀，方便实用，好评 ,-,-,2021-04-25
1505,t**1,颜色分类: 米色 高配置【升级版】,好评,试用一下加热很快。衣服躺的也很好。很满意的一次购物。很好,-,-,2021-06-19
1506,麦**2,颜色分类: 圆杆简易配置,好评,用过后才来评价的，效果不错， ,-,-,2021-04-22
1507,可**8,颜色分类: 红色 高配置【升级版】,好评,很不错，很方便，价格也不贵，可以下单,-,-,2021-04-21
1508,a**3,颜色分类: 米色 高配置【升级版】,好评,宝贝收到，很好操作，方便好用,-,-,2021-05-09
1509,雷**铺,颜色分类: 圆杆简易配置,好评,美这里。挂烫机收到了，跟描述相同没有色差机器安装好也很大气，看着很好看，之前在别家也买过挂烫机，但是收到后试用了一下，效果不怎么样，就退货了，这家的用着挺好的，出汽也很快昨晚到的，安装完毕，客服很贴心解答问题，说以后有问题可以随时解决，好评！  ,-,-,2021-03-19
1510,t**2,颜色分类: 高配置双杆【蓝色】,好评,简单好用，价格也不贵，很实用 ,-,-,2021-06-12
1511,t**5,颜色分类: 米色 高配置【升级版】,好评,平烫挂烫都很好用，超方便,-,-,2021-05-02
1512,y**8,颜色分类: 圆杆简易配置,好评,不错好用，安装简洁方便 ,-,-,2021-04-21
1513,9**1,颜色分类: 高配置双杆【蓝色】,好评,到货了质量很好价格便宜物流很快客服态度很好,-,-,2021-04-29
1514,t**8,颜色分类: 高配置双杆【蓝色】,好评,蒸汽烫斗收到了，蒸汽大，挺好用的,-,-,2021-06-16
1515,梨**1,颜色分类: 高配置双杆【蓝色】,好评,好用，有了这个衣服不怕皱了,-,-,2021-05-06
1516,l**0,颜色分类: 宽杆标准配置,好评,此用户没有填写评价。,用了挺好的很不错值得购买,-,2021-06-23
1517,女**0,颜色分类: 高配置双杆【蓝色】,好评,产品质量很棒，是一款非常好的产品，值得推荐,-,-,2021-04-19
1518,邱**6,颜色分类: 米色 高配置【升级版】,好评,很漂亮真的喜欢，卖家描完全致，发货速度非常快，很满意的一次购物 ,-,-,2021-05-04
1519,t**9,颜色分类: 米色 高配置【升级版】,好评,质量不错，很好用的一款挂烫机 ,-,-,2021-06-23
1520,t**6,颜色分类: 高配置双杆【蓝色】,好评,用起来很方便，也不占地方 ,-,-,2021-04-21
1521,l**振,颜色分类: 高配置双杆【蓝色】,好评,蛮好用的，蒸汽很大，外观好看,-,-,2021-04-18
1522,d**8,颜色分类: 米色 高配置【升级版】,好评,质量很好，挺好用的，很方便，非常满意,-,-,2021-05-08
1523,t**8,颜色分类: 米色 高配置【升级版】,好评,很好用。高配置的。质量很好，非常满意,-,-,2021-06-16
1524,t**2,颜色分类: 蓝色 高配置【升级版】,好评,家里用真的超级方便，太好用了。,-,-,2021-06-12
1525,日**2,颜色分类: 高配置双杆【蓝色】,好评,不错不错不错一次愉快的网购,-,-,2021-04-17
1526,丹**2,颜色分类: 高配置双杆【蓝色】,好评,刚刚用，效果不错，推荐购买,-,-,2021-05-03
1527,x**7,颜色分类: 高配置双杆【蓝色】,好评,有惠普好生活 惠普值得信赖,-,-,2021-05-08
1528,1**啊,颜色分类: 米色 高配置【升级版】,好评,东西收到了，质量很好，也很好用，满意 ,-,-,2021-04-22
1529,y**6,颜色分类: 米色 高配置【升级版】,好评,3心必须安全号安全号够500天,-,-,2021-05-02
1530,孟**格,颜色分类: 高配置双杆【蓝色】,好评,熨衣服很好，很方便，用起来很顺手！好评！,-,-,2021-04-16
1531,t**2,颜色分类: 高配置双杆【蓝色】,好评,操作方便，真的太实用了,-,-,2021-06-12
1532,王**8,颜色分类: 宽杆标准配置,好评,拿到马上试用了下，还不错,-,-,2021-04-21
1533,夜**5,颜色分类: 高配置双杆【蓝色】,好评,到货两天，试用了一下，挺好用的 ,-,-,2021-05-03
1534,t**5,颜色分类: 高配置双杆【蓝色】,好评,效果很好，很快，很喜欢,-,-,2021-04-29
1535,t**1,颜色分类: 高配置双杆【蓝色】,好评,挂烫机已经用上了，质量不错,-,-,2021-06-19
1536,t**9,颜色分类: 高配置双杆【蓝色】,好评,队收到货了，质量很好，价格优惠，款式也好看 ,-,-,2021-06-23
1537,t**8,颜色分类: 蓝色 高配置【升级版】,好评,非常好用也好看，经济实惠，值得购买。,-,-,2021-06-16
1538,t**1,颜色分类: 蓝色 高配置【升级版】,好评,宝贝真的很好,-,-,2021-06-19
1539,奇**8,颜色分类: 蓝色 高配置【升级版】,好评,挂烫机已收到，用了用还挺好的，物超所值！,-,-,2021-04-25
1540,不**4,颜色分类: 高配置双杆【蓝色】,好评,特别好安装，卖家服务特别好，没使用呢，使用后再来评价  ,-,-,2021-04-24
1541,t**5,颜色分类: 高配置双杆【蓝色】,好评,熨烫方便快捷，好收纳,-,-,2021-04-27
1542,雨**飞,颜色分类: 米色 高配置【升级版】,好评,挂烫机收到了，烫衣服很好。,-,-,2021-05-05
1543,小**啾,颜色分类: 高配置双杆【蓝色】,好评,此用户没有填写评价。,上汽超快，用过几次。,-,2021-05-05
1544,t**2,颜色分类: 米色 高配置【升级版】,好评,很好用，推介给大家,-,-,2021-06-12
1545,麻**0,颜色分类: 高配置双杆【蓝色】,好评,经济方便实用 真的太棒了 ,-,-,2021-05-09
1546,w**5,颜色分类: 高配置双杆【蓝色】,好评,大小合适满意，性价比高,-,-,2021-05-06
1547,金**3,颜色分类: 米色 高配置【升级版】,好评,蒸汽好，就是烫衣架差,-,-,2021-05-22
1548,姐**过,颜色分类: 高配置双杆【蓝色】,好评,到货及时，整体满意。,-,-,2021-04-16
1549,j**一,颜色分类: 高配置双杆【蓝色】,好评,质量不错 很好 物流也很快  ,-,-,2021-04-22
1550,t**0,颜色分类: 高配置双杆【蓝色】,好评,挺好用的！小巧不占地方！  ,-,-,2021-06-13
1551,t**2,颜色分类: 红色 高配置【升级版】,好评,很方便很实用，质量保证，,-,-,2021-06-12
1552,t**8,颜色分类: 米色 高配置【升级版】,好评,好用，家用很方便高配置,-,-,2021-06-16
1553,t**6,颜色分类: 蓝色 高配置【升级版】,好评,挂烫机用着很顺手，很方便，物美价廉，值得购买,-,-,2021-04-28
1554,d**n,颜色分类: 高配置双杆【蓝色】,好评,质量好，用着很不错。操作方便。,-,-,2021-05-07
1555,1**2,颜色分类: 蓝色 高配置【升级版】,好评,货已收到，挂烫机非常不错，好用方便 ,-,-,2021-05-02
1556,t**8,颜色分类: 高配置双杆【蓝色】,好评,收到哦了，质量很好，很好用，非常满意 ,-,-,2021-06-16
1557,c**崔,颜色分类: 高配置双杆【蓝色】,好评,收到了，安装比较简单，熨烫使用都很方便，很不错,-,-,2021-04-18
1558,t**3,颜色分类: 蓝色 高配置【升级版】,好评,烫斗高端大气，实用方便，很满意！,-,-,2021-06-26
1559,k**0,颜色分类: 高配置双杆【蓝色】,好评,宝贝收到了，很实用，用起来很方便，好评,-,-,2021-04-16
1560,z**蓝,颜色分类: 高配置双杆【蓝色】,好评,还在使用，现在用起来不错,-,-,2021-05-08
1561,绽**9,颜色分类: 蓝色 高配置【升级版】,好评,收到很满意，使用方便。,-,-,2021-04-18
1562,w**0,颜色分类: 高配置双杆【蓝色】,好评,质量不错，蒸汽出的很快很好用 ,-,-,2021-05-09
1563,暴**停,颜色分类: 高配置双杆【蓝色】,好评,质量不错，用起来也很方便,-,-,2021-04-25
1564,t**5,颜色分类: 米色 高配置【升级版】,好评,物流很给力，很快就到了，挂烫机质量相当好，很满意,-,-,2021-04-20
1565,8**0,颜色分类: 蓝色 高配置【升级版】,好评,质量很好，使用方便。 ,-,-,2021-05-09
1566,t**1,颜色分类: 高配置双杆【蓝色】,好评,已收到了自家用很合适哦,-,-,2021-06-19
1567,m**4,颜色分类: 蓝色 高配置【升级版】,好评,是理想中的产品，质量不错，物流也很快，值得点赞,-,-,2021-04-30
1568,a**7,颜色分类: 蓝色 高配置【升级版】,好评,质量不错，使用了一下家用足够了,-,-,2021-04-17
1569,j**7,颜色分类: 高配置双杆【蓝色】,好评,挂烫机很好用，烫的衣服很顺！性价比高！,-,-,2021-04-21
1570,粤**售,颜色分类: 红色 高配置【升级版】,好评,已安装，未使用，先好评 ,-,-,2021-04-24
1571,h**8,颜色分类: 高配置双杆【蓝色】,好评,很方便，很实用，用着挺不错的，服务态度也很好。,-,-,2021-04-16
1572,姜**猫,颜色分类: 高配置双杆【蓝色】,好评,还没用  看着挺好的 ,-,-,2021-04-30
1573,丫**g,颜色分类: 高配置双杆【蓝色】,好评,发热速度快，烫衣效果好，物美价廉,-,-,2021-04-16
1574,陈**4,颜色分类: 高配置双杆【蓝色】,好评,很实用，用起来也方便又不占地方，好评,-,-,2021-04-29
1575,权**潞,颜色分类: 高配置双杆【蓝色】,好评,发货速度快！很好用！价格也便宜很满意,-,-,2021-04-25
1576,t**9,颜色分类: 圆杆简易配置,好评,好用，而且烫得也挺好的,-,-,2021-06-23
1577,1**y,颜色分类: 高配置双杆【蓝色】,好评,很实用的一款挂烫机 ,-,-,2021-04-27
1578,我**也,颜色分类: 高配置双杆【蓝色】,好评,使用方便，熨烫很好，价格很实惠，客服态度也很好 ,-,-,2021-04-26
1579,雅**英,颜色分类: 高配置双杆【蓝色】,好评,跟实体店没有区别，还便宜，喜欢！ ,-,-,2021-05-04
1580,虚**出,颜色分类: 高配置双杆【蓝色】,好评,不错不错很好用试了一下,-,-,2021-04-18
1581,普**1,颜色分类: 圆杆简易配置,好评,迫不及待用了下，挺好的 ,-,-,2021-05-08
1582,g**我,颜色分类: 高配置双杆【蓝色】,好评,货已收到，真心的不错，用起来很方便,-,-,2021-04-26
1583,润**1,颜色分类: 米色 高配置【升级版】,好评,物流速度很快，价格比实体店便宜很多，很满意,-,-,2021-04-16
1584,s**9,颜色分类: 高配置双杆【蓝色】,好评,效果不错，用着挺好,-,-,2021-06-13
1585,东**船,颜色分类: 米色 高配置【升级版】,好评,家用很好不占地方 ,-,-,2021-04-24
1586,t**糖,颜色分类: 圆杆简易配置,好评,很好用 家用比较方便 ,-,-,2021-05-04
1587,李**强,颜色分类: 米色 高配置【升级版】,好评,用了一下，非常不方便,-,-,2021-05-22
1588,t**2,颜色分类: 米色 高配置【升级版】,好评,挂机收到了，质量很好，很满意。,-,-,2021-06-12
1589,欧**刘,颜色分类: 高配置双杆【蓝色】,好评,熨斗效果不错。质量保证。非常喜欢,-,-,2021-04-23
1590,曹**轩,颜色分类: 米色 高配置【升级版】,好评,宝贝收到了，我很喜欢！好用！下次再来！,-,-,2021-05-05
1591,陈**5,颜色分类: 红色 高配置【升级版】,好评,收到很好，用过再评 ,-,-,2021-04-24
1592,北**4,颜色分类: 红色 高配置【升级版】,好评,自己平时用的，很方便的。 ,-,-,2021-04-16
1593,t**4,颜色分类: 高配置双杆【蓝色】,好评,挺好用的，熨衣服很方便，也很快，好评,-,-,2021-06-23
1594,玩**店,颜色分类: 高配置双杆【蓝色】,好评,挂烫机收到了，用了一下，非常好使，谢谢商家！,-,-,2021-05-06
1595,m**7,颜色分类: 米色 高配置【升级版】,好评,一般，扑扑水声很大，说是正常现象,-,-,2021-04-11
1596,t**8,颜色分类: 蓝色 高配置【升级版】,好评,好用实用，好宝贝，推荐。,-,-,2021-06-16
1597,c**9,颜色分类: 红色 高配置【升级版】,好评,宝贝收到了，质量非常好，服务态度好，下次还来。 ,-,-,2021-04-24
1598,t**8,颜色分类: 米色 高配置【升级版】,好评,蒸烫机不错，好用,-,-,2021-06-16
1599,如**3,颜色分类: 高配置双杆【蓝色】,好评,非常好用，烫了效果不错，物美价廉，好评！ ,-,-,2021-04-28
1600,陶**8,颜色分类: 米色 高配置【升级版】,好评,非常不错，方便多了，,-,-,2021-04-19
1601,t**0,颜色分类: 米色 高配置【升级版】,好评,用了几天感觉挺好的，好用,-,-,2021-06-13
1602,z**5,颜色分类: 高配置双杆【蓝色】,好评,忘了评了 还不错，挺好 ,-,-,2021-06-15
1603,l**9,颜色分类: 高配置双杆【蓝色】,好评,效果很好。物美价廉，满意，喜欢,-,-,2021-04-26
1604,h**花,颜色分类: 蓝色 高配置【升级版】,好评,很好用的一款产品，质量很好，物流很快很满意,-,-,2021-04-26
1605,y**u,颜色分类: 高配置双杆【蓝色】,好评,买这家的是福气好,-,-,2021-04-18
1606,z**0,颜色分类: 高配置双杆【蓝色】,好评,加热很快.功能多 ,-,-,2021-05-05
1607,1**a,颜色分类: 高配置双杆【蓝色】,好评,很好用，出蒸汽很快,-,-,2021-04-21
1608,k**3,颜色分类: 高配置双杆【蓝色】,好评,烫机收到了，质量超级，商家服务也非常好，值得购买，值得推荐,-,-,2021-04-24
1609,温**9,颜色分类: 高配置双杆【蓝色】,好评,试用了一下，先好评！,-,-,2021-04-27
1610,d**6,颜色分类: 高配置双杆【蓝色】,好评,用了一段时间，挺好的,-,-,2021-04-29
1611,飞**8,颜色分类: 高配置双杆【蓝色】,好评,我用了一下还挺好用。,-,-,2021-05-18
1612,潘**8,颜色分类: 蓝色 高配置【升级版】,好评,货已收到，蒸汽非常大，便捷好用 ,-,-,2021-04-19
1613,旭**2,颜色分类: 圆杆简易配置,好评,蒸汽小，不好熨平 ,-,-,2021-05-20
1614,j**8,颜色分类: 圆杆简易配置,好评,还行吧，用了一次 ,-,-,2021-05-17
1615,q**2,颜色分类: 米色 高配置【升级版】,好评,货已收到，质量很好，很满意喜欢哦,-,-,2021-05-02
1616,h**0,颜色分类: 宽杆标准配置,好评,我个人觉得挺好,-,-,2021-04-16
1617,t**2,颜色分类: 高配置双杆【蓝色】,好评,操作简便，质量不错,-,-,2021-06-12
1618,y**7,颜色分类: 红色 高配置【升级版】,好评,真的很好用，，值得推荐，，三秒吐雾😂😂😂,-,-,2021-04-28
1619,t**0,颜色分类: 米色 高配置【升级版】,好评,使用方便简单，烫的很平正，不错,-,-,2021-06-13
1620,l**8,颜色分类: 米色 高配置【升级版】,好评,很实用很好正品,-,-,2021-06-25
1621,亭**停,颜色分类: 米色 高配置【升级版】,好评,挺好用的，用过才来评价的，货真价实！,-,-,2021-04-17
1622,t**1,颜色分类: 高配置双杆【蓝色】,好评,挺好用的，很方便,-,-,2021-06-19
1623,t**1,颜色分类: 高配置双杆【蓝色】,好评,出汽很快，汽量很大 ,-,-,2021-06-19
1624,t**5,颜色分类: 高配置双杆【蓝色】,好评,很好用。还不错 ,-,-,2021-04-28
1625,分**3,颜色分类: 高配置双杆【蓝色】,好评,小巧，方便实用,-,-,2021-05-05
1626,l**6,颜色分类: 高配置双杆【蓝色】,好评,买的家用的，挺好用好评！,-,-,2021-04-23
1627,t**2,颜色分类: 高配置双杆【蓝色】,好评,时间短，蒸气大！ ,-,-,2021-06-12
1628,爱**惯,颜色分类: 高配置双杆【蓝色】,好评,很好非常喜欢,-,-,2021-04-19
1629,浅**荷,颜色分类: 高配置双杆【蓝色】,好评,颜值不错，值得买 ,-,-,2021-04-26
1630,爷**鳖,颜色分类: 高配置双杆【蓝色】,好评,还可以，挺好用的。,-,-,2021-05-16
1631,王**丽,颜色分类: 高配置双杆【蓝色】,好评,试用了效果不错，也不贵，值得购买 ,-,-,2021-04-28
1632,玉**洁,颜色分类: 蓝色 高配置【升级版】,好评,不错，挺好用的，颜值也高，买值了 ,-,-,2021-04-30
1633,末**万,颜色分类: 高配置双杆【蓝色】,好评,东西非常好，非常满意，好评。,-,-,2021-04-16
1634,霞**3,颜色分类: 高配置双杆【蓝色】,好评,质量很好，外观好看，值得购买 ,-,-,2021-05-01
1635,t**7,颜色分类: 宽杆标准配置,好评,包装严实，质量好，非常满意. ,-,-,2021-06-13
1636,0**阁,颜色分类: 红色 高配置【升级版】,好评,用着不错，价格实在，发货速度快,-,-,2021-05-01
1637,拥**3,颜色分类: 红色 高配置【升级版】,好评,熨衣服又快又好,-,-,2021-05-06
1638,t**9,颜色分类: 米色 高配置【升级版】,好评,好用(✪▽✪),-,-,2021-06-23
1639,萱**2,颜色分类: 圆杆简易配置,好评,目前来说很好,-,-,2021-04-22
1640,步**泽,颜色分类: 米色 高配置【升级版】,好评,熨斗挺好用的，质量很好,-,-,2021-04-23
1641,胡**3,颜色分类: 红色 高配置【升级版】,好评,质量很好，推荐购买 ,-,-,2021-05-08
1642,啊**网,颜色分类: 宽杆标准配置,好评,宝贝收到，，好用方便喜欢 ,-,-,2021-05-04
1643,老**2,颜色分类: 米色 高配置【升级版】,好评,宝贝收到了，挺好用的。,-,-,2021-04-22
1644,t**1,颜色分类: 宽杆标准配置,好评,可以，好用 ,-,-,2021-06-19
1645,t**4,颜色分类: 宽杆标准配置,好评,好用，方便多了,-,-,2021-06-23
1646,谢**0,颜色分类: 高配置双杆【蓝色】,好评,很好用 很方便,-,-,2021-04-25
1647,t**1,颜色分类: 宽杆标准配置,好评,很好用，也很实用 ,-,-,2021-06-19
1648,t**3,颜色分类: 高配置双杆【蓝色】,好评,出乎意料的好。,-,-,2021-06-26
1649,n**7,颜色分类: 红色 高配置【升级版】,好评,很好用，很方便,-,-,2021-04-25
1650,那**地,颜色分类: 高配置双杆【蓝色】,好评,好用，很方便,-,-,2021-04-22
1651,t**8,颜色分类: 高配置双杆【蓝色】,好评,东西收到了，质量不错，服务态度很好，特满意,-,-,2021-06-16
1652,t**5,颜色分类: 高配置双杆【蓝色】,好评,板有个脚坏了,-,-,2021-05-21
1653,a**3,颜色分类: 米色 高配置【升级版】,好评,用了还不错噢!,-,-,2021-05-07
1654,c**9,颜色分类: 高配置双杆【蓝色】,好评,质量好，做工精细，用着方便,-,-,2021-04-24
1655,w**5,颜色分类: 高配置双杆【蓝色】,好评,不是很满意,-,-,2021-05-15
1656,t**6,颜色分类: 蓝色 高配置【升级版】,好评,到货很快。质量不错，好评 ,-,-,2021-04-25
1657,唐**贝,颜色分类: 高配置双杆【蓝色】,好评,用着还可以,-,-,2021-04-21
1658,t**9,颜色分类: 蓝色 高配置【升级版】,好评,收到后就用了，非常好用，很满意,-,-,2021-06-23
1659,t**3,颜色分类: 米色 高配置【升级版】,好评,很满意的，质量很不错,-,-,2021-06-26
1660,s**1,颜色分类: 红色 高配置【升级版】,好评,发货很快，里面的配件很齐全，用起来很方便,-,-,2021-04-30
1661,2**y,颜色分类: 高配置双杆【蓝色】,好评,真是家庭好帮手，货真价实，值得购买，,-,-,2021-05-09
1662,t**0,颜色分类: 圆杆简易配置,好评,蒸氣產生速度快出貨速度快,-,-,2021-06-13
1663,春**你,颜色分类: 高配置双杆【蓝色】,好评,发货速度快，做工精细质量很好,-,-,2021-05-06
1664,静**兮,颜色分类: 高配置双杆【蓝色】,好评,非常好用，简单好用，性价比高 ,-,-,2021-04-22
1665,夏**章,颜色分类: 高配置双杆【蓝色】,好评,很方便，用起来很好，我很满意,-,-,2021-04-18
1666,李**发,颜色分类: 高配置双杆【蓝色】,好评,好用不贵,-,-,2021-04-24
1667,i**7,颜色分类: 圆杆简易配置,好评,蛮好用的，衣服瞬间亮了，喜欢,-,-,2021-05-05
1668,t**2,颜色分类: 蓝色 高配置【升级版】,好评,很好很方便,-,-,2021-06-12
1669,t**3,颜色分类: 米色 高配置【升级版】,好评,小巧实用 ,-,-,2021-06-26
1670,t**5,颜色分类: 米色 高配置【升级版】,好评,物流很快，服务态度好，宝贝也很好，放家里用还蛮不错的还很方便，也很好用，,-,-,2021-04-26
1671,d**0,颜色分类: 米色 高配置【升级版】,好评,管子太短了， ,-,-,2021-05-20
1672,鸭**2,颜色分类: 高配置双杆【蓝色】,好评,质量不错，物流挺快的，很实用,-,-,2021-05-13
1673,t**6,颜色分类: 高配置双杆【蓝色】,好评,安装方便，也挺稳实，满意,-,-,2021-04-29
1674,t**3,颜色分类: 高配置双杆【蓝色】,好评,质量很好，大蒸汽烫斗很好用，物流很快。,-,-,2021-06-26
1675,何**g,颜色分类: 高配置双杆【蓝色】,好评,挺好用的，质量不错，喜欢 ,-,-,2021-05-01
1676,h**5,颜色分类: 高配置双杆【蓝色】,好评,不错，质量好效果超级满意，物流很快,-,-,2021-04-16
1677,瓶**啦,颜色分类: 高配置双杆【蓝色】,好评,效果不错,-,-,2021-04-18
1678,一**2,颜色分类: 高配置双杆【蓝色】,好评,特别好用，,-,-,2021-05-05
1679,b**y,颜色分类: 高配置双杆【蓝色】,好评,不错的一个。,-,-,2021-04-27
1680,贾**甲,颜色分类: 米色 高配置【升级版】,好评,超级喜欢,-,-,2021-04-17
1681,这**儒,颜色分类: 高配置双杆【蓝色】,好评,功能很全,-,-,2021-05-04
1682,逗**0,颜色分类: 米色 高配置【升级版】,好评,好用，好用，颜值高，物超所值！,-,-,2021-04-21
1683,t**8,颜色分类: 高配置双杆【蓝色】,好评,质量很好，很实用,-,-,2021-06-16
1684,李**3,颜色分类: 米色 高配置【升级版】,好评,质量不错，好用,-,-,2021-04-20
1685,笨**团,颜色分类: 宽杆标准配置,好评,商家服务态度很好，这款烫机真是不错，很方便，在家就能轻松的烫衣服，值得推荐，谢谢卖家 ,-,-,2021-05-09
1686,续**0,颜色分类: 红色 高配置【升级版】,好评,很不错，熨的很好，速度也很快。用了两次，很满意,-,-,2021-05-08
1687,学**灵,颜色分类: 高配置双杆【蓝色】,好评,用过了才来评价，挺好用的，好评！ ,-,-,2021-05-07
1688,q**a,颜色分类: 高配置双杆【蓝色】,好评,性价比高，还行 ,-,-,2021-04-29
1689,t**9,颜色分类: 高配置双杆【蓝色】,好评,还没用，用了来追评,-,-,2021-06-23
1690,t**1,颜色分类: 高配置双杆【蓝色】,好评,喜欢，烫衣服很快，也方便，满意,-,-,2021-06-19
1691,t**1,颜色分类: 高配置双杆【蓝色】,好评,宝贝收到，非常好用,-,-,2021-06-19
1692,豆**纸,颜色分类: 圆杆简易配置,好评,刚刚收到，还没有用，看上去还可以,-,-,2021-04-04
1693,爱**0,颜色分类: 圆杆简易配置,好评,线太短了,-,-,2021-05-12
1694,y**依,颜色分类: 高配置双杆【蓝色】,好评,挺好的，价格也便宜,-,-,2021-05-09
1695,t**9,颜色分类: 高配置双杆【蓝色】,好评,挂烫机收到了，物流很快，客服态度很好，使用方便 省时又省力,-,-,2021-06-23
1696,郑**杨,颜色分类: 高配置双杆【蓝色】,好评,很好用，很方便，值得购买,-,-,2021-04-17
1697,许**1,颜色分类: 高配置双杆【蓝色】,好评,挂烫机很好用，客服讲解很到位。,-,-,2021-04-28
1698,李**8,颜色分类: 米色 高配置【升级版】,好评,质量不错，好用，满意,-,-,2021-04-30
1699,s**1,颜色分类: 高配置双杆【蓝色】,好评,收到，还没使用，使用了再评。,-,-,2021-05-21
1700,上**g,颜色分类: 米色 高配置【升级版】,好评,质量很好，而且商家服务态度很好，用起来很方便，大爱 ,-,-,2021-04-20
1701,z**5,颜色分类: 宽杆标准配置,好评,特色功能：多样功能.适合家用的蒸汽烫熨斗! 外观材质：质量真的超级棒.整体看起来绝配.反正就是很喜欢外貌的了.颜色还好喔! 熨烫效果：特别皱的衣服.拿出来一烫就是新的衣服.效果太好了.特别给赞👍出来的蒸汽也刚刚好!完全是很适当新手熨衣服! ,适合家用的蒸汽烫熨斗! 质量真的超级棒.整体看起来绝配.反正就是很喜欢外貌的了.颜色还好喔! 熨烫效果：特别皱的衣服.拿出来一烫就是新的衣服.效果太好了.特别给赞👍出来的蒸汽也刚刚好!完全是很适当新手熨衣服!最后祝愿商家生意兴隆哈~多次光顾的老顾客啦！,-,2021-06-15
1702,火**碳,颜色分类: 高配置双杆【蓝色】,好评,物流很快，使用方便，质量很好，不错。￼,-,-,2021-05-05
1703,板**饨,颜色分类: 米色 高配置【升级版】,好评,物流很快，有了它烫衣服太方便了，很节能,-,-,2021-04-24
1704,l**1,颜色分类: 圆杆简易配置,好评,还没有用呢,-,-,2021-05-17
1705,富**洲,颜色分类: 圆杆简易配置,好评,不错，是我理想烫衣服帮手,-,-,2021-04-19
1706,m**9,颜色分类: 米色 高配置【升级版】,好评,物超所值，挂烫机很好用。好评！ ,-,-,2021-06-22
1707,t**3,颜色分类: 米色 高配置【升级版】,好评,很满意，实用，使用很方便,-,-,2021-06-26
1708,乱**9,颜色分类: 米色 高配置【升级版】,好评,很实用，也很方便，很满意,-,-,2021-04-29
1709,t**5,颜色分类: 高配置双杆【蓝色】,好评,收到了，非常好用，推荐 ,-,-,2021-04-26
1710,x**0,颜色分类: 红色 高配置【升级版】,好评,到货了，质量好，比较好用,-,-,2021-04-25
