949,t**8,颜色分类: 米色 高配置【升级版】,好评,朋友推荐的，我买了一个，用了两天，感觉还可以，不错不错不错。熨衣服太好了,-,-,2021-06-16
950,t**1,颜色分类: 红色 高配置【升级版】,好评,熨烫效果特别好，用起来方便快捷，颜色特别喜欢，非常满意 ,-,-,2021-06-19
951,胡**呢,颜色分类: 蓝色 高配置【升级版】,好评,收到宝贝了，很方便使用，质量也挺满意，整体感觉不错，好评。,-,-,2021-04-24
952,t**8,颜色分类: 米色 高配置【升级版】,好评,用着很方便，衣服熨的也特别的整齐，没有褶皱 ,-,-,2021-06-16
953,遇**子,颜色分类: 高配置双杆【蓝色】,好评,熨烫效果：买回来试了一下，很好用，挺便宜的，质量也没的说。 ,-,-,2021-05-01
954,邹**a,颜色分类: 高配置双杆【蓝色】,好评,非常不错，外观小巧可爱，熨烫的效果也很好 ,-,-,2021-04-20
955,t**4,颜色分类: 高配置双杆【蓝色】,好评,非常好用，操作简单，质量挺好的，颜色漂亮,-,-,2021-06-23
956,小**笑,颜色分类: 米色 高配置【升级版】,好评,家用烫衣架收到了，安装简单，容量大，质量好，外观漂亮。,-,-,2021-04-22
957,沛**欣,颜色分类: 红色 高配置【升级版】,好评,太好了，烫衣服方便多了，衣服平整双好看，质量很好。 ,-,-,2021-04-27
958,w**8,颜色分类: 米色 高配置【升级版】,好评,这价格能买到这款挂烫机很便宜了，很好用，不会烫坏衣服，非常方便,-,-,2021-05-03
959,4**n,颜色分类: 米色 高配置【升级版】,好评,宝贝很好 女朋友介绍的 不错 如有需要还会再来的,-,-,2021-05-04
960,智**哗,颜色分类: 高配置双杆【蓝色】,好评,物流很快，机子外观及功能如描述的一致，运输中未受任何损伤，满意。 ,-,-,2021-04-25
961,袁**4,颜色分类: 高配置双杆【蓝色】,好评,效果很好 衣服没有褶子了,-,-,2021-04-18
962,陈**6,颜色分类: 高配置双杆【蓝色】,好评,东西收到了   好看又好用   用起来也很方便   好评,-,-,2021-04-19
963,璇**红,颜色分类: 高配置双杆【蓝色】,好评,忙没时间收到货还没开始安装使用，看包装很好待后追评,-,-,2021-04-17
964,t**2,颜色分类: 高配置双杆【蓝色】,好评,终于买到自己梦寐以求的挂烫机，很好用，而且颜值也很不错，很满意的一次购物,-,-,2021-06-12
965,r**r,颜色分类: 米色 高配置【升级版】,好评,产品质量很好，拿回来赶紧试了试，升温很快，做汤效果很好，好用，爱了爱了！,-,-,2021-04-25
966,t**1,颜色分类: 高配置双杆【蓝色】,好评,很好用 再也不用担心褶啦安排 ,挺不错的。 老板人也好  方便啦,-,2021-06-19
967,不**！,颜色分类: 蓝色 高配置【升级版】,好评,昨天拿回来了，今天试用一下，果出我所料还是挺好用的👍👍 ,-,-,2021-04-28
968,你**5,颜色分类: 高配置双杆【蓝色】,好评,昨晚试了一下，感觉很不错，衣服熨的平平整整的，建议大家购买 ,-,-,2021-04-26
969,9**9,颜色分类: 圆杆简易配置,好评,颜色很喜欢，质量也不错，用起来也很顺手，很喜欢很实用 ,-,-,2021-04-26
970,韦**5,颜色分类: 圆杆简易配置,好评,物有所值，雾气很大 ,-,-,2021-04-17
971,t**6,颜色分类: 蓝色 高配置【升级版】,好评,特意用了一次，很方便，喷雾也很大，用这款挂烫机烫皮草真好，能很好杀菌去灰尘。,-,-,2021-05-06
972,黄**l,颜色分类: 米色 高配置【升级版】,好评,挂烫机已经收到好几天了，使用过才来评价的，质量好的没得说，非常好用，现在每天都在用,-,-,2021-05-09
973,1**燕,颜色分类: 高配置双杆【蓝色】,好评,使用效果很好，很平整，方便实用 ,-,-,2021-04-20
974,张**8,颜色分类: 高配置双杆【蓝色】,好评,挂烫机收到了，颜色和品质都不错，烫衣服试了一下，挺好用的,-,-,2021-05-03
975,l**1,颜色分类: 高配置双杆【蓝色】,好评,看了好久，早就想买了，一直没下手。还没用但包装得的挺好的。,-,-,2021-05-07
976,t**3,颜色分类: 米色 高配置【升级版】,好评,用起来很方便，烫衣服烫的很服贴。烫了几件的衣服特别好。小巧玲珑的放在家里也不占地方。,-,-,2021-06-26
977,只**聚,颜色分类: 米色 高配置【升级版】,好评,买的时候担心，看了评价多对下单这一家，收货没有失望，插电很快就热了，熨得很平。 ,-,-,2021-05-15
978,小**头,颜色分类: 米色 高配置【升级版】,好评,挂烫机收到了，用着感觉很不错，熨衣服效果很好，使用也方便。很满意。,-,-,2021-04-28
979,欣**0,颜色分类: 高配置双杆【蓝色】,好评,货收到就迫不及待的用了一下，蒸汽很大 和描述的一样 😘,-,-,2021-04-19
980,1**来,颜色分类: 米色 高配置【升级版】,好评,朋友推荐给我的，质量不错，做工品质真心可以,-,-,2021-04-29
981,t**5,颜色分类: 圆杆简易配置,好评,蒸汽很大，使用起来很方便，便宜又实惠,-,-,2021-04-18
982,旺**。,颜色分类: 米色 高配置【升级版】,好评,🌵值得购买！没有什么味道，用起来还可以😘，没有不舒服的地方😶，所以我还蛮喜欢的,-,-,2021-04-29
983,t**6,颜色分类: 高配置双杆【蓝色】,好评,蒸汽挂烫机太实用了，快速熨烫衣物，不伤衣物，还能杀菌消毒，很方便，家庭必备！,-,-,2021-04-21
984,j**0,颜色分类: 蓝色 高配置【升级版】,好评,犹豫了很久，看评论买的，买回来试了一下蒸汽还是很大，烫衣服很快，插电几十秒就冒蒸汽了，很快,-,-,2021-04-21
985,张**4,颜色分类: 高配置双杆【蓝色】,好评,收到几天了，经济实惠又好用，质量也是杠杠的，直得推荐,-,-,2021-05-08
986,马**籽,颜色分类: 高配置双杆【蓝色】,好评,收到货，第一时间拆包装，质量非常好，用着很方便。 ,-,-,2021-04-20
987,剑**我,颜色分类: 红色 高配置【升级版】,好评,很喜欢。在家也很好用。 主要是买来服装店用的。效果超级好。还不湿衣服。 ,-,-,2021-04-25
988,八**天,颜色分类: 蓝色 高配置【升级版】,好评,收到试了一下很好用，也不漏水，朋友把链接要走也买个。,-,-,2021-04-22
989,f**修,颜色分类: 高配置双杆【蓝色】,好评,质量很好，拿回来用了烫的也很快，效果挺好的，用起来也方便，非常满意,-,-,2021-04-22
990,f**u,颜色分类: 高配置双杆【蓝色】,好评,宝贝到手，迫不及待的试用了，雾气很大，温度适宜，衣服瞬间服帖,-,-,2021-05-01
991,t**6,颜色分类: 米色 高配置【升级版】,好评,不占地方，用着挺好用的，衣服运得很整齐,-,-,2021-05-05
992,五**氏,颜色分类: 米色 高配置【升级版】,好评,出气很快。放家里不占地方。加水也很方便。不伤衣服面料。 ,-,-,2021-04-29
993,5**5,颜色分类: 米色 高配置【升级版】,好评,非常好使，这个买给妈妈家用的，也不会贵，用起来很方便,-,-,2021-04-24
994,芦**1,颜色分类: 高配置双杆【蓝色】,好评,回来先拿件衣服试了试，效果不错值得购买，喷雾均匀，外观和图片无差别，好看 ,-,-,2021-04-28
995,1**钱,颜色分类: 米色 高配置【升级版】,好评,超级好用，质量很好，外观也不错，熨烫效果也不错 ,-,-,2021-04-21
996,t**1,颜色分类: 米色 高配置【升级版】,好评,快递刚回来就试了试 非常方便 熨完以后衣服一点也不褶皱了 值得买。,-,-,2021-06-19
997,t**8,颜色分类: 米色 高配置【升级版】,好评,很不错的，非常满意 ,-,-,2021-06-16
998,王**3,颜色分类: 蓝色 高配置【升级版】,好评,熨衣服效果还不错，颜色也好看，物美价廉，实用,-,-,2021-04-26
999,t**蓉,颜色分类: 高配置双杆【蓝色】,好评,收到后试用了一次，挺好用的，使用方便，颜色也是我喜欢的。,-,-,2021-04-26
1000,隔**1,颜色分类: 红色 高配置【升级版】,好评,宝贝收到了就使用了一下，效果很好，衣服板板正正。 ,-,-,2021-04-29
1001,烟**a,颜色分类: 蓝色 高配置【升级版】,好评,挂烫机用着非常不错，太喜欢了，值得拥有,-,-,2021-05-05
1002,明**1,颜色分类: 米色 高配置【升级版】,好评,加热很快，多功能使用方便，熨一下就不皱了，而且这个小型很方便，占用地方也不大,-,-,2021-05-06
1003,t**0,颜色分类: 高配置双杆【蓝色】,好评,颜色漂亮，安装简单，用起来很方便，值得购买,-,-,2021-06-13
1004,他**3,颜色分类: 高配置双杆【蓝色】,好评,质量还不错哦，喜欢的可惜直接购买呢，有需要再下单,-,-,2021-04-21
1005,未**2,颜色分类: 米色 高配置【升级版】,好评,宝贝收到了，物流很快，功能强大齐全，煲烫效果很好，外观设计也很好看，值得入手 ,-,-,2021-05-03
1006,无**菌,颜色分类: 高配置双杆【蓝色】,好评,很喜欢熨衣服很方便，功能齐全质量不错，熨烫衣服效果不错的。 ,-,-,2021-05-07
1007,古**1,颜色分类: 米色 高配置【升级版】,好评,好用，褶皱很快就烫平了 ,-,-,2021-05-08
1008,水**镜,颜色分类: 高配置双杆【蓝色】,好评,挂烫机用起来还不错，衣服挺平整的。,-,-,2021-04-21
1009,不**哒,颜色分类: 红色 高配置【升级版】,好评,用了几天才来评价，摆放方便，质量很好，不占地方，很喜欢 ,-,-,2021-04-23
1010,陈**良,颜色分类: 蓝色 高配置【升级版】,好评,操作简单，便捷，不占地方，熨衣效果特别好，非常满意,-,-,2021-04-18
1011,w**5,颜色分类: 高配置双杆【蓝色】,好评,东西一般吧，质量也一般，怕一不小心杆就断了。,-,-,2021-05-27
1012,杨**嗯,颜色分类: 蓝色 高配置【升级版】,好评,试用了一下 还不错 安装方便 价格比实体店便宜很满意  ,-,-,2021-04-26
1013,爱**6,颜色分类: 高配置双杆【蓝色】,好评,熨烫衣服很方便，外观也好看，质量很好很满意 ,-,-,2021-04-28
1014,a**9,颜色分类: 高配置双杆【蓝色】,好评,挂烫机收到了 熨烫效果很好*做很简单 你喜欢,-,-,2021-04-20
1015,l**5,颜色分类: 高配置双杆【蓝色】,好评,无色差，挺好用的，价格也实惠 ,-,-,2021-05-07
1016,w**龙,颜色分类: 高配置双杆【蓝色】,好评,外观设计简单，效果很好，用起来很方便，非常满意 ,-,-,2021-04-18
1017,离**脱,颜色分类: 高配置双杆【蓝色】,好评,还没开始用不知道效果如何后面用了之后再来追平。,-,-,2021-05-20
1018,羽**宇,颜色分类: 高配置双杆【蓝色】,好评,这个价格还说这款整体来说很不错，很好用。,-,-,2021-04-17
1019,韩**1,颜色分类: 高配置双杆【蓝色】,好评,一收到立马安装试用，非常好用，质量好很结实，蒸气也很强劲，推荐购买。,-,-,2021-04-18
1020,孙**伟,颜色分类: 圆杆简易配置,好评,质量一般   出气管有点短还经常掉,-,-,2021-05-12
1021,t**8,颜色分类: 米色 高配置【升级版】,好评,包装的很好，安装方便。使用也简单，是整理衣服的好帮手,-,-,2021-06-16
1022,t**7,颜色分类: 米色 高配置【升级版】,好评,收到货好几天才来评价，质量很好哦。价格不贵,-,-,2021-06-13
1023,椰**娃,颜色分类: 高配置双杆【蓝色】,好评,质量很好，价格还便宜！同样的东西实体店好几百呢！很满意 ,-,-,2021-05-07
1024,t**8,颜色分类: 米色 高配置【升级版】,好评,整体尺寸不大，用着效果不错哦，操作简单方便！ ,-,-,2021-06-16
1025,t**7,颜色分类: 米色 高配置【升级版】,好评,货到就试用了一下，简单操作，熨烫效果挺好的,-,-,2021-06-13
1026,t**1,颜色分类: 高配置双杆【蓝色】,好评,挂烫机款式大气，质量不错，喷气劲大，这下方便多了,-,-,2021-06-19
1027,w**想,颜色分类: 高配置双杆【蓝色】,好评,蒸汽挂烫机收    和图片一样    值得入手   很满意,-,-,2021-04-24
1028,午**狼,颜色分类: 米色 高配置【升级版】,好评,外形挺好看，蒸汽出的很快，不滴水，好评,-,-,2021-04-24
1029,皋**6,颜色分类: 米色 高配置【升级版】,好评,蒸汽熨斗质量不错，使用方便，价格划算,-,-,2021-05-01
1030,嘛**板,颜色分类: 高配置双杆【蓝色】,好评,效果真不错，质量比想像中的要好，物超所值！,-,-,2021-04-29
1031,许**6,颜色分类: 米色 高配置【升级版】,好评,货收到，质量很好，价格实惠，直得购买 ,-,-,2021-04-25
1032,0**单,颜色分类: 高配置双杆【蓝色】,好评,熨斗熨的衣服很平整    用起来也很方便,-,-,2021-04-16
1033,紫**都,颜色分类: 高配置双杆【蓝色】,好评,挂烫机家用质量很好，用起来方便，有需要的下单吧,-,-,2021-05-06
1034,h**踪,颜色分类: 高配置双杆【蓝色】,好评,质量很好，熨出来的衣服效果很好，很平整，没有褶子,-,-,2021-04-26
1035,t**5,颜色分类: 高配置双杆【蓝色】,好评,很满意的一次网购，质量很好，和图片描述的一模一样！,-,-,2021-05-06
1036,d**1,颜色分类: 米色 高配置【升级版】,好评,质量很好👌出气很均匀，熨的衣服很平整👌推荐购买,-,-,2021-04-16
1037,m**1,颜色分类: 米色 高配置【升级版】,好评,蒸汽很足 熨烫衣服还是挺平整的,-,-,2021-05-18
1038,t**4,颜色分类: 高配置双杆【蓝色】,好评,有了这神器，每天衣服都是整齐。,-,-,2021-06-23
1039,1**m,颜色分类: 高配置双杆【蓝色】,好评,挂烫机收到了，夏天到了，衣服比较薄，必须烫好才能穿。神器啊，放心入手吧 ,-,-,2021-05-04
1040,y**w,颜色分类: 高配置双杆【蓝色】,好评,功能强大。外观漂亮。熨烫效果好。值得购买。 ,-,-,2021-04-17
1041,t**3,颜色分类: 米色 高配置【升级版】,好评,货收到了非常满意质量不错价格公道,-,-,2021-06-26
1042,t**9,颜色分类: 高配置双杆【蓝色】,好评,质量很好，非常漂亮，具体等使用后在追评，,-,-,2021-06-23
1043,张**7,颜色分类: 高配置双杆【蓝色】,好评,很满意的一次购物，虽然是大件商品，质量比实体的好还便宜，服务真心的不错。,-,-,2021-04-22
1044,心**9,颜色分类: 蓝色 高配置【升级版】,好评,拿回来立刻就试了，操作非常简单，家用很方便。效果不错，很实用,-,-,2021-04-20
1045,逗**宝,颜色分类: 高配置双杆【蓝色】,好评,东西收到了，特意试了一下才评论的，非常好用，把好几件衣服都熨烫了,-,-,2021-04-21
1046,琴**5,颜色分类: 蓝色 高配置【升级版】,好评,好多衣服都打皱了，买了它太实用了，像新的一样,-,-,2021-05-01
1047,1**猪,颜色分类: 米色 高配置【升级版】,好评,操作简单又实用，效果还不错，也不占地方,-,-,2021-04-16
1048,t**6,颜色分类: 高配置双杆【蓝色】,好评,挂烫机外观漂亮，使用方便，好用，挺好的,-,-,2021-05-02
1049,k**杭,颜色分类: 蓝色 高配置【升级版】,好评,宝贝收到了  试用两天 效果很棒  好评,-,-,2021-04-27
1050,朱**1,颜色分类: 高配置双杆【蓝色】,好评,质量很好，买的很合我心意，棒棒哒！✨需要的亲们可以放心购买 ,-,-,2021-04-26
1051,星**店,颜色分类: 蓝色 高配置【升级版】,好评,安装好试用一下 挺好的 满意 推荐朋友们购买！很好的卖家！,-,-,2021-05-01
1052,淘**淘,颜色分类: 高配置双杆【蓝色】,好评,第二次回购了，外观小巧不占空间。熨烫效果不错，物有所值。 ,-,-,2021-04-16
1053,小**装,颜色分类: 圆杆简易配置,好评,买这个机器一波三折的，索性结果是好的，客服都给处理了，机器还是可以的，价格不贵值得购买 ,-,-,2021-05-24
1054,张**i,颜色分类: 米色 高配置【升级版】,好评,质量挺好，方便，以后在家里就可以烫衣服 ,-,-,2021-04-24
1055,t**1,颜色分类: 高配置双杆【蓝色】,好评,这款性价高，非常实用、价格也实惠，值得推荐,-,-,2021-06-19
1056,t**1,颜色分类: 米色 高配置【升级版】,好评,宝贝收到了，非常好用，性价比又高，推荐一下，😊😊😊😊😊😊,-,-,2021-06-19
1057,t**5,颜色分类: 圆杆简易配置,好评,收到货不会安装  客服非常耐心的教   给客服一个好评    衣服熨的也平整   好用 ,-,-,2021-04-23
1058,九**下,颜色分类: 米色 高配置【升级版】,好评,质量没得说，跟专卖店一样，特别特别喜欢，而且价格优惠,-,-,2021-04-25
1059,花**兮,颜色分类: 高配置双杆【蓝色】,好评,还不错，用起来很方便，衣服烫出来的效果也不错 ,-,-,2021-04-22
1060,芳**8,颜色分类: 高配置双杆【蓝色】,好评,家用还是挺好的，不占空间。值得拥有 ,-,-,2021-04-24
1061,s**4,颜色分类: 圆杆简易配置,好评,简易，用起来方便,-,-,2021-04-18
1062,t**5,颜色分类: 米色 高配置【升级版】,好评,跟我在实体店买的一模一样！还是一样的好用，开心 ,-,-,2021-05-08
1063,t**4,颜色分类: 高配置双杆【蓝色】,好评,精致女人必备的，好用,-,-,2021-06-23
1064,w**5,颜色分类: 蓝色 高配置【升级版】,好评,已用一段时间了，好用蒸汽效果很好，喜欢满意 ,-,-,2021-04-18
1065,我**奥,颜色分类: 米色 高配置【升级版】,好评,这个蒸汽挂烫机特别好，使用方便，而且是高配置的。功能特别强大  ,-,-,2021-05-04
1066,t**3,颜色分类: 高配置双杆【蓝色】,好评,机器用了好几次，质量很好，用着也简单，非常满意的一次购物。,-,-,2021-06-26
1067,牛**涵,颜色分类: 红色 高配置【升级版】,好评,喜欢质量很好哦非常喜欢显瘦下次还会购买,-,-,2021-05-05
1068,a**6,颜色分类: 高配置双杆【蓝色】,好评,宝贝非常好用，蒸汽出的也很大，五星好评，推荐购买。,-,-,2021-05-05
1069,约**指,颜色分类: 宽杆标准配置,好评,做工不差，熨衣服的效果也不好。,-,-,2021-05-27
1070,墨**儿,颜色分类: 高配置双杆【蓝色】,好评,宝贝很喜欢，有喜欢的小伙伴可以入手啦  ,-,-,2021-04-29
1071,w**5,颜色分类: 高配置双杆【蓝色】,好评,用上了，安全方便，熨烫的很平整 ,-,-,2021-04-16
1072,我**5,颜色分类: 高配置双杆【蓝色】,好评,是正品，和实体店一样，价格还优惠，果断转粉 ,-,-,2021-04-19
1073,b**8,颜色分类: 高配置双杆【蓝色】,好评,特的试用了才来评价的。真的很不错。。不懂的地方问客服客服都很有耐心的讲。。很好，会推荐给周围的朋友用,-,-,2021-04-18
1074,t**8,颜色分类: 米色 高配置【升级版】,好评,挂烫机收到了，质量很好，价格实惠。,-,-,2021-06-16
1075,t**4,颜色分类: 高配置双杆【蓝色】,好评,挂烫机小巧，精致，使用方便,-,-,2021-06-23
1076,g**4,颜色分类: 米色 高配置【升级版】,好评,挂烫机收到了，配套齐全。功率比较大，用起来也很方便快捷，非常喜欢 ,-,-,2021-04-26
1077,t**0,颜色分类: 高配置双杆【蓝色】,好评,样式挺好看的，按照说明书操作，简单方便 ,-,-,2021-06-13
1078,肌**身,颜色分类: 米色 高配置【升级版】,好评,送妈**礼物🎁 试用了一下，很不错的样子，还快 ,-,-,2021-05-02
1079,t**0,颜色分类: 高配置双杆【蓝色】,好评,蒸汽量大，家用方便，价格不贵，好安装颜色好看。,-,-,2021-06-13
1080,s**9,颜色分类: 高配置双杆【蓝色】,好评,挂烫机非常好用，热的快，用着方便。需要的亲们可以下手了。,-,-,2021-06-13
1081,t**8,颜色分类: 米色 高配置【升级版】,好评,挂烫机很好用，质量不错，价格也很公道，超实用。 ,-,-,2021-06-16
1082,c**1,颜色分类: 米色 高配置【升级版】,好评,和实体店的质量要一样，物美价廉，值得入手,-,-,2021-04-24
1083,朱**你,颜色分类: 高配置双杆【蓝色】,好评,做工好，质量也不错，非常的满意。 ,-,-,2021-04-17
1084,d**8,颜色分类: 高配置双杆【蓝色】,好评,效果很好，便宜实惠，满意,-,-,2021-04-24
1085,t**0,颜色分类: 米色 高配置【升级版】,好评,外观很好看，卖家服务态度也很好，烫熨效果很不错，性价比高，给个好评吧值得够买哦哦 ,-,-,2021-06-13
1086,小**≈,颜色分类: 高配置双杆【蓝色】,好评,宝贝收到了，特别漂亮，很轻便，熨烫效果很好 ,-,-,2021-04-28
1087,许**1,颜色分类: 红色 高配置【升级版】,好评,宝贝收到了 趟衣服方便多了 哈哈哈 以后不用去去外面弄了 ,-,-,2021-04-21
1088,m**a,颜色分类: 米色 高配置【升级版】,好评,使用简单 烫出来的衣服效果很好 太喜欢了 ,-,-,2021-04-25
1089,粉**钉,颜色分类: 高配置双杆【蓝色】,好评,根本不能用。好评应该都是刷的。大家千万不要买。千万别上当,-,-,2021-05-16
1090,王**4,颜色分类: 米色 高配置【升级版】,好评,挂烫机收到了 很满意 物超所值 大家可以放心购买,-,-,2021-04-22
1091,x**2,颜色分类: 蓝色 高配置【升级版】,好评,真心喜欢，颜色、款式都非常棒！,-,-,2021-04-29
1092,落**的,颜色分类: 高配置双杆【蓝色】,好评,收到货了质量很好的哦，用起来很合适的哦非常满意,-,-,2021-04-25
1093,翘**翘,颜色分类: 蓝色 高配置【升级版】,好评,宝贝收到了很不错，使用起来也比较方便，跟描述的一样，喜欢 ,-,-,2021-04-17
1094,n**2,颜色分类: 蓝色 高配置【升级版】,好评,外观漂亮  蒸汽挺大  非常满意 ,-,-,2021-04-16
1095,t**9,颜色分类: 高配置双杆【蓝色】,好评,质量很好，烫衣服效果不错，价格实惠，满意,-,-,2021-06-23
1096,t**0,颜色分类: 高配置双杆【蓝色】,好评,挂烫机是正品，好用不贵，会介绍朋友来买！,-,-,2021-06-13
1097,t**6,颜色分类: 红色 高配置【升级版】,好评,质量不错。价格真的很实惠，以后可以自己烫衣服了,-,-,2021-04-16
1098,t**1,颜色分类: 蓝色 高配置【升级版】,好评,东西收到了，小巧、颜色好看，蒸汽出口大，带着出门方便  ,-,-,2021-06-19
1099,大**员,颜色分类: 米色 高配置【升级版】,好评,效果还不错哦！使用起来也很方便！质量很好！ ,-,-,2021-04-26
1100,a**0,颜色分类: 高配置双杆【蓝色】,好评,挂烫机非常好用，很容易烫平，操作简单方便，颜值也不错，非常喜欢！ ,-,-,2021-04-29
1101,包**麻,颜色分类: 圆杆简易配置,好评,总体还不错，性价比很好 ,-,-,2021-04-30
1102,快**女,颜色分类: 米色 高配置【升级版】,好评,质量不错，用在家里很方便 ，物价所值 ,-,-,2021-05-09
1103,求**理,颜色分类: 高配置双杆【蓝色】,好评,挂烫机收到了，材质好，做工精细，蒸汽大不漏水，不错,-,-,2021-04-27
1104,t**4,颜色分类: 高配置双杆【蓝色】,好评,质量不错，使用简单方面，物流速度很快，包装的也很精细 ，推荐 ,-,-,2021-06-23
1105,t**6,颜色分类: 高配置双杆【蓝色】,好评,商品质量不错，细节、品质、做工都非常好，发货贼快，快递也给力，棒棒哒~🌸🌸🌸,-,-,2021-04-26
1106,程**4,颜色分类: 米色 高配置【升级版】,好评,挂烫机烫衣服。很平整很好的产品,-,-,2021-05-05
1107,风**1,颜色分类: 高配置双杆【蓝色】,好评,发货快，挂烫机外形美观，非常实用，物有所值，好评！,-,-,2021-05-03
1108,最**n,颜色分类: 高配置双杆【蓝色】,好评,挂烫机很好用，家里有这个很方便，衬衣裙子都可以烫挺好的,-,-,2021-04-28
1109,蔚**5,颜色分类: 高配置双杆【蓝色】,好评,很不错的宝贝，质量很好，颜色也是很好看的一款，很喜欢,-,-,2021-04-26
1110,哈**妞,颜色分类: 宽杆标准配置,好评,收到了，蒸汽挂烫机非常好用大小合适，颜色也好，特别喜欢这款式，物流也快，老板人非常好，谢谢老板哟,-,-,2021-04-22
1111,魏**6,颜色分类: 高配置双杆【蓝色】,好评,蒸汽很大，烫衣服很快，很平整,-,-,2021-04-17
1112,t**3,颜色分类: 蓝色 高配置【升级版】,好评,挂烫机家用很合适，小巧不占地方，使用起来也很方便，效果不错 ,-,-,2021-06-26
1113,1**a,颜色分类: 高配置双杆【蓝色】,好评,小巧又扎实，好用又不贵，👍👍👍,-,-,2021-05-06
1114,l**具,颜色分类: 米色 高配置【升级版】,好评,试了，好用，刚好可以烫我买的新衣服，好用,-,-,2021-04-19
1115,t**6,颜色分类: 蓝色 高配置【升级版】,好评,挂烫机质量好，水箱大，热得快，出气大，熨烫又快又好，使用很方便 ,-,-,2021-05-06
1116,印**7,颜色分类: 蓝色 高配置【升级版】,好评,东西收到了   质量不错   很满意,-,-,2021-04-20
1117,t**7,颜色分类: 高配置双杆【蓝色】,好评,用起来挺省心，真不错，衬衫多，必须熨烫，穿出来很有气质 ,-,-,2021-06-13
1118,y**3,颜色分类: 高配置双杆【蓝色】,好评,很好用烫出来的衣服很整齐,-,-,2021-04-24
1119,t**0,颜色分类: 米色 高配置【升级版】,好评,材质很好，用起来很方便，性价比很高，满意 ,-,-,2021-06-13
