479,许**四,颜色分类: 6s黑色【带原配】质保1年,好评,，工具很全面，安装好了很好用，各方面都非常正常，好评！第一次自己换屏，很好操作，安装视频解答的很清晰，工具很齐全，自己在换屏幕的过程中不懂的问了客服，客服很耐心，很满意，屏幕质量很好，跟原装的差不多一模一样，触摸很灵敏，分辨率很高，触摸灵敏度一切正常非常灵敏，一点也不卡顿，安装后贴合度非常好，很满意！,质量很好，分辨率显示效果很好，颜色比较正，触摸正常非常灵敏，一点也不卡顿，用起来真的跟原装没有区别，屏幕装上去也很贴合，满意！ 装着和崭新的一样一样的，哈哈。价格比实体店便宜，以后不再去实体店了，还是这家靠谱，很满意！卖家服务很热情，收到货后联系卖家具体要怎么操作，卖家很积极很有耐心给我们讲解，还发了安装视频，自己安装也很方便了。安装完后操作手机，新的手机屏幕操作起来也很顺畅，没有任何卡顿的现象，很好,-,2021-05-08
480,李**7,颜色分类: 6s黑色【带原配】质保1年,好评,东西看来还不错，服务也周到，东西划算 收到货后打开包裹，里面的包装给人感觉很高端很棒，给人感觉依旧很好，包装严密，安装有视频教学，有配送的拆卸工具，装后的色差、亮度、反应都不错，各方面功能正常，总之比较满意,屏幕收到了，更换上屏幕色彩显示非常好。触摸也是很灵敏，和原来的一模一样，买之前还有所顾虑，到手后按照服务人员给的视频一步步操作，自己动手，很有成就感，触摸灵敏，清晰度高，和机身贴合， 色泽度也可以，不会偏暗发黄，触摸准确稳定。卖家的教程解答的很详细，客服回答也很耐心，不懂的问了客服都回复了，很耐心真的太满意了。触摸灵敏真的很不错，强力推荐 还算比较顺利 多看几遍教学视频 细心细心再细心 多问问客服 色彩 效果还是可以 关键使用时间也可以 总体很满意,-,2021-04-07
481,钱**雅,颜色分类: X屏幕【TFT新天马】+质保1年,好评,物流很快，包装的很好，是正品，价格实惠，店家服务态度很好，非常满意,-,-,2021-02-27
482,9**h,颜色分类: 7p白色【带原配】质保1年,好评,宝贝收到，完好无勋，物流也很快，收到宝贝立刻把手机屏换好了，挺好的，满意的购买，感谢商家。,-,-,2021-05-30
483,网**c,颜色分类: 8代白色【带原配】质保1年,好评,游戏党需考虑，玩游戏会断触。刚刚装上就玩了一把游戏断触的挺严重的。后续在追加,回访专员小咚跟进回访购物多次后来才知道淘宝评论得积分可以涨淘气淘宝买东西都是系统自动好评回访,-,2021-05-08
484,t**0,颜色分类: 6s白色【带原配】质保1年,好评,很好,-,-,2021-04-06
485,方**妈,颜色分类: 8p白色【带原配】质保1年,好评,"发货很快，虽然现在换了个手机，修好当备用机，买一套换起来很简单，还有视频教程，基本小白也可以自己弄,过程不是很复杂，屏幕质量不错， 装好后和新买的一样，屏幕清晰度非常高，不会模糊，亮度不会很暗，看久了也不会不适应，触控也很灵敏，又能用几年了哈哈","照着教程自己琢磨就装好了，用起来的感觉和外面修的没差别，还便宜了一大半的钱，觉得很满意。是我理想中的样子很愉快的一次网购，这家店的东西和描述的一模一样，东西很好，性价比很高,比实体店的便宜好看质量很好，包装完好无损",-,2021-03-30
486,正**哦,颜色分类: 8代黑色【带原配】质保1年,好评,真垃圾屏幕,质量服务需要提高回访专员小咚跟进回访购物多次后来才知道淘宝评论得积分可以涨淘气淘宝买东西都是系统自动好评回访」 - - - - - - - - - - - - - - -,-,2021-02-28
487,t**8,颜色分类: X屏幕【硬性OLED】+质保1年,好评,真的服了这个服务态度每次等客服发个信息能等很久服务态度差到极点还有买的x型号的屏幕给我发的xs，还非要说是x的屏幕，我去手机店换的老板说是屏幕xs的根本不对型号客服还非常跟我撅。退货商家发错型号还不给退邮费,：服务质量需提高回访专员小咚跟进回访购物多次后来才知道淘宝评论得积分可以涨淘气淘宝买东西都是系统自动好评回访,-,2021-06-25
488,l**3,颜色分类: X屏幕【TFT新天马】+质保1年,好评,第一次自己安装 很激动的。 期间出了点小问题 不过客服很好 很耐心的教我。 成功解决 跟手机很贴合 触摸很灵敏 画面很清晰 色彩亮度都和我原来的一模一样 。这个非常非常划算。,屏幕收到了，屏幕真心的好，这次真的没有买亏，买回来装起来就亮了，没有漏光，挺好，成功挽回。工具齐全，视频教程讲的非常详细，安装简便，用了一段时间 效果不错 各方面触摸 反应都不错，屏幕的分辨率非常细腻，图像都特别清晰没有杂点，卖家还提供专业视频 自己动手安装 很简单,-,2021-02-23
489,n**g,颜色分类: 6s黑色【带原配】质保1年,好评,此用户没有填写评价。,-,-,2021-04-16
490,l**0,颜色分类: 6sp白色【带原配】质保1年,好评,很满意，发货速度也很快 很容易装，小白都可以装，很简单，装上了挺好用的呢，色彩均匀，灵敏度跟原机一样，店家也挺贴心的，不但发货速度快，而且东西质量也很好，安装时出现不明白的地方客服也能马上解决，客服也很耐心的解答问题，真是周到，太感谢了，安装后跟新的一样，必须推荐,屏幕收到就迫不及待的安装了，快递包装很安全，送的有拆机工具，自己装也不难，跟原来一样的触摸灵敏和清晰度，屏幕质量也很好，屏幕外观完美，色彩很好，更换后无缝隙，面容解锁等功能都正常，触点触摸灵敏，各项功能正常，非常好，值得推荐！ 好东西，下次还再来买,-,2021-04-09
491,庄**8,颜色分类: 7p黑色【带原配】质保1年,好评,非常满意😘，材质做工非常好，而且百搭，手感也很棒，非常nice，实用性非常强，赞👍是理想中的产品，质量不错，物流也很快，值得点赞,-,-,2021-06-12
492,t**2,颜色分类: X屏幕【TFT新天马】+质保1年,好评,昨晚按好的，使用了一天没有任何问题，非常的好，反应迅速,宝贝收到非常惊喜卖家配备的工具非常的齐全，还另外赠送钢化膜很贴心，看了安装视频过程非常简单自己动手安装的非常好，很贴合，屏幕质感很好，反应也是非常的迅速，很满意,-,2021-06-05
493,h**子,颜色分类: 6p白色【带原配】质保1年,好评,宝贝收到了，和描述一样，货真价实，物美价廉，老板服务态度很好很负责，物流也很快，五星好评，非常满意！真是太赞了！还是回购的哦！,-,-,2021-05-05
494,为**虹,颜色分类: 7p黑色【带原配】质保1年,好评,之前买过，没问题，这次购买，装上去触控id使用不了，询问解决不了，再买了一个，结果到货开机只显示logo，进不了界面，果断差评退货了，算倒霉了,质量需要提高，回访专员小咚跟进回访购物多次后来才知道淘宝评论得积分可以涨淘气淘宝买东西都是系统自动好评回访。,-,2021-05-23
495,夏**x,颜色分类: 8代黑色【带原配】质保1年,好评,手机屏幕收到了，快递的效率好高，两天就到了，屏幕的质量很好，和原装一样，分辨率一样，无色差，很清晰，玩了一会运行正常，很赞质量一流，服务一流。不错，跟原装的一样，屏幕质量确实很好，色彩也可以，很清晰高清，跟原来的差不多，卖家还送了小工具，推荐购买。,这个屏幕显示颜色很好，分辨率清晰，触摸很灵敏，跟我以前手机屏幕是一样的。还送了全套拆机工具，装起来得心应手。快递、物流速度很快，隔天就到了。客服服务态度很好，指导安装很耐心。这个屏幕出乎意料的好，无论色彩和流畅度与原装屏幕没任何区别，价格合理，值得推荐,-,2021-04-15
496,w**儿,颜色分类: 6sp白色【带原配】质保1年,好评,屏幕收到货后，自己通过看视频动手组装，不算太难，换上后使用流畅，和新的差不多。 换好用了几天后，手机一切正常。,-,-,2021-06-16
497,蹇**婕,颜色分类: 8p黑色【带原配】质保1年,好评,我购买了屏幕总成和home键票，安装过后前置摄像头没发使用，home键只能按一下，而且还不好按，没发双击跳屏，本来问题可以解决，客服半天说一句话，不建议大家购买,回访专员小咚跟进回访购物多次后来才知道淘宝评论得积分可以涨淘气淘宝买东西都是系统自动好评回访。,-,2021-06-06
498,h**0,颜色分类: 6s白色【带原配】质保1年,好评,宝贝挺不错的，价格很公道，快递很给力，值得购买。卖家的服务态度很好，很耐心解答我的每一个疑问，是一次很愉快的购物，祝卖家生意兴隆！,-,-,2021-04-21
499,t**6,颜色分类: 6代白色【带原配】质保1年,好评,非常好用，看了视频教程，换上去触摸屏非常清晰，各功能都正常，经济实惠又不贵，打字不会跳屏打错字，产品特别好，客服也很棒，耐心解答，使用不发烫 物超所值。,其他的没什么问题，显示和触屏都非常不错，屏幕清晰，触摸顺畅，用起来跟原装的没有区别，屏幕分辨率很高，没什么色差，屏幕都是经过测试的，所以也没必要担心有什么不良情况，屏幕不单显示高清，很溜 ，触摸灵活不卡顿，没有瑕疵划痕，和手机原来的屏使用感一样。刚开始测试时遇到点小麻烦，赶紧卖家联系，让重新插拔排线试试，果然再次操作就亮屏了，安装的时候还真不能太大意的，注意视频里面讲的细节就没问题的，挺喜欢的,-,2021-06-12
500,早**7,颜色分类: XS屏幕【TFT材质】+质保1年,好评,以前在他们家买的的屏幕用了很久，这次买的的屏幕，一如既往的好用。更换过后就像新的一样，贴合紧密，屏幕清晰，滑动流畅。,以前在他们家买的的屏幕用了很久，这次买的的屏幕，一如既往的好用。更换过后就像新的一样，贴合紧密，屏幕清晰，滑动流畅。,-,2021-03-26
501,f**0,颜色分类: XS屏幕【TFT材质】+质保1年,好评,屏幕真的不错，用的还不错，用得感觉和原装差不多，分辨率基本没差，换完发现一点也不难，跟着视频一个步骤一个步骤来就完工了。本以为手机要报废了 哈哈，拆机配套工具很全，我同事都说真有钱，买新手机啦！我弱弱的说换了个屏幕而已。,宝贝安装很方便，一次点亮好很好非常好屏幕显示完美，屏幕很清楚，触控反应快，和手机完美贴合，值得购买触摸灵敏跟分辨率跟原厂的基本一样，没差多少，屏幕也不卡顿，反映很快，不漏光，跟手机很贴合，卖家包装也是很贴心。,-,2021-03-23
502,x**3,颜色分类: 6sp白色【带原配】质保1年,好评,好用,-,-,2021-05-19
503,杨**莹,颜色分类: 8代白色【无配件】质保1年,好评,用了两天一不小心摔了一下，马上就破了。,回访专员小咚跟进回访售后，购物多次后来才知道淘宝评论得积分可以涨淘气淘宝买东西都是系统自动好评回访。,-,2021-03-27
504,小**字,颜色分类: 8代黑色【带原配】质保1年,好评,还是换原装的吧，国产显示明显有问题，误触严重,质量服务需要提高回访专员小咚跟进回访购物多次后来才知道淘宝评论得积分可以涨淘气淘宝买东西都是系统自动好评回访,-,2021-03-03
505,t**4,颜色分类: 6p白色【带原配】质保1年,好评,反正我个人觉得这个是非常不错。自己就可以换上。以后再也不会天天去手机店了。只要心细点就可以了。我自己换的。第一次修手机。了一个小时。反正我五分好评,不管怎样都是好评因为不用天天往手机店跑了。感觉自己是超人。什么都干。现在淘宝是超级给力。,-,2021-06-20
506,l**康,颜色分类: 7代白色【无配件】质保1年,好评,本人在这买的屏幕跟按键(苹果7)，我也不是第一次拆机装机的新手，当晚安装好之后就发现按键触屏很不灵敏，屏幕也偶尔会变色，但是基本都不会变色，但是按键确实是很不灵敏，第二天早上起来就发现手机很卡，于是我就重启了之后就发现按键用不了了，之后用手机屏幕也没出现变色卡顿之类，估计也是按键引起的，我找了客服，客服叫我查了重新检查一下接触那些，当晚回去我就拆了重新检查一遍发现安装都是完好，我也重新在装一遍还是不行，找客服半天不见人，后面来人了就说他们本来就没指纹功能的，无语了，我一直在处理的按键没反应，没说什么指纹功能，他们就不敢面对问题就喜欢兜，而且每次都要等他们信息，就没见过这么差的客服，算我倒霉我也认栽了，我不需要他们服务了。我以前在别的地方也买过屏幕，都不是原厂的感觉就是没那么好，看这家贵点以为会好点，没想到，人家没那么贵，还有膜送，这家又贵又差什么都没有。总结就是产品贵，质量差，服务更更更差。说了那么多希望不要有人上当，千万别看他们好评，都是刷出来的,质量服务需提高，回访专员小咚跟进回访购物多次后来才知道淘宝评论得积分可以涨淘气淘宝买东西都是系统自动好评回访,-,2021-03-20
507,飞**8,颜色分类: XR屏幕【TFT材质】+质保1年,好评,产品整体质量很好！收到东西完美无瑕，工具很齐全，非常好用，看了视频教程，换上去触摸屏非常清晰，各功能都正常，经济实惠又不贵，打字不会跳屏打错字，产品特别好，客服也很棒，耐心解答，使用不发烫 物超所值。,安装挺方便的，照着视频教程来做就可以了，装完特别有成就感，试完了一阵子，挺灵敏的，和原来的感觉不出走什么区别，价格实惠，值得购买屏幕不错，自己安装完全没问题！非常好！很实惠屏幕，还是很快的。,-,2021-03-09
508,a**6,颜色分类: 7p白色【带原配】质保1年,好评,用不到一个星期，还是一掉就坏了,质量需要提高，回访专员小咚跟进回访购物多次后来才知道淘宝评论得积分可以涨淘气淘宝买东西都是系统自动好评回访。,-,2021-06-12
509,t**4,颜色分类: 8p黑色【带原配】质保1年,好评,屏幕收到了， 装好像新的一样，各方面功能正常，而且这个价比手机店实惠多了，满意！更换也很简单，几分钟搞定，一次点亮，目前没有什么毛病屏的质量不错，跟原装的没什么区别。我订的屏不错，经济实惠质量。,安装起来简单方便，而且没有卡顿，成色很好，反应灵敏不会断触，操作流畅，清晰色彩饱和度也很好，卖家还贴心的送了操作工具，很齐全！分辨率像素和原先的没有丝毫差别，屏幕画质挺好的，颜色很正无色差，不偏色不发黄，也没有瑕疵白点黑点这些，感觉不错 换好之后看起来跟全新手机一样，最主要屏幕很好用，反应灵敏不卡顿，屏幕很清晰，颜色鲜艳，没感觉到色差，没出现坏点黑线问题，手感也很好摸起来很顺手，质量很不错,-,2021-06-20
510,t**5,颜色分类: 7代黑色【带原配】质保1年,好评,用着非常好，灵敏度很高，屏幕质量很不错，显示触摸都没问题，比实体店维修划算太多了，装上去的手感特别好，各种功能都没问题，质量很好，触摸也全部试过了，大小非常合适，确认过眼神了，没问题。安装不难，安装视频讲得内容很详细呢，现在发展到还可以买回来自己换，不可思议。商家送了安装教程 工具 很周到。教程也很详细，工具很全面，安装好了很好用，各方面都非常正常，好评！第一次自己换屏，很好操作，安装视频解答的很清晰，工具很齐全，自己在换屏幕的过程中不懂的问了客服，客服很耐心，很满意，屏幕质量很好，跟原装的差不多一模一样，触摸很灵敏，分辨率很高，触摸灵敏度一切正常非常灵敏，一点也不卡顿，安装后贴合度非常好，很满意！,神速收到，全5分，满意  收到货后打开包裹，里面的包装给人感觉很高端很棒，给人感觉依旧很好，包装严密，安装有视频教学，有配送的拆卸工具，装后的色差、亮度、反应都不错，各方面功能正常，总之比较满意,-,2021-06-10
511,徐**燕,颜色分类: 8p黑色【带原配】质保1年,好评,没想到一个女生也可以把屏幕修好的，哈哈…… 换起来跟新的一样，屏幕也很灵 卖家人很好 值得购买 最开始担心自己换不好，就买了屏幕尝试换换，结果二十分钟搞定，太简单了。然后咨询屏幕，发给我安装视频让我先看看感觉下，没觉得有什么难度就下单了。到手后二十分钟左右搞定，屏幕使用和流畅度都不错！,用着非常好，灵敏度很高，屏幕质量很不错，显示触摸都没问题，比实体店维修划算太多了，装上去的手感特别好，各种功能都没问题，质量很好，触摸也全部试过了，大小非常合适，确认过眼神了，没问题。安装不难，安装视频讲得内容很详细呢，现在发展到还可以买回来自己换，不可思议。商家送了安装教程 工具 很周到。教程也很详细，工具很全面，安装好了很好用，各方面都非常正常，好评！第一次自己换屏，很好操作，安装视频解答的很清晰，工具很齐全，自己在换屏幕的过程中不懂的问了客服，客服很耐心，很满意，屏幕质量很好，跟原装的差不多一模一样，触摸很灵敏，分辨率很高，触摸灵敏度一切正常非常灵敏，一点也不卡顿，安装后贴合度非常好，很满意！,-,2021-05-04
512,郭**9,颜色分类: 8代白色【带原配】质保1年,好评,好,-,-,2021-05-22
513,心**曦,颜色分类: 6代黑色【带原配】质保1年,好评,更换挺简单的。用了几天感觉还满意。手机罢工了还以为是手机的问题，没想到换了个屏幕居然好了真是太开心了。🎃还送了玻璃膜安装好屏幕一起顺手给手机贴上了，非常完美。颜色很正，分辨率还可以哦☎,更换挺简单的。用了几天感觉还满意。手机罢工了还以为是手机的问题，没想到换了个屏幕居然好了真是太开心了。🎃还送了玻璃膜安装好屏幕一起顺手给手机贴上了，非常完美。颜色很正，分辨率还可以哦☎,-,2021-06-23
514,惟**9,颜色分类: X屏幕【TFT新天马】+质保1年,好评,屏幕质量非常好，使用也是没有问题，显示色彩和触摸都没有问题，分辨率也很高，比实体店的要便宜太多了， 以后都不需要在店里换屏幕了，价格高而且不经用，屏幕很好。很划算。没想到自己也可以亲手换屏幕，屏幕性能非常好，反应灵敏速度快，自己安装的，有安装教程，第一次安装屏幕有点不太明白还咨询了客服，客服都是很耐心的解答，反应很快！跟新买的手机一样！关键是价格还很优惠果然没有失望，手机已经满血复活，,屏幕很不错，有详细的拆机教学，配有拆机工具。换过之后各功能完好，十分超值。非常棒的购物体验。回复速度很及时，超级满意,-,2021-03-08
515,t**0,颜色分类: 7p黑色【带原配】质保1年,好评,买家服务态度好，屏幕也很棒，物流很快，安装上触摸不卡！,买家服务态度好，屏幕也很棒，物流很快，安装上触摸不卡！,-,2021-04-07
516,l**0,颜色分类: 7代黑色【带原配】质保1年,好评,安装视频详细到位！半小时搞定！省了几百块钱！非常不错！还可以锻炼动手能力！值得推荐！看不出与原装有什么区别！,现在看着新屏幕心情就是不一样，顺畅，质量都非常不错呢，棒棒哒！屏幕分辨率非常不错的。图像都很清晰，已经推荐给我舍友了，质量是真心不错，还在犹豫中的朋友可以下手了 屏幕总成收到了，工具齐全，看着视频安装好了，是正品，安装上试了下效果很好，清晰度很好。 这家的触摸和显示和我一开始买的手机是一模一样的，非常的不错。屏幕显示很好很清晰，触摸也非常的好，我比较喜欢玩游戏触摸没有问题的，得劲，这个价格也是非常合适的，物美价廉,-,2021-05-18
517,败**丶,颜色分类: 7p白色【带原配】质保1年,好评,不是原装，有色差，看着不舒服,回访专员小咚跟进回访购物多次后来才知道淘宝评论得积分可以涨淘气淘宝买东西都是系统自动好评回访,-,2021-05-28
518,f**6,颜色分类: X屏幕【TFT新天马】+质保1年,好评,店家还给安装工具，安装还有视频教程，非常详细。安装操作非常简单，新手小白也是可以自己安装操作，有问题还可以咨询客服，客服的服务态度也是非常好，屏幕安装上之后显示色彩也是一级棒，跟我之前的屏幕没有区别，触摸使用也是很灵敏，这次换了一个颜色。。比实体店维修便宜还省事，客服态度也很好，很满意，非常好，安装很简单，跟屏幕完美结合显示效果角度色彩都,使用后感觉非常流畅，良心卖家非常满意的一次购物,-,2021-03-03
519,c**y,颜色分类: 6sp黑色【带原配】质保1年,好评,屏幕显示效果清晰，像素非常好。 运行速度快，没有卡机的现象。 图像清晰，像素不错。 玩得多就要在充一次电。 总之还是非常满意的，和我之前在实体店里买的差不多，不过价格就实惠多了！以前在手机店换的屏幕太垃圾了，摔了就花屏了，这家店里的屏幕不错,整体还是可以的，我这个女生都能安装上，也是很神奇了，安装简单，反应挺灵敏的，有需要的还是可以购买的 屏幕整体质量很好！收到东西完美无瑕。反应很快，和之前实体店买的一样，不过比实体店的便宜，屏幕跟手机很贴合触屏也很灵敏，终于把我这个碎屏的手机变成一个全新的手机了。换了跟新的一样，用很灵敏，手机重新复活了。,-,2021-05-29
520,李**q,颜色分类: 6p黑色【带原配】质保1年,好评,宝贝安装很方便，一次点亮好很好非常好屏幕显示完美，屏幕很清楚，触控反应快，和手机完美贴合，值得购买触摸灵敏跟分辨率跟原厂的基本一样，没差多少，屏幕也不卡顿，反映很快，不漏光，跟手机很贴合，卖家包装也是很贴心。,现在看着新屏幕心情就是不一样，顺畅，质量都非常不错呢，棒棒哒！屏幕分辨率非常不错的。图像都很清晰，已经推荐给我舍友了，质量是真心不错，还在犹豫中的朋友可以下手了 屏幕总成收到了，工具齐全，看着视频安装好了，是正品，安装上试了下效果很好，清晰度很好。 这个屏幕出乎意料的好，无论色彩和流畅度与原装屏幕没任何区别，价格合理，值得推荐,-,2021-05-08
521,合**坊,颜色分类: 8p白色【带原配】质保1年,好评,这个屏幕出乎意料的好，无论色彩和流畅度与原装屏幕没任何区别，价格合理，值得推荐,安装很方便，简单，而且安装了以后和原件几乎一样，字很清晰，灵敏度很高，最主要的是价格实惠，比实体店的便宜，是正品，我很满意，我会推荐给别人的！价格实惠，货真价实，感觉不错，屏幕清晰，触感灵敏，和原来的没有什么差别。 色彩均匀，灵敏度跟原机一样，店家也挺贴心的，不但发货速度快，而且东西质量也很好，安装时出现不明白的地方客服也能马上解决，客服也很耐心的解答问题，真是周到，太感谢了，安装后跟新的一样，必须推荐,-,2021-05-27
522,龙**道,颜色分类: 6sp白色【带原配】质保1年,好评,这个是真的好，材料和做工都特别精致，做工真的非常棒，我觉着我可以推荐给我朋友买宝贝收到后很满意，外形颜色也很喜欢，挑选好多家，果然没看错，希望把好物分享给大家☺️,这个是真的好，材料和做工都特别精致，做工真的非常棒，我觉着我可以推荐给我朋友买宝贝收到后很满意，外形颜色也很喜欢，挑选好多家，果然没看错，希望把好物分享给大家☺️,-,2021-06-12
523,t**1,颜色分类: 8p黑色【带原配】质保1年,好评,不错,-,-,2021-05-21
524,q**1,颜色分类: 6sp白色【带原配】质保1年,好评,屏幕能用，色差肯定是有的。防水胶不好弄，尺寸有点偏小，一不小心就干废了，只能另外再去卖防水胶,回访专员小咚跟进回访购物多次后来才知道淘宝评论得积分可以涨淘气淘宝买东西都是系统自动好评回访。,-,2021-06-05
