1398,力**莉,颜色分类: 全车五片【合金边框 含后挡】（请备注车型年份）,好评,快递很给力，包装完好无损，本来是凑单买的，没想到质量出乎意料的好  特别特别喜欢，而且价格优惠,-,-,2021-03-20
1399,3**w,颜色分类: 全车五片【合金边框 含后挡】（请备注车型年份）,好评,这个价格买到非常实惠，质量不错，很满意,-,-,2021-04-04
1400,t**1,颜色分类: 侧窗四片【合金边框】（请备注车型年份）,好评,此用户没有填写评价。,雨刮器很好，下雨天已经试过了，刮的很干净，也没什么噪音，和原车的一样好用。,-,2021-04-06
1401,t**2,颜色分类: 全车五片【升级加密 含后挡】（请备注车型年份）,好评,没有卖家讲的好，凑合用吧。,-,-,2021-06-16
1402,d**8,颜色分类: 前窗两片【合金边框】（请备注车型年份）,好评,还不错，小贵，还挺遮阳的,-,-,2021-03-30
1403,糖**7,颜色分类: 侧窗四片【升级加密】（请备注车型年份）,好评,很好 大小合适 质量非常好,-,-,2021-04-14
1404,l**3,颜色分类: 全车五片【合金边框 含后挡】（请备注车型年份）,好评,质量很好，做工精细，价格实惠，很满意！,-,-,2021-06-25
1405,随**1,颜色分类: 前窗一片【升级加密】（请备注车型年份）,好评,不要买，质量极差：,-,-,2021-05-13
1406,打**他,颜色分类: 全车五片【升级加密 含后挡】（请备注车型年份）,好评,收到宝贝了，包装很严实，物流发货很快，值得大家购买,-,-,2021-04-15
1407,l**狗,颜色分类: 前窗两片【升级加密】（请备注车型年份）,好评,不错 但是好像不可以折叠收纳啊……,-,-,2021-05-10
1408,y**2,颜色分类: 侧窗四片【合金边框】（请备注车型年份）,好评,实用性和颜值都非常的赞，我很喜欢，还会再来买的 ,-,-,2021-03-31
1409,海**生,颜色分类: 全车五片【合金边框 含后挡】（请备注车型年份）,好评,质量好，和实体店一样，还便宜,-,-,2021-03-17
1410,t**3,颜色分类: 全车五片【合金边框 含后挡】（请备注车型年份）,好评,材质厚实使用方便售后服务耐心热情发货又快,-,-,2021-06-15
1411,l**冢,颜色分类: 全车五片【升级加密 含后挡】（请备注车型年份）,好评,隔热效果不错呢，质量非常好，挺满意的,-,-,2021-04-09
1412,j**5,颜色分类: 全车五片【升级加密 含后挡】（请备注车型年份）,好评,遮光效果很好，防晒隔热，夏季不怕车里晒热，很不错,-,-,2021-04-09
1413,春**2,颜色分类: 前窗一片【合金边框】（请备注车型年份）,好评,质量不错，已经安装上了。  很满意。 会再光顾的。 ,-,-,2021-04-02
1414,口**姐,颜色分类: 侧窗四片【升级加密】（请备注车型年份）,好评,偏薄，这价格太高了，很普通的东西 ,-,-,2021-05-22
1415,w**1,颜色分类: 全车五片【升级加密 含后挡】（请备注车型年份）,好评,价格很实惠，性价比很高，算是平价好物，会回购的,-,-,2021-04-09
1416,桂**轰,颜色分类: 全车五片【升级加密 含后挡】（请备注车型年份）,好评,遮阳帘不错，夏天车停在楼下不怕晒了,-,-,2021-04-08
1417,安**7,颜色分类: 前窗一片【升级加密】（请备注车型年份）,好评,不会再买，退有点麻烦，一般般，不是定制 ,-,-,2021-05-18
1418,善**涯,颜色分类: 全车五片【合金边框 含后挡】（请备注车型年份）,好评,贴合度高，安装简单，挺不错,-,-,2021-03-28
1419,年**霞,颜色分类: 前窗两片【升级加密】（请备注车型年份）,好评,一般吧，遮不住，还价格那么高 ,-,-,2021-05-18
1420,威**8,颜色分类: 后窗两片【合金边框】（请备注车型年份）,好评,第二次买了，确实很方便，准备给另一辆车也采购上。,-,-,2021-04-04
1421,记**水,颜色分类: 全车五片【升级加密 含后挡】（请备注车型年份）,好评,网纱质量不错，遮阳效果好，满意。,-,-,2021-04-10
1422,l**n,颜色分类: 侧窗四片【合金边框】（请备注车型年份）,好评,刚装好，感觉很不错👍  ,-,-,2021-03-27
1423,凌**0,颜色分类: 全车五片【升级加密 含后挡】（请备注车型年份）,好评,隔热效果很不错，材质也很好，非常满意,-,-,2021-04-15
1424,5**f,颜色分类: 侧窗四片【升级加密】（请备注车型年份）,好评,严丝合缝，四字足矣,-,-,2021-05-23
1425,不**谢,颜色分类: 三角窗【合金边框】（请备注车型年份）,好评,实用性很高，非常满意，性价比很高，好评！,-,-,2021-04-11
1426,睡**0,颜色分类: 前窗两片【合金边框】（请备注车型年份）,好评,安装简单，遮阳效果挺好的，实用 ,-,-,2021-03-19
1427,懊**谨,颜色分类: 全车五片【升级加密 含后挡】（请备注车型年份）,好评,不错，装上去好很多，中午出去开车就不会那么热了,-,-,2021-04-13
1428,j**g,颜色分类: 后挡一片【合金边框】（请备注车型年份）,好评,遮阳效果特别好，夏天舒服了！ ,-,-,2021-03-29
1429,陈**州,颜色分类: 全车6片【前窗2片、后窗2片、三角窗2片】【合金边框】,好评,遮阳效果不错，安装起来简便！,-,-,2021-04-03
1430,m**8,颜色分类: 侧窗四片【合金边框】（请备注车型年份）,好评,用上了，很好👍值得拥有,-,-,2021-03-28
1431,胡**m,颜色分类: 前窗两片【升级加密】（请备注车型年份）,好评,型号都不对，小了,根本不值这个价，而且型号不符合,-,2021-05-13
1432,正**斗,颜色分类: 全车五片【合金边框 含后挡】（请备注车型年份）,好评,收到啦 整体不错 非常喜欢,-,-,2021-03-23
1433,s**y,颜色分类: 侧窗四片【合金边框】（请备注车型年份）,好评,对于无框窗来说性价比不高 ,-,-,2021-03-30
1434,a**i,颜色分类: 全车五片【合金边框 含后挡】（请备注车型年份）,好评,物流迅速，包装完好。安装后使用效果佳。,-,-,2021-03-25
1435,t**9,颜色分类: 前窗一片【合金边框】（请备注车型年份）,好评,东西非常好用。下次还会在买的。,-,-,2021-03-29
1436,夏**忆,颜色分类: 全车五片【升级加密 含后挡】（请备注车型年份）,好评,不错，遮阳效果很好，再也不用怕车子发烫了。,-,-,2021-04-06
1437,z**6,颜色分类: 前窗一片【升级加密】（请备注车型年份）,好评,备注车型都不合适，一句话太垃圾了,-,-,2021-05-20
1438,m**3,颜色分类: 全车五片【升级加密 含后挡】（请备注车型年份）,好评,😃超级好用！还很美观！墙裂推荐！有需要再回购！,-,-,2021-04-05
1439,万**科,颜色分类: 前窗两片【合金边框】（请备注车型年份）,好评,😃超级好用！还很美观！墙裂推荐！有需要再回购！ ,-,-,2021-03-18
1440,足**派,颜色分类: 全车五片【升级加密 含后挡】（请备注车型年份）,好评,已经收到快递了 这个很划算 价格便宜 ，值得购买,-,-,2021-04-08
1441,w**l,颜色分类: 前窗两片【升级加密】（请备注车型年份）,好评,第二次买的尺寸有问题 有些大了  ,-,-,2021-05-19
1442,g**8,颜色分类: 侧窗四片【合金边框】（请备注车型年份）,好评,东西收到之后马上查看了，和预想的一样，之前夏天车里晒的很，尤其是驾驶室和副驾驶室，太阳一直照着，有了这个就很好，而且前面有一块预留窗口，也不阻挡驾驶者的视线，不影响安全驾驶，很满意的一次购物 ,-,-,2021-03-18
1443,有**惜,颜色分类: 全车五片【合金边框 含后挡】（请备注车型年份）,好评,到了，大小合适，质量很好，非常满意。,-,-,2021-03-29
1444,芦**草,颜色分类: 全车五片【合金边框 含后挡】（请备注车型年份）,好评,防晒效果很好，真心不错,-,-,2021-04-07
1445,t**6,颜色分类: 全车五片【合金边框 含后挡】（请备注车型年份）,好评,遮光效果很好，隔热效果也很好。,-,-,2021-06-26
1446,宅**b,颜色分类: 后挡一片【合金边框】（请备注车型年份）,好评,宝贝收到，效果很好，重点是服务态度很好。祝你们生意兴隆,-,-,2021-04-13
1447,x**y,颜色分类: 全车五片【合金边框 含后挡】（请备注车型年份）,好评,蛮不错的，包装完好，没有破损,-,-,2021-04-05
1448,文**腔,颜色分类: 全车五片【升级加密 含后挡】（请备注车型年份）,好评,质量不错，价格实惠，值得购买！,-,-,2021-04-15
1449,y**4,颜色分类: 全车五片【升级加密 含后挡】（请备注车型年份）,好评,图片与实物一致质量很好哦,-,-,2021-04-06
1450,游**k,颜色分类: 全车五片【合金边框 含后挡】（请备注车型年份）,好评,质量非常的不错，价格也很公道。很满意,-,-,2021-03-25
1451,j**a,颜色分类: 全车五片【升级加密 含后挡】（请备注车型年份）,好评,宝贝收到了，很车窗很贴合，质量很不错。,-,-,2021-04-12
1452,g**i,颜色分类: 全车五片【合金边框 含后挡】（请备注车型年份）,好评,质量很好做工精细很满意,-,-,2021-03-17
1453,囚**车,颜色分类: 全车五片【合金边框 含后挡】（请备注车型年份）,好评,款式质量都还不错，值得购买。,-,-,2021-04-05
1454,t**4,颜色分类: 全车五片【合金边框 含后挡】（请备注车型年份）,好评,质量很不错，遮阳效果挺好，，很满意！ ,-,-,2021-06-23
1455,麻**z,颜色分类: 全车五片【合金边框 含后挡】（请备注车型年份）,好评,隔热效果不错，质量很好。,-,-,2021-04-03
1456,紫**虫,颜色分类: 全车五片【升级加密 含后挡】（请备注车型年份）,好评,很好满意，安装合适,-,-,2021-04-14
1457,姐**名,颜色分类: 全车五片【合金边框 含后挡】（请备注车型年份）,好评,挺不错的，效果很满意,-,-,2021-04-01
1458,幸**6,颜色分类: 侧窗四片【升级加密】（请备注车型年份）,好评,宝贝已收到非常好值得购买！,-,-,2021-04-08
1459,t**6,颜色分类: 前窗一片【升级加密】（请备注车型年份）,好评,一般，没有描述的好用,-,-,2021-06-26
1460,一**景,颜色分类: 前窗一片【升级加密】（请备注车型年份）,好评,不是完全符合，一般般 ,-,-,2021-05-16
1461,r**2,颜色分类: 全车五片【合金边框 含后挡】（请备注车型年份）,好评,质量很好，，和卖家描述的一样，超喜欢,-,-,2021-04-08
1462,牛**2,颜色分类: 后窗两片【升级加密】（请备注车型年份）,好评,还没有用，期待效果。,-,-,2021-05-12
1463,t**0,颜色分类: 全车五片【升级加密 含后挡】（请备注车型年份）,好评,收到了，质量很好，物流也很快，价格实惠非常满意,-,-,2021-06-25
1464,a**玥,颜色分类: 前窗两片【合金边框】（请备注车型年份）,好评,尺寸合适,-,-,2021-04-05
1465,m**u,颜色分类: 前窗一片【升级加密】（请备注车型年份）,好评,此用户没有填写评价。,不合适就算了，根本就不防晒，还卖这么贵！哎！丢了,-,2021-05-16
1466,w**z,颜色分类: 侧窗四片【合金边框】（请备注车型年份）,好评,不错 真心不错 不担心会掉 ,-,-,2021-04-07
1467,d**0,颜色分类: 全车五片【合金边框 含后挡】（请备注车型年份）,好评,真的超级喜欢，质量非常好，与卖家描述的一致！,-,-,2021-03-28
1468,l**0,颜色分类: 前挡一片【合金边框】（请备注车型年份.）,好评,此用户没有填写评价。,防晒效果还不错,-,2021-04-04
1469,巴**缓,颜色分类: 前窗两片【合金边框】（请备注车型年份）,好评,天热了，正好用上 ,-,-,2021-03-26
1470,o**o,颜色分类: 全车五片【合金边框 含后挡】（请备注车型年份）,好评,到货快，质量很好，没什么问题很满意,-,-,2021-04-02
1471,伤**老,颜色分类: 前窗一片【合金边框】（请备注车型年份）,好评,有点贵，但真的很实用，安装也非常方便,-,-,2021-03-22
1472,圣**白,颜色分类: 后窗两片【升级加密】（请备注车型年份）,好评,挺好的。喜欢 ,-,-,2021-04-15
1473,乘**代,颜色分类: 全车五片【升级加密 含后挡】（请备注车型年份）,好评,少发一张后档遮阳帘，十多天过去了还没反应，无语～,-,-,2021-05-23
1474,h**g,颜色分类: 全车五片【合金边框 含后挡】（请备注车型年份）,好评,发货很快，物流也给力。大小合适装上凉快很。奈斯 ,-,-,2021-04-01
1475,晨**纱,颜色分类: 全车五片【合金边框 含后挡】（请备注车型年份）,好评,物有所值很好的卖家赞一个全五星好评,-,-,2021-03-20
1476,l**3,颜色分类: 前窗两片【升级加密】（请备注车型年份）,好评,根本没有磁吸,-,-,2021-06-25
1477,l**9,颜色分类: 全车五片【升级加密 含后挡】（请备注车型年份）,好评,质量不错  效果好,-,-,2021-04-13
1478,z**d,颜色分类: 全车七片【升级加密 含后挡】（请备注车型年份）,好评,使用起来真好用，一点问题都没有。也没有啥破裂的地方,-,-,2021-05-16
1479,晟**柒,颜色分类: 全车五片【合金边框 含后挡】（请备注车型年份）,好评,质量很好，遮阳效果也很好，非常满意,-,-,2021-03-31
1480,t**h,颜色分类: 全车五片【合金边框 含后挡】（请备注车型年份）,好评,很实用，效果很好,-,-,2021-03-27
1481,t**3,颜色分类: 前窗两片【升级加密】（请备注车型年份）,好评,感觉不值这个价位 ,-,-,2021-06-15
1482,l**8,颜色分类: 全车五片【合金边框 含后挡】（请备注车型年份）,好评,质量不错，遮光效果非常好，好用,-,-,2021-04-06
1483,l**4,颜色分类: 全车五片【升级加密 含后挡】（请备注车型年份）,好评,质量很好物流很快物有所值推荐购买。,-,-,2021-04-09
1484,雷**b,颜色分类: 全车五片【升级加密 含后挡】（请备注车型年份）,好评,质量很好，安装简单方便，很实用,-,-,2021-04-15
1485,笨**豆,颜色分类: 全车五片【升级加密 含后挡】（请备注车型年份）,好评,卖家发货速度很快 ，产品收到没有任何破损 ！很愉快的一次购物  ,-,-,2021-04-14
1486,j**n,颜色分类: 全车五片【合金边框 含后挡】（请备注车型年份）,好评,质量不错，价格也不贵，我挺满意的。,-,-,2021-04-04
1487,t**0,颜色分类: 前窗两片【合金边框】（请备注车型年份）,好评,效果很好,-,-,2021-06-25
1488,星**7,颜色分类: 全车五片【合金边框 含后挡】（请备注车型年份）,好评,这个遮阳帘质量很好，和实体店一样的价格优惠多了，谢谢商家物流给力。,-,-,2021-03-20
1489,l**头,颜色分类: 全车五片【合金边框 含后挡】（请备注车型年份）,好评,质量很好，非常满意的一次购物体验 ,-,-,2021-03-31
1490,l**f,颜色分类: 全车五片【合金边框 含后挡】（请备注车型年份）,好评,不错，大小形状基本贴合 ,-,-,2021-03-30
1491,冬**春,颜色分类: 后窗两片【合金边框】（请备注车型年份）,好评,质量可以,-,-,2021-03-25
1492,杨**1,颜色分类: 全车五片【合金边框 含后挡】（请备注车型年份）,好评,质量很好，遮阳效果强，满意,-,-,2021-03-29
1493,龙**门,颜色分类: 前窗两片【升级加密】（请备注车型年份）,好评,尺寸比较小,-,-,2021-05-23
1494,h**1,颜色分类: 【加厚全遮光款】前窗1片 合金边框,好评,发过来就是个坏的，根本卡不住 ,-,-,2021-05-16
1495,l**b,颜色分类: 前窗两片【合金边框】（请备注车型年份）,好评,还没有使用，看着不错，先好评,-,-,2021-04-10
1496,t**3,颜色分类: 全车五片【升级加密 含后挡】（请备注车型年份）,好评,遮光又防晒，还能起到降温，爱了爱了,-,-,2021-06-15
1497,t**2,颜色分类: 侧窗四片【合金边框】（请备注车型年份）,好评,忙得忘记评论了，试了一下还可以,-,-,2021-06-16
1498,t**n,颜色分类: 全车五片【合金边框 含后挡】（请备注车型年份）,好评,遮阳效果不错，质量很好，卖家发货快，好评。,-,-,2021-03-22
1499,香**派,颜色分类: 侧窗四片【升级加密】（请备注车型年份）,好评,此用户没有填写评价。,买完就降价了20,-,2021-05-06
1500,鄂**锚,颜色分类: 全车五片【合金边框 含后挡】（请备注车型年份）,好评,宝贝非常好，感谢卖家好评，质量非常好,-,-,2021-04-04
1501,q**2,颜色分类: 前窗一片【升级加密】（请备注车型年份）,好评,上次买了全套，掉了一个，这次补买一个。 ,-,-,2021-05-12
1502,t**0,颜色分类: 侧窗四片【合金边框】（请备注车型年份）,好评,挺好的，期待使用，能遮阳。这样出门就不怕太阳晒了。客服态度好！,-,-,2021-06-25
1503,t**0,颜色分类: 全车五片【合金边框 含后挡】（请备注车型年份）,好评,宝贝做的很好、本人比较满意、谢谢店家,-,-,2021-06-25
1504,东**猴,颜色分类: 全车五片【升级加密 含后挡】（请备注车型年份）,好评,下单后发货很快  宝贝跟描述的符合 客服态度很好 下次再光顾,-,-,2021-04-11
1505,h**5,颜色分类: 后窗两片【合金边框】（请备注车型年份）,好评,挺好用，如果遮阳再好点就更好了,-,-,2021-03-25
1506,t**1,颜色分类: 全车五片【升级加密 含后挡】（请备注车型年份）,好评,东西收到了，质量不错，遮阳效果不错,-,-,2021-04-10
1507,c**l,颜色分类: 后窗两片【合金边框】（请备注车型年份）,好评,可以的，夏日必备，防晒防蚊虫,-,-,2021-03-19
1508,c**f,颜色分类: 侧窗四片【合金边框】（请备注车型年份）,好评,很好，是专车专用的，装卸简单，不错。 ,-,-,2021-03-29
1509,方**伺,颜色分类: 全车6片【前窗2片、后窗2片、三角窗2片】【升级加密】,好评,款式不错很不赖，发货速度的很。,-,-,2021-05-22
1510,t**5,颜色分类: 后窗两片【升级加密】（请备注车型年份）,好评,挺好。也挺厚，就是有点小贵,-,-,2021-05-17
1511,b**0,颜色分类: 全车五片【合金边框 含后挡】（请备注车型年份）,好评,快递收到了非常好用物美价廉值得购买,-,-,2021-03-19
1512,h**7,颜色分类: 全车五片【合金边框 含后挡】（请备注车型年份）,好评,快递很快，防晒效果不错，再也不怕爱车晒着了,-,-,2021-03-17
1513,t**4,颜色分类: 后窗两片【升级加密】（请备注车型年份）,好评,后悔只买了后窗的，还想在买其他的,-,-,2021-06-23
1514,j**t,颜色分类: 侧窗四片【升级加密】（请备注车型年份）,好评,固定贴少了点，其他都挺好。 ,-,-,2021-05-16
1515,c**儿,颜色分类: 前窗两片【合金边框】（请备注车型年份）,好评,质量挺好的，有防晒效果不错👍,-,-,2021-04-04
1516,蓦**0,颜色分类: 全车五片【升级加密 含后挡】（请备注车型年份）,好评,质量很好，很满意。下次还来买！,-,-,2021-04-15
1517,z**9,颜色分类: 全车五片【合金边框 含后挡】（请备注车型年份）,好评,遮光效果挺好的，试用方便，值得推荐,-,-,2021-06-22
1518,王**6,颜色分类: 全车五片【合金边框 含后挡】（请备注车型年份）,好评,满意，质量超出想象，卖家很有信誉,-,-,2021-03-30
1519,才**走,颜色分类: 全车五片【合金边框 含后挡】（请备注车型年份）,好评,质量很好，价格便宜，值得购买,-,-,2021-03-20
1520,大**8,颜色分类: 全车五片【合金边框 含后挡】（请备注车型年份）,好评,遮阳隔热效果很好，满意,-,-,2021-04-01
1521,t**4,颜色分类: 全车五片【升级加密 含后挡】（请备注车型年份）,好评,宝贝收到了，还没使用，希望好用,-,-,2021-06-23
1522,活**了,颜色分类: 前窗一片【升级加密】（请备注车型年份）,好评,如果便宜点就很不错了,-,-,2021-04-15
1523,m**n,颜色分类: 前窗两片【升级加密】（请备注车型年份）,好评,一开窗窗帘就掉真闹心,-,-,2021-05-22
1524,l**j,颜色分类: 全车五片【合金边框 含后挡】（请备注车型年份）,好评,和商家描述的一致，性价比非常高，好评。,-,-,2021-03-23
1525,我**1,颜色分类: 前窗两片【升级加密】（请备注车型年份）,好评,整体评价：个人观点，90多买这款商品 太不值 磁铁软布  没有内撑的   6元左右一个     这款买回来感觉少半截   根本就不是专用的   服务挺好的   但实物根本就不匹配  望 想买的  看好尺寸   不匹配  退回嫌麻烦   使用体验：少半截  根本就不是专用的   做工形式：做工 一般吧  不配套   产品材质：一般  少半截 ,不配套的防晒车窗帘，怀疑是17款的车尺寸,-,2021-04-26
1526,x**3,颜色分类: 全车五片【合金边框 含后挡】（请备注车型年份）,好评,很满意的一次网购。,-,-,2021-03-20
1527,蛮**主,颜色分类: 前窗一片【升级加密】（请备注车型年份）,好评,不合适，跟客服沟通了，还是不合适，边框不能完全贴个，翘翘着，一碰就掉,-,-,2021-05-14
1528,l**康,颜色分类: 全车五片【升级加密 含后挡】（请备注车型年份）,好评,质量很满意，老板服务好。,-,-,2021-04-10
1529,天**3,颜色分类: 侧窗四片【合金边框】（请备注车型年份）,好评,真的好用，无损安装！发货物流都很快！,-,-,2021-03-27
1530,跳**9,颜色分类: 侧窗四片【合金边框】（请备注车型年份）,好评,产品质量非常满意！,-,-,2021-04-01
1531,t**9,颜色分类: 前窗两片【升级加密】（请备注车型年份）,好评,一点也不遮阳 失望,-,-,2021-05-21
1532,小**店,颜色分类: 全车五片【合金边框 含后挡】（请备注车型年份）,好评,宝贝质量很好，物超所值，下次再来，谢谢店家！ ,-,-,2021-04-05
1533,t**6,颜色分类: 前窗两片【合金边框】（请备注车型年份）,好评,效果不错，是想要的。 ,-,-,2021-06-26
1534,小**0,颜色分类: 全车五片【合金边框 含后挡】（请备注车型年份）,好评,和店家描述的一致，质量很好，包装很严实，快递很给力,-,-,2021-03-29
1535,景**毛,颜色分类: 全车五片【合金边框 含后挡】（请备注车型年份）,好评,安装完成，挺满意的,-,-,2021-04-09
1536,月**妮,颜色分类: 前窗两片【升级加密】（请备注车型年份）,好评,好像小了一点,-,-,2021-05-23
1537,z**8,颜色分类: 前窗一片【合金边框】（请备注车型年份）,好评,按照好了，挺好的👌,-,-,2021-03-25
1538,a**5,颜色分类: 侧窗四片【合金边框】（请备注车型年份）,好评,天热  很实用 ,-,-,2021-04-09
1539,t**b,颜色分类: 全车9片【前窗2片、后窗4片、三角窗2片、后档1片】【合金边框】,好评,性价比高，我很喜欢，下次还会光临。,-,-,2021-03-18
1540,嫣**头,颜色分类: 前窗一片【合金边框】（请备注车型年份）,好评,以前买了一套，后来丢了一个，又补上 ,-,-,2021-04-02
1541,淑**泪,颜色分类: 全车五片【合金边框 含后挡】（请备注车型年份）,好评,效果不错，质量挺好的，很满意,-,-,2021-03-19
1542,x**9,颜色分类: 前窗一片【升级加密】（请备注车型年份）,好评,不是太挡阳光,-,-,2021-05-14
1543,l**0,颜色分类: 侧窗四片【合金边框】（请备注车型年份）,好评,已收到 很不错哦,-,-,2021-03-18
1544,米**丶,颜色分类: 全车五片【合金边框 含后挡】（请备注车型年份）,好评,质量很不错，挺好用的,-,-,2021-03-31
1545,t**1,颜色分类: 前窗两片【合金边框】（请备注车型年份）,好评,夏天必备，质量不错,-,-,2021-04-11
1546,t**3,颜色分类: 侧窗四片【合金边框】（请备注车型年份）,好评,东西好，很满意的购物,-,-,2021-06-15
1547,李**坚,颜色分类: 全车五片【升级加密 含后挡】（请备注车型年份）,好评,卖家服务好，发货快，收到就安装上了，很好操作,-,-,2021-04-13
1548,l**1,颜色分类: 三角窗【合金边框】（请备注车型年份）,好评,很好很强大👍 ,-,-,2021-06-24
1549,遇**爱,颜色分类: 全车五片【升级加密 含后挡】（请备注车型年份）,好评,不错不错，很实用,-,-,2021-04-14
1550,海**石,颜色分类: 前窗两片【升级加密】（请备注车型年份）,好评,真的很无语，丢了,-,-,2021-05-21
1551,c**n,颜色分类: 全车五片【升级加密 含后挡】（请备注车型年份）,好评,挺好的，质量真心好，值得购买,-,-,2021-04-09
1552,j**n,颜色分类: 全车五片【升级加密 含后挡】（请备注车型年份）,好评,非常好用，质量很好 ,-,-,2021-04-12
1553,c**f,颜色分类: 前窗一片【合金边框】（请备注车型年份）,好评,希望有效果,-,-,2021-03-20
1554,姚**6,颜色分类: 前窗两片【升级加密】（请备注车型年份）,好评,和去年买的不一样,-,-,2021-05-16
1555,t**4,颜色分类: 全车五片【升级加密 含后挡】（请备注车型年份）,好评,质量很好，物流很快，隔热效果很好 ,-,-,2021-06-23
1556,双**妞,颜色分类: 侧窗四片【合金边框】（请备注车型年份）,好评,安装方便,-,-,2021-04-09
