494,t**6,表带尺寸: 适用：华为GT2/2E(46mm) 颜色分类: 墨绿色-【黑扣款】,好评,很满意的一次购物，很柔软，打算再换个颜色🤓,-,-,2021-06-22
495,t**3,表带尺寸: 适用：华为GT2/2E(46mm) 颜色分类: 活力橙-【银扣款】,好评,此用户没有填写评价。,表带质量很好，表面光滑无毛刺做工细致，也没有什么气味孔位精准 ，和手表很匹配价位合适也很哈好安装。,-,2021-05-30
496,m**8,表带尺寸: 适用：华为GT2/2E(46mm) 颜色分类: 赤霞橙-【黑扣款】,好评,带着很舒服，硅胶的也不会有异味，拆装都很方便，这个价格能买到这品质很划算哦！颜色很正很喜欢！,-,-,2021-05-31
497,t**7,表带尺寸: 适用：华为GT2/2E(46mm) 颜色分类: 赤霞橙-【黑扣款】,好评,质量品质很好，做工精致，环保材质，弹性好，戴着舒适，款式好看。很喜欢,-,-,2021-06-26
498,t**5,表带尺寸: 适用：荣耀ES 颜色分类: 赤霞橙-【银扣款】,好评,收到表带，很满意，原因是质量很好，卡扣质量也很好，能保证手机安全性。包装完美，颜色很正，卖家还有赠品，两个手表表面膜，可以用几年了，好评！,-,-,2021-06-22
499,姜**4,表带尺寸: 适用：荣耀手表2(46mm) 颜色分类: 赤霞橙-【黑扣款】,好评,红色的就是好看，带手上很靓，运动气息十足，大家可以尝试一下，五星好评。,-,-,2021-05-30
500,f**9,表带尺寸: 适用：荣耀ES 颜色分类: 赤霞橙-【黑扣款】,好评,东西很不错!也很舒服!没有出现瘙痒的症状!质地很柔软哟！所以产品想当的不错，，需要的朋友可以下手了!不贵买了也不会后悔!东西超级棒哦⊙∀⊙！,-,-,2021-05-31
501,峰**玉,表带尺寸: 适用：华为GT2/2E(46mm) 颜色分类: 赤霞橙-【黑扣款】,好评,表带质量很好，做工也很好，很结实的钢材质，硬度很够，但又不硌手，送的东西很实在，也很实用，还是很满意的！,-,-,2021-05-30
502,珊**7,表带尺寸: 适用：华为GT2/2E(46mm) 颜色分类: 赤霞橙-【黑扣款】,好评,表带带着很舒服，贴合手腕，防水防汗轻盈透气，没有异味，不变形，值得入手,-,-,2021-06-04
503,张**4,表带尺寸: 适用：华为GT2/2E(46mm) 颜色分类: 墨绿色-【黑扣款】,好评,表带颜色很靓丽，易安装！长度刚好，软软的，戴着很舒服！,-,-,2021-06-07
504,t**0,表带尺寸: 适用：华为GT2/2E(46mm) 颜色分类: 墨绿色-【银扣款】,好评,宝贝收到了，颜色漂亮，材质戴起来很透气，不闷皮肤，下次继续回购其他颜色,-,-,2021-05-31
505,王**s,表带尺寸: 适用：华为GT2/2E(46mm) 颜色分类: 墨绿色-【黑扣款】,好评,戴上去不磨胳膊，卖家还赠了两片膜,-,-,2021-06-12
506,t**0,表带尺寸: 适用：华为GT2/2E(46mm) 颜色分类: 墨绿色-【黑扣款】,好评,手表收到了，款式很有特色，做工精致，质量看着也还可以，戴起来不勒手。挺喜欢的，推荐购买哦,-,-,2021-05-31
507,c**h,表带尺寸: 适用：华为GT1(运动/时尚/活力款) 颜色分类: 赤霞橙-【黑扣款】,好评,硅胶表带，柔软舒适无异味，蛮合适的，价格也很实惠！,-,-,2021-05-31
508,s**敏,表带尺寸: 适用：华为GT2/2E(46mm) 颜色分类: 赤霞橙-【黑扣款】,好评,表带一如既往的好，拆卸什么的也很方便，上手也很好看，高档，喜欢的朋友可以下手，不会后悔的,-,-,2021-06-01
509,披**瓜,表带尺寸: 适用：华为GT2/2E(46mm) 颜色分类: 赤霞橙-【黑扣款】,好评,不错，质感很好,-,-,2021-06-10
510,三**9,表带尺寸: 适用：华为GT2/2E(46mm) 颜色分类: 墨绿色-【黑扣款】,好评,真心不错，贴合很好，没有什么缝隙，表扣戴着也很紧实，不容易松动。是真皮材的，颜色很好看没有色差，值得购买。,-,-,2021-05-30
511,t**6,表带尺寸: 适用：华为GT2/2E(46mm) 颜色分类: 赤霞橙-【黑扣款】,好评,表带很快收到了，打开一看太好看了，活力十足，戴上显得年轻，做工不错孔眼精致满意。,-,-,2021-06-22
512,t**5,表带尺寸: 适用：华为GT2/2E(46mm) 颜色分类: 墨绿色-【黑扣款】,好评,华为硅胶表带质量很好，戴上接触皮肤很舒服，设计挺时尚的且做工细致，没有瑕疵,-,-,2021-06-22
513,小**8,表带尺寸: 适用：荣耀手表2(46mm) 颜色分类: 墨绿色-【黑扣款】,好评,硅胶材料，回弹性好。表带与表盘拼接处吻合很好，佩戴舒服。,-,-,2021-05-30
514,建**e,表带尺寸: 适用：华为GT2/2E(46mm) 颜色分类: 赤霞橙-【黑扣款】,好评,表带质量非常好，带上去很舒服，颜色也很正，和手表很搭配，价格也比我在实体店看的便宜好多，太满意了。,-,-,2021-05-31
515,c**0,表带尺寸: 适用：华为GT2/2E(46mm) 颜色分类: 墨绿色-【银扣款】,好评,看起来很结实，做工挺精细的，戴在手上很不错透气性好，挺满意的,-,-,2021-05-30
516,一**封,表带尺寸: 适用：华为GT2/2E(46mm) 颜色分类: 赤霞橙-【黑扣款】,好评,表带质量不错  手感舒服  透气不闷热 颜色好看很搭  尺寸随意调节 满意,-,-,2021-05-29
517,王**托,表带尺寸: 适用：荣耀手表2(46mm) 颜色分类: 赤霞橙-【黑扣款】,好评,(๑•̀ㅂ•́)و✧价格超优惠，匹配也非常棒，性价比很高的表带哦,-,-,2021-05-30
518,t**1,表带尺寸: 适用：华为GT2/2E(46mm) 颜色分类: 运动黑-【黑扣款】,好评,表带尺寸合适，硅胶材质，戴着舒服，颜色和我的手表也很搭，价格也比实体店的便宜，好评,-,-,2021-06-25
519,t**0,表带尺寸: 适用：华为GT1(运动/时尚/活力款) 颜色分类: 墨绿色-【黑扣款】,好评,性价比高，非常满意。,-,-,2021-06-14
520,t**3,表带尺寸: 适用：华为GT2/2E(46mm) 颜色分类: 赤霞橙-【黑扣款】,好评,收到啦，颜色样子和图片一样漂亮，喜欢😍手感也特别好，满意满意满意满意，,-,-,2021-06-02
521,t**1,表带尺寸: 适用：华为GT2/2E(46mm) 颜色分类: 赤霞橙-【黑扣款】,好评,物流快包装完好，表带质量不错材质柔软不刮手颜色耐脏耐看性价比高,-,-,2021-06-25
522,t**8,表带尺寸: 适用：华为GT2/2E(46mm) 颜色分类: 赤霞橙-【黑扣款】,好评,表带是硅胶的一开始还担心质量不好，但拿回来一上好，和表太配了，质量也挺好的，正是我想要的，准备在买一条换着用,-,-,2021-06-03
523,p**i,表带尺寸: 适用：华为GT2/2E(46mm) 颜色分类: 墨绿色-【黑扣款】,好评,尺寸大小都合适，颜色很喜欢带着显手白又好看，盆友都说买的很划算,-,-,2021-06-04
524,q**1,表带尺寸: 适用：华为GT2/2E(46mm) 颜色分类: 赤霞橙-【黑扣款】,好评,表带大小合适装上刚好无缝衔接，质量也很好轻盈柔软又透气，戴上很舒适,-,-,2021-06-05
525,t**1,表带尺寸: 适用：华为GT2/2E(46mm) 颜色分类: 赤霞橙-【黑扣款】,好评,质量不错颜色很正，大小合适款式好看，戴着舒服不勒手腕，跟表很配满意,-,-,2021-06-25
526,木**6,表带尺寸: 适用：华为GT2/2E(46mm) 颜色分类: 墨绿色-【黑扣款】,好评,表带太好看了，没有色差，戴着非常显白显气质，做工精细，跟原装差不多。,-,-,2021-06-06
527,d**8,表带尺寸: 适用：华为GT2/2E(46mm) 颜色分类: 赤霞橙-【黑扣款】,好评,表带颜色很好看，无色差，大方耐看。这种硅胶材质的表带也很适合夏天戴，挺满意的，性价比高！,-,-,2021-05-31
528,刘**1,表带尺寸: 适用：华为GT2/2E(46mm) 颜色分类: 墨绿色-【黑扣款】,好评,东西挺好的，大小适中，质量也不错，非常喜欢。我给我朋友也推荐买这个。,-,-,2021-06-02
529,t**3,表带尺寸: 适用：华为GT2/2E(46mm) 颜色分类: 墨绿色-【黑扣款】,好评,表带已到货，质量很好，价格非常实惠，颜色很喜欢，满意好评,-,-,2021-06-05
530,t**7,表带尺寸: 适用：华为GT2/2E(46mm) 颜色分类: 运动黑-【黑扣款】,好评,表带收到了 质量很不错 ，没有什么刺鼻的味道 ，价格实惠 戴在手上也很舒适 ，满意,-,-,2021-06-26
531,t**7,表带尺寸: 适用：华为GT2/2E(46mm) 颜色分类: 墨绿色-【黑扣款】,好评,真的是物美价廉，表带颜色很好看，质量跟原装的差不多，价格比原装的少好几倍，感觉赚到了。,-,-,2021-06-26
532,t**2,表带尺寸: 适用：荣耀手表2(46mm) 颜色分类: 活力橙-【银扣款】,好评,好家伙，我直接好家伙，表带印花错了就算了，还有味道，然后膜就直接送了个破的,-,-,2021-06-26
533,t**8,表带尺寸: 适用：华为GT2/2E(46mm) 颜色分类: 赤霞橙-【黑扣款】,好评,很精致。操作简单易上手，套上后贴合度很好，跟手表简直完美融合，整体性价比真的很高,-,-,2021-05-28
534,x**9,表带尺寸: 适用：华为GT2/2E(46mm) 颜色分类: 运动黑-【黑扣款】,好评,很好，夏天这个表带很是凉快，很精致，客服态度很好，赞一个。,表带待了没几天就坏了，客服还说是我自己弄坏的，质量绝对有问题，下次绝不会为了那俩块钱的好评去给评价了，永远都是顾客自己的事，垃圾垃圾垃圾,-,2021-06-11
535,w**9,表带尺寸: 适用：华为GT2/2E(46mm) 颜色分类: 墨绿色-【黑扣款】,好评,材质柔软，无异味，佩戴舒适，颜色时尚，很满意！！,-,-,2021-05-30
536,t**1,表带尺寸: 适用：华为GT1(运动/时尚/活力款) 颜色分类: 赤霞橙-【黑扣款】,好评,表带材料好，手感柔软，带上舒服，尺寸标准，无异味包装精美，商家发货速度,-,-,2021-06-25
537,s**的,表带尺寸: 适用：华为GT2/2E(46mm) 颜色分类: 赤霞橙-【黑扣款】,好评,物流速度很快，买回来就装上了，，拆卸很方便，换上以后戴了，和之前原配的一样，现在为止没有出现任何问题，可以说质量很好的。,-,-,2021-06-08
538,小**木,表带尺寸: 适用：华为GT2/2E(46mm) 颜色分类: 赤霞橙-【黑扣款】,好评,这个还不错。红色的比较匹配，我的衣服和穿着。嗯，好的，下次再买个绿的。,-,-,2021-05-31
539,万**2,表带尺寸: 适用：华为GT2/2E(46mm) 颜色分类: 墨绿色-【黑扣款】,好评,表带搭配效果不错，质的很好无异味，手感舒服，工艺挺好的，换上给人焕然一新的感觉，不错。,-,-,2021-05-30
540,1**4,表带尺寸: 适用：华为GT2/2E(46mm) 颜色分类: 赤霞橙-【黑扣款】,好评,表带收到了，硅胶材质柔软不卡手腕，戴着很舒服，颜色正，跟原装的没什么区别，特别满意！,-,-,2021-06-07
541,t**6,表带尺寸: 适用：华为GT2/2E(46mm) 颜色分类: 赤霞橙-【黑扣款】,好评,表带特别好看，原装是黑色的，夏天换了一个红色的，很漂亮，质量很好,-,-,2021-06-22
542,陈**6,表带尺寸: 适用：华为GT2/2E(46mm) 颜色分类: 赤霞橙-【黑扣款】,好评,很漂亮哦，材质真心不错哦，我觉得很满意，也没什么味道，价格实惠！,-,-,2021-06-07
543,m**6,表带尺寸: 适用：华为GT2 Pro/ECG/保时捷版 颜色分类: 墨绿色-【黑扣款】,好评,装上合适，喜欢这个颜色，非常不错的一次购物。还会再来。,-,-,2021-05-29
544,a**1,表带尺寸: 适用：华为GT2/2E(46mm) 颜色分类: 雅致白-【银扣款】,好评,质量很好，看着很有质感，挺时尚的，价格也合理，性价比高，想买的朋友们可以放心购买,-,-,2021-06-04
545,请**0,表带尺寸: 适用：华为GT1(运动/时尚/活力款) 颜色分类: 赤霞橙-【黑扣款】,好评,表带质量很好，尺寸合适，设计的很合理，价格实惠，很喜欢。,-,-,2021-06-05
546,t**7,表带尺寸: 适用：华为GT2/2E(46mm) 颜色分类: 墨绿色-【黑扣款】,好评,很好看啊，比原装那个戴着舒服，这个还很透气不闷，下次再回购别的颜色的物美价廉,-,-,2021-06-26
547,a**7,表带尺寸: 适用：华为Watch2(无膜) 颜色分类: 赤霞橙-【黑扣款】,好评,盒子一打开儿子就迫不及待给带上了，看外表跟手机店卖的也差不多,-,-,2021-06-07
548,t**3,表带尺寸: 适用：华为GT2/2E(46mm) 颜色分类: 赤霞橙-【黑扣款】,好评,这真表带值得信赖，做工非常好，有皮质的光亮感，也很柔软，佩戴方便，感觉很合适。,-,-,2021-06-05
549,t**7,表带尺寸: 适用：华为GT2/2E(46mm) 颜色分类: 赤霞橙-【黑扣款】,好评,整体都不错，质量也很好 安装简单快捷 表盘和表带的拼接处也很紧致不容易松动,-,-,2021-06-26
550,粉**情,表带尺寸: 适用：华为GT2/2E(46mm) 颜色分类: 赤霞橙-【黑扣款】,好评,表带收到就换上了，很好看，比原装那个戴着还要舒服，非常透气，颜色也很漂亮。,-,-,2021-06-03
551,t**0,表带尺寸: 适用：华为GT2/2E(46mm) 颜色分类: 赤霞橙-【黑扣款】,好评,表带收到了，质量不错。颜色挺新的。手感不错，硅胶带比其他的佩戴舒服。好打理。,-,-,2021-05-28
552,t**2,表带尺寸: 适用：荣耀手表2(46mm) 颜色分类: 赤霞橙-【黑扣款】,好评,表收到了，质量很好，款式很漂亮，带上高端大气上档次，很喜欢，值得拥有哟。,-,-,2021-06-26
553,左**米,表带尺寸: 适用：荣耀手表2(46mm) 颜色分类: 运动黑-【黑扣款】,好评,手表表带质量很好，做工精细，款式时尚大气，戴起来很显气质。,-,-,2021-05-31
554,美**u,表带尺寸: 适用：华为GT2/2E(46mm) 颜色分类: 赤霞橙-【黑扣款】,好评,表带质量很好，颜色也漂亮，尺寸合适。,-,-,2021-06-02
555,我**p,表带尺寸: 适用：华为GT2/2E(46mm) 颜色分类: 赤霞橙-【黑扣款】,好评,表带质量不错，带上感觉挺舒适的，没有异味啥的，颜色漂亮,-,-,2021-06-08
556,t**0,表带尺寸: 适用：华为GT2/2E(46mm) 颜色分类: 赤霞橙-【黑扣款】,好评,很好安装，比原装的还漂亮，性价比超高，准备再挑款别的颜色,-,-,2021-05-28
557,t**5,表带尺寸: 适用：华为GT2/2E(46mm) 颜色分类: 赤霞橙-【黑扣款】,好评,价格比较实惠，款式好看，做工精细，个人很喜欢这款，还会回购的。,-,-,2021-06-22
558,t**4,表带尺寸: 适用：华为GT2/2E(46mm) 颜色分类: 赤霞橙-【黑扣款】,好评,表带收到了，很好看，当时还担心不透气.不过挺好戴起来很舒服。很喜欢这个颜色,-,-,2021-06-26
559,t**7,表带尺寸: 适用：荣耀手表2(46mm) 颜色分类: 赤霞橙-【黑扣款】,好评,尺寸刚好，做工精细，颜色很漂亮，焕然一新和新买的手表一样。,-,-,2021-06-26
560,t**6,表带尺寸: 适用：荣耀手表2(46mm) 颜色分类: 墨绿色-【黑扣款】,好评,表带收到了质量很好 颜色也非常喜欢 带着特别舒服 而且透气好，物流也很快 需要会再回购,-,-,2021-06-22
561,t**8,表带尺寸: 适用：华为GT2/2E(46mm) 颜色分类: 赤霞橙-【黑扣款】,好评,很实用～刚好做活动，价格便宜了很多，性价比超高，真的特别划算,-,-,2021-05-31
562,t**2,表带尺寸: 适用：华为GT2/2E(46mm) 颜色分类: 赤霞橙-【黑扣款】,好评,这款表带挺不错 和手表很合适 表带很宽 戴着很舒服 没有不适 感觉挺结实的 不怕水 放心戴,-,-,2021-06-26
563,z**0,表带尺寸: 适用：华为GT2/2E(46mm) 颜色分类: 赤霞橙-【黑扣款】,好评,这款表带挺不错，和手表很合适。表带很宽戴着很舒服，没有不适感觉。挺结实的，不怕水，放心戴。,-,-,2021-06-22
564,t**9,表带尺寸: 适用：华为GT2/2E(46mm) 颜色分类: 赤霞橙-【黑扣款】,好评,宝贝质量不错，很喜欢了。这个价格买到这么好的真的很好啦，物美价廉，很值得回购的一款哦，相信这家店铺没错的呢,-,-,2021-06-24
565,谈**闹,表带尺寸: 适用：华为GT2(42mm)/荣耀手表2(42mm) 颜色分类: 墨绿色-【银扣款】,好评,表带的质量很好，和原装的几乎一样，墨绿的颜色太正了，非常喜欢，值得购买,-,-,2021-06-05
566,t**7,表带尺寸: 适用：华为GT2/2E(46mm) 颜色分类: 赤霞橙-【黑扣款】,好评,产品设计新颖独特，采用优质材质制作而成，质量也不错。,-,-,2021-06-26
567,t**9,表带尺寸: 适用：华为GT2/2E(46mm) 颜色分类: 赤霞橙-【黑扣款】,好评,质量很好，带着舒服柔软透气，款式简约大方，好看，非常满意,-,-,2021-06-24
568,t**6,表带尺寸: 适用：荣耀手表2(46mm) 颜色分类: 运动黑-【黑扣款】,好评,表带收到了，做工质量都挺好，戴着舒服好看，满意好评。,-,-,2021-06-22
569,加**示,表带尺寸: 适用：华为GT2/2E(46mm) 颜色分类: 赤霞橙-【黑扣款】,好评,表带收到了，质量很好，颜色好看没有色差，比原装还好看，巴适，戴着很舒服以后需要还会再来，非常满意,-,-,2021-06-05
570,t**0,表带尺寸: 适用：华为GT2/2E(46mm) 颜色分类: 赤霞橙-【黑扣款】,好评,效果非常好，手感也超细腻柔软，颜色超喜欢超喜欢,-,-,2021-06-07
571,t**6,表带尺寸: 适用：华为GT2/2E(46mm) 颜色分类: 赤霞橙-【黑扣款】,好评,帮朋友买的，这家表带一如既往的好，长度，软硬度，都刚刚好,-,-,2021-06-22
572,t**0,表带尺寸: 适用：华为GT1(运动/时尚/活力款) 颜色分类: 中国红-【黑扣款】,好评,表带收到的   大小很合适  款式也挺好看   质量很好  很喜欢,-,-,2021-05-28
573,杨**贝,表带尺寸: 适用：华为GT2/2E(46mm) 颜色分类: 赤霞橙-【黑扣款】,好评,整体还不都不错，质量很好，戴着很舒服，比较透气不闷手，美观又大方。,-,-,2021-05-30
574,t**9,表带尺寸: 适用：华为GT2/2E(46mm) 颜色分类: 赤霞橙-【黑扣款】,好评,带上一点也不闷热，而且很精致，做工特别好，价格实惠！！！,-,-,2021-06-24
575,f**6,表带尺寸: 适用：华为GT1(运动/时尚/活力款) 颜色分类: 赤霞橙-【银扣款】,好评,很漂亮的一款 戴在手上也很透气 不会闷 而且价格也很便宜 很满意的一次购物呢,-,-,2021-05-30
576,1**春,表带尺寸: 适用：华为GT2(42mm)/荣耀手表2(42mm) 颜色分类: 赤霞橙-【黑扣款】,好评,是真皮的  价格合适  质量很好  值得购买,-,-,2021-06-05
577,芳**源,表带尺寸: 适用：华为GT2 Pro/ECG/保时捷版 颜色分类: 墨绿色-【黑扣款】,好评,手表收到了，精准，带起来挺好看的，防水耐磨，轻松贴合，很满意！,-,-,2021-05-29
578,刘**2,表带尺寸: 适用：华为GT2/2E(46mm) 颜色分类: 墨绿色-【黑扣款】,好评,表带质量很好，颜色好看，款式喜欢，戴着非常舒服合适，满意！,-,-,2021-05-28
579,安**子,表带尺寸: 适用：华为GT1(运动/时尚/活力款) 颜色分类: 赤霞橙-【黑扣款】,好评,精挑细选很久，最后决定买这一款，到货后果然没有让我失望，实物很漂亮，做工很精细，特别满意,-,-,2021-05-31
580,t**9,表带尺寸: 适用：华为GT2/2E(46mm) 颜色分类: 墨绿色-【黑扣款】,好评,表带已收到，质量挺好的，款式简单大方，颜色也好看，非常喜欢值得推荐,-,-,2021-06-24
581,t**3,表带尺寸: 适用：荣耀手表2(46mm) 颜色分类: 运动黑-【黑扣款】,好评,表带收到了，颜色和原来的差不多，戴着舒服透气不闷，安装容易很合适,-,-,2021-06-02
582,张**雇,表带尺寸: 适用：华为GT2/2E(46mm) 颜色分类: 赤霞橙-【黑扣款】,好评,手表带质量很好，戴上了觉得很漂亮，还有就是做工精致，款式时尚大气。,-,-,2021-05-29
583,金**记,表带尺寸: 适用：华为GT2/2E(46mm) 颜色分类: 赤霞橙-【黑扣款】,好评,潮流百搭，孔位精准，柔软韧性，轻盈透气，性价比高,-,-,2021-05-28
584,l**2,表带尺寸: 适用：华为GT2/2E(46mm) 颜色分类: 墨绿色-【黑扣款】,好评,质量非常好，尺寸标准非常适合，喜欢这款颜色，下次还会再来购买,-,-,2021-05-30
585,r**秋,表带尺寸: 适用：华为GT2/2E(46mm) 颜色分类: 墨绿色-【黑扣款】,好评,表带收到已安装好了，很好看，非常喜欢，是我喜欢的颜色，高端大气上档次,-,-,2021-06-03
586,彼**s,表带尺寸: 适用：华为GT1(运动/时尚/活力款) 颜色分类: 赤霞橙-【黑扣款】,好评,哈哈，像换了一块新表一样，和表毫无违和感，质量也很不错，戴上和原来一样舒服,-,-,2021-05-28
587,t**9,表带尺寸: 适用：华为GT2/2E(46mm) 颜色分类: 赤霞橙-【黑扣款】,好评,很漂亮的表带，带着很合适，尺寸很精确，做工细致，款式时尚大气，十分好的表带,-,-,2021-06-24
588,伴**4,表带尺寸: 适用：华为GT2/2E(46mm) 颜色分类: 赤霞橙-【黑扣款】,好评,手表带很软，比较亲肤，不会被磨到皮肤！很有档次，价钱实惠！颜色很正！卖家服务态度很好，推荐的颜色很满意,-,-,2021-06-07
589,a**乐,表带尺寸: 适用：华为GT2/2E(46mm) 颜色分类: 赤霞橙-【黑扣款】,好评,颜色很好看，性价比高，质量也不错，实物看起来非常好看，，戴起来很时尚潮流,-,-,2021-06-07
590,白**y,表带尺寸: 适用：华为GT2/2E(46mm) 颜色分类: 赤霞橙-【黑扣款】,好评,表带质量很好，和原版差不多，戴着舒服，没有什么异味，也没有色差,-,-,2021-05-31
591,漱**吗,表带尺寸: 适用：华为GT2/2E(46mm) 颜色分类: 墨绿色-【银扣款】,好评,稍微有点异味,-,-,2021-06-16
592,建**9,表带尺寸: 适用：荣耀手表2(46mm) 颜色分类: 赤霞橙-【黑扣款】,好评,手表很喜欢很漂亮，可以防水防汗也可以直接冲洗的很好。时间走的很准。表带贴合带着舒服。,-,-,2021-06-04
593,在**人,表带尺寸: 适用：华为GT1(运动/时尚/活力款) 颜色分类: 赤霞橙-【黑扣款】,好评,质量保证，款式新潮很有活力，价格不贵很划算，值得拥有,-,-,2021-06-04
594,媛**6,表带尺寸: 适用：华为GT2/2E(46mm) 颜色分类: 赤霞橙-【黑扣款】,好评,质量好，价格实惠，尺寸很合适，安上效果很不错，很满意,-,-,2021-06-01
595,讷**龙,表带尺寸: 适用：华为GT1(运动/时尚/活力款) 颜色分类: 运动黑-【黑扣款】,好评,东西收到了 ，手感不错，很喜欢,-,-,2021-05-28
596,t**5,表带尺寸: 适用：华为GT2/2E(46mm) 颜色分类: 赤霞橙-【黑扣款】,好评,与表身完美贴合，非常漂亮哦！材质硅胶的非常柔软戴起来舒服。,-,-,2021-06-22
597,t**5,表带尺寸: 适用：荣耀手表2(46mm) 颜色分类: 运动黑-【黑扣款】,好评,刚刚合适华为的手表，这个表带感觉带起来上了档次 ，大小刚刚合适 ，骑车的时候没手表，不方便看时间,-,-,2021-06-22
598,s**5,表带尺寸: 适用：华为GT2/2E(46mm) 颜色分类: 运动黑-【黑扣款】,好评,这次给弟弟买的，他看我的挺好看，就一直叫送他一个，这家质量很好，真的物超所值。,-,-,2021-06-05
599,t**7,表带尺寸: 适用：华为GT2/2E(46mm) 颜色分类: 墨绿色-【黑扣款】,好评,表带质量很好，带着很舒服透气，和原装的一样。,-,-,2021-06-26
600,民**一,表带尺寸: 适用：华为GT1(运动/时尚/活力款) 颜色分类: 运动黑-【黑扣款】,好评,表带戴着很舒服，手感蛮好。款式很好看，做工也很结实，挺不错的。价格方面也很实惠。,-,-,2021-06-02
601,徐**9,表带尺寸: 适用：华为GT1(运动/时尚/活力款) 颜色分类: 运动黑-【黑扣款】,好评,能全面的保护手表，很贴合，不用担心划伤手表，灵敏度也很不错，喜欢，体验感觉很不错,-,-,2021-06-02
602,江**5,表带尺寸: 适用：华为GT2/2E(46mm) 颜色分类: 赤霞橙-【黑扣款】,好评,质量挺好的，硅胶的质感戴着很舒服，和原装的质量一样，与描述一致,-,-,2021-06-08
603,爱**m,表带尺寸: 适用：华为GT2/2E(46mm) 颜色分类: 赤霞橙-【黑扣款】,好评,皮子还是可以的，比较软，没有味道，性价比还是挺高的，安装也简单，好评,-,-,2021-05-28
604,t**1,表带尺寸: 适用：华为GT2/2E(46mm) 颜色分类: 赤霞橙-【黑扣款】,好评,很漂亮，做工标准，没有色差，带的大气，介绍同事了,-,-,2021-06-25
605,b**5,表带尺寸: 适用：华为GT2/2E(46mm) 颜色分类: 墨绿色-【黑扣款】,好评,很好看，戴着舒服，不容易断，透气，整体来说很满意,-,-,2021-05-31
606,憧**思,表带尺寸: 适用：华为GT2/2E(46mm) 颜色分类: 墨绿色-【黑扣款】,好评,戴上显年轻，样式很不错，价格也实惠，值得购买,-,-,2021-06-05
607,t**7,表带尺寸: 适用：华为GT2 Pro/ECG/保时捷版 颜色分类: 赤霞橙-【黑扣款】,好评,很喜欢这款产品。外观精美。时尚大方。尺寸大小合适。推荐购买。赞赞赞赞赞赞赞。,-,-,2021-06-26
608,t**2,表带尺寸: 适用：华为GT2/2E(46mm) 颜色分类: 运动黑-【黑扣款】,好评,质量不错，与图片描述相符，价格也实惠，很满意,-,-,2021-06-26
609,t**4,表带尺寸: 适用：华为GT2/2E(46mm) 颜色分类: 赤霞橙-【银扣款】,好评,宝贝都货了，质量不错，安装简单快捷，表带颜色漂亮，物流很快，可以放心入手！,-,-,2021-06-26
610,可**4,表带尺寸: 适用：荣耀手表magic/dream 颜色分类: 墨绿色-【黑扣款】,好评,非常满意，比之前原装的戴着舒服,-,-,2021-05-31
