1488,嘟**力,表带尺寸: 适用：华为GT2/2E(46mm) 颜色分类: 运动黑-【黑扣款】,好评,手感戴起来不错。店铺还送了表盘膜，可以可以，下次还来，价格实惠。,-,-,2021-05-01
1489,t**7,表带尺寸: 适用：荣耀手表magic/dream 颜色分类: 流沙粉-【银扣款】,好评,质量好，店家还送了两个手表膜,-,-,2021-06-26
1490,小**7,表带尺寸: 适用：荣耀手表2(46mm) 颜色分类: 赤霞橙-【银扣款】,好评,此用户没有填写评价。,质量不错，物有所值,-,2021-05-17
1491,t**8,表带尺寸: 适用：华为GT1(运动/时尚/活力款) 颜色分类: 活力橙-【银扣款】,好评,描述不符，要么别印，印个错误的玩意是什么个意思。搞什么智商！,-,-,2021-05-19
1492,贤**8,表带尺寸: 适用：华为GT2/2E(46mm) 颜色分类: 墨绿色-【黑扣款】,好评,表带做工挺好的，基本上和原装的表带没啥区别，颜色好看，上手效果也不错,-,-,2021-05-06
1493,银**6,表带尺寸: 适用：华为GT1(运动/时尚/活力款) 颜色分类: 墨绿色-【银扣款】,好评,整体感觉还不错，做工可以不算差 非常配，作工也不错，物美价廉,-,-,2021-05-02
1494,陈**8,表带尺寸: 适用：华为GT2 Pro/ECG/保时捷版 颜色分类: 墨绿色-【黑扣款】,好评,硅胶弹性刚刚好，摸起来很舒服。颜色很漂亮、安装起来和原装的一样很吻合。￼￼,-,-,2021-04-29
1495,t**2,表带尺寸: 适用：华为GT2/2E(46mm) 颜色分类: 赤霞橙-【黑扣款】,好评,表带比原厂薄一点，但更软 不影响使用 价格便宜，和原装的没什么区别😊😊,-,-,2021-06-26
1496,t**2,表带尺寸: 适用：荣耀手表2(46mm) 颜色分类: 赤霞橙-【黑扣款】,好评,上手效果不错😊 带起来很舒服，价格也实惠，不错不错,-,-,2021-06-26
1497,少**巴,表带尺寸: 适用：华为GT2/2E(46mm) 颜色分类: 中国红-【银扣款】,好评,表带可以用完美来形容嘛！颜色一點没有色差，夏天露腕的时候带太漂亮了，厚度我特意拍照的，自己看看够不够用，老板还赠了两片钢化膜，价位也不贵，满意的一次购物！,-,-,2021-04-21
1498,邂**眼,表带尺寸: 适用：荣耀手表2(46mm) 颜色分类: 墨绿色-【银扣款】,好评,表带质感相当好，和原厂没什么区别。推荐购买，确实是良心价了，不用担心质量,-,-,2021-04-21
1499,t**0,表带尺寸: 适用：华为GT2/2E(46mm) 颜色分类: 赤霞橙-【黑扣款】,好评,挺喜欢这个颜色 简单大方，又买了一条时不时换换样，质量不错,-,-,2021-04-28
1500,虐**生,表带尺寸: 适用：华为GT2/2E(46mm) 颜色分类: 赤霞橙-【黑扣款】,好评,到货就装上，也不难装。质量不错，挺柔软的，不会卡手腕。没什么刺鼻的味道。颜色也鲜艳亮丽，价格也是好实惠。,-,-,2021-04-27
1501,谁**碉,表带尺寸: 适用：华为GT1(运动/时尚/活力款) 颜色分类: 运动黑-【黑扣款】,好评,质量和原厂差不多，价格这个便宜，而且还带两两个环！很贴心,-,-,2021-05-01
1502,t**8,表带尺寸: 适用：荣耀手表2(46mm) 颜色分类: 墨绿色-【黑扣款】,好评,总得来说还是可以 舒适度还是不错了。 颜色很好看,-,-,2021-04-21
1503,疯**4,表带尺寸: 适用：荣耀手表2(46mm) 颜色分类: 赤霞橙-【黑扣款】,好评,非常好看呢，[笑脸]跟手表很搭配的呢！显的手皮肤很白 价位合理棒棒的,-,-,2021-04-30
1504,t**5,表带尺寸: 适用：华为GT1(运动/时尚/活力款) 颜色分类: 午夜蓝-【银扣款】,好评,很好看 显白 这个价钱划算 赠送的表膜也好贴 不错不错,-,-,2021-06-22
1505,鑫**嘉,表带尺寸: 适用：华为GT2/2E(46mm) 颜色分类: 墨绿色-【黑扣款】,好评,质量很好,-,-,2021-05-27
1506,t**3,表带尺寸: 适用：华为GT2/2E(46mm) 颜色分类: 中国红-【黑扣款】,好评,硅胶表带，戴着柔软舒适，弹力大小也很合适，没有色差，尺寸大小合适，没有晃动，质量很好，价格便宜实惠！,-,-,2021-04-22
1507,吃**5,表带尺寸: 适用：华为GT2/2E(46mm) 颜色分类: 活力橙-【银扣款】,好评,收到货了。非常满意。物流很快。商家服务态度很好哦。非常满意的一次购物。下次还会光临的。,-,-,2021-05-15
1508,b**8,表带尺寸: 适用：华为GT2/2E(46mm) 颜色分类: 运动黑-【银扣款】,好评,表带很不错，厚实无异味，应该能用很久 安装简单,-,-,2021-04-26
1509,梦**周,表带尺寸: 适用：华为GT2/2E(46mm) 颜色分类: 午夜蓝-【银扣款】,好评,收到货，第一时间拆包装，感觉质量还是比较好的，与卖家描述的还是一致的，非常满意，发货速度比较快，物流公司服务态度很好，运送速度很快,-,-,2021-04-17
1510,t**3,表带尺寸: 适用：华为GT2 Pro/ECG/保时捷版 颜色分类: 运动黑-【黑扣款】,好评,表带质量不错，尺寸都配得上，款式跟手表相符，易装上，价格实惠，很愉快的一次购物,-,-,2021-04-23
1511,分**密,表带尺寸: 适用：华为GT2 Pro/ECG/保时捷版 颜色分类: 运动黑-【黑扣款】,好评,此用户没有填写评价。,到了，这个表带是卡扣设计拆解很方便，而且戴在手上没有皮肤过敏的现象，材质也没有异味，安全环保，我戴着刚好合适，质感又好非常喜欢,-,2021-04-19
1512,t**4,表带尺寸: 适用：华为GT2(42mm)/荣耀手表2(42mm) 颜色分类: 墨绿色-【黑扣款】,好评,表带可以用完美来形容，颜色一点没有色差，夏天露手腕带太漂亮了，厚度我特别满意，自己看看够不够用？老板还赠了两片钢化膜价位也不贵，物美价廉，满意的一次购物,-,-,2021-06-26
1513,我**淡,表带尺寸: 适用：华为GT2/2E(46mm) 颜色分类: 墨绿色-【黑扣款】,好评,很不错的一个硅胶表带。物美价廉，好看易装，设计的也很巧妙,-,-,2021-05-05
1514,y**2,表带尺寸: 适用：华为GT2/2E(46mm) 颜色分类: 活力橙-【黑扣款】,好评,给爱表换了个活力橙表带，瞬间美美哒，晒一下我6元买的太空人表盘,-,-,2021-05-04
1515,t**4,表带尺寸: 适用：华为GT2/2E(46mm) 颜色分类: 中国红-【黑扣款】,好评,质量不错，和原装的感觉一样。买2个颜色，换着戴,-,-,2021-06-26
1516,我**9,表带尺寸: 适用：华为GT2/2E(46mm) 颜色分类: 墨绿色-【黑扣款】,好评,摸起来手感滑润，非常舒服 色泽与图片描述一致 习惯好评吧,-,-,2021-05-03
1517,t**6,表带尺寸: 适用：华为GT2 Pro/ECG/保时捷版 颜色分类: 【双色款】-黑绿色,好评,很软 质地很厚实 不比原装的差 扣的也很结实 完全没有色差 会回购,-,-,2021-06-22
1518,t**7,表带尺寸: 适用：荣耀手表2(46mm) 颜色分类: 墨绿色-【黑扣款】,好评,表带柔软舒适，透气好，不会有闷的感觉，颜色很帅气，五金质量厚实不易脱落，和手表风格很搭，很有气场，非常喜欢,-,-,2021-06-26
1519,t**8,表带尺寸: 适用：华为GT2/2E(46mm) 颜色分类: 墨绿色-【银扣款】,好评,宝贝收到了，是正品，包装非常精致，材质真心不错，价格实惠，买的开心值得,-,-,2021-05-08
1520,t**5,表带尺寸: 适用：华为GT2/2E(46mm) 颜色分类: 赤霞橙-【黑扣款】,好评,表带很好比原来的拆装方便 也不掉色，换带子操作也很简单,-,-,2021-06-22
1521,t**8,表带尺寸: 适用：华为GT1(运动/时尚/活力款) 颜色分类: 运动黑-【银扣款】,好评,柔软舒适，做工扎实，安装简单，物超所值,-,-,2021-05-08
1522,a**n,表带尺寸: 适用：华为GT2/2E(46mm) 颜色分类: 赤霞橙-【黑扣款】,好评,表带换上正合适，相当的不错，和原装没有什么区别！,-,-,2021-04-30
1523,即**芯,表带尺寸: 适用：华为GT2/2E(46mm) 颜色分类: 墨绿色-【黑扣款】,好评,外观设计漂亮，皮质不错，柔软舒适，佩戴效果很好，不会勒，安装也简单，跟表很搭，整体来说很满意,-,-,2021-05-08
1524,喝**点,表带尺寸: 适用：华为GT2/2E(46mm) 颜色分类: 赤霞橙-【黑扣款】,好评,质量挺好的，很有质感，也合用 价格实惠哦,-,-,2021-04-27
1525,t**4,表带尺寸: 适用：荣耀手表2(46mm) 颜色分类: 赤霞橙-【黑扣款】,好评,非常满意么，表带很好看 佩戴舒服，透气 手感也很好,-,-,2021-06-26
1526,忧**0,表带尺寸: 适用：华为GT2/2E(46mm) 颜色分类: 墨绿色-【黑扣款】,好评,整体还行！比原装的偏软。（黑色的为原装）,-,-,2021-04-25
1527,我**宝,表带尺寸: 适用：荣耀手表2(46mm) 颜色分类: 墨绿色-【银扣款】,好评,戴着和原厂一样舒服，赞👍 很好用，脏了水一冲就好了,-,-,2021-04-27
1528,w**3,表带尺寸: 适用：华为GT2/2E(46mm) 颜色分类: 运动黑-【黑扣款】,好评,质量不错哦！材料挺柔软，大家值得购买哦！,-,-,2021-05-03
1529,2**号,表带尺寸: 适用：华为GT2/2E(46mm) 颜色分类: 运动黑-【黑扣款】,好评,质感不错，已经安装使用大小合适，价格便宜，性价比超高，喜欢黑色高端大气上档次，值得购买,-,-,2021-05-01
1530,故**7,表带尺寸: 自量接口（20mm）【不送膜】 颜色分类: 星空灰-【银扣款】,好评,又买两条换着戴，真的不错，表带柔软舒适，颜色也正！,-,-,2021-05-05
1531,t**2,表带尺寸: 适用：荣耀手表2(46mm) 颜色分类: 赤霞橙-【黑扣款】,好评,收到货了，我很喜欢,-,-,2021-06-26
1532,a**w,表带尺寸: 适用：华为GT2/2E(46mm) 颜色分类: 中国红-【黑扣款】,好评,就是我想要的大红的颜色，美美嗒，店铺收藏了。,-,-,2021-04-29
1533,t**0,表带尺寸: 适用：华为GT2/2E(46mm) 颜色分类: 运动黑-【黑扣款】,好评,这个表达还真不错，物美价廉不说，性价比还很高，戴着很舒服，没有廉价的感觉，非常非常合适。以后买表带儿我就选他家,-,-,2021-05-02
1534,c**6,表带尺寸: 适用：华为GT2(42mm)/荣耀手表2(42mm) 颜色分类: 运动黑-【黑扣款】,好评,表带质量也是相当不错的，这个价位值了🙂.,-,-,2021-04-26
1535,z**8,表带尺寸: 适用：华为GT2 Pro/ECG/保时捷版 颜色分类: 赤霞橙-【银扣款】,好评,手感真的很好，感觉比原装的还要舒服。 质量也是很不错的,-,-,2021-04-27
1536,h**i,表带尺寸: 适用：华为GT2/2E(46mm) 颜色分类: 墨绿色-【黑扣款】,好评,跟描述一致，表盘和表带的拼接处也很紧致不容易松动🌴表带很舒服唷,-,-,2021-05-02
1537,f**9,表带尺寸: 适用：华为GT2/2E(46mm) 颜色分类: 墨绿色-【黑扣款】,好评,真的好好看。带了一个星期了。也没有过敏现象关键是实惠男女皆可~材质很透气,-,-,2021-05-06
1538,c**a,表带尺寸: 适用：华为GT2/2E(46mm) 颜色分类: 运动黑-【银扣款】,好评,质量真心好的表带，硅胶材质佩戴特别舒服，透气性也好，没有异味，价格还实惠，非常满意。,-,-,2021-04-28
1539,t**7,表带尺寸: 适用：华为GT1(运动/时尚/活力款) 颜色分类: 墨绿色-【黑扣款】,好评,此用户没有填写评价。,这个硅胶表带质量不错！有点弹力，边缘光滑，带起来很舒服！卡扣很好用！颜色漂亮！,-,2021-06-26
1540,毛**5,表带尺寸: 适用：华为GT2/2E(46mm) 颜色分类: 赤霞橙-【黑扣款】,好评,表带质量很好，值得拥有！,-,-,2021-04-24
1541,h**c,表带尺寸: 适用：华为GT2/2E(46mm) 颜色分类: 墨绿色-【黑扣款】,好评,表带质量不错，硅胶材质柔软尺寸合适，颜色正佩戴手表漂亮，价格还便宜😊,-,-,2021-04-25
1542,t**6,表带尺寸: 适用：华为GT2/2E(46mm) 颜色分类: 墨绿色-【黑扣款】,好评,之前的表带断了，想着买个试试，谁知道拿到后一看直接就换上了，戴上试了很不错，值得购买,-,-,2021-06-22
1543,荣**2,表带尺寸: 适用：荣耀手表2(46mm) 颜色分类: 墨绿色-【黑扣款】,好评,颜色很正，发货挺快，设计很大方，收到包装也可以，这个价格还这么实惠，相当满意，喜欢的朋友赶紧下手,-,-,2021-04-21
1544,t**6,表带尺寸: 适用：华为GT2/2E(46mm) 颜色分类: 墨绿色-【黑扣款】,好评,包装很严实没有损坏，带上很舒服，表带都是用硅胶材质做的，也不会过敏，无异味，触感非常柔软，真心不错哟。,-,-,2021-06-22
1545,t**0,表带尺寸: 适用：华为GT2/2E(46mm) 颜色分类: 机甲绿-【银扣款】,好评,这款表带收到了！真心质量不错！戴着也不勒手！防水的也不怕打湿！价格实惠！,-,-,2021-04-24
1546,郝**1,表带尺寸: 适用：华为GT2 Pro/ECG/保时捷版 颜色分类: 赤霞橙-【黑扣款】,好评,喜欢 还便宜 质量非常好，和原装的没什么区别,-,-,2021-04-26
1547,t**3,表带尺寸: 适用：华为GT2/2E(46mm) 颜色分类: 运动黑-【银扣款】,好评,黑色的不张扬显稳重，硅胶的不会很硬，戴上舒服，尺寸也合适,-,-,2021-04-19
1548,格**5,表带尺寸: 适用：华为GT2/2E(46mm) 颜色分类: 墨绿色-【黑扣款】,好评,表带很漂亮，质量也挺不错的，上手体验效果很棒，完美贴合我的华为手表，价格也实惠，爱了爱了，推荐,-,-,2021-04-29
1549,子**哥,表带尺寸: 自量接口(22mm)【不送膜】 颜色分类: 运动黑-【黑扣款】,好评,性价比全网第一，绝对可以，质感不错,-,-,2021-04-29
1550,f**4,表带尺寸: 适用：华为GT2/2E(46mm) 颜色分类: 赤霞橙-【黑扣款】,好评,有质感 质量非常好，价钱也很合理,-,-,2021-05-02
1551,t**7,表带尺寸: 适用：华为GT2/2E(46mm) 颜色分类: 赤霞橙-【黑扣款】,好评,很好 很喜欢 早知道买两个了 和原装的一样,-,-,2021-06-26
1552,乱**杷,表带尺寸: 适用：华为GT1(运动/时尚/活力款) 颜色分类: 墨绿色-【黑扣款】,好评,腊鸡玩意，收到就掉漆了，店家还说掉漆很正常,-,-,2021-05-21
1553,连**7,表带尺寸: 适用：华为GT2/2E(46mm) 颜色分类: 赤霞橙-【黑扣款】,好评,表带真心不错，安装简单，不勒手，手感柔软舒适，和正版的一样，无瑕疵，非常满意，还会再来光顾！,-,-,2021-05-08
1554,t**4,表带尺寸: 适用：华为GT2/2E(46mm) 颜色分类: 运动黑-【黑扣款】,好评,表带质感非常舒服，卖家还送了两张钢化膜和一个表扣非常贴心,-,-,2021-06-26
1555,t**2,表带尺寸: 适用：华为GT2/2E(46mm) 颜色分类: 运动黑-【银扣款】,好评,非常好，超乎预期的好，值得大家购买，很愉快的一次购物，推荐推荐推荐,-,-,2021-06-26
1556,奇**儿,表带尺寸: 适用：华为GT2/2E(46mm) 颜色分类: 赤霞橙-【黑扣款】,好评,店家服务态度超级好，发货速度快，值得购买！,-,-,2021-05-25
1557,x**o,表带尺寸: 适用：华为GT2/2E(46mm) 颜色分类: 活力橙-【黑扣款】,好评,做工凑合。可惜，表带上打的手表的英文单词，那几个字母，让人哭笑不得！老板，你这代工厂也太山寨了吧。康师傅和庚帅博的区别！,WCATH GT2，  watch，  C强行插队，挤到大哥A的前面！ 我们不要面子的吗？今后咋混🥲,-,2021-05-20
1558,t**7,表带尺寸: 适用：华为GT2/2E(46mm) 颜色分类: 赤霞橙-【黑扣款】,好评,实物的质量真的很不错，做工精细表带非常的舒适，就连卡扣做得都很精致很实用性价比很高的一款颜色也非常的漂亮。,-,-,2021-06-26
1559,硕**0,表带尺寸: 适用：华为GT2/2E(46mm) 颜色分类: 赤霞橙-【黑扣款】,好评,很好呢质量好 尺寸合适 手感质感都没得说,-,-,2021-05-01
1560,t**6,表带尺寸: 适用：华为GT2/2E(46mm) 颜色分类: 运动黑-【黑扣款】,好评,硅胶材质够柔软，没有异味，型号也匹配，做工精细，感觉比原来的更耐看,-,-,2021-06-22
1561,创**2,表带尺寸: 适用：华为GT2/2E(46mm) 颜色分类: 赤霞橙-【黑扣款】,好评,手表款型好看，硅胶表带柔软戴上舒服，放水效果不错,-,-,2021-05-06
1562,t**3,表带尺寸: 适用：华为GT2/2E(46mm) 颜色分类: 运动黑-【黑扣款】,好评,这个表带戴着很舒服，透气性好，一点也不闷，外观看起来精致大气，尺寸合适,-,-,2021-04-19
1563,t**1,表带尺寸: 适用：华为GT2 Pro/ECG/保时捷版 颜色分类: 赤霞橙-【黑扣款】,好评,表带可以用完美来形容嘛!颜色一点没有色差，夏天露腕的时候带太漂亮了，自价位也不贵，满意的一次购物!,-,-,2021-06-25
1564,t**7,表带尺寸: 适用：华为GT2/2E(46mm) 颜色分类: 中国红-【黑扣款】,好评,表带收到马上就装上了，做工精细，颜色很正，比图片好看，轻柔舒适，很棒的硅胶表带，喜欢！,-,-,2021-06-26
1565,t**5,表带尺寸: 适用：荣耀手表2(46mm) 颜色分类: 赤霞橙-【黑扣款】,好评,表带硅胶的质量非常好，无不适感觉！款式也非常漂亮，和机身完美搭配，非常时尚潮流哦！,-,-,2021-06-22
1566,h**e,表带尺寸: 适用：华为GT2/2E(46mm) 颜色分类: 墨绿色-【黑扣款】,好评,货物收到，物流很快，很给力，建议大家购买，满分好评！,-,-,2021-05-25
1567,w**莲,表带尺寸: 适用：华为Watch2(无膜) 颜色分类: 赤霞橙-【黑扣款】,好评,带着舒服比想象中要好的多 质量也不错 物流也很给力,-,-,2021-04-26
1568,超**5,表带尺寸: 适用：华为GT2 Pro/ECG/保时捷版 颜色分类: 墨绿色-【黑扣款】,好评,摸着蛮舒服的  硅胶材料只好特别好 颜色也漂亮  与表纹丝合缝好安装  性价比杠杠的,-,-,2021-05-03
1569,t**6,表带尺寸: 适用：华为GT2/2E(46mm) 颜色分类: 赤霞橙-【黑扣款】,好评,买了红色，特别喜欢，颜色很正搭什么颜色衣服都好看！硅胶的戴着舒服，防水好打理,-,-,2021-06-22
1570,t**1,表带尺寸: 适用：华为GT2 Pro/ECG/保时捷版 颜色分类: 墨绿色-【黑扣款】,好评,表带质量挺好的，型号也合适，颜色特别喜欢，今年很流行的绿色，特别洋气，好喜欢,-,-,2021-06-25
1571,丫**贝,表带尺寸: 适用：华为GT2/2E(46mm) 颜色分类: 墨绿色-【黑扣款】,好评,表带收到，带了好几天啦，和原装的没什么区别，非常棒，做工也非常精致，看起来很有质感，带上去看很提气质,-,-,2021-04-27
1572,t**9,表带尺寸: 适用：华为GT2 Pro/ECG/保时捷版 颜色分类: 墨绿色-【银扣款】,好评,尺寸正好 没有色差就喜欢这个颜色 硅胶材质的不过敏不怕水 很好 满意推荐给大家👍,-,-,2021-06-24
1573,落**t,表带尺寸: 适用：华为GT2/2E(46mm) 颜色分类: 中国红-【黑扣款】,好评,宝贝收到了，好漂亮的表带。材质也不硬，软软的,-,-,2021-04-22
1574,t**3,表带尺寸: 适用：华为GT2 Pro/ECG/保时捷版 颜色分类: 薄荷绿-【银扣款】,好评,手表已收到，大小尺码正合适，硅胶表带质量非常好，样式也好看，价格还不贵。,-,-,2021-04-24
1575,火**x,表带尺寸: 适用：华为GT2 Pro/ECG/保时捷版 颜色分类: 运动黑-【银扣款】,好评,这个蛮好的 戴手上手感好 就算我流汗了也不粘皮肤 价格也合适 买到算赚到,-,-,2021-04-21
1576,花**8,表带尺寸: 适用：华为GT2/2E(46mm) 颜色分类: 赤霞橙-【黑扣款】,好评,表带非常柔软舒适，价廉物美 想不到那么快就到了,-,-,2021-04-27
1577,钱**￥,表带尺寸: 适用：华为GT2 Pro/ECG/保时捷版 颜色分类: 墨绿色-【银扣款】,好评,表带材质很好，尺寸合适，颜色很正，高档色，安装简单方便，款式好搭配，性价比高！,-,-,2021-04-17
1578,周**升,表带尺寸: 适用：华为GT2(42mm)/荣耀手表2(42mm) 颜色分类: 赤霞橙-【黑扣款】,好评,手表带是硅胶壳的质量真的很好，带上很舒适，外观好看，上等次，价格也实惠，,-,-,2021-04-25
1579,t**6,表带尺寸: 自量接口(22mm)【不送膜】 颜色分类: 运动黑-【银扣款】,好评,表带带起来真的很舒服 而且看起来很好看,-,-,2021-06-22
1580,t**6,表带尺寸: 适用：华为GT2/2E(46mm) 颜色分类: 赤霞橙-【黑扣款】,好评,质量蛮好的表带，液态硅胶材质，佩戴特别舒服，无色差无异味，价格还实惠，非常满意。,-,-,2021-06-22
1581,容**风,表带尺寸: 适用：华为GT2 Pro/ECG/保时捷版 颜色分类: 赤霞橙-【黑扣款】,好评,材质好，性价比高，表带很好大小合适，拿回来立即装上去，颜色匹配，服务态度很好，真的很贴心，满意的一次购物,-,-,2021-05-04
1582,t**6,表带尺寸: 适用：华为GT2/2E(46mm) 颜色分类: 墨绿色-【银扣款】,好评,东西很不错，还挺合适 表带很软。,-,-,2021-06-22
1583,t**2,表带尺寸: 适用：华为GT2/2E(46mm) 颜色分类: 墨绿色-【黑扣款】,好评,第二次购买了，这次是替邻居代买的，上次收快递正好被她看到，她看到我买的质量这么好还这么实惠，正好她家女儿的表带需要换了。,-,-,2021-06-26
1584,c**7,表带尺寸: 适用：华为GT2 Pro/ECG/保时捷版 颜色分类: 活力橙-【银扣款】,好评,表带质量很好，硅胶很有弹力，颜色漂亮，戴上既舒服又漂亮,-,-,2021-04-25
1585,扬**来,表带尺寸: 适用：华为GT2/2E(46mm) 颜色分类: 墨绿色-【银扣款】,好评,宝贝非常好我非常满意 带上去非常显年轻 科技感十足 很高级的样子特别是绿色 很深沉稳重,-,-,2021-04-20
1586,分**滩,表带尺寸: 适用：华为GT2(42mm)/荣耀手表2(42mm) 颜色分类: 运动黑-【黑扣款】,好评,环保硅胶，无异味。弹性柔韧，稳固贴合。很好。,-,-,2021-05-06
1587,邢**桢,表带尺寸: 适用：华为GT2/2E(46mm) 颜色分类: 中国红-【黑扣款】,好评,非常好 跟卖家描述的一样好看 建议购买,-,-,2021-05-01
1588,安**0,表带尺寸: 适用：华为GT2 Pro/ECG/保时捷版 颜色分类: 赤霞橙-【黑扣款】,好评,表带质量很不错，颜色没有色差，大小合适，款式也很时尚，推荐购买,-,-,2021-05-06
1589,烫**1,表带尺寸: 适用：华为GT2/2E(46mm) 颜色分类: 活力橙-【银扣款】,好评,十多块钱可以了，带着玩呗，挺好，还送了两个膜,-,-,2021-04-21
1590,t**5,表带尺寸: 适用：华为GT2/2E(46mm) 颜色分类: 赤霞橙-【黑扣款】,好评,质量棒棒哒！尺寸合适  颜色很正  价格还特实惠,-,-,2021-06-22
1591,董**0,表带尺寸: 适用：华为GT1(运动/时尚/活力款) 颜色分类: 墨绿色-【银扣款】,好评,客服有耐心，宝贝经济实惠，还送了保护屏幕的钢化膜，表带材质挺软的，就是不知道耐用不，先好评,-,-,2021-05-04
1592,阿**4,表带尺寸: 适用：华为GT2 Pro/ECG/保时捷版 颜色分类: 【双色款】-黑灰色,好评,表带质量不错，回来就安上啦，大小尺寸刚刚好，没有色差，和图片还有客服介绍的无二样，价格也很给力，比实体店优惠很多，超级划算呦,-,-,2021-05-01
1593,k**6,表带尺寸: 适用：华为GT2 Pro/ECG/保时捷版 颜色分类: 赤霞橙-【黑扣款】,好评,价格实惠，质量很不错，颜色很漂亮，外观大气，对于我这爱表的人，真心感觉这款性价比很高,-,-,2021-04-25
1594,依**3,表带尺寸: 适用：华为GT2/2E(46mm) 颜色分类: 赤霞橙-【黑扣款】,好评,价格便宜 物流很快蛮好的 表带质量不错,-,-,2021-04-29
1595,t**7,表带尺寸: 适用：华为GT2 Pro/ECG/保时捷版 颜色分类: 赤霞橙-【黑扣款】,好评,表带柔软弹性不变形，轻盈透气，防水防汗，配戴舒适,-,-,2021-06-26
1596,坏**妹,表带尺寸: 适用：华为GT2 Pro/ECG/保时捷版 颜色分类: 赤霞橙-【黑扣款】,好评,红色真的超级正，太好看了，没有色差，硅胶的防水，很好清洗干净,-,-,2021-04-18
1597,努**珍,表带尺寸: 自量接口（20mm）【不送膜】 颜色分类: 墨绿色-【黑扣款】,好评,表带包装不错，试戴手感不错，挺舒服的，一点也不硬，扣孔多好可以调节，喜欢得很，很衬我的肤色呀！,-,-,2021-04-22
1598,f**7,表带尺寸: 适用：华为GT2 Pro/ECG/保时捷版 颜色分类: 星空灰-【黑扣款】,好评,表带非常好 可以推荐朋友过来 物流很快,-,-,2021-05-03
1599,t**0,表带尺寸: 适用：华为GT2 Pro/ECG/保时捷版 颜色分类: 午夜蓝-【黑扣款】,好评,一拿到就迫不及待的打开，颜色漂亮，硅胶材质很好，不怕水不怕折，准备再给朋友买一个,-,-,2021-04-19
1600,t**5,表带尺寸: 适用：荣耀手表2(46mm) 颜色分类: 运动黑-【黑扣款】,好评,硅胶材质，耐磨佩戴着好看，亲肤舒服，和我的华为gt2完美搭配，好评(o^^o),-,-,2021-06-22
1601,l**6,表带尺寸: 适用：荣耀手表2(46mm) 颜色分类: 墨绿色-【黑扣款】,好评,物流还是挺给力的，包装也完好，表带柔软，颜色很正和图片一样，很好看，这个颜色显白还百搭，性价比高，推荐,-,-,2021-05-06
1602,c**d,表带尺寸: 适用：华为GT2/2E(46mm) 颜色分类: 赤霞橙-【黑扣款】,好评,回购他们好多次了，质量很好，看起来很有质感，和手表的尺寸大小很贴合，戴上去手不会出汗，很透气，喜欢💕,-,-,2021-05-08
1603,t**3,表带尺寸: 适用：华为GT2 Pro/ECG/保时捷版 颜色分类: 运动黑-【黑扣款】,好评,这个太靠谱了，方向盘包裹的很好，翻毛皮材质很舒服，内壁防护的也很好，不担心刮伤方向盘，简直是手汗的神器啊！,-,-,2021-04-22
