752,t**4,颜色分类: 5叶黑色-遥控款,好评,质量很好，风力也很好，准备再买一把,-,-,2021-06-08
753,知**扬,颜色分类: 5叶黑色-遥控款,好评,高端大气上档次，功能多而且遥控器操作方便，特别是有静音功能耶，真心值得拥有哦！ ,-,-,2021-06-17
754,二**0,颜色分类: 5叶黑色-遥控款,好评,宝贝收到了，还赠送了工具，静音模式很好卖家态度也特别好祝生意兴隆,-,-,2021-06-24
755,y**0,颜色分类: 5叶黑色-遥控款,好评,声音很小，风量很大，很愉快的一次购物 ,-,-,2021-06-24
756,守**6,颜色分类: 5叶黑色-遥控款,好评,风扇用了还不错，以后还是买美的的大牌子就是不一样 ,-,-,2021-06-20
757,涅**8,颜色分类: 5叶黑色-遥控款,好评,质量非常好，做工精细，省电静音,-,-,2021-06-23
758,t**7,颜色分类: 5叶黑色-遥控款,好评,此用户没有填写评价。,已经用了一段时间风力很大很静音,-,2021-06-20
759,z**6,颜色分类: 5叶黑色-遥控款,好评,电风扇收到试用了很好，外观好看，声音很小，值得购买 ,-,-,2021-06-21
760,t**9,颜色分类: 5叶黑色-遥控款,好评,电扇质量很好，跟实体店买的一样，物流很快，值得购买。,-,-,2021-06-15
761,青**色,颜色分类: 5叶黑色-遥控款,好评,风力很大，非常静音，还有静音模式，遥控器也好操作，老人用着也方便，5叶风扇风柔和，美的小家电还是很不错的，老公也说好,-,-,2021-06-18
762,t**6,颜色分类: 5叶黑色-遥控款,好评,宝贝收到了，还没得安装，习惯五星好评,-,-,2021-06-23
763,t**9,颜色分类: 5叶黑色-遥控款,好评,安装简单，还满意，质量也很好。,-,-,2021-06-25
764,梦**蓝,颜色分类: 5叶黑色-遥控款,好评,风扇特别漂亮，高档，孩子最喜欢的是有遥控，用起来方便。静音效果不错哟！,-,-,2021-06-18
765,x**8,颜色分类: 5叶黑色-遥控款,好评,几年前买了一台，这次活动又买了一台，一如既往的好,-,-,2021-06-24
766,叶**8,颜色分类: 5叶黑色-遥控款,好评,风扇颜值高，质量很不错 ,-,-,2021-06-14
767,苹**兰,颜色分类: 七叶白色-【机械款】,好评,大家放心买，美的是大品牌，没声音，风力很大,-,-,2021-06-24
768,当**敌,颜色分类: 5叶黑色-遥控款,好评,美的风扇非常好没噪音，我喜欢的品牌。,-,-,2021-06-20
769,刘**嘿,颜色分类: 5叶黑色-遥控款,好评,黑色很精致，爸妈说使用效果特别好，很喜欢,-,-,2021-06-14
770,t**5,颜色分类: 5叶黑色-遥控款,好评,产品风还是挺凉的 舒服,-,-,2021-06-15
771,小**2,颜色分类: 5叶黑色-遥控款,好评,宝贝已收到，马上安装好了。外观漂亮大气，声音小、风量分档大小有别，真好！,-,-,2021-06-18
772,龚**8,颜色分类: 5叶黑色-遥控款,好评,当时买的时候还在犹豫价格，买来之后一点都不后悔，而且物流还快，可以入手。,-,-,2021-06-24
773,电**关,颜色分类: 5叶黑色-遥控款,好评,外观材质：二次购买了没有什么声音！邻居看到了叫推荐给她了！！！ ,-,-,2021-06-22
774,t**3,颜色分类: 5叶黑色-遥控款,好评,安装简单 外观简介大方 喜欢这种传统造型 因为以后清理方便 声音可以接受 总体不错 信任这个品牌 ,-,-,2021-06-14
775,t**7,颜色分类: 5叶黑色-遥控款,好评,风很大，还可以遥控，爱了爱了(⑉°з°)-♡ ,-,-,2021-06-20
776,金**2,颜色分类: 5叶黑色-遥控款,好评,风扇不错，风大。遥控操作使用方便。 ,-,-,2021-06-21
777,t**0,颜色分类: 5叶黑色-遥控款,好评,在外出差，一直没空，回来赶紧来评价。风扇确实不错，听朋友建议第一次买遥控版的，果然方便。风速风类选择多，定时时间也比机械版的多，强劲风适合放在客厅吹，柔和风晚上睡觉很好，静音设计赞👍黑色外观漂亮，安装简单，能耗一级。 ,-,-,2021-06-09
778,t**3,颜色分类: 5叶黑色-遥控款,好评,电扇非常好用，风大无燥音，值得购买，值得信任,-,-,2021-06-14
779,陈**2,颜色分类: 5叶黑色-遥控款,好评,第二次购买，质量不错 ,-,-,2021-06-19
780,朱**9,颜色分类: 5叶黑色-遥控款,好评,风扇很好，静音风大，选风扇还是美的牌子的好 ,-,-,2021-06-25
781,我**噜,颜色分类: 5叶黑色-遥控款,好评,质量很好，遥控也很灵敏，使用感很好 ,-,-,2021-06-21
782,t**6,颜色分类: 5叶黑色-遥控款,好评,东西收到质量很好，安装简单一下子就弄好了，试了一下风蛮大哦，好喜欢下次需要再买。,-,-,2021-06-23
783,嘉**贝,颜色分类: 5叶黑色-遥控款,好评,大品牌，质量好风大，值得购买,-,-,2021-06-15
784,t**9,颜色分类: 5叶黑色-遥控款,好评,这款风扇真的很好，价格也不是很贵，按装简单方便，有遥控和手档键，满足了各种需求，静音效果也非常好，特别是小妹妹售后服务特别周到，有问题及时回复，特赞！ ,-,-,2021-06-19
785,若**爹,颜色分类: 5叶黑色-遥控款,好评,质量真心不错,-,-,2021-06-20
786,着**9,颜色分类: 5叶黑色-遥控款,好评,收货快，前两年家里买过，现在给婆婆买的，安装好了，已经用上 ,-,-,2021-06-14
787,d**g,颜色分类: 5叶黑色-遥控款,好评,一直信赖大品牌，好用，舒适,-,-,2021-06-21
788,f**1,颜色分类: 5叶黑色-遥控款,好评,外观材质：黑色很耐看 吹风感受：低档风很轻柔没有噪音 到手就安装了，很简单不需要工具就可以安装好  ,-,-,2021-06-18
789,t**8,颜色分类: 5叶黑色-遥控款,好评,质量很好，好凉快，美的牌不错的。 ,-,-,2021-06-20
790,凯**2,颜色分类: 5叶黑色-遥控款,好评,颜值高 风声小 吹的很舒服 值得推荐！ ,-,-,2021-06-22
791,威**1,颜色分类: 5叶黑色-遥控款,好评,美的的品牌就是不一样非常好，带遥控不用来回跑，风量挺好，没有杂声，值得购买值得信赖！,-,-,2021-06-11
792,轻**7,颜色分类: 5叶黑色-遥控款,好评,吹风感受：静音挺好。 档位调节：按键敏感好操作 外观材质：外观很大气，不错👍高大上档次，而且还便宜，外观精美 风力贼大 效果贼好 超静音风扇 风叶大，颜值高，出风柔和，低嗓音，能耗低。带遥控智能款的特别满意，适合睡眠。享一整晚安睡。下次需要再来光顾,-,-,2021-06-19
793,z**a,颜色分类: 5叶黑色-遥控款,好评,风扇真的很给力，去年买了两个，今天又买了一个，不但外观漂亮，直动手动都很方便并且还可以定时，多功能的，静音风一点声音都没有，真的超喜欢，给五星好评！ ,-,-,2021-06-17
794,白**内,颜色分类: 5叶黑色-遥控款,好评,耗电量：一级效能，挺省电的！ 档位调节：有遥控器，和按键，很方便！ 外观材质：外观我很喜欢！黑色很大气！也耐脏  吹风感受：风量可根据需求调节！ ,-,-,2021-06-21
795,徐**兴,颜色分类: 5叶黑色-遥控款,好评,已经装了用上了，效果不错，还带遥控的 ,-,-,2021-06-20
796,l**1,颜色分类: 5叶黑色-遥控款,好评,风扇不错，质量很好？声音小。值得购买,-,-,2021-06-23
797,王**好,颜色分类: 5叶黑色-遥控款,好评,第二次购买。风扇三挡风挺大的。物流挺快，很满意一次购物。,-,-,2021-06-20
798,h**8,颜色分类: 5叶黑色-遥控款,好评,款式新颖，用料讲究，功能多，风力强。,-,-,2021-06-19
799,t**0,颜色分类: 5叶黑色-遥控款,好评,超好，而且静音,-,-,2021-06-18
800,忆**缘,颜色分类: 5叶黑色-遥控款,好评,外观材质：很实用 ,-,-,2021-06-24
801,海**3,颜色分类: 5叶黑色-遥控款,好评,非常好用，物美价廉 ，静音效果很好 ，快递 又快,-,-,2021-06-22
802,t**5,颜色分类: 5叶黑色-遥控款,好评,宝贝收到，和描述一样，质量好材质也好，值得推荐购买，用了几天才来评价的,-,-,2021-06-15
803,登**发,颜色分类: 5叶黑色-遥控款,好评,物流很快，安装也很简单，不用工具，比我之前买的风扇好太多了，值得推荐,-,-,2021-06-25
804,蒋**0,颜色分类: 5叶黑色-遥控款,好评,外观材质：材质很好，外光很好看 耗电量：耗电量底，很节省电 运转声音：安静音 档位调节：档位调节方便简单 ,-,-,2021-06-16
805,1**c,颜色分类: 5叶黑色-遥控款,好评,试用了还不错  比之前美的三扇的风力更大  最喜欢就是遥控控制，看中才选择的  希望耐用！客服也很耐心处理问题  这次购物还满意🤗 ,-,-,2021-06-23
806,t**5,颜色分类: 七叶白色-【机械款】,好评,小巧玲珑，美观秀气，二档风力就大的。选号时没有注意摇控和机械，随意选了机械的，总之满意。 运转声音：细小。 档位调节：手动按扭。 吹风感受：二档就够大的。 ,-,-,2021-06-15
807,y**1,颜色分类: 5叶黑色-遥控款,好评,外观材质：很好 耗电量：小 运转声音：小 档位调节：好 吹风感受：好  ,-,-,2021-06-21
808,l**7,颜色分类: 5叶黑色-遥控款,好评,用了几天是正品，风速分好几个档，好用,-,-,2021-06-22
809,t**3,颜色分类: 5叶黑色-遥控款,好评,外观材质：好 耗电量：低 运转声音：很小 档位调节：灵敏 吹风感受：自然风，很舒服。 ,-,-,2021-06-14
810,y**6,颜色分类: 5叶黑色-遥控款,好评,挺不错的，买了一台用的还好又果断买了台 ,-,-,2021-06-25
811,l**3,颜色分类: 5叶黑色-遥控款,好评,风力很大，可选择模式很多。遥控很好用。满意。 ,-,-,2021-06-22
812,s**7,颜色分类: 5叶黑色-遥控款,好评,外观材质：还可以 ,-,-,2021-06-22
813,苏**婧,颜色分类: 5叶黑色-遥控款,好评,很凉爽，静音。风大，666，推荐入手 ,-,-,2021-06-20
814,t**4,颜色分类: 5叶黑色-遥控款,好评,今天收到宝呗啦，非常满意，需要的话还会回购,-,-,2021-06-21
815,t**2,颜色分类: 5叶黑色-遥控款,好评,电扇收到了，质量很好，声音小,-,-,2021-06-23
816,李**x,颜色分类: 5叶黑色-遥控款,好评,电扇收到了，给爸妈买的，本来以为很不好安装，结果老爸很快就组装好了，并且非常满意，没有很大噪声，特别好，推荐,-,-,2021-06-22
817,t**2,颜色分类: 七叶白色-【机械款】,好评,声音小 风力大 用着舒适 推荐 ,-,-,2021-06-20
818,1**君,颜色分类: 5叶黑色-遥控款,好评,风扇很好。大家值得购买,-,-,2021-06-22
819,w**1,颜色分类: 5叶黑色-遥控款,好评,外观材质：看起来很结实 运转声音：开静音模式一点也不吵 吹风感受：风挺大的 ,-,-,2021-06-21
820,田**昌,颜色分类: 5叶黑色-遥控款,好评,外观材质：外观很结实 耗电量：目前还不清楚 运转声音：有静音模式很好，晚上睡觉用太好了 档位调节：好几个档位，风很大 吹风感受：风好大，很温和的风，用了好几天才来评价，质量没得说，首选美的，物流速度快 ,-,-,2021-06-19
821,z**8,颜色分类: 5叶黑色-遥控款,好评,美的风扇，高品质，高颜值，我一次买了2⃣️把，性价比蛮高，需要的朋友可以放心购买。,-,-,2021-06-16
822,马**漫,颜色分类: 5叶黑色-遥控款,好评,风扇风可以调大调小，非常好用，有了它夏天再也不热了,-,-,2021-06-21
823,t**1,颜色分类: 5叶黑色-遥控款,好评,电风扇非常棒风大静音非常不错 ,-,-,2021-06-23
824,c**5,颜色分类: 5叶黑色-遥控款,好评,外观材质：漂亮 耗电量：很少 运转声音：很小  档位调节：很灵 吹风感受：舒服 ,-,-,2021-06-21
825,方**雪,颜色分类: 5叶黑色-遥控款,好评,这款美的电风扇外型高端大气，风力很大，遥控器的用起来很方便，而且声音很小，值得大家信赖！ ,-,-,2021-06-18
826,赵**9,颜色分类: 5叶黑色-遥控款,好评,运转声音：随和 外观材质：光滑细腻 ,-,-,2021-06-23
827,披**狼,颜色分类: 5叶黑色-遥控款,好评,比想象中要高端大气上档次！,-,-,2021-06-22
828,t**4,颜色分类: 5叶黑色-遥控款,好评,收到！名牌就是好，超级静音，外观超酷，有多种模式，自然风，睡眠风，包装好丶，无破损五星好评。 ,-,-,2021-06-15
829,向**兵,颜色分类: 5叶黑色-遥控款,好评,外观好看，声音小，风速也是我想要的，可以合理调节，回家安装也方便，好看又实用，是真心地好，喜欢的需要的赶紧吧😃,-,-,2021-06-17
830,寒**冬,颜色分类: 5叶黑色-遥控款,好评,非常不错的一次购物，商品与卖家描述的一致！物流也不错！,-,-,2021-06-19
831,添**6,颜色分类: 5叶黑色-遥控款,好评,外观材质：外观大气上档次 耗电量：节能省电非常好 运转声音：静音效果还不错 档位调节：好几个档位满足不同需求 吹风感受：凉爽舒服 ,-,-,2021-06-22
832,观**学,颜色分类: 5叶黑色-遥控款,好评,宝贝很喜欢,用了段时间，真的不错,-,2021-06-22
833,笨**3,颜色分类: 5叶黑色-遥控款,好评,嫂子推荐的，说她姐姐买了一台觉得挺好，然后她又买了两台，正好我缺一个风扇就一起种**，大爱，安装很简单，吹出来的风也很凉，推荐大家入手,-,-,2021-06-16
834,t**1,颜色分类: 5叶黑色-遥控款,好评,外观材质：非常好 运转声音：有静音模式，声音很小 档位调节：很方便，各档位风速很合适 吹风感受：很好，很凉快 ,-,-,2021-06-23
835,r**5,颜色分类: 5叶黑色-遥控款,好评,很漂亮，功能简单易操作，关键是高度可以，适合大房子厅里使用。,-,-,2021-06-19
836,b**u,颜色分类: 5叶黑色-遥控款,好评,挺好用的，客服服务态度也很好  安装很方便，风速风量也很大 ,-,-,2021-06-23
837,我**人,颜色分类: 5叶黑色-遥控款,好评,第三次购买 风扇还不错， ,-,-,2021-06-22
838,风**呢,颜色分类: 5叶黑色-遥控款,好评,相信品牌的力量，货真价实，匠心制造，中国造 ,-,-,2021-06-22
839,m**6,颜色分类: 5叶黑色-遥控款,好评,很满意。美的的质量不错。风很大 ,-,-,2021-06-23
840,z**6,颜色分类: 5叶黑色-遥控款,好评,用过后再来评价的，有9种风速适合大人小孩吹外观好看，经济适用实惠,-,-,2021-06-19
841,t**9,颜色分类: 5叶黑色-遥控款,好评,外观漂亮大气上档次，质量很好。声音小，如果需要下次再来。,-,-,2021-06-17
842,j**2,颜色分类: 5叶黑色-遥控款,好评,这款美的电风扇是我在这家店买的第4台风扇了，质量好，风力又大，真的好用 ,-,-,2021-06-23
843,木**4,颜色分类: 5叶黑色-遥控款,好评,纠结了好久买哪个电风扇，无意中同事推荐了这款，还不错可以遥控，性价比高。 ,-,-,2021-06-17
844,徐**灵,颜色分类: 5叶黑色-遥控款,好评,性价比超级高质量也很好  跟实体店一样  但是可比实体店便宜很多,-,-,2021-06-15
845,小**4,颜色分类: 5叶黑色-遥控款,好评,货收到了，质量很好，而且风很大，静音,-,-,2021-06-22
846,k**2,颜色分类: 5叶黑色-遥控款,好评,外观精致，风吹着很舒服，变档多，很适合日常生活使用，很满意！！！ ,-,-,2021-06-14
847,y**4,颜色分类: 5叶黑色-遥控款,好评,宝贝很不错，已经买了三台了，颜值高性能好，特别值得推荐，遥控器也特别好看而且用起来很方便。 ,-,-,2021-06-18
848,l**4,颜色分类: 5叶黑色-遥控款,好评,外观材质：特别好，有质感 耗电量：一级能效   吹风感受：舒服 运转声音：静音 档位调节：得劲 ,-,-,2021-06-15
849,胡**8,颜色分类: 5叶黑色-遥控款,好评,第二次购买，风大，静音挺好。,-,-,2021-06-23
850,翩**羽,颜色分类: 5叶黑色-遥控款,好评,和描述一致，性价比高，推荐大家入手 ,-,-,2021-06-22
851,为**斯,颜色分类: 5叶黑色-遥控款,好评,电风扇很好，外观好，声音小，一看就是正品，风扇很多功能，多功能风力，遥控实用，定时能达到七个半小时，真是厉害啊，高端品牌产品，看到的人都说好，确是正品完美产品，客服也很好。 ,-,-,2021-06-21
852,t**0,颜色分类: 5叶黑色-遥控款,好评,货真价实，安装简易，风力可以，有静音功能，总得来说是一次不错的购物,-,-,2021-06-14
853,张**燃,颜色分类: 5叶黑色-遥控款,好评,外观材质：好 耗电量：低 运转声音：小 档位调节：顺滑 ,-,-,2021-06-24
854,z**e,颜色分类: 七叶白色-【机械款】,好评,颜值不错，有遥控就更完美！,-,-,2021-06-25
855,z**9,颜色分类: 5叶黑色-遥控款,好评,美的风扇不错，风量很大，最高档有点噪音，正常可以接受，一键静音还可以，总体满意 ,-,-,2021-06-18
856,u**g,颜色分类: 七叶白色-【机械款】,好评,没什么噪音，整体较轻，风力够，造型简洁，安装方便，需要手动控制,-,-,2021-06-20
857,秋**悠,颜色分类: 5叶黑色-遥控款,好评,第二次买了，电扇很好风大声音也轻，这次是给父母的，值得拥有 ,-,-,2021-06-18
858,波**吉,颜色分类: 5叶黑色-遥控款,好评,风扇收到了，不错，黑色的挺高大尚的，遥控款方便多了。,-,-,2021-06-19
859,t**2,颜色分类: 5叶黑色-遥控款,好评,风扇外观挺漂亮的，有多种风速模式，遥控款的，使用起来也很方便，喜欢静音模式，夜里也不会吵，美的产品，大品牌值得信赖。,-,-,2021-06-19
860,h**8,颜色分类: 5叶黑色-遥控款,好评,不错值得购买非常好用,-,-,2021-06-23
861,t**2,颜色分类: 5叶黑色-遥控款,好评,外观很好，质量不错，黑色大气，有静音模式，选美的大品牌没错，很满意一次网购！,-,-,2021-06-18
862,q**2,颜色分类: 5叶黑色-遥控款,好评,质量很好，第二次购买了，,-,-,2021-06-24
863,t**4,颜色分类: 5叶黑色-遥控款,好评,风扇收到了非常满意好用 ,-,-,2021-06-22
864,山**皮,颜色分类: 5叶黑色-遥控款,好评,很好！比想象中更好！下次还会首选考虑,-,-,2021-06-23
865,爱**1,颜色分类: 5叶黑色-遥控款,好评,风扇收到了，质量不错，底盘稳重，外观好看，风力也很大，快递也很好，有需要的朋友可以下手了 ,-,-,2021-06-18
866,t**8,颜色分类: 5叶黑色-遥控款,好评,风扇收到了，跟商家描述一致，很好。下次还会购买。,-,-,2021-06-10
867,温**天,颜色分类: 5叶黑色-遥控款,好评,放在爸**房间，不占地方，方便实用，满分💯,-,-,2021-06-19
868,腋**哒,颜色分类: 七叶白色-【机械款】,好评,质感很好，噪音小，风力大，值得推荐,-,-,2021-06-20
869,微**矿,颜色分类: 5叶黑色-遥控款,好评,给家里人拍的，操作简单，风力也挺大的，正常的风声，不错喜欢，整个夏天都凉爽了。,-,-,2021-06-20
870,t**5,颜色分类: 5叶黑色-遥控款,好评,简直太完美了，大家放心购买！ ,-,-,2021-06-15
871,王**t,颜色分类: 5叶黑色-遥控款,好评,非常好，声音小 ，风力强劲,-,-,2021-06-22
872,彭**钦,颜色分类: 5叶黑色-遥控款,好评,第二次购买，非常不错！,-,-,2021-06-21
873,l**2,颜色分类: 5叶黑色-遥控款,好评,吹风感受：风量可以。强劲 ,-,-,2021-06-20
874,梅**3,颜色分类: 5叶黑色-遥控款,好评,美的老牌子可以的，外观材质都很好，档位也多不用担心睡着被吵和着凉，有遥控很方便再不用爬起来了 ,-,-,2021-06-14
875,杨**8,颜色分类: 5叶黑色-遥控款,好评,用了三天才来评价的，和描述的一样，非常好，物流也很快 ,-,-,2021-06-22
876,t**8,颜色分类: 5叶黑色-遥控款,好评,外观材质：大气上档次，质量杠杠的 运转声音：安静悠悠，静静的夜，舒舒服服睡一觉酸爽。 吹风感受：透心凉心飞扬巴适的很 ,-,-,2021-06-21
877,5**物,颜色分类: 5叶黑色-遥控款,好评,质量好，高端大气上档次，准备还买一台 ,-,-,2021-06-22
878,t**5,颜色分类: 七叶白色-【机械款】,好评,非常不错的风扇，发货很快，静音功能也很好，满意满意 ,-,-,2021-06-15
879,l**n,颜色分类: 5叶黑色-遥控款,好评,电风扇不错，大气上档次，风力大，特别是静音对于睡觉来说基本上没有声音，推荐遥控款的，夜里调节方便。,-,-,2021-06-18
880,杨**3,颜色分类: 5叶黑色-遥控款,好评,质量和性价比超高，夏天值得拥有,-,-,2021-06-19
881,s**下,颜色分类: 5叶黑色-遥控款,好评,美的小家电产品质量保证。,-,-,2021-06-21
882,吴**0,颜色分类: 5叶黑色-遥控款,好评,非常好用，声音小！美的就是好用！ ,-,-,2021-06-21
883,帘**居,颜色分类: 5叶黑色-遥控款,好评,还不错哈，安装十分简便，买给儿子房间用的，他也很喜欢，美的大品牌用着放心点！ ,-,-,2021-06-17
884,t**0,颜色分类: 5叶黑色-遥控款,好评,静音风很大挺不错,-,-,2021-06-12
885,t**4,颜色分类: 5叶黑色-遥控款,好评,大品牌值得信赖，真心不错，可以静音，风速也很润和外很是喜欢，还带遥控的，自己调节，观也很 大气，,-,-,2021-06-15
886,t**4,颜色分类: 5叶黑色-遥控款,好评,好，喜欢的亲可以下单,-,-,2021-06-23
887,p**n,颜色分类: 5叶黑色-遥控款,好评,安装简单，功能多，很实用。,-,-,2021-06-25
888,怡**上,颜色分类: 5叶黑色-遥控款,好评,质量挺好的，是金属网罩，底盘也挺重的，不愧是美的，有需要会回购。风力也很多选择，最大的风很凉快,-,-,2021-06-18
889,f**3,颜色分类: 5叶黑色-遥控款,好评,美的风扇风速大没有什么噪音，又回购买了一个 ,-,-,2021-06-22
890,t**4,颜色分类: 七叶白色-【机械款】,好评,风扇已经收到了，美观大方，燥音小，还是比较划算,-,-,2021-06-23
891,理**旗,颜色分类: 5叶黑色-遥控款,好评,此用户没有填写评价。,美的值得购买风力十足,-,2021-06-21
892,g**晶,颜色分类: 5叶黑色-遥控款,好评,不错很喜欢遥控很方便 ,-,-,2021-06-24
893,莉**l,颜色分类: 5叶黑色-遥控款,好评,安装还算简单 哈哈，不错,-,-,2021-06-23
894,忆**缘,颜色分类: 5叶黑色-遥控款,好评,外观大气 ,-,-,2021-06-24
895,顺**8,颜色分类: 5叶黑色-遥控款,好评,质量很好，风大声音小，值得购买,-,-,2021-06-11
896,倪**2,颜色分类: 5叶黑色-遥控款,好评,电风扇质量很好(✪▽✪)，去年买了两台，今天帮同事又买了一台！大牌子值得信赖！,-,-,2021-06-19
897,小**p,颜色分类: 5叶黑色-遥控款,好评,用了一段时间了，风很大，价格实惠好用。遥控很方便。,-,-,2021-06-19
898,t**0,颜色分类: 5叶黑色-遥控款,好评,电风扇已收到，和面述的一样，躁音很小，挺喜欢的，打算过一段时间在买一台。 ,-,-,2021-06-21
899,牛**吃,颜色分类: 5叶黑色-遥控款,好评,风扇质量很好，风速也很大，安装比较简单，按着视频安装步骤来的，价格也比较划算，赞👍 ,-,-,2021-06-14
900,日**9,颜色分类: 5叶黑色-遥控款,好评,风扇收到了安装方便，用了几天感觉还不错风量足档位多睡眠风跟轻柔没有什么声音。赶上搞活动比实体店便宜，挺不错的呢。 ,-,-,2021-06-24
901,绮**8,颜色分类: 5叶黑色-遥控款,好评,美的风扇质量好，用的放心，客服蟹子很贴心 ,-,-,2021-06-20
902,钱**伟,颜色分类: 5叶黑色-遥控款,好评,美的大品牌值得信赖，外观设计感觉好看，八小时定时很好用，还带睡眠模式，风够大,-,-,2021-06-15
903,w**7,颜色分类: 5叶黑色-遥控款,好评,风力很大哦 噪音小不错,-,-,2021-06-20
904,下**0,颜色分类: 5叶黑色-遥控款,好评,非常满意，买给老家的爸爸用的，对他老人家来说遥控的比较方便，趁618活动买的很划算，外观好看，声音不大，几个档位可调很方便，赞,-,-,2021-06-20
905,心**9,颜色分类: 5叶黑色-遥控款,好评,电扇非常好，安装简单，静音，非常满意 ,-,-,2021-06-25
906,t**0,颜色分类: 5叶黑色-遥控款,好评,收到货了，和客服介绍的一样，新样式挺美观，风扇运行平稳，风力足，遥控设计很方便，安装简单，不错的产品，商家讲信用。,-,-,2021-06-25
907,y**9,颜色分类: 5叶黑色-遥控款,好评,货收到了，质量挺好好的，值得购买！ ,-,-,2021-06-22
908,向**羽,颜色分类: 5叶黑色-遥控款,好评,姐姐推荐的，我也买了，款式高大上，无噪音，最满意的是可以遥控。,-,-,2021-06-21
909,y**y,颜色分类: 5叶黑色-遥控款,好评,之前家里购买过同型号的，使用很好，风力不错，遥控也很方便 比实体店优惠许多，试机正常，好评 ,-,-,2021-06-21
910,t**9,颜色分类: 5叶黑色-遥控款,好评,"宝贝外观时尚，风大静音，性价比高，商家服务热情, 售后服务周到，物流给力。 ",-,-,2021-06-10
911,惠**宝,颜色分类: 5叶黑色-遥控款,好评,包裹已收到，安装方便，美的品牌我很满意，给五星好评！,-,-,2021-06-16
912,于**姗,颜色分类: 5叶黑色-遥控款,好评,宝贝不错，组装狠简单带遥控很方便，风有好几个档呢！狠满意的一次网购，一如既往的👌 ,-,-,2021-06-16
913,西**号,颜色分类: 5叶黑色-遥控款,好评,真心不错 大品牌,-,-,2021-06-25
914,s**林,颜色分类: 5叶黑色-遥控款,好评,静音、方便！非常好👍 ,-,-,2021-06-21
