1378,陈**8,颜色分类: 5叶黑色-遥控款,好评,去年买了一台很好用，今年再来买了同款，一如既往地喜欢！感谢店家！ ,-,-,2021-06-17
1379,天**荣,颜色分类: 5叶黑色-遥控款,好评,第三次购买了 ，噪音小 风力很大，有需要的可以考虑这家哦！,-,-,2021-06-21
1380,郑**6,颜色分类: 七叶白色-【机械款】,好评,外观清洁，简单实用，暂未发现什么质量问题,-,-,2021-06-20
1381,棁**1,颜色分类: 5叶黑色-遥控款,好评,总体还说很不错，静音风大，颜值很高，值得推荐购买 ,-,-,2021-06-21
1382,亡**安,颜色分类: 5叶黑色-遥控款,好评,非常不错，风力大，晚上吹还有静音功能， ,-,-,2021-06-18
1383,t**2,颜色分类: 5叶黑色-遥控款,好评,选了好久最后选了这款，现在看来比较喜欢，希望好用。 ,-,-,2021-06-23
1384,y**n,颜色分类: 5叶黑色-遥控款,好评,老婆挺喜欢的，好评一个！,-,-,2021-06-19
1385,小**潴,颜色分类: 5叶黑色-遥控款,好评,东西很好 有朋友要买会推荐,-,-,2021-06-21
1386,w**7,颜色分类: 5叶黑色-遥控款,好评,包装特别好，每个零件都有袋子装着，收到没有任何损坏，客服特别非常好，一步一步教怎么安装，也很简单，618买的价位很值，这款风扇商场都卖两三百，不错,-,-,2021-06-19
1387,车**平,颜色分类: 5叶黑色-遥控款,好评,外观材质：外观黑色，显得大气，质量不错， 耗电量：一级节能 运转声音：声音很小，可选择静音模式 档位调节：3个档位好调节 吹风感受：风很大，美的的牌子真的很好 ,-,-,2021-06-01
1388,昭**n,颜色分类: 5叶黑色-遥控款,好评,静音模式声音没有很大，而且底盘比较稳，风力很大，很满意 ,-,-,2021-06-14
1389,t**8,颜色分类: 5叶黑色-遥控款,好评,美的品牌值得信赖，外观大气上档次，风速可以任意调节，静音效果也很好，需要的亲们可以放心购买,-,-,2021-06-16
1390,z**菲,颜色分类: 5叶黑色-遥控款,好评,多次回购，美的风扇质量杠杠的，吹的非常舒适,-,-,2021-06-24
1391,鱼**f,颜色分类: 5叶黑色-遥控款,好评,静音效果很好，外观也不错。 ,-,-,2021-06-24
1392,辉**明,颜色分类: 5叶黑色-遥控款,好评,质量很好，噪音小风力大，功能齐全,-,-,2021-06-18
1393,程**4,颜色分类: 5叶黑色-遥控款,好评,吹风感受：非常给力！用起来也很方便 ,-,-,2021-06-19
1394,王**4,颜色分类: 5叶黑色-遥控款,好评,618活动买的电风扇，物廉价美，用着很不错,-,-,2021-06-17
1395,l**9,颜色分类: 5叶黑色-遥控款,好评,很好用，价格也实惠。 外观材质：好看 耗电量：省电 运转声音：静音 ,-,-,2021-06-24
1396,t**1,颜色分类: 5叶黑色-遥控款,好评,宝贝收到了，很喜欢，安装后打开静音模式，这样不打扰孩子睡觉💤,-,-,2021-06-23
1397,温**恺,颜色分类: 5叶黑色-遥控款,好评,风扇收到了迫不及待的装好，很好，质量看着也很好耐不耐用就不知道了，反正目前为止很满意，网罩圈要是黑色就完美了,-,-,2021-06-14
1398,鹦**8,颜色分类: 5叶黑色-遥控款,好评,颜色漂亮，很时尚，安装方便，喜欢!,-,-,2021-06-23
1399,t**9,颜色分类: 5叶黑色-遥控款,好评,风扇质量很好，这已经是第二次购买了,-,-,2021-06-24
1400,t**4,颜色分类: 5叶黑色-遥控款,好评,电扇质量很好，之前买过一台，这是第二次买，只是型号不一样，质量都是很好的 ,-,-,2021-06-15
1401,1**w,颜色分类: 5叶黑色-遥控款,好评,风量挺大，遥控也很好用，值得买一回,-,-,2021-06-15
1402,t**2,颜色分类: 5叶黑色-遥控款,好评,去年买了两台，今年又下手一台，摇控款的方便，美的的小家电还是很不错的。,-,-,2021-06-24
1403,y**e,颜色分类: 5叶黑色-遥控款,好评,风扇很好，静音没有一点声音，吹着很舒服，非常满意！,-,-,2021-06-18
1404,握**0,颜色分类: 七叶白色-【机械款】,好评,很漂亮，声音很小，已经回购第四个了 ,-,-,2021-06-17
1405,红**3,颜色分类: 七叶白色-【机械款】,好评,白色很耐看！声音也很轻！,-,-,2021-06-22
1406,疯**0,颜色分类: 5叶黑色-遥控款,好评,此用户没有填写评价。,风扇质量没得说，家里已经买了两台美的风扇了,-,2021-06-25
1407,淼**0,颜色分类: 5叶黑色-遥控款,好评,这款风扇很不错，样子漂亮，价格实惠，性价比很高！棒棒哒！好东西值得分享！ ,-,-,2021-06-18
1408,l**5,颜色分类: 5叶黑色-遥控款,好评,风量大  声小  非常满意 ,-,-,2021-06-17
1409,m**8,颜色分类: 5叶黑色-遥控款,好评,电风扇很不错，去年买了2个，今年趁着618又买了1个,-,-,2021-06-17
1410,王**n,颜色分类: 5叶黑色-遥控款,好评,快递很快，都用了好几天了，有个睡眠模式晚上真的没啥噪音，很舒服，风也很大。挺便宜的,-,-,2021-06-10
1411,快**糖,颜色分类: 5叶黑色-遥控款,好评,非常不错的宝贝！方便实用！ ,-,-,2021-06-18
1412,t**8,颜色分类: 5叶黑色-遥控款,好评,物流速度很快，美的的大品牌值得信赖，风扇颜色很喜欢，黑色加香槟金的 ,-,-,2021-06-05
1413,小**8,颜色分类: 5叶黑色-遥控款,好评,质量不错，高度可以调节，声音也不大，很满意 ,-,-,2021-06-23
1414,g**5,颜色分类: 5叶黑色-遥控款,好评,风扇非常的好用，比我想象中的要好，客服小姐姐也很有耐心。,-,-,2021-06-16
1415,t**9,颜色分类: 5叶黑色-遥控款,好评,去年买了一台不错，今天又回购一台，风大又静音，用遥控器很方便,-,-,2021-06-25
1416,t**3,颜色分类: 5叶黑色-遥控款,好评,风力不错，性价比也还高，一直用的这个品牌的。,-,-,2021-06-14
1417,s**9,颜色分类: 5叶黑色-遥控款,好评,这款电风扇买了好几 台，风力不错，夏天每个房间备一台 ,-,-,2021-06-22
1418,t**6,颜色分类: 5叶黑色-遥控款,好评,风好大，声音好，第二次购买了，太喜欢了,-,-,2021-06-23
1419,昊**友,颜色分类: 5叶黑色-遥控款,好评,外观材质：外观好看，声音小，档位调节方便，棒棒哒！ ,-,-,2021-06-21
1420,y**2,颜色分类: 5叶黑色-遥控款,好评,非常不错，已经是购买的第三个了，非常好用，风速也挺大，声音也小，很奈斯,-,-,2021-06-23
1421,t**8,颜色分类: 5叶黑色-遥控款,好评,美的风扇一直在回购，很静音，有很多个档位，有专门的静音档,-,-,2021-06-15
1422,张**3,颜色分类: 5叶黑色-遥控款,好评,一直用美的风扇，这一款169的我非常满意，外观大气，黑油发亮，摇控还有静音，现正用很舒服。,-,-,2021-06-14
1423,l**9,颜色分类: 5叶黑色-遥控款,好评,风扇刚收到不错，比想象中的好多了，风力很大直的购买，,-,-,2021-06-24
1424,永**8,颜色分类: 5叶黑色-遥控款,好评,外观材质：美观精致 耗电量：低 运转声音：不大 档位调节：方便 吹风感受：9种风感体验舒适 ,-,-,2021-06-21
1425,w**j,颜色分类: 5叶黑色-遥控款,好评,宝贝很漂亮，风吹着很凉快,-,-,2021-06-19
1426,t**4,颜色分类: 5叶黑色-遥控款,好评,宝贝收到了，满意,-,-,2021-06-23
1427,我**小,颜色分类: 5叶黑色-遥控款,好评,带遥控的很方便，静音模式适合夜间 ,-,-,2021-06-14
1428,t**1,颜色分类: 5叶黑色-遥控款,好评,大品牌就不一样，静音，风速都是杠杠的，值得购买，,-,-,2021-06-23
1429,蓝**7,颜色分类: 5叶黑色-遥控款,好评,宝贝还挺不错呦，推荐亲们购买呦,-,-,2021-06-10
1430,秋**8,颜色分类: 5叶黑色-遥控款,好评,质量非常好，价格也便宜，静音挡很舒服！ ,-,-,2021-06-20
1431,金**0,颜色分类: 5叶黑色-遥控款,好评,风力清爽，遥控开关，静音模式大爱！大爱！,-,-,2021-06-19
1432,小**活,颜色分类: 5叶黑色-遥控款,好评,客服态度很好，风扇也很好用，易安装！,-,-,2021-06-18
1433,每**1,颜色分类: 5叶黑色-遥控款,好评,电扇用了几天，风力还可以，比较省电，价格也公道，值得购买 ,-,-,2021-06-23
1434,r**n,颜色分类: 七叶白色-【机械款】,好评,给老人买的，老人喜欢，说很实用,-,-,2021-06-14
1435,k**4,颜色分类: 5叶黑色-遥控款,好评,风力很大，也没什么声音，这个夏天不会热了，关键是有遥控器还很方便，买电器还得是牌子的。 ,-,-,2021-06-22
1436,吴**杰,颜色分类: 5叶黑色-遥控款,好评,风扇收到了，材质看到不错，而且没杂音，一次愉快的购物。。。值得推荐 ,-,-,2021-06-21
1437,h**4,颜色分类: 5叶黑色-遥控款,好评,挺不错的，高大上的感觉。家电品牌还是认美的。家里小孩每天都在客厅玩，这款的静音模式非常好，契合我使用。总体使用起来很好。 ,-,-,2021-06-09
1438,t**6,颜色分类: 5叶黑色-遥控款,好评,物美价廉质量很好给个五星好评,用了几天质量很好很好用,-,2021-06-23
1439,花**琴,颜色分类: 5叶黑色-遥控款,好评,风扇回购了好几部了，买回来好用邻居看到又想要，也叫我帮忙买， ,-,-,2021-06-25
1440,杨**鹏,颜色分类: 5叶黑色-遥控款,好评,跟大电扇放一起，丝毫不逊色，很棒,-,-,2021-06-15
1441,秦**娟,颜色分类: 5叶黑色-遥控款,好评,外观材质：可以 耗电量：看起来很低哦！ 运转声音：比较静音。关键一键静音很实用 档位调节：很多了，三种风类三个档位够了 吹风感受：还可以 ,-,-,2021-06-08
1442,王**8,颜色分类: 5叶黑色-遥控款,好评,外观材质：好 耗电量：好 运转声音：好 档位调节：好 吹风感受：好 ,-,-,2021-06-18
1443,g**5,颜色分类: 5叶黑色-遥控款,好评,很好用，外观大气，风很大。,-,-,2021-06-19
1444,z**7,颜色分类: 5叶黑色-遥控款,好评,好用，没有噪音很安静！风力大，晚上睡觉需要开静音的风，推荐！！,-,-,2021-06-23
1445,s**0,颜色分类: 5叶黑色-遥控款,好评,电风扇很好，声音小，大品牌就是好，值得购买 ,-,-,2021-06-14
1446,我**3,颜色分类: 5叶黑色-遥控款,好评,此用户没有填写评价。,风扇很好，遥控很方便，静音模式几乎听不到声音。,-,2021-06-03
1447,t**8,颜色分类: 5叶黑色-遥控款,好评,外观时尚大气 运转声音小 真心不错👍 ,-,-,2021-06-23
1448,l**o,颜色分类: 5叶黑色-遥控款,好评,质量非常的好，而且没有声音，这是我在网上买的最满意的一款风扇，下次打算再入手一个 ,-,-,2021-06-15
1449,会**锅,颜色分类: 七叶白色-【机械款】,好评,看起来很高级，风也还可以，好评,-,-,2021-06-17
1450,a**1,颜色分类: 5叶黑色-遥控款,好评,很不错，很喜欢，很快就装好了，风速也很好，自由切换,-,-,2021-06-18
1451,t**2,颜色分类: 5叶黑色-遥控款,好评,电风扇到家很快自己安装好了，质量不错，颜值好，风扇的风力很大，放在客厅用很好，想睡觉也可以调成静音模式。 ,-,-,2021-06-16
1452,t**0,颜色分类: 5叶黑色-遥控款,好评,货已收到   外观漂亮  风力大,-,-,2021-06-23
1453,t**3,颜色分类: 5叶黑色-遥控款,好评,外观漂亮，座位稳，声音小风力大，挺凉快的。美的大品牌值得购买。前段时间买了一台，这次又果断回购一台。,底座稳，呵呵。购买了两台，客厅一台卧室一台，挺好的。值得购买。,您简短的肯定已经胜过无数赞美，我们也会努力做到更好，做您的知心朋友。让您在购物的同时，感受到不一样的关心服务。我们店铺产品不断上架更新中，收藏和关注店铺获取更多店铺动态和资讯哦~期待您的再次光临~【您可以在手机淘宝里收藏我们店铺哦，多多关注我们店铺，会不定期上新款产品~】,2021-06-14
1454,c**k,颜色分类: 5叶黑色-遥控款,好评,买的第五台美的风扇了，价格便宜，摇控功能太方便了，摇控器也比之前的设计感更好，质量扛扛滴，,-,-,2021-06-23
1455,上**2,颜色分类: 5叶黑色-遥控款,好评,风大，不错，值得购买。。安装也方便，我一个人就装好了。,-,-,2021-06-20
1456,t**5,颜色分类: 5叶黑色-遥控款,好评,电扇收到了，个头发，身高长，和以前的老电扇差不多，风力也大，确认好评。喜欢大电扇的，可以买这款。,-,-,2021-06-15
1457,叶**间,颜色分类: 5叶黑色-遥控款,好评,用着感觉挺好的，已经用了一段时间，声音也正常。遥控挺方便的。,-,-,2021-06-20
1458,t**3,颜色分类: 5叶黑色-遥控款,好评,风力很大，吹出来的风也很舒服，外观材质：挺漂亮，挺高档的。 耗电量：不耗电 运转声音：声音挺小的。很漂亮 有档次 很喜欢易安装风也比较柔和。安装很简单，几分钟就搞定了。颜值很高！一直以来都是用美的的电风扇，因为它吹出来的风特别柔，特别舒服。美的节能遥控电风扇，非常好风大 ,-,-,2021-06-14
1459,t**1,颜色分类: 5叶黑色-遥控款,好评,电扇吹的风好大，值得表扬一下哈哈,-,-,2021-06-23
1460,w**1,颜色分类: 5叶黑色-遥控款,好评,家里的电器都是美的，质量杆杆的 ,-,-,2021-06-11
1461,y**8,颜色分类: 5叶黑色-遥控款,好评,妥妥的静音，好用 没买错，安装五分钟搞定，好评！,-,-,2021-06-22
1462,z**1,颜色分类: 5叶黑色-遥控款,好评,收到了，很凉快，有遥控很方便，声音大小能接受,-,-,2021-06-20
1463,宝**n,颜色分类: 5叶黑色-遥控款,好评,一直用的这个牌子的电风扇，果断复购 ,-,-,2021-06-14
1464,t**1,颜色分类: 5叶黑色-遥控款,好评,智能静音，风大功能多，很好，一次愉快的网购,-,-,2021-06-23
1465,s**7,颜色分类: 5叶黑色-遥控款,好评,选了好久选的这家，比较厚实，一次买了两台。发货也挺快，赞一个。,-,-,2021-06-18
1466,薇**薇,颜色分类: 5叶黑色-遥控款,好评,美的正品！质量保证！不错不错👍风力大 满意满意啦 ,-,-,2021-06-12
1467,j**4,颜色分类: 5叶黑色-遥控款,好评,风扇收到，质量不错，好看，风速多档，满意！ ,-,-,2021-06-24
1468,马**滨,颜色分类: 5叶黑色-遥控款,好评,风扇质量很好，物有所值，不愧是大品牌，值得信赖 ,-,-,2021-06-10
1469,土**觉,颜色分类: 5叶黑色-遥控款,好评,用了几天才来评价的，质量一如既往的好 ,-,-,2021-06-21
1470,8**8,颜色分类: 5叶黑色-遥控款,好评,特意用了几天才评价的，美的一如既往的的好，这个比 ,-,-,2021-06-12
1471,t**8,颜色分类: 5叶黑色-遥控款,好评,无噪音，高大上，好用,高大上，非常喜欢，,-,2021-06-16
1472,t**9,颜色分类: 5叶黑色-遥控款,好评,外观材质：质量很好，风扇各个细节做的到位，没有异味，表面处理的很光滑，触感很好  耗电量：耗电量低，而且长时间运行不发热 运转声音：运转声音较小  吹风感受：远程风量也很给力  ,-,-,2021-06-19
1473,飞**6,颜色分类: 5叶黑色-遥控款,好评,非常棒，风力够，静音好，非常适合家用。,-,-,2021-06-18
1474,c**2,颜色分类: 5叶黑色-遥控款,好评,外观材质：真的很不错！ 耗电量：满意 运转声音：和之前买的那台一样 档位调节：和之前买的那台一样 吹风感受：和之前买的那台一样 ,-,-,2021-06-17
1475,a**儿,颜色分类: 5叶黑色-遥控款,好评,已经第两次买了，好看,-,-,2021-06-09
1476,小**包,颜色分类: 5叶黑色-遥控款,好评,使用一段时间了，质量很好，造型也好看。,-,-,2021-06-21
1477,协**1,颜色分类: 5叶黑色-遥控款,好评,美的值得信赖，电风扇安装简单，功能实用，遥控很方便，很满意。,-,-,2021-06-21
1478,h**6,颜色分类: 5叶黑色-遥控款,好评,很好用，在店里买都要两百多！！聚划算，静音很好，遥控的好用 ,-,-,2021-06-20
1479,t**2,颜色分类: 5叶黑色-遥控款,好评,美的电风扇收到质量和描述一样，这次网购很满意建议放心购买 ,-,-,2021-05-29
1480,尉**艳,颜色分类: 5叶黑色-遥控款,好评,挺好不错！这两天又降温了、等用了追评 ,-,-,2021-06-19
1481,t**9,颜色分类: 5叶黑色-遥控款,好评,宝贝收到了，很喜欢，声音很小风力挺大，不错哦😄,-,-,2021-06-16
1482,武**7,颜色分类: 5叶黑色-遥控款,好评,两年前就买的这款电扇，因为使用了两年感觉质量很好，操作很简单，夜里噪音很小。所以这是第二次购买，非常值得推荐一下。 ,-,-,2021-06-01
1483,t**3,颜色分类: 5叶黑色-遥控款,好评,电风扇跟图片描述的一样，物流也很快，卖家服务态度好，电风扇拿回来两天了，今天才装好，我太喜欢这款电风扇了，风速好，又静音宝宝睡觉也不怕帮吵醒，非常满意,-,-,2021-06-14
1484,彭**2,颜色分类: 5叶黑色-遥控款,好评,声音较小，风力舒适，遥控方便。安装也简单。,-,-,2021-06-11
1485,t**4,颜色分类: 5叶黑色-遥控款,好评,宝贝己收到非常好,-,-,2021-06-18
1486,t**6,颜色分类: 5叶黑色-遥控款,好评,买给我爸的，他老人家说风力很大，超喜欢。,-,-,2021-06-23
1487,面**z,颜色分类: 5叶黑色-遥控款,好评,首先包装很结实，材质没异味，安装起来很便捷，收到就接着用上了，连续用了很久，功能很不错，物有所值，准备再买一件！ ,-,-,2021-06-14
1488,y**3,颜色分类: 5叶黑色-遥控款,好评,去年有买过一台一样的，好用，再购买了一台 ,-,-,2021-06-22
1489,s**1,颜色分类: 5叶黑色-遥控款,好评,凤力很大，外观也不错，值得购买 ,-,-,2021-06-19
1490,t**1,颜色分类: 5叶黑色-遥控款,好评,风扇质量非常好，而且声音很轻,-,-,2021-06-23
1491,明**4,颜色分类: 5叶黑色-遥控款,好评,符合预期，特别好看，风力强劲,-,-,2021-06-19
1492,陈**i,颜色分类: 5叶黑色-遥控款,好评,一如既往的好用，回购的。推荐给朋友了。,-,-,2021-06-24
1493,t**8,颜色分类: 5叶黑色-遥控款,好评,很满意的一次购物，喜欢的可以不单,真的很值得的一次购物，风也很大，喜欢的你可以放心下单吧,-,2021-06-21
1494,希**希,颜色分类: 七叶白色-【机械款】,好评,还算静音的，风力也大，性价比不错 ,-,-,2021-06-21
1495,t**8,颜色分类: 5叶黑色-遥控款,好评,外观材质：高端大气上档次 ,-,-,2021-06-11
1496,番**哩,颜色分类: 5叶黑色-遥控款,好评,质量很好 性价比高 感觉能用好久 黑色的很耐看 还有遥控器 很满意 ,-,-,2021-06-06
1497,每**6,颜色分类: 5叶黑色-遥控款,好评,商品完好无损，已装好了，运行正常，遥控方便，满意。 ,-,-,2021-06-20
1498,欢**去,颜色分类: 5叶黑色-遥控款,好评,比实体店便宜一半 家里电器几乎都是美的的 好用 ,-,-,2021-06-20
1499,m**h,颜色分类: 5叶黑色-遥控款,好评,用了几天才来评价，买的带遥控的，功能挺齐全，和之前在商场买的一样，质量挺好，价格便宜了一半，推荐购买👍 ,-,-,2021-06-06
1500,雪**好,颜色分类: 5叶黑色-遥控款,好评,总体来说不错的，耐用就更好，需要的是不错的选择！ ,-,-,2021-06-14
1501,一**菇,颜色分类: 5叶黑色-遥控款,好评,不错，声音不大，外观美丽，今天刚到，就用上，满意 吹风感受：了 ,-,-,2021-06-22
1502,c**2,颜色分类: 5叶黑色-遥控款,好评,外观材质：外观高档漂亮，又好看 运转声音：基本没有声音，风感大人小孩都非常适合 吹风感受：吹起来很舒服，就是忘记拍图片了 ,-,-,2021-06-15
1503,t**7,颜色分类: 5叶黑色-遥控款,好评,美的电风扇美观 好用 可信赖的品牌 ，,-,-,2021-06-20
1504,生**朱,颜色分类: 5叶黑色-遥控款,好评,风扇质量不错，下次还会购买,-,-,2021-06-21
1505,楠**森,颜色分类: 5叶黑色-遥控款,好评,回头客了，去年也买了一把这个… 主要是有一个遥控器可以调档位和开关，感觉很方便🤣🤣 ,-,-,2021-06-21
1506,小**0,颜色分类: 5叶黑色-遥控款,好评,宝贝是正品，风速也很大，非常满意,-,-,2021-06-18
1507,q**g,颜色分类: 七叶白色-【机械款】,好评,非常静音，几乎听不到声音，风量也不错。好评！ ,-,-,2021-06-19
1508,健**2,颜色分类: 5叶黑色-遥控款,好评,本来还担心杆子不稳，安装好后很稳当，不愧是大品牌。一档的风很柔和，声音正常。小孩子睡觉不会吵。遥控器也可以不用。就是按键的时候会有声音,-,-,2021-06-19
1509,t**2,颜色分类: 5叶黑色-遥控款,好评,使用风速大小可以，舒服,-,-,2021-06-25
1510,1**n,颜色分类: 5叶黑色-遥控款,好评,非常不错的风扇，第二台购买，两年前买那台现在还好好的👍,-,-,2021-06-25
1511,t**8,颜色分类: 七叶白色-【机械款】,好评,风扇，小巧，好用，静音，五分好评！,-,-,2021-06-19
1512,t**1,颜色分类: 5叶黑色-遥控款,好评,家里面收到了、东西很满意、快递哥服务也好,-,-,2021-06-23
1513,t**9,颜色分类: 5叶黑色-遥控款,好评,非常好，大品牌值得信赖哦,-,-,2021-06-14
1514,阳**行,颜色分类: 5叶黑色-遥控款,好评,带遥控器的美的电扇，一级能耗，有静音睡眠档，总的来说感觉不错，很满意 ,-,-,2021-06-24
1515,t**6,颜色分类: 5叶黑色-遥控款,好评,感觉实物比图片更好看，价格和质量成正比，这次购物非常满意，喜欢的宝宝赶紧下手,-,-,2021-06-23
1516,李**7,颜色分类: 5叶黑色-遥控款,好评,外观材质：看着大方 耗电量：一级能耗 运转声音：运行平稳，声音很小 档位调节：四档调节 吹风感受：舒适 ,-,-,2021-06-15
1517,t**6,颜色分类: 5叶黑色-遥控款,好评,物流还是可以的，两天到家，晚上到家就装起来试试，暂时还行，准备再买一台，以后再评 ,-,-,2021-06-23
1518,徐**8,颜色分类: 5叶黑色-遥控款,好评,好用，买给老妈老爸用的，操作很方便。,-,-,2021-06-21
1519,h**8,颜色分类: 5叶黑色-遥控款,好评,美的电扇质量棒棒的，一直买的美的电扇。,-,-,2021-06-12
1520,t**9,颜色分类: 5叶黑色-遥控款,好评,风扇配的遥控器很方便，风很柔和，最大档位风也很大，性价比还不错，可以考虑,-,-,2021-06-10
1521,黄**1,颜色分类: 5叶黑色-遥控款,好评,美的电扇品质好，风力大，声音小。下次还来买他们家的电商。,-,-,2021-06-23
1522,9**芳,颜色分类: 5叶黑色-遥控款,好评,电风扇质量很好，罩子都是不锈钢的，风力有大有小，也适用小孩和老人，颜值不错，推荐,-,-,2021-06-17
1523,d**0,颜色分类: 5叶黑色-遥控款,好评,非常满意，第二次购买了，大品牌靠得住！,-,-,2021-06-18
1524,心**心,颜色分类: 5叶黑色-遥控款,好评,不错用一段时间再说  ,-,-,2021-06-20
1525,l**d,颜色分类: 5叶黑色-遥控款,好评,挺好，安装简单，遥控方便。本想买新款7页的，但看评价说底座不稳，于是放弃了。这款底座很稳，外观大气，风量也不错，我一般只用最低档就可以了。运转声音也还好，档位高声音会大一点，低档位还好。整体不错 ,-,-,2021-06-24
1526,t**4,颜色分类: 5叶黑色-遥控款,好评,又是满意的一次购物，回购N次了，家里的风扇都是美的，支持国货没毛病！,-,-,2021-06-17
1527,t**4,颜色分类: 5叶黑色-遥控款,好评,宝贝收到了质量非常好,-,-,2021-06-21
1528,w**g,颜色分类: 5叶黑色-遥控款,好评,风扇收到就迫不及待的打开试着安装好了，真的挺不错的，风力大，噪音小，非常值得购买！ ,-,-,2021-06-04
1529,张**活,颜色分类: 5叶黑色-遥控款,好评,风扇收到了，安装很简单，打开后风速根据自己的需要也可以调节，静音模式声音很小，总之用着很满意，毕竟大牌子比较放心，满意！ ,-,-,2021-06-01
1530,l**4,颜色分类: 5叶黑色-遥控款,好评,宝贝收到了，物流也很快，比想象中要好很多，物超所值！准备复购！ ,-,-,2021-06-22
1531,牧**雨,颜色分类: 5叶黑色-遥控款,好评,风扇很好，声音很轻，遥控方便 ,-,-,2021-06-14
1532,t**3,颜色分类: 5叶黑色-遥控款,好评,还不错啊，功能齐全大品牌！,-,-,2021-06-14
1533,c**5,颜色分类: 5叶黑色-遥控款,好评,棒棒哒 声音也不大 不影响睡眠 大品牌 物流速度真的超给力👍🏻👍🏻👍🏻,-,-,2021-06-20
1534,开**7,颜色分类: 5叶黑色-遥控款,好评,质量好，又美观，噪音小,-,-,2021-06-14
1535,唐**g,颜色分类: 5叶黑色-遥控款,好评,外观材质：电风扇已经收到好几天了，一直忙着没有来评价，电风扇的质量很好，已经用了好几天了感觉不错，以后有需要了还会去你们家买电风扇了，五星好评！ ,-,-,2021-06-14
1536,快**活,颜色分类: 5叶黑色-遥控款,好评,风扇的功能超级多，可以按键又可以5米遥控，超级方便，黑色机身加黄色边框是今年的主打流行色,-,-,2021-06-06
1537,t**3,颜色分类: 5叶黑色-遥控款,好评,买了几天才来，很好用值得购买，,-,-,2021-06-14
1538,c**念,颜色分类: 5叶黑色-遥控款,好评,风扇质量很好，非常满意。,-,-,2021-06-14
1539,y**5,颜色分类: 5叶黑色-遥控款,好评,老客户了，质量蛮好，风力很大 ,-,-,2021-06-22
